{"title":"ARAÚJO, Paulo Bruno Brito de","cargoss":["Deputado Estadual"],"cargos_esp":[0],"datas_ini":[1924],"datas_fim":[1930],"estados":["RJ"],"autor":["Raimundo Helio Lopes"],"content":"**ARAÚJO, Paulo Bruno Brito de**\n\n\\* dep. est. RJ 1924-1930.\n\n*Paulo Bruno Brito de Araújo* ingressou na Assembleia Legislativa do\nEstado do Rio de Janeiro (ALERJ) em agosto de 1924 depois de novas\neleições legislativas para preencher as vagas deixadas pelas renúncias\nde alguns deputados. Foi eleito deputado estadual pelo terceiro distrito\neleitoral, com sede em Cantagalo (RJ). Entre 1925 e 1926 integrou a\nComissão de Redação de Leis.\n\nEm 1927 foi reeleito deputado estadual, agora pelo primeiro distrito\neleitoral, com sede em Niterói, na legenda do Partido Republicano\nFluminense (PRF). Durante a legislatura foi suplente de secretário da\nAssembleia Legislativa e membro da Comissão de Petições, Representações\ne Poderes.\n\nFoi reeleito deputado estadual em agosto de 1930. Nas eleições\nrealizadas para a formação das comissões parlamentares, mais uma vez foi\nescolhido secretário da Assembleia Legislativa e membro da Comissão de\nPetições, Representações e Poderes. Em novembro desse ano teve seu\nmandato interrompido com a vitória da Revolução de 1930 que levou\nGetúlio Vargas ao poder e fechou todos os órgãos legislativos do país.\n\n*Raimundo Helio Lopes*\n\nFONTES: ASSEMB. LEGISL. RJ. *Anais* (1924-1930); *Estado* (19/8 e\n2/10/1930); FERREIRA, M. *República*.\n","ref":"FONTES: ASSEMB. LEGISL. RJ. *Anais* (1924-1930); *Estado* (19/8 e\n2/10/1930); FERREIRA, M. *República*.\n","dic":"DPRRJ"}
