{"title":"MAIA, Carneiro","cargoss":["Constituinte","Deputado Estadual"],"cargos_esp":["est",0],"datas_ini":[1892,1892],"datas_fim":[1892,1893],"estados":["RJ","RJ"],"autor":[0],"content":"**MAIA, Carneiro**\n\n\\* const. est. RJ 1892; dep. est. RJ 1892-1893.\n\n*Joaquim Azevedo Carneiro Maia* foi eleito deputado estadual no estado\ndo Rio de Janeiro em 31 de janeiro de 1892, para compor a nova\nAssembleia Estadual Constituinte formada após a renúncia do então\npresidente do estado do Rio de Janeiro Francisco Portela (1889-1891).\nCom a saída do então chefe do poder estadual, a Assembleia Legislativa\ndo Estado do Rio de Janeiro (ALERJ) foi dissolvida, assim como foi\nanulada a primeira Constituição republicana fluminense que havia sido\npromulgada por Portela e seus partidários quando foi formada a primeira\nConstituinte estadual em 1891.\n\nA nova Assembleia, composta por partidários do Partido Republicano\nFluminense (PRF) liderados por José Tomás da Porciúncula, procurou\nreorganizar os estatutos jurídicos do estado que tinham sido\nconstituídos para favorecer Francisco Portela e representou o início do\ndomínio do PRF na política estadual.\n\nApós a promulgação da nova Constituição, em 9 de abril de 1892, foram\nrealizadas novas eleições para o Legislativo estadual no dia 24 do mesmo\nmês. Nesse pleito Joaquim Azevedo Carneiro Maia foi eleito deputado\nestadual na legenda do PRF e, na ALERJ, logo ingressou na Comissão de\nFazenda e Orçamento do Estado.\n\nFaleceu em 1893, em pleno exercício do mandato.\n\n*Samuel Silva Rodrigues de Oliveira*\n\nFONTES: ASSEMB. LEGISL. RJ. *Anais*(14/11/1892-12/1/1893, 1/3-9/4/1892,\n8/1892, 13-26/1, 1/8/1893); FERREIRA, M. *República*.\n","ref":"FONTES: ASSEMB. LEGISL. RJ. *Anais*(14/11/1892-12/1/1893, 1/3-9/4/1892,\n8/1892, 13-26/1, 1/8/1893); FERREIRA, M. *República*.\n","dic":"DPRRJ"}
