{"title":"MAIA, Telêmaco Gonçalves","cargoss":["Deputado Estadual"],"cargos_esp":["GB"],"datas_ini":[1963],"datas_fim":[1975],"estados":[0],"autor":[0],"content":"**MAIA, Telêmaco Gonçalves**\n\n\\* dep. est. GB 1963-1975.\n\n*Telêmaco Gonçalves Maia* nasceu no Rio de Janeiro, então Distrito\nFederal, no dia 5 de janeiro de 1899, filho de João Maia e de Maria\nGonçalves Maia.\n\nFez o curso primário num colégio público e o secundário no Colégio Pedro\nII. A seguir, ingressou na Faculdade de Medicina, onde se formou em\n1923; após a graduação, fez também o curso de homeopatia. Em 1927 foi\nconvocado pelo Exército, onde serviu como segundo-tenente médico.\n\nEm 1932 lutou contra o governo provisório de Getúlio Vargas na Revolução\nConstitucionalista, razão pela qual foi preso e exilou-se em Portugal.\nRetornou ao Brasil após os revolucionários de 1932 terem sido\nanistiados, em maio de 1933. Em 1935, já capitão, transferiu-se para a\nAviação Militar do Exército, e em 1941, quando a Aeronáutica passou a\nser uma força militar distinta do Exército e da Marinha, dotada de um\nministério próprio, transferiu-se para a nova força. Foi promovido a\nmajor e nomeado diretor do Departamento de Seleção e Controle da\nAeronáutica. Fez parte da Força Expedicionária Brasileira (FEB) enviada\nà Itália em 1944, durante a Segunda Guerra Mundial (1939-1945), e em\nseguida trabalhou no Correio Aéreo Nacional. Ao longo da carreira\nmilitar, fez os cursos de medicina aeronáutica, Estado-Maior da\nAeronáutica e aperfeiçoamento de medicina de guerra. Passou para a\nreserva como major-brigadeiro médico.\n\nAlém de médico e militar, também se dedicou ao espiritismo, religião da\nqual se tornou adepto ainda em 1925. Na década de 1940, foi diretor do\nDepartamento Médico da Liga Espírita do Brasil. Estudioso e difusor do\nkardecismo, participou da criação de várias instituições espíritas, como\na União dos Discípulos de Jesus, o Hospital Allan Kardec e o Hospital\nPsiquiátrico Pedro de Alcântara, além de obras assistenciais como a Casa\nde Lázaro, a Casa da Mãe Pobre e o Albergue Teresa Cristina. Dirigiu\nvárias frentes de trabalho na Liga Espírita do Brasil e foi membro\nefetivo do Conselho Superior da Federação Espírita Brasileira.\n\nTambém prestava atendimento médico gratuito pelo menos duas vezes por\nsemana, o que o tornou conhecido entre as regiões mais pobres do Rio de\nJaneiro, especialmente em Bangu, onde possuía uma clínica, e nos demais\nbairros da chamada “zona rural”. Começou a militar politicamente nesses\nbairros por volta de 1947, e em outubro de 1950 foi eleito vereador no\nDistrito Federal na legenda do Partido Social Progressista (PSP), com\n4.833 votos. No mesmo pleito, concorreu como suplente de Mozart Pereira\nLago, candidato eleito ao Senado na chapa formada pelo PSP e o Partido\nTrabalhista Brasileiro (PTB). Empossado na Câmara dos Vereadores em\nfevereiro de 1951, foi escolhido membro da Comissão de Fiscalização do\nServiço Público e líder do PSP. Reelegeu-se vereador em outubro de 1954,\nmais uma vez na legenda do PSP, com 3.279 votos, mas em março de 1957\ndesligou-se do PSP e filiou-se ao Partido Republicano (PR). Em 1958\nocupou a segunda vice-presidência da mesa diretora da Câmara Municipal\nmais uma vez se reelegeu vereador em outubro, com 4.238 votos. Em 1959,\nfoi vice-presidente da Comissão de Economia e Finanças. Desde o início\nde sua atuação parlamentar, procurou obter verbas destinadas à\nrealização de melhorias em ruas e ao cumprimento de necessidades básicas\nem Bangu e outros bairros do subúrbio, como transportes e serviço de\nágua e esgoto. Além disso, também favorecia obras assistenciais e\ncentros espíritas. Em diversas ocasiões foi ao plenário para falar sobre\ntemas referentes ao espiritismo e à defesa da liberdade religiosa.\n\nEm outubro de 1960, candidatou-se na legenda do PR a deputado\nconstituinte na Guanabara, estado criado quando Brasília passou a\ncapital federal, mas não conseguiu se eleger. Voltou a candidatar-se a\ndeputado estadual na legenda do PR no pleito de outubro de 1962, e dessa\nvez foi eleito Na sessão legislativa de 1963, foi escolhido quarto\nsecretário da mesa diretora da Assembleia Legislativa do Estado da\nGuanabara (ALEG). Entre 1964 e 1966, ocupou a primeira suplência da mesa\ndiretora e foi indicado membro da Comissão de Administração e Redação.\n\nDiante do movimento político-militar de 31 de março de 1964, que\nderrubou o presidente da República João Goulart (1961-1964) e instaurou\nno país um regime militar, declarou não ser um dos “revolucionários”,\nembora se considerasse um anticomunista intransigente e elogiasse a\n“revolução” pela paz e calma que, em sua opinião, esta trouxera ao país;\ndisse também que não era do tipo que “não teve a honra de conspirar e\ntomou parte da vitória”, numa provocação endereçada ao governador Carlos\nLacerda (1960-1965), que começava a se opor à prorrogação do mandato do\nentão presidente marechal Castelo Branco (1964-1967). Ainda sobre Carlos\nLacerda, dizia que “tem feito a desgraça de muito homem público”, que\n“não é amigo de ninguém” e que não votaria nele ou em candidato seu nem\nse sua própria mãe “viesse do céu” para pedir-lhe. Para as eleições de\ngovernador a serem realizadas em 1965, declarou seu apoio à candidatura\nde Negrão de Lima, do Partido Social Democrático (PSD), a quem dizia\nconhecer desde os tempos em que viajava para o Paraguai pelo Correio\nAéreo Nacional e se hospedava na embaixada então chefiada pelo agora\ncandidato pessedista.\n\nEm abril de 1965, anunciou sua saída do PR e ingresso no PTB. No\nentanto, em outubro daquele ano o Ato Institucional n^o^ 2 extinguiu o\nsistema partidário existente. Com a posterior instauração do\nbipartidarismo, ingressou no Movimento Democrático Brasileiro (MDB),\npartido de oposição, e nessa legenda foi reeleito deputado estadual nas\neleições de novembro de 1966. Em 1967 foi escolhido para ocupar a\nsegunda suplência da mesa diretora da ALEG e integrou a comissão\nparlamentar de inquérito (CPI) formada para apurar denúncias de\nirregularidades na Secretaria de Obras Públicas. Na sessão legislativa\nde 1970, participou da Comissão de Constituição e Justiça e presidiu a\nComissão de Administração e Trabalho. Nas eleições estaduais de novembro\nfoi novamente eleito na legenda do MDB. A partir daí, seria um dos\nprincipais aliados do governador eleito (por via indireta) Chagas\nFreitas, do MDB, de quem era próximo desde quando os dois pertenciam ao\nPSP, na década de 1950. Na sessão legislativa de 1971, foi escolhido\nterceiro vice-presidente da mesa-diretora. No entanto, a partir desse\nano, uma série de infartos prejudicaria sua saúde e sua presença na\nALEG.\n\nFaleceu no Rio de Janeiro no dia 4 de julho de 1974.\n\nCasado com Maria de Lourdes Gonçalves Maia, teve três filhos.\n\n*Paulo Celso Corrêa*\n\nFONTES: ASSEMB. LEGISL. GB. *Anais*; Anuário Espírita (1999). Disponível\nem: \\<www.scribd.com/doc/29000587/Anuario-Espirita1999\\>. Acesso em:\n7/1/2011; *Jornal do Brasil* (5/7/1974).\n","ref":"FONTES: ASSEMB. LEGISL. GB. *Anais*; Anuário Espírita (1999). Disponível\nem: \\<www.scribd.com/doc/29000587/Anuario-Espirita1999\\>. Acesso em:\n7/1/2011; *Jornal do Brasil* (5/7/1974).\n","dic":"DPRRJ"}
