{"title":"MANHÃES, Eduardo José","cargoss":["Constituinte","Deputado Estadual"],"cargos_esp":["est",0],"datas_ini":[1892,1898],"datas_fim":[1892,1900],"estados":["RJ","RJ"],"autor":[0],"content":"**MANHÃES, Eduardo José**\n\n\\* const. est. RJ 1892; dep. est. RJ 1898-1900.\n\n*Eduardo José Manhães* nasceu em São João da Barra (RJ) em 21 de abril\nde 1865. Formou-se em direito em 1890, sendo importante chefe político\nde São João da Barra.\n\nApós a proclamação da República (15/11/1889), em São João da Barra, o\npresidente do estado do Rio de Janeiro, Francisco Portela (1889-1891),\nnomeado pelo presidente da República, marechal Deodoro da Fonseca\n(1889-1891), tentou fundar um diretório do Partido Republicano para\nformar uma aliança entre monarquistas e republicanos visando fortalecer\na governabilidade. Eduardo José Manhães, como republicano, participou da\nfundação do diretório. Em 1890, foi nomeado por Portela como membro do\nConselho de Intendência de São João da Barra, órgão responsável pelo\ngoverno municipal. Apesar dessas aproximações, depois veio a romper com\no então presidente estadual.\n\nConcorreu nas primeiras eleições realizadas para a formação da\nAssembleia Constituinte fluminense, mas não foi eleito. Esse pleito,\nrealizado em 20 de março de 1891, foi vencido pelos partidários de\nFrancisco Portela.\n\nA primeira Constituição fluminense havia sido elaborada em 1891 pelos\npartidários de Francisco Portela, e anulada após a renúncia deste, em\ndezembro do mesmo ano. No dia 31 de janeiro de 1892 uma nova eleição foi\nrealizada para compor a nova Assembleia Constituinte, que foi formada\npor membros do Partido Republicano Fluminense (PRF), presidida por José\nTomás da Porciúncula e que promulgaria, no dia 9 de abril do mesmo ano,\na segunda Constituição fluminense. Nessa ocasião Eduardo José Manhães se\nelegeu. A nova Assembleia, composta por partidários do Partido\nRepublicano Fluminense (PRF), procurou reorganizar os estatutos\njurídicos do estado que tinham sido constituídos para favorecer\nFrancisco Portela e representou o início do domínio do PRF na política\nestadual.\n\nNo dia 24 de abril de 1892 foram realizadas eleições para a composição\nda Assembleia Legislativa do Estado do Rio de Janeiro (ALERJ) e nesse\npleito Eduardo José Manhães não foi eleito.\n\nEm 26 de dezembro de 1897 foi eleito deputado estadual na legenda do\nPRF, pelo segundo distrito eleitoral, com sede em Campos (RJ). Com o\ninício dos trabalhos legislativos em 1898 foi eleito para a Comissão de\nGuarda da Constituição e das Leis e Poderes, sendo reeleito em 1899.\nNesse ano foi também eleito para a Comissão do Comércio, Agricultura,\nIndústria e Colonização. Foi reeleito para as duas comissões em 1900.\nDurante seu mandato passou a fazer oposição ao então presidente do\nestado Alberto Torres (1897-1900). Durante a legislatura, o PRF sofreu\numa cisão devido às divergências envolvendo Alberto Torres e José Tomás\nda Porciúncula, ex-presidente estadual (1892-1894) e agora senador\n(1897-1901). O novo presidente estadual rebelou-se contra a liderança\npartidária de Porciúncula, que exigia que o Executivo estadual\nfortalecesse seu partido. Diante dessa situação, em maio de 1899, quatro\nmembros da comissão executiva do PRF renunciaram aos seus cargos dentro\nda agremiação e em 23 de julho fundaram o Partido Republicano do Rio de\nJaneiro (PRRJ), liderados por Alberto Torres. Nesse contexto, Eduardo\nJosé Manhães permaneceu fiel ao seu partido e não ingressou no PRRJ.\n\nFoi membro e presidente da Câmara Municipal de São João da Barra.\n\nFaleceu em Campos no dia 9 de junho de 1917.\n\n*Samuel Silva Rodrigues de Oliveira*\n\nFONTES: ASSEMB. LEGISL. RJ. *Anais*(1/3-9/4/1892); *Diário Oficial da\nUnião* (7/1/1890); FERREIRA, M. *República*; PORTO, M. *Apontamentos*.\n","ref":"FONTES: ASSEMB. LEGISL. RJ. *Anais*(1/3-9/4/1892); *Diário Oficial da\nUnião* (7/1/1890); FERREIRA, M. *República*; PORTO, M. *Apontamentos*.\n","dic":"DPRRJ"}
