{"title":"MANHÃES, José","cargoss":["Constituinte","Deputado Estadual"],"cargos_esp":["est",0],"datas_ini":[1947,1947],"datas_fim":[1947,1955],"estados":["RJ","RJ"],"autor":[0],"content":"**MANHÃES, José**\n\n\\* const. est. RJ 1947; dep. est. RJ 1947-1955.\n\n*José dos Campos Manhães* construiu suas bases políticas em Nova Iguaçu\ne em Duque de Caxias, no estado do Rio de Janeiro.\n\nNa década de 1930 foi filiado a União Progressista.\n\nCom o fim do Estado Novo e a reorganização partidária em 1945 foram\nconvocadas eleições para o Congresso Nacional, que preparou a\nConstituição Republicana Federal de 18 de setembro de 1946. Em janeiro\nde 1947 foram realizadas eleições para o Legislativo e o Executivo\nestadual e municipal. José Manhães foi eleito deputado estadual\nconstituinte no estado do Rio de Janeiro, na legenda do Partido Social\nProgressista (PSP).\n\nNo dia 24 de fevereiro seguinte foi instalada a Assembleia Estadual\nConstituinte e José Manhães foi quarto secretário da Mesa que promulgou\nno dia 20 de junho a nova Constituição do Estado do Rio de Janeiro.\nPromulgada a Carta, assumiu o mandato ordinário de deputado estadual na\nAssembleia Legislativa do Estado do Rio de Janeiro (ALERJ). Além de\nquarto secretário, foi terceiro vice-presidente da Mesa Diretora.\n\nReelegeu-se deputado estadual no pleito de 3 de outubro de 1950 e\nassumiu o mandato no ano seguinte. Foi líder de seu partido na\nAssembleia. Deixou a ALERJ no início de 1955, no fim da legislatura.\n\nDurante sua atividade parlamentar discutiu na plenária questões sobre\nsegurança pública, saúde, saneamento e sobre os debates envolvendo a\nBaixada Fluminense.\n\nFoi, ainda, prefeito de São João do Meriti.\n\n*Vicente Saul Moreira dos Santos*\n\nFONTES: ASSEM. CONST. RJ. *Anais* (1947); ASSEMB. LEGISL. RJ.\n*Anais*(1947, 1948, 1951); Balaio Meriti. Disponível em:\n\\<balaiomeriti1.sites.uol.com.br\\>.\n","ref":"FONTES: ASSEM. CONST. RJ. *Anais* (1947); ASSEMB. LEGISL. RJ.\n*Anais*(1947, 1948, 1951); Balaio Meriti. Disponível em:\n\\<balaiomeriti1.sites.uol.com.br\\>.\n","dic":"DPRRJ"}
