{"title":"ARCÊNIO, Adilmar","cargoss":["Deputado Estadual"],"cargos_esp":[0],"datas_ini":[1991],"datas_fim":[1992],"estados":["RJ"],"autor":["Sabrina Guerghe"],"content":"**ARCÊNIO, Adilmar**\n\n\\* dep. est. RJ 1991-1992.\n\n*Adilmar Arcênio dos Santos*, também conhecido como *Mica*, nasceu na\ncidade do Rio de Janeiro, então Distrito Federal, no dia 22 de novembro\nde 1955.\n\nGraduado em direito, elegeu-se vereador em São João de Meriti (RJ) e\ncumpriu o mandato entre 1989 e 1990. Deixou a Câmara Municipal para se\ncandidatar a deputado estadual nas eleições de outubro de 1990. Eleito\nna legenda do Partido Trabalhista Renovador (PTR), foi terceiro suplente\nda Mesa Diretora da Assembleia Legislativa do Estado do Rio de Janeiro\n(ALERJ). Renunciou ao mandato de deputado estadual no dia 28 de dezembro\nde 1992, para assumir o mandato de prefeito de São João de Meriti, para\no qual fora eleito em outubro anterior, dessa vez na legenda do Partido\ndo Movimento Democrático Brasileiro (PMDB). Esteve à frente da\nprefeitura entre 1993 e 1996.\n\nEm 4 de agosto de 1997 foi nomeado pelo então governador Marcelo Alencar\n(1995-1998) secretário de Desenvolvimento da Baixada Fluminense e\nMunicípios Adjacentes. Permaneceu no cargo até fevereiro do ano\nseguinte. Em 1998 candidatou-se mais uma vez a deputado estadual no Rio\nde Janeiro pelo Partido da Social Democracia Brasileira (PSDB), e obteve\numa suplência. Nas eleições municipais realizadas em outubro de 2000,\nreelegeu-se vereador em São João de Meriti, ainda na legenda do PSDB. No\nmesmo ano foi alvo de um processo julgado pelo Tribunal de Contas da\nUnião (TCU) em que suas contas em seu mandato como prefeito de São João\nde Meriti foram consideradas irregulares. Nas eleições de 2002\ncandidatou-se a deputado federal novamente na legenda tucana. Os 15.975\nvotos que recebeu lhe garantiram uma suplência.\n\nReeleito pela terceira vez vereador em São João de Meriti em outubro de\n2004 – pela coligação “Muda Meriti”, composta pelo PSDB, pelo Partido\nTrabalhista Brasileiro (PTB) e pelo Partido da Frente Liberal (PFL) –,\nvoltou a buscar a reeleição em 2008. No entanto, teve sua candidatura\nindeferida, tornando-se inelegível por decisão do Tribunal Regional\nEleitoral do Rio de Janeiro (TRE-RJ) que rejeitou suas contas, julgadas\nirregulares.\n\nNo dia 7 de junho de 2010, foi sancionada a Lei Complementar 135, a\nchamada “ficha limpa”, que estabeleceu que pessoas condenadas por\ncorrupção eleitoral, por compra de votos ou por gastos ilícitos de\nrecursos de campanha se tornariam inelegíveis por oito anos. Ainda em\njunho, o Tribunal Superior Eleitoral (TSE) divulgou a lista de 4.922\ngestores públicos considerados inelegíveis por terem suas contas\njulgadas irregulares pelo TCU. O nome de Adilmar Arcênio constou da\nrelação de políticos fluminenses considerados inelegíveis.\n\n*Sabrina Guerghe*\n\nFONTES: Às Claras – Portal da Transparência. (Eleições 2004); Disponível\nem: \\<www.asclaras.org.br/\\>; *Dia* (1/8/2006); *Diário Oficial RJ*\n(4/2/19911); *Extra* (21/6/2010); *Folha* (12/8/2006); *Globo*\n(3/10/2008, 5/10/2008); SUPR. TRIB. FED. (24/6/2008); TRIB. SUP. ELEIT.\nDisponível em:\n\\<http://tse.jus.br/internet/contas\\_publicas/arquivo/tcu/contasJulgadasIrregulares.html\\>.\nAcesso em: 11/5/2011. TRIB. SUP. ELEIT. (Eleições 1998, 2000, 2002, 2004\ne 2008).\n","ref":"FONTES: Às Claras – Portal da Transparência. (Eleições 2004); Disponível\nem: \\<www.asclaras.org.br/\\>; *Dia* (1/8/2006); *Diário Oficial RJ*\n(4/2/19911); *Extra* (21/6/2010); *Folha* (12/8/2006); *Globo*\n(3/10/2008, 5/10/2008); SUPR. TRIB. FED. (24/6/2008); TRIB. SUP. ELEIT.\nDisponível em:\n\\<http://tse.jus.br/internet/contas\\_publicas/arquivo/tcu/contasJulgadasIrregulares.html\\>.\nAcesso em: 11/5/2011. TRIB. SUP. ELEIT. (Eleições 1998, 2000, 2002, 2004\ne 2008).\n","dic":"DPRRJ"}
