{"title":"MARANHÃO, Sérgio","cargoss":["Deputado Estadual","Constituinte","Deputado Estadual"],"cargos_esp":["GB","est",0],"datas_ini":[1971,1975,1975],"datas_fim":[1975,1975,1979],"estados":[0,"RJ","RJ"],"autor":[0],"content":"**MARANHÃO, Sérgio**\n\n**\\*** dep. est. GB 1971-1975; const. est. RJ 1975; dep. est. RJ\n1975-1979.\n\n*Sérgio de Albuquerque* *Maranhão* nasceu no dia 5 de junho de 1936.\n\nFiliado ao Movimento Democrático Brasileiro (MDB), elegeu-se deputado\nestadual no estado da Guanabara nas eleições de novembro de 1970.\nAssumiu o mandato em fevereiro do ano seguinte e foi indicado quinto\nsecretário da Mesa Diretora da Assembleia Legislativa do Estado da\nGuanabara (ALEG).\n\nNas eleições de novembro de 1974, foi reeleito deputado estadual. Tomou\nposse em fevereiro de 1975 e a partir de 15 de março participou dos\ntrabalhos da Assembleia Constituinte encarregada de elaborar a\nConstituição do novo estado do Rio de Janeiro, resultante da fusão do\nestado da Guanabara com o antigo estado do Rio. Na Constituinte, foi\nvice-líder da maioria. Com a promulgação da nova Constituição estadual\nem 23 de julho de 1975, retornou ao exercício do mandato ordinário. Um\ndos vice-líderes do MDB, voltou sua atuação para questões ligadas à\neducação, proferindo alguns discursos críticos ao governador Faria Lima\ne à Secretaria de Educação e Cultura. Deixou a ALERJ ao final da\nlegislatura, em janeiro de 1979.\n\n*Jougi Guimarães Yamashita*\n\nFONTES:ASSEMB. CONST. RJ. *Anais*; ASSEMB. LEGISL. RJ. *Fundos*. ASSEMB.\nLEGISL. RJ. Disponível em: \\<www.alerj.rj.gov.br/\\>. Acesso em:\n20/3/2011.\n","ref":"FONTES:ASSEMB. CONST. RJ. *Anais*; ASSEMB. LEGISL. RJ. *Fundos*. ASSEMB.\nLEGISL. RJ. Disponível em: \\<www.alerj.rj.gov.br/\\>. Acesso em:\n20/3/2011.\n","dic":"DPRRJ"}
