{"title":"MARQUES, Mário","cargoss":["Deputado Estadual"],"cargos_esp":[0],"datas_ini":[2007],"datas_fim":[2011],"estados":["RJ"],"autor":["Tiago Alves Jaques"],"content":"**MARQUES, Mário**\n\n\\* dep. est. RJ 2007-2011.\n\n*Mário Pereira Marques Filho* nasceu em Nova Iguaçu (RJ) no dia 10 de\nabril de 1940.\n\nAdvogado e procurador municipal de Nova Iguaçu, foi juiz de paz da\ncomarca de Nova Iguaçu entre 1967 e 1970 e presidente da Liga de\nDesportos de Nova Iguaçu entre 1971 e 1980. Foi diretor do Departamento\nJurídico da Federação de Futebol do Estado do Rio de Janeiro (FERJ) e,\nentre 1992 e 2010, foi vice-presidente de Assuntos Externos na mesma\ninstituição.\n\nFiliou-se à agremiação partidária Aliança Renovadora Nacional (Arena) em\n1965. Entre 1967 e 1968 assumiu a Secretaria de Administração da\nPrefeitura Municipal de Nova Iguaçu. Foi eleito vereador por sete vezes\nnaquele município. Em 1970, 1972 e 1976, pela legenda da Arena; em 1982\ne 1988, pela legenda do Partido Democrático Social (PDS); reeleito em\n1992 e reeleito novamente em 1996, desta vez pela legenda do Partido\nProgressista Brasileiro (PPB). Como vereador, foi líder do governo na\nCâmara Municipal entre 1972 e 1974, e entre 1997 e 1998; líder da\nbancada de vereadores da Arena entre 1975 e 1978; e eleito presidente da\ncâmara (1999-2000). Candidatou-se ao cargo de deputado estadual em 1974,\npela legenda da Arena, e em 1986, pela legenda do PDS, mas não foi\neleito. Foi candidato a deputado federal em 1990 pela legenda do Partido\nTrabalhista Renovador (PTR), mas tampouco foi eleito. Elegeu-se\nvice-prefeito de Nova Iguaçu em 2000, na chapa de Nelson Bornier, eleito\npela legenda do Partido da Social Democracia Brasileira (PSDB). Assumiu\na prefeitura de Nova Iguaçu em 2002, quando Nelson Bornier renunciou\npara assumir o cargo de deputado federal. Candidatou-se à reeleição em\n2004, dessa vez pela legenda do Partido do Movimento Democrático\nBrasileiro (PMDB), mas não foi eleito. Elegeu-se deputado estadual em\n2006, pela legenda do PSDB.\n\nNa Assembleia Legislativa do Estado do Rio de Janeiro (ALERJ) foi\npresidente da Comissão de Assuntos da Criança, do Adolescente e do\nIdoso, e membro efetivo da Comissão de Redação, da Comissão de\nTransportes, da Comissão de Obras Públicas e da Comissão de Assuntos\nMunicipais e de Desenvolvimento Regional.\n\nEm seu mandato como deputado estadual teve 17 projetos de leis de sua\nautoria ou coautoria transformados em leis ordinárias, abrangendo\nprincipalmente as áreas de saúde, educação, meio ambiente e defesa do\nconsumidor, entre elas a Lei estadual n^o^ 5.151, de 10 de dezembro de\n2007, que obrigou os shopping centers, localizados no estado do Rio de\nJaneiro, a disponibilizar espaço para a implantação de um posto do\nPrograma Estadual de Orientação e Proteção ao Consumidor (Procon); a Lei\nestadual n^o^ 5422, de 31 de março de 2009, que obrigou as repartições\npúblicas estaduais a afixar em local visível cartazes com os números dos\ntelefones úteis de atendimento à criança, ao adolescente e ao idoso; a\nLei estadual n^o^ 5477, de 15 de junho de 2009, que instituiu o programa\nestadual de inclusão digital do jovem residente na área rural; e a Lei\nestadual n^o^ 5641, de 6 de janeiro de 2010, que instituiu a política\nestadual de educação preventiva contra a hanseníase e de combate ao\npreconceito no estado do Rio de Janeiro.\n\nEm 2010 candidatou-se à reeleição, na legenda do PSDB, mas não foi\neleito.\n\nFoi casado com Maria Luisa Guimarães Marques e pai de dois filhos, o\njornalista Mário Marques e a defensora pública Ana Beatriz Guimarães\nMarques.\n\n*Tiago Alves Jaques*\n\nFONTES: ASSEMB. LEGISL. RJ. *Legislação estadual*. Disponível em:\n\\<www.alerj.rj.gov.br/processo2.htm\\>. Acesso em: 10/4/2011; ASSEMB.\nLEGISL. RJ. *Comissões permanentes* *– composição*. Disponível em:\n\\<http://alerjln1.alerj.rj.gov.br/compcom.nsf/PageComposicao?OpenPage\\>.\nAcesso em: 10/4/2011; MARQUES, Mário. *Biografia*. Disponível em:\n\\<http://deputadoMáriomarques.com/biografia\\>. Acesso em: 10/4/2011;\nTRIB. SUP. ELEIT. *Eleições* (1996, 2000, 2002, 2004, 2006, 2010).\n","ref":"FONTES: ASSEMB. LEGISL. RJ. *Legislação estadual*. Disponível em:\n\\<www.alerj.rj.gov.br/processo2.htm\\>. Acesso em: 10/4/2011; ASSEMB.\nLEGISL. RJ. *Comissões permanentes* *– composição*. Disponível em:\n\\<http://alerjln1.alerj.rj.gov.br/compcom.nsf/PageComposicao?OpenPage\\>.\nAcesso em: 10/4/2011; MARQUES, Mário. *Biografia*. Disponível em:\n\\<http://deputadoMáriomarques.com/biografia\\>. Acesso em: 10/4/2011;\nTRIB. SUP. ELEIT. *Eleições* (1996, 2000, 2002, 2004, 2006, 2010).\n","dic":"DPRRJ"}
