{"title":"MARTINO, Humberto de","cargoss":["Constituinte","Deputado Estadual"],"cargos_esp":["est",0],"datas_ini":[1947,1947],"datas_fim":[1947,1951],"estados":["RJ","RJ"],"autor":[0],"content":"**MARTINO, Humberto de**\n\n\\* const. est. RJ 1947; dep. est. RJ 1947-1951.\n\n*Humberto Bruno de Martino* construiu sua base política na região de\nMiraflores (RJ).\n\nCom o fim do Estado Novo e a reorganização partidária em 1945, foram\nconvocadas eleições para o Congresso Nacional e para as assembleias\nlegislativas estaduais. Em janeiro de 1947 foi eleito deputado à\nAssembleia Constituinte do Estado do Rio de Janeiro pela legenda do\nPartido Social Democrático (PSD). Assumiu o cargo no mês seguinte. Em\njulho, depois de promulgada a Constituição, ocupou uma cadeira na\nAssembleia Legislativa do Estado do Rio de Janeiro (ALERJ). Durante esse\nmandato ocupou o cargo de terceiro secretário da Mesa Diretora.\n\nPosicionou-se nos debates sobre economia, abastecimento, agricultura,\nsistemas de transportes e acerca do Norte Fluminense. Destacou que a\nCompanhia Telefônica Brasileira devia expandir sua atuação no interior\ndo estado, pois estava concentrada na cidade do Rio de Janeiro, então\nDistrito Federal.\n\nParticipou das comissões de Educação e Constituição e Justiça.\n\n*Vicente Saul Moreira dos Santos*\n\nFONTES: ASSEMB. CONST. RJ. *Anais* (1947); ASSEMB. LEGISL. RJ.\n*Anais*(1947, 1948).\n","ref":"FONTES: ASSEMB. CONST. RJ. *Anais* (1947); ASSEMB. LEGISL. RJ.\n*Anais*(1947, 1948).\n","dic":"DPRRJ"}
