{"title":"MARTINS, Glênio","cargoss":["Deputado federal"],"cargos_esp":[0],"datas_ini":[1964],"datas_fim":[1969],"estados":["RJ"],"autor":[0],"content":"**MARTINS, Glênio**\n\n\\* dep. fed. RJ 1964-1969.\n\n*Glênio Martins Peçanha* nasceu no Rio de Janeiro, então Distrito\nFederal, no dia 10 de abril de 1939, filho de Almir de Almeida Peçanha e\nde Perpétua Martins Peçanha.\n\nEstudou nos colégios São José e Santo Inácio, ambos em sua cidade natal,\ne bacharelou-se pela Faculdade de Direito da Universidade do Brasil,\natual Universidade Federal do Rio de Janeiro (UFRJ).\n\nIniciou sua vida política nas eleições de outubro de 1962, obtendo a\nsegunda suplência de deputado federal pelo estado do Rio de Janeiro na\nlegenda da chapa da Renovação Federal, coligação formada pelo Movimento\nTrabalhista Renovador (MTR), o Partido Socialista Brasileiro (PSB) e o\nPartido Social Trabalhista (PST). Em decorrência do movimento\npolítico-militar de 31 de março de 1964 que depôs o presidente João\nGoulart e do processo de cassações então inaugurado, assumiu uma cadeira\nna Câmara em junho do mesmo ano. Com a extinção dos partidos políticos\npelo Ato Institucional n^o^ 2 (27/10/1965) e a posterior instauração do\nbipartidarismo, filiou-se ao Movimento Democrático Brasileiro (MDB),\npartido de oposição ao regime militar. No pleito de novembro de 1966\nelegeu-se a uma vaga na Câmara Federal pelo Rio de Janeiro na legenda do\nMDB. Tomou posse em 2 de fevereiro de 1967. Nesse ano, no Congresso\nNacional, participou como vice-presidente da Comissão Mista responsável\npor votar o veto ao Projeto de Lei n^o^ 23/1966 que regulava a liberdade\nde manifestação do pensamento e da informação. Integrou ainda comissão\nmista que reviu a Lei n^o^ 3.381 (24/4/1958), criando o fundo de Marinha\nMercante. Na Câmara dos Deputados integrou a Comissão Permanente de\nEconomia, como membro efetivo e vice-presidente.\n\nParticipou dos trabalhos parlamentares até 29 de abril de 1969, quando\nteve seu mandato cassado e os direitos políticos suspensos por dez anos\ncom base no Ato Institucional n^o^ 5 (AI-5), editado em 13 de dezembro\ndo ano anterior.\n\nFuncionário público, desempenhou ainda as funções de técnico de\nadministração do governo do estado do Rio de Janeiro.\n\nFoi casado e teve uma filha.\n\nFONTES: ARQ. DEP. PESQ. JORNAL DO BRASIL; CÂM. DEP. *Deputados*; CÂM.\nDEP. *Deputados brasileiros*. Repertório (1967-1971); TRIB. SUP. ELEIT.\n*Dados* (6 e 8).\n","ref":"FONTES: ARQ. DEP. PESQ. JORNAL DO BRASIL; CÂM. DEP. *Deputados*; CÂM.\nDEP. *Deputados brasileiros*. Repertório (1967-1971); TRIB. SUP. ELEIT.\n*Dados* (6 e 8).\n","dic":"DPRRJ"}
