{"title":"MARTINS, João de Morais","cargoss":["Deputado Estadual"],"cargos_esp":[0],"datas_ini":[1919],"datas_fim":[1921],"estados":["RJ"],"autor":[0],"content":"**MARTINS, João de Morais**\n\n\\* militar; dep. est. RJ 1919-1921.\n\n*João de Morais Martins* nasceu na fazenda Olaria, na região de\nCantagalo (RJ), filho de Francisco Lopes Martins e de Felizarda de\nMorais Martins. Seu pai pertencia a uma família de proprietários rurais,\nda mesma forma que sua mãe, filha do rico cafeicultor João Antônio de\nMorais, barão das Duas Barras.\n\nJoão de Morais Martins ingressou no Exército e alcançou a patente de\ncoronel.\n\nEm janeiro de 1919 disputou uma vaga na Assembleia Legislativa do Estado\ndo Rio de Janeiro (ALERJ). Eleito, assumiu o mandato e durante a\nlegislatura integrou a Comissão de Estatística, Divisão Civil,\nJudiciária e Câmaras Municipais. Deixou a ALERJ em 1921, ao fim do\nmandato.\n\nCasou-se com sua prima-irmã Honestalda de Morais Pereira de Melo e não\nteve filhos. O casal era padrinho do filho de uma prima-irmã, Raul de\nMorais Veiga, que foi deputado federal (1909-1917 e 1927-1930) e\npresidente do estado do Rio de Janeiro (1918-1922). José de Morais,\nfilho de outro primo-irmão, foi várias vezes deputado estadual e também\ndeputado federal (1918-1920 e 1924-1930). O sobrinho Galdino do Vale\nFilho, filho da irmã de João de Morais Martins, foi igualmente deputado\nfederal (1924-1925, 1927-1930 e 1955-1959).\n\n*Vicente Saul Moreira dos Santos*\n\nFONTES: ASSEMB. LEGISL. RJ. (1919; 1920); FERREIRA, M. *República*;\nSOARES, E. *História*.\n","ref":"FONTES: ASSEMB. LEGISL. RJ. (1919; 1920); FERREIRA, M. *República*;\nSOARES, E. *História*.\n","dic":"DPRRJ"}
