{"title":"MASSENA, João","cargoss":["Deputado Estadual"],"cargos_esp":["GB"],"datas_ini":[1963],"datas_fim":[1964],"estados":[0],"autor":[0],"content":"**MASSENA, João**\n\n\\* dep. est. GB 1963-1964.\n\n*João Massena Melo* nasceu em 18 de agosto de 1919 em Palmares (PE),\nfilho de Sebastião Massena Melo e de Olímpia Melo Maciel.\n\nMudou-se para o Rio de Janeiro, então Distrito Federal, e aí trabalhou\ncomo operário tecelão da Fábrica de Tecidos Nova América, no bairro de\nDel Castilho e posteriormente como metalúrgico. Militante do Partido\nComunista Brasileiro, então chamado Partido Comunista do Brasil (PCB),\nfoi eleito vereador no Distrito Federal por nas eleições municipais de\n1946. No entanto, seu mandato e os dos outros vereadores comunistas\nforam cassados em janeiro de 1948, em consequência do cancelamento do\nregistro do PCB pelo governo do presidente Eurico Gaspar Dutra.\n\nNas eleições estaduais de 1962, candidatou-se e foi eleito deputado\nestadual na Guanabara na legenda do Partido Social Trabalhista (PST).\nSua diplomação chegou a ser ameaçada por um processo movido no Tribunal\nSuperior Eleitoral, mas acabou por tomar posse na Assembleia\nLegislativa. Dias após a deflagração do movimento político-militar de 31\nde março de 1964, discursou na Assembleia em protesto contra a prisão do\ndeputado Hércules Correia, do Partido Trabalhista Brasileiro (PTB), e\nfez um apelo à resistência: “Nesta hora grave em que meia dúzia de\nagentes imperialistas de latifundiários quer perturbar a nossa terra,\nurge que nos levantemos com o povo contra esses assassinos. Temos que\nseguir junto com as classes operárias, com os camponeses e com todos os\npatriotas para desarmar a mão assassina de meia dúzia de privilegiados,\npois a maioria do nosso povo não concorda com essa situação. É uma\nminoria insignificante, contam com as armas, mas não contam porém com a\nmaioria das forças armadas, com os soldados, marinheiros e fuzileiros.”\nSeu mandato foi cassado em 10 de junho de 1964.\n\nEm julho de 1966, o Conselho Permanente de Justiça Militar o condenou a\n35 anos de reclusão. Foi preso em 1970 por agentes da 2^a^ Auditoria da\nMarinha e torturado na prisão da Ilha das Flores; sua família também\nchegou a ser detida. João Foi solto em fevereiro de 1973, mas seria\nnovamente preso em São Paulo no dia 3 de abril de 1974. Desde então,\nnunca mais se soube do seu paradeiro. Em 20 de setembro de 1978, foi\nabsolvido pela Auditoria da Marinha por prescrição penal.\n\nEra casado e pai de dois filhos.\n\n*Paulo Celso Corrêa*\n\nFONTES: ASSEMB. LEGISL. GB. *Anais*; Ficha pessoal. Disponível em:\n\\<www.desaparecidospoliticos.org.br/pessoa.php?id=308&m=3\\>. Acesso em:\n5/11/2010; TORTURA NUNCA MAIS.\n","ref":"FONTES: ASSEMB. LEGISL. GB. *Anais*; Ficha pessoal. Disponível em:\n\\<www.desaparecidospoliticos.org.br/pessoa.php?id=308&m=3\\>. Acesso em:\n5/11/2010; TORTURA NUNCA MAIS.\n","dic":"DPRRJ"}
