{"title":"MATOS, Arino","cargoss":["Constituinte","Deputado Estadual"],"cargos_esp":["est","RJ 1947-1951 dep fed"],"datas_ini":[1947,1955],"datas_fim":[1947,1959],"estados":["RJ","RJ"],"autor":[0],"content":"**MATOS, Arino**\n\n\\* const. est. RJ 1947; dep. est. RJ 1947-1951 dep. fed. RJ 1955-1959.\n\n*Arino de Sousa Matos* nasceu em Maricá (RJ).\n\nFez o curso preparatório no Colégio São José, bacharelando-se em\nciências jurídicas e sociais pela Faculdade de Direito do Rio de Janeiro\nem 1923.\n\nMontou escritório de advocacia em Niterói e, após conquistar prestígio\nnos meios comerciais, foi durante algum tempo presidente da Associação\nComercial do Rio de Janeiro.\n\nSeguindo a tradição política de sua família, vinculou-se à corrente de\nNilo Peçanha e, após a morte deste, acompanhou a posição de seus\ncorreligionários. No pleito de maio de 1933 elegeu-se décimo-quinto\nsuplente de deputado à Assembleia Nacional Constituinte pelo estado do\nRio de Janeiro na Legenda Constitucionalista. Com o fim do Estado Novo\nem 1945 e a redemocratização do país, concorreu no pleito de janeiro de\n1947, elegendo-se deputado à Assembleia Constituinte fluminense na\nlegenda do Partido Social Democrático (PSD). Ocupou sua cadeira em março\ndo mesmo ano e, após a promulgação da nova Carta estadual, passou a\nexercer o mandato ordinário até janeiro de 1951.\n\nNo pleito de outubro de 1954 elegeu-se deputado federal pelo Rio de\nJaneiro, sempre na legenda do PSD, assumindo o mandato em fevereiro do\nano seguinte. De 1956 a 1958 foi vice-presidente da Comissão Parlamentar\nde Inquérito sobre Energia Atômica na Câmara dos Deputados. Deixou a\ncasa ao final da legislatura, em janeiro de 1959.\n\nFaleceu em Niterói no dia 12 de fevereiro de 1983.\n\nFONTES: ASSEMB. NAC. CONST. 1934. *Anais* (14); CÂM. DEP. *Deputados*;\nCÂM. DEP. *Deputados federais*. Inventário; CÂM. DEP. *Relação dos\ndep*.; CONSULT. MAGALHÃES, B.; SALES, D. *Razões*; TRIB. SUP. ELEIT.\n*Dados* (1 e 3).\n","ref":"FONTES: ASSEMB. NAC. CONST. 1934. *Anais* (14); CÂM. DEP. *Deputados*;\nCÂM. DEP. *Deputados federais*. Inventário; CÂM. DEP. *Relação dos\ndep*.; CONSULT. MAGALHÃES, B.; SALES, D. *Razões*; TRIB. SUP. ELEIT.\n*Dados* (1 e 3).\n","dic":"DPRRJ"}
