{"title":"MELO E ALVIM, Eduardo Amaral","cargoss":["Deputado Estadual"],"cargos_esp":[0],"datas_ini":[1910],"datas_fim":[1912],"estados":["RJ"],"autor":[0],"content":"**MELO E ALVIM, Eduardo Amaral**\n\n\\* militar; dep. est. RJ 1910-1912.\n\n*Eduardo Amaral Melo e Alvim* era militar e foi nomeado, em 1902,\ncoronel comandante da 2^a^ Brigada de Cavalaria, na comarca de Niterói\n(RJ).\n\nElegeu-se deputado estadual no estado do Rio de Janeiro em dezembro de\n1909, na chapa apoiada pelo grupo de Alfredo Backer, então presidente do\nestado (1906-1910).\n\nNo início dos trabalhos legislativos de 1910, participou do chamado\n“caso fluminense”, que consistiu no lançamento de duas candidaturas à\nsucessão estadual em julho de 1910 em que se encontraram, de um lado,\nAlfredo Backer e seus partidários, que defendiam a candidatura de Manuel\nEdwiges Queirós Viana e, de outro, Nilo Peçanha, então presidente da\nRepública (1909-1910), e seus correligionários, que apoiavam o candidato\nFrancisco Chaves de Oliveira Botelho. Em agosto, realizada a eleição,\ncada grupo reivindicou a vitória de seu candidato. O impasse foi\nresolvido apenas em dezembro do mesmo ano, com a intervenção do novo\npresidente da República Hermes da Fonseca (1910-1914), que empossou o\ncandidato nilista Oliveira Botelho na presidência do estado do Rio de\nJaneiro.\n\nCom o início dos trabalhos legislativos, em 3 de agosto de 1911, Eduardo\nAmaral Melo e Alvim e os outros deputados backeristas passaram a formar\no grupo de oposição ao governo Oliveira Botelho (1910-1914). Durante o\nmandato, integrou a Comissão de Comércio, Indústria e Colonização.\nDeixou a Assembleia Legislativa do Estado do Rio de Janeiro em 1912,\nquando teve fim a legislatura.\n\n*Vicente Saul Moreira dos Santos*\n\nFONTES: ASSEMB. LEGISL. RJ. *Anais*; *Diário Oficial da União*\n(5/6/1895).\n","ref":"FONTES: ASSEMB. LEGISL. RJ. *Anais*; *Diário Oficial da União*\n(5/6/1895).\n","dic":"DPRRJ"}
