{"title":"MELO, Alberto Soares de Sousa","cargoss":["Deputado Estadual"],"cargos_esp":[0],"datas_ini":[1923],"datas_fim":[1929],"estados":["RJ"],"autor":[0],"content":"**MELO, Alberto Soares de Sousa**\n\n\\* dep. est. RJ 1923-1929.\n\n*Alberto Soares de Sousa e Melo* foi filho de Bernardino José de Sousa e\nMelo Cipriana e de Maria Soares. Seu pai fundou a Fazenda São\nBernardino, considerada pelos especialistas um exemplo perfeito da\narquitetura colonial, e por isso tombada em 1951 pelo Serviço do\nPatrimônio Histórico e Artístico.\n\nFoi vereador no município de Nova Iguaçu (RJ) em duas legislaturas, de\n1901 a 1903 e de 1919 a 1921.\n\nFoi eleito deputado estadual pelo quarto distrito eleitoral, com sede em\nVassouras (RJ), em 28 de outubro de 1923, no pleito realizado durante a\nintervenção federal no estado do Rio de Janeiro. Durante a intervenção\nfederal, decretada em 10 de janeiro de 1923 pelo então presidente da\nRepública Artur Bernardes (1922-1926), o estado foi governado pelo\ninterventor Aureliano Leal, que fechou a Assembleia Legislativa do\nEstado do Rio de Janeiro (ALERJ) e anulou as eleições de 9 de julho de\n1922 realizadas para a sucessão do então presidente estadual Raul Veiga\n(1918-1922), quando os candidatos Raul Fernandes e Feliciano Sodré\ndeclararam-se eleitos, ocasionando a dualidade da ALERJ.\n\nFoi eleito na legenda do Partido Republicano Fluminense (PRF). Com o\ninício dos trabalhos legislativos, em 27 de novembro, participou do\nreconhecimento pela ALERJ da eleição de Feliciano Sodré para presidente\ndo Rio de Janeiro (1923-1927), encerrando o período de intervenção\nfederal do estado.\n\nEm abril de 1927 foi reeleito deputado estadual na chapa oficial do PRF.\nAntes do final da legislatura renunciou ao seu mandato para assumir a\nprefeitura de Nova Iguaçu, no período de 31 de dezembro de 1929 a 18 de\ndezembro de 1930. Entre os anos de 1936 e 1939 foi novamente vereador em\nNova Iguaçu.\n\n*Cláudia Calmon*\n\nFONTES: FERREIRA, M. *República*; UNIV. FED. FLUM. FAC. HIST. Disponível\nem: \\<www.historia.uff.br\\>.\n","ref":"FONTES: FERREIRA, M. *República*; UNIV. FED. FLUM. FAC. HIST. Disponível\nem: \\<www.historia.uff.br\\>.\n","dic":"DPRRJ"}
