{"title":"MELO, José Claro da Rosa","cargoss":["Deputado Estadual"],"cargos_esp":[0],"datas_ini":[1923],"datas_fim":[1930],"estados":["RJ"],"autor":["Raimundo Helio Lopes"],"content":"**MELO, José Claro da Rosa**\n\n\\* dep. est. RJ 1923-1930.\n\n*José Claro da Rosa Melo* iniciou sua vida política em 1921 quando se\ncandidatou a uma vaga na Assembleia Legislativa, mas não foi eleito.\n\nFoi eleito deputado estadual pelo quarto distrito eleitoral, com sede em\nVassouras (RJ), em 28 de outubro de 1923, no pleito realizado durante a\nintervenção federal no estado do Rio de Janeiro. Durante a intervenção\nfederal, decretada em 10 de janeiro de 1923 pelo então presidente da\nRepública Artur Bernardes (1922-1926), o estado foi governado pelo\ninterventor Aureliano Leal, que fechou a Assembleia Legislativa do\nEstado do Rio de Janeiro (ALERJ) e anulou as eleições de 9 de julho de\n1922 realizadas para a sucessão do então presidente estadual Raul Veiga\n(1918-1922), quando os candidatos Raul Fernandes e Feliciano Sodré\ndeclararam-se eleitos, ocasionando a dualidade da ALERJ.\n\nFoi eleito na legenda do Partido Republicano Fluminense (PRF). Com o\ninício dos trabalhos legislativos, em 27 de novembro, participou do\nreconhecimento pela ALERJ da eleição de Feliciano Sodré para presidente\ndo Rio de Janeiro (1923-1927), encerrando o período de intervenção\nfederal do estado. Foi eleito ainda nesse ano membro da Comissão de\nRedação de Leis. Nos outros anos dessa legislatura, compreendida até\n1926, foi sucessivamente reeleito membro da Comissão de Viação e Obras\nPúblicas.\n\nEm abril de 1927 foi reeleito deputado estadual na chapa oficial do PRF\ne no ano seguinte integrou a Comissão de Viação e Obras Públicas. Ao\nfinal da legislatura, em janeiro de 1930, não foi reeleito.\n\n*Raimundo Helio Lopes*\n\nFONTES: ASSEMB. LEGISL. RJ. *Anais* (1923-1930); *Estado* (19/12/1921);\nFERREIRA, M. *República*.\n","ref":"FONTES: ASSEMB. LEGISL. RJ. *Anais* (1923-1930); *Estado* (19/12/1921);\nFERREIRA, M. *República*.\n","dic":"DPRRJ"}
