{"title":"MELO, Modesto Alves Pereira de","cargoss":["Deputado Estadual"],"cargos_esp":[0],"datas_ini":[1901],"datas_fim":[1909],"estados":[0],"autor":["Raimundo Helio Lopes"],"content":"**MELO, Modesto Alves Pereira de**\n\n\\* dep. est. 1901-1909.\n\n*Modesto Alves Pereira de Melo* iniciou sua vida política ainda durante\no Império, quando foi eleito deputado provincial no Rio de Janeiro pela\nlegenda do Partido Conservador.\n\nAlguns anos depois da instalação do regime republicano, em 15 de\nnovembro de 1889, aderiu ao novo regime e foi eleito deputado estadual\npelo 3^o^ distrito eleitoral com 4.656 votos no ano de 1901. Durante\ntoda essa legislatura, compreendida até o ano de 1903, foi membro da\nComissão de Redação de Leis.\n\nEm 1904 fez parte da Comissão para apurar e verificar os poderes dos\ndeputados eleitos pelo 1^o^ distrito eleitoral. Nesse mesmo ano foi\nreeleito deputado estadual, pelo 3^o^ distrito, com 6.584 votos. No ano\nseguinte ingressou na Comissão de Fazenda e Orçamento do Estado e da\nForça Pública. Em 1906, além de ser reeleito membro dessa comissão, fez\nparte também da de Instrução Pública.\n\nEm 1907 foi novamente reeleito com 7.507 votos e eleito segundo\nvice-presidente da Assembleia Legislativa do Estado do Rio de Janeiro\n(ALERJ). Nos dois anos seguintes desta legislatura, compreendida até\n1909, assumiu o posto de primeiro vice-presidente da ALERJ. Durante essa\nlegislatura, segundo João Raimundo Araújo, foi também presidente da\nCâmara de Vereados da cidade de Nova Friburgo em duas oportunidades, de\nsetembro de 1908 a janeiro de 1909 e março de 1909 a janeiro de 1910.\n\nEm 1910 teve uma votação de 4.207 votos para mais um mandato, mas não\nfoi diplomado, pois a Comissão para apurar e verificar os poderes dos\ndeputados eleitos pelo 3^o^ distrito eleitoral anulou seu diploma e\nreconhece como deputado Otávio de Moraes Veiga.\n\nEm 1912 foi candidato a deputado federal pela legenda do Partido\nRepublicano Fluminense, mas não foi eleito. Em 1915 voltou a concorrer a\numa vaga na ALERJ, na chapa liderada pelo senador Miguel de Carvalho,\nmas não obteve êxito.\n\n*Raimundo Helio Lopes*\n\nFONTES: ARAÚJO, J. *Nova Friburgo*; ASSEMB. LEGISL. RJ. *Anais*\n(1907-1909); GOUVÊA, M. *Império*; *Correio de Cantagalo* (21/1/1912);\n*Fluminense* (21/12/1915).\n","ref":"FONTES: ARAÚJO, J. *Nova Friburgo*; ASSEMB. LEGISL. RJ. *Anais*\n(1907-1909); GOUVÊA, M. *Império*; *Correio de Cantagalo* (21/1/1912);\n*Fluminense* (21/12/1915).\n","dic":"DPRRJ"}
