{"title":"MELO, Olímpio de","cargoss":["Prefeito","Interventor"],"cargos_esp":[0,0],"datas_ini":[1936,1937],"datas_fim":[1937,1937],"estados":["DF","DF"],"autor":["Robert Pechman"],"content":"**MELO, Olímpio de**\n\n\\* religioso; pref. DF 1936-1937; interv. DF 1937.\n\n*Olímpio de Melo* nasceu na freguesia de Floresta do Pajeú, no município\nde Pesqueira (PE), no dia 27 de novembro de 1886, filho de Luís de Melo\ne de Olímpia de Meneses Melo.\n\nFez o curso primário em sua cidade natal, o secundário na capital do\nestado, e em 1903 ingressou no Seminário de Olinda (PE), ordenando-se\npadre em 1909 depois de obter licença especial do Vaticano devido à sua\npouca idade. Capelão da usina Goiana, que junto com a fábrica Camaragibe\nconcentrava os mais importantes Círculos de Operários Católicos de\nPernambuco, passou a dirigir esses organismos no estado e instalou um\nserviço de assistência religiosa com finalidades sociais.\n\nEm junho de 1919 viajou a passeio para o Rio de Janeiro, então Distrito\nFederal, onde, depois de prolongar sua permanência para tratamento de\nsaúde, fixou residência em caráter definitivo. Nessa cidade, durante a\ndécada de 1920, foi capelão do hospital São Francisco de Paula, das\nigrejas Nossa Senhora Mãe dos Homens e Santíssimo Sacramento de Santa\nRita, e vigário da paróquia de Santa Cruz. Em 1931 foi transferido para\na paróquia de Bangu, importante centro fabril onde o cardeal dom\nSebastião Leme esperava que reeditasse o sucesso de sua atuação entre os\noperários pernambucanos.\n\nJunto com os trabalhos paroquiais, Olímpio de Melo integrou-se à Liga\nEleitoral Católica (LEC), associação civil de âmbito nacional criada em\n1932 pelo cardeal do Rio de Janeiro para atuar na mobilização do\neleitorado católico em apoio a candidatos comprometidos com a doutrina\nsocial da igreja. Em março de 1933, ao lado de Pedro Ernesto Batista\n(interventor no Distrito Federal desde 1931), foi um dos fundadores do\nPartido Autonomista (PA) do Distrito Federal, que lutava pela autonomia\ndos poderes Executivo e Legislativo da capital em relação ao governo\nfederal e desenvolvia, principalmente através de Pedro Ernesto, uma\npolítica de assistência social voltada para as camadas populares.\n\nPor ocasião das eleições de março de 1933 para a Assembleia Nacional\nConstituinte, o cardeal Leme, pretendendo manter a independência da LEC\nem relação aos partidos políticos, desaconselhou a candidatura de\nOlímpio de Melo, mas reviu sua posição nas eleições municipais de\noutubro de 1934. Liberado para concorrer, Olímpio de Melo tornou-se um\ndos 20 vereadores eleitos pelo PA para a Câmara Municipal, composta de\n24 cadeiras. Na sessão inaugural da legislatura, realizada em abril de\n1935, o padre Olímpio foi eleito para a presidência da Câmara e Pedro\nErnesto para a Prefeitura do Distrito Federal.\n\nAinda em 1935, a aproximação de Pedro Ernesto da Aliança Nacional\nLibertadora (ANL) provocou um aumento de suas divergências com a Igreja\ne uma quebra da unidade do PA, com a formação de um grupo de oposição ao\nprefeito, liderado por Luís Aranha e Olímpio de Melo, que nessa época\npossuía grande representatividade junto a setores operários católicos\norganizados na Zona Norte do Rio e adquirira forte posição dentro do\npartido. Os desacordos persistiram mesmo depois da proposta de adoção de\num novo programa partidário feita por Pedro Ernesto com intenções\nconciliadoras.\n\nO fechamento da ANL pelo governo federal em 11 de julho de 1935 e o\nlevante aliancista desencadeado em fins de novembro em Natal, Recife e\nRio de Janeiro trouxeram importantes alterações na política nacional.\nAtravés de seus senadores, o PA hipotecou solidariedade ao presidente\nGetúlio Vargas pela rápida debelação do movimento, enquanto o prefeito\ndo Distrito Federal passou a assumir cada vez mais abertamente sua\noposição ao governo federal, numa conjuntura marcada pelo acirramento da\nrepressão às correntes oposicionistas. O partido dividiu-se então entre\nessas duas posições, tendo Olímpio de Melo liderado a oposição a Pedro\nErnesto. Com a prisão deste em 3 de abril de 1936, acusado de\nparticipação no levante, o padre Olímpio, na qualidade de presidente da\nCâmara Municipal, assumiu a prefeitura. Nesse cargo, teve dificuldades\nno relacionamento com a bancada majoritária da Câmara e o conjunto do\npartido, sendo acusado de realizar uma administração impopular. Membros\neminentes do PA como Luís Aranha, Augusto Amaral Peixoto e Cesário de\nMelo lideraram um movimento que tinha por fim diluir sua importância\npolítica.\n\nPedro Ernesto foi condenado a três anos e quatro meses de reclusão pelo\nTribunal de Segurança Nacional, mas, absolvido pelo Superior – então\nSupremo – Tribunal Militar, foi submetido a novo julgamento. Sua\nprovável absolvição o traria de volta à Prefeitura do Distrito Federal.\nBuscando eliminar definitivamente sua influência política e unir o PA em\ntorno de um líder que apoiasse o candidato oficial à sucessão de Vargas,\no governo federal decretou intervenção no Distrito Federal em 15 de\nmarço de 1937, suspendendo por um ano o funcionamento da Câmara, mas\nratificando Olímpio de Melo na chefia do Executivo municipal. De acordo\ncom instruções baixadas pelo ministro da Justiça, Agamenon Magalhães, o\nnovo interventor teria que se limitar à parte administrativa de seu\ncargo, enquanto a política local seria coordenada por esse ministério.\n\nDurante sua administração, o padre Olímpio de Melo realizou várias obras\npúblicas e criou o Tribunal de Contas da Prefeitura do Distrito Federal\ne o primeiro Código de Obras, conhecido como Decreto n^o^ 6.000, que\nregulou as construções da cidade até 1970 e serviu de modelo para grande\nnúmero de municípios brasileiros. Inaugurou os hospitais Miguel Couto e\nCarlos Chagas, obras iniciadas pelo seu antecessor. Criou o Conselho\nConsultivo de Turismo e construiu a estrada do Redentor e o Circuito da\nGávea, para corridas de automóveis. Contrariando a orientação seguida\npela administração anterior, promulgou também a lei do ensino religioso\nnas escolas públicas.\n\nEm junho de 1937, abertos os debates sobre a sucessão presidencial,\nOlímpio de Melo e Luís Aranha colocaram suas divergências em segundo\nplano por temerem o fortalecimento da corrente pró-Pedro Ernesto, que\ntinha o apoio do interventor gaúcho José Antônio Flores da Cunha. No\nencontro de ambos com Vargas, ficou decidido que o padre Olímpio\ndeixaria a interventoria em benefício de um nome que promovesse a união\ndas forças políticas que reconheciam a liderança do presidente. Assim,\nmenos de quatro meses depois de sua posse, Olímpio de Melo redigiu sua\ncarta de demissão dirigida a Getúlio Vargas, de quem era amigo pessoal,\nafirmando: “Não desejo atuar diretamente na administração da cidade\nquando correligionários de V. Excia contrariam normas por mim adotadas,\nsentindo-se prejudicados pelas mesmas. De minha permanência no cargo\npoderia resultar a ruptura de laços de solidariedade, para a qual não\nquero fornecer o motivo. Prefiro renunciar à interventoria a concorrer,\nde qualquer forma, para a intranquilidade do ambiente em que se vai\nprocessar a sucessão presidencial.”\n\nEm 2 de julho Olímpio de Melo foi substituído na interventoria por\nHenrique Dodsworth, sendo nomeado pouco depois ministro do Tribunal de\nContas da Prefeitura do Distrito Federal. Eleito por seus pares\npresidente desse tribunal, permaneceria no cargo até 1951, voltando a\nocupá-lo entre agosto de 1955 e novembro de 1956.\n\nEm 10 de novembro de 1937, um golpe de Estado liderado pelo próprio\npresidente Vargas implantou o Estado Novo, suspendendo as eleições\nprevistas para o ano seguinte e determinando o fechamento dos órgãos\nlegislativos e de todos os partidos. As atividades político-partidárias\nsó seriam retomadas em fevereiro de 1945, quando o Ato Adicional n^o^ 9\nliberou a reorganização das agremiações. Nessa ocasião, Olímpio de Melo\nintegrou-se nas articulações do Partido Social Democrático (PSD),\ntornando-se, em abril de 1945, um dos seus fundadores. Depois da\ndeposição de Vargas, em outubro desse ano, teve destacada participação\nna campanha vitoriosa do general Eurico Gaspar Dutra para a presidência\nda República.\n\nDurante suas atividades políticas, angariou fama de homem mau e de andar\narmado. Entretanto, explicava a origem desses rumores pelo fato de estar\nsempre de posse de uma imitação perfeita de arma de fogo, que na verdade\nera uma tabaqueira onde guardava rapé.\n\nEm 1951 participou em Roma das solenidades de canonização do papa Pio X.\nAposentado das funções de presidente do Tribunal de Contas do Distrito\nFederal em novembro de 1956, afastou-se da política e dedicou todo o\nresto de sua vida ao trabalho paroquial nas igrejas Bom Jesus do\nCalvário e Via Sacra, no bairro carioca da Tijuca. Faleceu aos 90 anos,\nno dia 11 de outubro de 1977, no Rio de Janeiro. Tinha os títulos de\ncônego e monsenhor.\n\nRobert Pechman\n\nFONTES: CARONE, E. *República Nova*; CORRESP. GOV. EST. GB; *Encic.\nMirador*; *Grande encic. Delta*; HIRSCHOWICZ, E. *Contemporâneos*;\n*Jornal do Brasil* (19/7/1974, 27, 28/11/1976, 20/7/1977); LEVINE, R.\n*Vargas*; PEIXOTO, A. *Getúlio*; POPPINO, R. *Federal*; REIS, J.\n*Prefeitos*; REIS, J. *Rio*; SILVA, H. *1937*; TODARO, M. *Pastors*.\n","ref":"FONTES: CARONE, E. *República Nova*; CORRESP. GOV. EST. GB; *Encic.\nMirador*; *Grande encic. Delta*; HIRSCHOWICZ, E. *Contemporâneos*;\n*Jornal do Brasil* (19/7/1974, 27, 28/11/1976, 20/7/1977); LEVINE, R.\n*Vargas*; PEIXOTO, A. *Getúlio*; POPPINO, R. *Federal*; REIS, J.\n*Prefeitos*; REIS, J. *Rio*; SILVA, H. *1937*; TODARO, M. *Pastors*.\n","dic":"DPRRJ"}
