{"title":"MELO, Osvaldo Luís Cardoso de","cargoss":["Prefeito","Constituinte"],"cargos_esp":["Campos",0],"datas_ini":[1931,1934],"datas_fim":[1932,1934],"estados":[0,0],"autor":[0],"content":"**MELO, Osvaldo Luís Cardoso de**\n\n\\* pref. Campos 1931-1932; const. 1934.\n\n*Osvaldo Luís Cardoso de Melo* nasceu em Campos (RJ) no dia 12 de março\nde 1897, filho de Luís Cardoso de Melo e de Francisca Batista Cardoso de\nMelo.\n\nFez os primeiros estudos no Colégio Paraíso e no Liceu de Humanidades,\nem sua cidade natal. Em 1919 formou-se pela Faculdade de Medicina do Rio\nde Janeiro.\n\nIniciou a carreira política como vereador na Câmara Municipal de Campos,\ntendo participado da campanha da Reação Republicana, movimento que\npromoveu em 1921-1922 a candidatura de Nilo Peçanha à presidência da\nRepública em oposição à de Artur Bernardes, afinal eleito em março de\n1922. A partir de 1929 tomou parte na campanha da Aliança Liberal e,\napós a Revolução de 1930, exerceu o cargo de prefeito de Campos,\nassumindo logo em seguida, ainda em 1931, a Secretaria do Interior e\nJustiça do estado do Rio de Janeiro, no governo do coronel Pantaleão\nPessoa.\n\nEm maio de 1933 foi eleito deputado pelo Rio de Janeiro à Assembleia\nNacional Constituinte na legenda do Partido Popular Radical (PPR).\nAssumiu o mandato em novembro do mesmo ano, participou dos trabalhos\nconstituintes e, com a promulgação da nova Carta (16/7/1934), teve seu\nmandato prorrogado até maio de 1935.\n\nFundou em seu município natal o periódico *A Semana*, no qual colaborou\ncom matérias políticas e com artigos científicos. Também em Campos,\nfundou a Sociedade Fluminense de Medicina e Cirurgia.\n\nFaleceu em sua cidade natal no dia 15 de setembro de 1968.\n\nEra casado com Aída da Costa Cardoso de Melo.\n\nFONTES: CÂM. DEP. *Deputados*; *Câm. Dep.* *seus componentes*; CONSULT.\nMAGALHÃES, B.; GODINHO, V. *Constituintes*.\n","ref":"FONTES: CÂM. DEP. *Deputados*; *Câm. Dep.* *seus componentes*; CONSULT.\nMAGALHÃES, B.; GODINHO, V. *Constituintes*.\n","dic":"DPRRJ"}
