{"title":"MENESES, José Félix da Cunha","cargoss":["Presidente de associação ou confederação de empregados ou empregadores"],"cargos_esp":["Cons Inten Municipal"],"datas_ini":[1890],"datas_fim":[1891],"estados":[0],"autor":["Raimundo Helio Lopes"],"content":"**MENESES, José Félix da Cunha**\n\n\\* pres. Cons. Inten. Municipal 1890-1891.\n\n*José Félix da Cunha Meneses* nasceu na cidade de Salvador (BA) em 4 de\nnovembro de 1844, filho de José Félix da Cunha Meneses e Joaquina\nNavarro da Cunha Meneses, barão e baronesa do Rio Vermelho.\n\nFormou-se na Faculdade de Medicina da Bahia em 1866 e, depois de\nformado, serviu como médico na Guerra do Paraguai (1864-1870). Depois do\nconflitou formou-se na Faculdade de Direito do Recife e passou a se\ndedicar à medicina legal, área em que seguiu carreira e tornou-se\nprofessor. Mudou-se para o Rio de Janeiro, então capital do Império, e\ndefendeu a causa republicana.\n\nEm 24 de fevereiro de 1890 ingressou no Conselho de Intendência\nMunicipal, órgão criado em 7 de dezembro de 1889, em substituição a\nIlustríssima Câmara da Corte, responsável pela administração da cidade\ndo Rio de Janeiro, então Distrito Federal. Sua entrada no conselho se\ndeu por nomeação do presidente marechal Deodoro da Fonseca (1889-1891),\nem substituição ao intendente de Higiene Domingos de Almeida Martins\nCosta, que foi exonerado do cargo. Por ser recente no conselho, não\nparticipou da renúncia coletiva de todos os intendentes liderados por\nFrancisco Antônio Pessoa de Barros (1889-1890), em 26 de fevereiro de\n1890. Com a formação de um novo conselho, presidido por Ubaldino do\nAmaral Fontoura (1890), foi intendente de Higiene e Praças.\n\nCom a renúncia de Amaral Fontoura, em 3 de agosto de 1890, assumiu a\npresidência do Conselho em 14 de agosto de 1890, nomeado pelo presidente\nDeodoro da Fonseca. Sua administração durou 15 meses e foi marcada por\ngreves dos carroceiros e dos funcionários das estradas de ferro da\ncapital federal. Félix da Cunha também foi criticado no Senado pelos\naltos preços dos gêneros alimentícios e por seu pouco combate às\nempresas que monopolizavam o combustível na cidade e aos atravessadores\ndos gêneros de primeira necessidade. Mesmo com todas as críticas,\nmanteve-se no poder apoiado pelo presidente da República. Entretanto,\ncom a renúncia de Deodoro da Fonseca, em 23 de novembro de 1891, depois\ndo fechamento do Congresso Nacional e de uma revolta da Esquadra, Félix\nda Cunha também renunciou ao seu cargo no Conselho Municipal, depois,\nsegundo o jornal *O País*, da invasão do prédio da Intendência\nMunicipal, liderada por Nilo Peçanha e Barata Ribeiro. Foi substituído\npelo intendente da Fazenda João Lopes Carneiro da Fontoura, o único que\nfez oposição à sua administração.\n\nPublicou *Fraturas nas feridas por armas de fogo* (1866), *Higiene –\nparecer apresentado ao Conselho de Intendência Municipal da capital\nfederal sobre proposta dos cidadãos drs. Hilário de Gouveia e Lima\nCastro relativo ao saneamento da cidade* (1890) e *Compêndio de medicina\nlegal para uso das faculdades de direito*.\n\n*Raimundo Helio Lopes*\n\nFONTES: BASTOS, A. *Conselho*; *Boletins do Conselho de Intendência\nMunicipal* (1890, 1891); BLAKE, A. *Dicionário*; *Governantes da cidade\ndo Rio de Janeiro*.\n","ref":"FONTES: BASTOS, A. *Conselho*; *Boletins do Conselho de Intendência\nMunicipal* (1890, 1891); BLAKE, A. *Dicionário*; *Governantes da cidade\ndo Rio de Janeiro*.\n","dic":"DPRRJ"}
