{"title":"MENESES, Josias","cargoss":["Deputado Estadual"],"cargos_esp":[0],"datas_ini":[1979],"datas_fim":[1983],"estados":["RJ"],"autor":["Sabrina Guerghe"],"content":"**MENESES, Josias**\n\n\\* dep. est. RJ 1979-1983.\n\n*Josias José de Meneses* nasceu em São Gonçalo (RJ), no dia 15 de junho\nde 1925, filho de Antônio Lúcio Meneses e de Alice Rosa de Meneses.\n\nTrabalhou em diversas atividades até tornar-se lapidador de diamantes e\nabrir seu próprio negócio. A partir dos anos de 1950 adotou a religião\nevangélica e passou a compor músicas do gênero.\n\nEm 1960 foi convidado a apresentar o programa *Voz da mocidade batista\ncarioca* na antiga Rádio Copacabana AM, localizada no Rio de Janeiro.\nDois anos mais tarde foi convidado a trabalhar como assessor da rádio.\n\nNas décadas de 1960 e 1970 coordenou caravanas de cantores evangélicos e\nvirou apresentador do programa *Peça seu hino preferido*, ainda na Rádio\nCopacabana, permanecendo no ar também durante a década de 1980.\n\nNas eleições de 1978 conquistou uma cadeira no Legislativo fluminense\npela legenda do Movimento Democrático Brasileiro (MDB). Ao tomar posse,\nem 1^o^ de fevereiro do ano seguinte, foi escolhido para presidir a\nComissão de Servidores Públicos e integrou, como membro efetivo, a\nComissão de Transportes.\n\nCom o fim do bipartidarismo, em novembro de 1979, filiou-se ao Partido\nPopular (PP). No pleito de 1982 tentou reeleger-se deputado estadual, no\nentanto não obteve os votos necessários. Deixou a Assembleia Legislativa\ndo Estado do Rio de Janeiro (ALERJ) em 31 de janeiro de 1983, ao término\ndo mandato.\n\nEm 13 de dezembro de 1984 foi aprovado o Projeto de Lei n^o^ 553/1981,\nde autoria dos deputados Josias Meneses e Sílvio Lessa, criando o Dia\ndas Igrejas Evangélicas Batistas do Estado do Rio de Janeiro, a ser\ncomemorado em 24 de agosto.\n\nNos últimos anos de vida tornou-se apresentador do programa *Ontem, hoje\ne sempre*, na Rádio Teresópolis.\n\nFaleceu no dia 12 de dezembro de 2010, em Teresópolis, região serrana do\nestado do Rio de Janeiro.\n\nCasou-se com Cosmia, com quem teve duas filhas.\n\n*Sabrina Guerghe*\n\nFONTES: ASSEMB. LEGISL. RJ. *Documentos parlamentares*; CPADNEWS.\nDisponível em: \\<http://cpadnews.com.br/redacao.php?s=12&i=6239\\>;\n*Diário Oficial do Poder Legislativo* (26/3, 17/4/1979); Efrata Music.\nDisponível em:\n\\<www.efratamusic.com.br/conteudo.php?id=366&id\\_secao=1\\>.\n","ref":"FONTES: ASSEMB. LEGISL. RJ. *Documentos parlamentares*; CPADNEWS.\nDisponível em: \\<http://cpadnews.com.br/redacao.php?s=12&i=6239\\>;\n*Diário Oficial do Poder Legislativo* (26/3, 17/4/1979); Efrata Music.\nDisponível em:\n\\<www.efratamusic.com.br/conteudo.php?id=366&id\\_secao=1\\>.\n","dic":"DPRRJ"}
