{"title":"MIRANDA, Otávio da Rocha","cargoss":["Deputado federal"],"cargos_esp":[0],"datas_ini":[1918],"datas_fim":[1920],"estados":["DF"],"autor":[0],"content":"**MIRANDA, Otávio da Rocha**\n\n\\* dep. fed. DF 1918-1920.\n\n*Otávio da Rocha Miranda* nasceu em 1884, filho do banqueiro, industrial\ne engenheiro *Luís da Rocha Miranda.*\n\nEm 1905, durante a gestão do prefeito Francisco Pereira Passos no Rio de\nJaneiro, então Distrito Federal (1902-1906), fundou, juntamente com\n*Raul Kennedy de Lemos,* a Companhia Construtora Ipanema, com a\nfinalidade de dar prosseguimento às obras de urbanização da Vila\nIpanema. A partir de então, novas ruas foram abertas e lotes foram\nvendidos. A valorização imobiliária foi enorme e, em alguns anos,\nIpanema se tornaria um dos bairros mais nobres e sofisticados do Rio de\nJaneiro.\n\nEm 1908, por sua iniciativa, foi inaugurada a primeira linha de ônibus\npara a Zona Sul do Rio de Janeiro, ligando o Centro da cidade ao bairro\nda Urca. Em 1916, a família Rocha Miranda adquiriu a Fazenda do Sapê,\nlocalizada na Zona Norte da capital federal e cujo proprietário, no\nséculo XIX, fora o barão de Mesquita. A partir de então, os Rocha\nMiranda promoveram o loteamento da região, com a abertura de várias ruas\ncom nomes de pedras preciosas, já que a área era conhecida como o Bairro\ndas Pedras Preciosas, devido às atividades garimpeiras realizadas no rio\nque cruza a região. A estação de trem da linha auxiliar, que fora\ninaugurada em 17 de março de 1905 com o nome de Sapê, recebeu\nposteriormente o nome de Rocha Miranda, com o qual também foi batizado o\nbairro, em homenagem à família que promoveu o loteamento da região no\ninício do século XX.\n\nEm 1918, Otávio da Rocha Miranda foi eleito deputado federal pelo\nDistrito Federal. Exerceu seu mandato até o final da legislatura, em\n1920.\n\nSeu pai era também sócio benemérito do Hospital Pro Matre, inaugurado em\n1918 no bairro da Saúde. Após sua morte, o filho deu continuidade à\najuda financeira ao hospital, contribuindo para a manutenção do\natendimento gratuito às classes menos favorecidas.\n\nFaleceu em 1954.\n\n*Izabel Pimentel da Silva*\n\nFONTES: GEORIO. Disponível em:\n\\<http://portalgeo.rio.rj.gov.br/bairroscariocas\\>; SIND. EST. GUIAS\nTUR. RJ. Disponível em: \\<http://sindegtur.org.br/2010/index.asp\\>.\n","ref":"FONTES: GEORIO. Disponível em:\n\\<http://portalgeo.rio.rj.gov.br/bairroscariocas\\>; SIND. EST. GUIAS\nTUR. RJ. Disponível em: \\<http://sindegtur.org.br/2010/index.asp\\>.\n","dic":"DPRRJ"}
