{"title":"ARRUDA, Mílton","cargoss":["Deputado Estadual"],"cargos_esp":[0],"datas_ini":[1923],"datas_fim":[1926],"estados":["RJ"],"autor":["Raimundo Helio Lopes"],"content":"**ARRUDA, Mílton**\n\n\\* dep. est. RJ 1923-1926.\n\n*Mílton Arruda* iniciou sua vida política em 1921, quando se candidatou\na uma vaga na Assembleia Legislativa do Estado do Rio de Janeiro\n(ALERJ), mas não obteve êxito.\n\nFoi eleito deputado estadual pelo terceiro distrito eleitoral, com sede\nem Cantagalo (RJ), em 28 de outubro de 1923, no pleito realizado durante\na intervenção federal no estado do Rio de Janeiro. Durante a intervenção\nfederal, decretada em 10 de janeiro de 1923 pelo então presidente da\nRepública Artur Bernardes (1922-1926), o estado foi governado pelo\ninterventor Aurelino Leal, que fechou a ALERJ e anulou as eleições de 9\nde julho de 1922 realizadas para a sucessão do então presidente estadual\nRaul Veiga (1918-1922), quando os candidatos Raul Fernandes e Feliciano\nSodré declararam-se eleitos, ocasionando a dualidade da ALERJ.\n\nFoi eleito na legenda do Partido Republicano Fluminense (PRF). Com o\ninício dos trabalhos legislativos, em 27 de novembro, participou do\nreconhecimento pela ALERJ da eleição de Feliciano Sodré para presidente\ndo Rio de Janeiro (1923-1927), encerrando o período de intervenção\nfederal do estado. Foi eleito, ainda em 1923, suplente de secretário e\nmembro da Comissão de Redação de Leis na ALERJ. A partir de 1925 também\npassou a integrar a Comissão Especial para apurar e verificar os poderes\ndo vice-presidente eleito João Maria da Rocha Werneck para complementar\no quatriênio de 1923 a 1927, em substituição a Paulino José Soares de\nSousa.\n\n*Raimundo Helio Lopes*\n\nFONTES: ASSEMB. LEGISL. RJ. *Anais* (1923-1925); Estado (19/12/1921);\nFERREIRA, M. *República*.\n","ref":"FONTES: ASSEMB. LEGISL. RJ. *Anais* (1923-1925); Estado (19/12/1921);\nFERREIRA, M. *República*.\n","dic":"DPRRJ"}
