{"title":"MONTEIRO, Adílio","cargoss":["Deputado Estadual"],"cargos_esp":[0],"datas_ini":[1904],"datas_fim":[1915],"estados":["RJ"],"autor":["Raimundo Helio Lopes"],"content":"**MONTEIRO, Adílio**\n\n\\* dep. est. RJ 1904-1915.\n\n*Adílio da Silva Monteiro* ingressou no exército e alcançou a patente de\ntenente-coronel. Ainda durante o Império ingressou no Partido Liberal,\nna cidade de Resende (RJ). Nesse mesmo município foi um dos fundadores\ndo Partido Republicano e um dos seus presidentes.\n\nElegeu-se deputado estadual na legenda do Partido Republicano do Rio de\nJaneiro (PRRJ), em 31 de janeiro de 1904, pelo quinto distrito\neleitoral, sediado em Resende. Na Assembleia Legislativa do Estado do\nRio de Janeiro (ALERJ), entre os anos de 1904 e 1906, integrou a\nComissão de Redação de Leis. Em 1906 ingressou na Comissão Especial\nresponsável pela apuração e verificação dos poderes do presidente e\nvice-presidente do estado eleitos para o quadriênio de 1907-1910 e na\nComissão de Verificação de Poderes dos deputados estaduais eleitos pelo\nprimeiro e pelo segundo distritos eleitorais.\n\nEm dezembro de 1906 reelegeu-se deputado estadual pelo PRRJ e, em\nsetembro de 1907, por ocasião da votação que visava regulamentar a\ncobrança da sobretaxa para o café estipulada pelo Convênio de Taubaté\n(1906) e o destino da arrecadação desse imposto, votou contra a\nmanutenção da cobrança que havia sido o estopim do distanciamento entre\nNilo Peçanha e o então presidente do estado do Rio de Janeiro Alfredo\nBacker (1906-1910). Nessa legislatura foi membro das comissões de\nRedação de Leis, de Estatística, Divisão Civil e Judiciária e de Obras\nPúblicas, Saúde Pública e Câmaras Municipais. Em seus pronunciamentos\ndeclarou apoio ao governo de Backer.\n\nNas eleições estaduais de dezembro de 1909 foi reeleito deputado\nestadual, agora na chapa do Partido Republicano Fluminense (PRF),\npartido que passou a abrigar o grupo ligado a Nilo Peçanha e que\nconseguiu eleger a maioria dos deputados estaduais. No início da\nlegislatura de 1910 participou do chamado “caso fluminense”. O\nacontecimento consistiu no lançamento de duas candidaturas à sucessão\nestadual, em julho de 1910, em que se encontraram, de um lado, Backer e\nseus partidários defendendo a candidatura de Manuel Edwiges Queirós\nViana e, de outro, Nilo Peçanha e correligionários apoiando o candidato\nFrancisco Chaves de Oliveira Botelho. Em agosto, realizada a eleição,\ncada grupo reivindicou a vitória de seu candidato. O impasse levou à\nintervenção do então presidente da República Hermes da Fonseca (1910-\n1914) que, em dezembro, empossou o candidato nilista Oliveira Botelho\n(1910-1914) na presidência do estado do Rio de Janeiro. Durante o\nmandato, Adílio Monteiro integrou as comissões de Redação de leis e\nFazenda, Orçamento e Força Pública.\n\nEm fevereiro de 1911 Adílio Monteiro ingressou no Partido Republicano\nConservador Fluminense (PRCF), surgido da fusão do PRF com o Partido\nRepublicano Conservador (PRC). Pelo PRCF reelegeu-se deputado estadual\nem 15 de dezembro de 1912. No ano seguinte Oliveira Botelho e Nilo\nPeçanha romperam politicamente devido à sucessão estadual, já que o\nprimeiro lançou o nome de Feliciano Sodré, então prefeito de Niterói,\nenquanto o próprio Nilo candidatou-se ao governo fluminense. Com esse\nrompimento os nilistas voltaram a usar a sigla do PRF, enquanto\nFeliciano Sodré concorreu pelo Partido Republicano Conservador\nFluminense (PRCF). Esse partido passou a abrigar a oposição ao nilismo e\nos deputados estaduais que apoiaram a candidatura de Sodré, caso de\nAdílio Monteiro.\n\nDurante a campanha eleitoral, a ALERJ foi dividida em duas: uma nilista\ne outra apoiadora de Feliciano Sodré, da qual fazia parte Adílio\nMonteiro. Depois do pleito de 12 de julho de 1914, ambos, Nilo e Sodré,\ndeclararam-se vencedores e foram reconhecidos pelas respectivas\nassembleias. A questão foi resolvida com um *habeas corpus* do Supremo\nTribunal Federal (STF) garantindo a eleição de Nilo Peçanha, cuja posse\nfoi assegurada pelo recém-empossado presidente da República Venceslau\nBrás (1914-1918).\n\nCom o início do novo governo de Nilo Peçanha (1914-1917), e a reabertura\ndos trabalhos legislativos da ALERJ, em julho de 1915, Adílio Monteiro\npassou à oposição ao governo, juntamente com os partidários do PRCF.\nDurante o mandato fez parte da Comissão de Fazenda, Orçamento e Força\nPública.\n\nEm dezembro candidatou-se novamente à ALERJ, mas não obteve êxito, pois\nos nilistas elegeram a maioria dos candidatos, derrotando a oposição.\n\n*Raimundo Helio Lopes*\n\nFONTES: ASSEMB. LEGISL. RJ. (1904-1915); FERREIRA, M. *República.*\n","ref":"FONTES: ASSEMB. LEGISL. RJ. (1904-1915); FERREIRA, M. *República.*\n","dic":"DPRRJ"}
