{"title":"MONTEIRO, Henrique Borges","cargoss":["Deputado Estadual","Deputado federal","Deputado federal"],"cargos_esp":[0,0,0],"datas_ini":[1898,1921,1903],"datas_fim":[1902,1925,1911],"estados":["RJ","RJ","RJ"],"autor":["Luciana Pinheiro"],"content":"**MONTEIRO, Henrique Borges**\n\n\\* dep. est. RJ 1898-1902; dep. fed. RJ 1903-1911 e 1921-1925.\n\n*Henrique Borges Monteiro* nasceu no Rio de Janeiro, então capital do\nImpério, no dia 11 de janeiro de 1869, filho de Isidro Borges Monteiro e\nde Augusta Rosa da Silva.\n\nBacharelou-se pela Faculdade de Direito de São Paulo em 1889 e no ano\nseguinte assumiu a promotoria pública da comarca de Cachoeira (SP).\nPosteriormente tornou-se promotor público em Vassouras (RJ), onde também\nmanteve um escritório de advocacia, foi juiz de direito, superintendente\nde ensino e vereador. Fixando-se no estado do Rio de Janeiro, elegeu-se\nduas vezes deputado estadual e exerceu os mandatos entre 1898 e 1902.\n\nEm 1903 foi eleito deputado federal pelo estado do Rio. Tomou posse na\nCâmara dos Deputados, no Distrito Federal, em maio do mesmo ano, e foi\nreeleito para as duas legislaturas seguintes, exercendo o mandato até\ndezembro de 1911. Foi membro das comissões de Legislação e Justiça, de\nTarifas, de Reforma Eleitoral e de Agricultura da Câmara. Voltou a\nexercer mandato eletivo em 1921, quando foi novamente eleito deputado\nfederal. Reelegeu-se em 1924, mas faleceu antes do fim da legislatura,\nem 4 de março de 1925.\n\nFoi casado com Ilídia Correia de Araújo e teve nove filhos. Um deles,\nHenrique Borges Monteiro Filho, foi deputado estadual no Rio de Janeiro\nem 1926.\n\n*Luciana Pinheiro*\n\nFONTES: ABRANCHES, J. *Governos* (p. 145-146); CÂM. DEP. *Deputados\nbrasileiros* (1826-1976); GeneAll. Disponível em: \\<www.geneall.net/\\>.\nAcesso em: 11/12/2010; GeneaMinas. Disponível em:\n\\<www.geneaminas.com.br/genealogia-mineira\\>. Acesso em: 11/12/2010;\nMELLO, M. *Parlamento*.\n","ref":"FONTES: ABRANCHES, J. *Governos* (p. 145-146); CÂM. DEP. *Deputados\nbrasileiros* (1826-1976); GeneAll. Disponível em: \\<www.geneall.net/\\>.\nAcesso em: 11/12/2010; GeneaMinas. Disponível em:\n\\<www.geneaminas.com.br/genealogia-mineira\\>. Acesso em: 11/12/2010;\nMELLO, M. *Parlamento*.\n","dic":"DPRRJ"}
