{"title":"MOREIRA, Altino","cargoss":["Deputado Estadual"],"cargos_esp":[0],"datas_ini":[1987],"datas_fim":[1991],"estados":["RJ"],"autor":["Sabrina Guerghe"],"content":"**MOREIRA, Altino**\n\n\\* dep. est. RJ 1987-1991.\n\n*Altino Alves Moreira* nasceu no município de Serrania (MG) no dia 7 de\nmarço de 1928.\n\nBacharelou-se em medicina e tornou-se especialista em cirurgia geral e\nginecologia.\n\nFoi eleito deputado estadual para a Quarta Legislatura (1987-1991) da\nAssembleia Legislativa do Estado do Rio de Janeiro (ALERJ), pela legenda\ndo Partido Trabalhista Brasileiro (PTB).\n\nDurante seu mandato assumiu a vice-liderança de sua agremiação na\nassembleia. Atuou como membro da Comissão Interpartidária\nPró-Constituinte, integrando a Subcomissão Social. Foi escolhido para\ncompor, como membro titular, a Comissão Parlamentar de Inquérito (CPI)\npara Apurar Irregularidades na Secretaria de Estado de Polícia Civil e\npresidiu a Comissão Especial para Apurar as Causas da Poluição do Rio\nParaibuna.\n\nAinda no final da década de 1980 foi um dos principais defensores da\nemancipação político-administrativa do município de Comendador Levy\nGasparian, ocorrida em 1991.\n\nPassou a integrar o Conselho Municipal dos Direitos da Criança e do\nAdolescente, em outubro de 1991, na cidade de Igarapava, estado de São\nPaulo, representando entidades não governamentais de defesa ou\natendimento dos direitos da criança e do adolescente.\n\nFaleceu no dia 13 de julho de 1999.\n\nFoi casado com Ana Mannarino Moreira.\n\n*Sabrina Guerghe*\n\nFONTES: ASSEMB. LEGISL. RJ. *Deputados estaduais fluminenses*. Quarta\nlegislatura (1987-1991); **CÂM. MUN. COMENDADOR LEVY GASPARIAN\n(18/2/2009); *Info. Dir. Exec.*** *Assoc. Nac. Serv. Previd. Seguridade\nSocial* ***INSS*** **(ano 3, n. 124, 17/3/2004);** PREF. IGARAPAVA.\nPortaria n^o^ 1.026 de 25/10/1991. Disponível em:\n\\<www.igarapava.sp.gov.br/pdfLeis/portarias/1026%251991.pdf\\>**.**\n","ref":"FONTES: ASSEMB. LEGISL. RJ. *Deputados estaduais fluminenses*. Quarta\nlegislatura (1987-1991); **CÂM. MUN. COMENDADOR LEVY GASPARIAN\n(18/2/2009); *Info. Dir. Exec.*** *Assoc. Nac. Serv. Previd. Seguridade\nSocial* ***INSS*** **(ano 3, n. 124, 17/3/2004);** PREF. IGARAPAVA.\nPortaria n^o^ 1.026 de 25/10/1991. Disponível em:\n\\<www.igarapava.sp.gov.br/pdfLeis/portarias/1026%251991.pdf\\>**.**\n","dic":"DPRRJ"}
