{"title":"MOURA, Jorge","cargoss":["Deputado federal","Deputado federal"],"cargos_esp":[0,0],"datas_ini":[1980,1975],"datas_fim":[1983,1979],"estados":["RJ","RJ"],"autor":["Marcelo Costa"],"content":"**MOURA, Jorge**\n\n\\* dep. fed. RJ 1975-1979 e 1980-1983.\n\n*Jorge Luís Moura* nasceu no Rio de Janeiro, então Distrito Federal, no\ndia 3 de março de 1942, filho de Valdi Gomes Moura e de Jeci Paroli\nMoura.\n\nIngressou na Faculdade Nacional de Direito e, por se destacar como líder\nestudantil, foi membro do Diretório Nacional dos Estudantes e\nvice-presidente do Centro Acadêmico Cândido de Oliveira em 1967. Em sua\natuação no movimento estudantil defendeu a participação dos estudantes\nna solução dos problemas nacionais. Bacharelou-se em ciências jurídicas\ne sociais em 1967.\n\nNo pleito de novembro de 1970 candidatou-se a deputado federal pelo\nentão estado da Guanabara na legenda do Movimento Democrático Brasileiro\n(MDB), partido de oposição ao regime militar instaurado no país em abril\nde 1964, mas obteve apenas uma suplência. Em novembro de 1974, novamente\ncandidato, dessa vez pelo novo estado que resultaria da fusão da\nGuanabara com o antigo estado do Rio de Janeiro em março de 1975,\nconseguiu eleger-se com o apoio do “grupo autêntico” do MDB. Assumiu sua\ncadeira na Câmara em fevereiro de 1975, tornou-se membro da Comissão de\nTrabalho e Legislação Social e suplente da Comissão de Minas e Energia.\nEm agosto de 1978, apresentou na tribuna abaixo-assinado de intelectuais\npaulistas e cariocas que reivindicavam liberdade de criação e condenavam\na censura. Em novembro desse ano, contrariando as expectativas dos\n“autênticos”, votou em Tancredo Neves, considerado moderado, para a\nliderança do MDB na Câmara.\n\nAinda em novembro de 1978 concorreu mais uma vez a uma cadeira de\ndeputado federal pelo Rio de Janeiro, sempre na legenda do MDB, mas só\nobteve a segunda suplência. Deixou a Câmara em janeiro de 1979 e, com a\nextinção do bipartidarismo em 29 de novembro desse ano e a consequente\nreformulação partidária, filiou-se ao Partido Popular (PP). Em janeiro\nde 1980, na reabertura do Congresso, assumiu uma cadeira na Câmara dos\nDeputados, em virtude da morte do deputado Amâncio de Azevedo e da\nefetivação do suplente Péricles Gonçalves, em exercício de mandato desde\nmarço de 1979. Na ocasião explicou que sua adesão ao PP decorria da\nnecessidade de conviver pacificamente com o governador fluminense\nAntônio de Pádua Chagas Freitas para atender aos interesses de seu\neleitorado, composto principalmente de líderes do subúrbio e de escolas\nde samba. Entretanto, com a incorporação do PP ao Partido do Movimento\nDemocrático Brasileiro (PMDB), efetivada em fevereiro de 1982, filiou-se\na essa última legenda. Nessa legislatura foi membro da Comissão de\nConstituição e Justiça e suplente da Comissão de Relações Exteriores da\nCâmara dos Deputados. No pleito de novembro de 1982 concorreu à\nreeleição, mas conseguiu apenas uma suplência. Encerrou seu mandato em\njaneiro de 1983.\n\nEm abril de 1985 tornou-se diretor da Rede Ferroviária Federal S.A.,\npermanecendo no cargo até o ano seguinte. Voltou a candidatar-se nas\neleições de novembro de 1986, agora à Assembleia Nacional Constituinte,\npela legenda do PMDB, mas novamente não foi bem-sucedido. Foi presidente\ndo Instituto de Previdência do Estado do Rio de Janeiro entre abril e\ndezembro de 1988, no governo de Wellington Moreira Franco (1987-1991).\nEm janeiro de 1989 tornou-se diretor executivo do Serviço Social das\nEstradas de Ferro, órgão da Rede Ferroviária Federal, e permaneceu no\ncargo até junho de 1990. Em outubro desse último ano voltou a disputar\numa vaga na Câmara dos Deputados, sempre pelo PMDB, sem, contudo, lograr\neleger-se.\n\nEm 1991 transferiu-se para Brasília, sendo cedido pela Rede Ferroviária\nFederal para trabalhar com o senador Nélson Carneiro (PMDB-RJ), na\npresidência do Senado. Permaneceu nessa função até maio de 1993, quando\nretornou ao Rio de Janeiro para assumir, pela segunda vez, o cargo de\ndiretor executivo do Serviço Social das Estradas de Ferro, função que\nexerceria até maio do ano seguinte.\n\nEm abril de 1994 teve seu nome incluído numa lista apreendida pelo\nMinistério Público na qual vários políticos eram citados como\nbeneficiados com doações feitas por banqueiros de jogo do bicho,\natividade ilegal no país. Na ocasião foi acusado de ter recebido\ndinheiro da contravenção para sua campanha a deputado federal em 1990.\n\nNo pleito de outubro de 1994 candidatou-se à Câmara dos Deputados pelo\nPartido Progressista (PP) do Rio de Janeiro, mas não conseguiu se\neleger. Com suspeitas de fraude devido ao número excessivo de votos em\nbranco, a eleição foi anulada por determinação do Tribunal Regional\nEleitoral (TRE) do estado. Marcado o novo pleito para novembro seguinte,\nMoura foi mais uma vez derrotado.\n\nEm janeiro de 1995 tornou-se subsecretário de Transportes do Estado do\nRio de Janeiro, no governo de Marcelo Alencar (1995-1998), do Partido da\nSocial Democracia Brasileira (PSDB). Em maio do ano seguinte pôs o cargo\nà disposição para apoiar a candidatura de Miro Teixeira, do Partido\nDemocrático Trabalhista (PDT) à prefeitura do Rio de Janeiro, no pleito\nde outubro de 1996. No segundo turno realizado em novembro apoiou a\ncandidatura vencedora de Luís Paulo Conde, do Partido da Frente Liberal\n(PFL), que derrotou na ocasião o candidato do PSDB, Sérgio Cabral Filho.\n\nEm junho de 2003, filiado ao Partido dos Trabalhadores (PT), foi nomeado\npresidente da Fundação Rede Ferroviária de Seguridade Social (Refer),\ncargo que ocupou até junho de 2004. Em 2006, durante as investigações\nrealizadas pela Comissão Parlamentar de Inquérito que averiguava\ndenúncias de corrupção nos Correios, acusou o PT de aparelhar\npoliticamente o Refer e disse que 19 milhões de reais foram desviados do\nfundo para servir de propina a diretores do órgão, ligados ao partido e\na sindicatos, de modo que eles aceitassem terceirizar para outra\ninstituição financeira a administração da rendosa carteira de\ninvestimentos do Refer. Moura teria pedido para deixar a presidência do\nfundo por não concordar com esse processo; deixou então o PT e filiou-se\nao Partido Popular Socialista (PPS). Com o prosseguimento das apurações\nsobre o caso dos Correios acabou sendo indiciado por razões\nadministrativas, visto que mesmo sabendo das perdas financeiras que\natingiam o Refer, não teria feito nada para apurar responsabilidades e\nbuscar o devido ressarcimento.\n\nNas eleições de outubro de 2006 candidatou-se a deputado federal pelo\nRio de Janeiro na legenda do PPS, porém não conseguiu ser eleito.\n\nJorge Moura casou-se com Laura Sportitsch Moura, com quem teve três\nfilhos.\n\nMarcelo Costa\n\nFONTES: AG. SEN (6/3/2006); CÂM. DEP. *Deputados brasileiros*.\nRepertório (1975-1979, 1979-1983); *Estado de S. Paulo* (6/4/1994);\n*Folha de S.Paulo* (10/1/1980, 29/3/2006); *Globo* (1/4/1994); INF.\nBIOG.; *Jornal do Brasil* (27/11/1974, 2/11/1977, 11/8, 20/11/1978,\n11/4/1985, 16/7/1994); NÉRI, S. *16*; *Perfil* (1980); TRIB. SUP. ELEIT.\n*Dados* (9).\n","ref":"FONTES: AG. SEN (6/3/2006); CÂM. DEP. *Deputados brasileiros*.\nRepertório (1975-1979, 1979-1983); *Estado de S. Paulo* (6/4/1994);\n*Folha de S.Paulo* (10/1/1980, 29/3/2006); *Globo* (1/4/1994); INF.\nBIOG.; *Jornal do Brasil* (27/11/1974, 2/11/1977, 11/8, 20/11/1978,\n11/4/1985, 16/7/1994); NÉRI, S. *16*; *Perfil* (1980); TRIB. SUP. ELEIT.\n*Dados* (9).\n","dic":"DPRRJ"}
