{"title":"NADER JÚNIOR, José","cargoss":["Deputado Estadual"],"cargos_esp":[0],"datas_ini":[2003],"datas_fim":[2011],"estados":["RJ"],"autor":["Tiago Alves Jaques"],"content":"**NADER JÚNIOR, José**\n\n\\* dep. est. RJ 2003-2011.\n\n*José Nader Júnior* nasceu em Bananal (SP) no dia 28 de janeiro de 1963,\nfilho de José Leite Nader e de Djalza Glória Pires Nader. Seu pai foi\ndeputado estadual no Rio de Janeiro de 1975 a 1979 e de 1983 a 1995,\npresidente da Assembleia Legislativa do Estado do Rio de Janeiro (ALERJ)\nde 1991 a 1994, e conselheiro do Tribunal de Contas do Estado do Rio de\nJaneiro (TCE-RJ) de 1998 a 2010. Seu tio, Féres Nader, foi prefeito de\nBarra Mansa (RJ) de 1973 a 1977 e deputado estadual no Rio de Janeiro de\n1987 a 1991 e em 1993. Seu irmão César Augusto Nader foi eleito vereador\nem Barra Mansa em 2008.\n\nFormou-se pela Faculdade de Ciências Econômicas Dom Bosco, em Resende\n(RJ), em 1987, e de 1990 a 1993 foi chefe de gabinete de seu pai na\nALERJ. Em 1998 candidatou-se a deputado estadual na legenda do Partido\nTrabalhista Brasileiro (PTB), mas não foi eleito. Entre 1999 e 2002 foi\nassessor de seu pai no TCE-RJ.\n\nNas eleições de outubro de 2002 foi eleito deputado estadual na legenda\ndo PTB. Assumiu o mandato em fevereiro de 2003 e foi escolhido líder do\nPTB na ALERJ, além de membro efetivo da Comissão de Minas e Energia e da\nComissão de Assuntos Municipais e de Desenvolvimento Regional da ALERJ.\nFoi um dos idealizadores da Clínica Popular Nise da Silveira, para\ntratamento de dependentes químicos, inaugurada em dezembro de 2003 em\nBarra Mansa. Reeleito em outubro de 2006, sempre na legenda do PTB,\niniciou novo mandato em fevereiro seguinte e manteve-se na liderança de\nseu partido. Presidiu a Comissão de Prevenção ao Uso de Drogas e\nDependentes Químicos em Geral, foi vice-presidente da Comissão de Minas\ne Energia, membro da Comissão de Tributação, Controle da Arrecadação\nEstadual e de Fiscalização dos Tributos Estaduais, e teve 13 projetos de\nlei de sua autoria ou coautoria transformados em lei.\n\nEm 2008 foi um dos alvos, junto com seu pai e outros, da investigação da\nPolícia Federal (PF) chamada de “Operação Pasárgada”, acerca de um\nsuposto esquema de tráfico de influência e venda de sentenças nos\ntribunais de contas do Rio de Janeiro e de Minas Gerais. Em março de\n2009 a ALERJ aprovou a criação de uma comissão parlamentar de inquérito\n(CPI) para investigar as denúncias contra os conselheiros do TCE-RJ e\ncontra o deputado estadual Nader Júnior.\n\nEm março de 2010 apresentou sua candidatura a conselheiro do TCE-RJ, o\nque levou a deputada Cidinha Campos a protestar no plenário da ALERJ. No\nmês seguinte, dos 22 candidatos, foi o único considerado inabilitado\npara concorrer à vaga. Apresentou recurso contra a decisão da Mesa\nDiretora da ALERJ, mas o plenário da Casa o rejeitou. Em maio a\ncorregedoria da ALERJ recomendou a abertura de processo de cassação de\nseu mandato por quebra de decoro em função dos resultados da CPI do\nTCE-RJ, mas o plenário da ALERJ demorou a apreciar o pedido. Nas\neleições de outubro candidatou-se a deputado federal, sempre na legenda\ndo PTB, mas não teve êxito. Deixou a ALERJ em janeiro de 2011, ao final\nda legislatura. Em outubro o Superior Tribunal de Justiça (STJ) acolheu\na denúncia contra Nader Júnior feita pelo Ministério Público em\ndecorrência da investigação da “Operação Pasárgada”. Acusado de\ncorrupção passiva e de formação de quadrilha, em 2012 ainda não havia\nsido julgado pelo STJ.\n\nAo longo de sua trajetória foi ainda membro efetivo da executiva\nregional do PTB-RJ e vice-presidente de diretório do PTB Barra Mansa.\n\n*Tiago Alves Jaques*\n\nFONTES: ASSEMB. LEGISL. RJ. *Legislação estadual*; ASSEMB. LEGISL. RJ.\n*Comissões permanentes*; *Estado de S. Paulo* (15/4/2010); *Extra*\n(14/4/2010); *Globo* (12/2, 2 e 12/3/2009, 13/4/2010, 27/10/2011);\n*IstoÉ* (14/4/2010); NADER JÚNIOR, J. *Currículo*; TRIB. SUP. ELEIT.\n*Eleições* (1998, 2002, 2006, 2010); *Veja* (14/5/2010).\n","ref":"FONTES: ASSEMB. LEGISL. RJ. *Legislação estadual*; ASSEMB. LEGISL. RJ.\n*Comissões permanentes*; *Estado de S. Paulo* (15/4/2010); *Extra*\n(14/4/2010); *Globo* (12/2, 2 e 12/3/2009, 13/4/2010, 27/10/2011);\n*IstoÉ* (14/4/2010); NADER JÚNIOR, J. *Currículo*; TRIB. SUP. ELEIT.\n*Eleições* (1998, 2002, 2006, 2010); *Veja* (14/5/2010).\n","dic":"DPRRJ"}
