{"title":"NADER, José","cargoss":["Deputado Estadual","Deputado Estadual"],"cargos_esp":[0,0],"datas_ini":[1983,1975],"datas_fim":[1995,1979],"estados":["RJ","RJ"],"autor":[0],"content":"**NADER, José**\n\n\\* dep. est. RJ 1975-1979 e 1983-1995.\n\n*José Leite Nader* nasceu em Bananal (SP) no dia 24 de fevereiro de\n1940, filho de Osrraia Pedro Nader e de Iracema Leite Nader. Seu irmão,\nFéres Nader, foi prefeito de Barra Mansa (RJ) de 1973 a 1977 e deputado\nestadual no Rio de Janeiro de 1987 a 1991 e em 1993.\n\nBacharelou-se em direito pela Sociedade de Ensino Superior de Barra\nMansa, atual Centro Universitário de Barra Mansa, e fez cursos\ncomplementares de administração no Instituto de Organização Racional do\nTrabalho do Rio de Janeiro.\n\nDe 1963 a 1970 foi funcionário da Companhia Siderúrgica Nacional, lotado\nna Escola Técnica Pandiá Cológeras, em Volta Redonda, e de 1967 a 1971\nfoi assessor direto do prefeito de Barra Mansa. Presidiu também o\nconselho do Serviço Autônomo de Água e Esgoto e foi diretor de Obras e\nAdministração do município. Foi ainda diretor financeiro da Companhia\nEstadual de Habitação (Cehab) do Rio de Janeiro de 1974 a 1975.\n\nFiliado à Aliança Renovadora Nacional (Arena), elegeu-se deputado\nestadual em 1974 com 39.175 votos e assumiu o mandato na Assembleia\nLegislativa do Estado do Rio de Janeiro (ALERJ) em fevereiro de 1975.\nFoi vice-líder da bancada da Arena de 1977 a 1978 e deixou a ALERJ ao\nfinal da legislatura, em janeiro de 1979. Já filiado ao Partido\nDemocrático Social (PDS), que sucedeu à Arena após o fim do\nbipartidarismo em 1979, voltou a se eleger em 1982, com 24.326\nvotos,iniciou novo mandato em fevereiro de 1983, foi escolhido quarto\nsecretário da ALERJ, e mais uma vez foi vice-líder da bancada de seu\npartido, de março a dezembro de 1983. Em 19 de novembro de 1984 rompeu\ncom o PDS e filiou-se ao Partido Democrático Trabalhista (PDT).\nVice-líder da bancada do PDT em 1986, nas eleições desse ano conquistou\nseu teceiro mandato, com 24.326 votos, e manteve a vice-liderança da\nbancada em 1987. Foi durante o segundo e o terceiro mandatos que\nparticipou do maior número de comissões da ALERJ: foi vice-presidente da\nComissão de Transportes (1986), membro efetivo das comissões de\nEconomia, Indústria e Comércio, e de Redação, e suplente de várias\noutras. Terminou seu teceiro mandato como primeiro secretário da ALERJ,\nnos anos de 1989 e 1990.\n\nEm 1990 foi eleito para o quarto mandato com 21.336 votos, novamente na\nlegenda do PDT. Duas vezes eleito presidente da ALERJ, para os biênios\n1991-1992 e 1993-1994, assumiu interinamente o governo do estado em\ndecorrência da licença do governador e do vice-governador em 15 de março\nde 1991. Em 1994 foi nomeado pelo então governador Nilo Batista\nconselheiro vitalício do Tribunal de Contas do Estado do Rio de Janeiro\n(TCE-RJ), mas teve sua posse impedida por problemas legais. Em maio de\n1998, após uma batalha de quatro anos na Justiça, assumiu o cargo de\nconselheiro, que exerceu até 2010.\n\nCasado com Djalza Glória Pires Nader, teve cinco filhos. José Nader\nJúnior foi deputado estadual no Rio de Janeiro de 2003 a 2001. Outro\nfilho, César Augusto Nader, foi eleito vereador em Barra Mansa em 2008.\n\n*Maria de Paula Godoy Garcia*\n\nFONTES: ASSEMB. LEGISL. RJ. *D**eputados estaduais fluminenses*.\nTerceira legislatura, Quarta legislatura, Quinta legislatura.\n","ref":"FONTES: ASSEMB. LEGISL. RJ. *D**eputados estaduais fluminenses*.\nTerceira legislatura, Quarta legislatura, Quinta legislatura.\n","dic":"DPRRJ"}
