{"title":"NAGAE, Neirobis","cargoss":["Deputado Estadual"],"cargos_esp":[0],"datas_ini":[1995],"datas_fim":[1999],"estados":[0],"autor":["Ana Beatriz Paes"],"content":"**NAGAE, Neirobis**\n\n\\* dep. est. 1995-1999.\n\n*Neirobis Kazuo Nagae* nasceu na cidade de Ituverava (SP) no dia 14 de\nmarço de 1944, filho de Tatsumi Naggae e de Tsuruco Nagae.\n\nFormou-se em odontologia pela Pontifícia Universidade Católica de\nCampinas (SP), no ano de 1967 e atuou como cirurgião dentista na cidade\nde Angra dos Reis (RJ). Entre os anos de 1968 e 1975 foi professor de\nciências na rede estadual de educação também em Angra dos Reis. Durante\nesse período participou de uma série de cursos de aperfeiçoamento de sua\nprofissão, bem como seminários, conferências e congressos, entre os\nquais se destacam: em 1969 fez o curso de treinamento de professores\npara exame de suficiência – ciências, no Centro de Apoio para\nDesenvolvimento Educacional e Social (CADES) em Nova Friburgo (RJ);\nparticipou em 1973 da III Jornada Odontológica como membro efetivo, da\nII Semana de Estudos Odontológicos, da I Jornada Universitária de Volta\nRedonda (RJ) e do Seminário de currículo do ensino fundamental, na\ncidade do Rio de Janeiro; no ano seguinte, em 1974, o curso de avaliação\nde aprendizagem na cidade do Rio de Janeiro e o de aperfeiçoamento para\nprofessores de atuação pedagógica em Angra dos Reis; em 1977, o curso de\nhipnologia e psicoterapia no Rio de Janeiro; e no ano de 1978 o curso de\nodontologia psicossomática e hipnologia, também no Rio de Janeiro. Em\n1982 presidiu a V Jornada itinerante ético-científica do Conselho\nRegional de Odontologia (CRO/RJ) do Rio de Janeiro, que aconteceu na\ncidade de Angra dos Reis; e depois de alguns anos, já em 1997,\nparticipou do seminário da nova Lei de Diretrizes e Bases da Educação,\nCaminhos e Desafios, na cidade do Rio de Janeiro.\n\nSeu primeiro mandato eletivo foi o de prefeito de Angra dos Reis, cidade\nonde residia, em que cumpriu sua gestão entre os anos 1989 e 1992; ainda\nem 1992 recebeu o colar do mérito judiciário do Tribunal de Justiça do\nEstado do Rio de Janeiro. Enquanto prefeito da cidade implantou a\npolítica do orçamento participativo, abriu à população praias\nilegalmente privatizadas, construiu 13 escolas, ampliou 24, decresceu a\nporcentagem dos índices de repetência de 43% a 23% devido aos\ninvestimentos na qualificação dos profissionais de educação.\n\nEm 1994 foi eleito para a sexta legislatura da Assembleia Legislativa do\nEstado do Rio de Janeiro (ALERJ), com 16.104 votos, pelo Partido dos\nTrabalhadores, partido ao qual foi vinculado desde o ano de 1984.\n\nDurante sua gestão, compreendida entre os anos de 1995 e 1999, atuou\ncomo presidente da Comissão de Educação, Cultura e desportos em 1995;\nmembro efetivo da Comissão de Orçamento, Finanças e Tributações entre\n1995 e 1996; da Comissão Especial para acompanhamento do projeto de\nampliação do Porto de Sepetiba em 1996; e da Comissão Especial para\ninvestigar e acompanhar as denúncias de casos de racismo e para realizar\no levantamento de terras de remanescentes quilombolas no estado do Rio\nde Janeiro em 1997; presidiu a comissão especial para acompanhar a\nimplantação do fundo de valorização do magistério e da Lei n^o^\n9.394/1996, Lei de Diretrizes e Bases da Educação (LDB), no âmbito do\nEstado do Rio de Janeiro, e atuou como segundo-vice-presidente da ALERJ\nentre os anos de 1997 e1998. Foi autor de oito resoluções legislativas,\nentre elas a de n^o^ 42, de autoria compartilhada com Carlos Minc,\nMarcelo Dias e Tânia Rodrigues, apresentada em 1995, que autorizava a\nmesa diretora a instalar sistema eletrônico de votação no plenário da\nALERJ.\n\nO jornal *O Dia* em 1997 considerou o deputado como um dos três melhores\ndo ano. No ano seguinte, entre as leis de que foi autor, destacamos a de\nn^o^ 2.929, de autoria compartilhada com Carlos Minc, Heloneida Studart,\nMarcelo Dias e Tânia Rodrigues,que dispunha sobre a colocação de\nfolhetos explicativos sobre a prevenção da AIDS e fornecimento de\npreservativos em hotéis, motéis e similares no estado do Rio de Janeiro.\nNo último ano de sua gestão como deputado estadual do Rio de Janeiro,\n1999, Neirobis foi condecorado pela ALERJ com a Medalha Tiradentes,\nresolução de autoria do deputado André Ceciliano. Ainda neste ano\nexerceu o cargo de agente de Desenvolvimento Regional da Secretaria de\nEstado de Agricultura, Abastecimento, Pesca e Desenvolvimento do\nInterior no Município de Angra dos Reis.\n\n*Ana Beatriz Paes*\n\nFONTES: ASSEMB. LEGISL RJ. *Deputados estaduais fluminenses*. Sexta\nlegislatura (1995-1999); ASSEMB. LEGISL. RJ. Disponível em:\n\\<http://alerjln1.alerj.rj.gov.br\\>; ASSEMB. LEGISL. RJ. *Documentos*;\nJuventude PT Angra dos Reis. Disponível em:\n\\<http://juventudeptangra.blogspot.com/2010/03/neirobis-nagae-uma-reflexao-sobre.html\\>.\n","ref":"FONTES: ASSEMB. LEGISL RJ. *Deputados estaduais fluminenses*. Sexta\nlegislatura (1995-1999); ASSEMB. LEGISL. RJ. Disponível em:\n\\<http://alerjln1.alerj.rj.gov.br\\>; ASSEMB. LEGISL. RJ. *Documentos*;\nJuventude PT Angra dos Reis. Disponível em:\n\\<http://juventudeptangra.blogspot.com/2010/03/neirobis-nagae-uma-reflexao-sobre.html\\>.\n","dic":"DPRRJ"}
