{"title":"NASCIMENTO, Nestor José do","cargoss":["Deputado Estadual","Deputado Estadual"],"cargos_esp":["GB",0],"datas_ini":[1971,1975],"datas_fim":[1974,1979],"estados":[0,"RJ"],"autor":[0],"content":"**NASCIMENTO, Nestor José do**\n\n\\* dep. est. GB 1971-1974; dep. est. RJ 1975-1979.\n\n*Nestor José do Nascimento* nasceu em São João do Meriti (RJ) em 9 de\nfevereiro de 1936.\n\nIngressou na política estadual ao ser eleito deputado pelo Movimento\nDemocrático Brasileiro (MDB) no pleito de 15 de novembro de 1970.\nAssumiu sua cadeira na Assembleia Legislativa em 1^o^ de fevereiro de\n1971.\n\nReeleito para a legislatura seguinte, permaneceu no desempenho de suas\nfunções até 31 de janeiro de 1975 quando, em função da Lei n^o^ 20, de\n1^o^ de julho de 1974 – promulgada pelo presidente Ernesto Geisel –, que\nreunia os estados da Guanabara e do Rio de Janeiro, foi impedido de\nassumir imediatamente o cargo de deputado estadual para o qual fora\neleito em 15 de novembro de 1974. Os candidatos eleitos nesse pleito\nsomente assumiram sua cadeira no Legislativo estadual em 15 de março de\n1975. Durante essa legislatura propôs a Lei n^o^ 51, de 9 de junho de\n1976, que instituiu o dia 13 de maio como o dia da polícia militar no\ncalendário de datas comemorativas do estado do Rio de Janeiro.\nPermaneceu no Legislativo estadual até 31 de janeiro de 1979.\n\nTambém foi advogado e juiz.\n\n*Ioneide Piffano Brion de Souza*\n\nFONTES: ASSEMB. LEGISL. GB. *Anais* (1974); ASSEMB. LEGISL. RJ.\nDisponível em: \\<www.alerj.rj.gov.br/arquivo.htm\\>. Acesso em:\n20/3/2011; REZENDE, L. *Pensamento*.\n","ref":"FONTES: ASSEMB. LEGISL. GB. *Anais* (1974); ASSEMB. LEGISL. RJ.\nDisponível em: \\<www.alerj.rj.gov.br/arquivo.htm\\>. Acesso em:\n20/3/2011; REZENDE, L. *Pensamento*.\n","dic":"DPRRJ"}
