{"title":"NICOLAU, José","cargoss":["Deputado Estadual"],"cargos_esp":[0],"datas_ini":[1983],"datas_fim":[1987],"estados":["RJ"],"autor":["Luciana Pinheiro"],"content":"**NICOLAU, José**\n\n\\* dep. est. RJ 1983-1987.\n\n*José Antônio Vieira Nicolau* nasceu no Rio de Janeiro, então Distrito\nFederal, no dia 13 de fevereiro de 1960.\n\nEmpresário, cursou faculdade de Comunicação Social.\n\nNo ano de 1984 participou ativamente da criação do Comitê Pró-Tancredo\nNeves, do qual foi coordenador. Nas eleições realizadas em novembro de\n1986 elegeu-se deputado estadual fluminense pela legenda do então\nPartido Liberal (PL), atual Partido da República (PR). Em fevereiro de\n1987 tomou posse de uma cadeira na Assembleia Legislativa do Rio de\nJaneiro (ALERJ). Na ALERJ atuou como vice-líder da Bancada do PL até o\nmês de novembro, quando se tornou filiado ao Partido Socialista (PS),\nsendo escolhido líder da bancada do partido.\n\nNo decorrer de sua gestão como legislador fluminense, até janeiro de\n1991, exerceu ainda as funções de vice-presidente da comissão de\nEconomia, Indústria e Comércio, além de ter sido suplente da Comissão\nParlamentar de Inquérito (CPI) criada na Casa Legislativa para apurar o\nabastecimento de água na cidade do Rio de Janeiro pela Companhia\nEstadual de Águas e Esgotos (CEDAE).\n\nNas eleições gerais de outubro de 2002 candidatou-se ao cargo de\ndeputado federal pela legenda do PR e conquistou 3.712 votos, sendo\neleito suplente. Concorreu a novo cargo eletivo no pleito municipal de\n2008, quando foi candidato a vereador da cidade do Rio de Janeiro pela\nlegenda do Partido Progressista (PP). Nessa ocasião obteve 1.952 votos,\nque lhe garantiram a suplência na Câmara carioca.\n\nAo longo de sua trajetória profissional atuou ainda como diretor de\nPatrimônio da Associação Comercial de Marechal Hermes, bairro do Rio de\nJaneiro. Por sua atuação no ramo empresarial José Antônio Vieira Nicolau\nrecebeu o prêmio “D. Quixote” de empresário do ano, oferecido pela\nrevista *Polícia em Ação*.\n\n*Luciana Pinheiro*\n\nFONTES: ASSEMB. LEGISL. RJ. *Deputados estaduais fluminenses*. Quarta\nlegislatura (1987-1991); TRIB. SUP. ELEIT. Disponível em:\n\\<www.tse.gov.br/internet/index.html\\>. Acesso em: 11/11/2010; Vote\nBrasil. Disponível em: \\<www.votebrasil.com\\>. Acesso em: 11/11/2010.\n","ref":"FONTES: ASSEMB. LEGISL. RJ. *Deputados estaduais fluminenses*. Quarta\nlegislatura (1987-1991); TRIB. SUP. ELEIT. Disponível em:\n\\<www.tse.gov.br/internet/index.html\\>. Acesso em: 11/11/2010; Vote\nBrasil. Disponível em: \\<www.votebrasil.com\\>. Acesso em: 11/11/2010.\n","dic":"DPRRJ"}
