{"title":"NORA, Bruno José dos Santos","cargoss":["Deputado Estadual"],"cargos_esp":[0],"datas_ini":[1895],"datas_fim":[1897],"estados":["RJ"],"autor":[0],"content":"**NORA, Bruno José dos Santos**\n\n\\* dep. est. RJ 1895-1897.\n\n*Bruno José dos Santos Nora* candidatou-se a deputado estadual no Rio de\nJaneiro, nas eleições realizadas em 20 de maio de 1895, na chapa oficial\ndo Partido Republicano Fluminense (PRF), liderado por José Tomás da\nPorciúncula, ex-presidente do estado do Rio de Janeiro (1892-1894) e\nentão deputado federal (1895-1897). Sob a liderança de Porciúncula, o\nPRF, partido representante dos setores majoritários da oligarquia\nfluminense, exerceu hegemonia no Executivo e Legislativo estadual.\nElegeu-se pelo quinto distrito eleitoral, com sede em Resende (RJ).\n\nAinda em 1897, ano final da legislatura, Bruno José dos Santos Nora foi\neleito membro da Comissão de Força Pública da Assembleia Legislativa do\nEstado do Rio de Janeiro (ALERJ).\n\nNa eleição para a Câmara dos Deputados em dezembro de 1899 lançou-se\ncandidato pelo quinto distrito, mas perdeu para a facção governista. Os\ndeputados federais eleitos eram majoritariamente partidários do então\npresidente do estado do Rio de Janeiro Alberto Torres (1897-1900) e em\njulho de 1899 fundaram o Partido Republicano do Rio de Janeiro (PRRJ),\nse reunindo fora dos quadros partidários do PRF.\n\nNas eleições de 1900 para o governo estadual foi indicado pelo PRF para\nser vice-presidente na chapa encabeçada por Quintino Bocaiúva, mas seu\nnome não foi consolidado para a disputa.\n\n*Samuel Silva Rodrigues de Oliveira*\n\nFONTES: ASSEMB. LEGISL. RJ. *Anais* (1895, 1897); FERREIRA, M.\n*República*.\n","ref":"FONTES: ASSEMB. LEGISL. RJ. *Anais* (1895, 1897); FERREIRA, M.\n*República*.\n","dic":"DPRRJ"}
