{"title":"NOVELA, Manuel","cargoss":["Deputado Estadual"],"cargos_esp":["GB"],"datas_ini":[1963],"datas_fim":[1964],"estados":[0],"autor":[0],"content":"**NOVELA, Manuel**\n\n\\* dep. est. GB 1963-1964.\n\n*Manuel Novela da Silva Júnior* nasceu no Rio de Janeiro, então Distrito\nFederal, no dia 2 de setembro de 1913.\n\nEntrou para a Polícia de Vigilância do Distrito Federal em 1935, quando\no órgão era chefiado pelo então major do exército Zenóbio da Costa.\nManuel Novela era o guarda n^o^ 405 da corporação, criada em 22 de maio\nde 1934 para substituir e exercer as funções que até então cabiam à\nGuarda Noturna do Distrito Federal.\n\nCandidatou-se e foi eleito vereador da Câmara Municipal do Distrito\nFederal pela legenda do Partido Democrata Cristão (PDC) nas eleições de\noutubro de 1954. Suas bases eleitorais vinham da Polícia de Vigilância,\nde cuja União dos Guardas ele era presidente, e de bairros da zona norte\nda cidade, como Piedade, Engenho da Rainha, Engenho Novo, Sampaio e\nMéier, onde residia. Em 1955 foi membro da Comissão de Administração e\nem 1956 integrou a Comissão de Agricultura, da qual renunciaria para\nassumir vaga na Comissão Especial de Internamento de Menores. Em 1957\nfoi escolhido quarto secretário da Mesa Diretora da Câmara. Em maio\ndesse ano deixou o PDC em protesto contra o fato de a sua colega de\npartido, vereadora Dulce Magalhães, ter sido contrária ao projeto de lei\nque visava conceder aposentadoria aos membros da Polícia de Vigilância\nque completassem 25 anos de serviço, demanda essa que era uma das\nprincipais bandeiras do seu mandato de vereador. No mês de outubro\nentrou para o Partido Social Trabalhista (PST). Na sessão legislativa de\n1958 integrou a Comissão de Administração, Trabalho e Assistência\nSocial; deixou o PST e foi para o Partido Republicano Trabalhista (PRT),\ndo qual se tornou vice-líder na Câmara.\n\nNa sessão legislativa de 1960 integrou a Comissão de Economia e\nFinanças. Em 21 de abril daquele mesmo ano, em virtude da lei que criava\no estado da Guanabara, a Câmara do Distrito Federal passou a ser a\nAssembleia Legislativa do Estado da Guanabara, que coexistiria com a\nAssembleia Constituinte a ser formada nas eleições estaduais de outubro\ndaquele ano. O agora deputado Manuel Novela tornou-se então líder do\nPartido Rural Trabalhista (PRT, nova designação do Partido Republicano\nTrabalhista após 1958) na assembleia e, como tal, declarou o afastamento\nde seu partido da maioria parlamentar, de modo a manter-se independente\nem relação ao Governo Provisório da Guanabara, chefiado por José Sete\nCâmara Filho. No entanto, em 21 de março de 1961, quando da promulgação\nda Constituição da Guanabara, a Assembleia Constituinte declarou a\nextinção da assembleia formada pela antiga Câmara do Distrito Federal,\nencerrando assim o mandato de seus membros.\n\nNas eleições de outubro de 1962 para o Legislativo do novo estado,\nManuel Novela candidatou-se a deputado estadual na Guanabara pela\nlegenda do PRT e foi eleito com 4.475 votos. Nesse período sua atuação\nparlamentar continuou voltada para a Polícia de Vigilância, em questões\ncomo a aposentadoria de seus membros, reformas estruturais na\ninstituição, concessões de pensão a viúvas de policiais mortos em\nserviço e o pagamento de adicional por risco de vida; e às necessidades\ndos bairros por ele representados, em termos de serviços públicos como\ncoleta de lixo, transporte, iluminação, entre outros. Além disso, também\nprocurava atender ao funcionalismo público estadual de maneira geral.\nCoerentemente com a posição de neutralidade assumida pelo partido por\nele liderado, seu relacionamento com o governo Lacerda variava de acordo\ncom a recepção dada pelo Executivo estadual a essas demandas;\nentretanto, causou-lhe especial frustração a escolha do coronel\nDeschamps para o comando da Polícia de Vigilância, oficial do Exército\naquele que Manuel Novela considerava um “grande general”, mas “péssimo”\nchefe de polícia. Em abril de 1963 recusou uma indicação para a Comissão\nde Economia e Finanças, alegando falta de tempo para participar do\ntrabalho das comissões; por motivo de doença, ausentou-se várias vezes\nda assembleia.\n\nNa sessão legislativa de 1964 passou a ocupar a vice-liderança do PST na\nassembleia e foi eleito primeiro-secretário da Mesa Diretora.\n\nFaleceu no dia 20 de maio de 1964, em pleno exercício do mandato.\n\nFoi casado com Otília Gonçalves Novela, com quem teve uma filha, Neli\nNovela da Silva Calheiros.\n\n*Paulo Celso Corrêa*\n\nFONTES: ASSEMB. LEGISL. GB. *Anais*; CÂM. DF. *Anais*; *Dia*\n(21/4/1964).\n","ref":"FONTES: ASSEMB. LEGISL. GB. *Anais*; CÂM. DF. *Anais*; *Dia*\n(21/4/1964).\n","dic":"DPRRJ"}
