{"title":"NUNES, Francisco da Costa","cargoss":["Prefeito","Prefeito"],"cargos_esp":["Campos","Campos"],"datas_ini":[1937,1933],"datas_fim":[1939,1936],"estados":[0,0],"autor":["Raimundo Helio Lopes"],"content":"**NUNES, Francisco da Costa**\n\n\\* pref. Campos 1933-1936, 1937-1939.\n\n*Francisco da Costa Nunes* foi engenheiro.\n\nChegou à cidade de Campos (RJ) na coluna liderada por Gwyer de Azevedo,\no primeiro contingente a invadir o Rio de Janeiro, saindo do norte do\nestado, durante o movimento revolucionário iniciado em outubro de 1930.\nCom a vitória do movimento, fixou-se em Campos e foi nomeado, pelo\ninterventor do estado do Rio de Janeiro Ari Parreiras (1931-1935),\nprefeito dessa cidade em 1933. Em 1936 afastou-se da prefeitura, mas\nretornou pouco depois, já em 1937, e permaneceu até 1939.\n\nFoi casado com Arlete da Costa Nunes.\n\n*Raimundo Helio Lopes*\n\nFONTES: **CÂM. MUN. CAMPOS GOYTACAZES. Disponível em:\n\\<**www.camaracampos.rj.gov.br/historia\\_camara.php\\>. Acesso em:\n26/5/2011; CARVALHO, W. *Depois*; Instituto Historiar. Disponível em:\n\\<www.institutohistoriar.blogspot.com\\>. Acesso em: 26/5/2011.\n","ref":"FONTES: **CÂM. MUN. CAMPOS GOYTACAZES. Disponível em:\n\\<**www.camaracampos.rj.gov.br/historia\\_camara.php\\>. Acesso em:\n26/5/2011; CARVALHO, W. *Depois*; Instituto Historiar. Disponível em:\n\\<www.institutohistoriar.blogspot.com\\>. Acesso em: 26/5/2011.\n","dic":"DPRRJ"}
