{"title":"OEST, Lincoln Cordeiro","cargoss":["Revolucionário ou revoltoso","Constituinte","Deputado Estadual"],"cargos_esp":[0,"est",0],"datas_ini":[1935,1947,1947],"datas_fim":[1935,1947,1948],"estados":[0,"RJ","RJ"],"autor":[0],"content":"**OEST, Lincoln Cordeiro**\n\n\\* rev. 1935; const. est. RJ 1947; dep. est. RJ 1947-1948.\n\n*Lincoln Cordeiro Oest* nasceu no Rio de Janeiro, então Distrito\nFederal, filho de Edmundo Oest e de Esequiela Cordeiro Oest. Seu irmão,\nHenrique Cordeiro Oest, foi revolucionário em 1922 e deputado federal\npelos estados do Rio de Janeiro (1947-1948) e de Alagoas (1963). Durante\na infância, residiu em Vassouras (RJ).\n\nFiliado à Aliança Nacional Libertadora (ANL), organização política de\nâmbito nacional fundada em março de 1935 com um programa que propunha a\nluta contra o fascismo, o imperialismo, o latifúndio e a miséria,\nparticipou em novembro do mesmo ano da Revolta Comunista.\n\nFinda a ditadura do Estado Novo (1937-1945), nas eleições de dezembro de\n1945 para a Assembleia Nacional Constituinte elegeu-se primeiro suplente\nde deputado pelo estado do Rio de Janeiro na legenda do Partido\nComunista Brasileiro, então chamado Partido Comunista do Brasil (PCB),\nmas não chegou a assumir o mandato.\n\nNas eleições de 19 de janeiro de 1947, sempre na legenda do PCB, foi\neleito deputado à Assembleia Constituinte do Estado do Rio de Janeiro.\nTomou posse no mês seguinte e, depois de promulgada a Constituição\nestadual no mês de julho, passou a exercer o mandato ordinário na\nAssembleia Legislativa do Estado do Rio de Janeiro (ALERJ). Foi\nsegundo-secretário da Mesa da Constituinte, assim como da ALERJ. Em sua\natividade parlamentar defendeu as populações carentes do estado,\npronunciou discurso em homenagem ao aniversário do levante do Forte de\nCopacabana (1922) e à participação da Força Expedicionária Brasileira\n(FEB) na Segunda Guerra Mundial, protestou contra a cassação do registro\ndo PCB (7 de maio de 1947) e a possibilidade de cassação do mandato dos\nseus representantes, e criticou os ataques cometidos contra a sede do\npartido no estado. De fato, assim como os outros cinco deputados da\nALERJ eleitos pelo PCB, teve o mandato cassado por determinação do\nTribunal Superior Eleitoral (TSE). No dia 12 de janeiro de 1948 ocorreu\na última sessão da qual os deputados comunistas participaram na\nAssembleia Legislativa.\n\nApós se afastar da ALERJ, visitou diversos países socialistas e manteve\ncontato com líderes chineses, como Chu En-Lai e Mao Tsé-Tung. Em 1957,\nfoi preso com farta documentação do comitê central do PCB. Em 1960, foi\num dos afastados do comitê central do PCB por discordar da nova\norientação do partido, expressa na *Declaração de março*, tomada no\ncongresso de 1958 e então reiterada. Ao lado de outros militantes,\nconsiderou a nova estratégia, de “caminho pacífico para o socialismo”,\n“de orientação abertamente revisionista”, na medida em que renegava a\nluta revolucionária e os princípios do marxismo-leninismo e do\ninternacionalismo proletário.\n\nComo desde o final da década de 1950 o PCB vinha atuando de forma\nsemilegal, seus dirigentes empreenderam uma campanha para a obtenção do\nregistro do partido junto ao Tribunal Superior Eleitoral (TSE). Com esse\nobjetivo, na conferência nacional de 1961 foi decidido que o PCB\npassaria a se chamar Partido Comunista Brasileiro, nome que atestaria o\ncaráter nacional da organização, já que um dos argumentos utilizados\npara a cassação de seu registro em 1947 fora o de que o partido era\nvinculado à União Soviética, conforme indicava o nome Partido Comunista\n*do* Brasil. Lincoln Oest e os outros membros do grupo que fora afastado\ndo comitê central se opuseram a essa decisão e divulgaram uma carta com\ncem assinaturas, conhecida como a *Carta dos cem*, o que levou à sua\nexpulsão das fileiras do partido.\n\nEm fevereiro de 1962, o mesmo grupo convocou uma conferência nacional\nextraordinária de oposição ao “partido prestista” e fundou uma nova\norganização com o nome de Partido Comunista do Brasil e a sigla PCdoB,\npara se distinguir do PCB. Lincoln Oest passou então a integrar o comitê\ncentral do PCdoB. Fez parte ainda da Comissão de Solidariedade a Cuba,\nalém de organizar a Comissão Cultural Brasil–Coreia do Norte. Em março\nde 1963, ao lado de João Amazonas, visitou a China e teve reuniões com o\npróprio Mao Tsé-Tung.\n\nEm abril de 1964, após o movimento político-militar de 31 de março, teve\nseu nome incluído – assim como seu irmão – na lista dos que tiveram os\ndireitos políticos cassados pelo Ato Institucional n^o^ 1, editado no\ndia 9 daquele mês. Passou então a viver na clandestinidade, e no ano\nseguinte teve um mandado de prisão emitido em São Paulo.\n\nEm junho de 1966, o PCdoB realizou sua VI Conferência Nacional, para se\ncontrapor ao VI Congresso do PCB, e aprovou novos estatutos, além de uma\nresolução que conclamava “a união dos brasileiros para libertar a nação\nda ditadura e da ameaça neocolonialista”. A VI Conferência aprovou ainda\ncomo estratégia de ação a organização de núcleos no campo para o início\ndo movimento revolucionário. Partindo do princípio de que o Brasil,\n“embora uma nação única, contém em si dois brasis: o do interior e o das\ngrandes cidades”, as teses apresentadas viam no interior um imenso\npotencial a ser mobilizado.\n\nApós a VI Conferência, ocorreu uma cisão no PCdoB. À direção do partido\ncontrapôs-se um grupo que defendia a tática do foco, preconizada pelo\nfrancês Régis Debray. Tal tática consistia em formar pequenos núcleos\nrevolucionários, os focos guerrilheiros da zona rural, os quais não só\ncentralizariam a iniciativa militar contra os exércitos regulares, como\ndeteriam a direção política do processo. Considerando que a ideia do\nfoco rompia com a visão clássica de partido de vanguarda e implicava uma\nvisão pequeno-burguesa da revolução tanto na esfera política como na\nesfera militar e organizativa, o comitê central do PCdoB criticou\nduramente a negação do partido como força dirigente do movimento\nrevolucionário e a atribuição desse papel aos núcleos guerrilheiros.\nOutra crítica do comitê central era que uma tática baseada em pequenos\ngrupos levaria ao desligamento do movimento de massas. Finalmente, a\ndireção do PCdoB declarou-se contrária à concepção de uma revolução\ncontinental única que não levasse em conta as características e as\netapas vividas por cada país. O grupo “foquista” foi então expulso do\nPCdoB, vindo a constituir a Ala Vermelha, que influiria na formação de\noutras organizações baseadas na mesma estratégia.\n\nEntre 1966 e 1967 o PCdoB passou a organizar núcleos de guerrilha no\ninterior do país, deslocando seus melhores quadros, constituídos de\nestudantes e operários do Rio de Janeiro e de São Paulo, para a região\ndo Araguaia, no sul do Pará. A ideia era transferir todo o comitê\ncentral para esse núcleo, que chegou a contar com 70 participantes,\nentre os quais Lincoln Oest.\n\nEm 1968, Lincoln Oest se encontrava clandestino em São Paulo quando foi\npreso. Ficou 18 dias detido no Departamento Estadual de Ordem Política e\nSocial de São Paulo (DEOPS/SP) e, após ser torturado, foi posto em\nliberdade por ausência de acusações.\n\nEm 1972, o Exército descobriu o núcleo do PCdoB no Araguaia e iniciou os\npreparativos para erradicá-lo da região. As tropas enviadas – o que\nchegou a implicar a abertura de estradas – eliminaram 50 guerrilheiros.\nNo mesmo período, teve início a perseguição do governo aos membros do\ncomitê central do PCdoB. Lincoln Oest, que se encontrava no Rio de\nJaneiro, foi preso em dezembro por agentes do Destacamento de Operações\nde Informações–Centro de Operações de Defesa Interna (DOI-CODI/RJ).\nSegundo relatório do Ministério da Aeronáutica e da Marinha, morreu em\ntiroteio no momento da prisão, no dia 20 de dezembro, mas, de acordo com\ndepoimentos de ex-presos políticos, foi torturado até a morte. Em 1973 o\nComitê de Solidariedade aos Presos Políticos do Brasil denunciou sua\nmorte sob tortura, assim como de outros presos políticos, através de\nrelatório entregue à Conferência Nacional dos Bispos do Brasil (CNBB).\nEm 1995 a Comissão dos Familiares dos Mortos e Desaparecidos Políticos\nproduziu novo relatório, e posteriormente sua família recebeu\nindenização do governo por sua morte.\n\nCasado, teve uma filha.\n\n*Vicente Saul Moreira dos Santos*\n\nFONTES: ASSEMB. CONST. RJ. *Anais* (1947); ASSEMB. LEGISL. RJ. *Anais*\n(1947); *Ato Institucional* (9/4/1964); *Correio da Manhã* (27/8/1968);\nDesaparecidos Políticos. Disponível em:\n\\<www.desaparecidospoliticos.org.br\\>; *Diário Oficial do Estado do Rio\nde Janeiro* (29/6/2010); *Folha de S.Paulo* (27/4/1978); TELES, J.\n*Mortos*; Tortura Nunca Mais. Disponível em:\n\\<www.torturanuncamais-rj.org.br\\>.\n","ref":"FONTES: ASSEMB. CONST. RJ. *Anais* (1947); ASSEMB. LEGISL. RJ. *Anais*\n(1947); *Ato Institucional* (9/4/1964); *Correio da Manhã* (27/8/1968);\nDesaparecidos Políticos. Disponível em:\n\\<www.desaparecidospoliticos.org.br\\>; *Diário Oficial do Estado do Rio\nde Janeiro* (29/6/2010); *Folha de S.Paulo* (27/4/1978); TELES, J.\n*Mortos*; Tortura Nunca Mais. Disponível em:\n\\<www.torturanuncamais-rj.org.br\\>.\n","dic":"DPRRJ"}
