{"title":"OLIVEIRA FILHO, Ubaldo de","cargoss":["Deputado Estadual"],"cargos_esp":[0],"datas_ini":[1979],"datas_fim":[1983],"estados":["RJ"],"autor":["Juliana Gagliardi"],"content":"**OLIVEIRA FILHO, Ubaldo de**\n\n\\* dep. est. RJ 1979-1983.\n\n*Ubaldo da Silva de Oliveira Filho* nasceu em 31 de dezembro de 1943,\nfilho de Ubaldo da Silva Oliveira e de Isaura Costa de Oliveira. Seu pai\nfoi deputado estadual na Guanabara entre 1963 e 1967 e representante do\ngrupo ligado a Chagas Freitas na Zona Oeste da cidade do Rio de Janeiro.\nSua irmã, Nadir de Oliveira, foi deputada estadual na Guanabara\n(1971-1975) e no Rio de Janeiro (1975-1979).\n\nEm 1978, candidatou-se a deputado estadual no Rio de Janeiro na legenda\ndo Movimento Democrático Brasileiro (MDB) e foi eleito. Assumiu o\nmandato em fevereiro de 1979 e, com o fim do bipartidarismo em novembro\nseguinte e a posterior reformulação partidária, filiou-se ao Partido do\nMovimento Democrático Brasileiro, herdeiro político do MDB. Nas eleições\nde 1982 e de 1986 candidatou-se novamente a deputado estadual na legenda\ndo PMDB, mas não conseguiu se eleger.\n\n*Juliana Gagliardi*\n\nFONTES: ASSEMB. LEGISL. RJ. *ALERJ: informações*; CARDIANO, F.\n*Eleições*; TRIB. REG. ELEIT. *Eleições* (15/11/1982).\n","ref":"FONTES: ASSEMB. LEGISL. RJ. *ALERJ: informações*; CARDIANO, F.\n*Eleições*; TRIB. REG. ELEIT. *Eleições* (15/11/1982).\n","dic":"DPRRJ"}
