{"title":"OLIVEIRA JÚNIOR, Joaquim Luís César de","cargoss":["Constituinte","Deputado Estadual"],"cargos_esp":["est",0],"datas_ini":[1891,1891],"datas_fim":[1891,1891],"estados":["RJ","RJ"],"content":"**OLIVEIRA JÚNIOR, Joaquim Luís César de**\n\n\\* const. est. RJ 1891; dep. est. RJ 1891.\n\n*            Joaquim Luís César de Oliveira Júnior* elegeu-se deputado\nestadual nas primeiras eleições realizadas após a proclamação da\nRepública (15/11/1889) para a formação da Assembleia Constituinte\nfluminense. Esse pleito, realizado em 20 de março de 1891, foi vencido\npelos partidários do presidente do estado do Rio de Janeiro, Francisco\nPortela (1889-1891), nomeado pelo presidente da República, marechal\nDeodoro da Fonseca (1889-1891). Os portelistas derrotaram os candidatos\ndo Partido Republicano, de oposição ao governo, liderados por José Tomás\nda Porciúncula.\n\nNa Constituinte estadual, reunida a partir de 10 de maio, Joaquim Luís\nCésar de Oliveira Júnior e os demais deputados promulgaram a primeira\nConstituição republicana fluminense e elegeram Portela presidente\nconstitucional. As sessões ordinárias desse ano se encerraram em\nnovembro, mesmo mês em que Deodoro da Fonseca renunciou ao governo da\nRepública, transferindo-o ao vice-presidente Floriano Peixoto. Diante\ndesse conturbado contexto político, no dia 10 de dezembro, Portela\nrenunciou à presidência do estado do Rio de Janeiro por não ter mais o\napoio do poder federal. Seu sucessor, Carlos Baltasar da Silveira\n(1891-1892), revogou a Constituição republicana fluminense, fechou o\nCongresso estadual e convocou uma nova Assembleia Constituinte. Diante\ndisso, Joaquim Luís César de Oliveira Júnior perdeu o mandato.\n\n*Samuel Silva Rodrigues de Oliveira*\n\nFONTE: FERREIRA, M. *República*.\n","ref":"","dic":"DPRRJ"}
