{"title":"OLIVEIRA, Aluísio","cargoss":["Deputado Estadual"],"cargos_esp":[0],"datas_ini":[1987],"datas_fim":[1995],"estados":["RJ"],"autor":["Isadora Tavares Maleval"],"content":"**OLIVEIRA, Aluísio**\n\n\\* dep. est. RJ 1987-1995.\n\n*Aluísio Oliveira Trindade* nasceu no Rio de Janeiro, então Distrito\nFederal, no dia 23 de julho de 1951.\n\nFormou-se em direito. Foi funcionário público e professor de educação\nfísica.\n\nIniciou sua trajetória política em 1982, quando foi eleito vereador na\ncidade do Rio de Janeiro, tendo assumido no ano seguinte o mandato para\na legislatura 1983-1986. Elegeu-se, em seguida, deputado estadual pela\nprimeira vez em 1986, para a legislatura 1987-1991, e se reelegeu no\npleito de 1990, para a legislatura 1991-1995, sempre na legenda do\nPartido Democrático Trabalhista (PDT).\n\nNa Assembleia Legislativa do Estado do Rio de Janeiro (ALERJ) foi\nvice-líder da bancada do PDT em 1987. Presidiu a Comissão de Controle do\nMeio Ambiente e de Defesa Civil e integrou as comissões de Constituição\ne Justiça, de Agricultura e Política Rural, de Redação, de Indicações\nLegislativas e Proposições Externas e de Cultura. Também foi membro da\nComissão Parlamentar de Inquérito (CPI) criada para apurar\nirregularidades na Secretaria de Estado de Polícia Civil e presidiu a\nCPI que apurou as causas do aumento da migração interna e da diminuição\nda produção agrícola.\n\nDurante o segundo mandato integrou a Comissão de Defesa dos Direitos\nHumanos e foi suplente da Comissão de Orçamento, Finanças e Tributação.\n\nFoi condecorado, em 1986, com a medalha Pedro Ernesto, oferecida pela\nCâmara Municipal do Rio de Janeiro.\n\n*Isadora Tavares Maleval*\n\nFONTES: ASSEMB. LEGISL. RJ. *Deputados estaduais fluminenses*. Quarta\nlegislatura (1987-1991), Quinta legislatura (1991-1994); *Globo*\n(19/10/1990).\n","ref":"FONTES: ASSEMB. LEGISL. RJ. *Deputados estaduais fluminenses*. Quarta\nlegislatura (1987-1991), Quinta legislatura (1991-1994); *Globo*\n(19/10/1990).\n","dic":"DPRRJ"}
