{"title":"OLIVEIRA, Ubaldo de","cargoss":["Deputado Estadual"],"cargos_esp":["GB"],"datas_ini":[1963],"datas_fim":[1967],"estados":[0],"autor":[0],"content":"**OLIVEIRA, Ubaldo de**\n\n\\* dep. est. GB 1963-1967.\n\n*Ubaldo da Silva Oliveira* nasceu no Rio de Janeiro, então Distrito\nFederal, em 16 de maio de 1913.\n\nNascido e criado em Bangu, bairro da zona oeste que fazia parte da\nchamada zona rural da cidade, em 1933 trabalhava como prático de\nenfermagem no Hospital Rocha Faria, em Campo Grande, quando conheceu o\npadre Olímpio de Melo, membro da Liga Eleitoral Católica, com o qual\niniciou sua carreira política. Em 1936, passou a trabalhar como fiscal\ndo Departamento de Rendas Mercantis do Distrito Federal. Também\ndesenvolveu várias outras atividades em Bangu, como presidir uma\ncooperativa agrícola (1951) e o clube esportivo Ceres (desde 1948) e ser\ndono de uma fábrica de tecidos com cerca de oito mil funcionários.\n\nNas eleições municipais de novembro de 1958, foi eleito vereador no\nDistrito Federal na legenda do Partido Social Progressista (PSP). Suas\nbases eleitorais estavam nos bairros de Bangu, Realengo, Padre Miguel,\nSenador Camará e outros da zona rural, a favor dos quais atuava na\nCâmara Municipal. Suas principais reivindicações se referiam à falta ou\nà deficiência de serviços básicos naquela região, como telefonia,\nhospitais, abastecimento de gêneros alimentícios e escolas. Na sessão\nlegislativa de 1959, foi vice-presidente da Comissão de Agricultura,\nIndústria e Comércio e integrou a comissão especial incumbida de\ninvestigar a situação dos loteamentos no Distrito Federal, da qual seria\npresidente a partir de setembro. Em fevereiro de 1960, deixou o PSP e\nfoi para o Partido Social Democrático (PSD) para apoiar a candidatura à\npresidência da República do marechal Henrique Lott. Nessa sessão\nlegislativa daquele ano, foi segundo secretário da mesa diretora, função\nà qual renunciaria em poucos meses após o presidente da mesa se recusar\na assinar uma proposição de sua autoria.\n\nEm 21 de abril de 1960, com a elevação da Câmara dos Vereadores do\nDistrito Federal a Assembleia Legislativa em virtude da criação do\nestado da Guanabara, os vereadores transformaram-se em deputados\nestaduais. Em outubro seguinte realizaram-se eleições para a Assembleia\nConstituinte e para o governo da Guanabara, vencidas estas por Carlos\nLacerda, da União Democrática Nacional (UDN). No dia 21 de março de\n1961, quando da promulgação da Constituição da Guanabara, a Assembleia\nConstituinte decidiu a extinção da Assembleia Legislativa criada a\npartir da Câmara Municipal do Distrito Federal, bem como do mandato de\nseus deputados. Após o encerramento brusco de seu mandato, Ubaldo de\nOliveira foi eleito deputado estadual na Guanabara nas eleições de\noutubro de 1962, na legenda do Partido Social Trabalhista (PST).\n\nNa legislatura iniciada em fevereiro de 1963, suas principais\nreivindicações foram a criação de mais um hospital infantil em Bangu,\npois o que existia graças à sua iniciativa, o Hospital Valdir Franco,\nfora convertido em posto de saúde; a construção de mais escolas de modo\na eliminar a superlotação das salas de aula; a ampliação das linhas de\ntrem e ônibus que atendiam à zona rural; a construção de um viaduto em\nPadre Miguel. Reclamou várias vezes do caráter eleitoreiro do\nplanejamento de obras do governo Lacerda, a quem acusava de não ter\nrespeito nem consideração pela Assembleia Legislativa. A partir do final\nde 1963, declarou seu apoio às reformas de base pretendidas pelo\npresidente da República João Goulart, especialmente a reforma agrária,\ndesde que feita sob “espírito cristão”. Na sessão legislativa de 1964,\nfoi presidente da Comissão de Educação, Saúde e Assistência Social e\nsuplente das comissões de Constituição e Justiça e de Orçamento e\nFinanças. Defendeu também João Goulart das críticas feitas ao comício da\nCentral do Brasil em 13 de março de 1964, negando que fosse um evento\n“comunista”, como diziam os “reacionários do IBAD” (Instituto Brasileiro\nde Ação Democrática) e os deputados cujas campanhas haviam sido\nfinanciadas por aquele órgão.\n\nApós o movimento político-militar de 31 de março, que depôs João\nGoulart, assumiu a liderança do PST na Assembleia Legislativa do Estado\ndo Rio de Janeiro (ALERJ) em virtude da cassação do então líder,\ndeputado Sinval Palmeira, e atribuiu a queda de Goulart à presença de\nelementos desleais e mal-intencionados ao seu redor. Diante dos boatos\nsobre a cassação de seu mandato, reafirmou seu anticomunismo, em virtude\nde seu catolicismo de congregado mariano: “Se me encontro na oposição é\npor não concordar com o governo da Guanabara, pois este governo não tem\ncorrespondido aos anseios da população dos subúrbios”. No entanto,\nafirmou que o comunismo deveria ser combatido pela razão, pois “não se\ncombatem ideias com calúnias, com bombas de gás nem com borracha”. Em\njulho de 1964, aceitou o convite feito pelo governador interino da\nGuanabara, Rafael de Almeida Magalhães, para ligar-se ao governo de modo\na elaborar um plano de obras para o subúrbio. Em agosto, tornou-se\nsuplente da Comissão de Economia, Viação e Obras Públicas da ALERJ.\n\nEm 1965, o oposicionista Negrão de Lima foi eleito governador da\nGuanabara. Ubaldo de Oliveira continuou líder do PST e membro da\nComissão de Educação, além de ter sido indicado vice-presidente da\nComissão Especial de Obras. Em 1966, em virtude da reorganização do\nsistema partidário nacional, feita pelo Ato Institucional n^o^ 2, passou\na integrar o Movimento Democrático Brasileiro (MDB), partido de\noposição. Na sessão legislativa daquele ano, foi segundo suplente da\nmesa da ALERJ. Declarou seu desapontamento com o governo do presidente\nmarechal Castelo Branco, no qual não percebia um “reajuste de ideias e\npensamentos” nem providências para melhorar a situação do povo, que\nsofria com a permanente alta do custo de vida.\n\nFoi reeleito no pleito estadual de novembro de 1966, na legenda do MDB,\nocasião em que apoiou a candidatura a deputado federal de seu aliado\npolítico Chagas Freitas. Em 1967, integrou novamente a Comissão de\nEducação. Entre as realizações resultantes de sua atuação parlamentar\nnaquele ano, destacaram-se a criação de uma Escola Normal em Bangu e de\nginásios estaduais nesse e em outros bairros da zona rural, além da\nconstrução de passagens de pedestres sobre o leito da linha férrea.\nInsistia na criação de escolas de ensino técnico profissional em regime\nde semi-internato, de modo a resolver a situação dos menores\nabandonados.\n\nFaleceu no Rio de Janeiro no dia 26 de dezembro de 1967.\n\nCasado com Isaura Costa de Oliveira, teve quatro filhos. Dois deles\nseguiram carreira política: Nadir Oliveira foi deputada estadual na\nGuanabara (1971-1975) e no Rio de Janeiro (1975-1979), e Ubaldo de\nOliveira Filho foi deputado estadual no Rio de Janeiro (1979-1983).\n\n*Paulo Celso Corrêa*\n\nFONTES: ASSEMB. LEGISL. GB. *Anais*; CÂM. DF. *Anais*; *Dia*\n(27/12/1967).\n","ref":"FONTES: ASSEMB. LEGISL. GB. *Anais*; CÂM. DF. *Anais*; *Dia*\n(27/12/1967).\n","dic":"DPRRJ"}
