{"title":"OLIVEIRA, Wilson Pereira de","cargoss":["Prefeito"],"cargos_esp":["Niterói"],"datas_ini":[1959],"datas_fim":[1961],"estados":[0],"content":"**OLIVEIRA, Wilson Pereira de**\n\n\\* pref. Niterói 1959-1961.\n\n*Wilson Pereira de Oliveira* nasceu em Fortaleza no dia 6 de novembro de\n1921, filho de José Evangelista de Oliveira e de Carmosinda Pereira de\nOliveira.\n\nFez os estudos secundários no Liceu Nilo Peçanha e no Colégio Carvalho,\nambos em Niterói, e em 1952 formou-se pela Faculdade Fluminense de\nMedicina, depois de ter iniciado sem concluir os cursos de direito e de\narquitetura. Foi interno na Santa Casa de Misericórdia do Rio de\nJaneiro, e ainda no Pronto Socorro de São Gonçalo, no Hospital Antônio\nPedro e no Hospital Santa Cruz, em Niterói.\n\nO início de sua carreira política se deu quando participou, ao lado de\nRoberto da Silveira e de Palmir Silva, da fundação do Partido\nTrabalhista Brasileiro (PTB) em 1945. Dois anos depois filiou-se ao\nPartido Democrata Cristão (PDC) e candidatou-se a vereador no município\nde Niterói, mas, por motivo de doença e devido à morte de sua mãe,\ndesistiu antes do pleito.\n\nEm 1954, já filiado ao Partido Trabalhista Nacional (PTN), foi eleito\nvice-prefeito de Niterói. Quatro anos depois foi eleito prefeito com uma\nvotação bastante expressiva, e em janeiro de 1959 tomou posse, sucedendo\na Alberto Rodrigues Fortes. Em parceria com o então governador do estado\ndo Rio, Roberto Silveira, seu amigo desde a época em que estudou no\nColégio Carvalho, executou obras de iluminação e pavimentação, sobretudo\nnas vias de acesso às regiões de Pendotiba e Oceânica; construiu\nescolas, inclusive nos morros do Estado e do Castro; fundou a Comissão\nde Turismo e Certames e o Conselho Municipal de Desportos; comprou da\nSuíça uma usina de asfalto; deu início ao alargamento da praia de Icaraí\ne da rua Visconde do Rio Branco; aumentou a área do cemitério do Maruí,\nno Barreto; restabeleceu as feiras livres; fez o projeto de\nprolongamento da avenida Professor João Brasil e a ligação entre os\nbairros de Jurujuba e Piratininga através do fortes Rio Branco e Imbuí.\n\nDurante sua gestão ocorreram graves crises políticas e também\neconômicas, que acabaram gerando greves e denúncias de corrupção.\nContribuiu para isso o fato de, no início de seu mandato, ter decidido\nafrontar as classes produtoras, ameaçando denunciar em praça pública o\nnome daqueles que deviam impostos. Começou inclusive a ter conflitos com\nseu aliado, o governador Roberto da Silveira, que defendia a\ninvestigação das denúncias de irregularidades. Assim, acabou sendo\nimpedido pela Câmara Municipal no dia 13 de setembro de 1961, e foi\nsubstituído pelo vice-prefeito Dalmo Américo Oberlaender.\n\nLogo após deixar a prefeitura, voltou a atuar como médico. Em 1982\ncandidatou-se novamente a prefeito, mas não foi eleito. Nas eleições de\n1988 mais uma vez teve sua candidatura indicada, mas preferiu apoiar a\nde Jorge Roberto Silveira.\n\nFoi professor de desenho nos colégios Brasil, Nilo Peçanha, Figueiredo\nCosta e na Academia Fluminense de Comércio. Além disso, teve uma\nimportante participação na fundação do Sindicato dos Professores do Rio\nde Janeiro.\n\nCasado com Laurita Barbosa de Oliveira, teve três filhos.\n\n*Paulo César Gomes Bezerra*\n\nfontes: PIMENTEL, L. *Enciclopédia*; SOARES, E. *Prefeitura*;SOARES, E.\n*Ruas*; WEHRS,C. *Niterói*.\n","ref":"","dic":"DPRRJ"}
