{"title":"PAIM, Almeida","cargoss":["Deputado Estadual"],"cargos_esp":[0],"datas_ini":[1907],"datas_fim":[1908],"estados":["RJ"],"autor":["Raimundo Helio Lopes"],"content":"**PAIM, Almeida**\n\n\\* dep. est. RJ 1907-1908.\n\n*José Gabriel Almeida Paim* formou-se pela Faculdade de Medicina da\nBahia em 1888, onde defendeu a tese *Sono, sonho, sonambulismo e\ndelírio*.\n\nFoi vereador na cidade de Petrópolis, então capital do estado do Rio de\nJaneiro, entre os anos de 1901 e 1903. Exerceu a medicina nesta cidade\npor muitos anos e em 1904 atuou no combate à epidemia de varíola que\nassolava esse município.\n\nEm 1907 foi eleito deputado estadual no estado do Rio de Janeiro. No\nmesmo ano ingressou na Comissão de Redação de Leis.\n\nNo início das atividades legislativas do ano de 1908, no dia 31 de\njulho, a Mesa Diretora da Assembleia Legislativa publicou uma nota de\npesar pelo seu falecimento.\n\n*Raimundo Helio Lopes*\n\nFONTES: ASSEMB. LEGISL. RJ. *Anai*s (1907-1908); INST. HIST. PETRÓPOLIS.\nDisponível em:\n\\<www.ihp.org.br/colecoes/lib\\_ihp/docs/jfan20030728.htm\\>. Acesso em:\n4/11/2010; ROCHA, N. *Faculdade*.\n","ref":"FONTES: ASSEMB. LEGISL. RJ. *Anai*s (1907-1908); INST. HIST. PETRÓPOLIS.\nDisponível em:\n\\<www.ihp.org.br/colecoes/lib\\_ihp/docs/jfan20030728.htm\\>. Acesso em:\n4/11/2010; ROCHA, N. *Faculdade*.\n","dic":"DPRRJ"}
