{"title":"PAIS, Eduardo","cargoss":["Deputado federal","Deputado federal","Prefeito"],"cargos_esp":[0,0,"Rio de Janeiro"],"datas_ini":[2002,1999,2009],"datas_fim":[2007,2001,0],"estados":["RJ","RJ",0],"autor":[0],"content":"**PAIS, Eduardo**\n\n\\* dep. fed. RJ 1999-2001 e 2002-2007; pref. Rio de Janeiro 2009-\n\n*Eduardo da Costa Pais* nasceu no Rio de Janeiro, então estado da\nGuanabara, no dia 14 de novembro de 1969, filho de Valmar de Sousa Pais\ne de Consuelo Neri da Costa Pais.\n\nEstudou no Colégio Santo Agostinho e formou-se em direito na Pontifícia\nUniversidade Católica (PUC-Rio) em 1993. Durante o curso estagiou no\nescritório de advocacia Gouveia Vieira. Ainda em 1993, durante o\nprimeiro mandato de César Maia na prefeitura do Rio de Janeiro, assumiu\na subprefeitura de Jacarepaguá e da Barra da Tijuca. Em 1994 filiou-se\nao Partido Verde (PV), que deixou no ano seguinte. Em 1996 ingressou no\nPartido da Frente Liberal (PFL), deixou a subprefeitura e em outubro foi\neleito para a Câmara Municipal do Rio de Janeiro com 82.418 votos, a\nmaior votação para vereador em todo o país.\n\nNo pleito de outubro de 1998 foi eleito deputado federal pelo estado do\nRio de Janeiro na legenda do PFL. Assumindo o mandato em fevereiro de\n1999, foi indicado vice-líder do PFL na Câmara dos Deputados, mas no\nmesmo ano deixou o partido e ingressou no Partido Trabalhista Brasileiro\n(PTB). Escolhido segundo vice-presidente da Comissão de Constituição e\nJustiça e de Redação, participou ainda da Comissão de Meio Ambiente e\nMinorias, da Comissão de Trabalho, Administração e Serviço Público e da\nComissão de Turismo e Desporto. Em 2000 foi vice-líder do PTB e do bloco\nformado por esse partido e pelo Partido da Social Democracia Brasileira\n(PSDB). Em 2001 licenciou-se do mandato e assumiu a Secretaria do Meio\nAmbiente na segunda administração de César Maia na prefeitura do Rio de\nJaneiro. Nesse mesmo ano, voltou ao PFL. Como secretário, implementou os\nmutirões de reflorestamento para revitalizar áreas degradadas da cidade.\nDeixou o cargo em abril de 2002, desincompatibilizando-se para disputar\na reeleição no pleito de outubro.\n\nReeleito deputado federal pelo Rio de Janeiro na legenda do PFL, iniciou\nnovo mandato em fevereiro de 2003 e ainda nesse ano filiou-se ao Partido\nda Social Democracia Brasileira (PSDB). Foi vice-líder do PSDB na\nCâmara, presidiu a Comissão de Seguridade Social e Família e participou\ncomo membro titular da Comissão de Constituição e Justiça e de\nCidadania, e da Comissão de Fiscalização Financeira e Controle. Em 2005\nparticipou ativamente das sessões e investigações empreendidas pela\nComissão Parlamentar Mista de Inquérito (CPMI) dos Correios, que foi\ncriada com objetivo de apurar as denúncias de corrupção nos Correios, e\nconcluiu, em seu relatório final, que membros do Partido dos\nTrabalhadores (PT) haviam pago mesadas a parlamentares a fim de\nassegurar votos favoráveis aos projetos do governo – caso que ficou\nconhecido na imprensa como o escândalo do “mensalão”.\n\nEm outubro de 2006, concorreu ao governo do Rio de Janeiro na legenda do\nPSDB. Obteve 5,5% dos votos válidos, resultado que não permitiu sua\nparticipação no segundo turno das eleições. No segundo turno,\ncontrariando as diretrizes do PSDB nacional, apoiou Sérgio Cabral Filho,\ncandidato do Partido do Movimento Democrático Brasileiro (PMDB). Com a\nvitória de Cabral, que derrotou Denise Frossard, do Partido Popular\nSocialista (PPS), ao encerrar o mandato de deputado em janeiro de 2007\nassumiu a Secretaria de Esportes e Turismo, acumulando-a com a\npresidência da Companhia de Turismo do Estado (TurisRio) e da\nSuperintendência de Desportos do Estado do Rio de Janeiro (Suderj). Como\nsecretário de Esportes, conduziu o projeto dos Jogos Pan-Americanos, que\nforam realizados no Rio de Janeiro em 2007. Ainda nesse ano, filiou-se\nao PMDB e foi indicado pelo governador Sérgio Cabral como provável\ncandidato do partido à prefeitura do Rio de Janeiro nas eleições que\naconteceriam no ano seguinte.\n\nEm abril de 2008 deixou a Secretaria de Esportes, e em outubro concorreu\nà prefeitura do Rio de Janeiro na legenda do PMDB. Durante a campanha, a\ncandidata Solange Amaral, do Democratas (DEM), pediu a impugnação de sua\ncandidatura, acusando-o de ter deixado o cargo de secretário estadual\napós o prazo legal para a desincompatibilização. Em julgamento no\nTribunal Superior Eleitoral (TSE), o pedido foi negado. Com 31,98% dos\nvotos válidos, foi para o segundo turno e passou a disputar a prefeitura\ndo Rio com Fernando Gabeira, que obtivera 25,61% dos votos válidos. A\ncampanha no segundo turno foi intensa e com muitas acusações entre os\ndois candidatos e seus correligionários. Eduardo Pais chegou a ser\nacusado por Fernando Gabeira de distribuir panfletos apócrifos e\ndifamatórios contra ele. No dia 26 de outubro, o resultado foi a vitória\nde Pais com 50,83%, contra 49,17% de Gabeira.\n\nTomou posse em 1^o^ de janeiro de 2009, sob protestos do Movimento\nPró-Democracia Carioca, que fora criado na internet pela juventude para\nquestionar a lisura e a validade da eleição para a prefeitura do Rio de\nJaneiro. Também contou com a oposição de jornais como *O Globo*, que\npublicou a lista de promessas que apresentara durante a campanha\neleitoral, afirmando que estaria atento a seu cumprimento. A lista\nprevia, para o transporte, a implantação do bilhete único, bem como a\nlegalização e licitação das linhas de vans; para a tributação, não\naumentar o Imposto Predial e Territorial Urbano (IPTU); para a educação,\nacabar com o projeto de aprovação automática no ensino fundamental das\nescolas públicas; para o lixo, não levar o aterro sanitário para\nPaciência e criar um programa de reciclagem; para as favelas, ampliar o\nPrograma de Aceleração do Crescimento (PAC) e continuar o Favela Bairro;\npara a saúde, ampliar o programa Saúde da Família, construir 40 Unidades\nde Pronto-Atendimento e criar um gabinete especial de combate à dengue;\npara a segurança, reestruturar a Guarda Municipal e multiplicar o número\nde câmeras de segurança em pontos estratégicos da cidade; para o turismo\ne meio ambiente, levar aterros sanitários para 100% da Zona Oeste,\nrecuperar as lagoas da Barra e Jacarepaguá, e transformar os arredores\ndo Maracanã e do Porto em centros turísticos; para a administração da\ncidade, adotar o projeto Prefeitura Itinerante, transferindo durante\nalgumas semanas seu gabinete para áreas mais pobres da cidade e\nconcentrando ali as principais ações do seu secretariado.\n\nLogo no ínicio de sua gestão implementou a Operação Choque de Ordem, que\ntinha como objetivo acabar com a desordem urbana. Em outubro, participou\nativamente da campanha bem-sucedida para que o Rio de Janeiro sediasse\nas Olimpíadas de 2016.\n\nEm outubro de 2012 foi reeleito prefeito no primeiro turno da eleição,\ncom 64,60% dos votos.\n\nCasou-se com Cristine de Sousa Assed Pais, com quem teve dois filhos.\n\nAnna Carolina Meireles\n======================\n\nFONTES: Diário do Rio de Janeiro. Disponível em:\n\\<http://diariodorio.com\\>; *Estado de S. Paulo*. Disponível em:\n\\<www.estadao.com.br\\>; G1. Disponível em:\n\\<http://g1.globo.com/noticias/politica\\>; INF. BIOG. por Andre Chaves;\nMovimento Pró-Democracia. Disponível em:\n\\<http://pro-democracia.blogspot.com\\>; Sidney Rezende. *Eleições 2008*.\nDisponível em: \\<www.sidneyrezende.com.br\\>; Tudo em Foco. Disponível\nem: \\<www.tudoemfoco.com.br\\>; *Veja*. Disponível em:\n\\<http://veja.abril.com.br/noticia/brasil/eduardo-paes-eleito-50-78-votos-395055.shtml\\>.\n","ref":"FONTES: Diário do Rio de Janeiro. Disponível em:\n\\<http://diariodorio.com\\>; *Estado de S. Paulo*. Disponível em:\n\\<www.estadao.com.br\\>; G1. Disponível em:\n\\<http://g1.globo.com/noticias/politica\\>; INF. BIOG. por Andre Chaves;\nMovimento Pró-Democracia. Disponível em:\n\\<http://pro-democracia.blogspot.com\\>; Sidney Rezende. *Eleições 2008*.\nDisponível em: \\<www.sidneyrezende.com.br\\>; Tudo em Foco. Disponível\nem: \\<www.tudoemfoco.com.br\\>; *Veja*. Disponível em:\n\\<http://veja.abril.com.br/noticia/brasil/eduardo-paes-eleito-50-78-votos-395055.shtml\\>.\n","dic":"DPRRJ"}
