{"title":"PALLIS, Vilmar","cargoss":["Deputado Estadual","Constituinte","Deputado Estadual","fed"],"cargos_esp":["GB","Est",0,0],"datas_ini":[1971,1975,1975,1983],"datas_fim":[1975,1975,1983,1987],"estados":[0,"RJ","RJ","RJ"],"autor":[0],"content":"**PALLIS, Vilmar**\n\n\\* dep. est. GB 1971-1975; const. Est. RJ 1975; dep. est. RJ 1975-1983;\nfed. RJ 1983-1987.\n\n*Vilmar Pallis* nasceu em Uberaba (MG) no dia 7 de junho de 1928, filho\nde Jacob Pallis e Sames Pallis.\n\nEstudou na Escola Nacional de Engenharia da Universidade do Brasil,\natual Universidade Federal do Rio de Janeiro (UFRJ), e formou-se em\nengenharia civil em 1952.\n\nIniciou sua carreira pública como responsável pela XII Região\nAdministrativa (XII RA) do estado da Guanabara, correspondente ao Méier\ne adjacências. Seu trabalho como administrador regional, priorizando\nprojetos nas áreas de infraestrutura, obras e transportes, rendeu-lhe\npopularidade. Fazendo da XII RA seu reduto eleitoral, elegeu-se pela\nprimeira vez deputado estadual no pleito de novembro de 1970, na legenda\nda Aliança Renovadora Nacional (Arena), partido de sustentação do regime\nmilitar instaurado no país em abril de 1964. Empossado em fevereiro de\n1971, nesse ano e no seguinte foi segundo secretário da mesa da\nAssembleia Legislativa do Estado da Guanabara (ALEG).\n\nEm novembro de 1974, reelegeu-se deputado estadual. Tomou posse em\nfevereiro de 1975, e em março passou a integrar a Assembleia\nConstituinte encarregada de elaborar a Constituição do novo estado do\nRio de Janeiro, resultante da fusão do antigo estado do Rio com o estado\nda Guanabara. Com a promulgação da nova Constituição estadual em 23 de\njulho de 1975, retornou ao exercício do mandato ordinário, agora na\nAssembleia Legislativa do Estado do Rio de Janeiro (ALERJ). Reelegeu-se\nem 1978 e, com o fim do bipartidarismo em 21 de novembro de 1979 e a\nconsequente reestruturação partidária, ingressou no Partido Democrático\nSocial (PDS), que deu continuidade à Arena.\n\nNa legenda do PDS, elegeu-se deputado federal pelo Rio de Janeiro em\nnovembro de 1982, assumindo uma cadeira na Câmara dos Deputados em\nfevereiro do ano seguinte. Em 25 de abril de 1984, contrariando a\nindicação de seu partido, votou favoravelmente à emenda Dante de\nOliveira, que previa o restabelecimento de eleições diretas para\npresidente da República em novembro daquele ano. Como a proposta não\nobteve a votação necessária para ser enviada ao Senado Federal, a\nsucessão do general João Batista Figueiredo ficou para ser decidida pela\nvia indireta, através de um Colégio Eleitoral a ser reunido em janeiro\ndo ano seguinte. Com isso, Pallis passou a apoiar ativamente a\ncandidatura presidencial de seu amigo, o ex-governador de Minas Gerais\nTancredo Neves, lançada em agosto de 1984 pela Aliança Democrática,\ncoligação que reuniu o Partido do Movimento Democrático Brasileiro\n(PMDB) e a dissidência do PDS conhecida como Frente Liberal. No mesmo\nperíodo, a convenção nacional do PDS aprovou a candidatura do\nex-governador de São Paulo e deputado federal Paulo Maluf, que derrotou,\nna ocasião, a pré-candidatura do ministro do Interior, o coronel Mário\nAndreazza.\n\nRatificando sua decisão, Vilmar Pallis votou em Tancredo no Colégio\nEleitoral reunido em 15 de janeiro de 1985. Eleito com uma expressiva\nvotação, o ex-governador mineiro não chegaria, contudo, a assumir a\npresidência. Gravemente enfermo, foi substituído por seu vice José\nSarney, empossado interinamente em março de 1985 e efetivado no cargo em\n21 de abril seguinte, quando Tancredo Neves veio a falecer.\n\nEm maio de 1986, Pallis saiu do PDS e ingressou no Partido Democrático\nTrabalhista (PDT), tendo sua ficha de filiação sido abonada pelo\ngovernador do estado do Rio, Leonel Brizola. Concorreu à reeleição pelo\nPDT mas não teve êxito, deixando com isso a Câmara em janeiro do ano\nseguinte, ao fim de seu mandato.\n\nEm novembro de 1988, elegeu-se vereador à Câmara Municipal do Rio de\nJaneiro. Empossado em janeiro do ano seguinte, veio a exercer a\nliderança da bancada do PDT na casa. Em março de 1989, após divergências\ncom a vereadora Regina Gordilho, presidente da Câmara e sua companheira\nde partido, abandonou o PDT. Ingressou, ainda no mesmo ano, no Partido\nda Reconstrução Nacional (PRN), legenda na qual o ex-governador de\nAlagoas Fernando Collor de Melo se elegeu presidente da República em\ndezembro de 1989, na primeira eleição direta para o cargo desde o fim do\nregime militar.\n\nEm setembro de 1992, ocasião em que a Câmara dos Deputados autorizou a\nabertura de um processo de *impeachment* contra Collor, Pallis deixou o\nPRN. Acusado de envolvimento num esquema de corrupção liderado por seu\nex-tesoureiro Paulo César Farias, Collor renunciou à presidência em 29\nde dezembro seguinte, horas antes de ter seu mandato cassado pelo Senado\nFederal. Seu substituto no cargo foi o vice Itamar Franco, que já vinha\nexercendo a função interinamente desde o dia 2 de outubro.\n\nNo pleito de outubro de 1994, Vilmar Pallis concorreu a uma vaga na\nAssembleia Legislativa do Estado do Rio de Janeiro na legenda do Partido\nProgressista Reformador (PPR), mas não teve êxito. Com suspeitas de\nfraude devido ao número excessivo de votos em branco, a eleição foi\nanulada por determinação do Tribunal Regional Eleitoral (TRE) do estado.\nMarcado um novo pleito para novembro seguinte, Pallis também não\nconseguiu se eleger.\n\nTeve duas filhas.\n\nFONTES: CÂM. DEP. *Deputados brasileiros*. Repertório (1983-1987);\n*Globo* (6/1/1989, 21/11/1994, 20/3/1996); *Jornal do Brasil*\n(23/11/1974, 1/3/1989, 27/9/1994).\n","ref":"FONTES: CÂM. DEP. *Deputados brasileiros*. Repertório (1983-1987);\n*Globo* (6/1/1989, 21/11/1994, 20/3/1996); *Jornal do Brasil*\n(23/11/1974, 1/3/1989, 27/9/1994).\n","dic":"DPRRJ"}
