{"title":"PARANHOS, Francisco","cargoss":["Deputado Estadual"],"cargos_esp":[0],"datas_ini":[1951],"datas_fim":[1955],"estados":["RJ"],"autor":[0],"content":"**PARANHOS, Francisco**\n\n\\* dep. est. RJ 1951-1955.\n\n*Francisco de Paula Paranhos* elegeu-se deputado estadual no Rio de\nJaneiro na legenda do Partido Social Democrático (PSD) em outubro de\n1950. Tomou posse no ano seguinte e, no exercício do mandato, fez parte\ndas comissões de Educação e dos Servidores da Assembleia Legislativa do\nEstado do Rio de Janeiro (ALERJ). Durante sua atuação parlamentar apoiou\nas ações dos governos federal e estadual, nesse momento, representados\npor Getúlio Vargas e Amaral Peixoto respectivamente. Entre os pareceres\nque assinou, destacam-se aqueles em que foram solicitados subpostos de\nsaúde para as localidades de Estrada Nova, em Itaocara, e Santo Antônio\nda Encruzilhada e Werneck, em Paraíba do Sul. Foi também o responsável\npor notificar à casa a aprovação do projeto que promovia a assistência\nmédica, farmacêutica e odontológica aos trabalhadores das salinas e suas\nrespectivas famílias, notícia que recebeu por telegrama do deputado\nfederal Miguel Couto Filho. Assinou também requerimento para que o\ngovernador do estado interferisse junto ao Ministério de Viação e Obras\nPúblicas para que fosse construído um dique no trecho do rio Muriaé que\nbanha a cidade de Itaperuna, a fim de evitar os prejuízos causados à\npopulação daquela localidade pelas cheias periódicas. Junto com outros\nservidores públicos, assinou o requerimento do deputado Lara Vilela para\nque os servidores do estado tivessem direito ao pagamento duplo pelas\nférias não gozadas em virtude de obrigações de trabalho.\n\nDeixou a ALERJ em 1955 ao fim da legislatura.\n\n*Andréa Camila de Faria*\n\nFONTES: ASSEMB. LEGISL. RJ. *Anais*. 16^a^ legislatura (1951-1954);\nTRIB. SUP. ELEIT. *Dados* (1950).\n","ref":"FONTES: ASSEMB. LEGISL. RJ. *Anais*. 16^a^ legislatura (1951-1954);\nTRIB. SUP. ELEIT. *Dados* (1950).\n","dic":"DPRRJ"}
