{"title":"AZEVEDO, José Bruno de","cargoss":["Prefeito"],"cargos_esp":["Campos"],"datas_ini":[1924],"datas_fim":[1928],"estados":[0],"autor":["Raimundo Helio Lopes"],"content":"**AZEVEDO, José Bruno de**\n\n\\* pref. Campos 1924-1928.\n\n*José Bruno de Azevedo* nasceu em Campos (RJ) no dia 3 de outubro de\n1874.\n\nEstudou no Liceu de Humanidades de Campos e em 1894 passou a trabalhar\nna Coletoria do Estado sediada na mesma cidade. Nesse período dedicou-se\ntambém ao comércio local, tendo presidido a Associação Comercial de\nCampos.\n\nEm 10 de julho de 1909 fundou o jornal *A Folha do Comércio* e em 1919\nelegeu-se vereador em Campos. Em seguida, assumiu a prefeitura da cidade\nentre 1924 e 1928. Após concluir o mandato de prefeito, trabalhou por um\ncurto período de tempo na Usina Sapucaia.\n\nFaleceu em Niterói no dia 27 de março de 1964.\n\nFoi casado com Teresa Fernandes Pinto, com quem teve seis filhos.\n\n*Raimundo Helio Lopes*\n\nFONTES: CÂM. VER. CAMPOS DOS GOYTACAZES. Disponível em:\n\\<www.camaracampos.rj.gov.br/historia\\_camara.php\\>. Acesso em:\n26/5/2011; CARVALHO, W. *Gente* (v. 2); Instituto Historiar. Disponível\nem: \\<www.institutohistoriar.blogspot.com/\\>. Acesso em: 26/5/2011.\n","ref":"FONTES: CÂM. VER. CAMPOS DOS GOYTACAZES. Disponível em:\n\\<www.camaracampos.rj.gov.br/historia\\_camara.php\\>. Acesso em:\n26/5/2011; CARVALHO, W. *Gente* (v. 2); Instituto Historiar. Disponível\nem: \\<www.institutohistoriar.blogspot.com/\\>. Acesso em: 26/5/2011.\n","dic":"DPRRJ"}
