{"title":"PAULA, Carlos Augusto de","cargoss":["Deputado Estadual"],"cargos_esp":[0],"datas_ini":[1997],"datas_fim":[1998],"estados":["RJ"],"autor":["Sabrina Guerghe"],"content":"**PAULA, Carlos Augusto de**\n\n\\* dep. est. RJ 1997-1998.\n\n*Carlos Augusto de Paula* nasceu em Macaé (RJ) no dia 27 de novembro de\n1950, filho de Joaquim de Paula e de Evangelina Carvalho de Paula. Em\nsua trajetória pública ficou conhecido como *Carlão*.\n\nGraduou-se em medicina. No pleito de 1992 foi eleito vice-prefeito\nmacaense na chapa composta por Carlos Emir Mussi, também médico de\nMacaé.\n\nNas eleições 1994 foi eleito suplente de deputado estadual para a sexta\nlegislatura (1995-1999) da Assembleia Legislativa do Estado do Rio de\nJaneiro (ALERJ), pela legenda do Partido da Social Democracia Brasileira\n(PSDB).\n\nEm 1995 trocou a legenda tucana pelo Partido Popular Socialista (PPS) e\nafastou-se do exercício da medicina. Derrotado nas eleições municipais\nmacaenses de 1996, tomou posse e foi efetivado para o Legislativo\nestadual em 3 de janeiro de 1997.\n\nAssim que assumiu seu mandato na ALERJ tornou-se vice-líder do seu\npartido; vice-presidente da Comissão Parlamentar de Inquérito (CPI) para\nApurar Irregularidades na Prestação de Serviços na Área de Saúde Pública\npela Fundação Cultural e Ecológica Anjos do Asfalto, Através do Convênio\nnúmero 019/92 Celebrado com o Sistema Único de Saúde (SUS); e membro\nefetivo da Comissão Especial para Apurar Possíveis Irregularidades na\nRede Hospitalar Pública e Privada, Credenciada e Conveniada, Além de\nClínicas Geriátricas, Psiquiátricas, Fora de Possibilidade Terapêutica\n(FTP), Integrantes do Sistema Único de Saúde (SUS) na Emissão de\nAutorizações de Internação Hospitalar (AIHs) e Unidades de Cobertura\nAmbulatorial (UCAs) e Aplicação de Seus Recursos no Estado do Rio de\nJaneiro.\n\nAinda durante a sexta legislatura atuou como vice-presidente de duas\ncomissões especiais: para Acompanhar a Implantação do Fundo de\nValorização do Magistério e da Lei n^o^ 9.394/96, Lei de Diretrizes e\nBases de Educação (LDB), no Âmbito do Estado do Rio de Janeiro; e para\nInvestigar e Acompanhar Denúncias de Casos de Racismo e Para Realizar o\nLevantamento de Terras Remanescentes de Quilombos no Estado do Rio de\nJaneiro.\n\nNo pleito de 1998 tentou reeleger-se deputado estadual pela legenda do\nPPS, no entanto foi malsucedido, com 16.034 votos. Nas eleições de 2002,\ndessa vez pela legenda do Partido da Reedificação da Ordem Nacional\n(Prona), tentou novamente conquistar uma cadeira na ALERJ, mas, com\n14.013 votos, não foi eleito.\n\nEm 2004 tentou novamente ser eleito vice-prefeito de Macaé, de volta à\nlegenda do PSDB. Em sua chapa, composta pelo candidato a prefeito\nRiverton Mussi Ramos, foi reeleito, ainda no primeiro turno, com 50,52%\ndos votos válidos.\n\nEntre 2005 e 2008 assumiu o Executivo macaense por três vezes. Em maio\nde 2006 assumiu a chefia da prefeitura durante uma viagem de Riverton\nMussi para a Expo China-Brasil, que ocorreu em Pequim. Naquela ocasião,\nCarlos Augusto de Paula ficou como chefe do Executivo interino por cerca\nde duas semanas. Um ano depois, voltou a assumir a prefeitura quando\nMussi liderou uma comitiva macaense a cidades europeias, como Madri e\nLisboa. E, em outubro de 2008, o prefeito se licenciou por 21 dias para\nse ausentar do município.\n\nEm setembro de 2007 filiou-se ao Partido Republicano Brasileiro (PRB).\nDepois mudou mais uma vez de legenda e filiou-se ao Partido Renovador\nTrabalhista Brasileiro (PRTB).\n\nEm 2010 foi candidato a deputado federal pelo PRTB, no Rio de Janeiro.\n\n*Sabrina Guerghe*\n\nFONTES: ASSEMB. LEGISL. RJ. *Deputados estaduais fluminenses*. Sexta\nlegislatura (1995-1999); ASSEMB. LEGISL. RJ. *Documentos*; CÂM. MUN.\nMACAÉ (28/9/2007, 26/4/2009); Click Macaé (14/5/2005); *Jornal Rio das\nOstras* (16/4/2009); PREF. MACAÉ (9/3, 7/9/2005); TRIB. SUP. ELEIT.\n*Eleições* (1998, 2002, 2004).\n","ref":"FONTES: ASSEMB. LEGISL. RJ. *Deputados estaduais fluminenses*. Sexta\nlegislatura (1995-1999); ASSEMB. LEGISL. RJ. *Documentos*; CÂM. MUN.\nMACAÉ (28/9/2007, 26/4/2009); Click Macaé (14/5/2005); *Jornal Rio das\nOstras* (16/4/2009); PREF. MACAÉ (9/3, 7/9/2005); TRIB. SUP. ELEIT.\n*Eleições* (1998, 2002, 2004).\n","dic":"DPRRJ"}
