{"title":"BALIEIRO, José Máximo","cargoss":["Constituinte","Deputado Estadual"],"cargos_esp":["est",0],"datas_ini":[1936,1935],"datas_fim":[1936,1936],"estados":["RJ","RJ"],"autor":["Adriana Clen"],"content":"**BALIEIRO, José Máximo**\n\n\\* const. est. RJ 1936; dep. est. RJ 1935-1936.\n\n*José Máximo Balieiro* nasceu no distrito de Bocaina, em Aiuruoca (MG),\nno dia 4 de dezembro de 1904, filho de José Teodoro Balieiro e de\nGuilhermina Maria de Almeida.\n\nGraduou-se pela Faculdade Nacional de Medicina do Rio de Janeiro, então\nDistrito Federal, em 1929. Foi pioneiro na fundação de duas casas de\nsaúde em Vargem Grande, então distrito de Resende (RJ).\n\nNa política, participou da União Progressista Fluminense em 1934 e foi\npresidente do Partido Social Democrático (PSD) durante anos. Elegeu-se\ndeputado estadual em outubro de 1934. Tomou posse no ano seguinte de uma\ncadeira na Assembleia Legislativa do Estado do Rio de Janeiro (ALERJ) e\ndurante a legislatura fez parte da Assembleia Constituinte estadual que\npreparou a nova Constituição do estado do Rio de Janeiro, promulgada em\n22 de janeiro de 1936. Em novembro do ano seguinte seu mandato foi,\ncontudo, interrompido devido ao golpe do Estado Novo, no governo do\npresidente Getúlio Vargas (1930-1945), quando o Congresso Nacional e as\nassembleias legislativas foram fechadas.\n\nComo médico, prestou assistência a indigentes e ocupou a chefia do Posto\nde Saúde de Resende de 1949 até o ano de sua aposentadoria. Trabalhou na\nSanta Casa de Misericórdia de Resende entre 1951 e 1953.\n\nFoi casado com Vanda Fajardo Balieiro e, em segundas núpcias, com Noêmia\nPereira de Sousa. Teve sete filhos.\n\n*Adriana Clen*\n\nFONTES: BRAS. Lei n^o^ 4.418/2010.\n","ref":"FONTES: BRAS. Lei n^o^ 4.418/2010.\n","dic":"DPRRJ"}
