{"title":"PEDREGAL FILHO, Antônio","cargoss":["Deputado Estadual"],"cargos_esp":[0],"datas_ini":[2003],"datas_fim":[2007],"estados":["RJ"],"autor":[0],"content":"**PEDREGAL FILHO, Antônio**\n\n\\* dep. est. RJ 2003-2007.\n\n*Antônio Ferreira Pedregal Filho* nasceu no Rio de Janeiro, então\nDistrito Federal, no dia 13 de junho de 1952.\n\nNas eleições de 2002 elegeu-se deputado estadual pelo estado do Rio de\nJaneiro na legenda do Partido Trabalhista do Brasil (PTdoB) e assumiu o\nmandato em fevereiro do ano seguinte para a legislatura 2003-2007. Em\nmarço de 2003 participou da Comissão Parlamentar de Inquérito (CPI) para\ninvestigar denúncias de desvio dos recursos destinados ao programa de\ndespoluição da Baía de Guanabara (PDBG).\n\nFoi o autor do projeto de lei de agosto de 2003 que visava a criação e\nimplementação de uma escola profissionalizante da Fundação de Apoio à\nEscola Técnica do Estado do Rio de Janeiro (Faetec) em Pedra de\nGuaratiba. Ainda em 2003 apresentou o projeto de lei que visava à\nimplementação de farmácias populares do Instituto Vital Brasil em\ndiversos bairros do estado do Rio de Janeiro, entre eles: Pedra de\nGuaratiba, Vicente de Carvalho, Irajá e Vaz Lobo.\n\nEm 2004 apresentou ao Poder Executivo o projeto de lei que criava\ndiversas casas para acolhimento de idosos nos bairros de Pedra de\nGuaratiba, Vaz Lobo, Oswaldo Cruz, Vicente de Carvalho e Irajá. Em junho\nde 2004 foi membro da CPI instaurada para apurar denúncias de grilagem\nde terras no estado do Rio de Janeiro.\n\nAinda durante a legislatura presidiu a Comissão de Política Urbana,\nHabitação e Assuntos Fundiários e a Comissão de Legislação\nConstitucional Complementar e Códigos; participou da Comissão de\nAssuntos Municipais e de Desenvolvimento Regional, da Comissão de\nEsporte e Lazer e da Comissão de Educação e Cultura e foi suplente da\nComissão de Obras Públicas, da Comissão de Assuntos da Criança do\nAdolescente e do Idoso, da Comissão de Turismo, da Comissão de\nServidores Públicos, da Comissão de Economia, Indústria e Comércio, da\nComissão de Defesa do Meio Ambiente, da Comissão de Segurança Alimentar,\nda Comissão de Orçamento, Finanças, Fiscalização Financeira e Controle,\nda Comissão de Trabalho, Legislação Social e Seguridade Social, da\nComissão de Saúde, da Comissão de Agricultura, Pecuária e Políticas\nRural Agrária e Pesqueira, da Comissão de Defesa do Consumidor e da\nComissão de Defesa civil.\n\nFoi vice-presidente do PTdoB na Câmara dos Deputados e presidente\nestadual do partido, além de secretário geral nacional. Em 2003 assumiu\na presidência municipal do Partido Trabalhista Nacional (PTN)\n\nCasou-se com Nereide Pedregal, que foi a vereadora mais votada do\nPartido Democrático Trabalhista (PDT) nas eleições de 2008 para a Câmara\nMunicipal do Rio de Janeiro. Tiveram três filhos.\n\n*Fernanda da Costa Monteiro Araújo*\n\nFONTES: ASSEMB. LEGISL. RJ. Disponível em: \\<www.alerj.rj.gov.br/\\>;\nASSEMB. LEGISL. RJ. Setor de Documentos Parlamentares; Gabinete do\ndeputado Antônio Pedregal (gabinete 410 – Anexo).\n","ref":"FONTES: ASSEMB. LEGISL. RJ. Disponível em: \\<www.alerj.rj.gov.br/\\>;\nASSEMB. LEGISL. RJ. Setor de Documentos Parlamentares; Gabinete do\ndeputado Antônio Pedregal (gabinete 410 – Anexo).\n","dic":"DPRRJ"}
