{"title":"PEIXOTO, Adroaldo","cargoss":["Deputado Estadual","Deputado Estadual"],"cargos_esp":[0,0],"datas_ini":[2003,1991],"datas_fim":[2007,1995],"estados":["RJ","RJ"],"autor":["Sabrina Guerghe"],"content":"**PEIXOTO, Adroaldo**\n\n\\* dep. est. RJ 1991-1995, 2003-2007.\n\n*Adroaldo Peixoto Garani* nasceu na cidade de Leopoldina (MG) no dia 7\nde julho de 1950.\n\nFoi professor, editor, livreiro e advogado, formou-se em direito pela\nUniversidade Federal Fluminense (UFF). Durante sua graduação, presidiu o\ndiretório de sua faculdade. Foi também presidente da Casa do Estudante\nFluminense.\n\nEm janeiro de 1979 inaugurou a Livraria Romanceiro, localizada no centro\nda cidade de Niterói (RJ). Em outubro de 1985 assinou a ata de fundação\ndo Instituto Latino Americano de Cultura (ILAC). Afastou-se da livraria\npara exercer o cargo de Superintendente Regional da Companhia de\nEletricidade do Estado do Rio de Janeiro (CERJ).\n\nFoi eleito deputado estadual do Rio de Janeiro pela primeira vez no\npleito de 1990, para a quinta legislatura (1991-1994) da Assembleia\nLegislativa do Estado do Rio de Janeiro (ALERJ). Conquistou a cadeira\natravés da legenda do Partido Democrático Trabalhista (PDT), em\nalinhamento com o Governo do Estado, assumido, pela segunda vez, por\nLeonel Brizola.\n\nEm 1991 integrou a Comissão Parlamentar de Inquérito constituída para\napurar possíveis irregularidades ocorridas na autorização de\nfuncionamento do Bazar Santa Bárbara, em Niterói. O bazar era um\ndepósito de fogos de artifícios e armas de munição que se incendiou no\ndia 21 de junho do referido ano e provocou a morte de 21 pessoas, deixou\n40 feridos, além de atingir 100 casas e 53 veículos.\n\nNo ano seguinte propôs projeto de lei que concedeu gratuidade de entrada\nnos estádios, ginásios esportivos e parques aquáticos do estado do Rio\nde Janeiro às pessoas portadoras de deficiência. Ainda atuou como\nsuplente da Comissão de Assuntos Municipais e de Desenvolvimento\nRegional.\n\nNas eleições de 1998 tentou conquistar, novamente, uma vaga no\nLegislativo estadual, filiado ao *Partido Socialista Brasileiro (PSB),*\nmas, com 12.861 votos, conseguiu apenas uma suplência.\n\nFoi presidente da Imprensa Oficial do Estado do Rio de Janeiro\n(2001-2002) e, n*o pleito de 2002, conseguiu outra suplência para a\ncadeira de deputado estadual pela legenda do PSB.*\n\nDescendente de italianos, Adroaldo Peixoto voltou sua atenção política à\ncomunidade ítalo-brasileira do Rio de Janeiro. *Através do Projeto de\nResolução n^o^ 1.084, de 15 de dezembro de 2005, criou a Frente\nParlamentar Brasil-Itália no Estado do Rio de Janeiro, que congregou 10%\ndos membros da assembleia.* O objetivo principal e primordial era reunir\nparlamentares da Casa Legislativa com o intuito de estreitar as relações\neconômicas, sociais e educacionais, para fortalecer os laços de amizade\nentre a Itália e o Brasil.\n\nEm 2006 enviou ao plenário o Projeto de Lei n^o^ 3.238/2006 propondo a\ndemarcação definitiva do Parque Estadual da Serra da Tiririca, criado em\n1991, que faz limite entre os municípios de Niterói e Maricá,\npreservando os loteamentos.\n\nTentou a reeleição no pleito seguinte pelo Partido Social Cristão (PSC),\nquando conseguiu mais uma suplência, com 19.105 votos nominais. Nos\núltimos dias de 2006 teve uma lei de sua autoria aprovada, a Lei n^o^\n4.969 que instituiu o Dia do Imigrante Italiano no Estado do Rio de\nJaneiro.\n\nEm 2008, tornou-se presidente da Associação Cultural Ítalo-Brasileira do\nRio de Janeiro (ACIB-RJ) para o período de 2008 a 2010. No dia 30 de\nabril de 2009 foi eleito conselheiro fiscal da Câmara Ítalo-Brasileira\nde Comércio e Indústria para o biênio 2009-2011.\n\nFiliou-se ao Partido da República (PR), oriundo da fusão entre o extinto\nPartido Liberal (PL) e o Partido de Reedificação da Ordem Nacional\n(Prona), e se tornou secretário geral do partido no Rio de Janeiro.\n\nFoi casado com Maria do Carmo e teve uma filha.\n\n*Sabrina Guerghe*\n\nFONTES: ACIB-RJ (2008); ASSEMB. LEGISL. RJ; CÂM. ÍTALO-BRAS. COM. IND.\n(4/2009); CORECON-RJ (Resolução n^o^ 11/2009, de 19/2/2009); Correio do\nILAC; *Dia* (5/1/2008); *Diário Oficial do Estado do Rio de Janeiro*\n(4/2/1991); *Diário da República Eletrônico*. Disponível em:\n\\<www.dre.pt/iolp/clisboa.html\\>; *Fluminense* (25/8, 4/9/2006,\n2/12/2007); *Folha de Niterói* (10-16/5/2008); *Globo* (19/10/1990);\nTRIB. SUP. ELEIT. *Eleições* (2006).\n","ref":"FONTES: ACIB-RJ (2008); ASSEMB. LEGISL. RJ; CÂM. ÍTALO-BRAS. COM. IND.\n(4/2009); CORECON-RJ (Resolução n^o^ 11/2009, de 19/2/2009); Correio do\nILAC; *Dia* (5/1/2008); *Diário Oficial do Estado do Rio de Janeiro*\n(4/2/1991); *Diário da República Eletrônico*. Disponível em:\n\\<www.dre.pt/iolp/clisboa.html\\>; *Fluminense* (25/8, 4/9/2006,\n2/12/2007); *Folha de Niterói* (10-16/5/2008); *Globo* (19/10/1990);\nTRIB. SUP. ELEIT. *Eleições* (2006).\n","dic":"DPRRJ"}
