{"title":"PEIXOTO, Américo","cargoss":["Deputado Estadual","Deputado Estadual","Deputado federal"],"cargos_esp":[0,0,0],"datas_ini":[1923,1919,1924],"datas_fim":[1925,1921,1930],"estados":["RJ","RJ","RJ"],"autor":["Luciana Pinheiro"],"content":"**PEIXOTO, Américo**\n\n\\* dep. est. RJ 1919-1921 e 1923-1925; dep. fed. RJ 1924-1930.\n\n*Américo Valentim Peixoto* nasceu em Macaé (RJ) no dia 6 de agosto de\n1878.\n\nCursou as primeiras séries no Colégio Caetano Dias, em seu município\nnatal, iniciou os estudos secundários no Liceu de Humanidades, em\nCampos, e concluiu-os no Ginásio Nacional, no Rio de Janeiro, então\nDistrito Federal. Em 1901 diplomou-se em Odontologia pela Faculdade de\nMedicina do Rio de Janeiro e trabalhou como dentista em Campos.\nMatriculou-se posteriormente na Faculdade Livre de Direito do Rio de\nJaneiro e obteve o grau de bacharel em 1907. Passou então a atuar na\nárea jurídica nas cidades fluminenses de Santa Maria Madalena e Macaé.\n\nEm 1924 foi eleito deputado federal pelo estado do Rio de Janeiro e\ntomou posse na Câmara dos Deputados em maio do mesmo ano, com mandato\naté dezembro de 1926. Reeleito em 1927 e em 1930, teve o mandato\ninterrompido em decorrência da vitória da Revolução de 1930, que levou\nGetúlio Vargas ao poder e extinguiu todos os órgãos legislativos do\npaís.\n\nAo longo de sua trajetória profissional também atuou na imprensa.\nDiretor dos periódicos *Jornal de Madalena* e *Autonomista*, foi\ncolaborador das revistas *Aurora* e *Fon-Fon* e redator dos jornais *O\nDia*, *A Capital* e *O Brasil*, no qual também publicava seus versos.\n\n*Luciana Pinheiro*\n\nFONTES: CÂM. DEP. *Deputados brasileiros* (1826-1976); VELHO SOBRINHO,\nJ. *Dic.* (v. 1).\n","ref":"FONTES: CÂM. DEP. *Deputados brasileiros* (1826-1976); VELHO SOBRINHO,\nJ. *Dic.* (v. 1).\n","dic":"DPRRJ"}
