{"title":"PEIXOTO, João Pereira","cargoss":["Deputado Estadual"],"cargos_esp":[0],"datas_ini":[1895],"datas_fim":[1897],"estados":["RJ"],"autor":[0],"content":"**PEIXOTO, João Pereira**\n\n\\* dep. est. RJ 1895-1897\n\n*João Pereira Peixoto* candidatou-se a deputado estadual pelo quinto\ndistrito, nas eleições realizadas em 1894, filiado ao Partido\nRepublicano Fluminense (PRF), e se elegeu. O partido congregava a\noligarquia fluminense, unindo lideranças monarquistas e republicanas; o\nPRF ascendeu ao poder com a queda do interventor de Francisco Portella\n(1890-1891).\n\nO pleito de 1894 foi vencido pelo PRF. Para o governo foi eleito\nMaurício de Abreu e para o Legislativo estadual a chapa do partido foi\nvitoriosa, uma vez que a oposição não apresentou candidatos, optou por\npraticar a abstenção total. João Pereira Peixoto foi eleito e diplomado\npara a legislatura estadual de 1895 a 1897. Em 1895 foi eleito para\nsuplente de secretário na composição da mesa organizadora dos trabalhos\nda Assembleia Legislativa do Estado do Rio de Janeiro (ALERJ). Em 1896 e\n1897 foi reeleito para o mesmo cargo.\n\nNo contexto político que se abria com a ascensão da oligarquia paulista\nao governo nacional, com a eleição de Prudente de Morais e a hegemonia\ndo Partido Republicano Federal, os republicanos fluminenses alinharam-se\nao governo federal, sem perder sua identidade e autonomia política.\n\n*Samuel Silva Rodrigues de Oliveira*\n\nFONTES: ASSEMB. LEGISL. RJ. *Anais*(1895, 1897); FERREIRA, M.\n*República*.\n","ref":"FONTES: ASSEMB. LEGISL. RJ. *Anais*(1895, 1897); FERREIRA, M.\n*República*.\n","dic":"DPRRJ"}
