{"title":"PEIXOTO, José Pereira","cargoss":["Deputado Estadual"],"cargos_esp":[0],"datas_ini":[1892],"datas_fim":[1897],"estados":["RJ"],"autor":[0],"content":"**PEIXOTO, José Pereira**\n\n\\* dep. est. RJ 1892-1897.\n\n*José Pereira Peixoto* foi eleito deputado estadual no estado do Rio de\nJaneiro nas eleições de 24 de abril de 1892, na legenda do Partido\nRepublicano Fluminense (PRF). A primeira Constituição fluminense havia\nsido elaborada em 1891 pelos partidários do presidente estadual\nFrancisco Portela (1889-1891), mas foi anulada após a renúncia deste, em\ndezembro do mesmo ano. No dia 31 de janeiro de 1892 uma nova eleição foi\nrealizada para compor a nova Assembleia Constituinte, que foi formada\npor membros do (PRF), presidida por José Tomás da Porciúncula e que\npromulgaria, no dia 9 de abril do mesmo ano, a segunda Constituição\nfluminense.\n\nDurante o mandato, que teve início em 1892, José Pereira Peixoto foi\neleito membro da Comissão de Instrução Pública e suplente de secretário\nda Assembleia Legislativa do Estado do Rio de Janeiro (ALERJ) até o\nfinal da legislatura, em dezembro de 1894.\n\nEm 20 de maio 1895 foi reeleito deputado estadual na chapa do PRF pelo\nquinto distrito eleitoral, com sede em Resende (RJ). Até o final desse\nmandato, em dezembro de 1897, exerceu a função de suplente de secretário\nda ALERJ.\n\n*Samuel Silva Rodrigues de Oliveira*\n\nFONTES: ASSEMB. LEGISL. RJ. *Anais* (14/11/1892-12/1/1893, 1, 1/3-9/4,\n8/1892, 13-26/1, 1/8/1893, 1895, 1897); FERREIRA, M. *República*.\n","ref":"FONTES: ASSEMB. LEGISL. RJ. *Anais* (14/11/1892-12/1/1893, 1, 1/3-9/4,\n8/1892, 13-26/1, 1/8/1893, 1895, 1897); FERREIRA, M. *República*.\n","dic":"DPRRJ"}
