{"title":"PENA, Mário de Oliveira","cargoss":["Deputado Estadual"],"cargos_esp":[0],"datas_ini":[1927],"datas_fim":[1930],"estados":["RJ"],"autor":["Raimundo Helio Lopes"],"content":"**PENA, Mário de Oliveira**\n\n\\* dep. est. RJ 1927-1930.\n\n*Mário de Oliveira Pena* foi eleito deputado estadual em abril de 1927,\npelo quarto distrito eleitoral, com sede em Vassouras (RJ), na chapa\noficial do Partido Republicano Fluminense (PRF). Durante a legislatura,\ncompreendida até janeiro de 1930, foi sucessivamente reeleito\nsegundo-secretário da Assembleia Legislativa.\n\nEm agosto de 1930 foi reeleito deputado estadual pelo PRF e foi\nnovamente eleito segundo-secretário da assembleia. Contudo teve seu\nmandato interrompido em novembro deste ano com a vitória da Revolução de\n1930 que levou Getúlio Vargas ao poder e fechou todos os órgãos\nlegislativos do país.\n\n*Raimundo Helio Lopes*\n\nFONTES: ASSEMB. LEGISL. RJ. *Anais* (1927-1930); *Estado* (16/3/1927,\n19/8, 3/10/1930); FERREIRA, M. *República*.\n","ref":"FONTES: ASSEMB. LEGISL. RJ. *Anais* (1927-1930); *Estado* (16/3/1927,\n19/8, 3/10/1930); FERREIRA, M. *República*.\n","dic":"DPRRJ"}
