{"title":"PERISSÉ, Gambeta","cargoss":["Deputado Estadual"],"cargos_esp":[0],"datas_ini":[1923],"datas_fim":[1926],"estados":["RJ"],"autor":["Raimundo Helio Lopes"],"content":"**PERISSÉ, Gambeta**\n\n\\* militar; dep. est. RJ 1923-1926.\n\n*João Gambeta Perissé* foi eleito deputado estadual pelo terceiro\ndistrito eleitoral, com sede em Cantagalo (RJ), em 28 de outubro de\n1923, no pleito realizado durante a intervenção federal no estado do Rio\nde Janeiro. Durante a intervenção federal, decretada em 10 de janeiro de\n1923 pelo então presidente da República Artur Bernardes (1922-1926), o\nestado foi governado pelo interventor Aureliano Leal, que fechou a\nAssembleia Legislativa do Estado do Rio de Janeiro (ALERJ) e anulou as\neleições de 9 de julho de 1922 realizadas para a sucessão do então\npresidente estadual Raul Veiga (1918-1922), quando os candidatos Raul\nFernandes e Feliciano Sodré declararam-se eleitos, ocasionando a\ndualidade da ALERJ.\n\nFoi eleito na legenda do Partido Republicano Fluminense (PRF), mas\nligado ao grupo político de Luís Guaraná, pré-candidato à presidência do\nestado em 1923 e opositor de Feliciano Sodré pelo controle político do\nnorte fluminense. Com o início dos trabalhos legislativos, em 27 de\nnovembro, participou do reconhecimento pela ALERJ da eleição de\nFeliciano Sodré para presidente do Rio de Janeiro (1923-1927),\nencerrando o período de intervenção federal do estado. Nesse mesmo ano\ningressou em três comissões: Comissão Especial para apurar e verificar\nos poderes do presidente e vice-presidente do estado, Viação e Obras\nPúblicas e Higiene e Instrução Pública. Nos anos seguintes a esse\nmandato foi eleito sucessivamente membro da Comissão de Higiene e\nInstrução Pública.\n\nDurante seu mandato fez oposição ao governo de Feliciano Sodré, ao lado\nde Abdelkader Magalhães, também ligado a Luis Guaraná, e posicionou-se\ncontrário à criação do Instituto de Fomento e Economia Agrícola (IFEA),\ninstituído por Sodré em agosto de 1926 com o objetivo de limitar as\nquotas de embarque de café para os produtores e instituir mais impostos\npara o estado. Em seus pronunciamentos criticou a intervenção do governo\nem assuntos que julgava fora do âmbito estadual e afirmou que o IFEA só\nfora criado para angariar recursos para a conclusão das obras do porto\nde Niterói. Ainda em 1926 tentou a reeleição, mas não obteve êxito.\n\nGambeta Perissé também foi médico e militar. Nas fileiras do Exército\nocupou o posto de capitão médico.\n\n*Raimundo Helio Lopes*\n\nFONTES: ASSEMB. LEGISL. RJ (1923-1926); FERREIRA, M. *República*.\n","ref":"FONTES: ASSEMB. LEGISL. RJ (1923-1926); FERREIRA, M. *República*.\n","dic":"DPRRJ"}
