{"title":"PERLINGEIRO, Amilcar Rodrigues","cargoss":["Constituinte","Deputado Estadual"],"cargos_esp":["est",0],"datas_ini":[1947,1947],"datas_fim":[1947,1951],"estados":["RJ","RJ"],"autor":[0],"content":"**PERLINGEIRO, Amilcar Rodrigues**\n\n\\* const. est. RJ 1947; dep. est. RJ 1947-1951.\n\n*Amilcar Rodrigues Perlingeiro* nasceu em Santo Antônio de Pádua (RJ),\nfilho do italiano Francisco Perlingeiro e de Adelina Perlingeiro.\n\nFiliado à União Democrática Nacional (UDN), candidatou-se a Assembleia\nLegislativa do Estado do Rio de Janeiro (ALERJ) no pleito de janeiro de\n1947 elegendo-se, com 1.789 votos, para a 15^a^ legislatura da República\n(1947-51).\n\nNa Assembleia Constituinte instalada no Rio de Janeiro no mesmo ano, com\nvistas a elaborar a Constituição estadual que passou a reger o estado do\nRio de Janeiro após a dissolução do Estado Novo (1937- 45), propôs\ndiversas emendas relativas ao sistema tributário então em vigor,\nparticularmente uma emenda impedindo a cobrança de imposto territorial\nsobre matas e terrenos reflorestados, com a finalidade de estimular a\nconservação das matas nos diversos municípios do estado.\n\nPublicou *Noventa anos de vida: uma vida, duas épocas, romance* em 1967\ne *Lavradores do Brasil: história do João* em 1975.\n\n*Lara de Melo Santos*\n\nFONTES: ASSEMB. LEGISL. RJ. *Anais* (1947); COL. PÁDUA. Disponível em:\n\\<www.colegiodepadua.com.br\\>. Acesso em: 23/9/2010; Eleições Pós-1945.\nDisponível em: \\<www.eleicoespos1945.com/\\>. Acesso em: 23/9/2010.\n","ref":"FONTES: ASSEMB. LEGISL. RJ. *Anais* (1947); COL. PÁDUA. Disponível em:\n\\<www.colegiodepadua.com.br\\>. Acesso em: 23/9/2010; Eleições Pós-1945.\nDisponível em: \\<www.eleicoespos1945.com/\\>. Acesso em: 23/9/2010.\n","dic":"DPRRJ"}
