{"title":"PINHEIRO, Batista","cargoss":["Deputado Estadual"],"cargos_esp":[0],"datas_ini":[1901],"datas_fim":[1906],"estados":["RJ"],"autor":["Raimundo Helio Lopes"],"content":"**PINHEIRO, Batista**\n\n\\* dep. est. RJ 1901-1906.\n\n*Ezequiel Batista de Araújo Pinheiro* elegeu-se deputado estadual no\nestado do Rio de Janeiro em 30 de dezembro de 1900. Foi eleito pelo\nsegundo Distrito Eleitoral, com sede em Campos (RJ), na legenda do\nPartido Republicano do Rio de Janeiro (PRRJ). O PRRJ fora fundado em 23\nde julho de 1899 pelos partidários do então presidente do estado do Rio\nde Janeiro Alberto Torres (1897-1900), que romperam com o Partido\nRepublicano Fluminense (PRF) diante das divergências envolvendo a\ninfluência do PRF sobre o governo estadual. Ao nascer como força\nsituacionista, o PRRJ garantiu um lugar de destaque no jogo político\nestadual e no pleito de 1900 conseguiu eleger a maioria dos deputados\nestaduais, vencendo o PRF, agremiação que passou, então, a abrigar a\noposição estadual.\n\nNessa legislatura, iniciada em setembro de 1901, Batista Pinheiro foi\nsucessivamente eleito membro da Comissão de Estatística, Divisão Civil e\nJudiciária. Em 1903, último ano do mandato, também integrou a Mesa\nDiretora da Assembleia Legislativa do Estado do Rio de Janeiro (ALERJ),\ntornando-se segundo-secretário. Ainda em 1903 participou da reforma da\nConstituição estadual, articulada pelo recém-eleito presidente estadual\nNilo Peçanha (1903-1906). Aprovada pela ALERJ em 18 de setembro desse\nano, a reforma determinou, entre outras medidas, o fortalecimento do\nExecutivo estadual a partir da diminuição das atribuições do Legislativo\ne do Judiciário; o aumento do mandato do presidente estadual de três\npara quatro anos; a redução do número de deputados estaduais de 60 para\n45 e a nomeação pelo presidente estadual dos prefeitos dos municípios\nnos quais o governo estadual fosse responsável por parte dos\nfinanciamentos de obras públicas – caso dos importantes municípios de\nNiterói, então capital do estado, Campos e Petrópolis.\n\nNo dia 31 de janeiro de 1904 foi reeleito deputado estadual na legenda\ndo PRRJ, novamente pelo segundo Distrito Eleitoral. Até o final da\nlegislatura, em dezembro de 1906, foi reeleito membro da Comissão de\nEstatística, Divisão Civil e Judiciária. Durante seus mandatos, foi\naliado político de Nilo Peçanha.\n\nBatista Pinheiro foi também tenente-coronel comandante do 127^o^\nBatalhão de Infantaria e presidente do Partido Republicano de Resende.\n\n*Raimundo Helio Lopes*\n\nFONTES: ASSEMB. LEGISL. RJ. *Anais* (1901-1906); FERREIRA, M.\n*República*.\n","ref":"FONTES: ASSEMB. LEGISL. RJ. *Anais* (1901-1906); FERREIRA, M.\n*República*.\n","dic":"DPRRJ"}
