{"title":"PINHEIRO, Benjamim de Sales","cargoss":["Constituinte","Deputado Estadual"],"cargos_esp":["est",0],"datas_ini":[1891,1891],"datas_fim":[1891,1891],"estados":["RJ","RJ"],"autor":[0],"content":"**PINHEIRO, Benjamim de Sales**\n\n\\* const. est. RJ 1891; dep. est. RJ 1891.\n\n*Benjamin de Sales Pinheiro* foi dono da Fazenda Santo Antônio, onde se\ndestacou na produção de café.\n\nPor volta de 1865 casou-se com Cândida Peregrina das Chagas Werneck,\nfilha de Peregrino José de América Pinheiro, o visconde de Ipiabas, e de\nAna Francisca das Chagas Werneck. Seu sogro foi um importante chefe\npolítico e produtor de café no município de Valença (RJ), onde Benjamin\nde Sales Pinheiro foi vereador e prefeito.\n\nElegeu-se deputado estadual nas primeiras eleições realizadas após a\nproclamação da República (15/11/1889) para a formação da Assembleia\nConstituinte fluminense. Esse pleito, realizado em 20 de março de 1891,\nfoi vencido pelos partidários do presidente do estado do Rio de Janeiro,\nFrancisco Portela (1889-1891), nomeado pelo presidente da República,\nmarechal Deodoro da Fonseca (1889-1891). Os portelistas derrotaram os\ncandidatos do Partido Republicano, de oposição ao governo, liderados por\nJosé Tomás da Porciúncula.\n\nNa Constituinte estadual, reunida a partir de 10 de maio, Benjamin de\nSales Pinheiro e os demais deputados promulgaram a primeira Constituição\nrepublicana fluminense e elegeram Portela presidente constitucional. As\nsessões ordinárias desse ano se encerraram em novembro, mesmo mês em que\nDeodoro da Fonseca renunciou ao governo da República, transferindo-o ao\nvice-presidente Floriano Peixoto. Diante desse conturbado contexto\npolítico, no dia 10 de dezembro, Portela renunciou à presidência do\nestado do Rio de Janeiro por não ter mais o apoio do poder federal. Seu\nsucessor, Carlos Baltasar da Silveira (1891-1892), revogou a\nConstituição republicana fluminense, fechou o Congresso estadual e\nconvocou uma nova Assembleia Constituinte. Diante disso, Benjamin de\nSales Pinheiro perdeu o mandato.\n\n*Samuel Silva Rodrigues de Oliveira*\n\nFONTES: FERREIRA, M. *República*; *Inventário das fazendas do vale\nparaíba fluminense*, Fazenda Santo Antônio, códice AIII-FO9-RF.\nDisponível em:\n\\<www.institutocidadeviva.org.br/inventarios/sistema/wp-content/uploads/2008/05/25\\_faz-santo-antonio.pdf\\>.\nAcesso em: 2/8/2010.\n","ref":"FONTES: FERREIRA, M. *República*; *Inventário das fazendas do vale\nparaíba fluminense*, Fazenda Santo Antônio, códice AIII-FO9-RF.\nDisponível em:\n\\<www.institutocidadeviva.org.br/inventarios/sistema/wp-content/uploads/2008/05/25\\_faz-santo-antonio.pdf\\>.\nAcesso em: 2/8/2010.\n","dic":"DPRRJ"}
