{"title":"PINHO, Avelino José","cargoss":["Constituinte","Deputado Estadual"],"cargos_esp":["est",0],"datas_ini":[1891,1891],"datas_fim":[1891,1891],"estados":["RJ","RJ"],"autor":[0],"content":"**PINHO, Avelino José**\n\n\\* const. est. RJ 1891; dep. est. RJ 1891.\n\n*Avelino José Pinho* nasceu no município de Cantagalo (RJ) no ano de\n1869, filho do médico e fazendeiro José Sizenando de Avelino Pinho e de\nAna Cândida Lopes Martins.\n\nElegeu-se deputado estadual nas primeiras eleições realizadas após a\nproclamação da República (15/11/1889) para a formação da Assembleia\nConstituinte fluminense. Esse pleito, realizado em 20 de março de 1891,\nfoi vencido pelos partidários do presidente do estado do Rio de Janeiro,\nFrancisco Portela (1889-1891), nomeado pelo presidente da República,\nmarechal Deodoro da Fonseca (1889-1891). Os portelistas derrotaram os\ncandidatos do Partido Republicano, de oposição ao governo, liderados por\nJosé Tomás da Porciúncula.\n\nNa Constituinte estadual, reunida a partir de 10 de maio, Avelino José\nPinho e os demais deputados promulgaram a primeira Constituição\nrepublicana fluminense e elegeram Portela presidente constitucional. As\nsessões ordinárias desse ano se encerraram em novembro, mesmo mês em que\nDeodoro da Fonseca renunciou ao governo da República, transferindo-o ao\nvice-presidente Floriano Peixoto. Diante desse conturbado contexto\npolítico, no dia 10 de dezembro, Portela renunciou à presidência do\nestado do Rio de Janeiro por não ter mais o apoio do poder federal. Seu\nsucessor, Carlos Baltasar da Silveira (1891-1892), revogou a\nConstituição republicana fluminense, fechou o Congresso estadual e\nconvocou uma nova Assembleia Constituinte. Diante disso, Avelino José\nPinho perdeu o mandato.\n\nEm 1894, casou-se com Arlinda Fortes Pinho.\n\n*Samuel Silva Rodrigues de Oliveira*\n\nFONTES: FERREIRA, M. *República*; Genealogia Fluminense. Disponível em:\n\\<www.marcopolo.pro.br/genealogia/paginas/cantagalo\\_lmartins.htm\\>.\nAcesso em: 2/8/2010.\n","ref":"FONTES: FERREIRA, M. *República*; Genealogia Fluminense. Disponível em:\n\\<www.marcopolo.pro.br/genealogia/paginas/cantagalo\\_lmartins.htm\\>.\nAcesso em: 2/8/2010.\n","dic":"DPRRJ"}
