{"title":"PINTO, Eduardo de Andrade","cargoss":["Constituinte","Senador"],"cargos_esp":["est",0],"datas_ini":[1891,1890],"datas_fim":[1891,1893],"estados":["RJ","RJ"],"content":"**PINTO, Eduardo de Andrade**\n\n\\* const. est. RJ 1891; sen. RJ 1890-1893.\n\n*Eduardo de Andrade Pinto* formou-se em direito.\n\nEm 5 de janeiro de 1878 foi nomeado ministro da Marinha.\n\nEm 1989 a Proclamação da República inaugurou uma nova conjuntura\npolítica no estado do Rio de Janeiro. O marechal Deodoro da Fonseca,\nprimeiro presidente da República, nomeou Francisco Portela interventor\ndo Rio de Janeiro. Portela era membro do Partido Republicano, mas não\nconseguiu unir nem os seus correligionários, nem a elite política\nfluminense. Realizou um governo marcado pela instabilidade, tentando\ncompor uma aliança com as lideranças conservadoras, liberais e\nrepublicanas.\n\nEduardo de Andrade Pinto, na instauração do regime republicano, foi\nsenador federal na legislatura de 1890 a 1893. Nesse mesmo período fez\nparte da base de apoio governista, elegendo-se para a Assembleia\nConstituinte do Estado do Rio de Janeiro em janeiro de 1891. A eleição\ndo Congresso Constituinte teve como eixo organizador o embate entre\n“oposicionistas” e “governistas”. Francisco Portela controlou o processo\neleitoral garantindo a vitória de seus candidatos. O “Regulamento Alvim”\npermitiu a Portela a nomeação dos Conselhos de Intendência, que tinham\ncomo função estabelecer o governo municipal e organizar as eleições em\nnível estadual e nacional. A primeira Constituinte tratou de consolidar\nas bases do poder “portelista” no Rio de Janeiro, legitimando o governo\nintervencionista.\n\nOs participantes da Constituinte garantiram um mandato no Legislativo\nestadual que estava dividido entre Senado e Câmara dos Deputados, era\nbicameral. Eduardo de Andrade Pinto ocupou cadeira no senado, ficando no\ncargo até dezembro de 1891.\n\nA renúncia do marechal Deodoro da Fonseca e a ascensão de Floriano\nPeixoto retiraram uma das fontes de apoio do governo portelista. Esse\ncontexto abriu espaço para a renúncia de Portela, dissolvendo-se o\nlegislativo estadual e revogando Constituição estadual de 1891, com a\norganização de uma nova Assembleia Constituinte do Estado do Rio de\nJaneiro em 1892.\n\nFaleceu no dia 10 de janeiro de 1895.\n\n*Samuel Silva Rodrigues de Oliveira*\n\nFONTE: FERREIRA, M. *República*; Acesso em: 7/9/2010; MAR. BRAS.\nDisponível em:\n\\<www.mar.mil.br/menu\\_v/cm/ministros\\_imperio\\_mb.html\\>. Acesso em:\n7/9/2010; SENADO. Disponível em:\n\\<www.senado.gov.br/senadores/senadores\\_biografia.asp?codparl=2888\\>.\n","ref":"","dic":"DPRRJ"}
