{"title":"PIRES, Altineu Cortes","cargoss":["Deputado Estadual"],"cargos_esp":[0],"datas_ini":[1959],"datas_fim":[1967],"estados":["RJ"],"autor":["Nayara Emerick Lamb"],"content":"**PIRES, Altineu Cortes**\n\n\\* dep. est. RJ 1959-1967.\n\n*Altineu Cortes Pires* foi eleito deputado estadual no estado do Rio de\nJaneiro em outubro de 1958 na legenda do Partido Social Democrático\n(PSD). Assumiu o mandato no ano seguinte e integrou a Comissão\nPermanente de Educação e Saúde, da Assembleia Legislativa do Estado do\nRio de Janeiro (ALERJ).\n\nDurante sua trajetória parlamentar se destacou em seus pronunciamentos a\npreocupação com questões de saúde e saneamento público da cidade de\nNiterói (RJ), para a qual requisitou maior ajuda financeira do Governo\ndo Estado do Rio de Janeiro.\n\nNas eleições de 1962 reelegeu-se deputado estadual. Tomou posse na ALERJ\nno início do ano seguinte e exerceu o mandato até o fim da legislatura\nem 1967.\n\n*Nayara Emerick Lamb*\n\nFONTES: ASSEMB. LEGISL. RJ. *Anais*. 18^a^ legislatura (1959-1962);\nSARMENTO, C. *Espelho*; SENADO. *Dados* (1959).\n","ref":"FONTES: ASSEMB. LEGISL. RJ. *Anais*. 18^a^ legislatura (1959-1962);\nSARMENTO, C. *Espelho*; SENADO. *Dados* (1959).\n","dic":"DPRRJ"}
