{"title":"PIRES, Filipe Basílio Cardoso","cargoss":["Deputado federal"],"cargos_esp":[0],"datas_ini":[1897],"datas_fim":[1898],"estados":["DF"],"autor":["Evelyn Morgan Monteiro Paiva"],"content":"**PIRES, Filipe Basílio Cardoso**\n\n\\* dep. fed. DF 1897-1898.\n\n*Filipe Basílio Cardoso Pires*, filho de Antônio Basílio Cardoso Pires e\nde Maria Cardoso Pires, lutou na Guerra do Paraguai (1864-1870) e\nformou-se pela Faculdade de Medicina do Rio de Janeiro na década de\n1870.\n\nFoi o primeiro presidente da **Banda do Ginásio Musical Recreativo 24 de\nFevereiro, f**undada **no distrito de Santa Cruz, no Rio de Janeiro,\nentão Distrito Federal,** em 24 de fevereiro de 1891 em homenagem à\nConstituição republicana publicada naquela data. Foi eleito para o\nConselho Municipal do Distrito Federal para o período de 1892 a 1895. Em\n1897 elegeu-se deputado pelo Distrito Federal. Assumiu em seguida o\nmandato na Câmara dos Deputados, mas não o concluiu, pois faleceu em\n1898.\n\nCasado com Maria José de Azevedo Pires, teve um filho. Seu sobrinho\nMilcíades Mário de Sá Freire foi deputado federal de 1898 a 1909,\nsenador de 1909 a 1916 e prefeito do Distrito Federal de 1919 a 1920.\n\n*Evelyn Morgan Monteiro Paiva*\n\nFONTES: ASBAM. Disponível em: \\<www.asbamrj.com.br/24fev.htm\\>; CÂM.\nDEP. *Deputados brasileiros*(1826-1976); CHAIA, J. *E**ducação*; CONS.\nMUN. DF. *Anais* (1892-1895); *Diário Oficial da União* (3/6/1932,\n6/12/1940, 15/12/1944, 30/12/1955, 4/5/1957); *Revista do Instituto\nHistórico e Geográfico Brasileiro* (2003, v. 420-421); RIBEIRO, L.\n*Liga*.\n","ref":"FONTES: ASBAM. Disponível em: \\<www.asbamrj.com.br/24fev.htm\\>; CÂM.\nDEP. *Deputados brasileiros*(1826-1976); CHAIA, J. *E**ducação*; CONS.\nMUN. DF. *Anais* (1892-1895); *Diário Oficial da União* (3/6/1932,\n6/12/1940, 15/12/1944, 30/12/1955, 4/5/1957); *Revista do Instituto\nHistórico e Geográfico Brasileiro* (2003, v. 420-421); RIBEIRO, L.\n*Liga*.\n","dic":"DPRRJ"}
