{"title":"PIRES, Gilberto Afonso","cargoss":["Deputado Estadual"],"cargos_esp":[0],"datas_ini":[1955],"datas_fim":[1958],"estados":["RJ"],"autor":["Jorge Cesar Pereira Nunes","Rui Aniceto Nascimento Fernandes"],"content":"**PIRES, Gilberto Afonso**\n\n\\* dep. est. RJ 1955-1958.\n\n*Gilberto Afonso Pires* nasceu em São Gonçalo (RJ) em 8 de abril de\n1915, filho de Alberto Pires Afonso e de Julieta Pires Afonso.\n\nCursou o ensino primário na Escola do Sítio do Peão e no Grupo Escolar\nNilo Peçanha, ambos em São Gonçalo. Matriculou-se na Escola Normal de\nNiterói não terminando o curso. Concluiu o ensino médio no Colégio Pedro\nII, no Rio de Janeiro. Fez preparatórios para cursar medicina, não tendo\nrealizado o curso por falta de recursos financeiros. Prestou exame para\nser aviador no Colégio Pritaneu Militar. Não obteve autorização dos\npais, o que era necessário por possuir menos de 21 anos, para\nintegrar-se à carreira militar. Ingressou na Academia do Comércio de\nNiterói e diplomou-se contador em 1933. Iniciou o curso de direito na\nFaculdade Nacional de Direito, concluído na Faculdade de Direito de\nNiterói, em 1957.\n\nIniciou suas atividades profissionais como caixeiro do armazém de D.\nInhora, em Neves, São Gonçalo. Foi ainda datilógrafo da Companhia de\nSeguros de Niterói, despachante oficial, contabilista de várias\nempresas, advogado criminalista e defensor público.\n\nIngressou na política durante o processo de democratização do país que\nacompanhou o fim do Estado Novo. Fundou o diretório gonçalense do\nPartido Social Democrático (PSD) e do Partido Trabalhista Brasileiro\n(PTB). Em 1945 disputou uma cadeira na Câmara Federal, obteve 1.769\nvotos e ocupou a suplência petebista. Em 1947 disputou a prefeitura\nmunicipal, alcançou 4.170 votos e ficou em segundo lugar. Em 1950 o PTB\nlançou seu nome na disputa pela chefia do Executivo gonçalense. O pleito\ncontou com cinco candidatos, saindo vitorioso por uma coligação que uniu\nPTB, PSD e o Partido Democrático Popular (PDP). Prefeito de São Gonçalo\nentre 31 de janeiro de 1951 e 31 de janeiro de 1955, seu mandato foi\nmarcado pela associação com o movimento operário, não tendo sido\nregistradas greves ou outros tipos de manifestações sindicais. Reformou\ne construiu escolas. Instituiu a sopa escolar. Manteve quatro mil bolsas\nde estudos para estudantes pobres em escolas secundárias particulares da\ncidade. Promoveu o calçamento de vias importantes no segundo e quinto\ndistritos da cidade, polo industrial local. Reconstruiu o prédio da\nprefeitura e iniciou a ampliação do pronto socorro municipal.\nIncentivava a prática esportiva e as atividades culturais participando\nda fundação de grêmios e clubes. Durante sua gestão a cidade passou por\num intenso processo de crescimento urbano-populacional. No início dos\nanos de 1950 intensificou-se o processo de loteamentos de antigas\nfazendas para atender o afluxo migratório daqueles que se deslocavam do\ninterior do estado do Rio de Janeiro e do Nordeste para a região do\nentorno do Distrito Federal e da capital fluminense em busca de melhores\ncondições de trabalho e de vida.\n\nPela legenda do PTB elegeu-se, em 1954, deputado estadual com 2.582\nvotos, exercendo o mandato entre 1955 e 1958. Não conseguiu a reeleição\nno pleito de 1958, em que obteve 1.404 votos.\n\nPassou a dedicar-se à advocacia e especializou-se como criminalista. Foi\nmembro fundador e presidente da oitava secção da Ordem dos Advogados do\nBrasil (OAB), por dois mandatos consecutivos (1971-1973 e 1973-1975);\nmembro da Loja Maçônica Cruzeiro Fluminense, do Tamoio Futebol Clube,\ncomentarista da Rádio Mapinguary, instituições sediadas na cidade; e\nDefensor Público do estado.\n\nFaleceu em 7 de março de 1993, em São Gonçalo. Está sepultado no\nCemitério Central da cidade.\n\nCasou-se, em 1936, com Edite Baptista Pires, com quem teve dois filhos,\nShirley Pires Erthal e Gilberto Afonso Pires Júnior.\n\nFoi biografado por Jorge Cesar Pereira Nunes e Salvador Mata e Silva e\ntema da monografia de Vanderli Araújo, Tomie Kavakami e Haydée\nFigueiredo.\n\n*Jorge Cesar Pereira Nunes/Rui Aniceto Nascimento Fernandes*\n\nFONTES: ARAÚJO, V; FIGUEIREDO, H; KAVAKAMI, T. *Gilberto*; CARDIANO, F.\n*Eleições*; *Comarca*. São Gonçalo (4/10/1947, p. 1); *Diário Oficial da\nUnião*; *Diário da Justiça* (8/1/1955); FREIRE, R. *Poder*; Inf.\nGilberto Afonso Pires Junior (2006); NUNES, J. *Dirigentes*; SILVA, S.\n*Escola*.\n","ref":"FONTES: ARAÚJO, V; FIGUEIREDO, H; KAVAKAMI, T. *Gilberto*; CARDIANO, F.\n*Eleições*; *Comarca*. São Gonçalo (4/10/1947, p. 1); *Diário Oficial da\nUnião*; *Diário da Justiça* (8/1/1955); FREIRE, R. *Poder*; Inf.\nGilberto Afonso Pires Junior (2006); NUNES, J. *Dirigentes*; SILVA, S.\n*Escola*.\n","dic":"DPRRJ"}
