{"title":"PORTO, Barbosa","cargoss":["Deputado Estadual"],"cargos_esp":[0],"datas_ini":[1991],"datas_fim":[1995],"estados":["RJ"],"autor":["Tiago Alves Jaques"],"content":"**PORTO, Barbosa**\n\n\\* dep. est. RJ 1991-1995.\n\n*José Barbosa Porto* nasceu em Própria (SE) no dia 27 de novembro de\n1923.\n\nFoi prefeito do município de Magé (RJ) de 1963 a 1964.\n\nElegeu-se deputado estadual em 1990 na legenda do Partido Democrático\nTrabalhista (PDT). Na Assembleia Legislativa do Estado do Rio de Janeiro\n(ALERJ) foi membro efetivo da Comissão de Saúde, Trabalho, Legislação\nSocial e Seguridade Social. Exerceu o mandato até 1995.\n\nTrabalhou, ainda, como agente em Petrópolis (RJ). Foi chefe\nadministrativo do setor de perícias médicas e chefe do setor de\nacidentes do trabalho no antigo IAPI/RJ, e diretor administrativo do\nHospital Universitário Pedro Ernesto.\n\n*Tiago Alves Jaques*\n\nFONTES: ASSEMB. LEGISL. RJ. *Deputados estaduais fluminenses*. Quinta\nlegislatura (1991-1994).\n","ref":"FONTES: ASSEMB. LEGISL. RJ. *Deputados estaduais fluminenses*. Quinta\nlegislatura (1991-1994).\n","dic":"DPRRJ"}
