{"title":"BARBOSA, Luís","cargoss":["Deputado Estadual","Constituinte"],"cargos_esp":[0,"est"],"datas_ini":[1987,1989],"datas_fim":[1991,1989],"estados":["RJ","RJ"],"autor":["Renata Moreira"],"content":"**BARBOSA, Luís**\n\n\\* dep. est. RJ 1987-1991; const. est. RJ 1989.\n\n*Luís Barbosa Correia* nasceu em Teresópolis (RJ), no dia 18 de maio de\n1930.\n\nFoi comerciante e iniciou sua trajetória política em 1970, quando foi\neleito, em novembro, vereador em Teresópolis. Assumiu uma cadeira na\nCâmara Municipal no início de 1971 e exerceu o mandato por seis anos.\nFoi vice-prefeito da mesma cidade entre 1977 e maio de 1982, quando\nassumiu como prefeito por sete meses. Nesse período foi um incentivador\ndas políticas culturais, educacionais e desportivas. Presidiu o sistema\nMovimento Brasileiro de Alfabetização (Mobral) de Teresópolis, reformou\no Ginásio Poliesportivo “Pedrão” e construiu o Centro de Ensino Roger\nMalhardes (Cerom), que incluía uma praça de esportes para a população do\nbairro São Pedro. Em janeiro de 1983 deixou a prefeitura e foi nomeado\nsecretário de Serviços Públicos, cargo que exerceu até 1986.\n\nEm novembro desse ano foi eleito deputado estadual no estado do Rio de\nJaneiro, na legenda do Partido do Movimento Democrático Brasileiro\n(PMDB). Tomou posse no dia 1^o^ de fevereiro de 1987 para a legislatura\nque terminaria em 1991. Na Assembleia Legislativa do Estado do Rio de\nJaneiro (ALERJ) foi eleito presidente da Comissão de Servidores\nPúblicos, membro das comissões de Orçamento e Finanças, de Redação,\nIndicações Legislativas e Proposições Externas e de Agricultura e\nPolítica Rural. Nessa última comissão, com o deputado José Figorelle,\nfez a apreciação da criação do Departamento de Estradas e Rodagens\n(Detro). Foi membro da Comissão Parlamentar de Inquérito encarregada de\napurar as causas da migração interna e a diminuição da produção agrícola\ne participou, como suplente, das comissões de Constituição e Justiça e\nde Legislação Social e Trabalho. Ainda na ALERJ, foi autor de duas leis\nvoltadas para a educação: a Lei n^o^ 1.707/1990, relativa à mudança do\nnome da Escola Estadual Estolino Peixoto da Rocha, em Teresópolis, e a\nLei n^o^ 1.357/1988, que conferiu ao Centro de Integrado de Educação\nPública (CIEP) o nome de Professor Amaury Amaral dos Santos, no bairro\nde Fonte de Santa.\n\nIntegrou a Assembleia Estadual Constituinte de 1989, reunida para\nadequar a Constituição fluminense à nova Carta federal promulgada em 5\nde outubro de 1988, que reorganizou a legislação nacional após a\nditadura militar (1964-1985) e que ficou conhecida como a “Constituição\nCidadã”. A Assembleia Estadual Constituinte foi formada pelos deputados\nestaduais eleitos no Rio de Janeiro em 1986 e promulgou a nova\nConstituição estadual no dia 5 de outubro de 1989. A partir dessa data\nretornou ao exercício do mandato ordinário na ALERJ.\n\nApós deixar a ALERJ, ao final do mandato, foi eleito prefeito de\nTeresópolis no pleito de 1992, assumindo a prefeitura em janeiro de\n1993. Nesse período, realizou as primeiras reformas do Terminal Tancredo\nNeves, na data das comemorações de cem anos da Estrada de Ferro de\nTeresópolis.\n\n*Renata Moreira*\n\nFONTES: ASSEMB. LEGISL. RJ. *Deputados estaduais fluminenses.* Quarta\nlegislatura (1987-1991); ASSEMB. LEGISL. RJ. *Informações e produtos\nparlamentares*; *Diário Oficial RJ* (3, 4/2/1987); *Fluminense* (3,\n26-27/12/1982); TRIB. CONTAS UNIÃO. Ata (n. 30 de 16/8/2003).\n","ref":"FONTES: ASSEMB. LEGISL. RJ. *Deputados estaduais fluminenses.* Quarta\nlegislatura (1987-1991); ASSEMB. LEGISL. RJ. *Informações e produtos\nparlamentares*; *Diário Oficial RJ* (3, 4/2/1987); *Fluminense* (3,\n26-27/12/1982); TRIB. CONTAS UNIÃO. Ata (n. 30 de 16/8/2003).\n","dic":"DPRRJ"}
