{"title":"PORTO, Edgard","cargoss":["Deputado Estadual"],"cargos_esp":[0],"datas_ini":[1955],"datas_fim":[1959],"estados":["RJ"],"autor":[0],"content":"**PORTO, Edgard**\n\n\\* dep. est. RJ 1955-1959.\n\n*Edgard Pereira da Silva Porto* nasceu em Itaperuna (RJ).\n\nIniciou sua trajetória política ao se candidatar a deputado estadual no\nRio de Janeiro, nas eleições de outubro de 1950, na legenda do Partido\nRepublicano (PR). Os 1.305 votos que obteve não foram suficientes para\nque se elegesse. No pleito seguinte, em outubro de 1954, candidatou-se\nnovamente e foi eleito. Assumiu o mandato na Assembleia Legislativa do\nEstado do Rio de Janeiro no início de 1955. Nas eleições de outubro de\n1958 candidatou-se mais uma vez a deputado estadual, mas não conseguiu\nse reeleger. Concluiu o mandato em janeiro de 1959.\n\n*Ioneide Piffano Brion de Souza*\n\nFONTES: CARDIANO, F. *Eleições*; MONTORO, F. *Memórias*.\n","ref":"FONTES: CARDIANO, F. *Eleições*; MONTORO, F. *Memórias*.\n","dic":"DPRRJ"}
