{"title":"PORTO, Hipólito","cargoss":["Constituinte","Deputado Estadual"],"cargos_esp":["est",0],"datas_ini":[1947,1947],"datas_fim":[1947,1959],"estados":["RJ","RJ"],"autor":[0],"content":"**PORTO, Hipólito**\n\n\\* const. est. RJ 1947; dep. est. RJ 1947-1959.\n\n*Hipólito da Silva Porto* elegeu-se deputado estadual no estado do Rio\nde Janeiro nas eleições de 1947, na legenda do Partido Trabalhista\nBrasileiro (PTB). Nessa legislatura integrou a Assembleia Estadual\nConstituinte que promulgou no dia 20 de junho a Constituição do Estado\ndo Rio de Janeiro de 1947. Em seguida passou a exercer o mandato\nordinário de deputado estadual.\n\nReelegeu-se em outubro de 1950 para a legislatura de 1951-1955.\n\nApesar de sua ausência na primeira sessão, a de posse, da 16^a^\nlegislatura (1951-1954), sua atuação política foi uma das mais\nrepresentativas entre os companheiros nos três mandatos para os quais\nfoi eleito. Sua atuação foi ampla, participando diretamente das\ndiscussões quanto à educação, na qual demonstrou forte interesse pela\nconstrução de escolas no interior; à indústria, em especial as\nindústrias salinas, em defesa dos direitos dos trabalhadores destas e\ndos impostos pagos ou não pelas mesmas; à economia nacional,\nprincipalmente as irregularidades no uso dos recursos da Caixa Econômica\nFederal; obras públicas, principalmente construção de estradas que\nligassem o interior à capital; e às questões referentes ao operariado e\nà necessidade de leis que regulassem melhor seus direitos e deveres.\n\nA amplitude de sua participação, no entanto, está vinculada a um forte\ninteresse a uma questão mais ampla referente à preocupação do êxodo\npopulacional entre os municípios do interior do estado e a capital.\nQuestão muito em voga na segunda metade do século XX e que dizia\nrespeito à organização que se daria à cidade após a transferência da\ncapital para Brasília (DF).\n\nNas eleições de 1954 elegeu-se mais uma vez deputado no estado do Rio de\nJaneiro, para a legislatura 1955-1959.\n\n*Nayara Emerick lamb*\n\nFONTES: ASSEMB. LEGISL. RJ. *Anais*. 16^a^ legislatura (1951-1954);\nSARMENTO, C. *Espelho*; TRIB. SUP. ELEIT. *Dados* (1950).\n","ref":"FONTES: ASSEMB. LEGISL. RJ. *Anais*. 16^a^ legislatura (1951-1954);\nSARMENTO, C. *Espelho*; TRIB. SUP. ELEIT. *Dados* (1950).\n","dic":"DPRRJ"}
