{"title":"PRATA, Alaor","cargoss":["Deputado federal","Prefeito","Deputado federal"],"cargos_esp":[0,0,0],"datas_ini":[1909,1922,1927],"datas_fim":[1922,1926,1930],"estados":["MG","RJ","MG"],"autor":["Claudia Mesquitta"],"content":"**PRATA, Alaor**\n\n\\* dep. fed. MG 1909-1922; pref. RJ 1922-1926; dep. fed. MG 1927-1930.\n\n*Alaor Prata Leme Soares* nasceu em Uberaba (MG) em 17 de junho de 1882,\nfilho do major Melânio Feliciano Soares e de Matilde Prata Soares.\n\nFez os primeiros estudos na cidade natal e graduou-se em engenharia\ncivil pela Escola Politécnica de São Paulo em 1906. Atuou na imprensa em\nUberaba e trabalhou como engenheiro na Estrada de Ferro Mogiana.\n\nFiliado ao Partido Republicano Mineiro (PRM), foi vereador em São Miguel\nVeríssimo, então distrito de Uberaba e hoje município de Veríssimo, de\n1908 a 1909. Em 1908 foi eleito deputado federal por Minas Gerais,\nassumiu o mandato em maio de 1909 e renovou-o até 1922. Convidado pelo\npresidente Artur Bernardes (1922-1926) para ser prefeito do Distrito\nFederal, assumiu o cargo em 16 de novembro de 1922, sucedendo a Carlos\nSampaio, e nele permaneceu durante todo o quadriênio. Enfrentaria\nferrenha crítica da imprensa à sua administração, provavelmente como\nreflexo dos movimentos revolucionários que eclodiram antes e durante o\ngoverno Artur Bernardes.\n\nAo assumir a prefeitura, deparou-se com uma situação de dificuldades\nfinanceiras resultantes das inúmeras despesas feitas na administração\nanterior com diversas obras de urbanização e saneamento. Propôs-se\nconduzir a administração municipal com base na redução e controle\nradical dos gastos, e assim o fez durante os primeiros anos. Expôs\nabertamente a situação financeira do município, o que não agradou a seu\nantecessor, que contestou as informações baseadas em dados fornecidos\npelos órgãos competentes da prefeitura. A partir desse impasse, escreveu\no livro *Recordação da vida pública*, somente editado em 1958, uma\nanálise pormenorizada das finanças municipais desde meados do ano de\n1919 até o fim de sua administração.\n\nComo consequência da situação econômica precária, Alaor Prata teve que\nsuspender e restringir uma série de obras, entre elas o desmonte do\nmorro do Castelo. Reformulou o programa de obras do município, e quando\na situação financeira se estabilizou deu continuidade a obras\nimportantes, como o alargamento e remodelação do túnel que unia a rua\nReal Grandeza, em Botafogo, à rua Barroso (atual Siqueira Campos), em\nCopacabana. O túnel receberia seu nome, mas se tornaria conhecido\npopularmente como Túnel Velho. Deu também prosseguimento à construção do\ncanal da avenida Visconde de Albuquerque, por se tratar de uma obra de\nsaneamento e valorização da área marginal. Dentro do programa de\nadaptação às condições financeiras da prefeitura, fez arruamentos em\ntorno da lagoa Rodrigo de Freitas, fez o projeto de abertura da avenida\nCarlo Peixoto, ligando dois pontos da ladeira do Leme, e modificou o\nprojeto aprovado pela administração anterior relativo ao morro de Santo\nAntônio, que previa a urbanização do morro sem demoli-lo. Propôs a\ncanalização do rio Joana através da rua Maxwell e o alargamento dessa\nimportante via de ligação com vários bairros da Zona Norte, evitando as\nconstantes inundações. Tratou ainda dos arruamentos da área parcialmente\naterrada no entorno do morro da Urca e de uma área do bairro do Grajaú.\n\nEm contrapartida, revogou o Decreto n^o^ 1.819, de 13 de novembro de\n1922, assinado por Carlos Sampaio, que aprovara a construção de um túnel\nque ligaria a rua Carlos Sampaio à rua Real Grandeza, sob os morros de\nSanta Teresa, Nova Cintra e Mundo Novo. Revogou também o Decreto n^o^\n1.826, de mesma data, invalidando o Plano de Urbanização da Área do\nCastelo formulado durante a administração de Carlos Sampaio, e sancionou\no Decreto n^o^ 1.924 de 28 de dezembro de 1923, que o alterou\nsignificativamente. Implantou ainda, pelo Decreto n^o^ 2.087, de 19 de\njaneiro de 1925, um código de obras regulamentador da construção na\ncidade, que tratava do uso do concreto armado, cada vez mais difundido\nem face do aumento do número de prédios com mais de seis andares. O\ncódigo expunha uma série de diretrizes a serem seguidas, tais como a\nobrigatoriedade de os projetos serem submetidos ao exame da Seção de\nArquitetura, a consideração dos elementos geométricos das construções\n(altura, pé direito, entre outros), a proibição de construções que não\ntivessem recebido o alvará de alinhamento, o estabelecimento de alturas\nmínimas levando em consideração o número de pavimentos, a restrição ao\nuso de porões, entre outras. Iria vigorar até meados dos anos 1930,\nquando foi substituído por outro formulado durante o mandato do prefeito\nPedro Ernesto.\n\nExecutou obras de remodelação do largo da Carioca, para as quais\nnecessitava de prévia desapropriação de prédios e terrenos da área,\nconforme o Decreto n^o^ 2.214, de 7 de outubro de 1925, que aprovou o\nprojeto, e realizou obras de reparos em decorrência da forte ressaca\nocorrida em julho de 1925, que causou danos na avenida Beira-Mar,\nprincipalmente na altura da rua do Russel e na enseada formada pela\ninterseção com a avenida Rui Barbosa, e ainda na avenida Atlântica, no\ntrecho entre as ruas Santa Clara e Xavier da Silveira\n\nFoi um intenso incentivador das duas sociedades esportivas do Rio de\nJaneiro, o Jóquei Clube Brasileiro e o Iate Clube. Este último obteve\nconcessão para incorporar à sua sede os terrenos fronteiros à antiga\npraia da Saudade, cuja área havia passado por sucessivos aterros.\nConcedeu também parte considerável do terreno que é ocupado atualmente\npelo Jóquei Clube. A inauguração da praça de corridas, atual Hipódromo\nda Gávea, ocorreu em 11 de julho de 1926, com a presença do presidente\nda República, de ministros de Estado e do prefeito. A construção do\nHipódromo foi empreendida pelo presidente do Jóquei Clube, Lineu de\nPaula Machado, e pelo engenheiro Mário Ribeiro, e em reconhecimento ao\nlegado que ambos deixaram para a cidade, Alaor Prata deu os nomes de\navenida Lineu de Paula Machado e rua Mário Ribeiro a dois logradouros\npróximos ao clube esportivo.\n\nDeixou a prefeitura em 15 de novembro de 1926, quando tomaram posse o\nnovo presidente Washington Luís e o novo prefeito Prado Júnior. Voltou à\nCâmara dos Deputados como representante de Minas Gerais entre 1927 e\n1930 e, a convite do presidente de Minas Olegário Maciel, foi secretário\nde Agricultura, Viação e Obras Públicas do estado entre setembro e\nnovembro de 1930. Com a vitória da Revolução de 1930 e a dissolução dos\nórgãos legislativos do país, afastou-se da política e dedicou-se à\nindústria têxtil no Rio de Janeiro. Foi também presidente do Fluminense\nFutebol Clube de 1936 a 1940. Em 1943 foi um dos signatários do\n*Manifesto dos Mineiros*, primeira manifestação pública contra o Estado\nNovo (1937-1945).\n\nFaleceu no Rio de Janeiro em 19 de setembro de 1964.\n\nAlém do livro já citado, deixou outras publicações.\n\n*Claudia Mesquitta*\n\nFONTES: ASSEMB. LEGISL. RJ. Disponível em:\n\\<www.alerj.rj.gov.br/memoria/historia\\>; BERGER, P. *Dic.*; BERGER, P.\n*Dic.*; CARDEMAN, D.*Rio de Janeiro*; CON. REG. BIBLIOTECONOMIA.\nDisponível em: \\<www.crb3.org.br/carreira\\>; HOCHMAN, G. *Era*; IHGB.\nDisponível em: \\<www.ihgb.org.br/acervo\\>; INST. MUN. URB. PEREIRA\nPASSOS. *Coleção*; PINHEIRO, M. *Instituto*; PLANALTO. Disponível em:\n\\<www.planalto.gov.br/\\>;PORTO, A. *História*; PREF. RJ. Disponível em:\n\\<www.rio.rj.gov.br/arquivo/governantes\\>; *Revista Municipal de\nEngenharia* (v. XLII, 1-12/1992, n. 1/4); REIS, J. *Administração*;\nSCHIAVO, C. *Memória*; SOBRAL, S. *Instituto*.\n","ref":"FONTES: ASSEMB. LEGISL. RJ. Disponível em:\n\\<www.alerj.rj.gov.br/memoria/historia\\>; BERGER, P. *Dic.*; BERGER, P.\n*Dic.*; CARDEMAN, D.*Rio de Janeiro*; CON. REG. BIBLIOTECONOMIA.\nDisponível em: \\<www.crb3.org.br/carreira\\>; HOCHMAN, G. *Era*; IHGB.\nDisponível em: \\<www.ihgb.org.br/acervo\\>; INST. MUN. URB. PEREIRA\nPASSOS. *Coleção*; PINHEIRO, M. *Instituto*; PLANALTO. Disponível em:\n\\<www.planalto.gov.br/\\>;PORTO, A. *História*; PREF. RJ. Disponível em:\n\\<www.rio.rj.gov.br/arquivo/governantes\\>; *Revista Municipal de\nEngenharia* (v. XLII, 1-12/1992, n. 1/4); REIS, J. *Administração*;\nSCHIAVO, C. *Memória*; SOBRAL, S. *Instituto*.\n","dic":"DPRRJ"}
