{"title":"QUINDERÉ, David","cargoss":["Deputado Estadual"],"cargos_esp":[0],"datas_ini":[1991],"datas_fim":[1995],"estados":["RJ"],"autor":["Silvia Monnerat"],"content":"**QUINDERÉ, David**\n\n\\* dep. est. RJ 1991-1995.\n\n*David Noguchi Quinderé* nasceu em 21 de dezembro de 1928.\n\nMissionário ligado à Igreja Universal do Reino de Deus, foi eleito\ndeputado estadual no Rio de Janeiro, na legenda do Partido Democrático\nTrabalhista (PDT), para a legislatura 1991-1995. Durante o mandato, que\nassumiu no início de 1991, foi vice-líder da bancada de seu partido,\nmembro da Comissão de Indicações Legislativas e suplente das comissões\nde Obras Públicas e Orçamento, Finanças e de Tributação.\n\n*Silvia Monnerat*\n\nFONTES: ASSEMB. LEGISL. RJ. *Deputados estaduais fluminenses*. Quinta\nlegislatura (1991-1994); *Veja*. Disponível em:\n\\<http://veja.abril.com.br/incidente\\_conteudo/020608/cerco-contra-igreja.html\\>.\n","ref":"FONTES: ASSEMB. LEGISL. RJ. *Deputados estaduais fluminenses*. Quinta\nlegislatura (1991-1994); *Veja*. Disponível em:\n\\<http://veja.abril.com.br/incidente\\_conteudo/020608/cerco-contra-igreja.html\\>.\n","dic":"DPRRJ"}
