{"title":"RAJZMAN, Bernard","cargoss":["sec nac Desportos","Deputado Estadual"],"cargos_esp":[0,0],"datas_ini":[1991,1997],"datas_fim":[1992,1999],"estados":[0,"RJ"],"autor":[0],"content":"**RAJZMAN, Bernard**\n\n\\* sec. nac. Desportos 1991-1992; dep. est. RJ 1997-1999.\n\n*Bernard Rajzman* nasceu na cidade do Rio de Janeiro, então Distrito\nFederal, em 25 de abril de 1957, filho de Sruldit Roger Rajzman e Helene\nRajzman.\n\nEstudou na Escola Municipal Dr. Cócio Barcelos e iniciou a carreira de\njogador de vôlei no Fluminense aos 11 anos de idade. Cursou o segundo\ngrau na Escola Estadual Infante Dom Henrique e no Colégio Benett, onde\ncompletou o terceiro ano. Fez dois anos do curso de administração de\nempresas na Sociedade Universitária Augusto Mota (SUAM), mas interrompeu\na faculdade em 1978 quando se transferiu para a equipe do Panini, na\nItália, tornando-se o primeiro jogador de vôlei brasileiro a atuar no\ncircuito internacional. Em 1980 voltou para o Brasil e prosseguiu na\ncarreira de jogador pelo Bradesco e, mais tarde, pelo Flamengo.\n\nAtuou na seleção brasileira de vôlei durante 17 anos. Participou de 540\npartidas, ganhou 12 títulos sul-americanos, participou de três\ncampeonatos mundiais (1978, 1982 e 1986) e de três olimpíadas (1980,\n1984 e 1988). Nessa última competição, realizada em Los Angeles, EUA,\nconquistou a medalha de prata. Notabilizou-se pela criação do saque\n“jornada nas estrelas”, que contribuiu em grande parte para a\npopularização da prática do vôlei no Brasil.\n\nParalelamente à carreira de esportista, dedicou-se à área de negócios e\nà administração pública. Na década de 1980, criou a MB Comércio de\nArtigos Esportivos e Promoções Ltda., empresa da qual se tornou\nsócio-proprietário. Em 1990, ocupou durante seis meses o cargo de\ndiretor comercial da Telefônica do Estado do Rio de Janeiro (Telerj).\nAinda nesse ano voltou à Itália, onde encerrou a carreira de jogador\nprofissional de vôlei na equipe do Gabbiano.\n\nDe volta ao Brasil, durante o governo do presidente Fernando Collor de\nMelo (1990-1992), foi convidado a assumir a Secretaria Nacional de\nDesportos em substituição ao jogador de futebol Artur Antunes Coimbra\n(Zico). Ocupou o cargo entre 24 de abril de 1991 e 1^o^ de outubro de\n1992. Nesse período, tratou inicialmente da regulamentação da Lei n^o^\n8.672/1993, mais conhecida como Lei Zico, junto ao Congresso. Iniciou um\nprograma de âmbito nacional para o desenvolvimento da prática de\nesportes, trazendo para o Brasil 20 professores cubanos de educação\nfísica, e construiu um Centro Integrado de Apoio à Criança numa área de\n350 mil metros quadrados cedida pelo Exército, em Jacarepaguá, no Rio de\nJaneiro. Diante da falta de recursos para enviar a delegação brasileira\nàs Olimpíadas de Barcelona em 1992, buscou apoio junto às empresas\nestatais, que passaram a associar a sua imagem a atletas que se\ndestacavam em diferentes modalidades. Para resolver o problema da verba\na ser destinada ao esporte encaminhou um projeto de lei reservando 4% do\nimposto sobre as loterias para o setor. Como secretário, foi designado\npresidente do Conselho Nacional de Desportos. Tornou-se também membro\nefetivo do Comitê Olímpico Brasileiro.\n\nEm outubro de 1994 foi eleito deputado estadual no Rio de Janeiro na\nlegenda do Partido da Social Democracia Brasileira (PSDB). Anulado o\npleito por determinação do Tribunal Regional Eleitoral (TRE) do Rio de\nJaneiro por suspeita de fraude, nas eleições de 15 de novembro do mesmo\nano não obteve o número de votos necessários para eleger-se. Entretanto,\nem novembro de 1996 o Tribunal Superior Eleitoral (TSE) decidiu revogar\no pleito de novembro de 1994 e restabelecer o resultado de outubro.\nConsiderando que as denúncias de fraude não tinham sido devidamente\ncomprovadas pelo TRE, o TSE determinou uma nova diplomação dos deputados\nde acordo com o resultado da primeira eleição. Vitorioso no primeiro\npleito, Bernard foi empossado na Assembleia Legislativa do Rio de\nJaneiro em 7 de fevereiro de 1997.\n\nNo exercício do mandato ocupou a vice-presidência da Comissão de\nEducação, Cultura e Desportos e da Comissão de Economia, Indústria,\nComércio e Turismo e foi membro da Comissão de Ciência, Energia e\nTecnologia. Vice-líder da bancada do PSDB, conseguiu aprovar oito\nprojetos de lei tratando de temas relacionados à ecologia, educação, uso\nde drogas, adolescência e esportes. Envolveu-se na campanha pelo\nreconhecimento da profissão de professor de educação física, conseguindo\nque o projeto de autoria do deputado federal Eduardo Mascarenhas\n(PSDB-RJ) fosse aprovado na sessão plenária da Câmara realizada em 30 de\njulho de 1997.\n\nDisputou a reeleição em outubro de 1998 e obteve uma suplência. Deixou a\nAssembleia Legislativa fluminense em janeiro do ano seguinte, ao final\nda legislatura.\n\nCasou-se com Michele Rajzman, com quem teve dois filhos e, em segundas\nnúpcias, com Carmem Guize Rajzman, com quem teve um filho.\n\nFONTES: CURRIC. BIOG.; *Dia* (19/7, 25/10/1997); *Fluminense* (13/5, 17,\n18/8, 28, 29/9, 7, 14, 11/11/1997); *Globo* (20/3/1996, 24/12/1997);\nINF. BIOG.; *Jornal dos Sports* (17/11/1997).\n","ref":"FONTES: CURRIC. BIOG.; *Dia* (19/7, 25/10/1997); *Fluminense* (13/5, 17,\n18/8, 28, 29/9, 7, 14, 11/11/1997); *Globo* (20/3/1996, 24/12/1997);\nINF. BIOG.; *Jornal dos Sports* (17/11/1997).\n","dic":"DPRRJ"}
