{"title":"RAMOS, Hugo","cargoss":["Constituinte","Deputado Estadual","Senador"],"cargos_esp":["est GB","GB",0],"datas_ini":[1960,1961,1978],"datas_fim":[1961,1962,1983],"estados":[0,0,"RJ"],"autor":[0],"content":"**RAMOS, Hugo**\n\n\\* const. est. GB 1960-1961; dep. est. GB 1961-1962; sen. RJ 1978-1983.\n\n*Hugo Ramos Filho* nasceu em Florianópolis no dia 17 de setembro de\n1914, filho de Hugo Ramos e de Juraci Fausto de Sousa Ramos. Seu avô\npaterno, Vidal Ramos, foi governador de Santa Catarina (1902-1905 e\n1910-1914), deputado federal (1906-1910 e 1927-1929) e senador\n(1914-1927 e 1935-1937) pelo mesmo estado. Seu tio Nereu Ramos teve\nintensa vida política: foi governador (1935-1937) e interventor\n(1937-1945) em Santa Catarina, vice-presidente (1946-1951) e presidente\nda República (novembro de 1955 a janeiro de 1956) e ministro da Justiça\n(1956-1957).\n\nRadicado no Rio de Janeiro, então Distrito Federal, desde 1919,\nbacharelou-se em 1938 pela Faculdade de Direito de Niterói e durante\nalgum tempo foi serventuário de Justiça. Ingressou na vida política em\n1946 filiando-se ao Partido Social Democrático (PSD), em cuja legenda\nelegeu-se vereador no Rio de Janeiro. Reeleito sucessivamente, em 1957\npresidiu a Câmara dos Vereadores carioca.\n\nEm 1960, em decorrência da transferência da capital do país para\nBrasília e da transformação do antigo Distrito Federal em estado da\nGuanabara, elegeu-se deputado estadual constituinte. Foi vice-presidente\nda comissão encarregada de elaborar a Constituição do novo estado e,\napós a promulgação da nova Carta (27/3/1961), passou a exercer o mandato\nordinário. Após ter concluído o mandato em 1962, retirou-se da política,\nretornando à sua banca de advocacia.\n\nEm novembro de 1974, elegeu-se suplente de senador na legenda do\nMovimento Democrático Brasileiro (MDB), partido de oposição ao regime\nmilitar vigente no país desde abril de 1964, criado a partir do Ato\nInstitucional n^o^ 2 (17/10/1965), que extinguiu os partidos políticos\nexistentes. Já após a fusão da Guanabara com o antigo estado do Rio,\nconsumada em março de 1975, ocupou uma cadeira no Senado, vaga em\ndecorrência do falecimento, em fevereiro de 1978, do senador Danton\nJobim. Participou das comissões de Justiça e Segurança Nacional e, com o\ntérmino do mandato em janeiro de 1983, encerrou sua carreira política,\nvoltando a advogar.\n\nFaleceu no Rio de Janeiro no dia 31 de julho de 1993.\n\nEra casado com Diva Cavalcanti Caruso Ramos, com quem teve dois filhos.\nO mais velho, Gilberto Ramos, foi eleito vice-prefeito do Rio de Janeiro\nem 1992, na chapa encabeçada por César Maia. Empossado em janeiro de\n1993, acumulou a vice-prefeitura com o cargo de secretário de\nAdministração do município do Rio de Janeiro. Deixou ambos os cargos em\ndezembro de 1996.\n\nFONTES: *Globo* (3/8/1993); INF. Assessoria de Gilberto Ramos; SENADO.\n*Dados biográficos* (1975-1983).\n","ref":"FONTES: *Globo* (3/8/1993); INF. Assessoria de Gilberto Ramos; SENADO.\n*Dados biográficos* (1975-1983).\n","dic":"DPRRJ"}
