{"title":"RANGEL, Alfredo de Sousa","cargoss":["Deputado Estadual"],"cargos_esp":[0],"datas_ini":[1923],"datas_fim":[1929],"estados":["RJ"],"autor":["Raimundo Helio Lopes"],"content":"**RANGEL, Alfredo de Sousa**\n\n\\* dep. est. RJ 1923-1929.\n\n*Alfredo de Sousa Rangel* nasceu na cidade de Macaé (RJ).\n\nFormou-se em medicina e farmácia na Faculdade de Medicina do Rio de\nJaneiro e exerceu por muitos anos sua profissão na cidade de Niterói\n(RJ). Atuou na fundação da Faculdade de Medicina desta cidade e foi um\ndos seus professores.\n\nEm 1921 se candidatou a uma vaga na Assembleia Legislativa, mas não\nconseguiu ser eleito.\n\nFoi eleito deputado estadual pelo primeiro distrito eleitoral, com sede\nem Niterói, em 28 de outubro de 1923, no pleito realizado durante a\nintervenção federal no estado do Rio de Janeiro. Durante a intervenção\nfederal, decretada em 10 de janeiro de 1923 pelo então presidente da\nRepública Artur Bernardes (1922-1926), o estado foi governado pelo\ninterventor Aureliano Leal, que fechou a Assembleia Legislativa do\nEstado do Rio de Janeiro (ALERJ) e anulou as eleições de 9 de julho de\n1922 realizadas para a sucessão do então presidente estadual Raul Veiga\n(1918-1922), quando os candidatos Raul Fernandes e Feliciano Sodré\ndeclararam-se eleitos, ocasionando a dualidade da ALERJ.\n\nFoi eleito na legenda do Partido Republicano Fluminense (PRF). Com o\ninício dos trabalhos legislativos, em 27 de novembro, participou do\nreconhecimento pela ALERJ da eleição de Feliciano Sodré para presidente\ndo Rio de Janeiro (1923-1927), encerrando o período de intervenção\nfederal do estado. Nesse mesmo ano foi eleito segundo vice-presidente da\nassembleia e membro da Comissão Especial para apurar e verificar os\npoderes do presidente e do vice-presidente eleitos para o quatriênio de\n1923 a 1927 e da Comissão de Higiene e Instrução Pública. Em 7 de abril\nde 1924, quando o então presidente da Assembleia Legislativa Horácio\nMagalhães Gomes renunciou ao posto de deputado estadual, assumiu a\npresidência da Casa, mas nas novas eleições realizadas para esse cargo\nperdeu o pleito para Eduardo Portela. Nesse mesmo ano tornou-se membro\nda Comissão de Finanças e Força Pública e foi eleito primeiro\nvice-presidente. Para esse posto foi sucessivamente reeleito até o final\ndeste mandato. Em 1925 integrou as comissões de Higiene e Instrução\nPública, de Finanças e Força Pública e a Comissão Especial para apurar e\nverificar os poderes do vice-presidente eleito João Maria da Rocha\nWerneck para complementar o quatriênio de 1923 a 1927, em substituição a\nPaulino José Soares de Sousa. Em 1926, último ano desta legislatura, fez\nparte das mesmas comissões.\n\nEm abril de 1927 foi reeleito deputado estadual na chapa oficial do PRF.\nNesse mesmo ano foi eleito primeiro-secretário da Mesa Diretora da Casa.\nEm 1928 foi eleito presidente da Assembleia Legislativa e reeleito no\nano seguinte.\n\nFaleceu em dezembro de 1929, na cidade de Niterói, em pleno exercício do\ncargo.\n\n*Raimundo Helio Lopes*\n\nFONTES: ASSEMB. LEGISL. RJ. *Anais* (1923-1926); *Estado* (13/11/1923,\n23/3/1927).\n","ref":"FONTES: ASSEMB. LEGISL. RJ. *Anais* (1923-1926); *Estado* (13/11/1923,\n23/3/1927).\n","dic":"DPRRJ"}
