{"title":"RANGEL, Darci","cargoss":["Deputado Estadual","Deputado Estadual","Deputado Estadual","Deputado Estadual","Constituinte"],"cargos_esp":["GB","GB","GB",0,"est"],"datas_ini":[1967,1966,1965,1975,1975],"datas_fim":[1975,0,0,1979,1975],"estados":[0,0,0,"RJ","RJ"],"autor":["Adriana Gomes"],"content":"**RANGEL, Darci**\n\n\\* dep. est. GB 1965, 1966, 1967-1975; dep. est. RJ 1975-1979; const.\nest. RJ 1975.\n\n*Darci Alves Rangel* nasceu no dia 2 de março de 1916.\n\nFiliado ao Partido Democrata Cristão (PDC), obteve uma suplência de\ndeputado estadual no estado da Guanabara, no pleito de 1962. Substituiu\ntemporariamente o deputado Luís Carlos Mancini (PDC) no mês de maio de\n1965, Francisco Gama Filho em dezembro desse mesmo ano e Everardo\nMagalhães Castro, do Movimento Democrático Brasileiro (MDB), entre\njaneiro e março de 1966.\n\nFoi eleito deputado estadual nas eleições de 1966, assumindo o mandato\nno dia 1^o^ de fevereiro de 1967. Nessa legislatura integrou as\ncomissões de Administração e Redação e de Economia, Viação e Obras\nPúblicas. Além disso, participou como titular nas comissões\nparlamentares de inquérito (CPI) para apurar a situação dos posseiros na\nchamada “zona rural” e para apurar irregularidades na Secretaria de\nObras Públicas.\n\nEm 15 de novembro de 1970 Darci Rangel foi reeleito deputado estadual e\nassumiu o mandato em 31 de fevereiro de 1971. Na Assembleia Legislativa\ndo Estado da Guanabara (ALEG) foi vice-presidente das comissões de\nObras, Serviços Públicos e Turismo e de Economia, Agricultura, Indústria\ne Comércio. Também foi vice-presidente da CPI para apurar o tráfico e o\nconsumo abusivo de tóxicos no estado.\n\nNas eleições de 1974 foi reeleito deputado estadual no estado da\nGuanabara. O presidente Ernesto Geisel havia enviado um projeto de lei\nao Congresso Nacional que previa a fusão dos estados da Guanabara e do\nRio de Janeiro e que, depois de rápida tramitação, foi transformado em\nlei em julho de 1974. Os deputados estaduais, que haviam sido eleitos em\nnovembro de 1974 pelos dois antigos estados e tomado posse em fevereiro\nde 1975 para os mandatos ordinários, passaram a formar, em março, a\nAssembleia Constituinte encarregada de elaborar a Constituição do novo\nestado do Rio de Janeiro – resultante da fusão que ocorreria no dia 15\nde março. Nesse mesmo dia tomou posse o governador nomeado almirante\nFaria Lima.\n\nNa Assembleia Constituinte, instalada no dia 15 de março, Darci Rangel\nfoi suplente na Comissão Constitucional. Na ocasião a maioria emedebista\nera ligada a Chagas Freitas e defendia que não se prolongasse no tempo\nos trabalhos constituintes. Em apenas quatro meses a nova Carta foi\nfinalizada.\n\nCom a promulgação da nova Constituição estadual em 23 de julho de 1975,\nretornou ao exercício do mandato ordinário na Assembleia Legislativa do\nEstado do Rio de Janeiro (ALERJ). Deixou a ALERJ no início de 1979, ao\nfim da legislatura.\n\n*Adriana Gomes*\n\nFONTES: ASSEMB. LEGISL. GB. *Informação e produtos parlamentares*\n(1960-1975); ASSEMB. LEGISL. RJ. *Anais* (1960, 1961, 1964-1971, 1975);\nEleições Pós-1945. Disponível em:\n\\<www.eleicoespos1945.com/19451965/rio\\_df\\_1958\\_estaduais\\_udn.htmla\\>.\nAcesso em: 24/6/2010.\n","ref":"FONTES: ASSEMB. LEGISL. GB. *Informação e produtos parlamentares*\n(1960-1975); ASSEMB. LEGISL. RJ. *Anais* (1960, 1961, 1964-1971, 1975);\nEleições Pós-1945. Disponível em:\n\\<www.eleicoespos1945.com/19451965/rio\\_df\\_1958\\_estaduais\\_udn.htmla\\>.\nAcesso em: 24/6/2010.\n","dic":"DPRRJ"}
