{"title":"BARCELOS, Cristóvão","cargoss":["Revolucionário ou revoltoso","Constituinte","Constituinte","Deputado Estadual","Chefe do Estado-Maior do Exército"],"cargos_esp":[0,0,"est",0,0],"datas_ini":[1930,1934,1935,1935,1944],"datas_fim":[1930,1934,1935,1936,1946],"estados":[0,0,"RJ","RJ",0],"autor":["Renato Lemos"],"content":"**BARCELOS, Cristóvão**\n\n\\* militar; rev. 1930; const. 1934; const. est. RJ 1935; dep. est. RJ\n1935-1936; ch. EME 1944-1946.\n\n*Cristóvão de Castro Barcelos* nasceu em Campos (RJ) no dia 25 de julho\nde 1883, filho de João Gomes Sobral Barcelos e de Teresa de Castro\nBarcelos.\n\nEstudou no Liceu de Humanidades de Campos e em 1901 assentou praça,\ningressando depois na Escola Militar do Brasil, no Rio de Janeiro, então\nDistrito Federal. Declarado aspirante a oficial em 1909, foi promovido a\nsegundo-tenente em 1911 e a primeiro-tenente em outubro de 1917. Em\njaneiro de 1918 seguiu para a França, integrando a comissão brasileira\nde estudos, operações de guerra e aquisição de material. Em plena\nPrimeira Guerra Mundial, acompanhou operações dos aliados e fez cursos\nna Escola de Saint-Cyr. Em janeiro de 1919, ainda na França, foi\npromovido a capitão por atos de bravura praticados durante a guerra. De\nvolta ao Brasil em junho seguinte, ingressou em março de 1922 na Escola\nde Estado-Maior do Exército, no Rio, cujo curso concluiu em janeiro de\n1925. Entre fevereiro de 1927 e fevereiro de 1930 chefiou a 3^a^\nCircunscrição de Recrutamento, sediada em Vitória. Foi promovido a major\nem novembro de 1928 e a tenente-coronel em fevereiro de 1930.\n\nNesse mesmo mês, durante a campanha eleitoral para a sucessão do\npresidente Washington Luís (1926-1930), chefiou a caravana oposicionista\nda Aliança Liberal que percorreu os estados do Rio de Janeiro e do\nEspírito Santo. Em Vitória, reagiu a tiros ao ataque movido por forças\npoliciais contra os oposicionistas, que realizavam um grande comício e\nendereçavam duras críticas ao governo federal. Em outubro, participou da\nrevolução que depôs Washington Luís, chefiando tropas na região situada\nentre as cidades mineiras de Além-Paraíba e Carangola. Quando, logo após\na tomada do poder pelos revolucionários, vários grupos começaram a se\nreunir em segredo, procurando chegar a uma forma de organização que\npudesse manter e defender os princípios da revolução, frequentou as\nreuniões de um desses grupos, embriões do futuro Clube 3 de Outubro, no\nbairro carioca da Gávea. A elas costumavam comparecer também Virgílio de\nMelo Franco, Juraci Magalhães, Herculino Cascardo, João Alberto Lins de\nBarros e outros.\n\nPromovido a coronel em abril de 1931, assumiu em junho desse ano o\ncomando da Escola de Estado-Maior do Exército. Em julho de 1932, com a\neclosão da Revolução Constitucionalista de São Paulo, combateu os\npaulistas à frente do Destacamento Coronel Barcelos, envolvido em\nchoques na região da serra da Mantiqueira (MG). Em setembro, foi\npromovido a general de brigada. Após a derrota dos constitucionalistas\n(outubro de 1932) e a posterior convocação de eleições para a Assembleia\nNacional Constituinte em maio de 1933, participou, em dezembro de 1932,\nda fundação do Partido Socialista Fluminense (PSF). Dois meses depois,\ndesligou-se do PSF e engajou-se na tentativa de unificar partidariamente\nos antigos aliados de Nilo Peçanha. Entretanto, frustraram-se os\nesforços de unificação dos nilistas, resultando daí a criação de dois\npartidos: a União Progressista Fluminense (UPF), liderada por Cristóvão\nBarcelos e José Eduardo Prado Kelly, e o Partido Popular Radical (PPR),\nchefiado por Raul Fernandes e José Eduardo de Macedo Soares.\n\nNa Constituinte\n\nMembro da primeira comissão diretora da UPF, Cristóvão Barcelos foi um\ndos quatro deputados eleitos na legenda do partido para a Assembleia\nNacional Constituinte em maio de 1933. Logo após a instalação da\nAssembleia em novembro de 1933, foi um dos protagonistas da disputa que\nse travou pela presidência da mesa diretora. A direção da Constituinte\ntinha particular importância política, já que um dos encargos de seus\nmembros seria a eleição do presidente da República.\n\nO chefe do governo provisório, Getúlio Vargas, tentando articular sua\npermanência no poder, procurava consolidar a aliança com setores das\noligarquias regionais. Nesse sentido, apoiou a indicação de Antônio\nCarlos Ribeiro de Andrada, deputado pelo Partido Progressista de Minas\nGerais e ex-presidente de seu estado, para a presidência da Assembleia.\nOutras candidaturas se apresentaram, inclusive a de Cristóvão Barcelos,\nque teria, segundo o informe do líder político mineiro Virgílio de Melo\nFranco a Getúlio Vargas, o apoio de deputados classistas e de\nrepresentantes das oposições do Distrito Federal, Bahia e São Paulo.\nCirculavam também no palácio Tiradentes, onde se reuniam os\nconstituintes, rumores de que o capitão-tenente Ari Parreiras,\ninterventor no estado do Rio de Janeiro, e o general Pedro Aurélio de\nGóis Monteiro, pretendente à sucessão de Vargas, viam com simpatia a\ncandidatura do general Barcelos. Entretanto, nas eleições para a\npresidência da mesa realizadas no dia 13 de novembro, Cristóvão Barcelos\nrecebeu apenas um voto contra os 138 que elegeram Antônio Carlos.\nCoube-lhe o posto de segundo-vice-presidente da Assembleia.\n\nNa sessão de 7 de dezembro, propôs a transferência da capital do país\npara o ponto mais central do território brasileiro, argumentando que sua\nexperiência na Primeira Guerra Mundial, quando Paris e Londres foram\nespecialmente visadas, ensinava que a sede do governo federal deveria\nsituar-se em um local mais protegido do ponto de vista militar. A\nproposta, contudo, não foi aceita.\n\nEm janeiro de 1934, foi um dos constituintes que se opuseram à proposta\ndo líder da maioria, Antônio Medeiros Neto, no sentido de inverter a\nordem dos trabalhos da Assembleia, de modo que a eleição do presidente\nda República ocorresse antes que se promulgasse a nova Constituição.\nContrário à proposta, participou de uma reunião no gabinete do general\nGóis Monteiro, a que também compareceram Virgílio de Melo Franco, João\nAlberto e Valdemar Mota, e em que ficou concertada a aceitação da\nFórmula Simões Lopes, sugerida pelo deputado Augusto Simões Lopes,\nsegundo a qual a eleição presidencial seria precedida da votação, em\nprimeiro turno, do projeto da Constituição.\n\nNo mês de março, quando se discutiu na Assembleia a possibilidade de\nprorrogação dos mandatos dos constituintes, que desse modo executariam\nfunções para as quais não haviam sido eleitos, assumiu posição\ndecididamente contrária à medida. Na semana seguinte, em reunião com os\nlíderes de bancadas, pronunciou-se sobre a concessão do direito de voto\naos sargentos, questão que dividia as oposições dentro do próprio\nExército. Argumentando que se produziriam efeitos nefastos para a\ndisciplina militar, solicitou que fosse encontrada uma forma de recuar,\nanulando a decisão já tomada. Sua proposta foi debatida, mas acabou\nrecusada pela maioria dos líderes.\n\nEm junho, já perto do final dos trabalhos constituintes, votou,\njuntamente com Nilo Alvarenga e Asdrúbal Gwyer de Azevedo, a favor de\nque a Assembleia atribuísse ao presidente da República, até a\npromulgação da nova Constituição, os poderes discricionários conferidos\nem 1930 ao cargo de presidente, atribuindo-lhe funções próprias dos\npoderes Executivo e Legislativo.\n\nCom Prado Kelly, Nilo Alvarenga e Abelardo Marinho, assinou as emendas\nn^o^ 897, criando o Conselho Federal, responsável pelo planejamento\nquinquenal da produção do país, e n^o^ 899, garantindo o direito à\neducação para todos os brasileiros. Integrou ainda a comissão nomeada\npelo presidente da Assembleia para apresentar a Getúlio Vargas\ncongratulações pela decretação da anistia para os acusados de crimes\npolíticos.\n\nA sucessão fluminense de 1935\n\nEncerrados os trabalhos da Constituinte em julho de 1934, com a\npromulgação da nova Constituição e a eleição de Vargas para a\npresidência daRepública, entrou em fase decisiva o processo de\nreconstitucionalização nos estados. Em outubro, realizaram-se eleições\npara a Câmara dos Deputados e para as constituintes estaduais,\nencarregadas também de eleger governadores e senadores. No estado do\nRio, a UPF elegeu 19 deputados, enquanto a coligação do PSF com o\nPartido Popular Radical conseguiu fazer 23 representantes.\n\nDois fatores, porém, tornavam especialmente complexa a conjuntura\npolítica fluminense. Em primeiro lugar, também no estado do Rio se\nregistrava uma característica do processo de reconstitucionalização nas\ndemais unidades da Federação: o governo federal, através dos\ninterventores, não lograra organizar-se politicamente de forma autônoma,\npermanecendo ligado a alianças com os tradicionais setores oligárquicos.\nDessa maneira, o interventor Ari Parreiras não conseguia dirigir sua\nprópria sucessão, disputada pelo general Barcelos, candidato da UPF e\napoiado pelo Partido Evolucionista do Distrito Federal e por um deputado\ndissidente do PSF, e o almirante Protógenes Guimarães, ministro da\nMarinha e candidato da Coligação Radical Socialista.\n\nO segundo fator a tornar mais complexa a conjuntura política fluminense\nera a interferência do governo federal e de alguns governos estaduais na\nsucessão. Mal haviam terminado os trabalhos da Assembleia Nacional\nConstituinte, já iam avançadas as articulações entre forças empenhadas\nnas eleições diretas para a presidência da República, previstas para os\nprimeiros meses de 1938. O governo do estado do Rio assumia assim grande\nimportância, atraindo a atenção de diversos grupos relevantes no plano\nnacional. Os governos do Rio Grande do Sul e de Minas Gerais apoiavam\nCristóvão Barcelos, enquanto os governos federal e de São Paulo eram\nfavoráveis a Protógenes Guimarães.\n\nApós tentar em vão um acordo entre os partidos adversários, o\ninterventor, sentindo fugir-lhe ao controle o processo eleitoral,\napresentou ao presidente Vargas, em janeiro de 1935, sua renúncia ao\ncargo, no que não foi atendido. Agravaram-se, a partir de então, as\nsuspeitas de que o governo federal estaria preparando a substituição do\ninterventor por algum elemento ligado ao seu esquema político. Em\ntelegrama datado de março de 1935, o general Barcelos denunciava a José\nAntônio Flores da Cunha, interventor no Rio Grande do Sul, as supostas\nmanobras do presidente.\n\nDe acordo com um relatório apresentado em setembro a Getúlio Vargas pelo\nministro da Justiça, Vicente Rao, Cristóvão Barcelos teria sido instado\npor Benedito Valadares, interventor federal em Minas Gerais e seu amigo\nparticular, a procurar uma solução conciliatória com os demais partidos\nfluminenses. Insistira porém em manter sua candidatura ao governo\nestadual, declarando, além disso, que “chegaria até à inimizade pessoal\ncom o presidente, não hesitando em levantar a rebelião no estado e a\nmorrer na luta”.\n\nEm 25 de setembro de 1935 realizaram-se as eleições, marcadas por atos\nde violência que chegaram a provocar ferimentos a bala em um deputado do\nPSF e no próprio general Barcelos. O almirante Protógenes Guimarães\nvenceu o pleito, mas a UPF entrou com recurso alegando as precárias\ncondições de segurança em que este fora realizado, e conseguiu que a\nJustiça Eleitoral anulasse o resultado e convocasse novas eleições.\n\nFlores da Cunha, empenhado em obstruir o projeto continuísta de Vargas,\napoiou o recurso impetrado pelo general Barcelos, acusando o presidente\nde pressionar os constituintes fluminenses, através do ministro da\nJustiça, para que votassem em Protógenes Guimarães. No dia 12 de\nnovembro de 1935 realizaram-se novas eleições, vencidas por um voto de\ndiferença pelo almirante Protógenes. As relações entre Vargas e Flores\nda Cunha deterioraram-se aceleradamente a partir dessa disputa\neleitoral, e às vésperas da decretação do Estado Novo (novembro de 1937)\nFlores da Cunha acabaria renunciando ao governo gaúcho e partindo para o\nexílio.\n\nDe volta à caserna\n\nDe fevereiro de 1936 a março de 1937 o general Barcelos comandou a 8^a^\nBrigada de Infantaria e em dezembro de 1937 assumiu o comando da 7^a^\nRegião Militar, sediada em Recife. Promovido a general de divisão em\njunho de 1938, deixou o comando da 7^a^ RM em agosto.\n\nEm janeiro de 1939 passou a presidir a Comissão Central de Requisições\ndo Exército e até 1942 comandou a 4^a^ Região Militar e a 4^a^ Divisão\nde Infantaria, ambas em Minas Gerais. Ainda em 1942 desempenhou as\nfunções de inspetor do 3^o^ Grupo de Regiões Militares e, em dezembro,\nfoi nomeado chefe da Comissão do Rio de Janeiro na Comissão Mista de\nDefesa Brasil-Estados Unidos, criada para regular a participação das\nforças militares dos dois países na defesa continental. Permaneceria na\ncomissão até 1944. De 1943 a 1945 integrou a Comissão de Promoções do\nExército, e em dezembro de 1944 tornou-se chefe do Estado-Maior do\nExército. Ocupou o cargo mesmo depois da queda de Getúlio Vargas\n(29/10/1945), até fevereiro de 1946.\n\nFaleceu no Rio de Janeiro em 1946.\n\nFoi casado com Olga de Carvalho Barcelos.\n\nRenato Lemos\n\nFONTES: ASSEMB. NAC. CONST. 1934. *Anais*; CÂM. DEP. *Deputados*;*Encic.\nMirador*; FUND. GETULIO VARGAS. *Cronologia* *da Assembleia*; GODINHO,\nV. *Constituintes*; *Grande encic. Delta*;LAGO, L. *Generais*; MIN.\nGUERRA. *Almanaque* (1944); MIN. REL. EXT. *Relatório*; NOVAIS, M.\n*História*; SILVA, H. *1930*; SILVA, H*. 1932*; SILVA, H. *1933*; SILVA,\nH. *1934*; SILVA, H. *1935*; SILVA, H. *1937*; SILVA, H. *1944.*\n","ref":"FONTES: ASSEMB. NAC. CONST. 1934. *Anais*; CÂM. DEP. *Deputados*;*Encic.\nMirador*; FUND. GETULIO VARGAS. *Cronologia* *da Assembleia*; GODINHO,\nV. *Constituintes*; *Grande encic. Delta*;LAGO, L. *Generais*; MIN.\nGUERRA. *Almanaque* (1944); MIN. REL. EXT. *Relatório*; NOVAIS, M.\n*História*; SILVA, H. *1930*; SILVA, H*. 1932*; SILVA, H. *1933*; SILVA,\nH. *1934*; SILVA, H. *1935*; SILVA, H. *1937*; SILVA, H. *1944.*\n","dic":"DPRRJ"}
