{"title":"REINALDO BETÃO","cargoss":["Deputado federal"],"cargos_esp":[0],"datas_ini":[2003],"datas_fim":[2007],"estados":["RJ"],"autor":["Sabrina Guerghe"],"content":"**REINALDO BETÃO**\n\n\\* dep. fed. RJ 2003-2007.\n\n*Reinaldo Pereira Pinto* nasceu em Duque de Caxias (RJ) no dia 7 de\nfevereiro de 1959, filho de Gélcio Pereira Pinto e de Geni Pereira\nPinto.\n\nCursou o antigo segundo grau técnico em contabilidade no Colégio\nVisconde de Mauá, em Magé (RJ).\n\nEm 2001 filiou-se ao Partido Social Democrata Cristão (PSDC) e em 2002\npresidiu o diretório do PSDC em Magé. Em outubro foi eleito deputado\nfederal. Antes mesmo de assumir o mandato, ingressou no Partido Liberal\n(PL). Em fevereiro de 2003 assumiu o mandato na Câmara, integrando as\ncomissões de Desenvolvimento Econômico, Indústria e Comércio, de\nDireitos Humanos e Minorias, de Economia, Indústria, Comércio e Turismo,\nde Turismo e Desporto e de Viação e Transportes.\n\nEm maio de 2004 foi um dos acusados de participar de um esquema com\nempresas do grupo Planam para a venda a municípios de ambulâncias\nsuperfaturadas, adquiridas com dinheiro proveniente de emendas\napresentadas por parlamentares que, em troca, receberiam comissão. O\nesquema foi revelado por uma operação da Polícia Federal e investigado\npela Comissão Parlamentar Mista de Inquérito (CPMI) dos Sanguessugas. Na\nocasião, negou qualquer tipo de envolvimento com a “máfia dos\nsanguessugas” e disse que jamais recebera ou aceitara promessa de\n“comissão” para destinar emendas parlamentares para a saúde ou qualquer\noutra área. Ainda no mesmo ano teve seu nome citado em escutas\ntelefônicas feitas pelo Ministério Público em trabalho conjunto com a\nPolícia Federal para investigar a chamada “máfia dos combustíveis”. Em\noutubro concorreu à prefeitura de Magé, mas não foi eleito.\n\nEm março de 2006 foi escolhido vice-líder do PL. Ainda nesse ano teve\nsua candidatura à reeleição indeferida pelo Tribunal Regional Eleitoral\ndo Rio de Janeiro (TRE-RJ) em função das denúncias de que teria\nparticipado do esquema dos Sanguessugas. Contudo, Betão recorreu ao\nTribunal Superior Eleitoral (TSE), que deferiu sua candidatura. Em\noutubro concorreu a uma vaga na Câmara dos Deputados pelo estado do Rio,\nnão conseguindo eleger-se. Deixou assim a Câmara dos Deputados em\njaneiro de 2007, ao final da legislatura.\n\nAinda em 2007 assumiu a Secretaria de Agricultura e Abastecimento do\nmunicípio de Duque de Caxias, na prefeitura de Washington Reis\n(2005-2009).\n\nNas eleições de outubro de 2010, já filiado ao Partido da República\n(PR), concorreu sem sucesso a uma vaga na Assembleia Legislativa do\nEstado do Rio de Janeiro (ALERJ).\n\n*Sabrina Guerghe*\n\nFONTES: Câmara dos Deputados; *Correio Brasiliense* (9/7/2006); *O Dia\nOnline* (29/7/2006); Agência Brasil (21/8, 25/8, 17/10/2006); *Folha de\nS.Paulo Online* (2/10/2006); Prefeitura de Duque de Caxias (17/5/2007).\n","ref":"FONTES: Câmara dos Deputados; *Correio Brasiliense* (9/7/2006); *O Dia\nOnline* (29/7/2006); Agência Brasil (21/8, 25/8, 17/10/2006); *Folha de\nS.Paulo Online* (2/10/2006); Prefeitura de Duque de Caxias (17/5/2007).\n","dic":"DPRRJ"}
