{"title":"REIS, Alberto Rajão","cargoss":["Deputado Estadual"],"cargos_esp":["GB"],"datas_ini":[1967],"datas_fim":[1969],"estados":[0],"autor":[0],"content":"**REIS, Alberto Rajão**\n\n\\* jornalista; dep. est. GB 1967-1969.\n\n*Alberto Rajão Reis* nasceu no dia 24 de novembro de 1939, filho de\nAntônio Fonseca Oliveira Reis e de Estela Rajão Reis.\n\nFoi deputado estadual no Estado da Guanabara na legenda do Movimento\nDemocrático Brasileiro (MDB). Tomou posse no dia 1^o^ de fevereiro de\n1967 e teve seu mandato cassado e seus direitos políticos suspensos por\ndez anos no dia 14 de março de 1969. Fez parte da chamada “Ala\nRenovadora” do MDB, junto com os deputados Fabiano Vilanova, Aluísio\nCaldas, Ciro Kurtz, Iara Vargas, Mário Saladini e Sebastião Contrucci.\nSeu mandato foi marcado por intensa atividade política de oposição ao\nRegime Militar e pela ligação estreita com o movimento estudantil na\ncidade do Rio de Janeiro. Ocupou em diversas oportunidades a tribuna da\nassembleia para registrar as manifestações estudantis, a invasão da\nUniversidade de Brasília pelas tropas do Exército e o assassinato do\nestudante Edson Luís pela Polícia Militar no restaurante Calabouço. Seu\nmandato debateu ainda temas de caráter nacionalista, como a venda de\nterras na Amazônia para estrangeiros e homenageou os artistas Clementina\nde Jesus e Alfredo Rocha Viana, o Pixinguinha.\n\nFoi filiado ao Partido Comunista Brasileiro (PCB). Foi jornalista do\n*Correio da Manhã* e de *O Estado de S. Paulo*.\n\n*Felipe Maia Guimarães da Silva*\n\nFONTES: ARQ. PÚB. RJ. *Fundo polícias políticas*; ASSEMB. LEGISL. RJ.\n*Dossiês parlamentares*.\n","ref":"FONTES: ARQ. PÚB. RJ. *Fundo polícias políticas*; ASSEMB. LEGISL. RJ.\n*Dossiês parlamentares*.\n","dic":"DPRRJ"}
