{"title":"REIS, Malvino da Silva","cargoss":["Constituinte","Deputado Estadual"],"cargos_esp":["est",0],"datas_ini":[1891,1891],"datas_fim":[1891,1891],"estados":["RJ","RJ"],"autor":[0],"content":"**REIS, Malvino da Silva**\n\n\\* const. est. RJ 1891; dep. est. RJ 1891.\n\n*Malvino da Silva Reis* foi engenheiro, negociante no Rio de Janeiro,\ncoronel comandante do primeiro corpo de cavalaria da Guarda Nacional,\ncomendador da Ordem da Rosa, da Ordem de Cristo de Portugal e da Ordem\nde São Gregório Magno de Roma.\n\nNa década de 1860 foi vereador na cidade do Rio de Janeiro, então\ncapital do Império.\n\nElegeu-se deputado estadual nas primeiras eleições realizadas após a\nproclamação da República (15/11/1889) para a formação da Assembleia\nConstituinte fluminense. Esse pleito, realizado em 20 de março de 1891,\nfoi vencido pelos partidários do presidente do estado do Rio de Janeiro,\nFrancisco Portela (1889-1891), nomeado pelo presidente da República,\nmarechal Deodoro da Fonseca (1889-1891). Os portelistas derrotaram os\ncandidatos do Partido Republicano, de oposição ao governo, liderados por\nJosé Tomás da Porciúncula.\n\nNa Constituinte estadual, reunida a partir de 10 de maio, Malvino da\nSilva Reis e os demais deputados promulgaram a primeira Constituição\nrepublicana fluminense e elegeram Portela presidente constitucional. As\nsessões ordinárias desse ano se encerraram em novembro, mesmo mês em que\nDeodoro da Fonseca renunciou ao governo da República, transferindo-o ao\nvice-presidente Floriano Peixoto. Diante desse conturbado contexto\npolítico, no dia 10 de dezembro, Portela renunciou à presidência do\nestado do Rio de Janeiro por não ter mais o apoio do poder federal. Seu\nsucessor, Carlos Baltasar da Silveira (1891-1892), revogou a\nConstituição republicana fluminense, fechou o Congresso estadual e\nconvocou uma nova Assembleia Constituinte. Diante disso, Malvino da\nSilva Reis perdeu o mandato.\n\nAinda na década de 1890 ocupou a direção da Companhia Ferro-Carril do\nJardim Botânico e em 1894 assinou um contrato com a prefeitura do Rio de\nJaneiro, então Distrito Federal, visando levar linhas de bondes para o\nLeme.\n\nPublicou *Proposta apresentada ao Corpo Legislativo pelo dr. Honório\nAugusto Ribeiro* (1880), *O Brasil político, industrial, agrícola e\ncomercial* (1884) e *Situação* *econômica do Brasil* (1884).\n\n*Samuel Silva Rodrigues de Oliveira*\n\nFONTES: BLAKE, A. *Dic.*; *Diário Oficial da União* (4/8/1903);\nFERREIRA, M. *República*; MEDEIROS, M. *Conservatório*;Sindegtur.\n*Resumo histórico de Ipanema*. Disponível em:\n\\<www.sindegtur.org.br/2006/arquivos/ipanema.pdf\\>. Acesso em: 4/8/2010;\nTEIXEIRA, M. *Excesso*.\n","ref":"FONTES: BLAKE, A. *Dic.*; *Diário Oficial da União* (4/8/1903);\nFERREIRA, M. *República*; MEDEIROS, M. *Conservatório*;Sindegtur.\n*Resumo histórico de Ipanema*. Disponível em:\n\\<www.sindegtur.org.br/2006/arquivos/ipanema.pdf\\>. Acesso em: 4/8/2010;\nTEIXEIRA, M. *Excesso*.\n","dic":"DPRRJ"}
