{"title":"REIS, Vieira","cargoss":["Deputado federal"],"cargos_esp":[0],"datas_ini":[2003],"datas_fim":[2007],"estados":["RJ"],"autor":["Isadora Tavares Maleval"],"content":"**REIS, Vieira**\n\n\\* dep. fed. RJ 2003-2007.\n\n*Jaildo Vieira Reis* nasceu em Camacan (BA) no dia 6 de julho de 1959,\nfilho de Hildo Francisco dos Reis e de Senhorinha Barbosa Vieira.\n\nFez o curso de aptidão profissional para radialista na Federação\nNacional dos Radialistas Profissionais e dos Trabalhadores em Empresas\nde Rádio e Televisão, em 1998. Em 2000, bacharelou-se em teologia na\nFaculdade de Educação Teológica no Estado de São Paulo (Fatebom).\n\nEm 2001 filiou-se ao Partido do Movimento Democrático do Brasil (PMDB) e\nem outubro de 2002 foi eleito deputado federal pelo estado do Rio de\nJaneiro na legenda do PMDB. Em dezembro, mudou o nome parlamentar de\nBispo Vieira Reis para Vieira Reis. Assumiu o mandato em fevereiro de\n2003 e ao longo da legislatura foi segundo vice-presidente da Comissão\nde Ciência e Tecnologia, Comunicação e Informática, e membro das\ncomissões de Relações Exteriores e de Defesa Nacional, de Constituição e\nJustiça e de Cidadania, de Direitos Humanos e Minorias, e de Segurança\nPública e Combate ao Crime Organizado.\n\nEm julho de 2003 apresentou requerimento, junto com o deputado José\nDivino, solicitando a instalação da Comissão Parlamentar de Inquérito\n(CPI) das Privatizações, que investigou as privatizações realizadas\nentre 1990 e 2002, nas gestões de Fernando Collor de Mello, Itamar\nFranco e Fernando Henrique Cardoso. Ainda em 2003 votou a favor das\npropostas de reforma da Previdência e tributária encaminhadas pelo\npresidente Luís Inácio Lula da Silva. Em 2005 filiou-se ao Partido\nMunicipalista Renovador (PMR), que no ano seguinte passaria a se chamar\nPartido Republicano Brasileiro (PRB). Foi acusado, no relatório parcial\napresentado pela chamada CPI dos Sanguessugas, de envolvimento no\nesquema de compra superfaturada de ambulâncias por prefeituras\nmunicipais. Não disputou a reeleição em outubro de 2006 e deixou a\nCâmara em janeiro de 2007, ao final da legislatura.\n\nFoi eleito vereador na cidade de Campos (RJ) no pleito de 2008 na\nlegenda do PRB.\n\n*Isadora Tavares Maleval*\n\nFONTES: CÂM. DEP. Disponível em:\n\\<www.camara.gov.br/Internet/deputado/Dep\\_Detalhe.asp?id=522385\\>.\nAcesso em: 11/9/2009, \\<www.camara.gov.br/vieirareis/\\>. Acesso em:\n11/9/2009; CÂM. MUN. CAMPOS DOS GOYTACAZES. Disponível em:\n\\<www.camaracampos.rj.gov.br/vereadores.php?noticia=11\\>. Acesso em:\n11/9/2009; Congresso em Foco. Disponível em:\n\\<http://congressoemfoco.ig.com.br/NoticiaPrint.aspx?id=10540\\>. Acesso\nem: 11/9/2009; *Folha*. Disponível em:\n\\<www1.folha.uol.com.br/folha/brasil/ult96u80490.shtml\\>. Acesso em:\n11/9/2009. Rádio Agência. Disponível em:\n\\<www.radioagencianp.com.br/index.php?option=com\\_content&task=view&id=821&Itemid=43\\>.\nAcesso em: 11/9/2009.\n","ref":"FONTES: CÂM. DEP. Disponível em:\n\\<www.camara.gov.br/Internet/deputado/Dep\\_Detalhe.asp?id=522385\\>.\nAcesso em: 11/9/2009, \\<www.camara.gov.br/vieirareis/\\>. Acesso em:\n11/9/2009; CÂM. MUN. CAMPOS DOS GOYTACAZES. Disponível em:\n\\<www.camaracampos.rj.gov.br/vereadores.php?noticia=11\\>. Acesso em:\n11/9/2009; Congresso em Foco. Disponível em:\n\\<http://congressoemfoco.ig.com.br/NoticiaPrint.aspx?id=10540\\>. Acesso\nem: 11/9/2009; *Folha*. Disponível em:\n\\<www1.folha.uol.com.br/folha/brasil/ult96u80490.shtml\\>. Acesso em:\n11/9/2009. Rádio Agência. Disponível em:\n\\<www.radioagencianp.com.br/index.php?option=com\\_content&task=view&id=821&Itemid=43\\>.\nAcesso em: 11/9/2009.\n","dic":"DPRRJ"}
