{"title":"BARCELOS, Licínio Chaves","cargoss":["Constituinte","Deputado Estadual"],"cargos_esp":["est",0],"datas_ini":[1891,1891],"datas_fim":[1891,1891],"estados":["RJ","RJ"],"autor":[0],"content":"**BARCELOS, Licínio Chaves**\n\n\\* const. est. RJ 1891; dep. est. RJ 1891.\n\n*Licínio Chaves Barcelos* nasceu no Rio Grande do Sul em 23 de agosto de\n1857.\n\nBacharelou-se em ciências físicas e matemáticas.\n\nNo Rio de Janeiro foi professor da Escola Politécnica e do Colégio Pedro\nII e participou das conferências populares da freguesia da Glória, entre\n1873 e 1883, para discutir assuntos ligados às ciências e à educação.\n\nCandidatou-se a uma vaga de deputado estadual no estado do Rio de\nJaneiro no pleito de 20 de março de 1891 – primeiras eleições realizadas\napós a proclamação da República (15/11/1889). Partidário do presidente\ndo estado do Rio de Janeiro, Francisco Portela (1889-1891), foi eleito e\nno mesmo ano assumiu uma cadeira na Assembleia Legislativa do Estado do\nRio de Janeiro (ALERJ).\n\nDurante o mandato integrou a Constituinte estadual, reunida a partir de\n10 de maio, e assinou a primeira Constituição fluminense. As sessões\nordinárias desse ano se encerraram em novembro, mesmo mês em que Deodoro\nda Fonseca (1889-1891) renunciou ao governo da República, transferindo-o\nao vice-presidente Floriano Peixoto (1891-1894). Diante desse conturbado\ncontexto político, no dia 10 de dezembro de 1891, Portela renunciou à\npresidência do estado do Rio de Janeiro por não ter mais o apoio do\npoder federal. Seu sucessor, Carlos Baltasar da Silveira (1891-1892),\nrevogou a Constituição republicana fluminense, fechou o Congresso\nestadual e convocou uma nova Assembleia Constituinte. Licínio Chaves\nBarcelos perdeu, então, o mandato.\n\nFoi, ainda, professor de cálculo na Escola Politécnica do Rio de\nJaneiro.\n\nFaleceu em Fortaleza no dia 19 de janeiro de 1895.\n\nPublicou *Álgebra* (1885).\n\n*Samuel Silva Rodrigues de Oliveira*\n\nFONTES: BASTOS, M. *Conferências*; BIELINSKI, A. *Educação*; BLAKE, A.\n*Dicionário*; CONGRESSO BRAS. HIST. EDU. *Anais*; *Diário Oficial da\nUnião* (13/11/1893); FERREIRA, S. *Colégio*;FERREIRA, M. *República*;\nMILLER, C. *Doutorado*.\n","ref":"FONTES: BASTOS, M. *Conferências*; BIELINSKI, A. *Educação*; BLAKE, A.\n*Dicionário*; CONGRESSO BRAS. HIST. EDU. *Anais*; *Diário Oficial da\nUnião* (13/11/1893); FERREIRA, S. *Colégio*;FERREIRA, M. *República*;\nMILLER, C. *Doutorado*.\n","dic":"DPRRJ"}
