{"title":"RIBEIRO, Antônio Francisco","cargoss":["Constituinte","Deputado Estadual"],"cargos_esp":["est",0],"datas_ini":[1892,1892],"datas_fim":[1892,1894],"estados":["RJ","RJ"],"autor":[0],"content":"**RIBEIRO, Antônio Francisco**\n\n\\* const. est. RJ 1892; dep. est. RJ 1892-1894.\n\n*Antônio Francisco Ribeiro* foi advogado em Campos (RJ) desde o Império,\nquando assumiu varias demandas jurídicas relacionadas à escravidão.\nAtingiu grande notoriedade pelos conhecimentos de direito atuando como\njurisconsulto emérito na reforma judiciária do estado. Ainda durante o\nImpério foi deputado da Assembleia Provincial.\n\nDepois da proclamação da República aderiu ao novo regime. Foi eleito, em\n31 de janeiro de 1892, para a nova Assembleia Estadual Constituinte\nformada após a renúncia do então presidente do estado do Rio de Janeiro\nFrancisco Portela (1889-1891). Com a saída do então chefe do poder\nestadual, a Assembleia Legislativa do Estado do Rio de Janeiro (ALERJ)\nfoi dissolvida, assim como foi anulada a primeira Constituição\nrepublicana fluminense que havia sido promulgada por Portela e seus\npartidários quando da formação da primeira constituinte estadual em\n1891.\n\nA nova assembleia, composta por partidários do Partido Republicano\nFluminense (PRF) liderados por José Tomás da Porciúncula, procurou\nreorganizar os estatutos jurídicos do estado que tinham sido\nconstituídos para favorecer Francisco Portela e representou o início do\ndomínio do PRF na política estadual.\n\nApós a promulgação da nova Constituição, em 9 de abril de 1892, foram\nrealizadas novas eleições para o Legislativo estadual no dia 24 do mesmo\nmês. Nesse pleito Antônio Francisco Ribeiro foi eleito deputado estadual\nna legenda do PRF e, na ALERJ, fez parte das comissões de Justiça e\nLegislação, de Redação das Leis, de Fazenda e Orçamento do Estado e de\nEstatística, Divisão Civil e Judiciária.\n\nDurante seu mandato fez várias críticas ao ex-presidente Francisco\nPortela. Apresentou várias demandas representando o município de Campos.\nEm 1892 pediu que se reconsiderasse o contrato celebrado pelo\nex-presidente com a Companhia Inglesa para abastecimento de água para\nCampos. Acusou a companhia de não cumprir o contrato de fornecimento a\ncada casa e cobrar preços exorbitantes pelo serviço prestado, acusado de\nbaixa qualidade. Ainda sobre o contrato, criticou o fato de Portela de\nter concedido um monopólio de exploração das águas do rio Paraíba e pelo\nfato de a empresa vir descumprindo o contrato de prestação de serviço.\n\nNo plenário da ALERJ, quando teve sua identificação republicana\nquestionada, fez longo discurso acentuando sua posição liberal,\ncontrária à monarquia (definida por ele como “antigo regime”) que\nmanteve um regime de privilégios e preferências pessoais. Participou da\nreforma judiciária e política do estado do Rio, com várias intervenções\nno debate legislativo. Fazia considerações sobre a legislação do Império\ncomo meio de definir os novos regulamentos e o caráter liberal da ordem\na ser instituída no estado.\n\nInterferiu na definição dos projetos relativos à organização dos\nmunicípios, à organização das eleições municipais e estaduais e à\norganização jurídica do Estado. Na organização dos municípios defendeu o\nprincípio da autonomia das câmaras municipais para governarem as\ncidades; na reforma eleitoral defendeu o voto distrital e a\nrepresentação da minoria, descentralizando a representação política; na\nreforma do Judiciário defendeu a liberdade individual e limites à\natividade do juiz e da força policial para evitarem o abuso de poder.\nDiscutiu a relação entre o Tribunal de Contas e o Executivo estadual. Em\n1893 pediu que se observasse a Constituição no que toca à nomeação de\njuízes e sua relação com o Executivo.\n\nEm 1894 fez uma interpretação da lei que retirava a soberania do\nTribunal de Contas, concedendo mais poder ao presidente do estado,\nlevando em conta as “contingências do momento” em que se enfrentava uma\ncrise política e econômica.\n\nFaleceu em 16 de setembro de 1894, em pleno exercício do mandato\nlegislativo.\n\n*Samuel Silva Rodrigues de Oliveira*\n\nFONTES: ASSEMB. LEGISL. RJ. *Anais* (1892-1894); FERREIRA, M.\n*República*.\n","ref":"FONTES: ASSEMB. LEGISL. RJ. *Anais* (1892-1894); FERREIRA, M.\n*República*.\n","dic":"DPRRJ"}
