{"title":"RIBEIRO, Darci","cargoss":["Reitor","Ministro da Educação","Chefe do Gabinete Civil da Presidência da República","Senador"],"cargos_esp":["UnB",0,0,0],"datas_ini":[1962,1962,1963,1991],"datas_fim":[1962,1963,1964,1997],"estados":[0,0,0,"RJ"],"autor":[0],"content":"**RIBEIRO, Darci**\n\n\\* reitor UnB 1962; min. Educ. 1962-1963; ch. Gab. Civ. Pres. Rep.\n1963-1964; sen. RJ 1991-1997.\n\n*Darci Ribeiro* nasceu na cidade de Montes Claros (MG) no dia 26 de\noutubro de 1922, filho do pequeno industrial Reginaldo Ribeiro dos\nSantos e da professora primária Josefina Augusta da Silveira Ribeiro,\ncujo trabalho como alfabetizadora marcou época na cidade. Em 1925, com a\nmorte do pai, foi morar com a mãe na casa dos avós maternos, também em\nMontes Claros.\n\nEm 1939 mudou-se para Belo Horizonte, onde ingressou na Faculdade de\nMedicina. No início da década de 1940 iniciou militância no Partido\nComunista Brasileiro (PCB), então Partido Comunista do Brasil. Sem\nvocação para a carreira médica, abandonou a faculdade em 1943 e retornou\na Montes Claros. No ano seguinte transferiu-se para a capital paulista e\nmatriculou-se na Escola de Sociologia e Política de São Paulo, por onde\nse graduou em 1946, com especialização em etnologia. Em 1947 ingressou\nno Serviço de Proteção ao Índio (SPI), travando contato com o marechal\nCândido Mariano Rondon, então presidente do Conselho Nacional de\nProteção ao Índio. Nos anos seguintes, seus estudos etnológicos\nlevaram-no a viver longos períodos entre comunidades indígenas, como a\ndos cadiuéus, no sul do Mato Grosso, e a dos urubu-caapor, na floresta\namazônica.\n\nEm 1950, a partir dos resultados de suas pesquisas etnológicas entre os\ncadiuéus, publicou o seu primeiro livro – *Religião e mitologia Kadiweu*\n– que lhe valeu na ocasião o Prêmio Fábio Prado, concedido pela União de\nLiteratura de São Paulo. Dois anos mais tarde, com o apoio do marechal\nRondon, assumiu a direção da seção de estudos do SPI. Dedicou-se então a\nintensa atividade, tanto no âmbito dos estudos científicos como no de\nassessoramento na formulação da política indigenista oficial.\nEmpenhou-se na elaboração de um projeto de lei que procurava garantir\naos índios a posse coletiva e inalienável de suas terras, mas a proposta\nenfrentou forte oposição e sequer chegou a ser apreciada pelo Congresso.\n\nPor sua iniciativa foi inaugurado em 1953, no Rio de Janeiro, o Museu do\nÍndio, apontado pela Organização das Nações Unidas para a Educação, a\nCiência e a Cultura (UNESCO) como modelo no setor etnológico, por ser o\nprimeiro museu do mundo organizado com o objetivo de quebrar o\npreconceito com relação aos índios e difundir sua cultura. No Museu do\nÍndio organizou, em 1955, o primeiro curso de pós-graduação em\nantropologia cultural realizado no Brasil. Outro importante momento de\nseu trabalho no SPI foi a formulação de um projeto para a criação do\nParque Indígena do Xingu, que viria a ser implantado anos mais tarde sob\na direção dos indianistas Orlando e Cláudio Vilas-Boas. Ainda em 1953,\ningressou como professor na Escola Brasileira de Administração Pública\n(EBAP), da Fundação Getulio Vargas, onde durante dois anos lecionou\netnologia brasileira.\n\nAfastado da militância comunista desde o início de seus estudos junto\naos índios, aproximou-se do trabalhismo na época do suicídio do\npresidente Getúlio Vargas, em 1954. Nesse mesmo ano, a convite da\nOrganização Internacional do Trabalho (OIT), realizou a sua primeira\nviagem à Europa, permanecendo dois meses na cidade suíça de Genebra,\nonde colaborou com os estudos ali desenvolvidos sobre os povos indígenas\nde todo o mundo.\n\nCom a eleição de Juscelino Kubitschek em outubro de 1955 para a\npresidência da República (1956-1961), foi convidado a colaborar na\nelaboração das diretrizes para o setor educacional do novo governo.\nTrabalhou então com o pedagogo Anísio Teixeira, que exerceria forte\ninfluência sobre a sua formação. Nessa época, deixou a direção da seção\nde estudos do SPI e passou a integrar o corpo docente da Faculdade\nNacional de Filosofia da Universidade do Brasil, atual Instituto de\nFilosofia e Ciências Sociais da Universidade Federal do Rio de Janeiro\n(IFCS-UFRJ), ficando responsável pelas cadeiras de etnologia brasileira\ne língua tupi-guarani.\n\nDesignado por Anísio Teixeira, passou a dirigir em 1957 a divisão de\nestudos sociais do Centro Brasileiro de Pesquisas Educacionais (CBPE),\nvinculado ao Ministério da Educação. Ali orientou pesquisas\nsocioantropológicas sobre os efeitos sociais dos processos de\nindustrialização e urbanização no Brasil. Sob sua direção, o CBPE passou\na publicar a *Revista de Educação e Ciências Sociais*. Na mesma época\nparticipou ativamente, junto com Anísio Teixeira, da campanha em defesa\nda escola pública, procurando interferir no processo de elaboração da\nLei de Diretrizes e Bases para a Educação, em discussão no Congresso.\n\nEm 1959, através de um decreto presidencial, foi encarregado de planejar\na montagem da Universidade de Brasília (UnB), tarefa para a qual\nconvocou um grupo de cientistas e pesquisadores, a maioria pertencentes\nà Sociedade Brasileira para o Progresso da Ciência (SBPC). Brasília foi\ninaugurada em 21 de abril de 1960, e em janeiro de 1961 Juscelino\nKubitschek transferiu o governo ao novo presidente Jânio Quadros. A\nrenúncia de Jânio em agosto de 1961 abriu no país um intenso debate em\ntorno da questão sucessória, uma vez que a posse do vice-presidente João\nGoulart era contestada por diversos setores do governo e das forças\narmadas, devido às suas estreitas ligações com o trabalhismo. Vetado\npelos três ministros militares de Jânio – o marechal Odílio Denis, da\nGuerra, o almirante Sílvio Heck, da Marinha, e o brigadeiro Gabriel Grün\nMoss, da Aeronáutica –, Goulart acabou sendo empossado no dia 7 de\nsetembro graças à aprovação, no dia 2, da Emenda Constitucional n^o^ 4,\nque implantou no país o regime parlamentarista, reduzindo os poderes do\nExecutivo e ampliando os do Congresso.\n\nEm 15 de dezembro seguinte foi sancionada a Lei n^o^ 3.998, que\nautorizou a criação da UnB. A universidade seria inaugurada em 21 de\nabril de 1962, tendo Darci Ribeiro como seu primeiro reitor.\n\nNo Ministério da Educação e no Gabinete Civil\n\nEm agosto de 1962 Darci Ribeiro deixou a reitoria da UnB, onde foi\nsubstituído por Anísio Teixeira, e assumiu o Ministério da Educação e\nCultura em substituição a Roberto Lira, passando a compor o gabinete\nchefiado pelo primeiro-ministro Hermes Lima. Como ministro da Educação,\ncriou o Fundo Nacional de Ensino e determinou a aplicação de 12% da\nreceita da União no aperfeiçoamento e desenvolvimento do ensino, o que,\nembora constitucionalmente previsto, só ocorreu de fato durante sua\ngestão.\n\nEm janeiro de 1963, por ocasião do retorno do país ao regime\npresidencialista, Darci Ribeiro deixou o Ministério da Educação e\nCultura, onde foi substituído por Teotônio Monteiro de Barros Filho,\npara assumir a chefia do Gabinete Civil da Presidência da República, em\nsubstituição a Evandro Lins e Silva.\n\nO período presidencialista do governo Goulart transcorreu sob crescente\ninsatisfação de setores civis e militares que acusavam o presidente de\nfavorecer a atuação de esquerdistas no governo, o que constituiria uma\nameaça à segurança nacional. O descontentamento tornou-se mais agudo\nquando, no dia 13 de março de 1964, em comício que reuniu milhares de\ntrabalhadores na estação da Central do Brasil, no Rio de Janeiro,\nGoulart reafirmou seu propósito de implantar as chamadas reformas de\nbase – agrária, administrativa, bancária e fiscal. O agravamento da\ncrise político-institucional nos dias que se seguiram culminou com a\ndeflagração do movimento político-militar que depôs o presidente em 31\nde março.\n\nNessa ocasião, Darci Ribeiro foi um dos poucos membros do governo a\ntentar organizar uma resistência em defesa do regime democrático.\nDiante, porém, da quase total ausência de disposição dos aliados de\nGoulart para resistir aos militares, deixou o país nos primeiros dias de\nabril e exilou-se no Uruguai. No dia 10 de abril foi destituído de seus\ndireitos políticos pelo Ato Institucional n^o^ 1 (AI-1), editado na\nvéspera pelo Comando Supremo da Revolução, integrado pelo general Artur\nda Costa e Silva, o almirante Augusto Rademaker e o brigadeiro Francisco\nde Assis Correia de Melo. Também com base no AI-1, foi demitido de seus\ncargos de professor da Universidade do Brasil e de etnólogo do SPI.\n\nNo exílio\n\nNo exílio, Darci Ribeiro lecionou antropologia na Universidade da\nRepública Oriental do Uruguai, em Montevidéu, e desenvolveu uma série de\ntrabalhos relacionados com o sistema universitário, entre os quais a\norganização e direção do Seminário de Reforma da Universidade da\nRepública e a organização da Enciclopédia de Cultura do Uruguai. Por\nessa época começou a escrever seus *Estudos de antropologia da\ncivilização*, obra constituída por cinco volumes publicados ao longo de\nvários anos, na qual procurou estabelecer uma interpretação global do\nprocesso de formação dos povos americanos, particularmente o brasileiro,\ne das causas de seu desenvolvimento desigual. O primeiro volume da\nsérie, *O processo civilizatório*, foi publicado em 1968, vindo em\nseguida *As Américas e a civilização*, *O dilema da América Latina*, *Os\nbrasileiros* e *Os índios e a civilização*.\n\nAinda em 1968, os processos que lhe eram movidos no Brasil pelo novo\nregime foram anulados pelo Supremo Tribunal Federal, o que lhe\npossibilitou retornar ao país em outubro. Por essa época, no entanto,\nacirrava-se o clima de polarização política entre o governo e a\noposição, que culminou com a edição do AI-5 em 13 de dezembro. Logo em\nseguida à edição do ato, Darci foi preso e indiciado sob a acusação de\ninfringir a Lei de Segurança Nacional. Permaneceu detido em unidade da\nMarinha até setembro do ano seguinte, quando foi afinal julgado e\nabsolvido pela Auditoria da Marinha do Rio de Janeiro. Em seguida,\nvoltou a deixar o país, fixando-se em Caracas, na Venezuela, onde\nlecionou e organizou o projeto de reforma da Universidade Central da\nRepública. Em 1971, convidado pelo presidente chileno Salvador Allende\npara assessorá-lo, transferiu-se para Santiago, onde trabalhou também\ncomo professor pesquisador do Instituto de Estudos Internacionais da\nUniversidade do Chile. No ano seguinte transferiu-se para o Peru, onde\ncolaborou com o governo do general Juan Velasco Alvarado. Dirigiu o\nprograma de integração das universidades peruanas e trabalhou na\norganização do Centro de Participação Social, patrocinado pela\nOrganização das Nações Unidas (ONU). Em dezembro de 1974, vítima de um\ncâncer pulmonar, foi autorizado pelo governo brasileiro a voltar ao\npaís. Foi então submetido a uma intervenção cirúrgica para a extração de\num dos pulmões. Permaneceu no Brasil apenas seis meses, tempo necessário\npara restabelecer-se, e em maio de 1975 retornou ao Peru.\nPosteriormente, elaborou estudos para universidades de diversos países\nlatino-americanos e da Argélia.\n\nEm 1976 retornou definitivamente ao Brasil, fixando-se no Rio de\nJaneiro. No ano seguinte, participou da XXIX Reunião Anual da SBPC,\nrealizada em São Paulo. Na ocasião analisou o sistema educacional\nbrasileiro e fez severas críticas ao Movimento Brasileiro de\nAlfabetização (Mobral), declarando que as verbas gastas por esse órgão\npara a alfabetização de adultos deveriam ser concentradas no ensino\nfundamental, uma vez que milhares de crianças no país continuavam\nprivadas de acesso à escola primária, situação que produziria uma nova\ngeração de adultos analfabetos. Suas declarações repercutiram na\nimprensa, onde foram contestadas pelo então presidente do Mobral,\nArlindo Lopes Correia.\n\nRetorno à vida política\n\nCom o gradual processo de redemocratização da vida política nacional,\niniciado no governo do general Ernesto Geisel (1974-1979), Darci Ribeiro\npassou a proferir sucessivas conferências em universidades brasileiras,\nocupando-se particularmente da campanha em defesa dos povos indígenas e\ndenunciando como “falsa” a proposta de emancipação dos índios defendida\npelo governo militar. No início de 1979 publicou seu primeiro romance,\n*Maíra*, logo traduzido para outros idiomas e sucessivamente reeditado\nem português.\n\nEm agosto daquele ano, o general João Batista Figueiredo – empossado em\nmarço na presidência da República – assinou lei concedendo anistia a\ntodos os punidos pelo regime instaurado no país em 1964. Favorecido pela\nmedida, Darci Ribeiro foi em seguida reintegrado ao IFCS-UFRJ, onde\nassumiu o cargo de diretor adjunto do Programa de Pós-Graduação em\nCiências Sociais. Ainda em 1979, foi eleito membro do conselho diretor\nda Faculdade Latino-Americana de Ciências Sociais (Flacso) e recebeu, em\nParis, o título de doutor *honoris* *causa* da Sorbonne, título que lhe\nseria concedido por várias outras instituições, tais como a Universidade\nde Copenhague, a Universidade da República Oriental do Uruguai, a\nUniversidade Central da Venezuela e a Universidade de Brasília.\n\nEm novembro de 1979 foram extintos os partidos políticos existentes no\npaís e traçadas as diretrizes para a instauração do pluripartidarismo,\niniciando-se as articulações para a formação de novas agremiações\npolíticas. Ao lado de Leonel Brizola, ex-governador do Rio Grande do\nSul, Darci Ribeiro empenhou-se na reorganização do Partido Trabalhista\nBrasileiro (PTB), numa tentativa de reviver o trabalhismo anterior a\n1964. A sigla do PTB, porém, era também disputada pelo grupo político\nliderado pela ex-deputada paulista Ivete Vargas. Em maio de 1980, o\nTribunal Superior Eleitoral, em polêmica decisão, concedeu ao grupo de\nIvete Vargas o controle da histórica legenda trabalhista. A corrente\norganizada sob a liderança de Brizola adotou então o nome de Partido\nDemocrático Trabalhista (PDT), incorporando-se Darci Ribeiro aos seus\nquadros.\n\nEm agosto de 1980, Darci viajou à Holanda para participar do Tribunal\nBertrand Russel sobre crimes cometidos contra os índios na América\nLatina. Nessa ocasião, teceu fortes críticas à diretoria da Fundação\nNacional do Índio (Funai), que sucedeu o SPI, segundo ele entregue a “um\ngrupo de coronéis sem qualquer formação filosófica ou científica”. Por\nconta dessa declaração, teve o seu pedido de reintegração aos quadros da\nFunai indeferido pelo ministro do Interior, Mário Andreazza.\n\nEm março de 1982, Darci Ribeiro foi lançado candidato a vice-governador\ndo estado do Rio de Janeiro na legenda do PDT, na chapa encabeçada por\nLeonel Brizola. Realizado o pleito em novembro, a chapa pedetista\nsagrou-se vencedora com cerca de 34% dos votos válidos, derrotando\noutros quatro concorrentes, entre os quais Wellington Moreira Franco, do\nPartido Democrático Social (PDS), apoiado pelo governo federal, e Miro\nTeixeira, do Partido do Movimento Democrático Brasileiro (PMDB), apoiado\npelo então governador fluminense Chagas Freitas.\n\n*DHBB 1983*\n\nO primeiro governo Brizola (1983-1986)\n\nEmpossado como vice-governador, Darci acumulou ainda o cargo de\nsecretário estadual de Ciência e Cultura e passou a coordenar o Programa\nEspecial de Educação, cuja principal meta era a implantação dos Centros\nIntegrados de Educação Pública (CIEPs). Idealizados por Darci, os CIEPs\neram unidades de ensino básico voltadas prioritariamente para a\npopulação de baixa renda e previstas para funcionar em regime de turno\nintegral, onde as crianças, além da educação tradicional, receberiam\nalimentação e assistência médica, e participariam de atividades de\ncultura e lazer. O projeto inicial do governo fluminense era construir\nquinhentos CIEPs ao longo de quatro anos, com investimento superior a um\nbilhão de dólares. Ao fim do governo, porém, somente 127 unidades\nestavam em funcionamento. Segundo seus críticos, a implantação dos\nCIEPs, além de precária, se dava em detrimento das unidades escolares\nconvencionais pertencentes ao governo do estado, que sequer recebiam os\ninvestimentos necessários à sua manutenção. Os representantes sindicais\ndos profissionais da educação, por sua vez, criticaram ostensivamente a\npolítica salarial adotada pelo governo estadual na área educacional,\nclassificando-a como incompatível com um ensino público de qualidade.\n\nEntre as iniciativas de Darci Ribeiro nesse período, destacaram-se\ntambém a criação da Fábrica de Escolas, voltada para a implantação dos\nCIEPs; a criação da Biblioteca Pública Estadual e da Casa de Cultura\nLaura Alvim; o apoio à implantação da Casa França-Brasil; a construção\ndo Sambódromo, projetado pelo arquiteto Oscar Niemeyer e destinado à\nrealização do desfile oficial das escolas de samba, sendo ainda\naproveitado no resto do ano para abrigar escolas de primeiro e segundo\ngraus.\n\nAs eleições de 1886 e de 1889\n\nEm 1986, com a proximidade das eleições para os governos estaduais, o\nPDT indicou o nome de Darci Ribeiro para a sucessão de Leonel Brizola.\nPara compor a chapa como vice-governador, o partido apresentou o\ndeputado estadual Cláudio Moacir, oriundo da ala chaguista do PMDB,\nadversária do PDT na política fluminense. Segundo Darci, o PDT\nnecessitava realizar alianças para vencer as eleições, devendo mesmo, em\nsua opinião, atuar como uma frente política empenhada prioritariamente\nna eleição de Leonel Brizola para a presidência da República. A partir\ndaí se tornaria um partido de características marcadamente ideológicas.\n\nIniciada a campanha eleitoral, logo se verificou a polarização da\ndisputa entre as candidaturas de Darci Ribeiro e de Moreira Franco, que\ntrocara o PDS pelo PMDB e reunira em torno de seu nome uma ampla\ncoligação partidária. Moreira Franco centrou seu discurso de campanha no\ncombate à violência e nas críticas ao desempenho do governo de Brizola\nna área de segurança pública, acusando o PDT de ser conivente com o\ncrime organizado. Tais acusações ganharam maior dimensão quando, em 20\nde outubro, reunidos numa churrascaria do Rio, os chefes do jogo do\nbicho da cidade, na presença de Darci e do candidato do PDT ao Senado,\nMarcelo Alencar, celebraram um pacto para ajudar o candidato pedetista a\nvencer as eleições. A adesão foi justificada por um dos chefes da\ncontravenção pelo fato de terem exercido suas atividades com\ntranquilidade no governo Brizola. Darci, por sua vez, nessa e em outras\nocasiões, classificou o jogo do bicho como legítima instituição da\ncultura carioca, ignorando as denúncias que associavam seus dirigentes\nao tráfico de armas e entorpecentes. Realizado o pleito em 15 de\nnovembro, a vitória coube a Moreira Franco, que obteve uma vantagem de\ncerca de oitocentos mil votos sobre Darci Ribeiro, o segundo colocado.\n\nEm maio de 1987, convidado pelo governador de Minas Gerais Newton\nCardoso, do PMDB, Darci Ribeiro assumiu a Secretaria Extraordinária de\nDesenvolvimento Social do estado. Ao ser empossado, declarou que sua\nprincipal meta era a construção de mil CIEPs em Minas ao longo dos\nquatro anos do governo. Em setembro seguinte, no entanto, abandonou o\ncargo, acusando o governo mineiro de não levar a sério o programa de\ninstalação dos CIEPs. Ainda em setembro foi convidado pelo governador de\nSão Paulo, Orestes Quércia, do PMDB, a colaborar com Oscar Niemeyer no\nplanejamento cultural do Memorial da América Latina, inaugurado em\njaneiro de 1989.\n\nNa eleição presidencial de 1989, a primeira a se realizar por via direta\nno país após quase 30 anos, o PDT apresentou a candidatura de Leonel\nBrizola, seu principal dirigente. Darci se empenhou na campanha do\npartido, percorrendo todo o Brasil. Sua principal tarefa foi organizar\ngrupos de intelectuais, sindicalistas, professores e técnicos para\ndiscutir e elaborar, setor por setor, o programa de governo de Brizola.\nContudo, realizado o primeiro turno do pleito em novembro, o candidato\npedetista obteve a terceira colocação, ficando de fora da disputa do\nsegundo turno, para o qual se habilitaram Fernando Collor de Melo,\nlançado pelo Partido da Reconstrução Nacional (PRN), e Luís Inácio Lula\nda Silva, candidato do Partido dos Trabalhadores (PT). O PDT optou no\nsegundo turno pelo apoio a Lula, afinal derrotado por Fernando Collor em\ndisputa marcada por acirrada polarização ideológica.\n\nAinda em 1989, Darci Ribeiro foi condecorado pelo presidente cubano\nFidel Castro com a medalha Haydée Santamaria, em comemoração aos 30 anos\nda Revolução Cubana e da Casa das Américas, a mais importante editora\ndaquele país.\n\nNo Senado\n\nEm outubro de 1990, Darci Ribeiro foi eleito senador pelo estado do Rio\nde Janeiro na legenda do PDT, no mesmo pleito que reconduziu Leonel\nBrizola ao comando do Executivo fluminense. Darci tomou posse no Senado\nem fevereiro do ano seguinte, para aquele que seria o único mandato\nlegislativo de toda a sua trajetória política.\n\nSua atividade parlamentar privilegiou temas relacionados à realidade\neducacional do país, em particular a elaboração da nova Lei de\nDiretrizes e Bases da Educação Nacional (LDB). Outra iniciativa\nimportante foi a apresentação do projeto que deu origem à lei de\ntransplantes de órgãos, segundo a qual todos aqueles que, em vida, não\nregistrassem legalmente a sua condição de não doadores de órgãos seriam\nconsiderados potenciais doadores após a morte. O projeto invertia a\nlegislação em vigor, que considerava doadores apenas aqueles que em vida\nmanifestassem esse desejo através de documento registrado em cartório,\nfator que constituía grave obstáculo à realização de transplantes. Darci\napresentou, também, um projeto de lei de controle de substâncias\nviciantes que, ao estabelecer a obrigatoriedade para os fabricantes de\ncola industrial de adicionar em sua fórmula uma substância atóxica,\nprocurava combater o consumo da chamada “cola de sapateiro” pelos\nmenores de rua.\n\nOutra marca de sua atuação no Senado goram as críticas à política de\nabertura econômica implementada pelo presidente Fernando Collor e a\noposição ao projeto governista de privatização das empresas estatais.\nSegundo Darci, somente as empresas inoperantes, que não desempenhassem\npapel social ou econômico relevante, poderiam eventualmente ser\nprivatizadas, ficando excluídas desse universo todas aquelas cujo\nfuncionamento sob controle do Estado fosse importante para a autonomia\nnacional.\n\nA par de sua atividade como senador, Darci mais uma vez colaborou com a\nadministração de Leonel Brizola no governo do estado do Rio de Janeiro.\nAmplamente reconhecido como o principal nome do PDT na área educacional,\nrecebeu de Brizola a incumbência de retomar o programa de implantação\ndos CIEPs e de coordenar a criação da Universidade Estadual do Norte\nFluminense (UENF), no município de Campos, concebida para ser um centro\ngerador de tecnologia avançada, voltada para o apoio ao desenvolvimento\neconômico do estado. Em setembro de 1991, Darci licenciou-se de seu\nmandato no Senado para assumir a Secretaria de Projetos Especiais de\nEducação do governo fluminense, cujo principal objetivo era promover a\nretomada da implantação dos CIEPs, bem como colaborar na implantação de\nsua versão em âmbito federal, os Centros Integrados de Apoio à Criança\n(CIACs) criados pelo governo Collor. Sua cadeira no Senado foi então\nocupada pelo suplente Abdias Nascimento, ligado ao movimento negro.\n\nNo comando de sua secretaria no governo fluminense, Darci voltou a\nreceber críticas de entidades sindicais, setores da imprensa e\nparlamentares da oposição, que denunciaram o desequilíbrio na\ndistribuição das verbas destinadas à educação. Segundo essas críticas,\nao privilegiar a Secretaria de Projetos Especiais e os CIEPs, o governo\ncondenava ao abandono as demais unidades escolares, que continuavam\nsubordinadas à Secretaria de Educação. O Sindicato Estadual dos\nProfissionais da Educação (SEPE), por sua vez, insistia na análise de\nque a implantação de um ensino público de qualidade era incompatível com\na realidade salarial imposta aos professores e demais trabalhadores do\nsetor educacional.\n\nEm 1992, já de volta ao Senado, Darci votou favoravelmente à abertura de\num processo de *impeachment* do presidente Fernando Collor, acusado de\nenvolvimento com um esquema de corrupção na administração federal\ncomandado pelo empresário Paulo César Farias, seu amigo pessoal e\nex-tesoureiro da sua campanha eleitoral. Afastado pela Câmara dos\nDeputados em 29 de setembro, Collor foi julgado e condenado pelo Senado\nem 29 de dezembro e, embora tenha renunciado ao cargo horas antes da\ndecisão dos senadores, foi então definitivamente afastado da presidência\ne teve seus direitos políticos cassados por oito anos.\n\nEm outubro de 1992, Darci Ribeiro foi eleito membro da Academia\nBrasileira de Letras, passando a ocupar a cadeira n^o^ 11 a partir de\nabril do ano seguinte.\n\nEm 1994, o PDT lançou novamente a candidatura de Leonel Brizola à\npresidência da República, tendo Darci Ribeiro como candidato a vice.\nBrizola manifestou então a sua intenção de, caso eleito, entregar o\nMinistério da Educação a Darci, que ficaria responsável pela implantação\nda escola de turno integral em todo o território nacional. A campanha\npresidencial foi marcada pela polarização entre as candidaturas de Lula,\nlançada pelo PT com o apoio de outras seis agremiações de esquerda, e a\nde Fernando Henrique Cardoso, lançada pelo Partido da Social Democracia\nBrasileira (PSDB) em aliança com o Partido da Frente Liberal (PFL) e o\nPTB. Realizado o pleito no mês de outubro, Fernando Henrique sagrou-se\nvencedor já no primeiro turno da disputa, com mais da metade dos votos\nválidos. A chapa Brizola-Darci Ribeiro conquistou apenas a quinta\ncolocação entre os oito concorrentes, recebendo pouco mais de dois\nmilhões de votos (3,2% do total dos votos válidos).\n\nEm dezembro de 1994, Darci Ribeiro foi internado em estado grave na\nUnidade de Terapia Intensiva do Hospital Samaritano, no Rio de Janeiro,\npara tratar-se de um câncer na próstata que se espalhara em metástase\npara outros órgãos. Apesar da gravidade de seu quadro de saúde, deixou o\nhospital sem ordem médica após cerca de um mês internado, dirigindo-se\npara sua casa de praia no município fluminense de Maricá. Justificou sua\natitude pela necessidade de concluir o livro *O povo brasileiro*, obra\nna qual trabalhou por cerca de 30 anos e com a qual pretendia oferecer\nsua interpretação global sobre a formação da nação brasileira – mesmo\nprojeto que já havia resultado na elaboração dos cinco volumes dos\n*Estudos de antropologia da civilização*.\n\nEm fevereiro de 1995 Darci retomou sua cadeira no Senado e passou a\nconcentrar sua atividade na elaboração da nova LDB. O projeto que\napresentou nesse sentido substituiu outro, preliminarmente aprovado na\nCâmara em 1993, cuja discussão se iniciara logo após a promulgação da\nConstituição de 1988 e se arrastara por vários anos, envolvendo\nparlamentares e entidades representativas do setor educacional. O\nsubstitutivo do senador pedetista foi criticado por entidades como a\nConfederação Nacional dos Trabalhadores da Educação (CNTE), que\ncontestaram sua legitimidade por sobrepor-se ao debate até então\ntravado. Para Darci, no entanto, a LDB aprovada na Câmara, ao\ncentralizar no âmbito federal as definições normativas sobre a\norganização educacional e submetê-las a conselhos corporativos,\ncongelava a estrutura da educação brasileira, que considerava de má\nqualidade e incapaz de atualizar-se para atender às novas demandas\nsociais e garantir os requisitos necessários ao desenvolvimento nacional\nautônomo. Na sua avaliação, a LDB deveria assumir a forma de “um diploma\nlegal sucinto, claro e genérico, para dar espaço ao exercício da\nautonomia tanto pelas escolas e universidades como pelos sistemas\nestaduais de ensino”. A nova lei abstinha-se de criar conselhos com\nfunções normativas por entender ser essa uma prerrogativa do Poder\nExecutivo, que deveria ficar responsável ainda pelo estabelecimento de\ncritérios para uma avaliação nacional do ensino em todos os níveis. No\nensino fundamental, a principal novidade introduzida pela nova LDB foi a\nexigência de formação universitária para todos os professores, inclusive\nos responsáveis pelo chamado curso primário – ou primeiro segmento do\nprimeiro grau –, para os quais, até então, era exigido apenas um curso\nde formação de professores, o curso normal, equivalente aos cursos\ntécnicos de nível secundário. As instituições de ensino universitário,\npor sua vez, passaram a desfrutar de maior autonomia para estruturar sua\ngrade curricular, estando porém obrigadas a apresentar resultados\nsatisfatórios nas avaliações de desempenho a ser regularmente promovidas\npelo Ministério da Educação, sob pena de perder seus registros de\nfuncionamento.\n\nAplaudida pelo ministro da Educação Paulo Renato Sousa, a nova LDB foi\naprovada pelo Congresso em dezembro de 1996 e sancionada no mesmo mês\npelo presidente Fernando Henrique, que, em homenagem ao senador\nfluminense, batizou-a de Lei Darci Ribeiro.\n\nDarci marcou também seu mandato no Senado pelas frequentes críticas\ndirigidas ao governo do presidente Fernando Henrique Cardoso. Apesar de\ndeclarar-se amigo pessoal do presidente e admirador de sua trajetória\nintelectual, condenou sua opção por aliar-se aos partidos políticos\nsituados à direita do espectro político nacional. Criticou especialmente\no modelo econômico implantado pelo governo, segundo ele marcado pela\nsubmissão aos interesses do grande capital internacional e conduzido por\ntecnocratas insensíveis à realidade social do país. Apontou a abertura\nindiscriminada do país ao comércio externo como a principal causa do\naumento do desemprego, e denunciou o agravamento da concentração de\nrenda como resultado da política econômica adotada pelo governo,\ncomparável segundo ele à vigente durante o regime militar. Criticou com\nveemência as privatizações de empresas estatais, em particular a venda\nda Companhia Vale do Rio Doce, por ele classificada como uma das mais\nbem-sucedidas empresas de mineração do mundo. Defendeu a realização da\nreforma agrária e classificou o Movimento dos Trabalhadores Rurais Sem\nTerra (MST) como um dos mais importantes da história do Brasil.\n\nNas votações das emendas constitucionais propostas pelo governo,\nmanifestou-se contrário à quebra do monopólio estatal da exploração do\npetróleo e da distribuição de gás canalizado, à mudança no conceito de\nempresa nacional e à quebra do monopólio nacional da navegação de\ncabotagem.\n\nDurante o ano de 1996 manteve uma coluna semanal no jornal *Folha de\nS.Paulo* e recebeu inúmeras homenagens. Em julho recebeu das mãos do\npresidente Fernando Henrique o Prêmio Anísio Teixeira, concedido pelo\ngoverno federal àqueles com atuação destacada na área educacional. Em\ndezembro foi agraciado com o Prêmio Sérgio Buarque de Holanda na\ncategoria ensaio social, concedido pela Biblioteca Nacional, pelo seu\nlivro *Diários índios*, publicado naquele ano, no qual relata sua\nexperiência junto aos índios urubu-caapor. Ainda em 1996 recebeu o\nPrêmio Interamericano de Educação Andrés Bello, concedido pela\nOrganização dos Estados Americanos (OEA). Em janeiro de 1997 foi\nagraciado com o título de “Homem de Ideias”, concedido pelo *Jornal do\nBrasil*.\n\nDarci Ribeiro faleceu no exercício do mandato de senador, em 17 de\nfevereiro de 1997, na capital federal. Seu velório, realizado no Salão\nNegro do Congresso Nacional e posteriormente na sede da Academia\nBrasileira de Letras, no Rio de Janeiro, reuniu as principais lideranças\nda política brasileira e fluminense. Em atendimento a um desejo\nmanifestado nos últimos tempos de vida, seu corpo foi encomendado por\nseu amigo pessoal, o teólogo cristão Leonardo Boff, cujas contribuições\nà chamada “Teologia da Libertação” valeram-lhe a exclusão dos quadros da\nIgreja Católica, ordenada pelo Vaticano.\n\nFoi casado com a antropóloga Berta Gleiser Ribeiro, coautora de alguns\nde seus trabalhos sobre os indígenas, e posteriormente com Cláudia\nZarvos. Não teve filhos.\n\nAo longo de toda a sua trajetória Darci Ribeiro manteve o gosto pela\npolêmica e pelo combate político. Partidário do trabalhismo desde os\nanos 1950, sempre exaltou o legado de Getúlio Vargas e o projeto\npolítico de João Goulart. Manteve estrita fidelidade política ao\nprincipal herdeiro do trabalhismo, o governador Leonel Brizola, a quem\ncostumava referir-se como a “principal cabeça política do país”. Nessa\nmesma direção, cultivou uma irredutível hostilidade contra todos que se\nidentificavam com o udenismo e com o regime militar. Declarou-se sempre\num político de esquerda e alimentou a imagem de intelectual polêmico e\nirônico. Assumidamente vaidoso, costumava dedicar fartos elogios à sua\nprópria pessoa em entrevistas e artigos de jornais. Entre as ideias\ncentrais de sua obra, sempre figuraram a denúncia da histórica exclusão\nsocial no Brasil e a procura de caminhos para levar o país a desenvolver\nplenamente as potencialidades que acreditava existirem em estado latente\nna nação, impedidas de se realizar pelas opressões de origem colonial.\nSegundo seus críticos, porém, o pensamento de Darci pecava pela\nexcessiva “condescendência com os proscritos” e por certo ufanismo\ningênuo e generoso ao falar das coisas brasileiras, como demonstraria\nsua reiterada tendência a identificar os índios brasileiros com a imagem\nromântica do bom selvagem rousseauniano.\n\nAlém das obras citadas, publicou também *Línguas e culturas indígenas no\nBrasil* (1957); *Arte plumária dos índios kaapor* (1957); *A política\nindigenista brasileira* (1962); *Plano orientador da Universidade de\nBrasília* (1962); *A universidade necessária* (1969); *Propuestas*\n(1970); *Configurações histórico-culturais dos povos americanos* (1970);\n*América Latina: a pátria grande* (1972); *Université des Sciences\nHumaines D’Alger* (1972); *La universidad peruana* (1974); *UnB –\ninvenção e descaminho* (1978); *Ensaios insólitos* (1979); *Sobre o\nóbvio* (1979); *Nossa escola é uma calamidade* (1984); *Aos trancos e\nbarrancos* (1985); *Suma etnológica brasileira* (1986, em colaboração\ncom Berta G. Ribeiro); *Testemunho* (1990); *A fundação do Brasil –\n1500/1700* (1992, em colaboração com Carlos de Araújo Moreira Neto);\n*Universidade do terceiro milênio – plano orientador da Universidade\nEstadual do Norte Fluminense* (1993); *O Brasil como problema* (1995);\n*Noções de coisas* (1995, com ilustrações de Ziraldo); *Confissões*\n(1997); além dos romances *O mulo* (1981), *Utopia selvagem* (1982) e\n*Migo* (1988).\n\nCláudia Galvão\n\nFONTES: ARQ. DEP. PESQ. JORNAL DO BRASIL; *Estado de S. Paulo*\n(16/9/1962, 21/10/1986, 26, 29/6/1995, 24/2, 14/3, 24/7, 17/8/1996,\n18/2/1997); *Folha de S.Paulo* (7/12/1988, 9/10/1992, 4, 9, 29/5/1994,\n8/1, 14, 16/2, 23/6/1995, 14/1, 12/2, 25/3, 1, 10/6, 16, 21, 23/12/1996,\n19/2/1997); *Globo* (21/11/1985, 25/11/1992, 16/4, 5/9/1993, 8/4/1994,\n15/1, 19, 26/2/1995, 9/2, 18/12/1996, 19/1/1997); *Grande encic. Delta*;\nINF. ASSES. BIOG.; *Jornal do Brasil* (7/4/1974, 12, 15, 16, 24/7,\n19/9/1977, 15/6, 9/11/1978, 27/7/1980, 14/3/1981, 6/7/1982, 27/1/1986,\n16/9/1987, 8, 30/8/1991, 6/6, 11/7/1993, 30/12/1994, 5, 18/1, 3/6/1995,\n15/2, 11/8, 23/12/1996, 25/1, 19/2/1997); MAGALHÃES, L. *Segundo*;\n*Perfil parlamentar/ IstoÉ* (1991); RIBEIRO, D. *Confissões*; RIBEIRO,\nD. *O Povo*; RIBEIRO, D. *Testemunho*; SEGANFREDO, S. *UNE*; *Tribuna da\nImprensa* (8/5/1995); *Veja* (22/1, 25/11/1980, 16/2/1981, 18/1/1995);\nVÍTOR, M. *Cinco*.\n","ref":"FONTES: ARQ. DEP. PESQ. JORNAL DO BRASIL; *Estado de S. Paulo*\n(16/9/1962, 21/10/1986, 26, 29/6/1995, 24/2, 14/3, 24/7, 17/8/1996,\n18/2/1997); *Folha de S.Paulo* (7/12/1988, 9/10/1992, 4, 9, 29/5/1994,\n8/1, 14, 16/2, 23/6/1995, 14/1, 12/2, 25/3, 1, 10/6, 16, 21, 23/12/1996,\n19/2/1997); *Globo* (21/11/1985, 25/11/1992, 16/4, 5/9/1993, 8/4/1994,\n15/1, 19, 26/2/1995, 9/2, 18/12/1996, 19/1/1997); *Grande encic. Delta*;\nINF. ASSES. BIOG.; *Jornal do Brasil* (7/4/1974, 12, 15, 16, 24/7,\n19/9/1977, 15/6, 9/11/1978, 27/7/1980, 14/3/1981, 6/7/1982, 27/1/1986,\n16/9/1987, 8, 30/8/1991, 6/6, 11/7/1993, 30/12/1994, 5, 18/1, 3/6/1995,\n15/2, 11/8, 23/12/1996, 25/1, 19/2/1997); MAGALHÃES, L. *Segundo*;\n*Perfil parlamentar/ IstoÉ* (1991); RIBEIRO, D. *Confissões*; RIBEIRO,\nD. *O Povo*; RIBEIRO, D. *Testemunho*; SEGANFREDO, S. *UNE*; *Tribuna da\nImprensa* (8/5/1995); *Veja* (22/1, 25/11/1980, 16/2/1981, 18/1/1995);\nVÍTOR, M. *Cinco*.\n","dic":"DPRRJ"}
