{"title":"RIBEIRO, Ernesto Francisco","cargoss":["Deputado Estadual"],"cargos_esp":[0],"datas_ini":[1901],"datas_fim":[1904],"estados":["RJ"],"autor":["Helio Lopes"],"content":"**RIBEIRO, Ernesto Francisco**\n\n\\* dep. est. RJ 1901-1904.\n\n*Ernesto Francisco Ribeiro* nasceu em Santa Isabel, São Gonçalo (RJ), em\n1852, filho de Antônio Bernardino Ribeiro e Francisca Dutra Ribeiro.\n\nFazendeiro em Itaipu, onde residiu por vários anos, serviu como inspetor\nde ensino estadual e auxiliou a reconstrução da Igreja Matriz de São\nSebastião, obra conduzida pelo vigário de São Gonçalo, cônego João\nFerreira Goulart, que a concluiu em 1897.\n\nApós a instauração do regime republicano, Francisco Portela foi nomeado,\npelo presidente marechal Deodoro da Fonseca, interventor estadual.\nRepublicano histórico, Francisco Portela afastou-se dos antigos aliados\nbuscando constituir um grupo político autônomo que lhe desse sustentação\nalicerçado no apoio do presidente da república. Uma de suas estratégias\nfoi a criação de novos municípios. Ao findar a monarquia, a província do\nRio de Janeiro possuía 36 municipalidades. O novo governador criou 20\nnovos municípios, entre eles o de São Gonçalo, por decreto de 22 de\nsetembro de 1890. O novo município retirou da capital fluminense seu\ndistrito rural, composto de três freguesias, São Gonçalo, Nossa Senhora\nda Conceição de Cordeiros e São Sebastião de Itaipu, e representava\ncerca dois terços de sua área territorial.\n\nBalthazar da Silveira assumiu a interventoria do Rio de Janeiro em 11 de\ndezembro de 1891, após a renúncia de Francisco Portela. O novo\ninterventor dissolveu o senado e a assembleia estaduais e realizou\neleições para a nova constituinte estadual em 21 de dezembro de 1891. A\nnova assembleia elegeu José Tomás da Porciúncula seu presidente e em 24\nde abril de 1892 foram realizadas novas eleições para deputados\nestaduais e presidente do estado. Porciúncula foi eleito para chefia do\nExecutivo fluminense e empossado em 3 de maio de 1892. Dois dias após a\nposse, o novo governador extinguia diversas municipalidades criadas por\nPortela, entre elas São Gonçalo.\n\nEm 16 de junho de 1892 elegeu-se vereador por Niterói, representando o\nentão 8^o^ distrito, Itaipu. A partir de projeto do deputado Carlos de\nSá Carvalho, o município de São Gonçalo foi recriado por lei de 17 de\ndezembro daquele ano. Ernesto Ribeiro teve o mandato garantido para a\nCâmara de São Gonçalo, após a reinstalação do município, não disputando\no pleito de 17 de janeiro de 1893. Em 1894 foi reeleito para o\nLegislativo local. Nesse mesmo ano foi nomeado delegado de instrução no\nmunicípio, sendo exonerado a 1^o^ de maio de 1895, e recebeu o título de\ntenente-coronel honorário do Exército. Era também coronel da Guarda\nNacional e, em 1896, foi nomeado delegado de polícia em São Gonçalo.\n\nEm 25 de fevereiro de 1898 era novamente eleito vereador, sendo o mais\nvotado com 694 votos. Assumiu a presidência da Câmara Municipal em 5 de\nmarço de 1898 e foi reeleito para esse cargo sucessivamente de 1899 a\n1903. Como presidente do Legislativo local exercia funções executivas.\n\nFoi eleito deputado estadual, pelo 1^o^ distrito eleitoral, com 4.565\nvotos no ano de 1900. Ocupou uma cadeira na Assembleia Legislativa até o\ninício de 1904, não sendo reeleito ao final dessa legislatura. Durante\nos anos de seu mandato foi membro da Comissão de Comércio, Agricultura,\nIndústria e Colonização. Exerceu esse mandato cumulativamente com o de\nvereador, afastando-se da Câmara Municipal por duas vezes, quando foi\nsubstituído pelo vice-presidente Joaquim Serrado Pereira da Silva. A\nlegislação, à época, não vedava a acumulação de mandatos legislativos.\n\nEm 20 de janeiro de 1904 Nilo Peçanha criou a prefeitura dos municípios\nem que a administração estadual arcasse com serviços de infraestrutura.\nNesta situação estavam os de Petrópolis, Campos, Niterói e São Gonçalo.\nOs três primeiros eram importantes focos de resistência à consolidação\ndo nilismo no estado. A criação de prefeituras, neste momento, foi usada\ncomo estratégia para neutralizar e cooptar as oposições ao presidente do\nestado. Ernesto Ribeiro foi nomeado prefeito gonçalense e exerceu o\ncargo até 18 de junho de 1906. Durante sua gestão foram tomadas medidas\nde contenção de gastos públicos e reorganizados os quadros do\nfuncionalismo municipal, seguindo o direcionamento que o presidente Nilo\nPeçanha realizava visando solucionar a crise financeira pela qual\npassava o estado.\n\nEm 31 de julho de 1907 faleceu seu único filho, Daniel Francisco\nRibeiro, o que o levou a afastar-se da política, dedicando-se às suas\nfazendas de Itaipu e de Ipiíba de Malheiros. Em 1918 integrou o conselho\ndo Banco Popular de São Gonçalo, criado em 16 de junho.\n\nFaleceu em 13 de junho de 1920, na sua Fazenda Ipiíba de Malheiros, em\nSão Gonçalo, e foi sepultado no Cemitério de Maruí, em Niterói.\n\nCasado com Luísa da Silva Ribeiro, teve um filho, Daniel Francisco\nRibeiro.\n\nÉ patrono da travessa e da rua Ernesto Ribeiro, ambas no bairro de\nNeves.\n\n*Jorge Cesar Pereira Nunes/Rui Aniceto Nascimento Fernandes/Raimundo\nHelio Lopes*\n\nFONTES: ASSEMB. LEGISL. RJ. *Anais* (1901-1903); FERREIRA, M.\n*República*; NUNES, J. *Dirigentes*; RIBEIRO, E. *Mensagem*; *São\nGonçalo Online*. Disponível em:\n\\<www.saogoncaloonline.com.br/cidade/prefeitos.htm\\>. Acesso em:\n8/11/2010.\n","ref":"FONTES: ASSEMB. LEGISL. RJ. *Anais* (1901-1903); FERREIRA, M.\n*República*; NUNES, J. *Dirigentes*; RIBEIRO, E. *Mensagem*; *São\nGonçalo Online*. Disponível em:\n\\<www.saogoncaloonline.com.br/cidade/prefeitos.htm\\>. Acesso em:\n8/11/2010.\n","dic":"DPRRJ"}
