{"title":"RIBEIRO, Luís","cargoss":["Deputado federal"],"cargos_esp":[0],"datas_ini":[1999],"datas_fim":[2003],"estados":["RJ"],"autor":["Isadora Tavares Maleval"],"content":"**RIBEIRO, Luís**\n\n\\* dep. fed. RJ 1999-2003.\n\n*Luís Antônio Dantas Ribeiro* nasceu em Teresópolis (RJ) no dia 16 de\nabril de 1954, filho de Antônio Rodrigues Ribeiro e de Maria da Glória\nDantas Ribeiro.\n\nEm 1978 graduou-se em medicina na Fundação Educacional Serra dos Órgãos\n(FESO), em sua cidade natal. Especializou-se em medicina do trabalho na\nmesma instituição, em 1982.\n\nEntre 1982 e 1998 foi professor de cirurgia na FESO. Foi ainda médico da\nBeneficência Portuguesa de Teresópolis, tendo exercido as funções de\ndiretor médico e diretor do ambulatório desse hospital.\n\nFiliou-se ao Partido da Frente Liberal (PFL) em 1987. Foi eleito\nvereador de Teresópolis na legenda pefelista no ano seguinte. Em 1991\nfoi para o Partido do Movimento Democrático do Brasil (PMDB) e foi\nreeleito em outubro do ano seguinte.\n\nVoltou ao PFL em 1994 e em outubro foi eleito deputado estadual. Em 1997\ningressou no Partido da Social Democracia Brasileira (PSDB). No pleito\nde outubro de 1998 foi eleito deputado federal pelo estado do Rio de\nJaneiro na legenda do PSDB.\n\nAssumiu o mandato em fevereiro de 1999 e participou da Comissão de\nCiência e Tecnologia, Comunicação e Informática e da Comissão de Defesa\ndo Consumidor, Meio Ambiente e Minorias. Apresentou o Projeto de Lei\n(PL) n^o^ 2.905/1997, sobre alimentos geneticamente modificados, e\npresidiu a Comissão Parlamentar de Inquérito (CPI) que investigou o\ntráfico de animais e plantas silvestres em 2003.\n\nEm outubro de 2002 disputou a reeleição na legenda do PSDB e obteve uma\nsuplência. Deixou a Câmara dos Deputados em janeiro de 2003, ao final da\nlegislatura.\n\n*Isadora Tavares Maleval*\n\nFONTES: Bate-papo Uol. Disponível em:\n\\<http://tc.batepapo.uol.com.br/convidados/arquivo/ecologia/ult1746u12.jhtm\\>.\nAcesso em: 16/9/2009; CÂM. DEP. Disponível em:\n\\<www2.camara.gov.br/deputados/index.html/loadFrame.html\\>. Acesso em:\n16/9/2009; Consultor Jurídico. Disponível em:\n\\<www.conjur.com.br/2003-jan-27/cpi\\_biopirataria\\_vota\\_relatorio\\_final\\_nesta\\_semana\\>.\nAcesso em: 16/9/2009; Terra Notícias. Disponível em:\n\\<http://noticias.terra.com.br/eleicoes/est/rj/atualdeputadofederal.html”\\>.\nAcesso em: 16/9/2009.\n","ref":"FONTES: Bate-papo Uol. Disponível em:\n\\<http://tc.batepapo.uol.com.br/convidados/arquivo/ecologia/ult1746u12.jhtm\\>.\nAcesso em: 16/9/2009; CÂM. DEP. Disponível em:\n\\<www2.camara.gov.br/deputados/index.html/loadFrame.html\\>. Acesso em:\n16/9/2009; Consultor Jurídico. Disponível em:\n\\<www.conjur.com.br/2003-jan-27/cpi\\_biopirataria\\_vota\\_relatorio\\_final\\_nesta\\_semana\\>.\nAcesso em: 16/9/2009; Terra Notícias. Disponível em:\n\\<http://noticias.terra.com.br/eleicoes/est/rj/atualdeputadofederal.html”\\>.\nAcesso em: 16/9/2009.\n","dic":"DPRRJ"}
