{"title":"RIBEIRO, Nina","cargoss":["Deputado Estadual","Deputado federal","Deputado federal"],"cargos_esp":["GB","GB",0],"datas_ini":[1963,1971,1975],"datas_fim":[1971,1975,1979],"estados":[0,0,"RJ"],"autor":["Lorenzo Aldé"],"content":"**RIBEIRO, Nina**\n\n\\* dep. est. GB 1963-1971; dep. fed. GB 1971-1975; dep. fed. RJ\n1975-1979.\n\n*Emílio Antônio Sousa Aguiar Nina Ribeiro* nasceu no Rio de Janeiro,\nentão Distrito Federal, no dia 20 de fevereiro de 1938, filho de\nFernando Nina Ribeiro e de Maria da Glória Mallet de Sousa Aguiar Nina\nRibeiro. Seu trisavô, marechal Emílio Luís Mallet, foi herói da Guerra\ndo Paraguai e tornou-se patrono da arma de artilharia do Exército\nbrasileiro.\n\nAo ingressar na Faculdade de Direito da Pontifícia Universidade Católica\ndo Rio de Janeiro (PUC-Rio), participou da política estudantil,\ncombatendo a linha de esquerda adotada pela direção da União Nacional\ndos Estudantes (UNE). Em reunião da UNE realizada em 1959, protestou\ncontra a cassação de suas credenciais de delegado ao II Congresso\nLatino-Americano de Estudantes, que se realizaria em Caracas\n(Venezuela), tendo em sua intervenção chamado os dirigentes da UNE de\n“lacaios de Moscou”, o que gerou grande tumulto. Bacharel em 1961, no\nano seguinte já exercia o magistério como professor de direito penal da\nPUC, onde lecionaria até 1971.\n\nEm outubro de 1962 elegeu-se deputado à Assembleia Legislativa do Estado\nda Guanabara na legenda da União Democrática Nacional (UDN), e em\nfevereiro do ano seguinte iniciou seu mandato. Ligado ao governador\nCarlos Lacerda (1960-1965), em 1964 exerceu a liderança da maioria na\nAssembleia Legislativa e participou ativamente do movimento\npolítico-militar de 31 de março, que depôs o presidente João Goulart\n(1961-1964). Com a extinção dos partidos políticos pelo Ato\nInstitucional n^o^ 2 (27/10/1965) e a posterior instauração do\nbipartidarismo, filiou-se à Aliança Renovadora Nacional (Arena), partido\nde apoio ao governo militar. Nessa legenda foi reeleito no pleito de\nnovembro de 1966, tendo sido o deputado estadual mais votado.\nResponsável pelo pedido rejeitado de *impeachment* do governador carioca\nFrancisco Negrão de Lima (1966-1971), foi presidente da Comissão\nEspecial contra a Poluição do Ar Atmosférico e membro das comissões de\nConstituição e Justiça e de Emendas Constitucionais da Assembleia.\n\nEm novembro de 1970 foi eleito deputado federal pela Guanabara na\nlegenda da Arena, e em fevereiro do ano seguinte, logo após o término de\nseu mandato de deputado estadual, assumiu sua cadeira na Câmara dos\nDeputados. Ainda em 1971 foi indicado para a vice-liderança de seu\npartido na Câmara, e participou também das comissões de Serviço Público\ne de Ciência e Tecnologia.\n\nEm entrevista à revista *Veja* (23/8/1972), defendeu uma diferenciação\nmais clara do sistema bicameral de representação, de forma que se\nmantivesse uma câmara com função política ao lado de uma câmara técnica,\nvoltada para o planejamento econômico. Tal sistema poderia adotar a\nrepresentação classista, tal como previsto na Constituição de 1934.\nDefendeu ainda a redivisão territorial do país e a representação\nlegislativa qualificada, sugerindo que a Justiça Eleitoral deveria\naplicar testes de conhecimento dos problemas nacionais aos candidatos a\npostos eletivos. Na mesma entrevista, propôs a institucionalização das\nforças armadas como poder moderador, segundo o modelo do período\nimperial, de forma a superar o Ato Institucional n^o^ 5 (13/12/1968). De\nacordo com essa proposta, aos militares seriam garantidos direitos de\nintervenção em momentos de crise, até mesmo através da dissolução do\nCongresso. Argumentou “preferir soluções drásticas, mas previstas na\nCarta Magna, à intranquilidade do improviso”.\n\nDeixando a vice-liderança do governo na Câmara, passou a preocupar-se\ncom a defesa do consumidor, realizando viagens a França, Suécia e\nEstados Unidos, para estagiar em organizações jurídicas de defesa dos\ndireitos do cidadão e do consumidor. Foi também proponente e relator\ngeral da Comissão Especial de Pesquisa dos Documentos Históricos.\n\nPrestava consultas jurídicas ligadas ao direito do consumidor em um\nprograma semanal na TV Educativa (TVE) quando foi reeleito, no pleito de\nnovembro de 1974, já pelo estado do Rio de Janeiro, porém com uma\nvotação bem menor do que a de 1970. Durante sua campanha eleitoral\ndefendeu a reabertura dos cassinos no país e a criação de um banco da\neducação e de um serviço nacional de apoio aos desempregados. Em 1975,\nfoi diplomado pela Escola Superior de Guerra (ESG). Durante o exercício\ndo novo mandato integrou a Comissão de Ciência e Tecnologia e foi\nsuplente da Comissão de Trabalho e Legislação Social da Câmara. Foi\nautor do primeiro projeto de lei do Código de Defesa do Consumidor e do\nprimeiro projeto de lei de criação do Juizado de Pequenas Causas.\n\nEm abril de 1976, pronunciou no plenário da Câmara, em horário cedido\npela oposição, discurso contendo críticas ao AI-5. O pronunciamento\ncriou embaraços que resultaram em pedidos de seu afastamento da Arena, e\naté de cassação do seu mandato. O líder da Arena na casa, José Bonifácio\nde Andrada, resolveu, em represália, afastá-lo da Comissão Parlamentar\nde Inquérito (CPI) de Defesa do Consumidor, que investigava a venda\nirregular no Brasil de remédios proibidos pela Food and Drug\nAdministration (FDA), dos Estados Unidos, bem como irregularidades\nrelacionadas a outros produtos e empresas, como a General Motors, por\nexemplo. Nina Ribeiro havia sido o proponente da CPI e, com o auxílio do\ndeputado Tancredo Neves, que intercedeu em seu favor, conseguiu depor na\ncomissão na qualidade de testemunha. Seu depoimento durou 12 horas e foi\nposteriormente publicado sob o título de *Meu depoimento perante a CPI\ndo Consumidor* (1977).\n\nNo final dos anos 1970, comandou o programa *Defesa do Consumidor*, na\nTV Tupi, durante dois anos. Em setembro de 1978, votou favoravelmente à\nemenda do deputado Francisco Acióli Filho, que propunha a extinção do\nsenador indireto, conhecido como “biônico”, criado por ato do presidente\nErnesto Geisel no ano anterior. No pleito de novembro de 1978 foi\nnovamente candidato pela Arena à reeleição e obteve uma suplência.\nDeixou a Câmara em janeiro de 1979, ao final do mandato.\n\n*DHBB 1983*\n\nEm agosto de 1987 tornou-se advogado da Light, exercendo a função de\nchefe da Divisão Criminal. Continuou atuando na televisão, com um quadro\nde direitos do consumidor na TVE. Em 1992, devido a uma declaração que\nfez no ar, classificando a Teologia da Libertação de “desonestidade\nintelectual”, foi afastado do programa por decisão administrativa da\nemissora. Em 1995, voltou a prestar consultas sobre os direitos do\nconsumidor no programa *É de Manhã*, da mesma emissora.\n\nAlém do trabalho citado, publicou *Pela afirmação de uma doutrina na\nrealidade política brasileira* (tese, 1967), *Um estudo sobre a educação\nno Brasil* (1971), *Em defesa do consumidor* (1974) e *O que podemos\nfazer* (1978).\n\nCasou-se com Nádia Sales Nina Ribeiro, com quem teve três filhos.\n\n*Lorenzo Aldé*\n\nFONTES: CÂM. DEP. *Deputados*; CÂM. DEP. *Deputados brasileiros*.\nRepertório (1967-1971, 1971-1975, 1975-1979); CÂM. DEP. *Relação nominal\ndos senhores*; INF. BIOG.; *Jornal do Brasil* (2/10/1966, 22/11/1974,\n11, 20/4/1976, 31/1, 22/9, 20/11/1978); NÉRI, S. *16*; *Perfil* (1972);\nTRIB. SUP. ELEIT. *Dados* (6, 8, 9); *Veja* (23/8/1972).\n","ref":"FONTES: CÂM. DEP. *Deputados*; CÂM. DEP. *Deputados brasileiros*.\nRepertório (1967-1971, 1971-1975, 1975-1979); CÂM. DEP. *Relação nominal\ndos senhores*; INF. BIOG.; *Jornal do Brasil* (2/10/1966, 22/11/1974,\n11, 20/4/1976, 31/1, 22/9, 20/11/1978); NÉRI, S. *16*; *Perfil* (1972);\nTRIB. SUP. ELEIT. *Dados* (6, 8, 9); *Veja* (23/8/1972).\n","dic":"DPRRJ"}
