{"title":"ROCHA, Filipe da","cargoss":["Deputado Estadual"],"cargos_esp":[0],"datas_ini":[1951],"datas_fim":[1955],"estados":["RJ"],"autor":[0],"content":"**ROCHA, Filipe da**\n\n\\* dep. est. RJ 1951-1955.\n\n*Antônio Filipe da Rocha* residiu em Niterói (RJ).\n\nCom o fim do Estado Novo e a reorganização partidária em 1945, foram\nconvocadas eleições para o Congresso Nacional e para as assembleias\nlegislativas estaduais. Em janeiro de 1947 candidatou-se a uma vaga para\na Assembleia Constituinte do Estado do Rio de Janeiro pela legenda do\nPartido Trabalhista Brasileiro (PTB), mas não obteve êxito.\n\nDisputou a eleição de outubro de 1950 para uma cadeira na Assembleia\nLegislativa do Estado do Rio de Janeiro (ALERJ) pelo PTB. Eleito,\nassumiu o mandato em fevereiro seguinte.\n\nTentou retornar À ALERJ nas eleições de 1954, 1958 e 1962, sempre pela\nlegenda do Partido Social Progressista (PSP).\n\nNo pleito de outubro de 1966 concorreu sem êxito a uma vaga de deputado\nestadual pela legenda do Movimento Democrático Brasileiro (MDB) –\npartido de oposição ao regime militar instaurado em março de 1964.\n\nParticipou dos debates envolvendo a capital fluminense, especialmente\nsobre as péssimas condições dos transportes públicos, o deficiente\nsistema viário, a infraestrutura urbana, a educação, a saúde, além de\ndefender os interesses trabalhistas.\n\nIntegrou as comissões de Constituição, Interior e Justiça.\n\n*Vicente Saul Moreira dos Santos*\n\nFONTES: ASSEMB. LEGISL. RJ. *Anais* (1951); CARDIANO, F. *Eleição*.\n","ref":"FONTES: ASSEMB. LEGISL. RJ. *Anais* (1951); CARDIANO, F. *Eleição*.\n","dic":"DPRRJ"}
