{"title":"ROCHA, José Antônio Porto","cargoss":["Deputado Estadual","Deputado Estadual","Constituinte"],"cargos_esp":[0,0,"est"],"datas_ini":[1892,1900,1903],"datas_fim":[1897,1909,1903],"estados":["RJ","RJ","RJ"],"autor":[0],"content":"**ROCHA, José Antônio Porto**\n\n\\* dep. est. RJ 1892-1897; dep. est. RJ 1900-1909; const. est. RJ 1903.\n\n*José Antônio Porto Rocha* foi líder político no município de Cabo Frio\n(RJ).\n\nEm novembro de 1891, a renúncia do marechal Deodoro da Fonseca e a\nascensão de Floriano Peixoto retiraram uma das fontes de apoio do\ninterventor estadual Francisco Portela. Deodoro da Fonseca vinha sendo\num dos grandes sustentáculos do poder do interventor. Republicanos e\nmonarquistas formaram uma coalizão antiportelista e aproveitaram a\nascensão de Floriano Peixoto para forçar a renúncia do interventor\nestadual. Dissolveram o Legislativo estadual, revogaram a Constituição\nestadual de 1891 e convocaram uma nova Assembleia Constituinte.\n\nApós a formação de uma nova carta constitucional, foram realizadas em 24\nde abril de 1892 as eleições que alicerçaram a vitória da coalizão de\nmonarquistas e republicanos para o governo estadual, agora, reunidos em\ntorno do Partido Republicano Fluminense (PRF). José Antônio Porto Rocha\ncandidatou-se ao pleito pelo PRF.\n\nA oposição portelista não concorreu aos cargos do Legislativo estadual.\nForam eleitos a chapa apresentada pelo PRF e outros candidatos avulsos\nsimpatizantes do partido. José Antônio Porto Rocha elegeu-se para a\nlegislatura de 1892 a 1894. Nesse período foi eleito para a Comissão da\nForça Pública em 1892 e 1894.\n\nNas eleições realizadas em 1894 candidatou-se à reeleição pelo primeiro\ndistrito. As forças ligadas ao Partido Republicano Fluminense (PRF)\ngarantiram novamente a vitória. Para o governo foi eleito Maurício de\nAbreu e para o Legislativo estadual a chapa do partido foi vitoriosa,\numa vez que a oposição não apresentou candidatos, optou por praticar a\nabstenção total.\n\nJosé Antônio Porto Rocha foi eleito para a legislatura de 1895 a 1897,\nsendo eleito para a Comissão de Força Pública em 1897. No contexto\npolítico que se abria com a ascensão da oligarquia paulista ao governo\nnacional, com a eleição de Prudente de Morais e hegemonia Partido\nRepublicano Federal, os republicanos fluminenses alinharam-se ao governo\nfederal, sem perder sua identidade e autonomia política.\n\nA política fluminense em 1898 foi dominada pela questão da dualidade da\nCâmara de Campos. As eleições para representante municipal na cidade\nforam um dos centros do confronto entre miracemistas e as elites do PRF,\nem 1897; esse confronto resultou na eleição de duas câmaras municipais,\numa para cada facção política. Alberto Benzamat em 1897, prevendo este\ndesfecho, aprovou na ALERJ a Lei n^o^ 373, que concedia ao governador\neleito autoridade para resolver a questão. Entretanto, na condição de\ngovernador do estado, Alberto Torres não se dispôs a aplicar o\nregulamento. Mostrava-se “legalista”, justificava sua posição apontando\ninconstitucionalidades na Lei n^o^ 373. O posicionamento do governador\ndo estado levou ao fracionamento de sua base de apoio.\n\nEste confronto levou o PRF, em 1899, a reformar seu quadro partidário.\nMartins Torres, visconde de Quiçamã, Hermogênio Silva e João Francisco\nBarcelos renunciaram a seus cargos, rompendo com Porciúncula e Miguel de\nCarvalho. O PRF cuidou de eliminar o resto dos partidários de Alberto\nTorres, que formaram um novo partido, o Partido Republicano do Estado do\nRio de Janeiro (PRRJ). A frente anti-PRF foi composta por miracemistas,\ne outros membros do PRF que preferiram ficar do lado de Alberto Torres.\n\nNas eleições de 1900 José Antônio Porto Rocha tentou se reeleger\ndeputado estadual pelo PRRJ no primeiro distrito. Essas eleições\nmarcaram a institucionalização do PRRJ no governo do estado. Disputando\ncom o PRF as cadeiras das Câmaras Municipais e na ALERJ, foi o grande\nvencedor, elegendo a maioria. O PRF teve sua representação reduzida de\n30 deputados para cinco.\n\nDiplomado para a legislatura de 1901 a 1903, foi eleito para a Comissão\nde Saúde Pública e Câmara Municipal em 1901, sendo reeleito em 1903.\n\nNilo Peçanha foi eleito governador e conseguiu estabelecer hegemonia na\npolítica fluminense a partir da reforma constitucional de 1903. Através\nde campanha, conseguiu-se que a assembleia eleita para a ALERJ se\ntransformasse em Assembleia Constituinte. Iniciaram-se os trabalhos\nconstituintes que tiveram como eixo organizador o reforço do Executivo\nestadual, em detrimento do Legislativo e o poder das Câmaras Municipais.\n\nNas eleições de 1904 José Antônio Porto Rocha pertencia a facção nilista\ndo PRRJ, tentando sua reeleição pelo 1^o^ distrito, sendo eleito e\ndiplomado para a legislatura de 1904 a 1907. Em 1904 foi eleito para a\nComissão de Saúde Pública e Câmaras Municipais, sendo reeleito em 1905 e\n1906.\n\nEm 1907 foi reeleito deputado estadual, sendo eleito segundo\nvice-presidente da Mesa Diretora da ALERJ, entre 1907 e 1909.\n\nApós este mandato, não se reelegeu.\n\n*Samuel Silva Rodrigues de Oliveira*\n\nFONTES: ASSEMB. LEGISL. RJ. *Anais* (1893-1900); *Comércio de Cantagalo*\n(7/8/1904); FERREIRA, M. *República*; *Jornal do Comércio* (2/6/1904).\n","ref":"FONTES: ASSEMB. LEGISL. RJ. *Anais* (1893-1900); *Comércio de Cantagalo*\n(7/8/1904); FERREIRA, M. *República*; *Jornal do Comércio* (2/6/1904).\n","dic":"DPRRJ"}
