{"title":"ROCHA, Péricles Correia","cargoss":["Deputado Estadual"],"cargos_esp":[0],"datas_ini":[1927],"datas_fim":[1930],"estados":["RJ"],"autor":["Raimundo Helio Lopes"],"content":"**ROCHA, Péricles Correia**\n\n\\* dep. est. RJ 1927-1930.\n\n*Péricles Correia Rocha* foi eleito prefeito da cidade de Bom Jardim\n(RJ) no ano de 1924 e permaneceu no cargo até 1926.\n\nEm abril de 1927 foi eleito deputado estadual pelo terceiro distrito\neleitoral, com sede Cantagalo (RJ), na chapa oficial do Partido\nRepublicano Fluminense (PRF). Neste ano e no seguinte foi eleito membro\nda Comissão de Agricultura Indústria e Comércio. Em 1929 passou a\nintegrar a Comissão de Petições, Representações e Poderes. Após o final\ndo mandato, em janeiro de 1930, tentou a reeleição, mas não obteve\nêxito.\n\n*Raimundo Helio Lopes*\n\nFONTES: ASSEMB. LEGISL. RJ. *Anais* (1927-1930); *Estado* (27/5/1924,\n19/8/1930); FERREIRA, M. *República*.\n","ref":"FONTES: ASSEMB. LEGISL. RJ. *Anais* (1927-1930); *Estado* (27/5/1924,\n19/8/1930); FERREIRA, M. *República*.\n","dic":"DPRRJ"}
