{"title":"BARROS, Fleury de","cargoss":["Deputado Estadual"],"cargos_esp":[0],"datas_ini":[1895],"datas_fim":[1900],"estados":["RJ"],"autor":["Adrianna Setemy"],"content":"**BARROS, Fleury de**\n\n\\* militar; dep. est. RJ 1895-1900.\n\n*Alfredo Oscar Fleury de Barros* foi eleito deputado estadual no estado\ndo Rio de Janeiro em 20 de maio de 1895, na legenda do Partido\nRepublicano Fluminense (PRF), pelo terceiro distrito, com sede em\nCantagalo. Na Assembleia Legislativa do Estado do Rio de Janeiro (ALERJ)\nintegrou a Comissão da Força Pública.\n\nFoi reeleito deputado estadual em 26 de dezembro de 1897, ainda pelo\nPRF. Nessa legislatura integrou novamente a Comissão da Força Pública.\nAo final desse mandato candidatou-se novamente às eleições de 30 de\ndezembro de 1900, contudo, não conseguiu se reeleger.\n\nMilitar, foi comandante do 14^o^ Regimento de Cavalaria, sediado em\nCampanha (MG), de fevereiro a abril de 1919, quando ocupava o posto de\ntenente-coronel.\n\n*Adrianna Setemy*\n\nFONTES: ASSEMB. LEGISL. RJ. *Anais* (1897, 1898, 1899); ASSEMB. LEGISL.\nRJ. Disponível em:\n\\<www.alerj.rj.gov.br/center\\_arq\\_inf\\_legislatura.htm\\>. Acesso em:\n3/8/2010; ESC. SARGENTO DAS ARMAS. Disponível em:\n\\<www.esa.ensino.eb.br/comandantes/anteriores.asp\\>. Acesso em:\n3/8/2010; ALERJ. *Anais* (1897, 1898 e 1899).\n","ref":"FONTES: ASSEMB. LEGISL. RJ. *Anais* (1897, 1898, 1899); ASSEMB. LEGISL.\nRJ. Disponível em:\n\\<www.alerj.rj.gov.br/center\\_arq\\_inf\\_legislatura.htm\\>. Acesso em:\n3/8/2010; ESC. SARGENTO DAS ARMAS. Disponível em:\n\\<www.esa.ensino.eb.br/comandantes/anteriores.asp\\>. Acesso em:\n3/8/2010; ALERJ. *Anais* (1897, 1898 e 1899).\n","dic":"DPRRJ"}
