{"title":"ROSA, Cantidiano Gomes da","cargoss":["Prefeito"],"cargos_esp":["Niterói"],"datas_ini":[1922],"datas_fim":[1923],"estados":["RJ"],"content":"**ROSA, Cantidiano Gomes da**\n\n\\* pref. Niterói RJ 1922-1923.\n\n*Cantidiano Gomes da Rosa* nasceu no estado de Sergipe no dia 28 de\nnovembro de 1856.\n\nIngressou na política em 1885, quando se mudou para Campos (RJ), e atuou\nna campanha republicana ao lado do então vereador daquele município\nFrancisco Portela. Quando houve a proclamação da República, Portela\nmudou-se para Niterói, já que fora nomeado presidente do estado do Rio\nde Janeiro pelo marechal Deodoro da Fonseca, posição que ocupou até o\nfinal de 1891. Naquela ocasião Cantidiano da Rosa também se transferiu\npara a capital do estado.\n\nEm dezembro de 1892 participou ativamente do movimento denominado\nRevolta da Polícia Militar, que destituiu por 24 horas, no Rio de\nJaneiro, o então presidente do estado Tomás Porciúncula. Chegou a ocupar\ninterinamente o cargo até que Francisco Portela pudesse assumi-lo, no\nentanto, este já se encontrava preso na Fortaleza de São João na Urca.\n\nApós esse episódio voltou para Campos, onde passou a trabalhar como\nleiloeiro público até 1900, quando retornou a Niterói. No mesmo ano foi\nnomeado escrivão de delegacia de polícia pelo presidente do estado,\nQuintino Bocaiuva. Em 1901 o mesmo presidente o promoveu a tabelião do\nRegistro Civil do 1^o^ Ofício de Niterói, onde permaneceu até 1910\nquando o cartório foi extinto.\n\nNovamente acompanhando Francisco Portela, retomou suas atividades\npolíticas em 1913. Passou a trabalhar na organização do Partido\nRepublicano Conservador (PRC), que tinha como principal representante o\npresidente da República Hermes da Fonseca e apoiava a candidatura de\nFeliciano Sodré para presidência do estado em oposição a Nilo Peçanha,\nque acabou sendo eleito.\n\nDepois disso só voltou à vida pública em 1919, quando foi eleito\nvereador em Niterói. Logo em seguida passou a ocupar a presidência da\nCâmara; por essa razão assumiu interinamente a prefeitura do município\nquando Ranulfo Bocaiúva Cunha renunciou ao cargo. Cantidiano da Rosa foi\nprefeito entre o dia 7 de junho de 1922 e 25 de julho do ano seguinte.\nSeu mandato deveria durar somente até as eleições municipais seguintes\nque ocorreram em julho de 1922, porém acabou permanecendo por mais tempo\njá que o resultado do pleito foi anulado em virtude da crise política\nque ocorria no âmbito estadual na sucessão do presidente Raul Veiga. Por\nisso, foi substituído apenas no ano seguinte quando foram realizadas\nnovas eleições e Henrique Castrioto de Figueiredo e Melo assumiu o\ncargo.\n\nLogo no início de seu mandato, Cantidiano da Rosa comprometeu-se a não\nfazer mudanças no programa de governo de seu antecessor, mas disse que\napenas procuraria resolver os problemas administrativos de maior\nimportância. Executou obras de iluminação, saneamento e calçamento de\nvárias ruas do Centro e do bairro de Icaraí; concluiu a rua Barão de\nJaceguai, reformou as praças Enéas de Castro e General Gomes Carneiro;\nlançou a pedra fundamental do Hospital Santa Cruz; reformou o serviço de\nlimpeza urbana dotando-o de novas instalações e finalizou a obra de\nabertura da avenida do Reconhecimento, que passou a se chamar avenida\nSete de Setembro em homenagem ao centenário da Independência do Brasil.\nInaugurou a rua Prefeito Sodré em homenagem a Feliciano Sodré, assim\ncomo fez diversas homenagens a figuras ilustres da cidade. Foi um\nprefeito de grande popularidade e bastante elogiado pela imprensa. Seu\ngoverno foi considerado aquele que até então mais tinha dado atenção às\ncondições de trabalho dos funcionários municipais e também à qualidade\ndos serviços públicos. Da mesma forma, buscou saldar dívidas da\nprefeitura, sem contrair novos empréstimos, o que proporcionou o\nrestabelecimento do crédito da municipalidade.\n\nEm 1932 auxiliou Alfredo Backer na fundação do Partido Liberal\nFluminense (PLF).\n\nFoi, ainda, membro da Guarda Nacional de Sergipe, onde chegou ao posto\nde capitão.\n\nFaleceu em Niterói no dia 25 de outubro de 1942.\n\nFoi casado em primeiras núpcias com Amélia de Vasconcelos Rosa, com quem\nteve três filhos, e, posteriormente, com Rosa Maria Josefina Pardal. Seu\nneto João Batista Vasconcelos Torres foi senador da República.\n\n*Paulo César Gomes Bezerra*\n\nfontes: *Fluminense*(7, 25/6, 4, 9/7, 7, 23/9, 16, 20/12/1922, 24/1,\n20/2, 20/3, 22/5, 3, 10, 24/6, 21, 25/7/1923); SOARES,E.\n*Prefeitura*;SOARES, E. *Ruas*;WEHRS, C. *Niterói*.\n","ref":"","dic":"DPRRJ"}
