{"title":"ROSA, Manuel de Miranda","cargoss":["Deputado Estadual","Deputado federal"],"cargos_esp":[0,0],"datas_ini":[1923,1926],"datas_fim":[1926,1930],"estados":["RJ","RJ"],"autor":["Luciana Pinheiro","Juliana Gagliardi"],"content":"**ROSA, Manuel de Miranda**\n\n\\* dep. est. RJ 1923-1926; dep. fed. RJ 1926-1930.\n\n*Manuel de Miranda Rosa* foi eleito deputado estadual no Rio de Janeiro\ne exerceu o mandato de 1923 a 1926. Integrou as comissões de Petições,\nRepresentações e Poderes (1923 e 1926) e de Constituição e Justiça\n(1926), foi segundo secretário (1924) e primeiro secretário (1925) da\nMesa Diretora da Assembleia Legislativa.\n\nEm 1926, foi eleito em eleição suplementar deputado federal pelo estado\ndo Rio de Janeiro e tomou posse em 27 de outubro, com mandato até 31 de\ndezembro do mesmo ano. Reeleito para as legislaturas 1927-1929 e\n1930-1932, teve o mandato interrompido em 23 de outubro de 1930 em\ndecorrência da vitória da revolução que levou Getúlio Vargas ao poder e\nextinguiu todos os órgãos legislativos do país.\n\n*Luciana Pinheiro/Juliana Gagliardi*\n\nFONTES:ASSEMB. LEGISL. RJ. *Anais* (20/11/1923-16/1/1924,\n26/7-31/10/1924, 26/7-31/10/1925, 26/7-31/10/1926; CÂM. DEP. *Deputados\nbrasileiros* (1826-1976).\n","ref":"FONTES:ASSEMB. LEGISL. RJ. *Anais* (20/11/1923-16/1/1924,\n26/7-31/10/1924, 26/7-31/10/1925, 26/7-31/10/1926; CÂM. DEP. *Deputados\nbrasileiros* (1826-1976).\n","dic":"DPRRJ"}
