{"title":"ROUSSOULIÈRES, Antônio","cargoss":["Deputado Estadual","Constituinte"],"cargos_esp":[0,"est"],"datas_ini":[1935,1936],"datas_fim":[1936,1936],"estados":["RJ","RJ"],"autor":[0],"content":"**ROUSSOULIÈRES, Antônio**\n\n\\* dep. est. RJ 1935-1936; const. est. RJ 1936.\n\n*Antônio Roussoulières* foi eleito deputado estadual em 14 de outubro de\n1934. Tomou posse no ano seguinte e integrou, durante a legislatura, a\nAssembleia Constituinte estadual que preparou a nova Constituição do\nestado do Rio de Janeiro, promulgada em 22 de janeiro de 1936. Em\nnovembro do ano seguinte seu mandato foi, contudo, interrompido devido\nao golpe do Estado Novo, no governo do presidente Getúlio Vargas\n(1930-1945), quando o Congresso Nacional e as assembleias legislativas\nforam fechados.\n\nPosteriormente, com a redemocratização do país, candidatou-se mais uma\nvez a deputado estadual no Rio de Janeiro nas eleições de 1947, na\nlegenda da União Democrática Nacional, mas não se elegeu.\n\nFONTES: ASSEMB. LEGISL. RJ. Disponível em:\n\\<www.alerj.rj.gov.br/center\\_arq\\_inf\\_legislatura.htm\\>. Acesso em:\n3/8/2010; CARDIANO, F. *Eleições*.\n","ref":"FONTES: ASSEMB. LEGISL. RJ. Disponível em:\n\\<www.alerj.rj.gov.br/center\\_arq\\_inf\\_legislatura.htm\\>. Acesso em:\n3/8/2010; CARDIANO, F. *Eleições*.\n","dic":"DPRRJ"}
