{"title":"SALADINI, Mário","cargoss":["Deputado Estadual","Deputado Estadual","Constituinte","Deputado Estadual"],"cargos_esp":["GB","GB","est",0],"datas_ini":[1972,1968,1975,1975],"datas_fim":[1975,1971,1975,1979],"estados":[0,0,"RJ","RJ"],"autor":[0],"content":"**SALADINI, Mário**\n\n\\* dep. est. GB 1968-1971, 1972-1975; const. est. RJ 1975; dep. est. RJ\n1975-1979.\n\n*Mário Saladini* nasceu em São Paulo no dia 16 de maio de 1915, filho de\nErcole Enrico Saladini e de Raquel Saladini, imigrantes italianos.\n\nComeçou os estudos primários no Colégio São Vicente de Paula, mas, com a\nmorte de seu pai quando contava seis anos de idade, e a necessidade de\nsua mãe ir para o Rio de Janeiro receber tratamento médico, foi\ninternado num orfanato. Acabou fugindo do orfanato e foi morar com uma\nconhecida da família. Começou a trabalhar e, com o dinheiro que juntou,\naos 13 anos de idade foi para o Rio de Janeiro reencontrar a mãe e a\nirmã, a atriz Olga Navarro. Em 1929 ingressou no Colégio Militar do Rio\nde Janeiro. Concluídos os estudos, em 1934 começou a trabalhar como\nrepórter policial no jornal *Gazeta de Notícias* e, depois, no *Diário\nCarioca*. Ao longo da carreira de jornalista, trabalharia também na\n*Imprensa* *Carioca*, no *Diário Trabalhista*, no *Diário da Noite*, no\nsemanário *Diretrizes* e outros. Foi remador do Clube de Regatas\nFlamengo.\n\nDurante a passagem de Ernâni Amaral Peixoto pela interventoria no estado\ndo Rio de Janeiro, logo após o golpe que instituiu o Estado Novo em\n1937, foi nomeado inspetor chefe de Polícia e, a seguir, tesoureiro da\nCaixa Econômica Federal em Niterói. Conhecido boêmio, na década de 1940\nfoi um dos fundadores do Clube dos Cafajestes, “instituto da boemia\ncarioca” formado por jovens de classe média e alta da zona sul do Rio de\nJaneiro, como Sérgio Porto, Carlos Niemeyer, Ibrahim Sued, Jorginho\nGuinle, Heleno de Freitas, entre outros, que promovia grandes festas e\nbailes em lugares como o Copacabana Palace, a boate Vogue e o Clube\nMarimbás.\n\nA partir de 1949, trabalhou como adido comercial a serviço do Escritório\nde Propaganda e Expansão Comercial vinculado ao Ministério do Trabalho,\nIndústria e Comércio; serviu na Inglaterra, em Portugal, no México e na\nFrança. Em 1959, concluiu o curso da Escola Superior de Guerra. Também\nem 1959, foi nomeado diretor de Turismo e Certames da prefeitura do\nDistrito Federal, que estava às vésperas de ser transferido da cidade do\nRio de Janeiro para Brasília. Durante uma viagem em serviço à Venezuela,\nadmirou-se com a favela de Maitequila, em Caracas, cujos barracos eram\ntodos coloridos; quando voltou ao Rio, informou à imprensa que seu\ndepartamento promoveria uma campanha para a pintura das favelas cariocas\nde modo a “melhorar seu aspecto e até transformá-las numa atração\nturística”. A ideia gerou polêmica com parte da opinião pública,\nincluindo líderes comunitários e o arcebispo da cidade, dom Hélder\nCâmara; rendeu até o samba *Favela amarela*, de autoria dos compositores\nJota Júnior e Oldemar Magalhães e interpretado por Araci de Almeida. Em\n1963, foi indicado pelo Partido Trabalhista Brasileiro (PTB) para ser um\ndos diretores da recém-criada Companhia Brasileira de Armazéns Gerais\n(Cibrazem).\n\nNas eleições estaduais de novembro de 1966, candidatou-se a deputado\nestadual na Guanabara na legenda do Movimento Democrático Brasileiro\n(MDB). A votação obtida o fez suplente do partido. Em 7 de março de\n1968, foi convocado a assumir a vaga do deputado Levi Neves, que iria\nocupar a Secretaria de Turismo. Na época, era diretor da Associação\nBrasileira de Imprensa (ABI). Em agosto de 1968, integrou uma comissão\nde deputados estaduais e federais que participou do congresso\n“Solidariedade, Paz e Amizade” em Sófia, na Bulgária, e visitou outros\npaíses da União Soviética, incluindo a Rússia; quando da passagem do\ngrupo por Praga, na Tchecoslováquia, a cidade foi invadida por tropas\nsoviéticas como resposta do Pacto de Varsóvia à chamada “Primavera de\nPraga”.\n\nUm dos temas a que mais deu ênfase na Assembleia Legislativa do Estado\nda Guanabara (ALEG) em seu primeiro ano de mandato foi o da necessidade\nde desenvolver uma infraestrutura de turismo no Rio de Janeiro, de modo\na torná-lo um lugar “folclórico” e não apenas a cidade do carnaval por\ntrês dias. Foi autor de várias proposições com o fim de valorizar datas,\nfestejos e associações culturais e tentar estruturar um calendário\nturístico para a cidade; foram os casos, por exemplo, da proposta de\ncriação de um Pavilhão Carioca do Folclore Brasileiro e da realização de\nFestivais da Seresta. No entanto, queixava-se de que seus sucessores na\nSecretaria de Turismo não davam continuidade aos projetos que iniciara\nnem buscavam inovações para o setor.\n\nEm 1969, a ALEG foi fechada e funcionou apenas administrativamente. Na\nsessão legislativa de 1970, foi membro da Comissão de Educação, Cultura,\nCiência e Tecnologia. Candidatou-se novamente nas eleições estaduais de\nnovembro na legenda do MDB, e obteve uma suplência. Deixou a Assembleia\nao final da legislatura, em janeiro de 1971, mas foi chamado a assumir o\nmandato em 1972. Na sessão legislativa desse ano, foi membro da Comissão\nde Economia, Agricultura, Indústria e Comércio. Em 1973, juntamente com\no deputado Edson Khair, foi destacado para representar a Assembleia na\nConvenção da Juventude dos Estados Árabes em Trípoli, na Líbia. Na\nsessão legislativa de 1974, ocupou a vice-presidência da Comissão de\nEconomia e foi suplente da Comissão de Orçamento e Finanças.\n\nNo dia de 1^o^ de julho de 1974, a Lei Complementar n^o^ 20, do governo\ndo presidente Ernesto Geisel, determinou a fusão entre os estados do Rio\nde Janeiro e da Guanabara, a ser concretizada em 15 de março de 1975. Na\neleição estadual de novembro de 1974, que escolheria os membros da\nAssembleia Constituinte do estado do Rio de Janeiro para o próximo ano,\ncandidatou-se e foi eleito na legenda do MDB. Durante o período de\nelaboração da nova Carta, promulgada em 23 de julho de 1975, foi\nsuplente da Comissão Constitucional. Nas sessões legislativas de 1975 a\n1978 foi membro da Comissão de Economia, Indústria e Comércio. De 1976 a\n1978, ocupou a vice-presidência da Comissão de Turismo e Desportos.\n\nNesse período, deu atenção aos setores do funcionalismo público estadual\ncujos vencimentos foram prejudicados em consequência da fusão. Criticava\nos “tecnocratas da fusão” pelas medidas de contenção de gastos que\ntomavam “às custas do sacrifício alheio” (no caso, os vencimentos dos\nservidores) com o apoio dos políticos da Aliança Renovadora Nacional\n(Arena). Em especial, reclamava da administração do prefeito Marcos\nTamoio, a quem considerava um demagogo no estilo de Carlos Lacerda, além\nde “glorioso comprador de palacetes, mendigo de empréstimos bancários,\ncriador de tarifas e majorador de impostos”; acusava-o de usar o cargo\npara promover sua carreira política e a de outros candidatos da Arena,\npara onde havia migrado do MDB na perspectiva de continuar no poder. Fez\num projeto de lei que acabava com os cargos de administrador regional e\nsecretário, pois, em sua opinião, seus ocupantes serviam apenas como\n“cabos eleitorais de luxo” do prefeito e de seu partido. Dedicou-se\ntambém ao bairro de Santa Cruz, para o qual propôs melhorias em ruas e a\ninstalação de serviços como postos de saúde, um terminal rodoviário, o\nviaduto inaugurado em 1977 (ligando as ruas Álvaro Alberto e Senador\nCamará), entre outros.\n\nCandidatou-se novamente a deputado estadual nas eleições de novembro de\n1978, mas não teve êxito. Também não foi eleito em novembro de 1986,\nquando concorreu a deputado federal na legenda do Partido do Movimento\nDemocrático Brasileiro (PMDB).\n\nFaleceu em 9 de setembro de 2009.\n\nEra casado com Heloísa Saladini, com quem teve três filhos.\n\nEm 2003 foi publicado o livro *Cafajeste com muita honra*, sua biografia\nautorizada escrita por Yvone Igrejas e Fredimio Biasoto Trota.\n\n*Paulo Celso Corrêa*\n\nFONTES: ASSEMB. LEGISL. GB. *Anais*; *Diário Oficial do Rio de Janeiro*;\nGente em foco: Mário Saladini. Disponível em:\n\\<www.velhosamigos.com.br/Foco/mariosaladini.html\\>. Acesso em:\n10/12/2010; *Jornal da Associação Brasileira de Imprensa* (n. 299,\n6/2005). Disponível em: \\<www.abi.org.br/jornaldaabi/Abril-2005.pdf\\>.\nAcesso em: 10/12/2010.\n","ref":"FONTES: ASSEMB. LEGISL. GB. *Anais*; *Diário Oficial do Rio de Janeiro*;\nGente em foco: Mário Saladini. Disponível em:\n\\<www.velhosamigos.com.br/Foco/mariosaladini.html\\>. Acesso em:\n10/12/2010; *Jornal da Associação Brasileira de Imprensa* (n. 299,\n6/2005). Disponível em: \\<www.abi.org.br/jornaldaabi/Abril-2005.pdf\\>.\nAcesso em: 10/12/2010.\n","dic":"DPRRJ"}
