{"title":"BARROS, João Batista de","cargoss":["Deputado Estadual"],"cargos_esp":[0],"datas_ini":[1967],"datas_fim":[1971],"estados":["RJ"],"autor":[0],"content":"**BARROS, João Batista de**\n\n\\* dep. est. RJ 1967-1971.\n\n*João Batista de Barros* era filho de Raul de Barros. Seu pai foi eleito\nvereador em Barra Mansa (RJ) em 1951. Seu irmão, Luís Batista de Barros,\ntambém foi vereador em Barra Mansa e presidente da Câmara Municipal.\n\nAdvogado e professor, foi eleito vereador em Barra Mansa em 1962.\nAssumiu o mandato e, durante a legislatura, em 1963, presidiu a Câmara\nMunicipal.\n\nCandidatou-se a deputado estadual no estado do Rio de Janeiro, na\nlegenda do Movimento Democrático Brasileiro (MDB), e foi eleito no\npleito de 15 de novembro de 1966. Assumiu uma cadeira na Assembleia\nLegislativa do Estado do Rio de Janeiro (ALERJ) em 1^o^ de fevereiro de\n1967. Durante essa legislatura foi segundo suplente da Mesa Diretora da\nALERJ e membro da Comissão de Justiça. Exerceu o mandato até o fim da\nlegislatura, em 31 de janeiro de 1971.\n\nAinda pelo MDB tentou se reeleger nas eleições de novembro de 1970, mas\nnão obteve sucesso. Em 1973, elegeu-se vice-prefeito de Barra Mansa.\n\nFONTES: ASSEMB. LEGISL. RJ. *Anais*; ASSEMB. LEGISL. RJ. Projeto de\nresolução n^o^ 1.608/2010; CARDIANO, F.*Eleições*.\n","ref":"FONTES: ASSEMB. LEGISL. RJ. *Anais*; ASSEMB. LEGISL. RJ. Projeto de\nresolução n^o^ 1.608/2010; CARDIANO, F.*Eleições*.\n","dic":"DPRRJ"}
