{"title":"SANTOS FILHO, Júlio","cargoss":["Deputado Estadual"],"cargos_esp":[0],"datas_ini":[1923],"datas_fim":[1930],"estados":["RJ"],"autor":["Raimundo Helio Lopes"],"content":"**SANTOS FILHO, Júlio**\n\n\\* dep. est. RJ 1923-1930.\n\n*Júlio Veríssimo Sauerbronn Santos Filho* era filho de Júlio Veríssimo\nda Silva Santos, republicano histórico no estado do Rio de Janeiro.\n\nFoi eleito deputado estadual pelo quarto distrito eleitoral, com sede em\nVassouras (RJ), em 28 de outubro de 1923, no pleito realizado durante a\nintervenção federal no estado do Rio de Janeiro. Durante a intervenção\nfederal, decretada em 10 de janeiro de 1923 pelo então presidente da\nRepública Artur Bernardes (1922-1926), o estado foi governado pelo\ninterventor Aureliano Leal, que fechou a Assembleia Legislativa do\nEstado do Rio de Janeiro (ALERJ) e anulou as eleições de 9 de julho de\n1922 realizadas para a sucessão do então presidente estadual Raul Veiga\n(1918-1922), quando os candidatos Raul Fernandes e Feliciano Sodré\ndeclararam-se eleitos, ocasionando a dualidade da ALERJ.\n\nFoi eleito na legenda do Partido Republicano Fluminense (PRF). Com o\ninício dos trabalhos legislativos, em 27 de novembro, participou do\nreconhecimento pela ALERJ da eleição de Feliciano Sodré para presidente\ndo Rio de Janeiro (1923-1927), encerrando o período de intervenção\nfederal do estado. Foi eleito ainda nesse ano membro da Comissão de\nConstituição e Justiça. Em 1924 foi reeleito para esta comissão e também\npara a de Agricultura, Indústria e Comércio, mas renunciou a esse posto\nem favor do ingresso de outras colegas nessas atividades. No ano\nseguinte foi mais uma vez membro da Comissão de Constituição e Justiça e\ningressou em mais duas: Estatística, Divisão Civil e Judiciária e\nCâmaras Municipais e também na Comissão especial para apurar e verificar\nos poderes do vice-presidente eleito João Maria da Rocha Werneck para\ncomplementar o quatriênio de 1923 a 1927, em substituição a Paulino José\nSoares de Souza. Em 1926, último ano desta legislatura, dedicou-se\napenas à Comissão de Constituição e Justiça.\n\nEm abril de 1927 foi reeleito deputado estadual na chapa oficial do PRF.\nNos anos de 1928 e 1929 foi membro da Comissão de Constituição e\nJustiça. Ainda em 1928 foi presidente e relator geral do projeto de\nreforma à Constituição estadual proposta pelo então presidente Manuel\nDuarte (1927-1930). Com essa reforma, promulgada em 31 de outubro desse\nano, houve uma redução dos poderes do Legislativo e o fortalecimento do\nExecutivo estadual, em detrimento da autonomia municipal. Nesse período\ntambém foi representante do PRF na convenção nacional que ratificou a\nchapa Júlio Prestes-Vital Soares para a presidência da República. Em\njaneiro de 1930 foi eleito presidente da ALERJ para os trabalhos finais\ndesta legislatura. Em agosto foi reeleito deputado estadual novamente\npelo PRF e eleito novamente presidente da assembleia, mas em novembro de\n1930 teve seu mandato interrompido com a vitória da Revolução de 1930\nque levou Getúlio Vargas ao poder e fechou todos os órgãos legislativos\ndo país.\n\nDurante os anos em que foi deputado, defendeu o PRF e foi o líder desse\npartido na Assembleia Legislativa em várias legislaturas.\n\n*Raimundo Helio Lopes*\n\nFONTES: ASSEMB. LEGISL. RJ. *Anais* (1923-1930); *Estado* (20/3/1924,\n22/3, 2/8/1927, 19/8/1930); FERREIRA, M. *República*;\n*Fluminense*(27/12/1928).\n","ref":"FONTES: ASSEMB. LEGISL. RJ. *Anais* (1923-1930); *Estado* (20/3/1924,\n22/3, 2/8/1927, 19/8/1930); FERREIRA, M. *República*;\n*Fluminense*(27/12/1928).\n","dic":"DPRRJ"}
