{"title":"SANTOS, Francisco de Paula Lupério","cargoss":["Deputado Estadual","Interventor"],"cargos_esp":[0,0],"datas_ini":[1935,1947],"datas_fim":[1937,1947],"estados":["RJ","RJ"],"autor":["Raimundo Helio Lopes"],"content":"**SANTOS, Francisco de Paula Lupério**\n\n\\* dep. est. RJ 1935-1937; interv. RJ 1947.\n\n*Francisco de Paula Lupério Santos* nasceu na cidade de Ouro Preto (MG)\nno ano de 1898, filho de Camilo Gonçalves dos Santos e de Maria Augusta\nde Paula.\n\nIniciou seus estudos em sua cidade natal, depois se transferindo para o\nRio de Janeiro, então Distrito Federal. Na nova cidade cursou a Academia\nMilitar e formou-se em direito na Universidade do Brasil.\n\nDepois de formado, advogou no Rio de Janeiro e logo depois em Petrópolis\n(RJ). Iniciou sua vida política nesse município, onde formou sua base\neleitoral e foi eleito, em 14 de outubro de 1934, deputado à Assembleia\nConstituinte fluminense, assumindo sua cadeira no ano seguinte.\nParticipou da elaboração da nova Carta estadual e, após sua promulgação\nem 1^o^ de outubro de 1935, passou a exercer o mandato ordinário.\nPermaneceu na Assembleia Legislativa do Estado do Rio de Janeiro (ALERJ)\naté 10 de novembro de 1937, quando com a implantação do Estado Novo\nforam suprimidos todos os órgãos legislativos do país.\n\nDurante o governo do interventor do Rio de Janeiro Hugo Silva\n(1946-1947) foi nomeado secretário da Agricultura, Viação e Obras\nPúblicas e, posteriormente, secretário de Interior e Justiça. Com a\nrenúncia do interventor em 6 de fevereiro de 1947 assumiu a\nInterventoria fluminense até o dia 8 do mesmo mês, quando transferiu o\npoder estadual para Álvaro Rocha Pereira da Silva.\n\nDepois desses anos, retornou a Petrópolis (RJ), onde se tornou tabelião\ntitular do cartório do 9^o^ ofício. No dia 31 de outubro de 1957\ningressou na Academia Petropolitana de Letras. Nessa instituição, ocupou\nmuitos cargos, como segundo-secretário, bibliotecário, relações públicas\ne tesoureiro.\n\nFoi também chefe de polícia e presidente do Conselho Administrativo\nFluminense.\n\nFaleceu na cidade de Petrópolis (RJ) no dia 1^o^ de novembro de 1977.\n\n*Raimundo Helio Lopes*\n\nFONTES: ACAD. PETROPOLITANA LET. Disponível em: \\<www.apcl.com.br/1\\>.\nAcesso em: 2/2011; ASSEMB. LEGISL. RJ. *Anais* (1935); BELOCH, I; ABREU,\nA. *Dic*.\n","ref":"FONTES: ACAD. PETROPOLITANA LET. Disponível em: \\<www.apcl.com.br/1\\>.\nAcesso em: 2/2011; ASSEMB. LEGISL. RJ. *Anais* (1935); BELOCH, I; ABREU,\nA. *Dic*.\n","dic":"DPRRJ"}
