{"title":"SERRA, Francisco de Faria","cargoss":["Deputado Estadual"],"cargos_esp":[0],"datas_ini":[1895],"datas_fim":[1903],"estados":["RJ"],"autor":[0],"content":"**SERRA, Francisco de Faria**\n\n\\* dep. est. RJ 1895-1903.\n\n*Francisco de Faria Serra* nasceu em Cabo Frio (RJ).\n\nFoi eleito deputado estadual em 20 de maio de 1895 na legenda do Partido\nRepublicano Fluminense (PRF). Foi reeleito deputado estadual em 26 de\ndezembro de 1897, novamente pelo PRF.\n\nEm 30 de julho de 1900 foi reeleito deputado estadual. Em 1903, ano\nfinal da legislatura, participou da reforma da Constituição estadual,\nque determinou, entre outras medidas, o fortalecimento do Executivo\nestadual a partir da diminuição das atribuições do Legislativo e do\nJudiciário; o aumento do mandato do presidente estadual de três para\nquatro anos; e a redução do número de deputados estaduais de 60 para 45.\n\nFoi casado com Matilde Felícia de Gouveia.\n\n*Ioneide Piffano Brion de Souza*\n\nFONTES: ASSEMB. LEGISL. RJ. *Anais*(14/11/1892-12/1/1893, 1896); ASSEMB.\nLEGISL. RJ. *Legislaturas*. Disponível em:\n\\<www.alerj.rj.gov.br/arquivo.htm\\>. Acesso em: 10/10/2010; MASSA, H.\n*Cabo Frio*.\n","ref":"FONTES: ASSEMB. LEGISL. RJ. *Anais*(14/11/1892-12/1/1893, 1896); ASSEMB.\nLEGISL. RJ. *Legislaturas*. Disponível em:\n\\<www.alerj.rj.gov.br/arquivo.htm\\>. Acesso em: 10/10/2010; MASSA, H.\n*Cabo Frio*.\n","dic":"DPRRJ"}
