{"title":"SILBERT SOBRINHO, Francisco","cargoss":["Constituinte","Deputado Estadual","Constituinte","Deputado Estadual"],"cargos_esp":["est GB","GB","est",0],"datas_ini":[1960,1961,1975,1975],"datas_fim":[1961,1975,1975,1977],"estados":[0,0,"RJ","RJ"],"autor":[0],"content":"**SILBERT SOBRINHO, Francisco**\n\n\\* const. est. GB 1960-1961; dep. est. GB 1961-1975; const. est. RJ\n1975; dep. est. RJ 1975-1977.\n\n*Francisco Silbert Sobrinho* nasceu na cidade do Rio de Janeiro, então\nDistrito Federal, no dia 5 de janeiro de 1918, filho de um casal de\nimigrantes judeus poloneses.\n\nComeçou a trabalhar aos 15 anos de idade, após a morte do pai, numa loja\nde tecidos. Ainda na década de 1930 tornou-se agente fiscal do\nDepartamento de Renda Imobiliária da Secretaria de Finanças do\nmunicípio. Foi também nadador e remador do Clube de Regatas Flamengo.\n\nNa década de 1950, trabalhou para os jornais *O Dia* e *A Notícia* no\ncomitê de imprensa do Senado Federal e depois no da Câmara Municipal.\nSua carreira política se iniciou nas eleições municipais de outubro de\n1958, quando foi eleito vereador no Distrito Federal na legenda do\nPartido Socialista Brasileiro (PSB), com 3.440 votos. Ao longo do\nmandato, foi presidente da Comissão de Economia e Finanças da Câmara\nMunicipal e membro da Comissão de Fiscalização do Serviço Público e da\nComissão Central de Estudos para a Organização do Estado da Guanabara.\nDesde o início, sua atuação parlamentar se caracterizou pela defesa dos\ninteresses do funcionalismo público e pela atenção dada aos problemas de\nordem fiscal e financeira.\n\nEm outubro de 1960 foi eleito deputado à Assembleia Constituinte do\nrecém-criado estado da Guanabara na legenda do Partido Libertador (PL),\ncom 5.230 votos. Após a promulgação da Carta (27/3/1961) e a\ntransformação da Constituinte em Legislativo ordinário, continuou no\nexercício do mandato. Foi vice-presidente da mesa diretora da Assembleia\ne opôs-se ao governo de Carlos Lacerda quanto ao projeto de reforma\ntributária. Foi autor do substitutivo que permitiu a criação da\nCompanhia Progresso do Estado da Guanabara (Copeg) e teve aprovado o\nprojeto que considerava seu maior trabalho em prol do funcionalismo,\norigem da Lei n^o^ 276, que assegurou ao servidor inativo o aumento de\nproventos nas mesmas bases percentuais dos aumentos concedidos aos\nservidores em atividade. Foi autor de projetos sobre imposto predial, de\nvendas e consignações, indústrias, profissões e outros, e de um projeto\nque coibia e impedia a elevação constante de impostos no estado. Na\nsessão legislativa de 1962, integrou a Comissão de Educação, Saúde e\nAssistência Social e chegou a ser líder do PL. Foi um dos principais\nresponsáveis pela elaboração da legislação financeira da Guanabara e do\nprimeiro orçamento do novo estado.\n\nNa eleição de outubro de 1962, reelegeu-se deputado estadual na\nGuanabara na legenda do PL com 4.091 votos. Em 1963, foi membro da\nComissão de Educação e da Comissão de Redação da Assembleia Legislativa\nda Guanabara (ALEG). Apesar de crítico de Carlos Lacerda, nas últimas\nnoites de março de 1964 esteve junto dele quando o governador montou um\nfoco de resistência no Palácio Guanabara contra a eventual ação de\ntropas militares leais ao presidente João Goulart, cujo governo era alvo\nde um movimento militar que resultou na sua deposição. Não demonstrou\noposição ao governo militar instaurado no país por ocasião do golpe, mas\nalguns meses depois já reclamava da alta do custo de vida que penalizava\no funcionalismo publico estadual, carente de aumentos justos; dizia que\na culpa estava “na ganância, na voracidade, na falta de patriotismo de\nelementos das classes conservadoras que não se contentam com lucros\njustos e razoáveis”, e a quem a “Revolução” não parecia preocupada em\npunir. Ainda em 1964, viajou para Portugal a convite do Secretariado de\nCultura e Turismo desse país. Na sessão legislativa de 1965 foi membro\nda Comissão de Administração e Redação da ALEG e apoiou a candidatura\nvitoriosa ao governo estadual de Negrão de Lima, lançada pelo Partido\nTrabalhista Brasileiro (PTB) e o Partido Social Democrático (PSD),\nacusando o governo Lacerda de ter implantado “uma ditadura do Executivo”\nque “arrancou criminosamente” a reforma tributária de uma “assembleia\ndócil e submissa”. Porém, já em meados de 1966 declarou sua oposição ao\ngoverno de Negrão de Lima, que considerava um “desgoverno” pela inércia\ncom que vinha tratando a questão dos vencimentos do funcionalismo\npúblico, ao qual devia muitos dos votos que permitiram sua eleição.\n\nDiante da reformulação do sistema partidário nacional feita pelo Ato\nInstitucional n^o^ 2, de outubro de 1965, juntou-se às fileiras do\nMovimento Democrático Brasileiro (MDB), partido de oposição ao governo\nmilitar. Nessa legenda foi mais uma vez reeleito deputado estadual na\nGuanabara em novembro de 1966. Na sessão legislativa de 1967, presidiu a\nComissão Parlamentar de Inquérito para apurar responsabilidades sobre o\ntráfico e disseminação de drogas entre os jovens da Guanabara. Foi\ncrítico do processo de esvaziamento do Legislativo, aprofundado pela\nConstituição Federal de 1967 e a consequente adaptação da Constituição\nestadual a ela. No final do ano, viajou para Israel a convite do governo\ndesse país, com o propósito de aprender sobre temas de ordem tributária\ne fiscal e sobre as experiências locais na agricultura.\n\nDurante o ano de 1969, a ALEG foi fechada e funcionou apenas\nadministrativamente. Na sessão legislativa de 1970, Silbert Sobrinho foi\nescolhido presidente da mesa diretora por unanimidade. Candidatou-se e\nfoi reeleito deputado estadual na legenda do MDB nas eleições de\nnovembro de 1970, com cerca de 13.600 votos. Em 1971, assumiu a\npresidência da Comissão de Orçamento e Finanças; em 1972 presidiu a\nComissão de Administração e Redação e, no ano seguinte, a Comissão de\nEducação e Cultura. Manifestava-se favoravelmente às ações do governo do\nemedebista Chagas Freitas, embora continuasse a pedir do governo federal\nprovidências contra a alta do custo de vida. Reclamava do esvaziamento\npolítico e econômico do estado da Guanabara.\n\nPor meio da Lei Complementar n^o^ 20, de 1^o^ de julho de 1974, baixada\nno governo do presidente Ernesto Geisel, foi decretada a fusão entre os\nestados do Rio de Janeiro e da Guanabara, a ser concretizada em 15 de\nmarço de 1975. Nas eleições de novembro de 1974, que escolheriam os\ndeputados estaduais que formariam a Assembleia Constituinte do novo\nestado do Rio de Janeiro, Silbert Sobrinho foi novamente eleito na\nlegenda do MDB, com cerca de 20 mil votos. Foi suplente da Comissão\nConstitucional, fez estudos sobre o Imposto sobre Serviço e sobre o\nImposto sobre Circulação de Mercadorias, e propôs modificações no Código\nTributário de modo a evitar a queda na arrecadação de impostos. A\nConstituição do estado do Rio de Janeiro foi promulgada em 23 de julho\nde 1975. Silbert Sobrinho declarava-se descontente com a fusão, que não\nfora pedida nem reclamada pela população, mas que ali estava,\n“inexorável e indiscutível”; além disso, julgava que a antiga Guanabara\nestava sendo muito prejudicada pela política fiscal adotada pelo governo\ndo almirante Faria Lima, nomeado pelo governo federal.\n\nEm junho de 1977, Silbert Sobrinho foi internado para o tratamento de um\ncâncer pulmonar. Faleceu no dia 21 de setembro daquele ano. Cursava o\núltimo ano da Faculdade de Direito da Sociedade Unificada de Ensino\nSuperior (Suam), em Bonsucesso. Sua vaga na ALERJ foi ocupada por\nAparício Marinho.\n\nCasado com Ruth Nogueira Gama Groba Silbert, teve quatro filhos.\n\n*Paulo Celso Corrêa*\n\nFONTES: ASSEMB. LEGISL. GB. *Anais*; *Dia* (23/9/1977); *Diário Oficial\ndo Estado do Rio de Janeiro*.\n","ref":"FONTES: ASSEMB. LEGISL. GB. *Anais*; *Dia* (23/9/1977); *Diário Oficial\ndo Estado do Rio de Janeiro*.\n","dic":"DPRRJ"}
