{"title":"SILVA, Carlos Maximiano de Azevedo e","cargoss":["Constituinte","Deputado Estadual"],"cargos_esp":["est",0],"datas_ini":[1891,1891],"datas_fim":[1891,1891],"estados":["RJ","RJ"],"autor":[0],"content":"**SILVA, Carlos Maximiano de Azevedo e**\n\n\\* const. est. RJ 1891; dep. est. RJ 1891.\n\n*Carlos Maximiano de Azevedo e Silva* ingressou, em 1867, na Faculdade\nde Medicina da cidade do Rio de Janeiro, então capital do Império.\n\nPartidário de Francisco Portela, então presidente do estado do Rio de\nJaneiro (1889-1891), foi eleito deputado nas primeiras eleições\nrealizadas após a proclamação da República (15/11/1889) para a formação\nda Assembleia Constituinte do estado do Rio de Janeiro, realizada em 20\nde março de 1891.\n\nNa Constituinte estadual, reunida a partir de 10 de maio do mesmo ano,\nparticipou da elaboração e da promulgação da primeira Constituição\nrepublicana. Em seguida assumiu o mandato ordinário na Assembleia\nLegislativa do Estado do Rio de Janeiro. As sessões legislativas desse\nano se encerraram em novembro, mesmo mês em que Deodoro da Fonseca\nrenunciou à presidência da República, transferindo-a ao vice-presidente\nFloriano Peixoto. Diante desse conturbado contexto político, no dia 10\nde dezembro, Portela renunciou à presidência do estado do Rio de Janeiro\npor não ter mais o apoio do poder federal. Seu sucessor, Carlos Baltasar\nda Silveira (1891-1892), revogou a Constituição republicana fluminense,\nfechou o Congresso estadual e convocou uma nova Assembleia Constituinte.\nDiante disso, Carlos Maximiano de Azevedo e Silva perdeu o mandato.\n\n*Samuel Silva Rodrigues de Oliveira*\n\nFONTES: ASSEMB. LEGISL. RJ. *Anais* (1867); FERREIRA, M. *República*.\n","ref":"FONTES: ASSEMB. LEGISL. RJ. *Anais* (1867); FERREIRA, M. *República*.\n","dic":"DPRRJ"}
