{"title":"SILVA, Éber","cargoss":["Deputado federal"],"cargos_esp":[0],"datas_ini":[1999],"datas_fim":[2003],"estados":["RJ"],"autor":["Martina Spohr"],"content":"**SILVA, Éber**\n\n\\* dep. fed. RJ 1999-2003.\n\n*Éber Silva* nasceu no Rio de Janeiro, então Distrito Federal, no dia 3\nde dezembro de 1949, filho de Miguel Ramos da Silva e de Maria José da\nSilva.\n\nFormou-se em letras na Faculdade Sousa Marques em 1972 e ainda nesse ano\nfez o curso de extensão em didática geral do ensino oferecido pelo\nMinistério da Educação. Em 1973 tornou-se professor da rede oficial de\nensino do estado do Rio de Janeiro e a partir de então lecionou em\ninúmeras instituições. Atuou também nos meios sindicais, tendo\npertencido ao Sindicato dos Professores do Rio de Janeiro entre 1978 e\n1979.\n\nMembro da Igreja Batista, em 1986 concluiu o curso de teologia no\nSeminário Teológico Batista do Sul do Brasil e tornou-se pastor\nconselheiro da Juventude Batista do Estado do Rio de Janeiro e da\nJuventude Batista Capixaba. Presidiu a Associação Batista Caxiense de\n1987 a 1988 e a Ordem dos Pastores Batistas Fluminenses em 1992, e foi\nprimeiro vice-presidente da Junta de Educação Religiosa e Publicações da\nConfederação Batista Brasileira de 1992 a 1993. Presidente da\nConfederação Batista Fluminense (CBF) em 1996 e da Associação Batista da\nPlanície de 1996 a 1997, foi ainda vice-presidente da Ordem dos Pastores\nBatistas do Brasil em 1998.\n\nTransferido para Campos dos Goytacazes (RJ), em 1997 iniciou sua\ncarreira política ao filiar-se ao Partido Democrático Trabalhista (PDT).\nNas eleições de outubro de 1998 foi eleito deputado federal pelo estado\ndo Rio de Janeiro na legenda pedetista com o apoio de Antony Garotinho,\nimportante liderança política do norte-fluminense. Empossado na Câmara\ndos Deputados em fevereiro de 1999, participou da Comissão de Educação\nCultura e Desporto e da Comissão Permanente de Seguridade Social e\nFamília. Foi ainda membro titular da Comissão Parlamentar de Inquérito\n(CPI) do Narcotráfico, que funcionou entre abril de 1999 e dezembro de\n2000 e investigou empresários, políticos, juízes e outros envolvidos com\no crime organizado e o narcotráfico, bem como em crimes de sonegação\nfiscal, e participou das diligências que ratificaram o Acordo sobre\nPrevenção, Controle, Fiscalização e Repressão ao Uso Indevido e ao\nTráfico Ilícito de Entorpecentes e de Substâncias Psicotrópicas, que\nfora assinado pelo Paraguai e o Brasil em março de 1988.\n\nEm 2001 ingressou no Partido Liberal (PL), pouco depois se filiou ao\nPartido Social Trabalhista (PST) e tornou-se vice-líder dessa agremiação\nna Câmara. No exercício do mandato apresentou projeto de lei instituindo\no Dia Nacional da Bíblia, que foi aprovado, e propôs a regulamentação da\nprofissão de psicanalista. Essa proposta gerou amplo debate na imprensa\ne no meio psicanalítico, expondo a divisão entre a Sociedade\nPsicanalista Ortodoxa do Brasil, favorável à aprovação do projeto, e as\nsociedades tradicionais de psicanálise, como a Associação Brasileira de\nPsicanálise. Em 2003 o projeto seria arquivado.\n\nNas eleições de 2002 candidatou-se a deputado estadual na legenda do PST\ne obteve uma suplência. Em janeiro de 2003, ao final da legislatura,\ndeixou a Câmara dos Deputados e voltou a ocupar o cargo de pastor\n-presidente da segunda Igreja Batista de Campos.\n\nEm maio de 2006, após investigação conduzida junto com o Ministério\nPúblico, a Polícia Federal deflagrou a chamada “Operação Sanguessuga”,\nque prendeu servidores públicos acusados de utilizar dinheiro público na\ncompra de ambulâncias superfaturadas. Foi revelado que a empresa Planam\npagava propina a parlamentares que apresentassem emendas ao orçamento\npara a compra de ambulâncias pelas prefeituras. Essas descobertas\nlevaram à instalação de uma comissão parlamentar mista de inquérito\n(CPMI), que tomou o depoimento de Luís Antônio Vedoin, sócio da Planam,\no qual, por sua vez, denunciou o envolvimento no esquema de mais de 90\nparlamentares das legislaturas 1999-2003 e 2003-2007. Entre os acusados\nfoi citado Éber Silva que, em agosto de 2006, foi denunciado pelo\nMinistério Público do Mato Grosso à Justiça por formação de quadrilha,\nlavagem de dinheiro e corrupção passiva.\n\nCasou-se com Dulcineia Paiva e Silva, com quem teve dois filhos.\n\nEscreveu *Muito mais de Deus* e *Adoração e adoradores*, ambos\npublicados pela MK Editora.\n\n*Martina Spohr*\n\nFONTES: ASSEMB. LEGISL. RJ. Disponível em: \\<www.alerj.rj.gov.br\\>; CÂM.\nDEP. Disponível em: \\<www.camara.gov.br\\>; *Folha de S.Paulo*.\nDisponível em: \\<www.folha.uol.com.br\\>; G1 (21/9/2006). Disponível em:\n\\<http://g1.globo.com/Noticias/0,,IIF384-5601,00.html\\>. Acesso em:\n21/9/2009;*IstoÉ*. Disponível em: \\<www.terra.com.br/istoe\\>; MIN. PUB.\nFED. *Notícias*. Disponível em:\n\\<http://noticias.pgr.mpf.gov.br/noticias-do-site/criminal/criminal-2006/operacao-sanguessuga-mpf-mt-oferece-denuncia-contra-novos-envolvidos-20060831\\>.\nAcesso em: 21/9/2009; TRIB. REG. ELEIT. SP. Disponível em:\n\\<www.tre-sp.gov.br\\>; TRIB. SUP. ELEIT. Disponível em:\n\\<www.tse.gov.br\\>; *Veja*. Disponível em: \\<http://veja.abril.com.br\\>.\n","ref":"FONTES: ASSEMB. LEGISL. RJ. Disponível em: \\<www.alerj.rj.gov.br\\>; CÂM.\nDEP. Disponível em: \\<www.camara.gov.br\\>; *Folha de S.Paulo*.\nDisponível em: \\<www.folha.uol.com.br\\>; G1 (21/9/2006). Disponível em:\n\\<http://g1.globo.com/Noticias/0,,IIF384-5601,00.html\\>. Acesso em:\n21/9/2009;*IstoÉ*. Disponível em: \\<www.terra.com.br/istoe\\>; MIN. PUB.\nFED. *Notícias*. Disponível em:\n\\<http://noticias.pgr.mpf.gov.br/noticias-do-site/criminal/criminal-2006/operacao-sanguessuga-mpf-mt-oferece-denuncia-contra-novos-envolvidos-20060831\\>.\nAcesso em: 21/9/2009; TRIB. REG. ELEIT. SP. Disponível em:\n\\<www.tre-sp.gov.br\\>; TRIB. SUP. ELEIT. Disponível em:\n\\<www.tse.gov.br\\>; *Veja*. Disponível em: \\<http://veja.abril.com.br\\>.\n","dic":"DPRRJ"}
