{"title":"SILVA, José Américo Pinto da","cargoss":["Deputado Estadual"],"cargos_esp":[0],"datas_ini":[1928],"datas_fim":[1930],"estados":["RJ"],"autor":["Raimundo Helio Lopes"],"content":"**SILVA, José Américo Pinto da**\n\n\\* dep. est. RJ 1928-1930.\n\n*José Américo Pinto da Silva* foi usineiro, líder político e vereador da\ncidade de Magé (RJ). Em 1927 presidia a Câmara Municipal dessa cidade\nquando renunciou ao cargo para concorrer à vaga aberta na Assembleia\nLegislativa devido à renúncia de Eduardo Portela, que se tornou\nvice-presidente do estado do Rio de Janeiro durante a presidência de\nManuel Duarte (1927-1930).\n\nAssim, em 1928 foi eleito deputado estadual pelo primeiro distrito\neleitoral, com sede em Niterói. Em agosto de 1930 foi reeleito na chapa\ndo Partido Republicano Fluminense (PRF), mas teve seu mandato\ninterrompido em novembro deste ano com a vitória da Revolução de 1930\nque elevou Getúlio Vargas ao poder, fechou o Congresso Federal e\nextinguiu todos os órgãos legislativos do país. Durante todos os anos em\nque ocupou uma cadeira na Assembleia Legislativa foi membro da Comissão\nde Redação de Leis.\n\n*Raimundo Helio Lopes*\n\nFONTES: ASSEMB. LEGISL. RJ. *Anais* (1927-1930); *Estado* (19/8,\n3/10/1930); FERREIRA, M. *República*.\n","ref":"FONTES: ASSEMB. LEGISL. RJ. *Anais* (1927-1930); *Estado* (19/8,\n3/10/1930); FERREIRA, M. *República*.\n","dic":"DPRRJ"}
