{"title":"BARROSO, Raul Capelo","cargoss":["Deputado federal","Deputado federal","Deputado federal"],"cargos_esp":[0,0,0],"datas_ini":[1919,1909,1897],"datas_fim":[1923,1911,1902],"estados":["DF","DF","DF"],"autor":["Carolina Vianna Dantas"],"content":"**BARROSO, Raul Capelo**\n\n\\* dep. fed. DF 1897-1902, 1909-1911 e 1919-1923.\n\n*Raul Capelo Barroso* nasceu no Rio de Janeiro, então capital do\nImpério, no dia 5 de julho de 1860, filho do comendador Antônio Barroso\nFerreira e de Maria Eugênia Barroso.\n\nFez seus primeiros estudos no Colégio Abílio e em 1876 bacharelou-se em\nciências e letras pelo Colégio Pedro II. No ano seguinte ingressou na\nFaculdade de Medicina do Rio de Janeiro, diplomando-se em 1882.\n\nAo mesmo tempo em que passou a exercer a medicina profissionalmente, já\nsob o regime republicano iniciou a carreira política ao ser eleito\nintendente municipal no Rio de Janeiro, com mandato de 1892 a 1895.\nApoiou ativamente o governo do marechal Floriano Peixoto (1891-1894),\nauxiliando no combate à Revolta da Armada (1893-1894) e sendo nomeado\ncomandante da Guarda Nacional pelo presidente da República. Entre 1895 e\n1897 foi secretário particular do então prefeito do Distrito Federal\nFurquim Werneck.\n\nCandidato pelo terceiro distrito da então capital federal, foi eleito\ndeputado federal pela primeira vez em 1897. Reeleito em 1900, permaneceu\nna Câmara dos deputados até 1902 e voltou a ela ainda duas vezes: de\n1909 a 1911 e de 1919 a 1923. Como deputado, fez parte da Comissão de\nEducação e Saúde por muitos anos. Ao lado de Rui Barbosa, participou da\nCampanha Civilista de 1910, e em 1922 apoiou a eleição de Artur\nBernardes, que exerceu a presidência do país entre 1922 e 1926.\n\nFaleceu no Rio de Janeiro em 23 de dezembro 1923.\n\nFoi casado com a professora Maria Fausta Muniz Teles de Sampaio, com\nquem teve sete filhos.\n\n*Carolina Vianna Dantas*\n\nFONTES: Anotações pessoais de Raul Barroso Ribeiro; BASTOS, M. *Campo.*\n","ref":"FONTES: Anotações pessoais de Raul Barroso Ribeiro; BASTOS, M. *Campo.*\n","dic":"DPRRJ"}
