{"title":"SILVEIRA, Artur Messias da","cargoss":["Deputado Estadual"],"cargos_esp":[0],"datas_ini":[1999],"datas_fim":[2003],"estados":["RJ"],"autor":["Renata Moreira"],"content":"**SILVEIRA, Artur Messias da**\n\n\\* dep. est. RJ 1999-2003.\n\n*Artur Messias da Silveira* nasceu na cidade do Rio de Janeiro em 14 de\nagosto de 1961, filho de Manuel Messias da Silveira e de Irina Maria\nMeneses da Silveira.\n\nAos quatro anos de idade sua família mudou-se para Mesquita, na Baixada\nFluminense, onde fez seus estudos no Colégio Estadual Brasil. No início\nda década de 1980 foi da Pastoral da Juventude e da Pastoral Social da\ndiocese de Nova Iguaçu, tendo sido coordenador dos projetos voltados aos\njovens e adultos. Participou ainda das Comunidades Eclesiais de Base da\nIgreja Católica em Nova Iguaçu. Membro do Movimento de Associações de\nBairros, presidiu a Associação de Moradores de Vila Emil, localizada em\nMesquita. Filiou-se ao Partido dos Trabalhadores em 1981 e fundou, em\n1985, a Biblioteca Comunitária Oscar Romero.\n\nAinda nesse último ano graduou-se em Comunicação Social na Universidade\nFederal Fluminense (UFF).\n\nEm 1987 trabalhou no jornal *Última Hora*. De 1989 a 1990 foi porta-voz\nda Coordenação Nacional Pastoral Operária de Duque de Caxias (RJ),\nmunicípio também da Baixada Fluminense, e de 1990 a 1992 foi professor\nna Associação Brasileira de Ensino Universitário (ABEU).\n\nNas eleições municipais de 1988 concorreu a vereador de Nova Iguaçu na\nlegenda do PT e obteve uma suplência. No pleito de 1992 foi eleito\nvereador de Nova Iguaçu sempre na legenda petista. Permaneceu no\nexercício do mandato até janeiro de 1997, quando completou a\nlegislatura.\n\nAinda em 1997 coordenou o projeto de Alfabetização de Jovens e Adultos,\nque seria premiado pela Organização das Nações Unidas para a Educação, a\nCiência e a Cultura (Unesco), e cursou especialização em políticas\nsociais na Universidade do Estado do Rio de Janeiro (UERJ).\n\nNo pleito de outubro de 1998 concorreu a uma vaga na Assembleia\nLegislativa do Estado do Rio de Janeiro (ALERJ) na legenda do PT.\nEleito, tomou posse em fevereiro de 1999 e foi vice-presidente da\nComissão de Trabalho, Legislação Social e Seguridade Social.\n\nNesse mesmo ano foi sancionada pelo então governador Anthony Garotinho\n(1999-2002) a lei que emancipou Mesquita de Nova Iguaçu e foi marcada\npara outubro de 2000 a realização das primeiras eleições do novo\nmunicípio. Nesse mês, Artur Messias concorreu a prefeito de Mesquita,\nmas não foi eleito.\n\nDe volta à ALERJ foi membro da Comissão de Economia, Indústria, Comércio\ne Turismo, sub-relator e vice-presidente da Comissão Especial (CE) para\nestudar a aplicação da legislação de compensação financeira ao\naproveitamento dos recursos hídricos e dos recursos minerais no âmbito\ndo estado do Rio de Janeiro, presidiu a Comissão Parlamentar de\nInquérito (CPI) “Destinada a apurar as causas e os efeitos de\nderramamento de óleo na Baía de Guanabara”, foi líder da bancada do PT e\ncom a posse da vice-governadora Benedita da Silva, após a renúncia de\nGarotinho para disputar a presidência da República, Artur Messias foi\nescolhido líder do governo.\n\nNas eleições de outubro de 2002 tentou a reeleição, sempre no PT, e\nobteve uma suplência. Deixou a ALERJ em janeiro seguinte, ao final da\nlegislatura. Ainda em 2003 foi nomeado gerente regional do Ministério do\nDesenvolvimento Social e um dos responsáveis pela implantação do\nprograma Fome Zero na região Sudeste. Nas eleições municipais de 2004 e\nde 2008 voltou a disputar a prefeitura de Mesquita, agora com sucesso.\nEsteve à frente da prefeitura de Mesquita até 1^o^ de janeiro de 2012,\nquando chegou ao fim o seu segundo mandato.\n\n*Renata Moreira*\n\nFONTES: ASSEMB. LEGISL. RJ. *Deputados estaduais fluminenses*. Sétima\nlegislatura (1999-2003); Blog pessoal; PREF. MUN. MESQUITA. Disponível\nem: \\<www.mesquita.rj.gov.br/\\>.\n","ref":"FONTES: ASSEMB. LEGISL. RJ. *Deputados estaduais fluminenses*. Sétima\nlegislatura (1999-2003); Blog pessoal; PREF. MUN. MESQUITA. Disponível\nem: \\<www.mesquita.rj.gov.br/\\>.\n","dic":"DPRRJ"}
