{"title":"SILVEIRA, Jorge Roberto","cargoss":["Deputado Estadual","Prefeito","Prefeito","Prefeito"],"cargos_esp":[0,"Niterói","Niterói","Niterói"],"datas_ini":[1979,2009,1997,1989],"datas_fim":[1983,0,2002,1993],"estados":["RJ",0,0,0],"autor":[0],"content":"**SILVEIRA, Jorge Roberto**\n\n\\* dep. est. RJ 1979-1983; pref. Niterói 1989-1993, 1997-2002 e 2009-\n\n*Jorge Roberto Saad Silveira* nasceu em Niterói no dia 9 de setembro de\n1952, filho de Roberto Teixeira da Silveira e de Ismélia Saad da\nSilveira. Seu pai foi governador do estado do Rio de Janeiro entre 1959\ne 1961. Seu tio José Silveira foi deputado federal pelo estado do Paraná\nde 1959 a 1963, e outro tio, Badger Silveira, também foi governador do\nestado do Rio, de 1963 a 1964.\n\nFez o curso secundário no Instituto Abel e no Centro Educacional de\nNiterói e graduou-se em jornalismo pela Universidade Federal Fluminense\n(UFF). Quando jovem, dedicou-se à música como compositor e\ninstrumentista. Em 1972 começou a trabalhar como crítico de cinema no\nsemanário niteroiense *Lig*. No ano seguinte continuou a escrever sobre\no mesmo tema, mas no suplemento de arte e cultura “Encontro” do jornal\n*O Fluminense*, do qual se tornou editor em 1975.\n\nFiliou-se em 1976 ao Movimento Democrático Brasileiro (MDB) e em\nnovembro de 1978 elegeu-se deputado estadual no Rio de Janeiro, tendo\nsido o quarto candidato mais votado do partido. Assumiu o mandato no\ninício de 1979 e, após o fim do bipartidarismo em novembro do mesmo ano,\nfiliou-se ao Partido Trabalhista Brasileiro (PTB). Nessa legenda\nreelegeu-se deputado estadual nas eleições de novembro de 1982, mesmo\npleito em que Leonel Brizola, do Partido Democrático Trabalhista (PDT),\nfoi eleito governador (1983-1987). Em 1983 transferiu-se para o PDT e\nfoi nomeado por Brizola secretário estadual de Esporte e Lazer.\nLicenciou-se do mandato de deputado para assumir a secretaria. Durante\nsua gestão recuperou os complexos esportivos do Maracanã, no Rio de\nJaneiro, e Caio Martins, em Niterói.\n\nNas eleições de novembro de 1988 elegeu-se prefeito de Niterói e em 1^o^\nde janeiro do ano seguinte tomou posse. Uma de suas primeiras medidas\nfoi promover o saneamento das finanças municipais, implantando um regime\nde caixa único, que proporcionou a centralização dos recursos da\nprefeitura. Promoveu, ainda, uma revisão dos casos de cidadãos que\ndeviam impostos à prefeitura de modo a aumentar a receita de seu\ngoverno. Sua administração caracterizou-se pelas reformas urbanas que\nrealizou. Foram abertas muitas frentes de obras, e foram tomadas\niniciativas que projetaram a cidade de Niterói. Entre elas destacaram-se\no início da construção do Museu de Arte Contemporânea (MAC), projetado\npor Oscar Niemeyer, a criação do selo musical Niterói Discos, a\nrestauração e o tombamento do Teatro Municipal João Caetano, a\nconstrução do Centro de Espetáculos Populares de São Domingos e do\nTerminal Rodoviário João Goulart, a criação da Companhia de Limpeza\nUrbana de Niterói (CLIN) e a implementação dos programas *Vida Nova no\nMorro*, que tinha como propósito oferecer infraestrutura e saneamento\npara a população carente que residia nos morros, e *Médico de Família*,\nque foi copiado por várias cidades do Brasil. Encerrou o mandato no dia\n1^o^ de janeiro de 1993 e foi em seguida nomeado secretário de Projetos\nde Integração Social do segundo governo de Leonel Brizola (1991-1994).\nNesse período ajudou a implantar o programa *Médico de Família* em\nvárias cidades do estado. Em outubro de 1994 candidatou-se a senador,\nmas não foi eleito.\n\nEm 1996 voltou a se eleger prefeito de Niterói e no ano seguinte assumiu\no mandato. Em agosto de 1997, desapropriou o Solar do Jambeiro, palacete\nconstruído no século XIX em Niterói, que passou em seguida por um\nprocesso de restauração. No mesmo ano, fez uma conferência na\nOrganização das Nações Unidas (ONU) em Nova Iorque sobre os projetos\n*Médico de Família* e *Vida Nova no Morro*. Ainda durante sua\nadministração, foram iniciadas as obras do Caminho Niemeyer, um conjunto\nde nove construções (Praça Juscelino Kubitschek, Memorial Roberto\nSilveira, Teatro Popular, um novo terminal das barcas, Museu Petrobrás\nde Cinema, Fundação Oscar Niemeyer, uma torre panorâmica e duas\ncatedrais) projetadas pelo arquiteto Oscar Niemeyer que formariam um\nconjunto com o MAC.\n\nReeleito em outubro de 2000, determinou o prosseguimento da construção\ndo Caminho Niemeyer, obra que, no entanto, não foi concluída até dos\ndias atuais. Deu também continuidade às obras de saneamento, de\nmanutenção da infraestrutura urbana e de reforma em unidades de saúde.\nRenunciou ao mandato em abril de 2002 para candidatar-se a governador do\nestado. Obteve 17% dos votos e foi o terceiro colocado no pleito vencido\npor Rosinha Garotinho.\n\nEm 2008, depois de seis anos afastado das atividades políticas, foi\nnovamente eleito prefeito de Niterói. Assumiu o mandato no ano seguinte,\nmanteve o programa *Viva Idoso*, iniciado no governo anterior, e deu\ncontinuidade ao projeto *Médico de Família*, instalando sua 34^a^\nunidade no bairro de Santa Rosa. Em abril de 2010, Niterói foi a cidade\nmais atingida do estado por fortes chuvas, que provocaram vários\ndeslizamentos de terra e atingiram a população que morava em áreas de\nrisco, sobretudo no morro do Bumba, cujo desmoronamento deixou dezenas\nde mortos e centenas de desabrigados. Após esse episódio a popularidade\ndo prefeito foi abalada, já que houve denúncias de que autoridades da\nprefeitura estariam cientes do risco do desmoronamento antes mesmo das\nchuvas.\n\nO programa *Médico de Família* recebeu o Prêmio Gestão Pública e\nCidadania, concedido pela Fundação Getulio Vargas e a Fundação Ford.\n\nCasado com Cristina Ramalho Silveira, teve um filhoa.\n\nEscreveu o livro *Vistas e paisagens da enseada de Niterói* (2002).\n\n*Paulo César Gomes Bezerra*\n\nFONTES: *Fluminense* (5/11/1988, 3, 15, 24/1, 17/3/1989, 29/12/1992, 9,\n18/1/1997, 2, 18/12/2000, 3/1/2001, 5/1/2009); PREF. NITERÓI. Disponível\nem: \\<www.niteroi.rj.gov.br/novo/index.php/o-prefeito\\>. Acesso em:\n10/10/2010. SOARES,E. *Prefeitura*;WEHRS, C. *Niterói*.\n","ref":"FONTES: *Fluminense* (5/11/1988, 3, 15, 24/1, 17/3/1989, 29/12/1992, 9,\n18/1/1997, 2, 18/12/2000, 3/1/2001, 5/1/2009); PREF. NITERÓI. Disponível\nem: \\<www.niteroi.rj.gov.br/novo/index.php/o-prefeito\\>. Acesso em:\n10/10/2010. SOARES,E. *Prefeitura*;WEHRS, C. *Niterói*.\n","dic":"DPRRJ"}
