{"title":"SIMÕES, José Miguel Olímpio","cargoss":["Deputado Estadual","Deputado Estadual"],"cargos_esp":[0,0],"datas_ini":[1975,1967],"datas_fim":[1977,1971],"estados":["RJ","RJ"],"autor":[0],"content":"**SIMÕES, José Miguel Olímpio**\n\n\\* dep. est. RJ 1967-1971, 1975-1977.\n\n*José Miguel Olímpio Simões* nasceu em Mangaratiba (RJ) no dia 7 de\nmarço de 1932, filho de Olímpio Miguel Simões e de Mary José Dib Arab\nSimões.\n\nGraduou-se na Sociedade Unificada Ensino Superior Cultura (SUESC) em\ndireito e lá também cursou administração de empresas. Atuou como\nadvogado durante alguns anos.\n\nAos 18 anos elegeu-se vereador no município de Mangaratiba.\n\nElegeu-se deputado estadual no antigo estado da Guanabara no pleito de\n15 de novembro de 1966, após uma série de decretos lançados pela\nPresidência da República suspendendo os direitos políticos de diversos\ncandidatos às eleições parlamentares daquele ano. Foi primeiro\nvice-presidente da Mesa Diretora em 1970. Exerceu o mandato até o fim da\nlegislatura, no início de 1971.\n\nReelegeu-se na legenda da Aliança Renovadora Nacional (Arena) em\nnovembro de 1974, com 5.268 votos. Nesse ano, o Congresso Nacional\naprovou o projeto de lei do governo federal que promoveu a fusão da\nGuanabara com o estado do Rio. No ano seguinte, os deputados que haviam\nsido eleitos para as assembleias estaduais se reuniram para formar a\nAssembleia Constituinte do novo estado do Rio de Janeiro.\n\nFoi prefeito do município de Mangaratiba entre 1977 e 1981 e entre 1993\ne 1997.\n\nCasou-se com Maria Luísa Vieira Simões e teve quatro filhos.\n\n*Lara de Melo*\n\nFONTES: Mangaratiba Nativa. Disponível em:\n\\<www.guiamangaratiba.org/conteudo.php?id=6\\>. Acesso em: 11/5/2011;\nTRIB. SUP. ELEIT. *Dados* (11).\n","ref":"FONTES: Mangaratiba Nativa. Disponível em:\n\\<www.guiamangaratiba.org/conteudo.php?id=6\\>. Acesso em: 11/5/2011;\nTRIB. SUP. ELEIT. *Dados* (11).\n","dic":"DPRRJ"}
