{"title":"SIVUCA","cargoss":["Deputado Estadual","Deputado Estadual"],"cargos_esp":[0,0],"datas_ini":[2005,1991],"datas_fim":[2006,2003],"estados":["RJ","RJ"],"autor":["Luciana Pinheiro"],"content":"**SIVUCA**\n\n\\* dep. est. RJ 1991-2003, 2005-2006.\n\n*José Guilherme Godinho Ferreira* nasceu em Valença (RJ) no dia 22 de\nsetembro de 1930, filho de Vitorino da Costa Ferreira e de Hercília\nFigueiredo Godinho. Ao longo de sua trajetória pública se tornou\nconhecido como *Sivuca*.\n\nDiplomado em 1973 no curso de ciências jurídicas e sociais pela\nFaculdade Nacional de Direito da Universidade Federal do Rio de Janeiro\n(UFRJ), concluiu pós-graduação em didática do ensino superior na\nUniversidade Gama Filho (UGF) em 1984. No decorrer de sua carreira\nrealizou diversos cursos de formação e especialização, em sua maioria\nnas áreas do direito e da segurança pública.\n\nMilitar de carreira, antes de ingressar na vida política atuou no\nGabinete Militar do Rio de Janeiro, foi delegado de polícia e exerceu a\nfunção de interventor da Circunscrição Regional de Trânsito (Ciretran)\nno município fluminense de Nova Iguaçu.\n\nReconhecido pelo bordão “Bandido bom é bandido morto”, Sivuca ingressou\nna vida política ao candidatar-se ao cargo de deputado estadual nas\neleições de 1990, sendo eleito pela legenda do Partido da Frente Liberal\n(PFL), atual Democratas (DEM). Tomou posse de sua cadeira na Assembleia\nLegislativa do Estado do Rio de Janeiro (ALERJ) em fevereiro de 1991,\nquando foi escolhido vice-líder do PFL na Casa. No ano seguinte\ntornou-se membro efetivo da Comissão de Constituição e Justiça e da\nComissão de Orçamento, Finanças e de Tributação, além de vice-presidente\nda Comissão de Legislação Constitucional Complementar e Códigos, com\ngestão até o ano seguinte.\n\nNo decorrer de 1993, ano em que presidiu a Comissão de Emendas\nConstitucionais e Vetos, foi vice-presidente da Comissão de Orçamento,\nFinanças e de Tributação e passou a integrar as comissões permanentes de\nRedação e de Servidores Públicos. Além disso, tornou-se membro da\nComissão Especial (CE) destinada a apurar possíveis irregularidades nos\ncontratos celebrados entre hospitais estaduais vinculados à Secretária\nde Saúde fluminense e às empresas prestadoras de serviços no ramo de\nlavanderias.\n\nNas eleições realizadas em novembro de 1994 concorreu à reeleição pela\nlegenda do Partido Republicano Progressista (PRP). Eleito, tomou posse\nem fevereiro de 1995, assumindo o cargo de líder do PRP na ALERJ.\nEscolhido para presidir a Comissão de Indicações Legislativas, nesse\nmesmo ano atuou ainda como vice-presidente da Comissão Especial\ndestinada a elaborar propostas que visavam a reestruturação das polícias\ndo estado do Rio. Durante 1996, quando novamente integrou a Comissão de\nConstituição e Justiça da Casa legislativa fluminense, atuou também como\npresidente da Comissão Especial que acompanhou a reforma do Código Penal\nbrasileiro e participou da CE que investigou o desenvolvimento do\nprograma de dragagem dos rios e canais no município de Campos dos\nGoytacazes.\n\nEm 1997 foi eleito vice-líder do Partido Progressista Brasileiro (PPB),\nformado pela fusão do PRP e do Partido Progressista (PP). Nesse mesmo\nano manteve-se membro da Comissão de Defesa do Consumidor e integrou\nquatro Comissões Parlamentares de Inquérito (CPIs), criadas\nrespectivamente para apurar as seguintes denúncias: “evasão na\narrecadação do ICMS”; “sonegação fiscal no âmbito do comércio de\nautomóveis e supermercados do estado do Rio de Janeiro”; !sonegação e\nevasão de receitas dos impostos estaduais”; “prejuízos causados à\nCompanhia Estadual de Água e Esgoto (CEDAE) e Outros”.\n\nEm 1998 assumiu as funções de membro efetivo em duas outras comissões:\nde Segurança Pública e Assuntos de Polícia e de Prevenção ao Uso de\nDrogas e Dependentes Químicos. No pleito eleitoral realizado em outubro\ndesse mesmo ano concorreu ao seu terceiro mandato na ALERJ. Eleito, em\nfevereiro de 1999 tomou posse do novo mandato de mais quatro anos.\n\nNas eleições gerais de 2002 candidatou-se novamente à reeleição,\nconquistando a primeira suplência do seu partido. Em janeiro de 2005\nassumiu sua quarta gestão legislativa em virtude da renúncia da então\ndeputada estadual Aparecida Panisset, recém-empossada no cargo de\nprefeita do município de São Gonçalo. No decorrer desse mesmo ano foi\nescolhido para presidir a comissão de Transportes. No pleito eleitoral\nrealizado em outubro de 2006 não concorreu a novo mandato, mas apoiou a\ncandidatura de seu filho Sylvio de Carvalho Ferreira, que concorreu sem\nsucesso pela legenda do Partido Trabalhista do Brasil (PTdoB) a uma\ncadeira na assembleia fluminense.\n\nNo decorrer de seus quatro mandatos na ALERJ Sivuca também integrou CPI\ncriada para apurar o tratamento concedido à população idosa por\ninstituições assistenciais, previdenciárias, concessionárias de serviços\npúblicos e outras organizações públicas ou privadas. Além disso, foi\nmembro de outras duas comissões especiais: uma delas destinada a\ninvestigar possíveis irregularidades das construções, contratos e\ncessões de áreas sem licitações nos Ceasas do Rio de Janeiro; outra\ncriada para averiguar a chacina de detentos ocorrida no presídio Ary\nFranco.\n\nMembro do conselho editorial da *Revista Polícia em Ação*, fora da\nesfera política Sivuca atuou ainda como assessor criminal e como\nconsultor em direito penal, disciplina que lecionou na Academia de\nPolícia Silvio Terra. Ex-diretor da Escola Superior Livre para o\nTrabalho (Esultra) e do Departamento de Trânsito do Estado do Rio de\nJaneiro (Detran), foi presidente nacional da Scuderie Detetive Le Cocq.\nAlém disso, chefiou a seção de recursos especiais e desativação de\nartefatos explosivos da Secretaria de Segurança Pública (SSP)\nfluminense, assim como o grupo de motociclistas da Polícia Especial do\nDepartamento Federal de Segurança Pública.\n\nAo longo de sua trajetória profissional José Guilherme Godinho Ferreira\nrecebeu diversos títulos e condecorações, entre os quais se destacam:\nmedalha “Fidelidade à Guabanara”, concedida pelo antigo estado da\nGuanabara; medalha centenária concedida pelo jornal *Gazeta de Notícia*;\nHonra ao Mérito pelos serviços prestados à Scuderie Le Cocq de Minas\nGerais; certificado de relevantes serviços prestados ao Projeto Minerva,\ndo Ministério da Educação e Cultura (MEC); certificado do governo do\nestado do Rio de Janeiro pelos relevantes serviços prestados; diploma de\nBenemérito do Circulo Policial Brasileiro; medalhas do Mérito Policial\nde prata e de bronze, oferecidas pela Secretaria de Estado de Polícia\nCivil.\n\nPublicou texto que discorre sobre o tema “Educação, instituição e menor\ncarente”, na *Revista Polícia em Ação*.\n\n*Luciana Pinheiro*\n\nFONTES: ASSEMB. LEGISL. RJ. *Deputados estaduais fluminenses*. Sexta\nlegislatura (1995-1999); ASSEMB. LEGISL. RJ. Disponível em:\n\\<www.alerj.rj.gov.br/\\>. Acesso em: 1/11/2010; *Dia*. Disponível em:\n\\<http://odia.terra.com.br/\\>. Acesso em: 1/11/2010; *Folha de S.Paulo*.\nDisponível em: \\<www.folha.uol.com.br/\\>. Acesso em: 1/11/2010.\n","ref":"FONTES: ASSEMB. LEGISL. RJ. *Deputados estaduais fluminenses*. Sexta\nlegislatura (1995-1999); ASSEMB. LEGISL. RJ. Disponível em:\n\\<www.alerj.rj.gov.br/\\>. Acesso em: 1/11/2010; *Dia*. Disponível em:\n\\<http://odia.terra.com.br/\\>. Acesso em: 1/11/2010; *Folha de S.Paulo*.\nDisponível em: \\<www.folha.uol.com.br/\\>. Acesso em: 1/11/2010.\n","dic":"DPRRJ"}
