{"title":"SOARES, Edmundo de Macedo","cargoss":["Ministro da Viação e Obras Públicas","Governador de estado ou do Distrito Federal","Presidente de associação ou confederação de empregados ou empregadores","Ministro da Indústria e Comércio"],"cargos_esp":[0,0,"CNI",0],"datas_ini":[1946,1947,1964,1967],"datas_fim":[1946,1951,1968,1969],"estados":[0,"RJ",0,0],"autor":[0],"content":"**SOARES, Edmundo de Macedo**\n\n\\* militar; min. Viação 1946; gov. RJ 1947-1951; pres. CNI 1964-1968;\nmin. Ind. e Com. 1967-1969.\n\n*Edmundo de Macedo Soares e Silva* nasceu no Rio de Janeiro, então\nDistrito Federal, no dia 9 de junho de 1901, filho do médico Sebastião\nEdmundo Mariano da Silva e de Elisa de Macedo Soares e Silva. Sua\nfamília teve atuação importante na vida política e cultural do país. Seu\navô materno, Antônio Joaquim de Macedo Soares, foi magistrado,\njurisconsulto, lexicógrafo e ministro do Supremo Tribunal Federal (STF).\nSeu irmão Hélio de Macedo Soares e Silva foi deputado federal de 1951 a\n1955. Entre seus primos destacaram-se José Carlos de Macedo Soares,\nconstituinte de 1934, ministro das Relações Exteriores de 1934 a 1937 e\nde 1955 a 1958, ministro da Justiça em 1937 e interventor federal em São\nPaulo de 1945 a 1947; José Roberto de Macedo Soares, embaixador no\nUruguai entre 1945 e 1951; José Cássio de Macedo Soares, deputado\nfederal de 1935 a 1937, e José Eduardo de Macedo Soares, jornalista,\ndeputado federal de 1915 a 1923, constituinte de 1934 e senador pelo Rio\nde Janeiro de 1935 a 1937.\n\nFez o curso primário entre 1907 e 1911 no Colégio Ronanet e no Externato\nPitanga, ambos no Rio de Janeiro. Ingressando no Colégio Militar em\n1912, aí completou o curso secundário em 1917. Sentou praça no ano\nseguinte, tornando-se aluno da Escola Militar do Realengo, de onde saiu\naspirante a oficial da arma de engenharia em janeiro de 1921. Serviu em\nseguida na 1^a^ Companhia Ferroviária em Deodoro, e em maio de 1921 foi\npromovido a segundo-tenente, sendo designado instrutor do curso de\nengenharia da Escola Militar do Realengo.\n\nTomou parte na Revolta de 5 de Julho de 1922, movimento que iniciou o\nciclo de revoltas tenentistas da década de 1920 e que irrompeu\nsimultaneamente no Rio de Janeiro e em Mato Grosso em protesto contra a\neleição de Artur Bernardes para a presidência da República e as punições\nimpostas pelo governo Epitácio Pessoa (1919-1922) aos militares, com o\nfechamento do Clube Militar e a prisão do marechal Hermes da Fonseca. A\nrevolta envolveu a Escola Militar, o forte de Copacabana e efetivos da\nVila Militar no Rio, e o contingente do Exército de Mato Grosso. Macedo\nSoares foi preso, mas apesar disso foi promovido a primeiro-tenente em\nsetembro de 1922. Em março de 1925 evadiu-se do presídio da ilha Grande\ne logo em seguida embarcou para a Europa.\n\nDurante os anos que passou no exílio, fez inicialmente o curso de\nengenharia metalúrgica no Conservatoire National des Arts et Métieres em\nParis, e em 1928 ingressou na École de Chauffage Industriel. Em\nfevereiro desse mesmo ano foi condenado à revelia a um ano e quatro\nmeses de prisão por seu envolvimento na Revolta de 1922. No ano seguinte\nconcluiu o curso da École Supérieure de Fonderie de Paris. Completando\nsua formação em metalurgia, estagiou nas usinas francesas de\nChoisy-le-Roi e de Chambéry e na usina Breda, na Itália.\n\nDe 1930 a 1945: atuação no debate siderúrgico\n\nCom a vitória da Revolução de 1930 e a instalação do governo provisório\nde Getúlio Vargas, Macedo Soares voltou ao Brasil, beneficiado pela\nanistia, e ainda em novembro foi promovido a capitão.\n\nOs revolucionários de 1930 tinham a proposta de impulsionar a utilização\ndos recursos nacionais para um maior desenvolvimento da indústria\nbrasileira. A exploração das jazidas de ferro e a instalação de uma\nindústria siderúrgica de grande porte eram fundamentais para a\nintensificação do processo de industrialização e passaram a ser uma das\nmetas do governo provisório. Durante os anos passados na Europa, Macedo\nSoares tornou-se um especialista em metalurgia, o que fez com que, ao\nretornar ao Brasil, fosse solicitado a participar de debates e\ncomissões, a dar pareceres e elaborar projetos sobre o problema\nsiderúrgico brasileiro. Já em 1930 encontrou um grande debate em torno\ndas concessões feitas à Itabira Iron Ore Company, empresa de capital\npredominantemente inglês que em 1911 havia adquirido as maiores jazidas\nde ferro do país. Essa empresa, dispondo de técnicas e de capital e\nmantendo o controle acionário da Companhia Estrada de Ferro\nVitória-Minas, firmara em 1920 um contrato com o governo federal pelo\nqual se comprometia a construir uma usina siderúrgica para a produção de\naço e laminados em troca do direito de exportar grandes quantidades de\nminério de ferro. O projeto Itabira provocava uma grande campanha de\noposição contra a exploração de riquezas naturais por grupos\nestrangeiros.\n\nEm janeiro de 1931, Macedo Soares foi nomeado para integrar a Comissão\nMilitar de Estudos Metalúrgicos, destinada a avaliar a capacidade de\nmobilização da indústria metalúrgica nacional, juntamente com os\ncapitães Sílvio Raulino de Oliveira e Franklin Emílio Rodrigues. A\ncomissão procurou estudar uma solução para o problema da fabricação de\narmamento e munição. Ainda em 1931, trabalhando no serviço de engenharia\nda 2^a^ Região Militar (2^a^ RM), sediada em São Paulo, participou da\norganização do projeto de abastecimento de água de Quitaúna, no\nmunicípio de Osasco. Em agosto desse mesmo ano, tornou-se membro da\nComissão Nacional de Siderurgia, criada por Vargas no Ministério da\nGuerra. Essa comissão tinha a incumbência de estudar o aproveitamento\ndos minérios de ferro nacionais, com o objetivo tanto de promover sua\nexportação como de implantar a indústria siderúrgica em larga escala no\npaís. Ao lado de Macedo Soares, secretário e relator da comissão,\nencontravam-se Sílvio Raulino de Oliveira, também representante do\nMinistério da Guerra, Ernesto da Fonseca Costa, Eusébio Paulo de\nOliveira, o capitão-tenente Raul Álvares de Azevedo Castro,\nrepresentante do Ministério da Marinha, Luís Betim Pais Leme e Raul\nRibeiro da Silva. Os trabalhos foram interrompidos em julho de 1932 ao\neclodir a revolução paulista, sendo reiniciados somente em março de\n1933.\n\nOs estudos realizados levaram os técnicos da Comissão de Siderurgia a\ndefender a construção de uma usina siderúrgica com capacidade de mil\ntoneladas diárias de ferro-gusa e laminados. Indicaram entretanto as\ndificuldades para a instalação dessa usina no país devido à falta de um\nagente térmico e de redução barata. O Brasil possuía carvão mineral nos\nestados do sul, mas havia problemas para a sua utilização. A comissão\nadmitiu por isso a possibilidade de ser instalada uma usina siderúrgica\nno vale do rio Doce, com carvão de madeira, dadas as grandes extensões\nde florestas ali existentes. Outra alternativa seria a instalação de uma\nusina a coque importado, sendo então necessárias 1.300 toneladas de\nhulha coqueificável, para uma usina de mil toneladas diárias. Nesse caso\nseria preciso exportar minério de ferro a fim de compensar o ingresso de\nhulha e evitar o pagamento do frete de retorno vazio. Devido às\ndificuldades de comercialização, essa solução não se mostrou a mais\nindicada, levando a comissão a sugerir que num primeiro momento se\nconstruísse uma usina para cerca de duzentas mil toneladas anuais,\nbaseada em carvão vegetal e localizada no vale do rio Doce.\nParalelamente seria necessário incrementar a exploração dos carvões de\nSanta Catarina, melhorar suas condições de transporte e embarque e\nrealizar a prospecção e o estudo de outras regiões do país a fim de\ndescobrir novas jazidas de hulha coqueificável. Em uma segunda etapa,\nentão, seria possível pensar na importação da hulha.\n\nA participação de Macedo Soares na Comissão Nacional de Siderurgia\npermitiu-lhe um contato maior com o problema siderúrgico brasileiro e um\naprofundamento em seu estudo, o que o levaria mais tarde à defesa da\nconstrução de uma grande usina siderúrgica, tida como fundamental para o\ndesenvolvimento nacional.\n\nDurante o ano de 1932 foi assistente técnico da delegação brasileira à\nConferência do Desarmamento, realizada em Genebra, delegado do Brasil à\nConferência Internacional do Trabalho, e fez um estágio na empresa\nBreda, em Milão, Itália, sobre o forno elétrico de aço. Também em 1932\niniciou sua carreira no magistério como professor de metalurgia da\nEscola de Engenharia do Exército, função que exerceria até 1943. Em 1933\ndeu um curso de metalurgia na Escola Politécnica do Rio de Janeiro.\nSolicitado nesse mesmo ano a participar da comissão organizadora da\nFábrica de Projéteis de Artilharia no bairro do Andaraí, no Rio de\nJaneiro, integrou também a Comissão de Estudos para a Indústria Militar\nBrasileira que visitou a Europa. Em outubro de 1934 foi promovido a\nmajor e em 1936 tornou-se auxiliar de ensino teórico da Escola Técnica\ndo Exército. Em junho do ano seguinte assumiu o cargo de subchefe do\nGabinete do Ministério da Justiça, na gestão de seu primo José Carlos de\nMacedo Soares, função que desempenhou até o advento do Estado Novo, em\nnovembro de 1937, quando José Carlos deixou a pasta.\n\nO período que se iniciou em 1937 trouxe a solução para as questões que\nenvolviam a criação de uma grande usina siderúrgica no país. Até então\nsó haviam sido construídas pequenas usinas, baseadas no carvão vegetal e\ncom uma produção em grande parte destinada à manufatura de artigos\ncorrentes como ferramentas, cutelaria etc. A produção dessas usinas,\nalém de pequena e cara, não satisfazia às necessidades do mercado\ninterno, que era obrigado a adquirir os produtos importados por preços\nbastante elevados. Essa situação tornava-se um obstáculo para o\ndesenvolvimento industrial nacional e, para enfrentá-la, determinados\nsetores militares, industriais e técnicos se uniram ao novo governo com\no intuito de formular as novas diretrizes da economia nacional. O\ninteresse de alguns militares pelos problemas básicos da economia\ndecorria de seu desejo de transformar o Brasil numa nação forte\neconômica e militarmente, como única forma de manter a sua independência\ne soberania. A siderurgia transformou-se num ponto vital para a\nmanutenção da defesa e da segurança nacional.\n\nCom o objetivo de encaminhar uma solução para o problema siderúrgico, em\nmarço de 1938 o presidente Vargas solicitou ao Conselho Técnico de\nEconomia e Finanças um parecer sobre os projetos enviados ao governo\nacerca da criação de uma grande siderúrgica e da exportação de minério\nde ferro em larga escala. O conselho, sob a presidência do ministro da\nFazenda Artur de Sousa Costa, preparou um relatório sobre o assunto e\nconvidou técnicos e personalidades da vida pública, entre eles Macedo\nSoares, para debaterem o problema siderúrgico. As opiniões ali emitidas\nlançaram uma nova visão sobre o encaminhamento do problema, sendo que a\nexposição feita por Macedo Soares foi fundamental. Apresentou um projeto\npara a construção de uma usina no país, o qual mais tarde, com algumas\nmodificações, serviria de base para a elaboração do projeto definitivo,\nisto é, o da usina siderúrgica de Volta Redonda. Ao terminar a exposição\nde suas ideias, foi solicitado pelo ministro Sousa Costa a elaborar um\nprojeto nos moldes que reivindicava, incluindo nele as dimensões da\nusina de acordo com as possibilidades do mercado brasileiro, os métodos\nde trabalho, a avaliação dos preços e do custo das matérias-primas etc.\n\nDuas semanas mais tarde o projeto foi entregue ao ministro, que o\nencaminhou ao presidente Vargas com a recomendação de que o examinasse\ncom toda a atenção. As teses propostas por Macedo Soares recomendavam,\nem resumo, que a exportação de minério de ferro e a construção da usina\nfossem tratadas separadamente, pois constituíam problemas distintos. A\ndecisão de construir uma grande usina vinha sendo impedida devido à\nquestão da exportação de minério, o que, segundo Macedo Soares, era um\nsimples negócio comercial. A exportação de minério de ferro poderia ser\nfeita em larga escala sem o menor inconveniente, tal era o volume das\njazidas brasileiras. O único obstáculo era o transporte do interior do\npaís para o litoral, o que poderia ser solucionado com a construção de\numa estrada de ferro no vale do rio Doce. Mostrou-se, no entanto,\ncontrário à construção dessa estrada pela empresa Itabira lron Ore Co.,\no que constituiria um atentado à economia e à soberania nacional. Quanto\nà instalação de uma usina, considerava que uma pequena indústria\nsiderúrgica a carvão de madeira, localizada no vale do rio Doce,\nsatisfaria as necessidades imediatas do país. No entanto, se o governo\ndesejasse desenvolver os transportes ferroviários, rodoviários, as\nindústrias mecânicas e a construção naval mediante um plano de grandes\nrealizações, seria necessário aparelhar uma grande usina que produzisse\ncerca de trezentas mil toneladas de aço por ano, sob a forma de\nlaminados, peças forjadas e aços finos. Essa siderúrgica deveria ser\ninstalada na costa, no Rio de Janeiro, de modo a facilitar a importação\nde hulha do Sul do Brasil e do exterior. As aquisições no estrangeiro\npara a montagem inicial orçariam em torno de um milhão e setecentas\nlibras ou 150 mil contos de réis, a serem despendidos em quatro anos. Em\nfuncionamento, a usina gastaria anualmente no estrangeiro 410 mil\nlibras-ouro. Para sua construção, Macedo Soares sugeriu a aliança do\ncapital nacional ao estrangeiro.\n\nO presidente da República encaminhou o problema siderúrgico ao Conselho\nFederal de Comércio Exterior e enviou Macedo Soares à Europa a fim de\nque avaliasse a possibilidade de o minério de ferro brasileiro ser\ncolocado nos mercados europeus. Também deveria informar-se acerca dos\nnovos processos de obtenção de aço e da viabilidade de financiamentos\npara a usina siderúrgica. De sua missão na Europa Macedo Soares\ndepreendeu que os países que visitara não tinham interesse em aplicar\ncapitais no Brasil, uma vez que se encontravam próximos de uma nova\nguerra, que de fato viria a eclodir em setembro de 1939. Constatou por\noutro lado que apenas os mercados ingleses aceitariam o minério de ferro\nbrasileiro. Ao terminar sua viagem, recebeu ordens de seguir para os\nEstados Unidos e ali continuar as conversações com a empresa United\nStates Steel, iniciadas por Osvaldo Aranha, então ministro das Relações\nExteriores.\n\nEm junho de 1939 a United States Steel enviou seus técnicos ao Brasil\npara estudar a viabilidade da construção de uma grande usina a coque,\ncom capital misto. Constituiu-se então uma comissão conjunta de técnicos\nbrasileiros e norte-americanos, composta por Macedo Soares, Plínio\nCantanhede, João Batista da Costa Pinto, Joaquim Arrojado Lisboa e mais\nsete técnicos norte-americanos. Os trabalhos se iniciaram ainda em junho\nde 1939 e as conclusões expressas no relatório conjunto de 20 de outubro\ndo mesmo ano rejeitavam o aproveitamento do projeto da Itabira Iron Ore\nCo. e indicavam que a usina siderúrgica a ser construída deveria ter\ncapacidade inicial de 285 mil toneladas anuais. Projetada para utilizar\ncoque, produziria trilhos e acessórios, perfis, ferros redondos e\nchatos, chapas, folhas de flandres e ferro gusa. O relatório recomendava\nainda que a usina se localizasse perto do Rio de Janeiro, nas\nproximidades de Santa Cruz, e que fosse servida pela Estrada de Ferro\nCentral do Brasil. Quanto ao carvão a ser utilizado, a comissão concluiu\nque o de Santa Catarina era coqueificável, podendo ser misturado com o\ncarvão importado até o momento em que fosse possível utilizar somente o\ncarvão nacional.\n\nEm seguida o governo criou a Comissão Preparatória do Plano Siderúrgico\ne, para integrá-la, o ministro da Viação e Obras Públicas, João de\nMendonça Lima, designou os técnicos brasileiros da comissão conjunta.\nCoube a Macedo Soares presidir a nova comissão, cuja preocupação\nprincipal era conciliar os interesses dos grupos internos envolvidos na\nquestão metalúrgica com a criação da usina pela United States Steel.\nEntretanto, apesar de a direção da United States Steel ter aprovado o\nplano técnico da usina, seu departamento financeiro não recomendou o\nempreendimento. A 16 de janeiro de 1940 o presidente Vargas foi\ninformado do desinteresse da empresa norte-americana em participar da\nconstrução da usina no Brasil, por não desejar estender sua atividade\npara fora do país.\n\nApós essa recusa, Vargas decidiu dar um rumo definitivo ao problema: a\ngrande usina deveria ser construída por uma empresa nacional com a ajuda\nde capitais estrangeiros, mas sob a forma de empréstimos. Convocou\nMacedo Soares e o industrial Guilherme Guinle a traçarem os primeiros\nesboços para a construção da usina siderúrgica brasileira. Em fevereiro\nde 1940 o presidente recebeu o resultado desse trabalho, do qual\nconstavam o orçamento, as normas gerais para a organização da usina e as\nrecomendações para a elaboração dos estatutos da nova empresa. Em 4 de\nmarço Vargas assinou o decreto-lei que criava a Comissão Executiva do\nPlano Siderúrgico Nacional com a incumbência de “realizar os estudos\nfinais para a construção de uma usina siderúrgica e de organizar uma\ncompanhia nacional para a construção e exploração da usina”. No dia\nseguinte Macedo Soares foi promovido a tenente-coronel e, no dia 7 do\nmesmo mês, foi designado pelo presidente para integrar a subcomissão de\nsiderurgia da Comissão Executiva do Plano Siderúrgico Nacional. Em seus\ntrabalhos, a nova comissão admitiu que a produção média da usina seria\nde trezentas mil toneladas anuais de perfis médios e pesados, trilhos,\nbillets (barras), chapas e folhas de flandres. Com relação ao carvão,\nficou igualmente estabelecido que a usina funcionaria num primeiro\nmomento com coque obtido da mistura do carvão importado com o de Santa\nCatarina. Quanto à sua localização, depois de estudadas várias regiões,\na comissão deu preferência ao trecho compreendido entre Barra do Piraí e\nBarra Mansa, no vale do Paraíba, no estado do Rio de Janeiro, sendo\nescolhida a localidade de Volta Redonda, situada a nove quilômetros de\nBarra Mansa.\n\nParalelamente o presidente Vargas iniciou entendimentos junto ao governo\nnorte-americano e ao Export Import Bank (Eximbank) para obter\nempréstimos financeiros, mas as negociações foram retardadas, pois os\nEstados Unidos esperavam que o Brasil se definisse ao lado dos países\naliados no conflito mundial que se desenrolava. Macedo Soares foi então\nenviado aos Estados Unidos, juntamente com Guilherme Guinle e Ari\nTorres, para negociar diretamente com o Eximbank, no que foram\nbem-sucedidos, obtendo um empréstimo de vinte milhões de dólares.\n\nA 9 de abril de 1941 foi criada a Companhia Siderúrgica Nacional (CSN)\nem Volta Redonda. Nomeado diretor-técnico da nova companhia na\nassembleia de sua constituição, Macedo Soares acompanhou todas as etapas\nde construção da usina até junho de 1946, quando esta entraria em\nfuncionamento. Ao mesmo tempo ocupou diversos cargos ligados ao setor\nmetalúrgico. Em 1942 tornou-se assistente (encarregado do setor de\ncarvão) do coordenador da Mobilização Econômica, órgão criado nesse\nmesmo ano com o objetivo de assegurar, por parte do Estado, a defesa da\neconomia brasileira diante dos problemas causados pela Segunda Guerra\nMundial. Também em 1942 passou a integrar o conselho consultivo da\nCompanhia Siderúrgica Belgo-Mineira e tornou-se presidente do Sindicato\nNacional da Indústria de Extração de Carvão. Em dezembro de 1944 foi\npromovido a coronel.\n\nNo Ministério da Viação e Obras Públicas\n\nNo início do ano de 1945, quando se intensificava a luta pela\nredemocratização, Vargas tomou as primeiras medidas para que o país\nvoltasse à normalidade. Em 28 de fevereiro promulgou o Ato Adicional,\nque, por meio de emenda à Constituição de 1937, determinava a realização\nde eleições para a presidência da República, para o Congresso Federal, e\npara governos e assembleias legislativas estaduais. Ainda nesse mesmo\nmês foi lançada a candidatura do brigadeiro Eduardo Gomes à presidência\nda República pelos opositores do regime estado-novista, e em março foi\nlançado o nome do ministro da Guerra, general Eurico Gaspar Dutra,\napoiado pelas forças favoráveis a Vargas. Nessa conjuntura, Macedo\nSoares foi nomeado membro da Comissão de Planejamento Econômico do\nConselho de Segurança Nacional.\n\nEm 29 de outubro de 1945 Vargas foi deposto por um golpe militar\nliderado pelo general Pedro Aurélio de Góis Monteiro, que substituía\nDutra no Ministério da Guerra. Realizadas as eleições em dezembro de\n1945, a vitória coube ao general Dutra, que nomeou Macedo Soares\nministro da Viação e Obras Públicas.\n\nSucedendo a Maurício Joppert, Macedo Soares assumiu o cargo no início do\ngoverno Dutra, em janeiro de 1946, e procurou estabelecer um programa\ngeral de atividades a serem cumpridas pelo órgão. Nomeou uma comissão\npara rever o Plano Geral de Viação e iniciou as negociações para a\nencampação da estrada de ferro São Paulo Railway, depois denominada\nEstrada de Ferro Santos-Jundiaí. Em sua gestão foram feitos estudos para\na adaptação da Fábrica Nacional de Motores (FNM), criada durante a\nguerra para produzir e reparar aviões, a fim de que fosse revertida em\numa indústria de paz. Em colaboração com o Ministério do Trabalho,\ndedicou ainda especial atenção ao funcionalismo, procurando reajustar os\nvencimentos dos portuários e ferroviários e reestruturar os níveis dos\nfuncionários de seu ministério.\n\nNo governo do estado do Rio\n\nEm outubro de 1946 Macedo Soares passou a pasta para Clóvis Pestana, a\nfim de lançar sua candidatura ao governo do estado do Rio de Janeiro na\nlegenda da coligação formada pelo Partido Social Democrático (PSD), o\nPartido Trabalhista Brasileiro (PTB) e a União Democrática Nacional\n(UDN). Foi eleito em janeiro de 1947 com 250.350 votos para um\neleitorado votante de 280.384, vencendo os candidatos Artur Lontra\nCosta, lançado pela Esquerda Democrática, e João de Macedo Pereira,\ninscrito na legenda do Partido Social Progressista (PSP). Tomou posse no\nmês seguinte, sucedendo ao interventor Álvaro Rocha Pereira da Silva.\n\nJá no início de sua administração enfrentou a falta de recursos\nfinanceiros e o déficit orçamentário, passando a promover rigorosa\ncompressão nas despesas e a aperfeiçoar o sistema arrecadador de taxas e\nimpostos. Durante seu governo ampliou a rede escolar primária,\nduplicando o número de salas de aula, e ainda em 1947, como forma de\nagilizar o problema da educação, desdobrou a Secretaria de Educação e\nSaúde, criando a de Educação e Cultura. Modernizou e ampliou a rede\nhospitalar do estado, deu ênfase à construção e à conservação de\nrodovias, abrindo ao tráfego 63km de estradas, e fez a dragagem do porto\nde Niterói. Construiu ainda duas usinas termelétricas – a de Japuíba, no\nmunicípio de Cachoeiras de Macacu, e outra em Angra dos Reis – e ampliou\no sistema de abastecimento de água do estado. Outro problema que recebeu\natenção de seu governo foi o da utilização das terras fluminenses,\natravés do estabelecimento de diretrizes para o incremento da produção\nagropecuária.\n\nDe volta à questão siderúrgica\n\nO término de seu mandato, em 31 de janeiro de 1951, coincidiu com a\nvolta de Getúlio Vargas à presidência da República, para a qual havia\nsido eleito em outubro do ano anterior. Substituído no governo\nfluminense por Ernâni Amaral Peixoto, também eleito em outubro de 1950,\nfoi designado em seguida para o quadro permanente da Escola Superior de\nGuerra (ESG). Ao mesmo tempo recebeu a incumbência de estudar a\nreorganização da Companhia Aços Especiais Itabira (Acesita).\n\nEm abril de 1952 foi promovido a general de brigada, passando em seguida\npara a reserva. Nesse mesmo ano, o grupo alemão Mannesmann iniciou\nnegociações para construir uma usina siderúrgica no Brasil. O assunto\nfoi levado pelo engenheiro de minas Glycon de Paiva, então integrante da\nAssessoria Econômica da Presidência da República, ao Conselho Nacional\nde Minas e Metalurgia, órgão do Ministério da Viação e Obras Públicas. A\nempresa, que pretendia fabricar principalmente tubos sem costura,\ndeveria ser organizada com capitais alemães e brasileiros. Como membro\ndo Conselho Nacional de Minas e Metalurgia, Macedo Soares foi favorável\nao projeto e recomendou que a instalação da usina fosse em Belo\nHorizonte, onde havia abundância de energia, o que efetivamente ocorreu.\n\nDevido a seu interesse pelos problemas metalúrgicos, em 1953 foi\nconvidado a integrar o corpo docente da Escola Politécnica da Pontifícia\nUniversidade Católica do Rio de Janeiro, como professor de metalurgia.\nNo ano seguinte, enquanto presidente executivo da Comissão de\nDesenvolvimento Industrial, foi convidado pela Organização das Nações\nUnidas (ONU) a dar seu parecer sobre a construção de uma usina\nsiderúrgica na Venezuela.\n\nAinda em 1954 uma grave crise política levou o presidente Vargas ao\nsuicídio em 24 de agosto. Assumiu seu lugar o vice-presidente João Café\nFilho. Macedo Soares, então presidente da Acesita, foi convidado pelo\ngeneral Juarez Távora, chefe do Gabinete Militar do novo governo, a\nocupar a presidência da CSN. Assumindo o cargo, empenhou-se em obter\nnovos financiamentos nos Estados Unidos para ampliar a usina, pois o\nrápido desenvolvimento industrial brasileiro exigia uma produção de aço\ncada vez maior. Em 1955 foi aos Estados Unidos com o objetivo de obter\num crédito da ordem de 35 milhões de dólares, que só foi concedido em\njunho do ano seguinte e permitiu então um considerável aumento na\nprodução de aço e laminados. Em 1959 foi eleito para a presidência do\nconselho consultivo da Companhia Siderúrgica Paulista (Cosipa), a qual\nviria a dirigir, e foi escolhido primeiro presidente do Instituto\nLatino-Americano do Ferro e do Aço.\n\nAo deixar a presidência da CSN em 1960, passou a lecionar na Escola\nPolitécnica de São Paulo. Em outubro desse mesmo ano tornou-se\nvice-presidente da empresa Mercedes-Benz do Brasil e, a partir de 1961,\nacumulou essas funções com a de membro do conselho consultivo da\nComissão do Plano do Carvão, que deixaria em 1967. Em 1963 foi eleito\nvice-presidente da primeira diretoria do Instituto Brasileiro de\nSiderurgia, sociedade civil então criada com o objetivo de participar do\nplanejamento e ampliar os conhecimentos na área siderúrgica.\n\nApoiou o movimento político-militar de março de 1964 que depôs o\npresidente João Goulart (1961-1964) e levou ao poder o marechal Humberto\nde Alencar Castelo Branco (1964-1967). Em dezembro foi eleito\nvice-presidente da Federação das Indústrias do Estado de São Paulo\n(FIESP) e presidente da Confederação Nacional da Indústria (CNI), cargo\npara o qual seria reeleito em 1966. Ainda em 1964 tornou-se presidente\ndo Instituto Brasileiro de Siderurgia.\n\nO governo Castelo Branco, na tentativa de resolver os problemas que\nafetavam o parque siderúrgico brasileiro, entregou em 1966 o estudo do\nassunto à firma Booz, Allen & Hamilton, por acordo do Banco Mundial com\no Banco Nacional de Desenvolvimento Econômico (BNDE). Macedo Soares foi\nencarregado pelo presidente da República de acompanhar os trabalhos\ndesenvolvidos pela empresa norte-americana, que tinha a orientação do\nministro do Planejamento Roberto Campos. As recomendações apresentadas\npor essa equipe seriam implementadas pelo sucessor de Castelo Branco, o\ngeneral Artur da Costa e Silva, que assumiu a presidência da República\nem março de 1967.\n\nNo Ministério da Indústria e Comércio\n\nDurante a composição do novo ministério, Macedo Soares foi convidado a\nocupar a pasta da Indústria e Comércio, que assumiu ainda em março de\n1967, sucedendo a Paulo Egídio Martins. Em sua gestão deu ênfase ao\nencaminhamento do problema siderúrgico, criando o Grupo Consultivo da\nIndústria Siderúrgica, encarregado de sugerir um programa para a\nexpansão dessa indústria. Presidido por Macedo Soares, o grupo reunia\nrepresentantes do Ministério do Planejamento e os presidentes do BNDE,\ndo Banco do Brasil, da CSN, da Companhia Vale do Rio Doce e do Plano do\nCarvão Nacional. De seus trabalhos resultou um plano siderúrgico que\nvisava a modernizar e aumentar a produção de laminados das usinas\nestatais, de acordo com o aumento do mercado brasileiro. Para a\nimplantação desse plano e para obedecer aos princípios que norteavam a\nadministração de grandes usinas, toda a política siderúrgica foi\nenfeixada no Conselho Consultivo da Siderurgia (Consider), criado em\nmarço de 1968 e presidido pelo ministro da Indústria e Comércio. O Plano\nSiderúrgico Nacional recomendou também a organização de uma *holding*\ndas empresas governamentais, que seria denominada Brassider, com a\nfunção de fazer executar, como órgão de cúpula, as decisões do Consider\ne de obter e distribuir os financiamentos destinados à expansão e à\ncriação de usinas. Essa *holding* só seria criada em 1973, com a\ndenominação de Siderbrás.\n\nNo exercício de seu cargo, procurou ainda incentivar a indústria do café\nsolúvel, aprovando normas e dando prioridade de financiamento aos\nprojetos localizados em zonas cafeeiras. Em maio de 1968 acertou com o\npresidente Costa e Silva os termos da venda da FNM à empresa italiana\nAlfa Romeo. Essa decisão provocou muitas críticas e foi considerada um\nindicador de desnacionalização da indústria brasileira, acusação que\nvinha sendo dirigida aos governos oriundos do movimento de 1964. Ainda\nem maio, Macedo Soares foi convidado a prestar depoimento na Comissão\nParlamentar de Inquérito (CPI) que se dedicava a estudar o problema da\ndesnacionalização das empresas. Nessa ocasião declarou que não havia\nqualquer indício que comprovasse a desnacionalização global, embora\nreconhecesse que havia problemas setoriais. Afirmou que existiam\ndificuldades de crédito devido à inflação e que o primordial não era\nimpedir a entrada de capitais estrangeiros, mas sim intensificar as\nsoluções de política econômica interna. Declarou ainda que, apesar de o\nmunicípio de Duque de Caxias (RJ), onde se situava a fábrica, ser área\nde segurança nacional, a venda da FNM a grupos estrangeiros não feria o\npreceito constitucional de garantir a predominância de empresas estatais\nnessas áreas. Voltou a depor nessa CPI em agosto de 1968, quando afirmou\nque as fábricas de veículos automotores não podiam se manter sem a\nassociação com capitais estrangeiros, justificando assim a venda da FNM.\n\nPara Macedo Soares, o desenvolvimento brasileiro e a sobrevivência da\nindústria nacional dependiam da incorporação ao mercado de produtos\nindustriais de cerca de 90% da população que ainda estavam\nmarginalizados e que não produziam, não vendiam e nem compravam.\nConsiderava também indispensável que os empresários desenvolvessem um\nprocesso contínuo de expansão para fortalecer sua capacidade de\nmodernização.\n\nNa qualidade de ministro de Estado, foi um dos signatários do Ato\nInstitucional n^o^ 5, editado em 13 de dezembro de 1968, que inaugurou\num ciclo de grande cerceamento das liberdades públicas e da atividade\npolítica, coroando um período de aguçamento de conflitos entre diversos\ngrupos da sociedade e o regime instituído em 1964.\n\nCom o objetivo de estimular a iniciativa privada, em agosto de 1969\nassinou um decreto consolidando a legislação de incentivos fiscais para\na importação de máquinas e equipamentos. O decreto previa um crescimento\ndo produto industrial na base de 7% a 8% ao ano, substituía a antiga\nComissão de Desenvolvimento Industrial (CDI) por um conselho e\nreestruturava toda forma de atuação dos grupos executivos que promoviam\nprojetos industriais. Com esse decreto o governo objetivava acelerar a\ntaxa de crescimento do emprego da mão de obra, defender a tecnologia\nnacional e absorver tecnologia do exterior, e implantar novos setores de\nprodução e uma tecnologia mais avançada.\n\nEm 26 de agosto de 1969 o presidente Costa e Silva foi acometido de uma\ntrombose cerebral. Os ministros militares que assumiram a presidência no\ndia 31 indicaram como sucessor o general Emílio Garrastazu Médici, que\ntomou posse em 30 de outubro. Nesse mesmo dia Macedo Soares deixou o\nMinistério da Indústria e Comércio, sendo substituído por Fábio Yassuda.\nAo deixar o cargo, passou a se dedicar à empresa privada. De outubro de\n1969 a dezembro de 1970 dirigiu a Mercedes-Benz do Brasil e em 1972\nassumiu a presidência dos conselhos consultivos da Companhia Siderúrgica\nMannesmann e da empresa M. Dedini Metalurgia. Nesse último ano integrou\nainda o conselho consultivo da III Conferência Nacional das Classes\nProdutoras, realizada no Rio de Janeiro. Foi também diretor-presidente\nda Parmet – Participações Metalúrgicas, presidente da Rheem Metalurgia,\nmembro dos conselhos consultivos da APEC Editora e da Standard Electric\ne responsável pela reorganização da fábrica de alumínio Rochedo. Na\ndécada de 1980, dirigiu a Polimetal.\n\nIntegrou o Conselho Consultivo do Planejamento (Consplan), o Clube de\nEngenharia e o conselho de administração da Escola de Administração de\nEmpresas da Fundação Getulio Vargas (FGV). Membro titular da Academia\nBrasileira de Ciências e membro honorário da Academia Fluminense de\nLetras e da Associação Brasileira de Metais de São Paulo, filiou-se\nainda à American Association of Mining, Metallurgical and Petroleum\nEngineers de Nova Iorque, à Academia Brasileira de Finanças e à\nAssociation of Iron and Steel Engineers de Pittsburgh, nos Estados\nUnidos. Obteve os títulos de doutor *honoris causa* pela Escola de Minas\nde Ouro Preto e pela Escola de Engenharia da Universidade de São Paulo e\nfoi sócio-honorário do Instituto Histórico e Geográfico Brasileiro.\n\nFaleceu no Rio de Janeiro no dia 9 de agosto de 1989.\n\nFoi casado em primeiras núpcias com Maria José Muniz de Macedo Soares e\nSilva, com quem teve uma filha. Após a morte de sua esposa em 1937,\ncasou-se com Alcina Fonseca de Macedo Soares e Silva, com quem teve três\nfilhos.\n\nPublicou, além de conferências e de diversos artigos para jornais e\nrevistas sobre metalurgia, economia, engenharia e problemas brasileiros,\n*La viscosité de l’aluminium des alliages légers et du nickel* (em\ncolaboração com Jean Gournot, 1927), *Memória para a organização de uma\nusina siderúrgica no Brasil* (1940), *Falando aos fluminenses* (1948),\n*Discurso aos fluminenses* (1960), *O momento e a* *missão da indústria*\n(1964),*A engenharia e o* *desenvolvimento industrial* (1965), *O ferro\nna* *história e na economia do Brasil* (1972), *As* *instituições de\nindústria e comércio no Brasil* (1972) e *Um construtor do nosso tempo:\ndepoimento ao Cpdoc* (1998).\n\nO arquivo de Edmundo de Macedo Soares encontra-se depositado no Centro\nde Pesquisa e Documentação de História Contemporânea do Brasil (Cpdoc)\nda FGV.\n\nAlzira Alves de Abreu\n\nFONTES: ABREU, A. *Siderurgia*; ARQ. GETÚLIO VARGAS: ARQ. NAC.\n*Relação*; CARONE, E. *Terceira*; COMIS. ESTUDO CAPACIDADE IND. MIL.\nMETALURGIA NAC. *Relatório*; CONF. NAC. COMÉRCIO. *20*; CONF. NAC. IND.;\nCONFERÊNCIA NAC. CLASSES PRODUTORAS. *Carta*; CONSULT. MAGALHÃES, B.;\nCORRESP. CONF. NAC. COMÉRCIO; CORRESP. GOV. EST. RJ; CORRESP. MIN. IND.\nCOMÉRCIO; COUTINHO, A. *Brasil*; *Encic. Mirador*; *Estado de S. Paulo*\n(11/8/1989); FICHÁRIO PESQ. M. AMORIM; *Folha de S.Paulo* (28/8/1977);\n*Globo* (11/8/1989); *Grande encic. Delta*;HIRSCHOWICZ, E.\n*Contemporâneos*; *Jornal do* *Brasil* (7/11/1975, 7/7/1976, 13/3/1977,\n11/8/1989); LACOMBE, L. *Chefes*; LEITE, A. *Páginas*; MAGALHÃES, I.\n*Segundo*; MIN. VIAÇÃO. *Dados*; *Opinião* (13/12/1974); RIBEIRO FILHO,\nJ. *Dic.*; *Siderurgia*, Rio (9/1971); SILVA, H. *1922*; SOARES, E.\n*Ferro*; SOARES, E. *Instituições*; SOARES, E. *Introdução*; *Súmulas*;\n*Veja* (16/8/1989); *Who’s who in Brazil*.\n","ref":"FONTES: ABREU, A. *Siderurgia*; ARQ. GETÚLIO VARGAS: ARQ. NAC.\n*Relação*; CARONE, E. *Terceira*; COMIS. ESTUDO CAPACIDADE IND. MIL.\nMETALURGIA NAC. *Relatório*; CONF. NAC. COMÉRCIO. *20*; CONF. NAC. IND.;\nCONFERÊNCIA NAC. CLASSES PRODUTORAS. *Carta*; CONSULT. MAGALHÃES, B.;\nCORRESP. CONF. NAC. COMÉRCIO; CORRESP. GOV. EST. RJ; CORRESP. MIN. IND.\nCOMÉRCIO; COUTINHO, A. *Brasil*; *Encic. Mirador*; *Estado de S. Paulo*\n(11/8/1989); FICHÁRIO PESQ. M. AMORIM; *Folha de S.Paulo* (28/8/1977);\n*Globo* (11/8/1989); *Grande encic. Delta*;HIRSCHOWICZ, E.\n*Contemporâneos*; *Jornal do* *Brasil* (7/11/1975, 7/7/1976, 13/3/1977,\n11/8/1989); LACOMBE, L. *Chefes*; LEITE, A. *Páginas*; MAGALHÃES, I.\n*Segundo*; MIN. VIAÇÃO. *Dados*; *Opinião* (13/12/1974); RIBEIRO FILHO,\nJ. *Dic.*; *Siderurgia*, Rio (9/1971); SILVA, H. *1922*; SOARES, E.\n*Ferro*; SOARES, E. *Instituições*; SOARES, E. *Introdução*; *Súmulas*;\n*Veja* (16/8/1989); *Who’s who in Brazil*.\n","dic":"DPRRJ"}
