{"title":"SOARES, Joaquim Sousa","cargoss":["Constituinte"],"cargos_esp":["est"],"datas_ini":[1892],"datas_fim":[1892],"estados":["RJ"],"autor":[0],"content":"**SOARES, Joaquim Sousa**\n\n\\* const. est. RJ 1892.\n\n*Joaquim Sousa Soares* foi médico durante o Império.\n\nEm 31 de janeiro de 1892 foi eleito para a nova Assembleia Estadual\nConstituinte formada após a renúncia do então presidente do estado do\nRio de Janeiro Francisco Portela (1889-1891). Com a saída do então chefe\ndo poder estadual, a Assembleia Legislativa do Estado do Rio de Janeiro\n(ALERJ) foi dissolvida, assim como a primeira Constituição republicana\nfluminense que havia sido promulgada por Portela e seus partidários\nquando da formação da primeira Constituinte estadual em 1891.\n\nA nova assembleia, composta por partidários do Partido Republicano\nFluminense (PRF) liderados por José Tomás da Porciúncula, procurou\nreorganizar os estatutos jurídicos do estado que tinham sido\nconstituídos para favorecer Francisco Portela e representou o início do\ndomínio do PRF na política estadual.\n\nApós a promulgação da nova Constituição, em 9 de abril de 1892, foram\nconvocadas novas eleições para o Legislativo estadual para o dia 24 do\nmesmo mês, mas Joaquim Sousa Soares não fez parte da nova composição da\nALERJ, formada exclusivamente por membros do PRF.\n\n*Samuel Silva Rodrigues de Oliveira*\n\nFONTES: ASSEMB. LEGISL. RJ. *Anais* (14/11/1892-12/1/1893,\n1/3-9/4/1892); FERREIRA, M. *República*.\n","ref":"FONTES: ASSEMB. LEGISL. RJ. *Anais* (14/11/1892-12/1/1893,\n1/3-9/4/1892); FERREIRA, M. *República*.\n","dic":"DPRRJ"}
