{"title":"SOARES, Jodenir","cargoss":["Deputado Estadual"],"cargos_esp":[0],"datas_ini":[2003],"datas_fim":[2011],"estados":["RJ"],"autor":[0],"content":"**SOARES, Jodenir**\n\n\\* dep. est. RJ 2003-2011.\n\n*Jodenir Soares dos Santos* nasceu no Rio de Janeiro, então Distrito\nFederal, no dia 18 de setembro de 1958.\n\nNo início dos anos 1980 começou sua carreira na Igreja Universal.\n\nNas eleições de 2002 candidatou-se ao cargo de deputado estadual na\nlegenda do Partido Trabalhista do Brasil (PTdoB) e saiu do pleito eleito\ncom 42.202 votos. No ano seguinte tomou posse na Assembleia Legislativa\ndo Estado do Rio de Janeiro (ALERJ) e foi nomeado membro da Comissão\nEspecial para acompanhar a execução das obras de saneamento da baixada\nde Jacarepaguá, Barra da Tijuca e Recreio dos Bandeirantes. Nesse mesmo\nano elegeu-se vice-presidente da Comissão de combate às discriminações e\npreconceitos de raça, cor, etnia, religião, e procedência nacional.\n\nDurante o mandato na ALERJ destacou-se em sua atuação na área social;\npor exemplo, no seu gabinete era possível providenciar a papelada para\nrealizar um casamento e ainda o empréstimo do vestido de noiva.\nPossibilitou também os recursos necessários para o trabalho como\nsegurança. Além de ter inovado com a nomeação de uma dentista e uma\nginecologista para o seu gabinete, como intuito de dar assistência à\npopulação.\n\nEm 2005 criou a Frente Parlamentar Brasil-China no Estado do Rio de\nJaneiro através da Resolução n^o^ 862, juntamente com outros\nparlamentares, com o intuito de estreitar as relações culturais e\neconômicas e fortalecer os laços de amizade entre a República Popular da\nChina e a República Federativa do Brasil. Ainda em 2005 foi criada\ntambém a Frente Parlamentar Brasil-Israel por Ely Patrício do Partido\nSocial Liberal (PSL), visando também estimular a cooperação política,\neconômica e cultural entre os países.\n\nNo pleito de 2006 reelegeu-se deputado estadual com 36.645 votos pelo\nPTdoB. No ano seguinte tomou posse e foi eleito membro da Comissão\nEspecial para acompanhar o cumprimento das leis – conhecida como\n“Comissão do cumpra-se”.\n\nEntre 2007 e 2010 presidiu a Frente Parlamentar Brasil-China e a Frente\nParlamentar Brasil-Israel. Nesse período incentivou a realização do\nFórum Empresarial Brasil-China, recebeu a delegação da China na ALERJ,\nrealizou a exposição sobre o holocausto, impulsionou debates sobre o\ntema, entre outras medidas. Em janeiro de 2009 incluiu o Centro Cultural\nJerusalém, localizado no bairro Del Castilho, no roteiro turístico do\nestado fluminense, através da Lei n^o^ 5.375/2009.\n\nNo ano de 2008 foi aprovado o projeto de Lei n^o^ 3.373/2006, que criou\no Conselho Estadual de Economia Solidária do Estado do Rio de Janeiro\n(CEES/ERJ) – projeto de sua autoria junto com os deputados estaduais\nPaulo Ramos (PDT), Paulo Melo (PMDB), Geraldo Moreira (PMN), Coronel\nJairo (PSC), André do PV, Luiz Paulo (PSDB), entre outros. O CEES tinha\nas seguintes atribuições: criação de um banco de dados que concentre o\ncadastro dos empreendimentos no estado; definição de critérios para\nseleção de programas e projetos a serem financiados com recursos\npúblicos; e acompanhamento e avaliação da gestão financeira, ganhos\nsociais e desempenho dos programas financiados por recursos públicos,\nentre outras.\n\nDurante o período de 2009 a 2010 foi membro das seguintes comissões:\nSaúde e Indicações Legislativas; atuou como vice-presidente da Comissão\nde Saneamento Ambiental e da Comissão de Prevenção ao uso de drogas e\ndependentes químicos em geral; e foi ainda suplente da Comissão de\nCiência e Tecnologia, da Comissão de Defesa dos Direitos das Mulheres, e\ntambém do Conselho de Ética e Decoro Parlamentar. Ainda entre 2009 e\n2010 presidiu a bancada do PTdoB na ALERJ.\n\nNas eleições de 2010 chegou a inscrever sua candidatura pelo PTdoB no\nTribunal Superior Eleitoral (TSE), mas renunciou antes do dia do pleito.\n\nFoi também bispo da Igreja Universal e fundador de 96 igrejas.\n\n*Mirna Aragão de Medeiros*\n\nFONTES: ASSEMB. LEGISL. RJ. *Notícias*; *Glob*o (31/5/2008, 1/12/2009,\n31/8/2010); *Jornal da ALERJ* (11/2004); TRIB. SUP. ELEIT. *Eleições*\n(2002, 2006, 2010); *Veja* (8/11/2006).\n","ref":"FONTES: ASSEMB. LEGISL. RJ. *Notícias*; *Glob*o (31/5/2008, 1/12/2009,\n31/8/2010); *Jornal da ALERJ* (11/2004); TRIB. SUP. ELEIT. *Eleições*\n(2002, 2006, 2010); *Veja* (8/11/2006).\n","dic":"DPRRJ"}
