{"title":"SODRÉ, Diógenes Abreu","cargoss":["Deputado Estadual"],"cargos_esp":[0],"datas_ini":[1923],"datas_fim":[1930],"estados":["RJ"],"autor":["Raimundo Helio Lopes"],"content":"**SODRÉ, Diógenes Abreu**\n\n\\* dep. est. RJ 1923-1930.\n\n*Diógenes Abreu Sodré* foi eleito deputado estadual pelo quinto distrito\neleitoral, com sede em Resende (RJ), em 28 de outubro de 1923, no pleito\nrealizado durante a intervenção federal no estado do Rio de Janeiro.\nDurante a intervenção federal, decretada em 10 de janeiro de 1923 pelo\nentão presidente da República Artur Bernardes (1922-1926), o estado foi\ngovernado pelo interventor Aureliano Leal, que fechou a Assembleia\nLegislativa do Estado do Rio de Janeiro (ALERJ) e anulou as eleições de\n9 de julho de 1922 realizadas para a sucessão do então presidente\nestadual Raul Veiga (1918-1922), quando os candidatos Raul Fernandes e\nFeliciano Sodré declararam-se eleitos, ocasionando a dualidade da ALERJ.\n\nFoi eleito na legenda do Partido Republicano Fluminense (PRF). Com o\ninício dos trabalhos legislativos, em 27 de novembro, participou do\nreconhecimento pela ALERJ da eleição de Feliciano Sodré para presidente\ndo Rio de Janeiro (1923-1927), encerrando o período de intervenção\nfederal do estado. Foi eleito ainda nesse ano membro da Comissão de\nViação e Obras Públicas. No ano seguinte foi reeleito para a mesma\ncomissão e conseguiu eleger-se membro da Comissão de Redação de Leis,\ncontudo, renunciou a esse cargo no mesmo ano em favor do ingresso de\nnovos colegas parlamentares nessas atividades. Em 1925 foi, mais uma\nvez, membro da Comissão de Viação e Obras Públicas e membro da Comissão\nEspecial para apurar e verificar os poderes do vice-presidente eleito\nJoão Maria da Rocha Werneck para complementar o quatriênio de 1923 a\n1927, em substituição a Paulino José Soares de Sousa. Em 1926, último\nano deste mandato, continuou membro daquela comissão.\n\nEm abril de 1927 foi reeleito deputado estadual na chapa oficial do PRF\ne foi sucessivamente reeleito, até o janeiro de 1930, membro da Comissão\nde Viação e Obras Públicas. Em agosto foi reeleito deputado estadual\nnovamente pelo PRF e logo ingressou na Comissão de Agricultura. Em\nnovembro de 1930 teve seu mandato interrompido com a vitória da\nRevolução de 1930 que levou Getúlio Vargas ao poder e fechou todos os\nórgãos legislativos do país.\n\n*Raimundo Helio Lopes*\n\nFONTES: ASSEMB. LEGISL. RJ. *Anais* (1923-1930); *Estado* (19/8/1930);\nFERREIRA, M. *República*; *Mensagem 1930*.\n","ref":"FONTES: ASSEMB. LEGISL. RJ. *Anais* (1923-1930); *Estado* (19/8/1930);\nFERREIRA, M. *República*; *Mensagem 1930*.\n","dic":"DPRRJ"}
