{"title":"SOUSA, Artur Paulo de","cargoss":["Deputado Estadual","Deputado Estadual"],"cargos_esp":[0,0],"datas_ini":[1923,1919],"datas_fim":[1925,1923],"estados":["RJ","RJ"],"autor":["Raimundo Helio Lopes"],"content":"**SOUSA, Artur Paulo de**\n\n\\* dep. est. RJ 1919-1923, 1923-1925.\n\n*Artur Paulo de Sousa* nasceu em São Paulo do Muriaé (MG) no dia 10 de\njaneiro de 1872.\n\nFormou-se em engenharia na Escola Politécnica da cidade do Rio de\nJaneiro, então capital do Império. Não seguiu essa carreira e se formou\nem direito na Faculdade de Direito de São Paulo. Foi promotor no estado\nde Minas Gerais e exerceu a advocacia no estado do Rio de Janeiro.\nIngressou no Exército e foi promovido a coronel de segunda linha. Também\nfoi professor e dono de escola no município de Vassouras (RJ), onde\nresidia.\n\nFoi eleito deputado estadual em janeiro de 1919 na chapa oficial do PRF,\npelo quarto distrito eleitoral, com sede em Vassouras. Em 1919 integrou\na Comissão de Obras Públicas, Saúde Pública e Câmaras Municipais. Em\n1920 passou a integrar a Comissão de Constituição e Justiça. Em maio\ndesse ano, depois da convenção oficial do PRF, o grupo situacionista,\nliderado por Nilo Peçanha, passou a adotar a sigla do Partido\nRepublicano do Rio de Janeiro (PRRJ), partido que abrigara os nilistas\nde 1899 a 1911.\n\nFoi reeleito deputado estadual na legenda do PRRJ em dezembro de 1921.\n\nPor ocasião da sucessão estadual de julho de 1922, apoiou a candidatura\ndo nilista Feliciano Sodré, candidato do PRF – reorganizado a partir da\nmudança da sigla do Partido Republicano Conservador Fluminense (PRCF) –,\ncontra a de Raul Fernandes, candidato do PRRJ. Realizada a eleição,\nambos os candidatos se declararam vencedores, o que ensejou uma cisão na\nAssembleia Legislativa do Estado do Rio de Janeiro (ALERJ), formando-se\nduas assembleias. Já que o reconhecimento do presidente do estado era da\ncompetência da assembleia, a dualidade de assembleias levou à dualidade\nde governos. Seguindo a orientação política do ex-presidente da\nRepública Nilo Peçanha (1909-1910), Raul Fernandes temia que o novo\npresidente, Artur Bernardes, eleito em novembro de 1922 e adversário de\nNilo, decretasse a intervenção federal no estado do Rio. Assim,\napresentou ao Supremo Tribunal Federal (STF) um pedido de *habeas\ncorpus* que assegurasse sua posse. Atendido o pedido, Raul Fernandes foi\ninvestido na presidência do estado, recebendo o cargo de Raul Veiga no\npalácio do Ingá, em Niterói, no dia 31 de dezembro de 1922. Entretanto,\nFeliciano Sodré também foi empossado por sua assembleia no mesmo dia.\nAlegando a duplicidade de poderes no Rio de Janeiro, Artur Bernardes\ndecretou a intervenção federal no estado, em 1923, entregando o\nExecutivo fluminense a Aureliano Leal, que anulou tanto as eleições\nocorridas em 1922 para presidente estadual como as eleições legislativas\nde 1921. Encerrou-se, então, o mandato deArtur Paulo de Sousa.\n\nNas novas eleições legislativas realizadas em 28 de outubro de 1923, foi\nreeleito deputado estadual, agora pelo PRF. Com o início dos trabalhos\nlegislativos, em 27 de novembro, participou do reconhecimento pela ALERJ\nda eleição de Feliciano Sodré para presidente do Rio de Janeiro\n(1923-1927), encerrando o período de intervenção federal do estado. Foi\neleito ainda nesse ano membro da Comissão de Petições, Representações e\nPoderes e no ano seguinte na de Finanças e Força Pública.\n\nNo campo jornalístico colaborou com o *Jornal do Brasil* e *Jornal do\nComércio*. Foi redator do periódico *O* *Município*, em Vassouras (RJ),\ne fundador do *Jornal de Vassouras*, na mesma cidade, e *O\nInconfidente*, em Cantagalo (RJ). Neste último defendeu, ainda no\nImpério, ideias republicanas.\n\nFaleceu em janeiro de 1925.\n\n*Raimundo Helio Lopes*\n\nFONTES: ASSEMB. LEGISL. RJ. *Anais* (1919-1925); *Estado* (17/12/1921);\nFERREIRA, M. *República*; SOARES, E. *História*.\n","ref":"FONTES: ASSEMB. LEGISL. RJ. *Anais* (1919-1925); *Estado* (17/12/1921);\nFERREIRA, M. *República*; SOARES, E. *História*.\n","dic":"DPRRJ"}
