{"title":"SOUSA, Belisário Augusto Soares de","cargoss":["Constituinte","Deputado Estadual","Deputado federal"],"cargos_esp":["est",0,0],"datas_ini":[1892,1892,1894],"datas_fim":[1892,1893,1902],"estados":["RJ","RJ","RJ"],"autor":["Adrianna Setemy"],"content":"**SOUSA, Belisário Augusto Soares de**\n\n\\* const. est. RJ 1892; dep. est. RJ 1892-1893; dep. fed. RJ 1894-1902.\n\n*Belisário Augusto Soares de Sousa* nasceu em Cabo Frio (RJ) no dia 8 de\nmaio de 1858, filho de Francisco Manuel Soares de Sousa e de Luísa das\nNeves Soares de Sousa. Oriundo de tradicional família de políticos, seu\npai foi médico e capitão da Guarda Nacional, e ainda chefe do Partido\nConservador em Cabo Frio, Araruama e Saquarema, municípios da então\nprovíncia do Rio de Janeiro. Seu tio Francisco Belisário Soares de Sousa\npertenceu ao Conselho do Imperador, foi senador, diretor do Banco do\nBrasil de 1873 a 1878 e ministro da Fazenda de 1885 a 1888. Seu irmão\nPedro Luís Soares de Sousa foi deputado no Império.\n\nFez os primeiros estudos no Colégio de Santo Agostinho e no Liceu\nNiteroiense. Aos 15 anos ingressou na Faculdade de Medicina do Rio de\nJaneiro, mas concluiu o curso na Faculdade de Medicina da Bahia. Em\nseguida, dedicou-se ao exercício da medicina em Niterói.\n\nIngressou na política elegendo-se deputado à Assembleia Provincial\nfluminense em 1886 com o apoio dos chefes do Partido Conservador do\nImpério. Com a proclamação da República em 15 de novembro de 1889,\nafastou-se da política, mas por pouco tempo. Logo após a promulgação da\nprimeira Constituição republicana do país em 24 de fevereiro de 1891,\nfoi solicitado por seus antigos correligionários a compor a oposição\nrepublicana ao governo de Francisco Portela, nomeado presidente do\nestado do Rio de Janeiro por decreto de Deodoro da Fonseca, e eleito\nprimeiro presidente constitucional do estado em 11 de maio de 1891. A\npermanência de Portela no governo não seria, contudo, longa. Após a\nrenúncia do marechal Deodoro e a posse do vice-presidente Floriano\nPeixoto no dia 23 de novembro de 1891, Carlos Baltasar da Silveira foi\nconvidado a assumir o governo do estado do Rio de Janeiro. Empossado no\ndia 11 de dezembro de 1891, o novo presidente do estado, após rever os\natos administrativos de seu antecessor, decidiu dissolver o Congresso\nEstadual e convocar eleições para uma nova Constituinte estadual, em 31\nde janeiro de 1892. Belisário Augusto foi eleito deputado constituinte\ne, após a promulgação da nova Carta, passou a integrar a Assembleia\nLegislativa.\n\nEm março de 1894 Belisário Augusto foi eleito deputado federal pelo\nestado do Rio. Assumiu sua cadeira na Câmara dos Deputados, no Rio de\nJaneiro, então Distrito Federal, em maio do mesmo ano, e foi reeleito em\n1897 e 1900, com mandato até dezembro de 1902. Aliado ao senador José\nTomás da Porciúncula, presidente do Partido Republicano Fluminense, fez\noposição ao presidente do estado Alberto Torres (1897-1900), que\nenfrentava grandes dificuldades com as posições defendidas pelo partido.\nO desentendimento provocou a primeira grande cisão partidária no estado,\ne resultou na fundação de um novo partido da situação, o Partido\nRepublicano do Rio de Janeiro (PRRJ).\n\nFaleceu no Rio de Janeiro no dia 5 de julho de 1912.\n\nCasado com Ana Romano Soares de Sousa, era pai de Belisário Augusto\nSoares de Sousa Filho, conhecido como Belisário de Sousa, que foi\njornalista de *O País* e deputado estadual no Rio de Janeiro entre 1916\ne 1921.\n\n*Adrianna Setemy*\n\nFONTES: ABRANCHES, J. *Governos*; CÂM. DEP. *Deputados brasileiros*\n(1826-1976); *Gazeta de Notícias* (24/5/1888); *Noite* (8/3/1918);\n*País* (6-8, 11, 12/7/1912); Projeto de imagem de publicações oficiais\nbrasileiras do Center for Research Libraries e Latin-american Microfilm\nProject. Disponível em: \\<www.crl.edu/content.asp?l1=4&l2=18&l3=33\\>.\nAcesso em: 8/1/2009.\n","ref":"FONTES: ABRANCHES, J. *Governos*; CÂM. DEP. *Deputados brasileiros*\n(1826-1976); *Gazeta de Notícias* (24/5/1888); *Noite* (8/3/1918);\n*País* (6-8, 11, 12/7/1912); Projeto de imagem de publicações oficiais\nbrasileiras do Center for Research Libraries e Latin-american Microfilm\nProject. Disponível em: \\<www.crl.edu/content.asp?l1=4&l2=18&l3=33\\>.\nAcesso em: 8/1/2009.\n","dic":"DPRRJ"}
