{"title":"SOUSA, Bismarck de","cargoss":["Deputado Estadual"],"cargos_esp":[0],"datas_ini":[1967],"datas_fim":[1971],"estados":["RJ"],"autor":["Juliana Gagliardi"],"content":"**SOUSA, Bismarck de**\n\n\\* dep. est. RJ 1967-1971.\n\n*José Bismarck de Sousa* nasceu em Itapipoca (CE) no dia 2 de fevereiro\nde 1926, filho de José Joaquim Jerônimo de Sousa e de Maria Lia Madeira\nde Sousa.\n\nIngressou na carreira militar em 20 de março de 1943, quando sentou\npraça, ainda no Ceará. Em 17 de dezembro de 1948 tornou-se aspirante,\nsendo promovido a segundo-tenente em 25 de junho do ano seguinte e,\nposteriormente, a primeiro-tenente, por antiguidade, em 25 de junho de\n1951. Em 25 de dezembro de 1953 se tornou capitão e, finalmente, em 25\nde agosto de 1961, chegou à patente de major na arma de Artilharia.\nNesse posto foi nomeado pelo Ministério da Guerra instrutor chefe do\ncurso de artilharia do Centro de Preparação de Oficiais da Reserva de\nBelo Horizonte (CPOR-BH), Minas Gerais, para os anos escolares de 1962 e\n1963. Em 1964 foi nomeado comandante geral da Polícia Militar do Rio de\nJaneiro e permaneceu nesse posto até 1966.\n\nEm outubro de 1965 o regime militar, iniciado no ano anterior, editou o\nAto Institucional n^o^ 2, que extinguiu os partidos políticos em vigor\naté então. Em novembro foi expedido o Ato Complementar n^o^ 4, que\ndispôs sobre a reorganização partidária que resultou no bipartidarismo.\nDois partidos foram criados: a Aliança Renovadora Nacional (Arena), de\napoio ao regime iniciado em 1964, e o Movimento Democrático Brasileiro\n(MDB), de oposição. No pleito seguinte, realizado em 15 de novembro de\n1966, Bismarck de Sousa ingressou na política como candidato a deputado\nestadual no Rio de Janeiro pela Aliança Renovadora Nacional (Arena).\nEleito, assumiu o mandato na Assembleia Legislativa do Estado do Rio de\nJaneiro (ALERJ) em 1^o^ de fevereiro de 1967. Nessa legislatura foi\nsegundo vice-presidente da Mesa Diretora entre 1968 e 1969. Durante o\nexercício do mandato integrou as comissões de Orçamento e de Justiça.\n\nCandidatou-se novamente a deputado estadual nas eleições seguintes de\nnovembro de 1970 e de novembro de 1974, ainda na legenda da Arena, mas\nnão se elegeu.\n\nAo deixar a ALERJ, dirigiu a Companhia Mercantil Ingá.\n\nCasou-se com Leda Maria Viana de Sousa, com que teve três filhos. Um\ndeles, José Bismarck Viana de Sousa, foi nomeado conselheiro da Agência\nReguladora de Energia e Saneamento Básico do Estado do Rio de Janeiro\n(Agenersa) em maio de 2011 e tornou-se conselheiro presidente em junho\nseguinte.\n\nBismarck de Sousa faleceu em Niterói (RJ) no dia 19 de janeiro de 1989.\n\n*Juliana Gagliardi*\n\nFONTES: ASSEMB. LEGISL. RJ. *Anais*; CARDIANO, F. *Eleições*; CANTALEJO,\nM. *Município*; *D**iário Oficial da União* (17/11/1961, seção I, parte\nI, p. 10209, 5/7/1951, seção I, p. 9979). Disponível em:\n\\<www.jusbrasil.com.br/diarios/2596034/dou-secao-1-05-07-1951-pg-1/pdfView\\>.\nAcesso em: 20/6/2011; *Diário Oficial da União* (28/12/1953, seção I, p.\n21931). Disponível em:\n\\<www.jusbrasil.com.br/diarios/2904413/dou-secao-1-28-12-1953-pg-3/pdfView\\>.\nAcesso em: 20/6/2011; INF. BIOGR. (21/7/2011); MIN. GUERRA. *Almanaque*\n(1956); MIN. GUERRA. *Almanaque* (1967); POL. MIL. RJ. Disponível em:\n\\<www.pmerj.org/20bpm/\\>. Acesso em: 20/6/2011.\n","ref":"FONTES: ASSEMB. LEGISL. RJ. *Anais*; CARDIANO, F. *Eleições*; CANTALEJO,\nM. *Município*; *D**iário Oficial da União* (17/11/1961, seção I, parte\nI, p. 10209, 5/7/1951, seção I, p. 9979). Disponível em:\n\\<www.jusbrasil.com.br/diarios/2596034/dou-secao-1-05-07-1951-pg-1/pdfView\\>.\nAcesso em: 20/6/2011; *Diário Oficial da União* (28/12/1953, seção I, p.\n21931). Disponível em:\n\\<www.jusbrasil.com.br/diarios/2904413/dou-secao-1-28-12-1953-pg-3/pdfView\\>.\nAcesso em: 20/6/2011; INF. BIOGR. (21/7/2011); MIN. GUERRA. *Almanaque*\n(1956); MIN. GUERRA. *Almanaque* (1967); POL. MIL. RJ. Disponível em:\n\\<www.pmerj.org/20bpm/\\>. Acesso em: 20/6/2011.\n","dic":"DPRRJ"}
