{"title":"SOUSA, Irineu de","cargoss":["Deputado Estadual"],"cargos_esp":[0],"datas_ini":[1955],"datas_fim":[1958],"estados":["RJ"],"autor":[0],"content":"**SOUSA, Irineu de**\n\n\\* dep. est. RJ 1955-1958\n\n*Irineu José de Sousa* nasceu no Rio de Janeiro, então Distrito Federal,\nfilho de Leonor Alves Pereira.\n\nIngressou na política ao se filiar ao Partido Comunista Brasileiro (PCB)\nem 1940. Em 1953 assumiu a liderança dos operários navais do Rio de\nJaneiro comandando inúmeras greves. Foi eleito deputado estadual pelo\nPartido Socialista Brasileiro (PSB). Assumiu sua cadeira na Assembleia\nLegislativa do Estado do Rio de Janeiro (ALERJ) em 1955. Permaneceu no\nlegislativo estadual até 1958.\n\nTambém advogou durante anos dando sempre ênfase aos problemas\ntrabalhistas.\n\nFoi casado com Emília M. de Sousa.\n\n*Ioneide Piffano Brion de Souza*\n\nFONTES: Bio. Irineu de Souza. Disponível em: \\<www.amesp.blogspot.com\\>.\nAcesso em: 21/2/2011; FERREIRA, M. *João*; MATTOS, M. *Greves*.\n","ref":"FONTES: Bio. Irineu de Souza. Disponível em: \\<www.amesp.blogspot.com\\>.\nAcesso em: 21/2/2011; FERREIRA, M. *João*; MATTOS, M. *Greves*.\n","dic":"DPRRJ"}
