{"title":"SOUSA, Sizenando Fernandes de","cargoss":["Deputado Estadual"],"cargos_esp":[0],"datas_ini":[1927],"datas_fim":[1930],"estados":["RJ"],"autor":["Raimundo Helio Lopes"],"content":"**SOUSA, Sizenando Fernandes de**\n\n\\* dep. est. RJ 1927-1930.\n\n*Sizenando Fernandes de Sousa* foi vereador na cidade de Macaé (RJ) em\ndiversas legislaturas e presidente da Câmara Municipal desse município.\nEm 1914 posicionou-se favoravelmente à candidatura de Feliciano Sodré,\nentão prefeito de Niterói para o governo do estado do Rio de Janeiro.\nEssa candidatura tinha apoio de Pinheiro Machado e se opunha à corrente\nde Nilo Peçanha, que se lançou pessoalmente para o pleito estadual.\n\nEm 1924 foi eleito prefeito da cidade de Macaé (RJ), cargo que ocupou\naté 1926. Em abril de 1927 foi eleito deputado estadual na legenda do\nPartido Republicano Fluminense (PRF), pelo segundo distrito eleitoral\ncom sede em Campos. Neste ano e no seguinte integrou a Comissão de\nEstatística, Divisão Civil e Judiciária e Câmaras Municipais. Em 1929\nfoi eleito membro da Comissão de Agricultura, Viação e Obras Públicas.\nEm janeiro de 1930, com o final de seu mandato, não foi reeleito.\n\n*Raimundo Helio Lopes*\n\nFONTES: ASSEMB. LEGISL. RJ *Anais* (1927-1930); *Estado* (1/6/1924,\n19/8/1930); FERREIRA, M. *República*; *País* (2/1/1915); SOARES, E.\n*História*.\n","ref":"FONTES: ASSEMB. LEGISL. RJ *Anais* (1927-1930); *Estado* (1/6/1924,\n19/8/1930); FERREIRA, M. *República*; *País* (2/1/1915); SOARES, E.\n*História*.\n","dic":"DPRRJ"}
