{"title":"TAMBORINDEGUY, Alice","cargoss":["Deputado Estadual","Deputado Estadual","Deputado Estadual"],"cargos_esp":[0,0,0],"datas_ini":[2009,2004,1987],"datas_fim":[2010,2007,2003],"estados":["RJ","RJ","RJ"],"autor":["Elizabeth Dezouzart Cardoso"],"content":"**TAMBORINDEGUY, Alice**\n\n\\* dep. est. RJ 1987-2003, 2004-2007 e 2009-2010.\n\n*Alice Maria Saldanha Tamborindeguy* nasceu no Rio de Janeiro, então\nDistrito Federal, em 2 de junho de 1960, filha de Mario Tamborindeguy e\nde Alice Maria de Sousa Saldanha Tamborindeguy. Seu pai foi\nrevolucionário de 1930 e deputado federal pelo estado do Rio de Janeiro\nde 1959 a 1971. Seu primo João Saldanha foi técnico da seleção\nbrasileira de futebol.\n\nFez os cursos básicos nos colégios Chapeuzinho Vermelho e São Marcelo, e\nformou-se em Direito pela Universidade Cândido Mendes em 1986, depois de\npassar uma temporada nos Estados Unidos e estagiar em um escritório de\nadvocacia.\n\nFiliada desde 1984 ao Partido Democrático Trabalhista (PDT) ainda em\n1986 foi eleita deputada estadual. Cumpriu seu primeiro mandato na\nAssembleia Legislativa do Estado do Rio de Janeiro (ALERJ) de 1987 a\n1991 e foi reeleita para a legislatura 1991-1995 com 21.273 votos. Em\nagosto de 1994 filiou-se ao Partido da Social Democracia Brasileira\n(PSDB) e nessa legenda voltou a ser eleita deputada estadual para a\nlegislatura 1995-1999. Nesse período candidatou-se à prefeitura de São\nGonçalo (RJ), seu reduto eleitoral, mas não foi eleita, embora tenha\nrecebido quase 99 mil votos. Foi mais uma vez reeleita para a ALERJ para\na legislatura de 1999-2003, e em 2000 candidatou-se novamente à\nprefeitura de São Gonçalo. Recebeu cerca de 86 mil votos e ainda uma vez\nnão foi eleita. Nas eleições de outubro de 2002 disputou novamente uma\nvaga na ALERJ na legenda do PSDB e obteve uma suplência. Deixou a ALERJ\nao final da legislatura, em janeiro de 2003, mas voltou a ocupar uma\ncadeira em 2004. No pleito de outubro de 2006 voltou a se candidatar e\nmais uma vez conquistou uma suplência. Em janeiro de 2007, ao final da\nlegislatura, deixou a ALERJ, e em novembro, a convite da prefeita\nAparecida Panisset, assumiu a Secretaria de Cultura do município de São\nGonçalo. Voltou à ALERJ entre 2009 e abril de 2010, e entre julho e\ndezembro desse último ano.\n\nAo longo de sua passagem pela ALERJ, foi vice-presidente da Mesa\nDiretora e exerceu a liderança e a vice-liderança do PSDB. Presidiu as\ncomissões permanentes da Mulher, Criança e Adolescente, de Obras\nPúblicas, de Agricultura e Política Rural, de Educação, e de Segurança\nAlimentar, e duas comissões parlamentares de inquérito (CPIs), a\nprimeira para apurar a sonegação fiscal no estado e a segunda para\napurar desvio de verba da merenda escolar. Participou ainda de várias\noutras comissões permanentes e CPIs.\n\nEm 2011 ingressou no Partido Progressista (PP) e passou a ocupar a\npresidência da agremiação em São Gonçalo. Nas eleições de 2012 concorreu\nà prefeitura de São Gonçalo na legenda do PP, mais uma vez sem êxito.\n\nCasou-se em primeiras núpcias com Nestor Martins da Rocha e teve uma\nfilha, Nicole. Casou-se mais duas vezes, com Paulo Brito e com o juiz\nJoão Correia.\n\n*Elizabeth Dezouzart Cardoso*\n\nFONTES: ALERJ. *Deputados*; *Globo* (19/10/1990); INF. BIOGR.; *São\nGonçalo* (1/4/2010); TRIB. SUP. ELEIT. *Eleições* (1986, 1990, 1994,\n1998, 2000, 2002, 2006, 2010, 2012).\n","ref":"FONTES: ALERJ. *Deputados*; *Globo* (19/10/1990); INF. BIOGR.; *São\nGonçalo* (1/4/2010); TRIB. SUP. ELEIT. *Eleições* (1986, 1990, 1994,\n1998, 2000, 2002, 2006, 2010, 2012).\n","dic":"DPRRJ"}
