{"title":"TAMOIO, Marcos","cargoss":["Prefeito"],"cargos_esp":["Rio de Janeiro"],"datas_ini":[1975],"datas_fim":[1979],"estados":[0],"autor":[0],"content":"**TAMOIO, Marcos**\n\n\\* pref. Rio de Janeiro 1975-1979.\n\n*Marcos Tito Tamoio da Silva* nasceu no Rio de Janeiro, então Distrito\nFederal, no dia 7 de setembro de 1926, filho do general Alcibíades\nTamoio da Silva e de Odila Tamoio da Silva.\n\nFez o ginásio no Externato São José e o curso complementar no Colégio\nSanto Inácio. Após ingressar na Escola Nacional de Engenharia, assumiu\nem 1947, através de concurso, seu primeiro cargo público, como topógrafo\nda prefeitura do Distrito Federal. Colou grau em engenharia civil em\n1949 e, mais adiante, pós-graduou-se em engenharia rodoviária. Em 1950\npassou a engenheiro da prefeitura do Rio de Janeiro.\n\nEm 1954 fundou a firma Tamoio Construção e Terraplenagem Ltda., depois\nSocivil Estudos e Projetos de Engenharia Ltda., da qual se tornou, em\n1957, diretor-presidente. Entre as principais obras da firma,\nincluíram-se a construção dos Estaleiros Verolme e a ligação das\nfronteiras do Brasil com a Guiana Inglesa e a Venezuela, através de\npontes. Em 1960 integrou o grupo de técnicos que assessorava o\nsecretário de Obras do governo Carlos Lacerda (1963-1967), tendo sido\nnessa época o idealizador do túnel Rebouças, que veio unir as zonas\nnorte e sul da cidade do Rio de Janeiro. Em 1961, foi nomeado\nengenheiro-chefe da Divisão de Túneis da extinta Superintendência de\nUrbanização e Saneamento (Sursan). Fez um estágio em Nova Iorque para\nestudar o funcionamento de túneis ventilados, passou em 1962 a diretor\ndo Departamento de Urbanização da Sursan, e em 1965 tornou-se presidente\ndo órgão. Foi nomeado, nesse mesmo ano, secretário de Obras Públicas do\ngoverno Carlos Lacerda, em substituição ao engenheiro Enaldo Cravo\nPeixoto, que sofrera um enfarte. Nesse cargo acompanhou a conclusão da\nadutora do Guandu.\n\nEm 1967 assumiu o posto de diretor-técnico da Novo Rio Crédito\nImobiliário, empresa fundada por Lacerda em 1965. Recolheu-se a partir\nde então à iniciativa privada, como presidente da Tamoio Construções e\nTerraplenagem Ltda. e da Grande Rio Crédito Imobiliário, nascida da Novo\nRio. Em 1969 filiou-se ao Movimento Democrático Brasileiro (MDB), tendo\ncomo perspectiva ser escolhido para sucessor de Francisco Negrão de Lima\nno governo da Guanabara, caso o governo federal conseguisse influir\ndecisivamente na questão e apontar o candidato do partido oposicionista.\nRespeitados, porém, os mecanismos da legislação partidária, o escolhido\nfoi Antônio de Pádua Chagas Freitas, que dispunha do apoio da convenção\nestadual do MDB.\n\nApós a fusão dos antigos estados do Rio de Janeiro e da Guanabara, em\n1975, foi nomeado prefeito do município do Rio de Janeiro por indicação\ndo governador Floriano Peixoto Faria Lima (1975-1979), assumindo o posto\na 2 de maio. Em março de 1976, deixou o MDB e ingressou na Aliança\nRenovadora Nacional (Arena), acompanhando o governador Faria Lima. Como\nprefeito, ocupou a atual sede da prefeitura (o palácio da Cidade),\nconstruiu 62 praças e reformou 49, criou 45 escolas, reformou os\nhospitais Salgado Filho, Sousa Aguiar, Paulino Werneck e Miguel Couto,\nconstruiu a ligação Campo Grande-Santa Cruz, o Riocentro, o autódromo de\nJacarepaguá e o Planetário, urbanizou a Cidade Nova, reformou o sistema\nde iluminação do Rio de Janeiro e a Quinta da Boa Vista, construiu a\nmarina da Glória, urbanizou a lagoa Rodrigo de Freiras, criou o sistema\nRádiotáxi, deu prosseguimento às obras de infraestrutura da Barra da\nTijuca e concluiu a chamada linha Lilás (ligação entre Botafogo e o Cais\ndo Porto). Realizou ainda obras de asfaltamento e construção de\ngalerias, tendo criado a nova estrutura da Companhia de Limpeza Urbana\n(Comlurb). Foi substituído na prefeitura do Rio de Janeiro por Israel\nKlabin, que tomou posse em março de 1979.\n\nCom a reforma partidária e a revogação do bipartidarismo em novembro de\n1979, dedicou-se à organização do Partido Democrático Social (PDS) no\nestado. Excluído, porém, da comissão executiva regional provisória do\nPDS, não se filiou a nenhum partido. Em 1980 concluiu o curso da Escola\nSuperior de Guerra (ESG) e foi reincorporado ao PDS por decisão do\npresidente João Batista Figueiredo.\n\nFoi ainda diretor-presidente da Expan S.A. Comércio e Indústria.\n\nFaleceu no Rio de Janeiro no dia 7 de abril de 1981, quando era cotado\ncomo o principal nome do PDS para concorrer à sucessão do governador\nChagas Freitas nas eleições de novembro de 1982.\n\nEra casado com Maria Isabel Tamoio da Silva, com quem teve duas filhas.\n\nFONTES: *Folha de S.Paulo* (8/4/1981); *Globo* (17/2, 8, 24/4/1981);\n*Jornal do Brasil* (24/2, 3/5/1975, 17/1, 16/3/1976, 8/5, 30/9/1980, 16,\n17/2, 8/4/1981).\n","ref":"FONTES: *Folha de S.Paulo* (8/4/1981); *Globo* (17/2, 8, 24/4/1981);\n*Jornal do Brasil* (24/2, 3/5/1975, 17/1, 16/3/1976, 8/5, 30/9/1980, 16,\n17/2, 8/4/1981).\n","dic":"DPRRJ"}
