{"title":"TAVARES, Francisco Luís","cargoss":["Deputado Estadual","Deputado Estadual"],"cargos_esp":[0,0],"datas_ini":[1907,1898],"datas_fim":[1909,1903],"estados":["RJ","RJ"],"autor":[0],"content":"**TAVARES, Francisco Luís**\n\n\\* dep. est. RJ 1898-1903, 1907-1909.\n\n***Francisco Luís Tavares***disputou uma vaga para a Assembleia\nLegislativa do Estado do Rio de Janeiro (ALERJ) na eleição de dezembro\nde 1897. **Era representante de Santana do Japuíba, atual distrito do\nmunicípio de Cachoeiras de Macacu.**\n\nEm dezembro de 1900 foi reeleito deputado estadual. Nessa legislatura\nparticipou da reforma constitucional de 1903, durante o governo de\nQuintino Bocaiúva (1900-1903), que, entre outras medidas, decidiu a\ntransferência da capital estadual de Petrópolis para Niterói.\n\nNo pleito de dezembro de 1906 foi novamente eleito.\n\nDurante sua atividade parlamentar posicionou-se contrariamente à mudança\ndo Liceu de Humanidades de Niterói para a cidade de Petrópolis, nova\ncapital fluminense, Também se opôs à transferência do Hospital de São\nJoão Baptista do Rio de Janeiro, que era vinculado ao governo estadual\npara a responsabilidade da Câmara Municipal de Niterói. Foi membro da\nComissão da Saúde Pública e Câmaras Municipais.\n\nFaleceu em Niterói em 25 de julho de 1915.\n\n*Vicente Saul Moreira dos Santos*\n\nFONTES: ASSEMB. LEGISL. RJ. *Anais* (1898, 1899, 1903); *Gazeta de\nNotícias* (30/7/1915); FERREIRA, M. *República*; INST. HIST. PETRÓPOLIS.\nDisponível em: \\<www.ihp.org.br\\>; SOARES, E. *História*.\n","ref":"FONTES: ASSEMB. LEGISL. RJ. *Anais* (1898, 1899, 1903); *Gazeta de\nNotícias* (30/7/1915); FERREIRA, M. *República*; INST. HIST. PETRÓPOLIS.\nDisponível em: \\<www.ihp.org.br\\>; SOARES, E. *História*.\n","dic":"DPRRJ"}
