{"title":"TAVARES, Jerônimo Batista","cargoss":["Deputado Estadual"],"cargos_esp":[0],"datas_ini":[1923],"datas_fim":[1924],"estados":["RJ"],"autor":["Raimundo Helio Lopes"],"content":"**TAVARES, Jerônimo Batista**\n\n\\* dep. est. RJ 1923-1924.\n\n*Jerônimo Batista Tavares* foi chefe político e médico na cidade de\nItaperuna (RJ). Em 1919, ao lado de Porfírio Henriques da Silva, fundou\nneste município o periódico *O Povir*.\n\nEm 1921 concorreu a uma vaga na Assembleia Legislativa, mas não obteve\nêxito. Foi eleito deputado estadual pelo segundo distrito eleitoral, com\nsede em Campos (RJ), em 28 de outubro de 1923, no pleito realizado\ndurante a intervenção federal no estado do Rio de Janeiro. Durante a\nintervenção federal, decretada em 10 de janeiro de 1923 pelo então\npresidente da República Artur Bernardes (1922-1926), o estado foi\ngovernado pelo interventor Aureliano Leal, que fechou a Assembleia\nLegislativa do Estado do Rio de Janeiro (ALERJ) e anulou as eleições de\n9 de julho de 1922 realizadas para a sucessão do então presidente\nestadual Raul Veiga (1918-1922), quando os candidatos Raul Fernandes e\nFeliciano Sodré declararam-se eleitos, ocasionando a dualidade da ALERJ.\n\nFoi eleito na legenda do Partido Republicano Fluminense (PRF). Com o\ninício dos trabalhos legislativos, em 27 de novembro, participou do\nreconhecimento pela ALERJ da eleição de Feliciano Sodré para presidente\ndo Rio de Janeiro (1923-1927), encerrando o período de intervenção\nfederal do estado. Foi eleito ainda nesse ano, e reeleito no seguinte,\nmembro da Comissão de Higiene e Instrução Pública.\n\nFaleceu em 1925, em pleno exercício do mandato.\n\n*Raimundo Helio Lopes*\n\nFONTES: ASSEMB. LEGISL. RJ. *Anais* (1923-1925); *Estado* (19/1/1922);\nFERREIRA, M. *República*.\n","ref":"FONTES: ASSEMB. LEGISL. RJ. *Anais* (1923-1925); *Estado* (19/1/1922);\nFERREIRA, M. *República*.\n","dic":"DPRRJ"}
