{"title":"TAVARES, Rubens","cargoss":["Deputado Estadual"],"cargos_esp":[0],"datas_ini":[1995],"datas_fim":[1999],"estados":["RJ"],"autor":["Ana Beatriz Paes"],"content":"**TAVARES, Rubens**\n\n\\* dep. est. RJ 1995-1999.\n\n*Rubens Tavares Filho* nasceu na cidade do Rio de Janeiro, então\nDistrito Federal, no dia 2 de janeiro de 1945, filho de Rubens Paiva\nSilva Tavares e de Itália Tavares.\n\nFormou-se em direito em 1967 na Faculdade Nacional de Direito, mesma\ninstituição onde fez pós-graduação em direito comercial no ano seguinte.\nEntre 1969 e 1970 estudou administração comercial na George Washington\nUniversity, nos Estados Unidos.\n\nEntre os cursos que assistiu para complementar sua formação acadêmica e\nprofissional, destacam-se os de marketing no Centro de Gerenciamento\nBrasil, de gerência financeira e administração comercial na Pontifícia\nUniversidade Católica do Rio de Janeiro (PUC-Rio), de comércio exterior\nna Associação Brasileira de Exportação do Rio de Janeiro, de comércio\nmoderno na Escola Superior de Guerra (ESG), de comércio exterior na\nBethlem Steel Corporation, nos Estados Unidos, de óleo e gasodutos na\nEmbaixada da França.\n\nFoi assessor do governador do Rio de Janeiro Carlos Lacerda, entre 1961\ne 1964.\n\nTeve uma extensa trajetória profissional em empresas. Entre os cargos\nque assumiu destacam-se o de diretor financeiro da empresa de produtos\nquímicos Banco Herzog (1966-1975), o de diretor da Seravit Ltda.\n(1975-1985) e o de diretor da Petrofértil/Petrobras e da Intermark\nComércio Exterior (empresa distribuidora e exportadora de açúcar, aço e\nmanufaturas *commodities*), no Rio de Janeiro (1981-1985). Entre 1985 e\n1987 foi diretor financeiro da Petrobras Fertilizantes. Nesse mesmo\nperíodo foi presidente do Conselho Goiasfértil, em Goiás e diretor do\nconselho administrativo da Nitrofértil na Bahia e em Sergipe. Durante\nsua gestão na Nitrofértil foi enviado em uma missão oficial em Paris, em\n1986.\n\nEm 3 de outubro de 1994 foi eleito deputado estadual no estado do Rio de\nJaneiro, na legenda do Partido da Frente Liberal (PFL). Assumiu o\nmandato em fevereiro do ano seguinte para a legislatura 1995-1999. Tendo\nmudado de partido, assumiu, em 1995, a vice-liderança do Partido\nProgressista (PP). No mesmo ano assumiu a presidência da Comissão de\nCiência, Energia e Tecnologia e a presidência da Comissão Parlamentar de\nInquérito (CPI) criada para apurar a evasão fiscal e a imunidade de ICMS\nsobre a operação de extração de petróleo e de seus derivados. Ainda em\n1995 mudou de agremiação política, tendo sido líder do Partido Liberal e\npresidente da Comissão Especial criada para acompanhar e fiscalizar a\npolítica estadual de combate à prostituição infantojuvenil.\n\nEm 1996 foi relator da Comissão Especial criada para estudar e elaborar\no anteprojeto de Reforma Administrativa do Estado do Rio de Janeiro e da\nCPI formada para apurar denúncias de sonegação de impostos na exportação\nde minério de ferro pelo Porto de Guaíba, no município de Mangaratiba.\nIntegrou também a Comissão Especial reunida para elaborar propostas de\nreestruturação das políticas do estado e foi relator da CPI criada para\napurar a morte de 88 idosos e a qualidade da assistência prestada a eles\npela Clínica Santa Genoveva. Neste mesmo ano participou da I Feira de\nNegócios Brasil-Uruguai.\n\nEm 1997 foi vice-presidente da Comissão de Ciência, Energia e\nTecnologia, presidente da Comissão de Agricultura, Pecuária e Políticas\nRural, Agrária e Pesqueira e sub-relator da Comissão Especial que\nacompanhou os investimentos realizados nos transportes\nmetro-ferroviários, a evolução das condições operacionais e o processo\nde desestatização pelo qual passavam. Participou, a convite do governo\ndos Estados Unidos, do curso sobre legislação e técnica congressual no\nSenado norte-americano, do encontro com o então presidente americano\nBill Clinton e do seminário Parlamentarismo e Voto distrital, em Paris.\n\nNo ano seguinte assumiu a presidência da Comissão de Minas e Energias e\nintegrou as comissões de Agricultura, Pecuária e Políticas Rural,\nAgrária e Pesqueira e de Combate à Discriminação e Preconceito de Raça,\nCor, Religião, Etnia e Procedência Nacional. Participou da Convenção do\nPartido Democrático nos Estados Unidos.\n\nAinda durante o mandato foi autor de seis leis e coautor de outras três.\nParticipou da elaboração de mais de 50 resoluções, sendo as mais\nfrequentes as de concessões de Medalhas Tiradentes e de títulos de\nCidadão Benemérito do Estado do Rio de Janeiro. Cumpriu o mandato até o\nfim da legislatura, em 1999.\n\nDurante sua trajetória, participou de uma série de seminários e\nconferências, entre os quais se destacam os congressos do Partido\nSocialista Italiano em Milão (1989), do Partido Comunista Italiano em\nRoma (1990) e o Seminário sobre Transportes Ferroviários em Chicago\n(1994). Participou também, em 1997, do encontro do Mercosul em\nMontevidéu e da Conferência sobre Transporte de Massas em Paris.\n\nFoi também vice-presidente do Reencontro Obras Sociais e Educacionais,\nque distribuiu 25 milhões de exemplares do *Novo testamento* no Brasil e\nno mundo, manteve creches, centro médico, serviço funerário e cruzadas\nevangélicas internacionalmente.\n\nFaleceu em fevereiro de 2001.\n\nEra casado com a estilista Cláudia Simões, com quem teve uma filha.\n\n*Ana Beatriz Paes*\n\nFONTES: ASSEMB. LEGISL. RJ. *Documentos*; ASSEMB. LEGISL. RJ. *Deputados\nestaduais fluminenses*. Sexta legislatura (1995-1999); ASSEMB. LEGISL.\nRJ. Disponível em:\n\\<http://alerjln1.alerj.rj.gov.br/CONTLEI.NSF/leiOrdAutorInt?OpenForm&Start=372.2&Count=15&Expand=375\\>;\n\\<http://alerjln1.alerj.rj.gov.br/scpro.nsf/Formularios/PDecretoAutor?OpenDocument&Start=15&Count=15&Expand=25\\>;\n\\<http://alerjln1.alerj.rj.gov.br/CONTLEI.NSF/ResolucaoAutorInt?OpenForm&Start=387.53&Count=15&Expand=387\\>;\nBlog da Associação Evangélica Revife. Disponível em:\n\\<http://revife.com/2010/04/20/depoimento-da-estilista-claudia-simoes/\\>.\n","ref":"FONTES: ASSEMB. LEGISL. RJ. *Documentos*; ASSEMB. LEGISL. RJ. *Deputados\nestaduais fluminenses*. Sexta legislatura (1995-1999); ASSEMB. LEGISL.\nRJ. Disponível em:\n\\<http://alerjln1.alerj.rj.gov.br/CONTLEI.NSF/leiOrdAutorInt?OpenForm&Start=372.2&Count=15&Expand=375\\>;\n\\<http://alerjln1.alerj.rj.gov.br/scpro.nsf/Formularios/PDecretoAutor?OpenDocument&Start=15&Count=15&Expand=25\\>;\n\\<http://alerjln1.alerj.rj.gov.br/CONTLEI.NSF/ResolucaoAutorInt?OpenForm&Start=387.53&Count=15&Expand=387\\>;\nBlog da Associação Evangélica Revife. Disponível em:\n\\<http://revife.com/2010/04/20/depoimento-da-estilista-claudia-simoes/\\>.\n","dic":"DPRRJ"}
