{"title":"TÁVORA, José","cargoss":["Deputado Estadual","Deputado Estadual","Deputado Estadual"],"cargos_esp":[0,0,0],"datas_ini":[2008,1999,1991],"datas_fim":[2009,2007,1995],"estados":["RJ","RJ","RJ"],"autor":["Juliana Gagliardi"],"content":"**TÁVORA, José**\n\n\\* dep. est. RJ 1991-1995, 1999-2007, 2008-2009.\n\n*José Cardoso Távora* nasceu no dia 21 de setembro de 1936.\n\nGraduou-se pela Faculdade Nacional de Direito. Foi promotor de justiça e\nprocurador em Nova Iguaçu (RJ).\n\nCandidatou-se a deputado estadual no estado do Rio de Janeiro em 1990 e\nfoi eleito no pleito de outubro desse ano na coligação do seu partido, o\nPartido Trabalhista Brasileiro (PTB), com o Partido da Frente Liberal\n(PFL). Em fevereiro do ano seguinte, assumiu uma cadeira na Assembleia\nLegislativa do Estado do Rio de Janeiro (ALERJ). Durante o mandato foi\nautor das leis n^o^ 2.020/1992, que estabelecia que houvesse uma escola\npública habilitada a ensinar aos cegos pelo sistema *Braille* em cada\nregião do estado, e n^o^ 2.013/1992, que determina tempo mínimo para\nalteração da relação de livros didáticos utilizados pelas escolas\nparticulares e estaduais.\n\nFiliou-se ao Partido Democrático Trabalhista (PDT), legenda na qual se\ncandidatou mais uma vez deputado estadual em outubro de 1998 e foi\neleito na coligação desse partido com o Partido Comunista Brasileiro\n(PCB) e o Partido Comunista do Brasil (PCdoB). Durante o mandato foi\nsegundo secretário da ALERJ. No dia 1^o^ de fevereiro de 2001, já\nfiliado ao Partido Socialista Brasileiro (PSB), tornou-se líder do\ngoverno na ALERJ, indicado por Anthony Garotinho, então governador do\nestado do Rio (199-2002) e filiado ao PSB desde janeiro desse ano.\n\nNas eleições de outubro de 2002 candidatou-se novamente com êxito na\ncoligação *Rio esperança e dignidade*, do PSB com o Partido Social\nTrabalhista (PST) e o Partido Trabalhista Cristão (PTC). Assumiu o\nmandato em fevereiro do ano seguinte e, durante a legislatura, foi\nsegundo vice-presidente da ALERJ e deixou o PSB para se filiar ao\nPartido do Movimento Democrático Brasileiro (PMDB).\n\nEm 29 de maio de 2005 foi eleito presidente da União Nacional dos\nLegislativos Estaduais (Unale), vencendo o deputado piauiense Leal\nJúnior (PFL) por 69 votos a 68. Durante sua gestão defendeu que o código\nde ética deveria ser universal e comum a todas as assembleias. Em junho\nde 2005 foi ao gabinete da presidência da Câmara dos Deputados pedir\napoio para a criação do código de ética das assembleias legislativas. No\ndia 22 do mesmo mês anunciou sua desfiliação do PMDB. Filiou-se, em\nseguida, ao PFL, que passaria a se chamar Democratas (Dem) em 2007, e\nfoi segundo vice-presidente da ALERJ.\n\nNo pleito de 2006 candidatou-se mais uma vez e obteve uma suplência. No\ndia 10 de abril de 2008 foi empossado na ALERJ no lugar de Rodrigo\nDantas (Dem), que se licenciou para assumir a Secretaria Municipal de\nObras do Rio de Janeiro, e exerceu o mandato até 2009.\n\nDurante sua trajetória parlamentar na ALERJ presidiu as comissões de\nRedação, de Economia Indústria, Comércio e Turismo e de Obras Públicas e\nintegrou as comissões dos Servidores Públicos, de Emendas\nConstitucionais e Vetos e de Educação e Cultura.\n\nFoi, ainda, secretário de Indústria, Comércio e Meio Ambiente de Nova\nIguaçu.\n\nFoi casado com Sônia Távora.\n\n*Juliana Gagliardi*\n\nFONTES:ASSEMB. LEGISL. RJ. (10/4/2008). José Távora toma posse em seu\nquinto mandato como deputado na Casa. Disponível em:\n\\<www.alerj.rj.gov.br/common/noticia\\_corpo.asp?num=25026\\>. Acesso em:\n29/12/2011; ASSEMB. LEGISL. RJ. (21/10/2005). José Távora é melhor\npersonalidade estadual de 2005 da BGA. Disponível em:\n\\<www.alerj.rj.gov.br/common/noticia\\_busca2.asp\\>. Acesso em:\n29/12/2011; ASSEMB. LEGISL. RJ. (22/6/2005). Deputado José Távora deixa\no PMDB. Disponível em:\n\\<www.alerj.rj.gov.br/common/noticia\\_corpo.asp?num=12309\\>. Acesso em:\n29/12/2011; ASSEMB. LEGISL. RJ. (31/5/2005). Deputado José Távora assume\na presidência da Unale. Disponível em:\n\\<www.alerj.rj.gov.br/common/noticia\\_corpo.asp?num=12024\\>. Acesso em:\n29/12/2011; ASSEMB. LEGISL. RJ. (3/3/2006). Na volta às aulas, leis\nregulam cantinas, taxas e peso das mochilas. Disponível em:\n\\<www.alerj.rj.gov.br/common/noticia\\_corpo.asp?num=15497\\>. Acesso em:\n29/12/2011; ASSEMB. LEGISL. RJ. (8/7/2005). Unale debate ética e\nfortalecimento do Legislativo. Disponível em:\n\\<www.alerj.rj.gov.br/common/noticia\\_corpo.asp?num=12520\\>. Acesso em:\n29/12/2011; *Jornal da Câmara* (22/6/2005); Mensagem n^o^ 4/2001, de\n1/2/2001 (do governador do RJ para a ALERJ). Disponível em:\n\\<http://alerjln1.alerj.rj.gov.br/scpro99.nsf/812f2a6fac1ce6d88325670400034c8a/40ca8de294300c5d032569ee0068e57c?OpenDocument\\>.\nAcesso em: 29/12/2011; TRIB. REG. ELEIT. *Eleições* (1990, 1998, 2002);\nUNALE (31/5/2010). Ex-presidente da Unale, José Távora, é condecorado na\nConferência da Unale. Disponível em:\n\\<www.unale.org.br/index.php?option=com\\_content&view=article&id=264:ex-presidente-da-unale-jose-tavora-e-condecorado-na-conferencia-da-unale&catid=2:mais-noticias&Itemid=22\\>.\nAcesso em: 29/12/2011.\n","ref":"FONTES:ASSEMB. LEGISL. RJ. (10/4/2008). José Távora toma posse em seu\nquinto mandato como deputado na Casa. Disponível em:\n\\<www.alerj.rj.gov.br/common/noticia\\_corpo.asp?num=25026\\>. Acesso em:\n29/12/2011; ASSEMB. LEGISL. RJ. (21/10/2005). José Távora é melhor\npersonalidade estadual de 2005 da BGA. Disponível em:\n\\<www.alerj.rj.gov.br/common/noticia\\_busca2.asp\\>. Acesso em:\n29/12/2011; ASSEMB. LEGISL. RJ. (22/6/2005). Deputado José Távora deixa\no PMDB. Disponível em:\n\\<www.alerj.rj.gov.br/common/noticia\\_corpo.asp?num=12309\\>. Acesso em:\n29/12/2011; ASSEMB. LEGISL. RJ. (31/5/2005). Deputado José Távora assume\na presidência da Unale. Disponível em:\n\\<www.alerj.rj.gov.br/common/noticia\\_corpo.asp?num=12024\\>. Acesso em:\n29/12/2011; ASSEMB. LEGISL. RJ. (3/3/2006). Na volta às aulas, leis\nregulam cantinas, taxas e peso das mochilas. Disponível em:\n\\<www.alerj.rj.gov.br/common/noticia\\_corpo.asp?num=15497\\>. Acesso em:\n29/12/2011; ASSEMB. LEGISL. RJ. (8/7/2005). Unale debate ética e\nfortalecimento do Legislativo. Disponível em:\n\\<www.alerj.rj.gov.br/common/noticia\\_corpo.asp?num=12520\\>. Acesso em:\n29/12/2011; *Jornal da Câmara* (22/6/2005); Mensagem n^o^ 4/2001, de\n1/2/2001 (do governador do RJ para a ALERJ). Disponível em:\n\\<http://alerjln1.alerj.rj.gov.br/scpro99.nsf/812f2a6fac1ce6d88325670400034c8a/40ca8de294300c5d032569ee0068e57c?OpenDocument\\>.\nAcesso em: 29/12/2011; TRIB. REG. ELEIT. *Eleições* (1990, 1998, 2002);\nUNALE (31/5/2010). Ex-presidente da Unale, José Távora, é condecorado na\nConferência da Unale. Disponível em:\n\\<www.unale.org.br/index.php?option=com\\_content&view=article&id=264:ex-presidente-da-unale-jose-tavora-e-condecorado-na-conferencia-da-unale&catid=2:mais-noticias&Itemid=22\\>.\nAcesso em: 29/12/2011.\n","dic":"DPRRJ"}
