{"title":"TEIXEIRA, Antônio Augusto","cargoss":["Constituinte","Deputado Estadual"],"cargos_esp":["est",0],"datas_ini":[1892,1892],"datas_fim":[1892,1900],"estados":["RJ","RJ"],"autor":[0],"content":"**TEIXEIRA, Antônio Augusto**\n\n\\* const. est. RJ 1892; dep. est. RJ 1892-1900.\n\n*Antônio Augusto Teixeira* elegeu-se deputado estadual constituinte no\nestado do Rio de Janeiro em 1892. Promulgada a Constituição do estado em\n9 de abril, foram convocadas novas eleições para o Legislativo.\nElegeu-se então deputado estadual na legenda do Partido Republicano\nFluminense (PRF) e passou a ocupar uma cadeira na Assembleia Legislativa\ndo Estado do Rio de Janeiro (ALERJ). Participou da Comissão de Instrução\nPública, e apresentou um projeto que destinava parte das cotas da\nloteria para as casas de caridade dos municípios fluminenses de Angra\ndos Reis, Itaguaí e Barra Mansa. Propôs também a “restauração das\ndivisas” do município de Itaguaí, que tinha sido dividido por decreto no\ngoverno de Francisco Portela (1889-1891).\n\nReeleito nas eleições de maio de 1895, discursou na ALERJ em apoio à\nação do presidente Prudente de Morais (1894-1898), que pôs fim a Revolta\nda Armada e à Revolução Federalista. Ainda nessa legislatura integrou a\nComissão de Comércio, Agricultura, Indústria e Colonização. Em 1896,\ndefendeu a encampação da Estrada de Ferro Leopoldina pelo governo do\nestado do Rio.\n\nMais uma vez reeleito no pleito de dezembro de 1897, apresentou um\nprojeto que propunha a redução dos impostos cobrados pelo estado sobre a\nexportação de café. A medida, segundo afirmava, corrigiria a legislação\ntributária adotada ainda no governo de Francisco Portela, que contribuía\npara que os produtores fluminenses fossem superados pelos produtores de\ncafé de São Paulo, Minas Gerais e Espírito Santo. Posicionou-se ainda\ncontra o aumento de gastos públicos e a criação da Imprensa Oficial do\nEstado do Rio, defendendo a publicação dos atos oficiais e debates da\nALERJ no *Jornal do Comércio*. Foi também defensor do saneamento das\ncontas do estado, participou dos debates sobre a reforma do Poder\nJudiciário e foi contra a extinção da comarca de Parati. Deixou a ALERJ\nem 1900, ao final da legislatura.\n\n*Samuel Silva Rodrigues de Oliveira*\n\nFONTES: ASSEMB. LEGISL. RJ. *Anais* (1892-1900); FERREIRA, M.\n*República*.\n","ref":"FONTES: ASSEMB. LEGISL. RJ. *Anais* (1892-1900); FERREIRA, M.\n*República*.\n","dic":"DPRRJ"}
