{"title":"TEIXEIRA, Leão","cargoss":["Deputado Estadual"],"cargos_esp":[0],"datas_ini":[1901],"datas_fim":[1906],"estados":["RJ"],"autor":["Raimundo Helio Lopes"],"content":"**TEIXEIRA, Leão**\n\n\\* dep. est. RJ 1901-1906.\n\n*Henrique Carneiro Leão Teixeira* nasceu na cidade do Rio de Janeiro,\nentão capital do Império, no dia 15 de maio de 1869, filho de Jerônimo\nJosé Teixeira Júnior e de Maria Henriqueta Carneiro Leão. Seu pai tinha\no título de visconde de Cruzeiro e seu avô materno, Honório Hermeto\nCarneiro Leão, o de marquês do Paraná.\n\nIngressou na Faculdade de Direito de São Paulo em 1886, mas\ntransferiu-se e colou grau em ciências jurídicas e sociais na Faculdade\nde Direito do Recife, em 1890.\n\nDe volta ao Rio de Janeiro, ingressou na política em 1901, quando foi\neleito deputado estadual pelo segundo distrito eleitoral do estado do\nRio com 4.556 votos. Em seu primeiro mandato foi membro das comissões de\nInstrução Pública e de Fazenda e Orçamento do Estado e, em 1903, foi\nconstituinte estadual. Em 1904 integrou a Comissão de Verificação de\nPoderes, responsável pelo reconhecimento da votação dos deputados\neleitos pelos terceiro e quarto distritos eleitorais. Nesse mesmo ano\nfoi reeleito pelo segundo distrito eleitoral com 8.144 votos. Na nova\nlegislatura foi membro da Comissão de Fazenda e Orçamento do Estado e,\nconcomitante à sua atividade parlamentar, foi secretário de governo do\nestado do Rio de Janeiro durante a presidência de Nilo Peçanha. Ao fim\ndo mandato, em 1906, não foi reeleito.\n\nFoi também diretor do *Jornal do Brasil* e, durante nove meses,\npresidente do Banco do Brasil.\n\nFaleceu no dia 1^o^ de janeiro de 1936.\n\nSeu filho Henrique Carneiro Leão Teixeira Filho foi engenheiro,\nprofessor e membro do Instituto Histórico e Geográfico Brasileiro.\n\n*Raimundo Helio Lopes*\n\nFONTES: ASSEMB. LEGISL. RJ. *Anais* (1901-1906); MOURA, C. *Vida*;\nRIBEIRO FILHO, J. *Dic*.\n","ref":"FONTES: ASSEMB. LEGISL. RJ. *Anais* (1901-1906); MOURA, C. *Vida*;\nRIBEIRO FILHO, J. *Dic*.\n","dic":"DPRRJ"}
