{"title":"TELES, Arildo","cargoss":["Deputado federal"],"cargos_esp":[0],"datas_ini":[1983],"datas_fim":[1987],"estados":["RJ"],"autor":[0],"content":"**TELES, Arildo**\n\n\\* militar; dep. fed. RJ 1983-1987.\n\n*Arildo Matos Teles* nasceu em Aracaju no dia 8 de março de 1934, filho\nde Arquibaldo Teles de Meneses e de Zulinah Matos Teles.\n\nSegundo-sargento da Aeronáutica, realizou seus estudos na área de\nciências humanas, licenciando-se em pedagogia pela Faculdade de Educação\nda Sociedade Universitária Augusto Mota e em filosofia pela Universidade\ndo Estado do Rio de Janeiro (UERJ). Bacharelou-se em ciências jurídicas\ne sociais pela Faculdade de Direito da Universidade Federal Fluminense\n(UFF) e posteriormente cursou o mestrado em administração escolar na\nUniversidade Federal do Rio de Janeiro (UFRJ). Paralelamente a seus\nestudos, atuou como professor da rede pública de ensino do estado do Rio\nde Janeiro, tendo sido diretor geral do Colégio João Lira Filho.\n\nEm novembro de 1982 foi eleito deputado federal pelo Rio de Janeiro na\nlegenda do Partido Democrático Trabalhista (PDT). Assumiu o mandato em\nfevereiro de 1983 e integrou, na Câmara dos Deputados, no mesmo ano, a\nComissão de Educação e Cultura e a Comissão de Agricultura e Política\nRural, nesta como suplente.\n\nNa sessão de 25 de abril de 1984 votou a favor da emenda Dante de\nOliveira, que propunha o restabelecimento de eleições diretas para a\npresidência da República em novembro desse ano. Como a emenda não obteve\na votação necessária para ser encaminhada ao Senado, decidiu apoiar, no\nColégio Eleitoral reunido a 15 de janeiro de 1985 para escolher o novo\npresidente do país, a chapa vitoriosa Tancredo Neves-José Sarney lançada\npela Aliança Democrática, coligação do Partido do Movimento Democrático\nBrasileiro (PMDB) com a dissidência do Partido Democrático Social (PDS)\ndenominada Frente Liberal. Acometido por uma diverticulite, Tancredo, no\nentanto, não chegou a ser empossado, vindo a falecer em 21 de abril de\n1985. Foi substituído na presidência por Sarney, que vinha ocupando o\ncargo interinamente desde o dia 15 de março.\n\nEm novembro de 1986 Arildo Teles concorreu à reeleição, mas não foi\nbem-sucedido. Com o término do seu mandato, em janeiro de 1987,\nretirou-se da Câmara. Tentou reeleger-se mais uma vez nos pleitos de\noutubro de 1990 e de 1994, sem êxito.\n\nTeve cinco filhos.\n\nFONTES: CÂM. DEP. *Deputados brasileiros*. Repertório (1983-1987);\n*Globo* (26/4/1984, 16/1/1985).\n","ref":"FONTES: CÂM. DEP. *Deputados brasileiros*. Repertório (1983-1987);\n*Globo* (26/4/1984, 16/1/1985).\n","dic":"DPRRJ"}
