{"title":"TEMER, Mílton","cargoss":["Deputado Estadual","Constituinte","Deputado federal"],"cargos_esp":[0,"est",0],"datas_ini":[1987,1989,1995],"datas_fim":[1991,1989,2003],"estados":["RJ","RJ","RJ"],"autor":[0],"content":"**TEMER, Mílton**\n\n\\* jornalista; dep. est. RJ 1987-1991; const. est. RJ 1989; dep. fed. RJ\n1995-2003.\n\n*Jorge Mílton Temer* nasceu no Rio de Janeiro, então Distrito Federal,\nno dia 12 de dezembro de 1938, filho de Gabriel Temer e de Júlia Temer.\n\nEm 1957 ingressou na Escola Naval do Rio de Janeiro, da qual saiu\noficial da Marinha do Brasil em 1959. Chegou a primeiro-tenente, mas em\nsetembro de 1964 foi cassado pelo regime militar instaurado no país em\nabril do mesmo ano.\n\nIniciou a vida partidária filiando-se ao proscrito Partido Comunista\nBrasileiro (PCB) em 1966. Também nesse ano começou suas atividades como\njornalista, estagiando no *Diário Carioca* e posteriormente trabalhando\nna Editora Abril, da qual foi chefe da sucursal do Rio de Janeiro e\ndiretor em São Paulo. Deixou a Abril em 1971, ano em que trabalhou no\n*Jornal do Brasil*. Em 1972 foi chamado para trabalhar com Samuel Wainer\nno *Domingo Ilustrado*, da Editora Bloch. No mesmo ano saiu da editora e\nviajou pela América Latina, fazendo entrevistas com personalidades como\no presidente do Chile, Salvador Allende, que eram publicadas na imprensa\nbrasileira. Na volta ao Brasil, trabalhou no jornal *O Globo* até agosto\nde 1972, quando deixou novamente o país, dessa vez com destino a Moscou,\npara cursar a Escola de Quadros do Partido Comunista da União das\nRepúblicas Socialistas Soviéticas (URSS). Em 1975 foi para Paris,\ntornando-se editor do jornal *Voz Operária*, órgão oficial do PCB,\neditado na capital francesa.\n\nDivergindo da influência exercida pelos regimes comunistas do Leste\neuropeu na política do PCB, rompeu com o partido em 1978. De volta ao\nBrasil no ano seguinte, foi contratado para trabalhar na coordenação da\neditoria política de *O Globo*. Em 1981, foi para Londres como\ncorrespondente internacional do jornal. Ao retornar ao Brasil um ano\ndepois, instalou-se em Fortaleza, onde implantou o projeto gráfico do\n*Diário do Nordeste*. Ainda em 1982 voltou para *O Globo* e participou\ndo projeto de implantação dos jornais de bairro. Dois anos depois\ntornou-se membro do conselho diretor da Associação Brasileira de\nImprensa (ABI) e, em 1985, ingressou na TV Educativa (TVE) do Rio de\nJaneiro, onde criou e apresentou um programa de debates constitucionais.\nAinda em 1985, foi reintegrado à Marinha como capitão de mar e guerra.\n\nEm 1986 filiou-se ao Partido Socialista Brasileiro (PSB) e nessa legenda\nfoi eleito, em novembro, deputado estadual no Rio de Janeiro. Assumiu\nsua cadeira em fevereiro de 1987 e, ao ser instalada a Assembleia\nConstituinte estadual em 1989, foi vice-relator da Constituição\nfluminense. Também em 1989 ingressou no Partido dos Trabalhadores (PT),\ndo qual foi líder na Assembleia Legislativa em 1989 e 1990, e de cujos\ndiretórios regional e nacional passou a fazer parte. Ainda em 1989\nparticipou da campanha de Luís Inácio Lula da Silva para a presidência\nda República. Apoiado pela Frente Brasil Popular, coligação que reuniu\nos principais partidos de esquerda do país, Lula chegou ao segundo turno\ndo pleito, realizado em dezembro de 1989, mas acabou sendo derrotado\npelo candidato do Partido da Reconstrução Nacional (PRN), Fernando\nCollor de Melo.\n\nCom a posse de Collor na presidência da República (15/3/1990), Temer foi\nafastado de suas funções na TVE. Em outubro de 1990, candidatou-se a\nsenador na legenda do PT, mas perdeu a eleição para o candidato do\nPartido Democrático Trabalhista (PDT), Darci Ribeiro. Deixou a\nAssembleia ao fim do mandato, em janeiro de 1991, e no ano seguinte, com\no *impeachment* de Collor, foi convidado pelo presidente da TVE, Válter\nClark, a retornar à emissora. Aceitando o convite, passou a apresentar\num programa de entrevistas chamado *Em busca do tempo perdido*. Durante\nos debates suscitados pelo plebiscito sobre a forma e o sistema de\ngoverno a ser realizado em abril de 1993, marcou posição como defensor\ndo modelo republicano presidencialista, que saiu vencedor.\n\nDeputado federal\n\nNo pleito de outubro de 1994 – no qual Fernando Henrique Cardoso, do\nPartido da Social Democracia Brasileira (PSDB) derrotou, entre outras, a\ncandidatura de Lula, tornando-se o novo presidente do país –, Temer\nelegeu-se deputado federal pelo PT. Com suspeitas de fraude devido ao\nnúmero excessivo de votos em branco, a eleição proporcional do Rio foi\nanulada por determinação do Tribunal Regional Eleitoral (TRE) do estado,\ne um novo pleito foi marcado para novembro seguinte. Temer confirmou sua\neleição, tendo recebido a maioria de seus votos de sua base eleitoral na\nZona Sul da capital.\n\nDurante a campanha, defendeu uma mudança constitucional que\npossibilitasse maior equidade nas representações estaduais no Congresso\nNacional. Empossado em fevereiro de 1995, tornou-se membro efetivo da\nComissão de Comunicação, Ciência e Tecnologia da Câmara e ainda no mesmo\nano apresentou um projeto de emenda constitucional outorgando poderes ao\nCongresso para a cassação de concessões de rádio e televisão,\nprerrogativa exclusiva do Judiciário. Foi indicado também para uma das\nvice-lideranças da bancada petista.\n\nNas votações das emendas constitucionais propostas pelo governo Fernando\nHenrique Cardoso (1995-1999) em 1995, votou sempre de acordo com as\nteses defendidas pelo PT, tentando obstruir a proposta de quebra do\nmonopólio dos governos estaduais na distribuição de gás canalizado e\nmanifestando-se contra a abertura da navegação de cabotagem às\nembarcações estrangeiras, a revisão do conceito de empresa nacional e a\nquebra do monopólio estatal nas telecomunicações e na exploração do\npetróleo pela Petrobras. Foi também contrário à prorrogação do Fundo de\nEstabilização Fiscal (FEF) – antigo Fundo Social de Emergência (FSE) –,\ncriado na legislatura anterior com o objetivo de financiar o plano de\nestabilização econômica do governo (Plano Real). Em julho de 1996 – ano\nem que foi membro da Comissão de Constituição e Justiça da Câmara –,\ndeclarou-se contrário à instituição da Contribuição Provisória sobre\nMovimentação Financeira (CPMF), sucessora do Imposto Provisório sobre\nMovimentação Financeira (IPMF), tributo concebido para aumentar a\narrecadação do Ministério da Saúde. Participante ativo das discussões\nreferentes ao sistema financeiro, defendeu sem sucesso a instalação de\numa comissão parlamentar de inquérito (CPI) para analisar o Programa de\nEstímulo à Reestruturação e ao Fortalecimento do Sistema Financeiro\nNacional (Proer) elaborado pelo governo. Além disso, foi o autor de\nprojetos que propunham a ampliação do controle social sobre o Conselho\nMonetário Nacional (CMN).\n\nEm novembro ainda de 1996, o Tribunal Superior Eleitoral (TSE) decidiu\nanular a eleição de novembro de 1994 e restabelecer o resultado do\npleito de outubro. Alegando falta de fundamentação nas denúncias de\nfraude, o tribunal deu ganho de causa aos recursos impetrados pelos\ncandidatos prejudicados com a decisão do TRE de realizar um novo pleito.\nEleito nas duas ocasiões, Temer não teve sua condição alterada, e foi\nreempossado na Câmara em 17 de fevereiro de 1997. Ainda em fevereiro\nvotou contra a emenda que instituiu a possibilidade de reeleição para os\nocupantes de cargos executivos (prefeitos, governadores de estado e\npresidente da República).\n\nEm agosto de 1997, candidatou-se à presidência do PT. Apoiado pelos\nsetores mais à esquerda do partido, foi no entanto derrotado por José\nDirceu, candidato lançado pela corrente Articulação, de tendência\nmoderada. Após a convenção, propôs o lançamento da chapa Lula-Leonel\nBrizola (PDT), para as eleições presidenciais de 1998.\n\nEm novembro de 1997, sempre em oposição ao governo Fernando Henrique,\ntambém foi contra o destaque do projeto de reforma administrativa do\ngoverno que punha fim à estabilidade no serviço público em caso de mau\ndesempenho do servidor ou por excesso de gastos com pessoal. Além dos\ntemas referentes ao sistema financeiro, destacou-se na luta contra a\nprivatização das empresas públicas e, em especial, do sistema Telebrás,\nefetivada em 1998.\n\nApesar das resistências encontradas em alguns setores da oposição que\ndefendiam um nome alternativo ao de Lula para representar as esquerdas,\na chapa Lula-Brizola acabou sendo aprovada, e uma inédita coligação\noposicionista, reunindo PT, PDT, Partido Comunista do Brasil (PCdoB) e\nPSB, foi formada para disputar o pleito de 1998. Não obstante ter sido o\nautor da proposta de aliança com Brizola, Temer recusou o apoio aos\npedetistas na eleição para governador do Rio de Janeiro. Aliado à\nesquerda petista, defendeu o lançamento da candidatura de Vladimir\nPalmeira, que acabou sendo aprovada pela convenção estadual do partido.\nA decisão do PT carioca provocou porém uma crise com o PDT, que ameaçou\nretirar o apoio a Lula, caso os petistas não revissem sua posição.\nProcurando evitar o racha na coligação oposicionista, a direção nacional\ndo PT decidiu então anular a indicação de Palmeira e forçar o apoio do\npartido à candidatura do pedetista Anthony Garotinho ao governo do\nestado, tendo a senadora petista Benedita da Silva como companheira de\nchapa.\n\nNo pleito de outubro de 1998 – ocasião em que Temer foi reeleito\ndeputado federal –, Lula foi novamente derrotado por Fernando Henrique\nCardoso, que foi reeleito presidente (1999-2003). Habilitado para\ndisputar o segundo turno com César Maia, do Partido da Frente Liberal\n(PFL), em novembro de 1998 Garotinho foi eleito governador e Benedita\nvice-governadora do Rio. No mesmo mês, Temer deu voto contrário aos\ndestaques da reforma da Previdência do governo que propunham o\nestabelecimento de um teto para as aposentadorias do funcionalismo\npúblico e a adoção dos critérios de idade mínima e de tempo de\ncontribuição na concessão dos benefícios para o setor privado.\n\nEm janeiro de 1999, discordando de medidas anunciadas por Anthony\nGarotinho, recém-empossado governador, Temer conclamou os também\nrecém-nomeados secretários estaduais petistas a abandonar seus cargos.\nNo mês seguinte, logo depois de assumir seu novo mandato na Câmara, e\ntornar-se membro da Comissão da Reforma Tributária, uniu-se aos\ndeputados José Dirceu e Arlindo Chinaglia para encaminhar ao Ministério\nPúblico representação contra o Executivo por crime de responsabilidade\ndiante da acusação ao presidente do Banco Central de operar esquema de\nvenda de informações privilegiadas a agentes do sistema financeiro e de\nautorizar operações cambiais que causaram prejuízo de mais de 1,5 bilhão\nde reais ao Tesouro Nacional. O caso, envolvendo os bancos Marka e\nFonteCindan e o banqueiro Salvatore Cacciola, veio à tona logo após a\ninesperada maxidesvalorização, em 13 de janeiro, da moeda brasileira\nfrente ao dólar americano, o que pôs fim à política de paridade cambial\nexecutada desde o início do Plano Real.\n\nNo mesmo período, aliou-se ao líder do PDT, Leonel Brizola, no\nlançamento de campanha nacional de coleta de assinaturas para a criação\nde uma CPI para investigar o processo de privatização das empresas\nestatais da área de telecomunicações, e na organização de mobilizações\npopulares contrárias ao governo federal e aos acordos com o Fundo\nMonetário Internacional. O movimento culminou com a “Caminhada dos 100\nmil” e com a entrega ao presidente do Congresso Nacional de um documento\ncom mais de um milhão de assinaturas pedindo a abertura da CPI das\nprivatizações.\n\nNo âmbito interno do PT, em novembro de 1999 Milton Temer foi candidato\núnico dos setores de esquerda à presidência do partido no II Congresso\nNacional, realizado em Belo Horizonte. José Dirceu, da tendência\nArticulação, foi reeleito com 54,8% dos votos, contra 34,7% de Temer e\n12,5% de Chinaglia. No mesmo mês de novembro, pela primeira vez Temer\nteve um de seus projetos parlamentares aprovado em caráter terminativo\nna Comissão de Constituição e Justiça, o que determinava seu envio ao\nSenado sem passar pela votação do plenário da Câmara. O projeto obrigava\no Poder Judiciário a priorizar o julgamento de ações cíveis em que um\ndos autores tivesse idade superior a 65 anos.\n\nNo início do ano 2000, Temer voltou a pressionar o PT fluminense no\nsentido da ruptura com o governador Anthony Garotinho e da consequente\nrenúncia dos secretários estaduais e ocupantes de cargos no governo\nvinculados ao partido. Na convenção municipal do partido, realizada em\nmarço, o pré-candidato da esquerda, Vladimir Palmeira, foi derrotado\npela vice-governadora Benedita da Silva, da ala “aliancista”, em meio a\natos de violência e acusações de fraudes no credenciamento de delegados.\nTemer e seus aliados não reconheceram a legitimidade da convenção. No\ndecorrer da campanha eleitoral, Temer declarou que pediria votos para os\ncandidatos a vereador da esquerda do partido, mas não para a candidata a\nprefeita.\n\nEm fevereiro de 2001, requereu o *impeachment* do presidente Fernando\nHenrique Cardoso. Em maio, lançou sua candidatura a governador do Rio de\nJaneiro. Em setembro foi instalada, a partir de requerimento de sua\ncoautoria, a CPI do Programa de Estímulo à Reestruturação do Sistema\nFinanceiro Nacional (Proer), na qual exerceu a função de\nsegundo-vice-presidente. A comissão investigou denúncias de\nirregularidades em benefício de bancos privados que teriam causado\nprejuízos bilionários aos cofres públicos durante a execução do\nprograma. Em dezembro, foi derrotado na convenção do PT em que a\nvice-governadora Benedita da Silva foi proclamada candidata ao governo\ndo estado.\n\nNos primeiros meses de 2002, opôs-se à aliança do PT com o Partido\nLiberal (PL), a que pertencia o político e empresário mineiro José\nAlencar, indicado para vice-presidente na chapa encabeçada por Lula, na\ndisputa pela sucessão de Fernando Henrique Cardoso. No âmbito do Rio de\nJaneiro, decidiu não tentar se reeleger deputado federal. As eleições de\noutubro deram vitória a Lula. Em janeiro de 2003, ao final da\nlegislatura, Temer deixou a Câmara dos Deputados.\n\nNo início do ano 2003, declarou que pela primeira vez em 50 anos de\nmilitância política era membro de um partido que chegara ao poder. Esse\nfato não o impedia de continuar na oposição, porque, no seu entender, o\ngoverno petista dava continuidade ao denominado modelo neoliberal de\ngestão implementado nos dois governos anteriores de Fernando Henrique\nCardoso. Criticou publicamente a composição dos ministérios, do Banco\nCentral e da base parlamentar de sustentação do governo. Aliou-se à\nsenadora Heloísa Helena (PT/AL), aos deputados federais Luciana Genro\n(PT/RS), João Batista Babá (PT/PA) e João Fontes (PT/SE), a Leonel\nBrizola, e ao Partido Socialista dos Trabalhadores Unificado (PSTU) na\norganização de atos públicos de oposição aos projetos do governo de\nreformas da Previdência e tributária. Em dezembro, criticou a decisão do\ndiretório nacional do PT de, por maioria de votos, expulsar a senadora\nHeloísa Helena e os deputados Luciana Genro, Babá e João Fontes.\n\nEm janeiro de 2004, desligou-se do PT e organizou um encontro dos\nparlamentares expulsos com intelectuais e dissidentes do diretório\nfluminense, em que foi redigido e divulgado o manifesto intitulado “Por\numa esquerda socialista e democrática”, procurando aglutinar forças para\nconstruir um novo partido. No mês de abril, foi eleito vice-presidente\nda Associação Brasileira de Imprensa (ABI) para o triênio 2004-2007. Em\njunho, em Brasília, foi um dos 101 fundadores do Partido Socialismo e\nLiberdade (Psol) e, com a formalização de aliança do novo partido com o\nPCdoB, assumiu oficialmente a coordenação da campanha de Jandira Feghali\npara a prefeitura do Rio de Janeiro. Em 2005, dedicou-se à campanha\nnacional para o registro oficial do Psol e às atividades de\nvice-presidente da ABI, onde, em abril, após romper com o presidente da\ncasa, Maurício Azedo, articulou a formação da chapa de oposição na\neleição para renovar 1/3 dos conselheiros.\n\nEm outubro de 2006, concorreu ao governo do Rio de Janeiro pela aliança\ndo Psol com o PSTU e o Partido Comunista Brasileiro (PCB), obteve a\nsétima colocação, com 1,44% dos votos válidos. Em 2007, assumiu a\npresidência da Fundação Lauro Campos, criada em abril visando à formação\nde quadros partidários e à pesquisa e divulgação de temas de interesse\ndo Psol. No ano seguinte, participou da campanha de Chico Alencar para\nprefeito do Rio de Janeiro. Em 2009, defendeu a candidatura de Heloísa\nHelena a presidente da República na disputa interna do Psol com Plínio\nde Arruda Sampaio.\n\nCasou-se com Rosane Andrade Aguiar, com quem teve um filho.\n\n*MoisésArioza/LuísOtávio de Sousa/Sinclair Cechine*\n\nFONTES: *Almanaque Abril* (1998); Arquivo premium o globo; CÂM. DEP.\n\\<www.camara.gov.br/\\>; CÂM. DEP. *Deputados brasileiros*. Repertório\n(1995-1999); Congresso em Foco. Disponível em:\n\\<www.congressoemfoco.ig.com.br/\\>; *Folha de S.Paulo* (31/1/1995,\n14/1/1996, 30/1/1997, 5/2, 29/9/1998); *Folha*. Disponível em:\n\\<ww1.folha.uol.com.br\\>; FUND, LAURO CAMPOS. Disponível em:\n\\<www.fundacaolaurocampos.com.br/\\>. *Globo* (22/11/1992, 20/3/1996,\n5/2/1997, 7/10/1998); INF. BIOG.; *Jornal do Brasil* (27/12/1994);Mílton\nTemer. Internet; TRIB. SUP. ELEIT. *Candidatos*(1998).\n","ref":"FONTES: *Almanaque Abril* (1998); Arquivo premium o globo; CÂM. DEP.\n\\<www.camara.gov.br/\\>; CÂM. DEP. *Deputados brasileiros*. Repertório\n(1995-1999); Congresso em Foco. Disponível em:\n\\<www.congressoemfoco.ig.com.br/\\>; *Folha de S.Paulo* (31/1/1995,\n14/1/1996, 30/1/1997, 5/2, 29/9/1998); *Folha*. Disponível em:\n\\<ww1.folha.uol.com.br\\>; FUND, LAURO CAMPOS. Disponível em:\n\\<www.fundacaolaurocampos.com.br/\\>. *Globo* (22/11/1992, 20/3/1996,\n5/2/1997, 7/10/1998); INF. BIOG.; *Jornal do Brasil* (27/12/1994);Mílton\nTemer. Internet; TRIB. SUP. ELEIT. *Candidatos*(1998).\n","dic":"DPRRJ"}
