{"title":"TINOCO, Brígido","cargoss":["Prefeito","Constituinte","Deputado federal","Deputado federal","Ministro da Educação","Deputado federal","Deputado federal","Deputado federal"],"cargos_esp":["Niterói",0,0,0,0,0,0,0],"datas_ini":[1945,1946,1959,1946,1961,1971,1966,1961],"datas_fim":[1945,1946,1961,1955,1961,1979,1966,1963],"estados":[0,0,"RJ","RJ",0,"RJ","RJ","RJ"],"autor":[0],"content":"**TINOCO, Brígido**\n\n\\* pref. Niterói 1945; const. 1946; dep. fed. RJ 1946-1955 e 1959-1961;\nmin. Educ. 1961; dep. fed. RJ 1961-1963, 1966 e 1971-1979.\n\n*Brígido Fernandes Tinoco* nasceu em Niterói, então capital do estado do\nRio de Janeiro, no dia 28 de setembro de 1910, filho de Mário Alves\nTinoco e de Ana Fernandes Tinoco. Seu pai era farmacêutico e sua mãe\nex-operária de uma fábrica de tecidos. Seu irmão, o médico Mário Alves\nTinoco Filho, foi secretário de Saúde do estado do Rio de Janeiro.\n\nConcluiu os primeiros estudos no Colégio Brasil e no Ginásio Bittencourt\nSilva, em sua cidade natal, e cursou o secundário no Colégio Pedro II,\nno Rio de Janeiro, então Distrito Federal. Ingressando a seguir na\nFaculdade de Direito de Niterói, fez política estudantil e em 1931 foi\neleito diretor do Centro Acadêmico Evaristo da Veiga, encabeçando a\ncampanha pela sede própria da faculdade. Ainda estudante de direito,\nlecionou na Faculdade Fluminense de Comércio, da qual viria a se tornar\nprofessor de direito constitucional e de economia, além de diretor.\nBacharelou-se em 1933.\n\nEm 1936 elegeu-se vereador na antiga capital fluminense, tendo chegado a\nexercer a liderança de seu partido na Câmara Municipal da cidade. Em\nnovembro do ano seguinte perdeu o mandato em decorrência do golpe do\nEstado Novo e da dissolução de todos os órgãos legislativos do país.\nAinda em 1937 foi nomeado pelo interventor Ernâni Amaral Peixoto\ndelegado geral da Polícia Municipal de Niterói, e exerceu o cargo até\n1938. Desse ano até 1940 atuou como secretário da Prefeitura de São\nGonçalo (RJ) durante a gestão de João Francisco Brandão Júnior, a quem\nsubstituiu ainda em 1940. No ano seguinte transferiu-se para São Paulo,\nonde ocupou o cargo de procurador da Justiça do Trabalho.\n\nEm 1942 tornou-se oficial de gabinete do ministro do Trabalho, Alexandre\nMarcondes Filho, função que exerceu até 1945. Nesse ínterim participou\ndo I e do II congressos do Trabalho, respectivamente em 1942 e 1944,\nsendo nesse último ano eleito membro do Conselho de Recursos da\nPropriedade Industrial do Brasil. Em 1945 passou a integrar a Comissão\ndo Imposto Sindical, ligada ao Ministério do Trabalho, sendo também\nnomeado secretário da Comissão da Consolidação das Leis do Trabalho\ndesse mesmo ministério.\n\nAinda em 1945, foi nomeado pelo interventor no estado do Rio, Ernâni\nAmaral Peixoto, prefeito de Niterói. Assumiu o novo cargo em fevereiro,\ntambém em substituição a Brandão Júnior, e exerceu-o até novembro\nseguinte, pouco depois da saída de Amaral Peixoto e da queda de Getúlio\nVargas e do Estado Novo (29/10/1945).\n\nNo pleito de dezembro desse mesmo ano elegeu-se deputado pelo Rio de\nJaneiro à Assembleia Nacional Constituinte com 7.864 votos, ficando em\nnono lugar na legenda do Partido Social Democrático (PSD). Empossado em\nfevereiro de 1946, participou dos trabalhos constituintes e, após a\npromulgação da nova Carta (18/9/1946), passou a exercer o mandato\nordinário. Foi voto vencido em janeiro de 1948, quando se manifestou\ncontra a cassação dos mandatos dos parlamentares comunistas. Membro das\ncomissões de Trabalho e Legislação Social e de Constituição e Justiça da\nCâmara dos Deputados, integrou ainda a Comissão de Inspeção dos\nPresídios e a Comissão Parlamentar de Inquérito (CPI) sobre os atos\ndelituosos da ditadura de Vargas. Em 1949 tornou-se membro da comissão\ndiretora do Centro de Estudos e Defesa do Petróleo e da Economia\nNacional (CEDPEN), núcleo da campanha em favor do monopólio estatal do\npetróleo, cujo conselho consultivo integrou desse ano ao seguinte.\n\nNo pleito de outubro de 1950 elegeu-se deputado federal pelo Rio de\nJaneiro na mesma legenda com 17.749 votos, tendo sido o segundo mais\nvotado em seu partido. Em 1952 representou a Câmara no Congresso\nJurídico Internacional de Genebra, na Suíça. Nas eleições de outubro de\n1954 candidatou-se ao governo do estado apoiado por uma coligação de\npartidos encabeçada pelo Partido Trabalhista Brasileiro (PTB), mas\nobteve apenas o terceiro lugar com 74.522 votos, sendo derrotado por\nMiguel Couto Filho. Nessa ocasião, já rompido com o líder pessedista\nAmaral Peixoto por causa da escolha de Miguel Couto Filho como candidato\ndo PSD, deixou esse partido e ingressou no Partido Socialista Brasileiro\n(PSB). Concluiu seu mandato na Câmara em janeiro de 1955 e, desse ano\naté 1958, integrou o Conselho Estadual de Educação.\n\nNo pleito de outubro de 1958 voltou a concorrer à Câmara dos Deputados,\ndessa vez na legenda da Aliança Popular Nacionalista – coligação formada\npelo PTB, o PSB, o Partido Democrata Cristão (PDC) e o Partido\nRepublicano (PR) –, sendo eleito com 18.364 votos, o que lhe valeu o\nquinto lugar. Assumindo o mandato em fevereiro de 1959, foi vice-líder\ndo PSB na Câmara a partir de 1960 e, nesse mesmo ano, liderou em seu\nestado uma dissidência do partido, participando da campanha de Jânio\nQuadros para a presidência da República.\n\nMinistro da Educação\n\nEm 31 de janeiro de 1961, ao se iniciar o governo de Jânio, Brígido\nTinoco assumiu a pasta da Educação. Durante sua gestão ocorreram várias\ngreves estudantis, destacando-se a da Faculdade de Direito do Recife,\nprovocada pela proibição do diretor de que a mãe de Ernesto “Che”\nGuevara pronunciasse uma conferência naquele estabelecimento. A greve\nocasionou uma desproporcional movimentação de tropas, iniciativa do\nExército que contou com o apoio do ministro da Educação e do presidente\nda República, que se recusou a receber os estudantes enquanto\npermanecessem em greve.\n\nA gestão de Brígido Tinoco caracterizou-se também pelo projeto de\ncriação de uma vasta rede de escolas ligadas ao artesanato e à\nindústria. Em agosto de 1961, quase às vésperas da renúncia de Jânio,\nfoi assinado pelo presidente da República o decreto que\ninstitucionalizava o Plano de Mobilização Nacional contra o\nAnalfabetismo. No dia 25, em virtude da renúncia de Jânio, Tinoco deixou\no Ministério da Educação.\n\nDe volta à Câmara\n\nReassumiu em seguida seu mandato de deputado federal e, já reconciliado\ncom Amaral Peixoto, voltou aos quadros do PSD, permanecendo na Câmara\naté janeiro de 1963, quando se afastou por não haver obtido sucesso em\nsua tentativa de reeleição no pleito de outubro de 1962. Entretanto, com\n13.846 votos, ficou como segundo suplente da bancada do PSD fluminense.\nEm 1965, um ano depois do movimento político-militar de 31 de março de\n1964, estagiou na Escola Superior de Guerra (ESG), onde apresentou a\ntese “Histórico das constituições da República”.\n\nCom a extinção dos partidos políticos pelo Ato Institucional n^o^ 2\n(27/10/1965) e a posterior implantação do bipartidarismo, filiou-se ao\nMovimento Democrático Brasileiro (MDB) e, de abril a agosto de 1966,\nocupou uma cadeira na Câmara em substituição a um deputado de seu\npartido que se afastou temporariamente. Não concorreu às eleições para o\nCongresso no pleito de novembro de 1966. Em 1969 tornou-se procurador\ngeral da Justiça do Trabalho, assumindo também a cátedra de direito\nadministrativo da Faculdade de Direito de Niterói.\n\nNo pleito de novembro de 1970 elegeu-se deputado federal pelo Rio de\nJaneiro na legenda do MDB. Assumiu o mandato em fevereiro de 1971 e\nainda nesse ano tornou-se vice-presidente da Comissão de Educação e\nCultura da Câmara dos Deputados. Em 1974 recusou sua candidatura ao\nSenado, sugerida por alguns correligionários do MDB, preferindo\nconcorrer em novembro à reeleição para deputado federal pelo novo estado\nque resultaria da fusão da Guanabara com o Rio de Janeiro. Eleito na\nlegenda do MDB, presidiu na legislatura iniciada em 1975 a Comissão de\nCiência e Tecnologia da Câmara dos Deputados, onde também defendeu os\ninteresses da classe dos ferroviários.\n\nEm entrevista publicada pelo *Jornal do Brasil* em 18 de julho de 1977,\nBrígido Tinoco denunciou a interferência da Central Intelligence Agency\n(CIA) no Brasil em 1960, quando esta promoveu a candidatura de Jânio\nQuadros e, paralelamente, o esvaziamento da candidatura do ex-ministro\nda Guerra, general Henrique Teixeira Lott, que era apoiado pelos\ncomunistas. Depois disso, ainda segundo Tinoco, a CIA se teria envolvido\ndiretamente nos acontecimentos que precipitaram a renúncia de Jânio,\ncomo já o fizera em relação ao suicídio de Vargas.\n\nEm 1978 voltou a romper com Amaral Peixoto. As divergências começaram\nquando, na convenção do MDB, a facção do partido fiel a Amaral preteriu\nBrígido Tinoco, apoiando, na eleição indireta de setembro de 1978,\nHamílton Xavier para vice-governador do estado do Rio de Janeiro na\nchapa encabeçada por Chagas Freitas.\n\nNo pleito de novembro seguinte voltou a se candidatar deputado federal\nna legenda do MDB pelo Rio de Janeiro, sendo derrotado por haver perdido\no apoio da facção amaralista do partido. Deixou a Câmara ao final da\nlegislatura, em janeiro de 1979. Em 1981, por não se haver filiado a\nnenhum partido depois da extinção do bipartidarismo em novembro de 1979,\ndeclarou que sua escolha dependeria da decisão de Jânio Quadros. Assim\ncomo este, filiou-se ao novo PTB de Ivete Vargas a fim de concorrer às\neleições para deputado federal pelo Rio de Janeiro em novembro de 1982.\n\nColaborador dos jornais *Diário Carioca* e *Correio da Manhã* e da\nrevista *Fon-Fon*, todos do Rio de Janeiro, foi membro da Academia\nFluminense de Letras, do Instituto Brasileiro de Direito do Trabalho e\ndo Cenáculo Fluminense de História e Letras.\n\nFaleceu no Rio de Janeiro no dia 22 de outubro de 1982, em plena\ncampanha eleitoral.\n\nEra casado com Maria da Conceição de Meneses Tinoco, filha do\nex-vereador Justino Meneses Júnior e neta do ex-deputado e ex-presidente\ninterino do estado do Rio de Janeiro (1917), Francisco Xavier da Silva\nGuimarães. O casal teve duas filhas.\n\nPublicou *Versos tristes* (1930); *Uma porção de folhas mortas* (1932);\n*Comunismo*, *fascismo e democracia* (1934); *O momento mundial e as\ndiretrizes nacionais* (1936); *Alvorada e ressurreição* (1938);\n*Fundamentos históricos do direito social* (1955); *As duas paixões de\nCaxias* (1956); *Da gênese e da codificação do direito administrativo*\n(1959); e *A vida de Nilo Peçanha* (1962).\n\nFONTES: BANDEIRA, L. *24*; CÂM. DEP. *Deputados*; CÂM. DEP. *Deputados\nbrasileiros*. Repertório; CÂM. DEP. *Relação dos dep.*; CÂM.\nDEP.*Relação nominal dos senhores*; CARVALHO, E. *Petróleo*; CISNEIROS,\nA. *Parlamentares*; *Diário do Congresso* *Nacional*; *Encic. Mirador*;\nGALVÃO, F. *Fechamento*; *Grande encic. Delta*; *Jornal do Brasil*\n(23/10/1982); NÉRI, S. *16*; Perfil (1972); SILVA, G. *Constituinte*;\nVÍTOR, M. *Cinco*.\n","ref":"FONTES: BANDEIRA, L. *24*; CÂM. DEP. *Deputados*; CÂM. DEP. *Deputados\nbrasileiros*. Repertório; CÂM. DEP. *Relação dos dep.*; CÂM.\nDEP.*Relação nominal dos senhores*; CARVALHO, E. *Petróleo*; CISNEIROS,\nA. *Parlamentares*; *Diário do Congresso* *Nacional*; *Encic. Mirador*;\nGALVÃO, F. *Fechamento*; *Grande encic. Delta*; *Jornal do Brasil*\n(23/10/1982); NÉRI, S. *16*; Perfil (1972); SILVA, G. *Constituinte*;\nVÍTOR, M. *Cinco*.\n","dic":"DPRRJ"}
