{"title":"TORRES, Celso","cargoss":["Constituinte","Deputado Estadual"],"cargos_esp":["est",0],"datas_ini":[1947,1947],"datas_fim":[1947,1948],"estados":["RJ","RJ"],"autor":[0],"content":"**TORRES, Celso**\n\n\\* const. est. RJ 1947; dep. est. RJ 1947-1948.\n\n*Celso Paulo Fernandes Torres* nasceu no município de Campos, no estado\ndo Rio de Janeiro.\n\nComeçou a trabalhar na cidade natal como ferroviário e aderiu à vida\nsindical.\n\nCom o fim da ditadura do Estado Novo (1937-1945) e a legalização do\nPartido Comunista Brasileiro (PCB), então chamado Partido Comunista do\nBrasil, candidatou-se nessa legenda a deputado estadual constituinte no\nestado do Rio de Janeiro nas eleições de 19 de janeiro de 1947. Eleito,\ntomou posse no mês seguinte. Já em 7 de maio, contudo, o PCB teve seu\nregistro cassado pelo Tribunal Superior Eleitoral (TSE), e\ndesencadeou-se a repressão sobre os núcleos comunistas em todo o país.\nAinda assim os parlamentares eleitos na legenda do partido – no estado\ndo Rio, foram cinco deputados estaduais – continuaram a exercer seus\nmandatos.\n\nEm julho de 1947, depois de promulgada a Constituição estadual, Celso\nTorres passou a exercer o mandato ordinário na Assembleia Legislativa do\nEstado do Rio de Janeiro (ALERJ). No final do ano, enviou um comunicado\nà Secretaria de Segurança Pública do estado do Rio, aprovado na\nAssembleia pelos demais parlamentares, denunciando prisão de dois\nmembros do PCB em Duque de Caxias por ocasião de uma solenidade\npromovida pelo poder local. Em um segundo encaminhamento, comunicou que\nconversava com operários na estação ferroviária de Campos quando foi\ninterpelado por dois policiais que exigiram que deixasse o local. No\nmesmo dia, ao se encontrar com operários da fábrica de tecidos da\ncidade, o grupo foi abordado por uma viatura com 14 soldados que manteve\no deputado no local até a chegada do delegado da polícia civil, que o\nliberou. Um terceiro acontecimento denunciado na Assembleia ocorreu no\ndia 3 de janeiro de 1948, quando a polícia impediu um comício em\nhomenagem a Luís Carlos Prestes no largo do Barreto, também em Campos,\nocupando o local na hora do evento. No mesmo dia, no Rio de Janeiro, a\npolícia invadiu a redação do jornal do partido, efetuando várias\nprisões.\n\nAlém das denúncias de medidas repressivas, Celso Torres defendeu em suas\ncomunicações os direitos trabalhistas da classe dos ferroviários. Suas\nprincipais críticas dirigiam-se à relação estabelecida entre o Estado\nbrasileiro e a Leopoldina Railway. Segundo o deputado, o governo\nconcedia recursos e empréstimos financeiros excessivos à empresa\nbritânica, que não os revertia aos trabalhadores, cujos salários estavam\ndefasados e cujos direitos eram preteridos. A jornada de trabalho já\nhavia sido fixada em oito horas por dia, mas na prática os ferroviários\nda companhia britânica trabalhavam em turnos de até 24 horas sem\ninterrupção. A companhia também apresentava um considerável quadro de\nafastamento de funcionários por motivo de tuberculose e acidentes sem\napresentar medidas de assistência ou indenização.\n\nEm 7 de janeiro de 1948 os deputados federais votaram a favor da\ncassação do mandato de todos os parlamentares eleitos na legenda do PCB.\nNo dia 12 de janeiro de 1948 realizou-se a última sessão da ALERJ de que\nparticiparam os deputados comunistas.\n\n*Maria de Paula de Godoy Garcia*\n\nFONTES: ASSEMB. LEGISL. RJ. *Anais* (1948); TEIXEIRA, F. *História*.\n","ref":"FONTES: ASSEMB. LEGISL. RJ. *Anais* (1948); TEIXEIRA, F. *História*.\n","dic":"DPRRJ"}
