{"title":"TORRES, Manuel Martins","cargoss":["Senador"],"cargos_esp":[0],"datas_ini":[1901],"datas_fim":[1905],"estados":["RJ"],"autor":["Raimundo Helio Lopes"],"content":"**TORRES, Manuel Martins**\n\n\\* sen. RJ 1901-1905.\n\n*Manuel Martins Torres* nasceu na cidade do Rio de Janeiro, então\ncapital do Império, em 22 de março de 1843, filho de Antônio Martins\nTorres e de Ana Joaquina Pereira de Mesquita.\n\nFormou-se na Faculdade de Direito de São Paulo, na turma de 1864, onde\nconheceu Prudente de Morais, futuro presidente da República (1894-1898),\ncom quem manteve longa amizade. Casou-se com Carlota Ferreira de Seixas,\ne em 1865 nasceu seu filho Alberto Torres, que, como o pai, também\nseguiria carreira política: foi deputado federal pelo estado do Rio de\nJaneiro (1893-1896), ministro da Justiça (1896-1897), presidente do\nestado do Rio (1897-1900) e ministro do Supremo Tribunal Federal\n(1901-1909).\n\nEntre 1866 e 1871 Manuel Martins Torres trabalhou em Cabo Frio (RJ),\nonde foi promotor e inspetor de segurança pública. Em 1872 mudou-se para\nLajes (SC) para assumir o posto de juiz de direito, e em poucos meses\ntransferiu-se para Itajaí (SC), onde exerceu a mesma função até 1876.\nAinda como juiz, em 1877 foi para Cuiabá e no ano seguinte para Abrantes\n(BA). De 1879 a 1880 foi chefe de polícia na província da Paraíba.\nEstabeleceu-se a seguir em Niterói, onde se tornou chefe político e\ningressou no Partido Liberal, sendo eleito deputado provincial.\n\nDepois que o marechal Deodoro da Fonseca, sustentado por setores do\nExército e por civis, proclamou a República em 15 de novembro de 1889,\naderiu ao novo regime. Diante de seu prestígio como chefe político de\nNiterói e um dos principais líderes do extinto Partido Liberal, em 9 de\njaneiro de 1890 foi nomeado primeiro vice-presidente do estado do Rio de\nJaneiro, sendo presidente estadual Francisco Portela (1889-1891).\nExerceu o cargo até 10 de maio de 1891, quando a primeira Assembleia\nConstituinte fluminense elegeu Francisco Portela e Artur Getúlio das\nNeves, respectivamente, presidente e vice-presidente constitucionais.\nNesse período, aproximou-se do Partido Republicano Fluminense (PRF) e\nfoi para a oposição a Portela, que durante seu governo adotou medidas\nque favoreciam seu poder pessoal em detrimento da corrente republicana\ndo estado.\n\nCom a renúncia de Deodoro da Fonseca em 23 de novembro de 1891,\nFrancisco Portela perdeu seu mais importante aliado político, e sua\nsaída do governo fluminense passou a ser exigida em uma série de\nmanifestações. Em Niterói, Martins Torres, juntamente com seu filho\nAlberto Torres e Sebastião Barroso, organizou comícios contra Portela.\nAfinal, diante das pressões, Portela renunciou em 10 de dezembro, sendo\nsubstituído por Carlos Baltasar da Silveira. O novo presidente estadual\nrevogou a Constituição Fluminense e convocou uma nova Assembleia\nConstituinte estadual, para a qual Alberto Torres foi eleito. Promulgada\na nova Constituição do estado em 9 de abril de 1892, novas eleições\nestaduais foram marcadas para o dia 24 do mesmo mês. José Tomás da\nPorciúncula foi então eleito presidente do estado, e Martins Torres, ao\nlado de Maurício de Abreu e Lourenço Maia de Almeida Batista, o barão de\nMiracema, foi eleito vice-presidente, enquanto seu filho Alberto Torres\nfoi eleito deputado estadual. Entre 12 de junho e 15 de agosto de 1893,\nperíodo em que Porciúncula esteve licenciado, Martins Torres assumiu a\npresidência do estado. Enquanto isso, em 9 de agosto de 1893, Alberto\nTorres foi eleito para preencher uma vaga de deputado federal.\n\nDurante a Revolta da Armada, levante de oposição ao presidente Floriano\nPeixoto que se estendeu de setembro de 1893 a março de 1894, sob a\nchefia do almirante Custódio de Melo e mais tarde do almirante Luís\nFelipe Saldanha da Gama, Martins Torres lutou contra os revoltosos.\nAssumiu também interinamente a chefatura de polícia da cidade do Rio de\nJaneiro, então Distrito Federal.\n\nNa sucessão de Porciúncula, em 1894, apoiou a eleição de Maurício de\nAbreu para a presidência estadual. Em 1896, participou da reorganização\ndo PRF, na qual a liderança de Porciúncula foi consolidada, em oposição\nà facção chefiada pelo barão de Miracema. Com a nova configuração\npartidária, tornou-se membro da comissão executiva do partido e chefe\npolítico da agremiação no primeiro distrito eleitoral do estado, com\nsede em Niterói, composto também pelos municípios de Magé, Itaboraí, Rio\nBonito, Araruama, Saquarema e Maricá.\n\nEm 1898 foi eleito deputado estadual na legenda do PRF com 4.384 votos.\nContudo, com a eleição de seu filho Alberto Torres para a presidência do\nestado (1897-1900), o PRF sofreu uma cisão. O novo presidente estadual\nrebelou-se contra a liderança partidária de Porciúncula, agora senador\n(1897-1901), que exigia que o Executivo estadual fortalecesse seu\npartido. Ao lado de seus aliados na Assembleia Legislativa do Rio de\nJaneiro (ALERJ), Porciúncula chegou a articular uma tentativa de\n*impeachment* de Alberto Torres. A tensão ficou expressa nas bancadas\nestaduais e federais da agremiação, que se dividiram em torno dos dois\nlíderes. Diante dessa situação, em maio de 1899 Martins Torres e outros\ntrês membros da comissão executiva do PRF renunciaram a seus cargos\ndentro da agremiação e em 23 de julho fundaram o Partido Republicano do\nRio de Janeiro (PRRJ), liderado por Alberto Torres. No PRRJ, Martins\nTorres integrou a comissão executiva e continuou à frente do primeiro\ndistrito eleitoral do estado, o que lhe garantiu a reeleição para\ndeputado estadual no pleito realizado em 30 de dezembro de 1900, com\n4.605 votos. Contudo, não chegou a assumir sua cadeira na ALERJ, pois\nfoi eleito senador na vaga aberta com a renúncia de Quintino Bocaiúva,\nque fora eleito presidente do estado do Rio de Janeiro (1900-1903).\n\nEmpossado no Senado em junho de 1901, ainda nesse ano Martins Torres\nenvolveu-se nas discussões acerca da mudança da capital fluminense,\ntransferida para Petrópolis desde 1894, devido à Revolta da Armada.\nNessa disputa, foi contrário ao retorno da capital para Niterói, mas seu\ngrupo foi derrotado pelas forças políticas favoráveis à mudança, ligadas\nao então deputado federal Nilo Peçanha (1890-1902). Em 1902, na sucessão\ndo presidente da República Campos Sales (1898-1902), não apoiou Quintino\nBocaiúva, candidato defendido pela maioria das oligarquias fluminenses,\ne sim Rodrigues Alves, que foi vitorioso. No Senado, passou a defender o\nnovo presidente da República e a fazer certa oposição ao recém-eleito\npresidente fluminense Nilo Peçanha (1903-1906). Ficou, assim, contra o\ngoverno de Nilo e ao lado do governo federal nos debates acerca do\nmonopólio da União sobre parte das exportações de areias monazíticas\ndescobertas em território fluminense.\n\nFaleceu na cidade do Rio de Janeiro em 16 de dezembro de 1905.\n\nPublicou *Regulamentos para a arrecadação do selo, cobrança de\nemolumentos das repartições públicas e impostos de transmissão de\npropriedade* (1875) e *Lei Hipotecária, Lei n^o^ 1.237, de 24 setembro\nde 1864, e Decreto n^o^ 3.453, de 26 de abril de 1865* (1876).\n\n*Raimundo Helio Lopes*\n\nFONTES: ABRANCHES, J. *Governos*; COL. BRAS. GENEALOGIA. Disponível em:\n\\<www.cbg.org.br/arquivos\\_genealogicos\\_r\\_02.html\\>. Acesso em:\n4/4/2011. FERREIRA, M. *República*; LACOMBE, L. *Chefes*; LEITE NETO, L.\n*Catálogo*.\n","ref":"FONTES: ABRANCHES, J. *Governos*; COL. BRAS. GENEALOGIA. Disponível em:\n\\<www.cbg.org.br/arquivos\\_genealogicos\\_r\\_02.html\\>. Acesso em:\n4/4/2011. FERREIRA, M. *República*; LACOMBE, L. *Chefes*; LEITE NETO, L.\n*Catálogo*.\n","dic":"DPRRJ"}
