{"title":"TORRES, Vasconcelos","cargoss":["Constituinte","Deputado Estadual","Deputado federal","Senador"],"cargos_esp":["est",0,0,0],"datas_ini":[1947,1947,1959,1963],"datas_fim":[1947,1959,1963,1979],"estados":["RJ","RJ","RJ","RJ"],"autor":[0],"content":"**TORRES, Vasconcelos**\n\n\\* const. est. RJ 1947; dep. est. RJ 1947-1959; dep. fed. RJ 1959-1963;\nsen. RJ 1963-1979.\n\n*João Batista de Vasconcelos Torres* nasceu em Campos (RJ) no dia 2 de\nabril de 1920, filho de Rosalvo Martins Torres e de Zélia Vasconcelos\nRosa Torres.\n\nFez o curso primário no Colégio Brasil, em Niterói, então capital do\nestado do Rio de Janeiro, e o secundário no Instituto de Educação da\nmesma cidade.\n\nDurante o Estado Novo (1937-1945) foi oficial do Gabinete Civil do\ninterventor no estado, Ernâni Amaral Peixoto. Em 1944 bacharelou-se em\nciências jurídicas e sociais pela Faculdade de Direito de Niterói, e no\nano seguinte tornou-se advogado do Banco do Brasil, atividade que\nexerceria até 1959. De 1947 a 1949 foi também professor de sociologia da\nEscola de Estado-Maior do Exército, no Distrito Federal.\n\nEm janeiro de 1947 elegeu-se deputado à Assembleia Constituinte do\nEstado do Rio de Janeiro na legenda do Partido Social Democrático (PSD),\nassumindo o mandato em março do mesmo ano. Participou dos trabalhos\nconstituintes e, com a promulgação da nova Carta estadual, passou a\nexercer o mandato ordinário. Eleito deputado estadual nos pleitos de\noutubro de 1950 e 1954, sempre na legenda do PSD, foi presidente da\nAssembleia Legislativa.\n\nEm outubro de 1958 elegeu-se deputado federal pelo Rio de Janeiro, na\nlegenda do PSD, e assumiu o mandato na Câmara em fevereiro do ano\nseguinte, após deixar a Assembleia fluminense. Eleito vice-líder da\nmaioria e do PSD na Câmara em julho de 1960, foi autor da emenda\nconstitucional que manteve o Correio Aéreo Nacional, e de diversos\nprojetos, entre eles o que transformava o aprendizado industrial em nova\nmodalidade de prestação do serviço militar, e o que impedia que fossem\ndados nomes de pessoas vivas a localidades e ruas. Favorável à\nnacionalização das companhias de seguros, integrou as comissões de\nJustiça, de Transportes e de Relações Exteriores da Câmara.\n\nRompendo com seu partido em 1962, ingressou no Partido Trabalhista\nBrasileiro (PTB), e nessa legenda foi eleito senador pelo Rio de Janeiro\nem outubro do mesmo ano. Concluiu mandato na Câmara em janeiro de 1963,\ntomou posse no Senado em fevereiro, e no mês seguinte tornou-se\nvice-líder da maioria, constituída pelo PTB e o PSD, e do governo,\nfunções que exerceu até março de 1965. Foi membro da comissão diretora\nde 1963 a 1968 e terceiro suplente da mesa do Senado de 1963 a 1965. Com\na extinção dos partidos políticos pelo Ato Institucional n^o^ 2\n(27/10/1965) e a posterior instauração do bipartidarismo, filiou-se à\nAliança Renovadora Nacional (Arena), partido de apoio ao governo militar\ninstalado em 1964. Em março de 1967 tornou-se vice-líder da Arena no\nSenado. Presidiu ainda a Comissão de Serviço Público Civil, foi\nvice-presidente da Comissão de Transportes, Comunicações e Obras\nPúblicas e membro efetivo das comissões do Distrito Federal, de Ajustes\nInternacionais e Legislação sobre Energia Atômica, e de Finanças, além\nde suplente das comissões de Constituição e Justiça, de Minas e Energia,\ne de Saúde.\n\nFoi reeleito para o Senado em novembro de 1970, ainda na legenda da\nArena, e iniciou o novo mandato em fevereiro de 1971. Autor da lei de\nemancipação do município de Volta Redonda (RJ) e da lei que criou a\nUniversidade Federal Fluminense (UFF), em Niterói, foi vice-presidente\nda Comissão de Economia e membro das comissões de Agricultura e de\nSegurança Nacional, chegando a exercer a vice-presidência desta última\nem 1975. Derrotado no pleito de novembro de 1978, quando buscava a\nreeleição na legenda da Arena, encerrou seu mandato em janeiro de 1979,\ndeixando o Senado e retornando a Niterói.\n\nCom a extinção do bipartidarismo em 29 de novembro de 1979 e a\nconsequente reformulação partidária, filiou-se em janeiro de 1981 ao\nPartido Popular (PP). Em abril de 1981 foi nomeado pelo governador\nChagas Freitas presidente do Instituto de Previdência do Estado do Rio\nde Janeiro (IPERJ), sucedendo ao deputado Ário Teodoro. Renunciou ao\ncargo em fevereiro de 1982, sendo substituído por Paulo Ribeiro, para se\ncandidatar ao Senado na legenda do PP nas eleições de novembro. No\nentanto, com a incorporação do PP ao Partido do Movimento Democrático\nBrasileiro (PMDB), ainda em fevereiro de 1982, filiou-se a este último e\nabriu mão de sua candidatura.\n\nAdvogado da companhia A Equitativa de Seguros e professor de sociologia\nda Fundação Getulio Vargas, fez curso de extensão em sociologia rural na\nUniversidade de Purdue, nos Estados Unidos. Pertenceu à Academia\nFluminense de Letras, à Sociedade de Geografia de Lisboa, à Associação\nFluminense de Jornalistas e ao Instituto Histórico de Petrópolis.\n\nFaleceu no Rio de Janeiro, no dia 25 de setembro de 1982.\n\nEra casado com Carlota de Vasconcelos Torres, com quem teve quatro\nfilhos. Sua filha Ana Clara Vasconcelos Torres casou-se com Wellington\nMoreira Franco, governador do estado do Rio de Janeiro (1987-1991),\ndeputado federal (1975-1977, 1995-1999 e 2003-2007) e ministro da\nSecretaria de Assuntos Estratégicos a partir de 2011.\n\nVasconcelos Torres publicou *Problemas do município de Parati*;\n*Cooperativismo*; *Grande Brasil*; *Conceito de religião entre as\npopulações rurais do Brasil*; *Ensaio de sociologia rural brasileira*;\n*Movimentos migratórios das populações rurais brasileiras*; *Oliveira\nViana, sua vida e sua obra*; *Condições de vida do trabalhador na\nagroindústria do açúcar*; *Fundamentos objetivos da comunidade\nluso-brasileira*; *Minhas lutas no Senado em favor dos trabalhadores*;\n*Imunidades parlamentares e os vereadores*; *Reforma do Poder\nLegislativo e unificação de serviços*; *Mar territorial e Marinha de\nGuerra*; *Aviação – presença antiga na integração nacional*; *Uma face\ndo problema agrário fluminense*; *A mobilidade rural brasileira*;\n*Comandante Ari Parreiras*; e *Itamarati – verdade e mentira*.\n\nFONTES: CÂM. DEP. *Deputados*; CÂM. DEP. *Relação dos dep.*; CÂM. DEP.\n*Relação nominal dos senhores*; COUTINHO, A. *Brasil*; *Diário do\nCongresso Nacional*; *Globo* (1, 2/4/1981, 11/2, 26/9/1982); GURGEL, H.\n*Governo*; *Jornal do Brasil* (30/5, 21/11/1978, 1/4/1981, 27/9/1982);\nNÉRI, S. *16*; *Perfil* (1972); SENADO. *Dados*; SENADO. *Dados\nbiográficos*; SENADO. *Endereços*; SENADO. *Relação*; SENADO. *Relação\ndos líderes*; TRIB. SUP. ELEIT. *Dados* (1-6, 9); VAITSMAN, M. *Sangue*.\n","ref":"FONTES: CÂM. DEP. *Deputados*; CÂM. DEP. *Relação dos dep.*; CÂM. DEP.\n*Relação nominal dos senhores*; COUTINHO, A. *Brasil*; *Diário do\nCongresso Nacional*; *Globo* (1, 2/4/1981, 11/2, 26/9/1982); GURGEL, H.\n*Governo*; *Jornal do Brasil* (30/5, 21/11/1978, 1/4/1981, 27/9/1982);\nNÉRI, S. *16*; *Perfil* (1972); SENADO. *Dados*; SENADO. *Dados\nbiográficos*; SENADO. *Endereços*; SENADO. *Relação*; SENADO. *Relação\ndos líderes*; TRIB. SUP. ELEIT. *Dados* (1-6, 9); VAITSMAN, M. *Sangue*.\n","dic":"DPRRJ"}
