{"title":"TRANJAN, Alfredo","cargoss":["Deputado Estadual"],"cargos_esp":["GB"],"datas_ini":[1963],"datas_fim":[1969],"estados":[0],"autor":[0],"content":"**TRANJAN, Alfredo**\n\n\\* dep. est. GB 1963-1969.\n\n*Alfredo Tranjan* nasceu na cidade de Santos (SP) no dia 27 de março de\n1914, filho de Gabriel Tranjan e de Garibe Tranjan, imigrantes vindos da\nAntioquia, então região da Síria. Mudou-se com a família em 1927 para o\nRio de Janeiro, então Distrito Federal e, dois anos mais tarde, foi\nmatriculado no terceiro ano do Colégio Pedro II.\n\nComeçou a trabalhar ainda jovem, no estabelecimento comercial de seu\npai. Em 1931 entrou para a Faculdade Nacional de Direito. Formou-se em\n1936 e estreou no tribunal do júri já no ano seguinte, como advogado\ncriminal. Na década de 1940 foi também advogado e presidente do\nBonsucesso Futebol Clube. Em 1955 filiou-se à Liga pela Defesa da\nLegalidade, criada pelo advogado Evandro Lins e Silva para defender a\nrealização das eleições presidenciais daquele ano, que se achavam\nameaçadas pela União Democrática Nacional (UDN) e por setores das forças\narmadas. Trabalhou no 1^o^ e no 2^o^ Tribunal de Júri do Distrito\nFederal.\n\nNas eleições de outubro de 1962 candidatou-se a deputado estadual no\nestado da Guanabara pela legenda do Partido Social Trabalhista (PST).\nObteve a primeira suplência do partido. Assumiu o mandato em várias\nocasiões no ano de 1963. Em abril de 1964 foi efetivado na vaga com a\ncassação do titular com base no Ato Institucional n^o^ 1 (AI-1)\ndecretado pelo regime militar, que fora instaurado no país em 31 de\nmarço daquele ano. Na assembleia foi escolhido vice-líder do PST e\nfirmou-se na oposição ao governador Carlos Lacerda, da UDN.\n\nApesar de confessar sua desconfiança em relação ao governo do\nex-presidente João Goulart, que, em sua opinião, fazia uma “política\nenlouquecida” no país, Alfredo Tranjan não apoiou o novo regime, que\nchamou de “quartelada”. Já no fim de 1964 passou a integrar o Bloco\nParlamentar de Resistência Democrática. Em 1965 saiu do PST e filiou-se\nao Partido Trabalhista Brasileiro (PTB). Com a decretação do Ato\nInstitucional n^o^ 2 (AI-2), de outubro de 1965, que extinguiu os\npartidos políticos existentes e instaurou o bipartidarismo, Alfredo\nTranjan filiou-se ao Movimento Democrático Brasileiro (MDB), partido da\noposição ao governo. Na sessão legislativa de 1966 integrou a Comissão\nde Constituição e Justiça e a Comissão Temporária de Emendas\nConstitucionais; participou também da CPI do jogo do bicho. Nas eleições\nde novembro de 1966 foi reeleito na legenda do MDB, assumiu o novo\nmandato em fevereiro seguinte e presidiu a Comissão de Constituição e\nJustiça. Em abril atuou como advogado da República Popular da Polônia\njunto ao Supremo Tribunal Federal (STF) no caso de extradição do\nfugitivo nazista Franz Stangl que fora preso em São Paulo.\n\nEm 1968 tornou-se vice-líder do governo na assembleia e vice-presidente\nda Comissão de Economia, Viação e Obras Públicas. Foi relator da\nComissão Parlamentar de Inquérito (CPI) que apurou a morte do estudante\nEdson Luís, acontecida durante um confronto entre a polícia e estudantes\nem março daquele ano no centro da cidade do Rio de Janeiro e que\nprovocou grave crise política. Em 14 de março de 1969 teve o mandato\ncassado e seus direitos políticos suspensos com base no Ato\nInstitucional n^o^ 5 (AI-5) que fora baixado em 13 de dezembro de 1968.\n\nDedicou-se então à advocacia. Em 1977 foi aprovado para juiz no 2^o^\nTribunal de Alçada do estado do Rio de Janeiro. Permaneceu no Tribunal\naté 1984, quando foi aposentado compulsoriamente.\n\nFaleceu no dia 19 de maio de 1995.\n\nEm sua homenagem, o presídio Bangu II, localizado na cidade do Rio,\nrecebeu o nome de Penitenciária Alfredo Tranjan.\n\nFoi casado com Aurora, com quem teve dois filhos.\n\nPublicou *A beca surrada: meio século no foro criminal* (1994).\n\n*Paulo Celso Corrêa*\n\nFONTES: ASSEMB. LEGISL. GB. *Anais*; TRANJAN, A. *Beca*.\n","ref":"FONTES: ASSEMB. LEGISL. GB. *Anais*; TRANJAN, A. *Beca*.\n","dic":"DPRRJ"}
