{"title":"TROTTA, Frederico","cargoss":["Deputado Estadual","Constituinte","Deputado Estadual"],"cargos_esp":["GB","est",0],"datas_ini":[1963,1975,1975],"datas_fim":[1974,1975,1980],"estados":[0,"RJ","RJ"],"autor":["Daniela Yabeta"],"content":"**TROTTA, Frederico**\n\n\\* militar; dep. est. GB 1963-1974; const. est. RJ 1975; dep. est. RJ\n1975-1980.\n\n*Frederico Trotta* nasceu no Rio de Janeiro, então Distrito Federal, no\ndia 27 de agosto de 1899, filho do imigrante italiano Diomedes Trotta e\nde Rosaria Araújo Trotta.\n\nDe origem humilde, iniciou os estudos primários em casa, sob a\norientação de seu pai. Mais tarde, trabalhou como operário durante o\ndia, enquanto cursava a escola noturna São José. Terminou os estudos\nsecundários no ginásio São Bento, sentou praça em 30 de novembro de 1918\ne ingressou na Escola Militar do Realengo. Em janeiro de 1924 tornou-se\naspirante, em julho foi promovido a segundo-tenente e um ano depois a\nprimeiro tenente. Em 1927 publicou seu primeiro livro, uma antologia\nsentimental intitulada *Mãe*. Em fevereiro de 1933 foi promovido a\ncapitão por merecimento.\n\nEm 1934 foi eleito vereador no Distrito Federal na legenda do Partido\nAutonomista. Dentro do partido, fazia parte da corrente de “renovadores\ntenentistas”, ao lado de Augusto Amaral Peixoto e Átila Soares, e\ndefendia a autonomia política da cidade do Rio de Janeiro, ou seja, o\ndireito de os cariocas elegerem seu prefeito, até então nomeado pelo\npresidente da República. Apresentou também à Câmara Municipal o projeto\nde criação da “língua brasileira” com base no argumento de que a língua\nfalada no Brasil era muito diversa da falada em Portugal. Após a saída\nde Anísio Teixeira da Diretoria da Instrução Pública do Distrito\nFederal, Francisco Campos ocupou o lugar deste e logo decidiu pôr a\nideia em prática. Em consequência, ocorreram manifestações de apoio a\nFrederico Trotta e a Francisco Campos, com repercussão continuada na\nimprensa, o que pôs em evidência discussões sobre a ortografia. Federico\nTrotta exerceu seu mandato até 10 de novembro de 1937, quando, com a\nimplantação do Estado Novo, foram suprimidos todos os órgãos\nlegislativos do país.\n\nEm 1942 fez o curso da Escola de Estado Maior do Exército e em outubro\nfoi promovido a major por antiguidade. Em 7 de fevereiro de 1946 foi\nnomeado pelo então presidente da República Eurico Gaspar Dutra\n(1946-1951) governador do território federal do Iguaçu. Foi o segundo e\núltimo governador do território do Iguaçu, que havia sido criado em 13\nde setembro de 1943, englobando parte dos territórios do Paraná e de\nSanta Catarina, e foi extinto pela Constituição de 1946. Durante os seis\nmeses em que permaneceu no governo, criou uma escola normal, cursos\nsupletivos, grupos escolares, bibliotecas e clubes agrícolas para\nmelhoramento genético das sementes que eram distribuídas gratuitamente\naos agricultores da região.\n\nAo deixar o território do Iguaçu, tomou posse em 1947 como primeiro\ngovernador do também recém-criado território federal de Guaporé, hoje\nestado de Rondônia. Assim como fez em Iguaçu, durante seu governo criou\no curso normal regional, que recebeu a denominação de Carmela Dutra. O\ncorpo docente era constituído por professores registrados no Ministério\nda Educação, e o curso tinha como finalidade formar professores,\nnecessários às escolas primárias da região. Em 25 de março de 1948 foi\npromovido a tenente-coronel, em 25 de julho de 1952 foi promovido a\ncoronel por antiguidade, e anos depois, entre 1957 e 1958, foi\nreformado.\n\nNo pleito de outubro de 1958, elegeu-se novamente vereador no Distrito\nFederal pelo Partido Social Democrático (PSD). Em 14 de abril de 1960,\nàs vésperas da inauguração de Brasília, o presidente da República\nJuscelino Kubitschek (1956-1961) publicou um decreto, conhecido como Lei\nSantiago Dantas, que estabelecia as normas para a criação do estado da\nGuanabara. No dia 21 de abril, concomitantemente à inauguração da nova\ncapital, deveria ser instalada a Assembleia Legislativa do Estado da\nGuanabara (ALEG), e os vereadores do antigo Distrito Federal, eleitos em\n1958, passariam a deputados estaduais da nova unidade da Federação, ao\nlado dos deputados constituintes que seriam eleitos no final de 1960. A\neleição de 3 de outubro de 1960 elegeu os parlamentares que formariam a\nAssembleia Constituinte. No entanto, em uma articulação política, e\ncontrariando a Lei San Tiago Dantas, esses deputados inseriram na nova\nCarta constitucional um dispositivo que impedia que os antigos\nvereadores permanecessem automaticamente na ALEG, a não ser que tivessem\nsido eleitos em 1960. Na primeira legislatura da ALEG havia apenas 30\ndeputados, e somente na legislatura seguinte haveria os 55 que iriam\nrepresentar proporcionalmente os eleitores do estado. Dessa forma,\nFederico Trotta encerrou seu mandato na Câmara Municipal em 1961.\n\nElegeu-se pela primeira vez deputado estadual na Guanabara pelo Partido\nTrabalhista Brasileiro (PTB) em 7 de outubro de 1962, e tomou posse em\n1^o^ de fevereiro de 1963. Com a extinção dos partidos pelo Ato\nInstitucional n^o^ 2 em outubro de 1965, e a posterior instituição do\nbipartidarismo, filiou-se ao Movimento Democrático Brasileiro (MDB),\npartido de oposição ao regime militar instaurado no país em abril de\n1964. Em 1966, foi eleito vice-presidente da Mesa Diretora da ALEG.\n\nNo pleito seguinte, realizado em 15 de novembro de 1966, reelegeu-se\ndeputado estadual na Guanabara, na legenda do MDB. Foi autor, em 1967,\ndo Projeto de Lei n^o^ 181, que tranformava o bairro de Campo Grande em\ncidade. Em 14 de junho de 1968 o projeto foi transformado em lei (n^o^\n1.627/1968), assinada pelo então governador do estado Francisco Negrão\nde Lima (1965-1971), mas esta foi posteriormente revogada. Em 1970, foi\nnovamente eleito vice-presidente da Mesa Diretora da ALEG.\n\nEm novembro de 1970 elegeu-se pela terceira vez deputado estadual na\nGuanabara. Tomou posse em 1^o^ de fevereiro de 1971, e em novembro de\n1974 voltou a ser eleito. O presidente Ernesto Geisel havia enviado um\nprojeto de lei ao Congresso Nacional que previa a fusão dos estados da\nGuanabara e do Rio de Janeiro, o qual, depois de rápida tramitação, fora\ntransformado em lei em julho de 1974. Os deputados estaduais eleitos em\nnovembro de 1974 pelos dois antigos estados tomaram posse em 1^o^ de\nfevereiro de 1975, e em 15 de março passaram a formar a Assembleia\nConstituinte encarregada de elaborar a Constituição do novo estado do\nRio de Janeiro. Nesse mesmo dia tomou posse o governador nomeado\nalmirante Faria Lima e consumou-se a fusão.\n\nNa Assembleia Constituinte, Frederico Trotta presidiu a Comissão\nConstitucional. Na ocasião seu nome recebeu o apoio da maioria\nemedebista ligada a Chagas Freitas, que defendia que os trabalhos\nconstituintes não se prolongassem no tempo. Em apenas quatro meses a\nnova Carta foi finalizada e, com sua promulgação em 23 de julho de 1975,\nos constituintes passaram a exercer o mandato ordinário na Assembleia\nLegislativa do Estado do Rio de Janeiro (ALERJ). Em 1977, Trotta\npreocupou-se em instituir datas comemorativas no estado do Rio de\nJaneiro, como por exemplo o Dia do Jornalismo (7 de abril), o Dia do\nMestre (15 de outubro), o Dia do Vendedor e o Dia do Distribuidor de\nJornais e Revistas (primeiro domingo depois da Páscoa cristã), o Dia do\nComércio (terceira segunda-feira de outubro) e o Dia da Igualdade da\nMulher (26 de agosto).\n\nNas eleições de novembro de 1978 elegeu-se mais uma vez deputado\nestadual. Empossado em fevereiro de 1979, foi eleito presidente da\nComissão de Constituição e Justiça da ALERJ. Faleceu em dezembro de\n1980, em pleno exercício do mandato.\n\nEra casado com Ludímia Trotta, com quem teve três filhos.\n\nComo jornalista, colaborou nos períodicos cariocas *O Jornal* e *Diário\ndo Povo*. Foi correspondente de *A Tarde*, de Curitiba, e da *Arcádia*\nde Porto Alegre. Foi ainda membro da Academia Carioca de Letras, da\nAcademia Brasileira de Educação, do Instituto Histórico e Geográfico\nBrasileiro, da Academina Guanabara de Letras, do Instituto de\nProfessores Públicos e Particulares, da Academia de Letras e Artes de\nParacambi, da Academia de Letras do Estado do Rio de Janeiro, da\nAcademia Brasileira de Belas Artes, da Academia Acreana de Letras e do\nCenáculo Brasileiro de Letras e Artes.\n\nPublicou vários livros, entre os quais *Floriano* (1940); *General\nDutra* (1945); *Território federal do Iguaçu* (1947); *Território\nfederal do Guaporé* (1948); *Breviário do recruta* (1953); *Da perda de\nmandato por mudança de partido* (1955); *História de Duque de Caxias*\n(1956); *Meu pai, meu bom amigo* (1957); *Um roseiral para alegrar a\nvista* (1957); *O talismã do cabo Pierre* (1957); *A promoção\nautomática* (1959); *A Constituição do Estado da Guanbara* (1960); *A\nfundação da cidade do Rio de Janeiro* (1965); *Poetas cariocas em 400\nanos* (1966); *Manual da política contemporânea* (1975); *Manifestação\nsobre o Acordo Termonuclear* (1975); *Independência do Brasil – Quem?\nComo? Onde?* (1978); e *O sistema parlamentar brasileiro*. Traduziu,\nainda, *Lições de Guerra da Espanha* (1941) e *Educação moral do\nsoldado* (1942).\n\n*Daniela Yabeta*\n\nFONTES: BARRETO, E. *Lavoura*; História de São Gonçalo: memória e\nidentidade. *Entrevista realizada com Josias Ávila Júnior* (10/2010).\nDisponível em: \\<http://historiadesaogoncalo.pro.br/hist\\_oral.htm\\>.\nAcesso em: 17/11/2010; *Jornal do Brasil* (2/2/1979, p. 5); MELLO, M.\n*Parlamento*;SARMENTO, C. *Espelho*; *Veja*. Os sub-bairros cariocas\n(2/8/2011). Disponível em:\n\\<http://vejario.abril.com.br/blog/as-ruas-do-rio/bairro-a-bairro/os-sub-bairros-cariocas-ultima-parte\\>.\nAcesso em: 3/10/2011. Wikipédia. *Lista de prefeitos de São Gonçalo*.\nDisponível em:\n\\<http://pt.wikipedia.org/wiki/Anexo:Lista\\_de\\_prefeitos\\_de\\_S%C3%A3o\\_Gon%C3%A7alo\\_%28Rio\\_de\\_Janeiro%29\\>.\nAcesso em: 23/11/2010.\n","ref":"FONTES: BARRETO, E. *Lavoura*; História de São Gonçalo: memória e\nidentidade. *Entrevista realizada com Josias Ávila Júnior* (10/2010).\nDisponível em: \\<http://historiadesaogoncalo.pro.br/hist\\_oral.htm\\>.\nAcesso em: 17/11/2010; *Jornal do Brasil* (2/2/1979, p. 5); MELLO, M.\n*Parlamento*;SARMENTO, C. *Espelho*; *Veja*. Os sub-bairros cariocas\n(2/8/2011). Disponível em:\n\\<http://vejario.abril.com.br/blog/as-ruas-do-rio/bairro-a-bairro/os-sub-bairros-cariocas-ultima-parte\\>.\nAcesso em: 3/10/2011. Wikipédia. *Lista de prefeitos de São Gonçalo*.\nDisponível em:\n\\<http://pt.wikipedia.org/wiki/Anexo:Lista\\_de\\_prefeitos\\_de\\_S%C3%A3o\\_Gon%C3%A7alo\\_%28Rio\\_de\\_Janeiro%29\\>.\nAcesso em: 23/11/2010.\n","dic":"DPRRJ"}
