{"title":"VALE, Cândido Alves Mourão do","cargoss":["Deputado Estadual"],"cargos_esp":[0],"datas_ini":[1895],"datas_fim":[1897],"estados":["RJ"],"autor":[0],"content":"**VALE, Cândido Alves Mourão do**\n\n\\* dep. est. RJ 1895-1897.\n\n*Cândido Alves Mourão do Vale* candidatou-se deputado estadual no estado\ndo Rio de Janeiro pelo primeiro distrito, com sede em Niterói, nas\neleições realizadas em 1894, filiado ao Partido Republicano Fluminense\n(PRF). O partido congregava a oligarquia fluminense, unindo lideranças\nmonarquistas e republicanas, e ascendeu ao poder com a queda do\ninterventor de Francisco Portela (1890-1891).\n\nO pleito de 1894 foi vencido pelo PRF. Para o governo foi eleito\nMaurício de Abreu e para o Legislativo estadual a chapa do partido foi\nvitoriosa, uma vez que a oposição não apresentou candidatos, optou por\npraticar a abstenção total. Candido Alves Mourão do Valle foi eleito e\ndiplomado para a legislatura estadual de 1895 a 1897. Em 1895 foi eleito\npara a Comissão de Obras Públicas da Assembleia Legislativa do Estado do\nRio de Janeiro (ALERJ), sendo reeleito em 1896 e em 1897.\n\nApós esta legislatura não ocupou cargos políticos no estado.\n\n*Samuel Silva Rodrigues de Oliveira*\n\nFONTES: ASSEMB. LEGISL. RJ. *Anais*(1895, 1897); FERREIRA, M.\n*República*.\n","ref":"FONTES: ASSEMB. LEGISL. RJ. *Anais*(1895, 1897); FERREIRA, M.\n*República*.\n","dic":"DPRRJ"}
