{"title":"VASCONCELOS, Clodomiro Rodrigues de","cargoss":["Deputado Estadual"],"cargos_esp":[0],"datas_ini":[1935],"datas_fim":[1937],"estados":["RJ"],"autor":["Adrianna Setemy"],"content":"**VASCONCELOS, Clodomiro Rodrigues de**\n\n\\* dep. est. RJ 1935-1937.\n\n*Clodomiro Rodrigues de Vasconcelos* elegeu-se deputado estadual em\noutubro de 1934. Tomou posse no ano seguinte e nessa legislatura a ALERJ\ne fez parte da Assembleia Constituinte estadual preparou a nova\nConstituição do estado do Rio de Janeiro, promulgada em 22 de janeiro de\n1936. Em novembro do ano seguinte, seu mandato foi, contudo,\ninterrompido devido ao golpe do Estado Novo, no governo do presidente\nGetúlio Vargas (1930-1945), quando o Congresso Nacional e as assembleias\nlegislativas foram fechadas.\n\n*Adrianna Setemy*\n\nFONTES: ASSEMB. LEGISL. RJ. Disponível em:\n\\<www.alerj.rj.gov.br/center\\_arq\\_inf\\_legislatura.htm\\>. Acesso em:\n3/8/2010.\n","ref":"FONTES: ASSEMB. LEGISL. RJ. Disponível em:\n\\<www.alerj.rj.gov.br/center\\_arq\\_inf\\_legislatura.htm\\>. Acesso em:\n3/8/2010.\n","dic":"DPRRJ"}
