{"title":"VELOSO, Napoleão Pereira","cargoss":["Deputado Estadual"],"cargos_esp":[0],"datas_ini":[1983],"datas_fim":[1991],"estados":["RJ"],"autor":["Renata Moreira"],"content":"**VELOSO, Napoleão Pereira**\n\n\\* dep. est. RJ 1983-1991.\n\n*Napoleão Pereira Veloso* nasceu em 22 de fevereiro de 1958, na cidade\ndo Rio de Janeiro, então Distrito Federal, filho de Climério Veloso.\n\nEm novembro de 1982 foi eleito deputado estadual no estado do Rio de\nJaneiro.\n\nSua primeira função política foi a de vice-líder da bancada do Partido\ndo Movimento Democrático Brasileiro (1983-1986). Napoleão Velloso\ndedicou o espaço “Indicações” do Diário Oficial do Estado do Rio de\nJaneiro (DOERJ) a locais específicos. Estas, por sua vez, versavam sobre\nurbanização, dragagens de rio, criação e ampliação da rede de esgoto,\ninstalações de subpostos de saúde, instalação de iluminação pública de\ntelefones, pavimentação, abastecimento de água e segurança pública.\n\nDiscursou, em 1983 sobre a concessão de licença indiscriminada a\nambulantes que limitavam o espaço de pedestres e adicionou a este tema a\nrelação dos donos de negócio que pagavam impostos, o contrário da\natividade informal mencionada. Demonstrou sua insatisfação com a\nutilização do espaço público pelo setor privado, uma vez que não se\nfazia menção a aluguel da área ocupada.\n\nEm novembro de 1986 reelegeu-se deputado estadual.\n\nNa Ata da 1^a^ Sessão Preparatória da 1^a^ Sessão Legislativa da 4^a^\nlegislatura na Assembleia Legislativa do Estado do Rio de Janeiro\n(ALERJ), realizada no dia 1^o^ de fevereiro de 1987, data de sua posse,\ncomprometeu-se a trabalhar contribuindo no Poder Legislativo para a\nfeitura e adequação da nova Constituição estadual. Em um segundo momento\nuniu-se ao deputado estadual Ivo Saldanha contra a especulação\nimobiliária ocorrida no patrimônio nacional e da humanidade que seriam\nas dunas de Cabo Frio; propôs assim uma comissão especial para\npreservação de nossos patrimônios naturais e históricos. Também pediu\nrespeito aos deputados, cujos trajes não seriam considerados adequados,\nporque não se deveria julgar pelas aparências e sim pelas atitudes e\nações como parlamentar.\n\nIntegrou diversas Comissões, ao longo dos seus dois mandatos, entre\nelas: como membro efetivo na Constituição e Justiça, Orçamento e\nFinanças, Ciência, Energia e Tecnologia, Economia, Indústria e Comércio,\nRedação, Indicações Legislativas e Proposições Externas, Transporte e\ntambém na Comissão Interpartidária Pró-Constituinte (subcomissão\neconômica). Como suplente participou da Comissão Parlamentar de\nInquérito (CPI) para “Apurar as Irregularidades na Secretaria de Estado\nde Polícia Civil” e de Controle do Meio Ambiente e de Cultura.\nParticipou da Assembleia Constituinte do estado do Rio de Janeiro e, em\n1990, assinou com outros deputados estaduais as disposições transitórias\nda Constituição e a Constituição do Estado do Rio de Janeiro (CERJ).\n\nEscreveu juntamente com José Figorelle, Alberto Brizolla e outros\ndeputados uma moção de apoio à luta de Niterói por seus legítimos\ndireitos. Visto que Niterói se tornou uma cidade inadministrável por ser\nsede de várias indústrias de construção e reparos navais e viu-se\nprivada de Imposto Sobre Serviço (ISS), por elas recolhido em virtude de\num ato de força do governo federal, com a fusão do estado da Guanabara\nperdeu a condição de capital, o que resultou em diminuição brutal da\nreceita proveniente de impostos, e finalmente foi destituída dos\nrecursos a que tinha dinheiro legal por conta dos *royalties* do\npetróleo.\n\nDeixou a ALERJ em janeiro de 1991, quando teve fim a legislatura\n\n*Renata Moreira*\n\nFONTES: ASSEMB. LEGISL. RJ. *Deputados estaduais fluminenses*. Terceira\nlegislatura (1983-1987), Quarta legislatura (1987-1991); *Diário Oficial\ndo Estado do Rio de Janeiro* (ano IX, n. 49, parte II, 14/3/1983, ano\nIX, n. 116, parte II, 21/6/1983, ano XIII, n. 13, parte II, 7/1/1987,\nano XIII, n. 20, parte II, 2/2/1987, ano XIII, n. 176, parte II,\n11/9/1987).\n","ref":"FONTES: ASSEMB. LEGISL. RJ. *Deputados estaduais fluminenses*. Terceira\nlegislatura (1983-1987), Quarta legislatura (1987-1991); *Diário Oficial\ndo Estado do Rio de Janeiro* (ano IX, n. 49, parte II, 14/3/1983, ano\nIX, n. 116, parte II, 21/6/1983, ano XIII, n. 13, parte II, 7/1/1987,\nano XIII, n. 20, parte II, 2/2/1987, ano XIII, n. 176, parte II,\n11/9/1987).\n","dic":"DPRRJ"}
