{"title":"VIANA, Arnaldo","cargoss":["Prefeito","Deputado federal"],"cargos_esp":["Campos",0],"datas_ini":[1998,2007],"datas_fim":[2004,2011],"estados":[0,"RJ"],"autor":[0],"content":"**VIANA, Arnaldo**\n\n\\* pref. Campos 1998-2004; dep. fed. RJ 2007-2011.\n\n*Arnaldo França Viana* nasceu em Campos (RJ) no dia 4 de novembro de\n1947, filho de Arnaldo Rosa Viana e Amélia de Abreu França Viana.\n\nBacharelou-se em medicina na Faculdade de Medicina de Campos em 1972,\nfez a residência médica no Hospital da Lagoa, no Rio de Janeiro, fez\npós-graduação em neurocirurgia na Alemanha e fez ainda quatro cursos de\npós-graduação *lato sensu* na Fundação Getúlio Vargas: Master Business\nAdministration (MBA) em Gestão Hospitalar, MBA em Gestão Municipal, MBA\nem Autoria Hospitalar, MBA em Saúde Coletiva. Foi diretor-clínico no\nHospital da Beneficência Portuguesa de Campos entre 1984 e 1989 e\ndiretor geral do Hospital Ferreira Machado entre 1989 e 1992.\n\nEm 1992 foi eleito vereador em Campos na legenda do Partido Democrático\nTrabalhista (PDT). Em 1996, foi eleito vice-prefeito de Campos na chapa\nencabeçada por Anthony Garotinho. No ano seguinte assumiu a Secretaria\nMunicipal de Governo e passou a presidir o Conselho Municipal de Saúde.\nCom a renúncia de Garotinho ainda em 1998 para candidatar-se ao governo\ndo estado, foi empossado prefeito de Campos. Assumiu então a presidência\ndo Consórcio da Bacia do Rio Itabapoana, ligado ao Programa de\nDesenvolvimento Regional Sustentável da Bacia Hidrográfica do Rio\nItabapoana, conhecido como Projeto Managé, cargo que exerceria até 2003.\nPresidiu também a Organização dos Municípios Produtores de Petróleo e\nGás da Bacia de Campos (Ompetro) de 2000 a 2002. No pleito de 2000 foi\nreeleito prefeito de Campos, para o período 2001-2004, e em 2001 rompeu\ncom Anthony Garotinho. Na eleição de seu sucessor, em 2004, apoiou\nCarlos Alberto Campista, que no segundo turno venceu o candidato e\naliado de Garotinho, Geraldo Pudim. Durante o período eleitoral, foi\nacusado de ter superfaturado shows feitos para promover a candidatura de\nCampista, o que levou o Ministério Público a conseguir seu afastamento\nda prefeitura. Contudo, poucos dias depois o Supremo Tribunal Federal\n(STF) o reconduziu ao cargo. Deixou a prefeitura em dezembro de 2004 e\nno ano seguinte foi empossado presidente do PDT em Campos.\n\nEm outubro de 2006, foi eleito deputado federal pelo Rio de Janeiro,\ntendo sido o mais votado no estado na legenda do PDT. Assumiu o mandato\nna Câmara em fevereiro de 2007 e integrou a Comissão Permanente de Minas\ne Energia, a Comissão Permanente de Seguridade Social e Família e a\nComissão Permanente de Meio Ambiente e Desenvolvimento Sustentável.\nVotou a favor da prorrogação da Contribuição Provisória sobre\nMovimentação Financeira (CPMF), que acabou extinta em votação no Senado.\n\nEm 2008, candidatou-se novamente a prefeito de Campos na legenda do PDT.\nDurante a campanha, teve seu registro cassado por decisão do Tribunal\nRegional Eleitoral (TRE) do Rio de Janeiro. Apresentou recurso junto ao\nTribunal Superior Eleitoral (TSE) que anulou a decisão da instância\nregional e deferiu a candidatura. Em outubro, disputou a eleição e\nconseguiu votos suficientes para concorrer em segundo turno contra a\ncandidata Rosinha Garotinho, que saiu vencedora. Voltou ao exercício do\nmandato de deputado federal, até janeiro de 2011.\n\nFoi também membro da Academia Brasileira de Neurocirurgia.\n\nCasado com Ilsan Maria Viana dos Santos, eleita vereadora em Campos em\n2008, teve um filho.\n\nFONTES: Assessoria de Comunicação Social da Procuradoria Regional do\nTrabalho da 1^a^ Região (14/3/2008); CÂM. DEP; *Folha* (2/9/2008); G1\n(26/10/2008); *Globo* (6/10/2008, 9/10/2008); Informe JB (5/9/2008);\n*Jornal do Brasil* (7/10/2004, 15/10/2004, 27/10/2004, 29/10/2004,\n14/5/2005, 5/9/2008, 10/10/2008); PDT (28/5/2007); PREF. MUN. CAMPOS DOS\nGOYTACAZES (18/11/2003); SUPR. TRIB. JUST. (12/11/2001), TRIB. SUP.\nELEIT. (9/10/2008), Uol notícias. Disponível em:\n\\<http://noticias.uol.com.br/ultnot/eleicoes/eleito/campos.jhtm\\>.\nAcesso em: 1/10/2009.\n","ref":"FONTES: Assessoria de Comunicação Social da Procuradoria Regional do\nTrabalho da 1^a^ Região (14/3/2008); CÂM. DEP; *Folha* (2/9/2008); G1\n(26/10/2008); *Globo* (6/10/2008, 9/10/2008); Informe JB (5/9/2008);\n*Jornal do Brasil* (7/10/2004, 15/10/2004, 27/10/2004, 29/10/2004,\n14/5/2005, 5/9/2008, 10/10/2008); PDT (28/5/2007); PREF. MUN. CAMPOS DOS\nGOYTACAZES (18/11/2003); SUPR. TRIB. JUST. (12/11/2001), TRIB. SUP.\nELEIT. (9/10/2008), Uol notícias. Disponível em:\n\\<http://noticias.uol.com.br/ultnot/eleicoes/eleito/campos.jhtm\\>.\nAcesso em: 1/10/2009.\n","dic":"DPRRJ"}
