{"title":"VIANA, Álvaro Miguelote","cargoss":["Prefeito"],"cargos_esp":["Niterói"],"datas_ini":[1936],"datas_fim":[1937],"estados":[0],"content":"**VIANA, Álvaro Miguelote**\n\n\\* militar; pref. Niterói 1936-1937.\n\n*Álvaro Miguelote Viana* nasceu em Niterói no dia 3 de outubro de 1897,\nfilho de Leopoldo Miguelote Viana e de Ismênia Miguelote Viana.\n\nIngressou na Escola Naval em 1914, na qual se formou guarda-marinha em\n1917.\n\nSeguiu a carreira militar e, logo em 1918, foi elevado a\nsegundo-tenente. Em 1921 passou a primeiro-tenente. No mesmo ano serviu\nem importantes embarcações como o cruzador *Barroso*, o encouraçado\n*Deodoro* e a contratorpedeira *Piauí*. No ano seguinte foi designado\npara servir na flotilha *Amazonas*. Em 1923 foi nomeado adido do\nEstado-Maior da Armada no Rio de Janeiro. Um ano depois foi preso por\nter se envolvido com uma rebelião naval liderada por Protógenes\nGuimarães. Em 1928 foi promovido a capitão-tenente e em 1929 tornou-se\najudante de ordens da flotilha de contratorpedeiras.\n\nApós ter participado da Revolução de 1930, foi nomeado prefeito de São\nGonçalo (RJ) em outubro daquele mesmo ano, cargo em que permaneceu por\napenas dois meses. Em 1932 passou a comandar a Base de Torpedeiras da\nIlha de Mocanguê, no Rio de Janeiro. Já em 1933, nomeado pelo\ninterventor do estado Ari Parreiras, voltou a ser prefeito de São\nGonçalo, cargo que ocupou até setembro de 1935, quando foi designado\npara o posto de assessor de gabinete do ministro da Marinha Protógenes\nGuimarães.\n\nEm novembro de 1935 Protógenes Guimarães assumiu o governo do estado e,\nno dia 27 de julho de 1936, nomeou Miguelote Viana prefeito de Niterói.\nO seu curto mandato, que durou até o dia 7 de agosto de 1937, foi\nmarcado por obras de infraestrutura do sistema de água, esgoto,\niluminação e saneamento de locais incorporados recentemente ao perímetro\nurbano do município. Havia constantes reclamações na imprensa a respeito\ndo mau funcionamento desses serviços.\n\nEntre o final de seu mandato e o início do Estado Novo, em novembro de\n1937, foi nomeado secretário de governo de Protógenes Guimarães, que\npassou a se ausentar frequentemente de sua função pública para realizar\ntratamentos de saúde. No final de 1937 voltou à Marinha e foi trabalhar\nna contratorpedeira *Mato Grosso*. Entre 1938 e 1940, já tendo alcançado\na patente de capitão de corveta, passou a comandar a Escola de\nAprendizes Marinheiros de Pernambuco. Em 1941 começou a cursar a Escola\nde Guerra Naval; contudo, no ano seguinte transferiu-se para a reserva e\nassumiu o cargo de consultor técnico da Comissão de Metalurgia do estado\nde São Paulo. No ano de 1944, poucos meses antes de falecer, deixou essa\nfunção pois estava passando por graves problemas de saúde.\n\nFaleceu no município de Petrópolis (RJ) no dia 14 de julho de 1945.\n\nFoi casado com Hilda Martins Miguelote, com quem teve dois filhos: Cora\ne Fernando.\n\n*Paulo César Gomes Bezerra*\n\nfontes: *Fluminense*(6, 7, 20, 27/7/1937); *São Gonçalo Online*. A\nhistória política de São Gonçalo. Disponível em:\n\\<www.saogoncaloonline.com.br/cidade/prefeitos.htm\\>. Acesso em:\n25/8/2010;SOARES, E. *P**refeitura*;SOARES, E. *Ruas*;WEHRS,C.\n*Niterói*.\n","ref":"","dic":"DPRRJ"}
