{"title":"BATISTA, Noel de Almeida","cargoss":["Deputado Estadual"],"cargos_esp":[0],"datas_ini":[1910],"datas_fim":[1921],"estados":["RJ"],"autor":[0],"content":"**BATISTA, Noel de Almeida**\n\n\\* dep. est. RJ 1910-1921.\n\n*Noel de Almeida Batista* nasceu em Campos (RJ) no dia 18 de novembro de\n1873, filho de Bento de Almeida Batista e de Alina Dutra Batista.\n\nEra funcionário público quando, na eleição de dezembro de 1909,\ncandidatou-se a deputado estadual no estado do Rio de Janeiro na legenda\ndo Partido Republicano Fluminense (PRF). Eleito, assumiu o mandato na\nAssembleia Legislativa do Estado do Rio de Janeiro (ALERJ) em 1910 e\nnessa legislatura apresentou um projeto que propunha um prazo de\npagamento dos impostos devidos ao estado. Além disso, apoiou a fundação\nde um banco de crédito agrícola no estado do Rio de Janeiro, propôs\nobras em São João Marcos, se opôs às emendas propostas ao projeto de\ninstrução primária e teceu considerações sobre a fixação da força\npública. Especificamente sobre a cidade de Campos, apresentou projetos\nsobre os contratos de abastecimento de água, a conservação das margens\ndos rios e a construção de pontes.\n\nEm fevereiro de 1911, Noel de Almeida Batista ingressou no Partido\nRepublicano Conservador Fluminense (PRCF), surgido da fusão do PRF com o\nPartido Republicano Conservador (PRC). Foi reeleito deputado estadual\npelo PRCF em 5 de dezembro de 1912 para a legislatura de 1913 a 1915. Em\n1913, devido aos desentendimentos políticos entre Oliveira Botelho\n(1910-1914), então presidente do estado do Rio, e Nilo Peçanha,\nprincipal liderança política estadual, retornou ao PRF junto com outros\npartidários do nilismo. Durante o mandato, pronunciou-se sobre o\ncontexto político em São João Marcos, Campos e Itaocara. Em setembro de\n1915 requereu uma comissão para representar a ALERJ em homenagens\nprestadas a Pinheiro Machado, senador pelo Rio Grande do Sul\n(1891-1915).\n\nCandidatou-se novamente, com êxito, em dezembro de 1915. No mandato,\niniciado em 1916, discursou sobre o contexto político em Duas Barras,\nsobre a reforma eleitoral, a obrigatoriedade do ensino da constituição\nbrasileira nas escolas públicas fluminenses, a preferência dada aos\ndiplomados na Faculdade Teixeira de Freitas para concorrerem aos cargos\nda magistratura e Ministério Público e apoiou a subvenção anual para o\nAsilo de Nossa Senhora do Carmo em Campos. Apresentou projeto sobre a\ncriação da cadeira de alemão no Liceu de Humanidades de Campos.\n\nFoi mais uma vez reeleito no pleito de janeiro de 1919. Durante a\nlegislatura, que teve início no mesmo ano, apoiou o projeto que\nconsiderava de utilidade pública o Centro de Imprensa Fluminense, a\nsubvenção anual para a Sociedade Sinfônica Fluminense, congratulou os\nsenadores que aprovaram o dia 25 de dezembro como feriado nacional,\nquestionou alguns aspectos do projeto que isentava as fábricas de papel\ndo pagamento de impostos estaduais.\n\nTentou nova reeleição a deputado estadual em dezembro de 1921. Foi\neleito, mas não assumiu o mandato devido aos desdobramentos da crise\npolítica estadual. No pleito para governador do estado do Rio de\nJaneiro, em julho de 1922, o candidato Raul Fernandes, apoiado pelos\nnilistas, e Feliciano Sodré, apoiado pelos partidários de Artur\nBernardes (1922-1926), então presidente da República, se declararam\nvencedores. Alegando a duplicidade de poderes no Rio de Janeiro, Artur\nBernardes decretou a intervenção federal no estado, em 1923, entregando\no Executivo fluminense a Aureliano Leal, que anulou tanto as eleições\nocorridas em 1922 para presidente estadual como as eleições legislativas\nde 1921. Noel de Almeida Batista disputou, sem sucesso, as eleições\nseguintes, em outubro de 1923, apoiado pela oposição nilista.\n\nDurante sua trajetória parlamentar integrou as comissões de Fazenda,\nOrçamento e Força Pública; de Justiça, Legislação e Instrução Pública;\nde Redação das Leis; de Estatística, Divisão Civil e Judiciária; do\nComércio, Agricultura, Indústria e Colonização e de Obras Públicas,\nSaúde Pública e Câmaras Municipais.\n\nFoi casado com Alcide Martins Ribeiro.\n\n*Vicente Saul Moreira dos Santos*\n\nFONTES: ASSEMB. LEGISL. RJ. *Anais*; *Correio da Manhã* (21/5/1914);\n*Estado* (17/12/1921, 18/1, 27/7/1922, 11/11/1923); FERREIRA, M.\n*República*; *Fluminense* (19/12/1915); SOARES, E. *História*.\n","ref":"FONTES: ASSEMB. LEGISL. RJ. *Anais*; *Correio da Manhã* (21/5/1914);\n*Estado* (17/12/1921, 18/1, 27/7/1922, 11/11/1923); FERREIRA, M.\n*República*; *Fluminense* (19/12/1915); SOARES, E. *História*.\n","dic":"DPRRJ"}
