{"title":"VIANA, Júlio Henrique","cargoss":["Deputado Estadual"],"cargos_esp":[0],"datas_ini":[1923],"datas_fim":[1926],"estados":["RJ"],"autor":["Raimundo Helio Lopes"],"content":"**VIANA, Júlio Henrique**\n\n\\* dep. est. RJ 1923-1926.\n\n*Júlio Henrique Viana* foi eleito deputado estadual pelo primeiro\ndistrito eleitoral, com sede em Niterói, em 28 de outubro de 1923, no\npleito realizado durante a intervenção federal no estado do Rio de\nJaneiro. Durante a intervenção federal, decretada em 10 de janeiro de\n1923 pelo então presidente da República Artur Bernardes (1922-1926), o\nestado foi governado pelo interventor Aureliano Leal, que fechou a\nAssembleia Legislativa do Estado do Rio de Janeiro (ALERJ) e anulou as\neleições de 9 de julho de 1922 realizadas para a sucessão do então\npresidente estadual Raul Veiga (1918-1922), quando os candidatos Raul\nFernandes e Feliciano Sodré declararam-se eleitos, ocasionando a\ndualidade da ALERJ.\n\nFoi eleito na legenda do Partido Republicano Fluminense (PRF). Com o\ninício dos trabalhos legislativos ingressou na Comissão especial para\napurar e verificar os poderes do presidente e vice-presidente do estado\ne em 27 de novembro participou do reconhecimento pela ALERJ da eleição\nde Feliciano Sodré para presidente do Rio de Janeiro (1923-1927),\nencerrando o período de intervenção federal do estado. Foi eleito ainda\nnesse ano membro da Comissão de Constituição e Justiça. No ano seguinte\npermaneceu nessa comissão e integrou também a Comissão de Estatística,\nDivisão Civil e Judiciária e Câmaras Municipais, mas pouco tempo depois\nrenunciou a esse cargo em favor do ingresso de novos colegas\nparlamentares nessas atividades. Nos dois anos seguintes desta\nlegislatura integrou novamente a Comissão de Constituição e Justiça.\n\nSeu tio, Mário Silveira Viana, foi deputado estadual no estado do Rio de\nJaneiro entre os anos de 1913 e 1921.\n\n*Raimundo Helio Lopes*\n\nFONTES: ASSEMB. LEGISL. RJ (1923-1926); FERREIRA, M. *República*.\n","ref":"FONTES: ASSEMB. LEGISL. RJ (1923-1926); FERREIRA, M. *República*.\n","dic":"DPRRJ"}
