{"title":"VIEIRA, Liszt","cargoss":["Deputado Estadual"],"cargos_esp":[0],"datas_ini":[1983],"datas_fim":[1987],"estados":["RJ"],"autor":["Luciana Pinheiro"],"content":"**VIEIRA, Liszt**\n\n\\* dep. est. RJ 1983-1987.\n\n*Liszt Benjamim Vieira* nasceu em Niterói, então capital do estado do\nRio de Janeiro, no dia 31 de janeiro de 1939, filho de Liszt Sá Vieira e\nde Coralia Aragon Vieira.\n\nBacharelou-se em direito pela Universidade Federal Fluminense (UFF) em\n1962 e iniciou sua trajetória profissional como advogado, tornando-se em\n1966, por meio de concurso, defensor público no Rio de Janeiro. Já\nformado em direito iniciou também o curso de ciências sociais na UFF e\nparticipou do movimento estudantil contra o regime militar instalado no\npaís em 1964. Após o Ato Institucional n^o^ 5, editado em 13 de dezembro\nde 1968, ingressou na luta armada contra o regime, aderindo à Vanguarda\nPopular Revolucionária (VPR) e participando do sequestro do cônsul\njaponês em São Paulo, Nobuo Okushi, em março de 1970. Pouco depois foi\npreso, torturado, e trocado, com outros prisioneiros políticos, pela\nliberdade do embaixador alemão Ehrenfried von Hollenben, sequestrado em\njunho de 1970. Banido do país, viveu dez anos no exílio, residindo na\nArgélia, em Cuba, no Chile, na Argentina e na França, onde prosseguiu os\nestudos. Formou-se assim em sociologia pela Universidade de Paris VII em\n1977, e no mesmo ano concluiu o mestrado em desenvolvimento agrícola na\nUniversidade de Paris I.\n\nDe volta ao Brasil após a promulgação da Lei da Anistia em agosto de\n1979, candidatou-se com êxito, nas eleições de novembro de 1982, a\ndeputado estadual no Rio de Janeiro na legenda do Partido dos\nTrabalhadores (PT). Em fevereiro de 1983 tomou posse na Assembleia\nLegislativa do Estado do Rio de Janeiro (ALERJ) e foi escolhido líder da\nbancada do PT. No mesmo ano tornou-se membro da comissão parlamentar de\ninquérito (CPI) criada para investigar o regime carcerário e\npenitenciário do estado. Ao longo do mandato, integrou a comissão de\nDefesa dos Direitos Humanos e a comissão especial criada para promover\nestudos sobre uma ampla revisão constitucional. Entre os projetos de lei\nde sua autoria que foram transformados em lei, destacam-se o que\nassegurava isenção de imposto ao trabalhador desempregado (Lei n^o^\n142/1983), o que prorrogava a licença da funcionária pública gestante\nque estivesse amamentando (Lei n^o^ 800/1984), o que garantia a\ncirculação de empregada doméstica ou qualquer pessoa no elevador e área\nsociais dos edifícios, independentemente de raça, cor ou condição social\n(Lei n^o^ 962/1985), o que concedia licença à funcionária que adotasse\numa criança, nos mesmos moldes que a concedida à gestante (Lei n^o^\n981/1986), e o que dispunha sobre a uniformização das tarifas\ntelefônicas cobradas pelas empresas de telefonia que operavam no estado\n(Lei n^o^ 950/1986). Em 1986 deixou o PT e participou da fundação do\nPartido Verde (PV). Em janeiro de 1987, ao final da legislatura, deixou\na ALERJ.\n\nReconhecido como defensor pioneiro da ecologia política no Brasil, em\n1987 assumiu a presidência do Instituto de Ecologia e Desenvolvimento,\norganização não governamental (ONG) que administrou por quatro anos.\nPronunciou-se sobre os debates travados na Assembleia Nacional\nConstituinte em 1988 e da campanha presidencial de 1989. Em 1991\ncoordenou o Fórum Global da Conferência Rio-92, e também o Fórum\nBrasileiro e o Fórum Internacional de ONGs, até 1995.\n\nDe 1997 a 1998 foi pesquisador visitante na Universidade de Columbia, em\nNova Iorque. Em 1998 concluiu o doutorado em sociologia no Instituto\nUniversitário de Pesquisas do Rio de Janeiro (IUPERJ), e em 1999\ningressou no quadro docente da UFF como professor visitante dos cursos\nde mestrado e doutorado em sociologia e direito, oferecendo a disciplina\nCidadania, sociedade civil e globalização. Ofereceu, ainda, no ano\nseguinte, a cadeira de Política ambiental no curso de pós-graduação da\nmesma universidade.\n\nDurante o governo de Benedita da Silva no Rio de Janeiro (2002-2003),\nfoi secretário de Meio Ambiente. Em 2003 foi nomeado presidente do\nJardim Botânico do Rio de Janeiro. No ano seguinte ingressou como\ndocente no departamento de ciências sociais da Pontifícia Universidade\nCatólica do Rio de Janeiro (PUC-Rio), e em 2005, no programa de\npós-graduação em direito da mesma instituição.\n\nEntre os livros e artigos de sua autoria, destacam-se: *Fragmentos de um\ndiscurso ecológico* (1990), *Ecologia: direito do cidadão* (1993),\n*Cidadania e globalização* (1997), *Cidadania e política ambiental*\n(1998), *Os argonautas da cidadania* (2001), e *A busca: memórias da\nresistência* (2008). Foi, ainda, organizador de *Identidade e\nglobalização* (2009).\n\nDivorciado, teve três filhos.\n\n*Luciana Pinheiro*\n\nFONTES: ASSEMB. LEGISL. RJ. *Deputados estaduais fluminenses*. Terceira\nlegislatura (1983-1987); INST. ESTUD. TRAB. SOC. Disponível em:\n\\<www.iets.org.br/article.php3?id\\_article=144&id\\_qs=56\\>. Acesso em:\n18/11/2010; Lizst Vieira. Disponível em:\n\\<www.lisztvieira.pro.br/index.asp\\>. Acesso em: 18/11/2010; Sistema de\nCurrículos Lattes. Disponível em:\n\\<http://buscatextual.cnpq.br/buscatextual/visualizacv.jsp?id=K4768864A6\\>.\nAcesso em: 18/11/2010.\n","ref":"FONTES: ASSEMB. LEGISL. RJ. *Deputados estaduais fluminenses*. Terceira\nlegislatura (1983-1987); INST. ESTUD. TRAB. SOC. Disponível em:\n\\<www.iets.org.br/article.php3?id\\_article=144&id\\_qs=56\\>. Acesso em:\n18/11/2010; Lizst Vieira. Disponível em:\n\\<www.lisztvieira.pro.br/index.asp\\>. Acesso em: 18/11/2010; Sistema de\nCurrículos Lattes. Disponível em:\n\\<http://buscatextual.cnpq.br/buscatextual/visualizacv.jsp?id=K4768864A6\\>.\nAcesso em: 18/11/2010.\n","dic":"DPRRJ"}
