{"title":"VIEIRA, Onofre Infante","cargoss":["Constituinte","Deputado Estadual"],"cargos_esp":["est",0],"datas_ini":[1947,1947],"datas_fim":[1947,1951],"estados":["RJ","RJ"],"autor":[0],"content":"**VIEIRA, Onofre Infante**\n\n\\* const. est. RJ 1947; dep. est. RJ 1947-1951.\n\n*Onofre Infante Vieira* nasceu em Barra do Piraí (RJ).\n\nFormou-se pela Faculdade de Medicina do Rio de Janeiro.\n\nCom o fim do Estado Novo e a reorganização partidária em 1945 foram\nconvocadas eleições para o Congresso Nacional e para as assembleias\nlegislativas estaduais. Em janeiro de 1947 foi eleito deputado à\nAssembleia Constituinte do Estado do Rio de Janeiro. Assumiu o cargo no\nmês seguinte. Foi terceiro-secretário da Mesa Constituinte. Em julho,\ndepois de promulgada a Constituição, ocupou uma cadeira na\nAssembleiaLegislativa do Estado do Rio de Janeiro (ALERJ). Foi\nterceiro-secretário da Mesa Diretora da assembleia.\n\nDurante sua atividade parlamentar posicionou-se sobre os debates\nenvolvendo o vale do Paraíba, problemas sanitários e de saúde pública.\n\nParticipou da Comissão de Educação e Saúde.\n\nApós se afastar da assembleia, ao fim da legislatura, em 1951, trabalhou\ncomo médico em Barra do Piraí.\n\nFoi casado com Gilda Infante Vieira, com quem teve um filho.\n\n*Vicente Saul Moreira dos Santos*\n\nFONTES: ASSEMB. CONST. RJ. *Anais* (1947); ASSEMB. LEGISL. RJ. *Anais*\n(1947, 1948); *Diário Oficial da União* (30/11/1913).\n","ref":"FONTES: ASSEMB. CONST. RJ. *Anais* (1947); ASSEMB. LEGISL. RJ. *Anais*\n(1947, 1948); *Diário Oficial da União* (30/11/1913).\n","dic":"DPRRJ"}
