{"title":"VILARES, Torquato","cargoss":["Deputado Estadual"],"cargos_esp":[0],"datas_ini":[1892],"datas_fim":[1894],"estados":["RJ"],"autor":[0],"content":"**VILARES, Torquato**\n\n\\* dep. est. RJ 1892-1894.\n\n*Torquato Vilares* nasceu no município de Rio das Flores (RJ).\n\nElegeu-se deputado estadual nas eleições realizadas em 24 de abril de\n1892, logo após a promulgação da segunda Constituição fluminense, pelo\nPartido Republicano Fluminense (PRF), então liderado por José Tomás da\nPorciúncula, republicano histórico e eleito presidente do estado do Rio\nde Janeiro (1892-1894) no mesmo pleito. A primeira Constituição\nfluminense havia sido elaborada em 1891 pelos partidários do presidente\ndo estado do Rio de Janeiro anterior, Francisco Portela (1889-1891), e\ndissolvida após sua renúncia, em dezembro desse ano. Foi então\norganizada uma nova Assembleia constituinte formada por membros do PRF e\npresidida por Porciúncula. Torquato Vilares iniciou o mandato no\nLegislativo estadual em maio de 1892 e permaneceu no desempenho desta\nfunção até dezembro de 1894.\n\n*Ioneide Piffano Brion de Souza*\n\nFONTES: ASSEMB. LEGISL. RJ. *Anais* (1892); FERREIRA, M. *República*.\n","ref":"FONTES: ASSEMB. LEGISL. RJ. *Anais* (1892); FERREIRA, M. *República*.\n","dic":"DPRRJ"}
