{"title":"VILAS BOAS, Valdílio","cargoss":["Deputado Estadual"],"cargos_esp":[0],"datas_ini":[1975],"datas_fim":[1979],"estados":["RJ"],"autor":["Juliana Gagliardi"],"content":"**VILAS BOAS, Valdílio**\n\n\\* dep. est. RJ 1975-1979.\n\n*Valdílio Vilas Boas* nasceu no dia 5 de novembro de 1927, filho de\nValério Vilas Boas, que foi funcionário da prefeitura de São João de\nMeriti, na Baixada Fluminense, e fundador do time de futebol mais antigo\ndaquela cidade, o Esmeraldo Futebol Clube.\n\nFoi vereador em São João de Meriti, tendo presidido a Câmara Municipal\nem 1963.\n\nNas eleições de novembro de 1974 candidatou-se a deputado estadual no\nRio de Janeiro, na legenda da Aliança Renovadora Nacional (Arena).\nEleito, assumiu o mandato em fevereiro do ano seguinte. O presidente\nErnesto Geisel havia enviado um projeto de lei ao Congresso Nacional que\nprevia a fusão dos estados da Guanabara e do Rio de Janeiro e que,\ndepois de rápida tramitação, foi transformado em lei em julho de 1974.\nOs deputados estaduais, que haviam sido eleitos em novembro de 1974\npelos dois antigos estados e tomado posse em fevereiro de 1975 para os\nmandatos ordinários, passaram a formar, em março, a Assembleia\nConstituinte encarregada de elaborar a Constituição do novo estado do\nRio de Janeiro – resultante da fusão que ocorreria no dia 15 de março.\nNesse mesmo dia tomou posse o governador nomeado almirante Faria Lima.\n\nNa Assembleia Constituinte, instalada no dia 15 de março, foi suplente\nna Comissão Constitucional. Na ocasião a maioria emedebista era ligada a\nChagas Freitas e defendia que não se prolongassem no tempo os trabalhos\nconstituintes. Em apenas quatro meses a nova Carta foi finalizada.\n\nCom a promulgação da nova Constituição estadual em 23 de julho de 1975,\nValdílio Vilas Boas retornou ao exercício do mandato ordinário na\nAssembleia Legislativa do Estado do Rio de Janeiro (ALERJ).\n\n*Juliana Gagliardi*\n\nFONTES: ASSEMB. LEGISL. RJ. Disponível em:\n\\<www.alerj.rj.gov.br/memoria/cd/assembleia/aconstrj.html\\>. Acesso em:\n10/5/2011; ASSEMB. LEGISL. RJ. *Informações e produtos parlamentares*\n(2000); CÂM. MUN. SÃO JOÃO DE MERITI. Disponível em:\n\\<http://camaradesaojoaodemeriti.rj.gov.br/site/\\>. Acesso em:\n13/7/2011; CARDIANO, F. *Eleições*; MOREIRA, L. *Mulheres*; SARMENTO, C.\n*Espelho*.\n","ref":"FONTES: ASSEMB. LEGISL. RJ. Disponível em:\n\\<www.alerj.rj.gov.br/memoria/cd/assembleia/aconstrj.html\\>. Acesso em:\n10/5/2011; ASSEMB. LEGISL. RJ. *Informações e produtos parlamentares*\n(2000); CÂM. MUN. SÃO JOÃO DE MERITI. Disponível em:\n\\<http://camaradesaojoaodemeriti.rj.gov.br/site/\\>. Acesso em:\n13/7/2011; CARDIANO, F. *Eleições*; MOREIRA, L. *Mulheres*; SARMENTO, C.\n*Espelho*.\n","dic":"DPRRJ"}
