{"title":"WERNECK, João Maria da Rocha","cargoss":["Deputado Estadual","Deputado Estadual","Deputado Estadual"],"cargos_esp":[0,0,0],"datas_ini":[1930,1923,1898],"datas_fim":[1930,1925,0],"estados":["RJ","RJ","RJ"],"autor":["Raimundo Helio Lopes"],"content":"**WERNECK, João Maria da Rocha**\n\n\\* dep. est. RJ 1898, 1923-1925, 1930.\n\n*João Maria da Rocha Werneck* foi eleito deputado estadual, pelo 4^o^\ndistrito eleitoral, com 3.238 votos em 1898. Elegeu-se\nsegundo-secretário da Assembleia Legislativa do Estado do Rio de Janeiro\n(ALERJ) e em dezembro do mesmo ano renunciou ao mandato de deputado.\nRetornou à assembleia no ano de 1923, quando foi novamente eleito\ndeputado pelo 4^o^ distrito eleitoral com 6.517 votos. Ainda nesse ano\nintegrou a Comissão de Petições, Representações e Poderes. Em 1924 foi\nreeleito membro desta comissão e segundo vice-presidente da Casa.\n\nEm 1925 renunciou ao mandato de deputado estadual para assumir o cargo\nde vice-presidente do estado durante a administração de Feliciano Sodré,\nem virtude da renuncia de Paulino José Soares de Sousa, então ocupante\ndo posto, que pretendia concorrer a uma vaga na Câmara dos Deputados.\n\nVoltou a ocupar uma cadeira na Assembleia Legislativa em agosto de 1930,\nquando foi eleito deputado estadual pelo 4^o^ distrito eleitoral com\n12.899 votos, e logo ingressou na Comissão de Higiene e Instrução\nPública. Contudo, em novembro de 1930 teve seu mandato interrompido com\na vitória da Revolução de 1930 que elevou Getúlio Vargas ao poder,\nfechou o Congresso Federal e extinguiu todos os órgãos legislativos do\npaís.\n\nJoão Maria da Rocha Werneck também foi vereador e presidente da Câmara\nMunicipal da cidade de Paraíba do Sul.\n\n*Raimundo Helio Lopes*\n\nFONTES: ASSEMB. LEGISL. RJ. *Anais* (1898, 1923-1925); *Estado*\n(13/3/1925, 19/8/1930).\n","ref":"FONTES: ASSEMB. LEGISL. RJ. *Anais* (1898, 1923-1925); *Estado*\n(13/3/1925, 19/8/1930).\n","dic":"DPRRJ"}
