{"title":"WERNECK, José Inácio da Rocha","cargoss":["Deputado Estadual","Constituinte","Prefeito","Prefeito"],"cargos_esp":[0,"est","Niterói","Niterói"],"datas_ini":[1923,1935,1950,1948],"datas_fim":[1926,1935,1951,1950],"estados":["RJ","RJ",0,0],"content":"**WERNECK, José Inácio da Rocha**\n\n\\* dep. est. RJ 1923-1926; const. est. RJ 1935; pref. Niterói 1948-1950\ne 1950-1951.\n\n*José Inácio da Rocha Werneck* nasceu em Paraíba do Sul (RJ) no dia 22\nde novembro de 1896, filho de José Inácio da Rocha Werneck e de Regina\nCabral da Rocha Werneck.\n\nBacharel pela Faculdade de Direito de Niterói, iniciou-se na política\nconcorrendo às eleições para Assembleia Legislativa do Estado do Rio de\nJaneiro (ALERJ) em outubro de 1923, na legenda do Partido Republicano\nFluminense (PRF). Foi empossado no mês seguinte e durante o mandato\nparticipou dos debates sobre economia, educação, funcionalismo público e\ninfraestrutura, e sobre questões envolvendo sua cidade natal e região.\nApoiou o projeto de criação do Instituto de Fomento e Economia Agrícola,\npronunciou discurso de apoio ao presidente estadual Feliciano Sodré\n(1923-1927) e ao presidente da República Washington Luís (1926-1930), e\nintegrou a Comissão de Petições, Representações e Poderes. Encerrou seu\nmandato na ALERJ em 1926, e em 1927 elegeu-se prefeito de Paraíba do\nSul, cargo que ocuparia até 1930.\n\nEm 1934 foi eleito deputado estadual constituinte. Empossado em 1935,\nintegrou a Comissão de Constituição, participou dos debates sobre\neducação e questões jurídicas, e pronunciou discurso de apoio ao\nExército, especialmente ao coronel Newton Cavalcanti, que entre 8 e 17\nde novembro foi interventor no estado e presidiu a eleição indireta para\na governador que deu a vitória ao almirante Protógenes Guimarães. Com a\nposse deste no governo (1935-1937), assumiu a Secretaria Estadual de\nFinanças. Já após o Estado Novo (1937-1945), durante o governo de Hugo\nSilva (1946-1947), foi secretário de Educação e Saúde.\n\nAssumiu pela primeira vez a prefeitura de Niterói entre 31 de março de\n1948 e 28 de junho de 1950, nomeado pelo governador Edmundo de Macedo\nSoares (1947-1951). Deixou então a prefeitura para assumir novamente a\nSecretaria Estadual de Educação, sendo substituído por Alberto Rodrigues\nFortes. Em 8 dezembro de 1950 retomou o posto de prefeito, até 31 de\njaneiro do ano seguinte, quando tomaram posse o governador eleito Amaral\nPeixoto (1951-1955) e o novo prefeito Daniel Paz de Almeida. Em suas\ngestões inaugurou o Hospital Antônio Pedro; reformou as capelas\nfunerárias da rua Coronel Gomes Machado; doou os terrenos para a\nconstrução da Casa do Advogado; concluiu a reforma do jardim São João, e\nfez obras de pavimentação de diversas ruas.\n\nApós deixar a prefeitura, foi nomeado tabelião do 16^o^Ofício de\nNiterói, onde permaneceu até 1966, quando se aposentou compulsoriamente.\n\nFaleceu em 16 de outubro de 1979 no Rio de Janeiro.\n\nCasado com Dulce Rios da Rocha Werneck, teve três filhos.\n\n*Paulo César Gomes Bezerra*\n\nfontes: ASSEMB. CONST. RJ. *Anais* (1935); ASSEMB. LEGISL. RJ. *Anais*\n(1925, 1926); SOARES, E. *Prefeitura*;WEHRS,C. *Niterói*.\n","ref":"","dic":"DPRRJ"}
