{"title":"WERNECK, Sousa","cargoss":["Constituinte","Deputado Estadual"],"cargos_esp":["est",0],"datas_ini":[1892,1892],"datas_fim":[1892,1894],"estados":["RJ","RJ"],"autor":["Lamb"],"content":"**WERNECK, Sousa**\n\n\\* const. est. RJ 1892; dep. est. RJ 1892-1894.\n\n*Francisco Pinheiro de Sousa Werneck* nasceu no Rio de Janeiro, então\ncapital do Império, no dia 26 de outubro de 1837, filho de Peregrino\nJosé de América Pinheiro e de Ana Isabel Werneck. Descendente, na raiz\nmaterna, de uma antiga família de origem germânica de proprietários\nrurais que chegaram ao Brasil a partir do século XVII e se estabeleceram\nposteriormente no vale do Paraíba integrando a aristocracia rural\ncafeeira. Seu pai, nascido em Pati do Alferes (RJ) em 1811, foi o\nprimeiro barão de Ipiabas. Tendo recebido o título no dia 30 de novembro\nde 1866, tornou-se barão com honras de grandeza no ano seguinte e, em\n1882, conde de Ipiabas. Francisco Pinheiro de Sousa Werneck foi chefe\npolítico na cidade de Valença e recebeu de d. Pedro II, em 22 de julho\nde 1882, o título de barão de Ipiabas anteriormente concedido ao seu\npai.\n\nCandidatou-se às primeiras eleições realizadas após a proclamação da\nRepública (15/11/1889) para a formação da Assembleia Constituinte\nfluminense, mas não foi eleito. Esse pleito, realizado em 20 de março de\n1891, foi vencido pelos partidários do presidente do estado do Rio de\nJaneiro, Francisco Portela (1889-1891), nomeado pelo presidente da\nRepública, marechal Deodoro da Fonseca (1889-1891). Os portelistas\nderrotaram os candidatos do Partido Republicano, de oposição ao governo,\nliderados por José Tomás da Porciúncula.\n\nA primeira Constituição fluminense foi elaborada em 1891 pelos\npartidários de Francisco Portela e anulada após a renúncia deste, em\ndezembro do mesmo ano. No dia 31 de janeiro de 1892 uma nova eleição foi\nrealizada para compor a nova Assembleia Constituinte, que foi formada\npor membros do PRF, presidida por José Tomás da Porciúncula e que\npromulgaria, no dia 9 de abril do mesmo ano, a segunda Constituição\nfluminense. Na ocasião, o barão de Ipiabas se elegeu. A nova assembleia,\ncomposta por partidários do Partido Republicano Fluminense (PRF),\nprocurou reorganizar os estatutos jurídicos do estado que tinham sido\nconstituídos para favorecer Francisco Portela e representou o início do\ndomínio do PRF na política estadual.\n\nNo dia 24 de abril foram realizadas eleições para a composição da\nAssembleia Legislativa. Elegeu-se deputado estadual na legenda do PRF.\nNo mesmo pleito José Tomás da Porciúncula elegeu-se presidente do estado\ndo Rio de Janeiro (1892-1894).\n\nNa Assembleia Legislativa ingressou, em 1893, nas comissões de\nEstatística, Divisão Civil e Judiciária, de Comércio, Agricultura,\nIndústria e Colonização e de Redação das Leis, nas quais permaneceu até\no fim do seu mandato, em dezembro de 1894.\n\nDepois de atuar no Legislativo estadual, constou, em 1898, na listagem\nde jurados e vogais qualificados para servirem no ano de 1899 no Rio de\nJaneiro, então capital federal. Ingressou no Partido Republicano do Rio\nde Janeiro (PRRJ), fundado em 23 de julho de 1899 e liderado por Alberto\nTorres, então presidente do estado do Rio de Janeiro (1897-1900),\noriginário de cisão do PRF.\n\nFoi também fazendeiro, comerciante e banqueiro.\n\nCasou-se com Francisca Guilhermina de Almeida Werneck. Sua filha,\nCarolina Pinheiro de Sousa casou-se com o primo, João Quirino da Rocha\nWerneck, que foi o segundo barão de Palmeiras e deputado estadual no Rio\nde Janeiro (1892-1894 e 1898-1900).\n\nFaleceu no dia 15 de abril de 1926.\n\n*Samuel Silva Rodrigues de Oliveira/Juliana Gagliardi/Nayara Emerick\nLamb*\n\nFONTES: ASSEMB. LEGISL. RJ. *Anais* (1892-1894); BARATA, C.; BUENO, A.\n*Dic.* (v. 2); *Diário Oficial da União* (22/11/1898, p. 6037).\nDisponível em:\n\\<www.jusbrasil.com.br/diarios/1687208/dou-secao-1-22-11-1898-pg-9/pdfView\\>.\nAcesso em: 29/6/2011; FERREIRA, M. *República*; LEMOS, R. *Implantação*;\nRHEINGANTZ, C. *Titulares*; ZUQUETE, A. *Nobreza* (v. 3).\n","ref":"FONTES: ASSEMB. LEGISL. RJ. *Anais* (1892-1894); BARATA, C.; BUENO, A.\n*Dic.* (v. 2); *Diário Oficial da União* (22/11/1898, p. 6037).\nDisponível em:\n\\<www.jusbrasil.com.br/diarios/1687208/dou-secao-1-22-11-1898-pg-9/pdfView\\>.\nAcesso em: 29/6/2011; FERREIRA, M. *República*; LEMOS, R. *Implantação*;\nRHEINGANTZ, C. *Titulares*; ZUQUETE, A. *Nobreza* (v. 3).\n","dic":"DPRRJ"}
