{"title":"BERARDINELLI, Álvaro","cargoss":["Deputado Estadual"],"cargos_esp":[0],"datas_ini":[1951],"datas_fim":[1952],"estados":["RJ"],"autor":["Weder Ferreira"],"content":"**BERARDINELLI, Álvaro**\n\n\\* dep. est. RJ 1951-1952.\n\n*Álvaro Berardinelli* nasceu em 16 de janeiro de 1897 na cidade de\nJacareí (SP), filho dos imigrantes italianos Affonso Antônio\nBerardinelli e de Annita Mollica Berardinelli.\n\nGraduou-se em 1917 pela Faculdade Nacional de Medicina do Rio de\nJaneiro. Aos 21 anos, como segundo-tenente médico, durante o governo de\nVenceslau Brás (1914-1918) na presidência da República, alistou-se\nespontaneamente na Missão Médica Militar para a França – expedição\nbrasileira enviada à Europa em apoio às Tropas Aliadas – e serviu na\ncidade de Carcassone. Fez cursos de especialização em medicina, entre os\nquais o de cirurgia de guerra, microbiologia e pediatria no Hospital\nVaugirard de Paris.\n\nDe volta ao Brasil, foi um dos fundadores do periódico *O Monitor de\nMendes*, que circulou em 1929. No dia 20 de outubro de 1929 – às\nvésperas do *crash* da bolsa de Nova Iorque – participou da fundação de\numa cooperativa de crédito, a Sociedade Cooperativa de Responsabilidade\nLtda., na localidade de Mendes, à época quarto distrito do município de\nBarra do Piraí, na região Sul do estado do Rio de Janeiro. Exerceu o\ncargo de diretor presidente da instituição até 1966.\n\nElegeu-se prefeito de Barra do Piraí, governando o município no biênio\n1946-1947.\n\nNas eleições de 3 de outubro de 1950 candidatou-se a deputado estadual\nno estado do Rio de Janeiro, na legenda do Partido Social Democrata\n(PSD). Eleito, assumiu o mandato em 1951 e, durante a legislatura,\napoiou o governador do estado Ernâni do Amaral Peixoto. Em 19 de março\nde 1951 foi eleito membro da Comissão de Educação e Saúde da Assembleia\nLegislativa do Estado do Rio de Janeiro (ALERJ). Durante sua trajetória\nparlamentar dedicou-se a temas ligados ao campo da educação e atuou no\nfomento à criação de várias escolas, sobretudo nos municípios de Mendes\ne de Barra do Piraí. Nesse mesmo ano solicitou, junto com o deputado\nArlindo Rodrigues, a construção de instituições escolares em todo o\nestado. Renunciou ao mandato da ALERJ em 1952 e foi o primeiro prefeito\neleito após a emancipação de Mendes. Assumiu o mandato em janeiro de\n1953 e o exerceu até janeiro de 1955.\n\nEm outubro de 1954 candidatou-se novamente a deputado estadual no estado\ndo Rio, ainda na legenda do PSD, mas não conseguiu se eleger.\n\nFoi, ainda, secretário de Estado da Educação do Rio de Janeiro.\n\nFaleceu aos 87 anos, no Rio de Janeiro, em 14 de fevereiro de 1984.\n\nCasou-se em primeiras núpcias com Marina Sílvia da Silva Rondon, filha\ndo marechal Cândido Rondon, com quem teve duas filhas. Ficou viúvo e,\nposteriormente, casou-se com Cleonice Serôa Mota Berardinelli, membro da\nAcademia Brasileira de Letras e correspondente brasileira da Academia de\nCiências de Lisboa.\n\n*Weder Ferreira*\n\nFONTES: ASSEMB. LEGISL. RJ. *Anais* (19^a^ legislatura, v. 2); KROEFF,\nM. *Missão*.\n","ref":"FONTES: ASSEMB. LEGISL. RJ. *Anais* (19^a^ legislatura, v. 2); KROEFF,\nM. *Missão*.\n","dic":"DPRRJ"}
