{"title":"BEZAMAT, Alberto","cargoss":["Deputado Geral","Deputado Estadual","def fed"],"cargos_esp":[0,0,0],"datas_ini":[1885,1898,1903],"datas_fim":[1889,1900,1905],"estados":["RJ","RJ","RJ"],"autor":["Luciana Pinheiro"],"content":"**BEZAMAT, Alberto**\n\n\\* dep. geral RJ 1885-1889; dep. est. RJ 1898-1900; def. fed. RJ\n1903-1905.\n\n*Alberto Bezamat* nasceu em Campos (RJ).\n\nBacharel pela Faculdade de Direito de São Paulo em 1870, retornou ao\nmunicípio natal e deu início à trajetória profissional atuando como\nadvogado. Ingressou na política filiando-se ao Partido Conservador e foi\ndeputado provincial em várias legislaturas. Em 1885 foi eleito pela\nprimeira vez deputado geral pela província do Rio de Janeiro. Reeleito\nno ano seguinte, exerceu o mandato até 1889.\n\nJá na República, elegeu-se deputado estadual no Rio de Janeiro e exerceu\no mandato entre 1898 e 1900. Candidatou-se a deputado federal pelo\nestado do Rio em 1903 e foi eleito. Tomou posse em maio na Câmara dos\nDeputados e exerceu o mandato até o fim da legislatura, em dezembro de\n1905.\n\nAo longo de sua trajetória profissional foi também juiz de direito em\nSantos (SP).\n\nFaleceu em 4 de julho de 1906.\n\nFoi casado com Eugênia de Albuquerque Bezamat.\n\n*Luciana Pinheiro*\n\nFONTES: ABRANCHES, J. *Governos*; CÂM. DEP. Deputados; MELLO, M.\n*Parlamento*; Novo Milênio. Disponível em:\n\\<www.novomilenio.inf.br/santos/h0412.htm\\>. Acesso em: 18/11/2010;VELHO\nSOBRINHO, J. *Dicionário*.\n","ref":"FONTES: ABRANCHES, J. *Governos*; CÂM. DEP. Deputados; MELLO, M.\n*Parlamento*; Novo Milênio. Disponível em:\n\\<www.novomilenio.inf.br/santos/h0412.htm\\>. Acesso em: 18/11/2010;VELHO\nSOBRINHO, J. *Dicionário*.\n","dic":"DPRRJ"}
