{"title":"ALBUQUERQUE, Afrânio de","cargoss":["Deputado Estadual"],"cargos_esp":[0],"datas_ini":[1913],"datas_fim":[1915],"estados":["RJ"],"autor":[0],"content":"**ALBUQUERQUE, Afrânio de**\n\n\\* dep. est. RJ 1913-1915.\n\n*Afrânio de Albuquerque* graduou-se em direito.\n\nNas eleições de 15 de dezembro de 1912, foi eleito deputado estadual no\nRio de Janeiro. Assumiu uma cadeira na Assembleia Legislativa do Estado\ndo Rio de Janeiro (ALERJ) no ano seguinte. Teve atuação discreta na\ntribuna, limitando-se a debater alguns projetos de lei referentes ao\nmunicípio de Angra dos Reis (RJ). Participou da Comissão de Redação das\nLeis.\n\nEm 1914, posicionou-se favoravelmente à candidatura de Feliciano Sodré,\nà época prefeito de Niterói – então capital do estado do Rio de Janeiro\n–, ao governo do estado do Rio de Janeiro. A candidatura de Feliciano\ntinha o apoio de Pinheiro Machado e se opunha à corrente de Nilo\nPeçanha, que se lançou pessoalmente para o pleito estadual.\n\nEm dezembro de 1915, disputou a reeleição a deputado estadual na chapa\nliderada pelo senador Miguel de Carvalho, mas não obteve êxito.\n\nSua trajetória política foi voltada para a região de Angra dos Reis.\n\nFaleceu em 1929.\n\n*Vicente Saul Moreira dos Santos*\n\nFONTES: ASSEMB. LEGISL. RJ. *Anais* (1913, 1915, 1929); FERREIRA, M.\n*República*; *Fluminense* (27/2/1914, 21/12/1915); SOARES, E.\n*História*.\n","ref":"FONTES: ASSEMB. LEGISL. RJ. *Anais* (1913, 1915, 1929); FERREIRA, M.\n*República*; *Fluminense* (27/2/1914, 21/12/1915); SOARES, E.\n*História*.\n","dic":"DPRRJ"}
