{"title":"ALBUQUERQUE, Ventura de","cargoss":["Deputado Estadual"],"cargos_esp":[0],"datas_ini":[1901],"datas_fim":[1912],"estados":["RJ"],"autor":[0],"content":"**ALBUQUERQUE, Ventura de**\n\n\\* dep. est. RJ 1901-1912.\n\n*Ventura José de Freitas Albuquerque* nasceu na Bahia, filho de\nFrancisco Maria de Freitas Albuquerque.\n\nBacharelou-se na Faculdade de Direito do Largo de São Francisco, em São\nPaulo, em 1869.\n\nProprietário de fazenda de cana-de-açúcar em Angra dos Reis, onde\nestabeleceu suas bases políticas e eleitorais, elegeu-se deputado\nestadual no estado do Rio de Janeiro no dia 30 de dezembro de 1900.\nPertencia à legenda do Partido Republicano do Rio de Janeiro (PRRJ), que\nfoi fundado em 23 de julho de 1899 por Alberto Torres (1897-1900), então\npresidente do estado do Rio de Janeiro, após divergências com membros do\nPartido Republicano Fluminense (PRF), o qual passou a abrigar a oposição\nestadual.\n\nVentura de Albuquerque assumiu o mandato em setembro de 1901 e foi\nmembro das comissões de Guarda da Constituição, das Leis e de Poderes.\nEm 1903, último ano do mandato, participou da reforma da Constituição\nestadual, articulada pelo recém-eleito presidente estadual Nilo Peçanha\n(1903-1906) e promulgada em 18 de setembro.\n\nNo dia 31 de janeiro de 1904, foi reeleito deputado estadual na legenda\ndo PRRJ. Empossado no mesmo ano, integrou as comissões de Justiça e\nLegislação e da Instrução Pública e de Redação de Leis. Nessa\nlegislatura foi aliado político de Nilo Peçanha. Em dezembro de 1906,\nreelegeu-se deputado estadual pelo PRRJ e por ocasião da votação que\nvisava regulamentar a cobrança da sobretaxa para o café, estipulada pelo\nConvênio de Taubaté (1906), e o destino da arrecadação desse imposto,\nvotou a favor da manutenção da cobrança que havia sido o estopim do\ndistanciamento entre Nilo Peçanha e Alfredo Backer (1906-1910), então\npresidente do estado do Rio de Janeiro.\n\nNas eleições estaduais de dezembro de 1909, Ventura de Albuquerque foi\nreeleito deputado estadual agora na chapa do PRF, partido que passou a\nabrigar o grupo ligado a Nilo Peçanha e que conseguiu eleger a maioria\ndos deputados estaduais. No início dos trabalhos legislativos de 1910,\nfoi eleito primeiro vice-presidente da Assembleia Legislativa do Estado\ndo Rio de Janeiro (ALERJ), tendo participado do chamado “caso\nfluminense”. O acontecimento consistiu no lançamento de duas\ncandidaturas à sucessão estadual em julho de 1910 em que se encontraram,\nde um lado, Backer e seus partidários defendendo a candidatura de Manuel\nEdwiges Queirós Viana e, de outro, Nilo Peçanha e correligionários\napoiando o candidato Francisco Chaves de Oliveira Botelho. Em agosto,\nrealizada a eleição, cada grupo reivindicou a vitória de seu candidato.\nO impasse levou à intervenção do então presidente da República Hermes da\nFonseca (1910-1914) que, em dezembro, empossou o candidato nilista\nOliveira Botelho na presidência do estado do Rio de Janeiro.\n\nEm fevereiro de 1911, Ventura de Albuquerque ingressou no Partido\nRepublicano Conservador Fluminense (PRCF), surgido da fusão do PRF com o\nPartido Republicano Conservador (PRC). Em dezembro de 1912 não concorreu\nàs eleições estaduais.\n\nAo longo de sua trajetória, foi também promotor público em Angra dos\nReis (RJ), chefe de policia no Pará, em São Paulo e na cidade do Rio de\nJaneiro, então sede da Corte imperial. Foi ainda juiz de direito em São\nSebastião (SP), Viçosa (MG) e Angra dos Reis, chegando a desembargador.\n\n*Vicente Saul Moreira dos Santos*\n\nFONTES: ASSEMB. LEGISL. RJ. *Anais* (1903-1906, 1908-1909, 1912);\nFERREIRA, M. *República*; *Jornal do Comércio* (2/6/1904); NOGUEIRA, A.\n*Academia*; SOARES, E. *História*.\n","ref":"FONTES: ASSEMB. LEGISL. RJ. *Anais* (1903-1906, 1908-1909, 1912);\nFERREIRA, M. *República*; *Jornal do Comércio* (2/6/1904); NOGUEIRA, A.\n*Academia*; SOARES, E. *História*.\n","dic":"DPRRJ"}
