{"title":"BRAGANÇA, Valdenir de","cargoss":["Deputado Estadual","Prefeito"],"cargos_esp":[0,"Niterói"],"datas_ini":[1979,1983],"datas_fim":[1983,1988],"estados":["RJ",0],"content":"**BRAGANÇA, Valdenir de**\n\n\\* dep. est. RJ 1979-1983; pref. Niterói 1983-1988.\n\n*Valdenir de Bragança* nasceu em Araruama (RJ) no dia 17 de julho de\n1931, filho de Virgílio de Bragança Quintanilha e de Eulália da Silveira\nBragança.\n\nConcluiu seus estudos secundários no Colégio Brasil, em Niterói, então\ncapital do estado do Rio de Janeiro, e se formou pela Faculdade\nFluminense de Medicina em 1956. No último ano da faculdade foi\npresidente do Centro Acadêmico Professor Barros Terra e, ao mesmo tempo,\ndirigiu o jornal interno que se chamava *A Lanceta*. Fez o internato\nmédico no hospital Antônio Pedro, no Manicômio Judiciário de Niterói, no\nServiço de Assistência Domiciliar e de Urgência (Samdu), na Pro-Matre do\nRio de Janeiro e na Maternidade de São Cristóvão. Em 2001 formou-se em\ndireito na Universidade Salgado de Oliveira (Universo), em Niterói.\n\nEm 1956 ingressou no funcionalismo público como auxiliar da Secretaria\nEstadual de Saúde do Rio de Janeiro. Em seguida trabalhou em diversas\ninstituições de saúde, entre as quais o ambulatório de higiene mental da\nDivisão de Doenças Mentais do Serviço Social da Indústria (SESI), a\nDivisão Hospitalar do Ministério da Saúde (1957-1975), o Hospital Heitor\nCarrilho, o Instituto de Previdência e Assistência aos Servidores do\nEstado (IPASE) e o Instituto Nacional de Assistência Médica e\nPrevidência Social (INAMPS). Em 1960 esteve envolvido com a criação da\nUniversidade Federal Fluminense (UFF) ao organizar seu plano de\nassistência médica. Em seguida, tornou-se catedrático da Escola de\nServiço Social dessa universidade e, posteriormente, professor titular\nda Faculdade de Medicina, função que exerceu até 1996. Entre 1964 e 1966\nfoi presidente do Conselho Regional de Medicina do Rio de Janeiro e,\nentre 1968 e 1971, da Associação Médica Fluminense, período em que\nconstruiu a Casa do Médico, segunda sede dessa instituição. Foi também\npresidente da Associação Médica Brasileira entre 1971 e 1981 e da\nAcademia Fluminense de Medicina, da qual era membro fundador, em 1974.\nNo ano seguinte o prefeito Ronaldo Fabrício o nomeou titular da\nSecretaria Municipal de Saúde de Niterói, logo após a sua criação. A\npartir de 1976 integrou a Associação Médica Mundial.\n\nAinda em 1975, com o apoio do prefeito Ronaldo Fabrício, candidatou-se\npela primeira vez a prefeito de Niterói na legenda da Aliança Renovadora\nNacional (Arena), partido de apoio ao regime militar instituído no país\ndesde 1964. Foi, no entanto, derrotado por Moreira Franco, candidato do\nMovimento Democrático Brasileiro (MDB), partido de oposição ao regime\nmilitar.\n\nNas eleições de novembro de 1978 candidatou-se a deputado estadual no\nestado do Rio de Janeiro, ainda na legenda da Arena, e foi eleito.\nAssumiu uma cadeira na Assembleia Legislativa do Estado do Rio de\nJaneiro (ALERJ) em fevereiro de 1979. Com o fim do bipartidarismo em\nnovembro desse ano e a posterior reformulação partidária, filiou-se ao\nPartido Democrático e Social (PDS).\n\nNa legenda do PDS foi eleito prefeito de Niterói em novembro de 1982,\ntendo tomado posse do mandato em 1983. Entre as medidas tomadas durante\nsua gestão destacam-se a construção do centro administrativo, onde se\nestabeleceria a nova sede da prefeitura, a fundação do Abrigo Municipal\nSão Benedito, a criação da subprefeitura da região Oceânica e das\nsecretarias municipais de Cultura, de Urbanismo e de Bem-Estar Social e\na reforma do Parque da Cidade, quando foi construída uma rampa de voo\nlivre. Durante sua gestão na prefeitura foi ao mesmo tempo presidente da\nAssociação Brasileira de Municípios e, novamente, da Academia Fluminense\nde Medicina, entre 1986 e 1988. Cumpriu o mandato na prefeitura até o\ndia 31 de dezembro de 1988. Entre 1988 e 1990 foi secretário-geral da\nFederação Brasileira das Academias de Medicina.\n\nEm 1990 candidatou-se a deputado federal pelo estado do Rio, agora\nfiliado ao Partido Liberal (PL), contudo não obteve êxito. Entre 2006 e\n2009 foi membro do conselho deliberativo da Associação Brasileira de\nMunicípios.\n\nFoi, ainda, membro das academias Fluminense e Niteroiense de Letras e\nrecebeu o título de cidadão honorário de diversos municípios\nfluminenses, como Niterói, Vassouras, Nilópolis, Santo Antônio de Pádua,\nRio Claro, Magé e Itaperuna. Recebeu condecorações, entre as quais a\nOrdem do Mérito Judiciário, pelo Tribunal de Justiça do Estado do Rio de\nJaneiro; a medalha Tamandaré, pela Marinha de Guerra do Brasil; a\nMedalha do Pacificador, pelo Ministério do Exército; a Medalha\nTiradentes, pela Assembleia Legislativa do Estado do Rio de Janeiro, e\nas medalhas José Clemente e José Cândido de Carvalho, pela Câmara\nMunicipal de Niterói.\n\nFoi casado com Maria Elisa Ranzeiro de Bragança, com quem teve cinco\nfilhos.\n\nPublicou o livro *Terceiridade* e foi coautor de *Aborto e o direito à\nvida*.\n\n*Paulo César Gomes Bezerra*\n\nfontes:ACAD. NITEROIENSE. Disponível em:\n\\<www.academianiteroiense.org.br/academicos.htm\\>. Acesso em:\n19/12/2010; ASSOC. BRAS. **MUNIC.** Disponível em:\\<www.abm.org.br/\\>.\nAcesso em: 19/12/2010; SOARES, E. *Prefeitura*.\n","ref":"","dic":"DPRRJ"}
