{"title":"BRÁULIO, Mesquita","cargoss":["Deputado Estadual","Deputado Estadual","Constituinte"],"cargos_esp":[0,0,"est"],"datas_ini":[1987,1979,1989],"datas_fim":[1991,1983,1989],"estados":["RJ","RJ","RJ"],"autor":["Isadora Tavares Maleval"],"content":"**BRÁULIO, Mesquita**\n\n\\* dep. est. RJ 1979-1983, 1987-1991; const. est. RJ 1989.\n\n*José de Mesquita Bráulio* nasceu em Três Pontas (MG) no dia 11 de\nsetembro de 1939.\n\nTrabalhou como professor e iniciou sua trajetória política em 1976,\nquando foi eleito vereador no Rio de Janeiro. Assumiu o mandato no ano\nseguinte e foi presidente da Comissão de Justiça e Redação na Câmara\nMunicipal. Em novembro de 1978 foi eleito deputado estadual no estado do\nRio, na legenda do Movimento Democrático Brasileiro (MDB), partido de\noposição ao regime militar iniciado no país em 1964. Renunciou ao\nmandato de vereador em 1^o^ de fevereiro de 1979, antes do fim do\nmandato. Em seu lugar Tobias Luiz assumiu uma cadeira na Câmara\nMunicipal.\n\nAssumiu uma cadeira na Assembleia Legislativa do Estado do Rio de\nJaneiro (ALERJ) em fevereiro de 1979. Durante a legislatura foi\npresidente das comissões de Estudos e Planejamento para o\nDesenvolvimento do Estado (1979) e de Normas Internas (1980-1981) e\nmembro das comissões de Educação, Cultura e Desportos (1981-1982), de\nIndicações Legislativas e Proposições Externas (1981-1982) e de Normas\nInternas (1982). Foi, ainda, suplente nas comissões de Emendas\nConstitucionais e Vetos e de Turismo (1979-1982), de Indicações\nLegislativas e Proposições Externas e de Legislação Constitucional\nComplementar e Códigos (1980). Em 1980 fez parte do Bloco Parlamentar do\nPartido Popular (PP).\n\nNas eleições de novembro de 1982 candidatou-se novamente a deputado\nestadual na legenda do Partido do Movimento Democrático Brasileiro\n(PMDB), agremiação criada em 1980 como herdeira do MDB no contexto do\nfim do bipartidarismo, em novembro de 1979, e da consequente\nreorganização partidária. No entanto, não conseguiu se eleger.\n\nCandidatou-se mais uma vez em 1986, agora na legenda do Partido da\nFrente Liberal (PFL), e, no pleito de novembro, foi eleito deputado\nestadual. Durante a legislatura foi líder da bancada do PFL na ALERJ,\nvice-presidente da Comissão de Turismo e Desportos e suplente da\nComissão de Educação. Presidiu a Comissão Parlamentar de Inquérito (CPI)\ncriada para apurar denúncias de irregularidades na compra, permuta e\nvenda de imóveis pela Companhia Estadual de Habitação do Rio de Janeiro\n(CEHAB-RJ) e foi suplente da CPI sobre a destruição do ecossistema da\nlagoa de Araruama.\n\nIntegrou, como primeiro vice-presidente, a Assembleia Estadual\nConstituinte de 1989, reunida para adequar a Constituição fluminense à\nnova Carta federal promulgada em 5 de outubro de 1988, que reorganizou a\nlegislação nacional após a ditadura militar (1964-1985) e que ficou\nconhecida como a “Constituição Cidadã”. A Assembleia Estadual\nConstituinte foi formada pelos deputados estaduais eleitos no Rio de\nJaneiro em 1986 e promulgou a nova Constituição estadual no dia 5 de\noutubro de 1989. A partir dessa data retornou ao exercício do mandato\nordinário na ALERJ.\n\nEm 1990 seu nome foi indicado pela ALERJ para preencher uma vaga de\nconselheiro no Conselho Estadual de Contas dos Municípios, que integrou\naté 1999.\n\n*Isadora Tavares Maleval*\n\nFONTES: ASSEMB. LEGISL. RJ. Disponível em:\n\\<www.alerj.rj.gov.br/memoria/historia/be7894.html\\>. Acesso em:\n10/12/2010; ASSEMB. LEGISL. RJ. *Deputados estaduais fluminenses*.\nQuarta legislatura (1987-1991); CARDIANO, F. *Eleições*; GOMES, M.\n*Palavra*.\n","ref":"FONTES: ASSEMB. LEGISL. RJ. Disponível em:\n\\<www.alerj.rj.gov.br/memoria/historia/be7894.html\\>. Acesso em:\n10/12/2010; ASSEMB. LEGISL. RJ. *Deputados estaduais fluminenses*.\nQuarta legislatura (1987-1991); CARDIANO, F. *Eleições*; GOMES, M.\n*Palavra*.\n","dic":"DPRRJ"}
