{"title":"BRITO, Joaquim Saturnino Ribeiro de","cargoss":["Deputado Estadual"],"cargos_esp":[0],"datas_ini":[1919],"datas_fim":[1923],"estados":["RJ"],"autor":[0],"content":"**BRITO, Joaquim Saturnino Ribeiro de**\n\n\\* dep. est. RJ 1919-1923.\n\n*Joaquim Saturnino Ribeiro de Brito* foi eleito deputado estadual em\njaneiro de 1919 na chapa oficial do Partido Republicano Fluminense\n(PRF). Governava então o estado do Rio de Janeiro Raul Veiga\n(1918-1922), aliado Nilo Peçanha, ex-presidente do estado (1903-1906 e\n1914-1917) e ex-presidente da República (1909-1910). Em maio de 1920,\ndepois da convenção oficial do PRF, o grupo situacionista, liderado por\nNilo Peçanha, passou a usar o nome Partido Republicano do Rio de Janeiro\n(PRRJ), partido que abrigara os nilistas de 1899 a 1911.\n\nJoaquim Saturnino foi reeleito deputado estadual na legenda do PRRJ em\ndezembro de 1921 e, por ocasião da sucessão estadual de julho de 1922,\napoiou a candidatura do nilista Raul Fernandes contra Feliciano Sodré,\ncandidato do PRF, reorganizado a partir da mudança da sigla do Partido\nRepublicano Conservador Fluminense (PRCF). Realizada a eleição, ambos os\ncandidatos se declararam vencedores, o que ensejou uma cisão na\nAssembleia Legislativa do Estado do Rio de Janeiro (ALERJ), formando-se\nduas assembleias. Já que o reconhecimento do presidente do estado era da\ncompetência da Assembleia, a dualidade de assembleias levou à dualidade\nde governos. Seguindo a orientação política de Nilo Peçanha, Raul\nFernandes temia que o novo presidente da República, Artur Bernardes\n(1922-1926), empossado em novembro de 1922 e adversário de Nilo,\ndecretasse a intervenção federal no estado do Rio. Assim, apresentou ao\nSupremo Tribunal Federal um pedido de *hábeas corpus* que assegurasse\nsua posse. Atendido o pedido, Raul Fernandes foi investido na\npresidência do estado, recebendo o cargo de Raul Veiga no palácio do\nIngá, em Niterói, no dia 31 de dezembro de 1922. Entretanto, Feliciano\nSodré também foi empossado por “sua” assembleia no mesmo dia. Alegando a\nduplicidade de poderes no Rio de Janeiro, Artur Bernardes decretou a\nintervenção federal no estado em 1923 e entregou o Executivo fluminense\na Aurelino Leal, que anulou tanto as eleições de 1922 para presidente\nestadual como as eleições legislativas de 1921. Encerrou-se, então, o\nmandato deJoaquim Saturnino Ribeiro de Brito.\n\nDurante sua atividade parlamentar posicionou-se sobre o projeto de\nauxílio às Caixas Rurais, e participou da Comissão de Estatística,\nDivisão Civil e Judiciária e Câmaras Municipais.\n\n*Vicente Saul Moreira dos Santos*\n\nFONTES: ASSEMB. LEGISL. RJ. *Anais* (1919, 1920, 1921); *Estado*\n(17/12/1921, 18/1/1922, 27/7/1922); FERREIRA, M.*República*; SOARES, E.\n*História.*\n","ref":"FONTES: ASSEMB. LEGISL. RJ. *Anais* (1919, 1920, 1921); *Estado*\n(17/12/1921, 18/1/1922, 27/7/1922); FERREIRA, M.*República*; SOARES, E.\n*História.*\n","dic":"DPRRJ"}
