{"title":"BRIZOLA, Alberto","cargoss":["Deputado Estadual","Constituinte",0],"cargos_esp":[0,"est",0],"datas_ini":[1987,1989,1999],"datas_fim":[1995,1989,2007],"estados":["RJ","RJ",0],"autor":[0],"content":"**BRIZOLA, Alberto**\n\n\\* dep. est. RJ 1987-1995; const. est. RJ 1989; 1999-2007.\n\n*Alberto Eli Brizola da Silva* nasceu em 30 de abril de 1959, na cidade\nde Triunfo (RS), filho de Joaquim Brizola e de Aldina Portela. Seu pai\nera primo do proeminente político gaúcho Leonel de Moura Brizola, que\nfoi deputado federal pelo Rio Grande do Sul (1955) e pela Guanabara\n(1963-1964), prefeito de Porto Alegre (1956-1958), Secretário de Obras\n(1952-1954), governador do Rio Grande do Sul (1959-1963) na legenda do\nPartido Trabalhista Brasileiro (PTB) e governador do Rio de Janeiro\n(1983-1987 e 1991-1994) na legenda do Partido Democrático Trabalhista\n(PDT).\n\nFormou-se em jornalismo e em relações internacionais. Ficou conhecido\ncomo radialista, atividade que exerceu desde os 13 anos de idade.\nApresentou um programa na Rádio Mundial AM na década de 1980 que\nalavancou sua carreira na cidade do Rio de Janeiro. Trabalhou também nas\nRádios Globo, 98 FM e Mundial. Na televisão, apresentou o *Programa do\nAmor*, na Rede Bandeirantes, durante cinco anos, e o programa *Caravana\ndo Amor*, na Rede CNT. Posteriormente, transferiu-se para a Rádio El\nShadai (atual 93 FM), de orientação evangélica, na qual trabalhou por\nmais de três anos apresentando o programa *Caravana do Louvor*.\n\nIngressou na política ao se candidatar a deputado estadual no estado do\nRio de Janeiro em 1986 na legenda do PDT. Eleito em novembro, assumiu o\nmandato em fevereiro de 1987 e, durante a legislatura 1987-1991,\npresidiu a Comissão de Defesa dos Direitos Humanos, foi vice-presidente\nda Comissão de Agricultura e Política Rural e integrou a Comissão de\nTrabalho e Legislação Social e a Comissão Parlamentar de Inquérito (CPI)\nsobre o desmatamento no município de Magé. Integrou a Assembleia\nEstadual Constituinte de 1989, reunida para adequar a Constituição\nfluminense à nova Carta federal que havia sido promulgada em 5 de\noutubro de 1988, reorganizou a legislação nacional após a ditadura\nmilitar (1964-1985) e ficou conhecida como a “Constituição Cidadã”. A\nAssembleia Estadual Constituinte foi formada pelos deputados estaduais\neleitos no Rio de Janeiro em 1986 e promulgou a nova Constituição\nestadual no dia 5 de outubro de 1989. A partir dessa data retornou ao\nexercício do mandato ordinário na Assembleia Legislativa do Estado do\nRio de Janeiro (ALERJ).\n\nAinda nessa legislatura, foi autor, entre outros projetos, do que deu\norigem à Lei n^o^ 1.800/1991, que vetou o atendimento por policiais\nhomens às mulheres vítimas de crimes, nas delegacias especializadas\nneste tipo de delito.\n\nEm outubro de 1990 foi reeleito deputado estadual para a legislatura\n1991-1995. Durante o mandato foi segundo suplente e quarto secretário da\nMesa Diretora da Assembleia Legislativa do Estado do Rio de Janeiro\n(ALERJ). Foi autor das leis n^o^ 2.661/1993, que criou a profissão de\nmodelo no estado do Rio de Janeiro, e n^o^ 2.130/1993, que tornou\nobrigatório o serviço de empacotamento nos supermercados. Exerceu o\nmandato até o final da legislatura, em janeiro de 1995.\n\nNas eleições de outubro de 1994 concorreu novamente a uma vaga na ALERJ,\npelo PDT, e obteve uma suplência. Quatro anos depois, em 1998 foi\ncandidato a deputado estadual mais uma vez, agora na legenda do Partido\nda Frente Liberal (PFL), atual Democratas (DEM). Eleito em outubro,\ntomou posse na ALERJ no ano seguinte para a legislatura 1999-2003. Em\n1999 foi vice-líder do PFL na casa e entre 2001 e 2002 foi líder do\npartido. Presidiu a CPI para investigar os bailes *funk*. Entre os\nprojetos de sua autoria destaca-se o que isenta as contas de serviços\npúblicos estaduais, devidas por igrejas e templos de qualquer culto da\ncobrança de Imposto sobre Circulação de Mercadorias (ICMS), que deu\norigem a Lei n^o^ 3.266/1999.\n\nNas eleições de outubro de 2002 foi novamente eleito deputado estadual\nna coligação Todos Pelo Rio, que reuniu, além do seu partido – PFL –, o\nPartido do Movimento Democrático Brasileiro (PMDB) e o Partido da Social\nDemocracia Brasileira (PSDB). Assumiu o mandato em fevereiro de 2003,\npara a legislatura 2003-2007, e, nesse período, mudou de partido,\nfiliando-se ao Partido Socialista Brasileiro (PSB) e, em seguida, ao\nPartido Trabalhista Nacional (PTN), do qual foi líder da bancada na\nALERJ em 2004. Foi autor do projeto de lei n^o^ 718/2003, que proibia a\ncobrança de multas pelos chamados “pardais eletrônicos” entre 1h e 5h.\nDeixou o PTN e retornou para o PDT. Em 2005 passou a apresentar o\nPrograma da Tarde, na rádio Roquette Pinto.\n\nNas eleições de outubro de 2006 foi mais uma vez candidato a deputado\nestadual na legenda do PDT, mas não conseguiu se reeleger.\n\nAo longo de sua vida de parlamentar criou leis que concederam títulos de\nutilidade pública para associações religiosas, culturais e\nprofissionais. Presbiteriano, ficou conhecido por sua vinculação com\ngrupos evangélicos.\n\nFoi casado com Marina de Oliveira, cantora *gospel* efilha de Arolde de\nOliveira, que, também vinculado à igreja evangélica, foi proprietário da\nRádio El Shadai, deputado federal pelo estado do Rio de Janeiro\n(2011-2015) na legenda do partido Democratas (DEM) e secretário\nmunicipal de Transportes no Rio de Janeiro (2003, 2007-2008).\n\n*Cláudia Calmon*\n\nFONTES: ASSEMB. LEGISL. RJ. Disponível em:\n\\<www.alerj.rj.gov.br/jornalalerj/jornalalerj38.pdf\\>. Acesso em:\n24/8/2010; \\<www.alerj.rj.gov.br/processo2.htm\\>. Acesso em: 24/8/2010;\n\\<www.alerj.rj.gov.br/jornalalerj/jornalalerj103.pdf\\>. Acesso em:\n10/11/2010; ASSEMB. LEGISL. RJ. *Deputados* *estaduais fluminenses*\n(1999-2003); Aroldo de Oliveira. Disponível em:\n\\<www.aroldedeoliveira.com.br/…/no-portal-da-camara-uma-pesquisa-fidedigna\\>;\nPortal Transferência Cristã. Disponível em:\n\\<http://transparenciacrista.blogspot.com/2010/10/deputado-federal-arolde-de-oliveira.html\\>.\nAcesso em: 4/1/2011; TRIB. SUP. ELEIT. Disponível em:\n\\<www.tse.jus.br/eleicoes/eleicoes-anteriores\\>.\n","ref":"FONTES: ASSEMB. LEGISL. RJ. Disponível em:\n\\<www.alerj.rj.gov.br/jornalalerj/jornalalerj38.pdf\\>. Acesso em:\n24/8/2010; \\<www.alerj.rj.gov.br/processo2.htm\\>. Acesso em: 24/8/2010;\n\\<www.alerj.rj.gov.br/jornalalerj/jornalalerj103.pdf\\>. Acesso em:\n10/11/2010; ASSEMB. LEGISL. RJ. *Deputados* *estaduais fluminenses*\n(1999-2003); Aroldo de Oliveira. Disponível em:\n\\<www.aroldedeoliveira.com.br/…/no-portal-da-camara-uma-pesquisa-fidedigna\\>;\nPortal Transferência Cristã. Disponível em:\n\\<http://transparenciacrista.blogspot.com/2010/10/deputado-federal-arolde-de-oliveira.html\\>.\nAcesso em: 4/1/2011; TRIB. SUP. ELEIT. Disponível em:\n\\<www.tse.jus.br/eleicoes/eleicoes-anteriores\\>.\n","dic":"DPRRJ"}
