{"title":"BRUNO, Ítalo","cargoss":["Deputado Estadual","Deputado Estadual","Constituinte","Deputado Estadual"],"cargos_esp":["GB",0,"est",0],"datas_ini":[1971,1975,1975,1979],"datas_fim":[1975,1979,1975,1987],"estados":[0,"RJ","RJ","RJ"],"autor":["Sabrina Guerghe"],"content":"**BRUNO, Ítalo**\n\n\\* dep. est. GB 1971-1975; dep. est. RJ 1975-1979; const. est. RJ 1975;\ndep. est. RJ 1979-1987.\n\n*Ítalo Vitorio Bruno* nasceu na cidade do Rio de Janeiro, então Distrito\nFederal, no dia 4 de agosto de 1933.\n\nCursou a Faculdade de Ciências Jurídicas do Rio de Janeiro e ingressou\nna política atuando no Movimento Renovador Universitário entre 1962 e\n1965.\n\nFoi eleito deputado estadual no estado da Guanabara na legenda da\nAliança Renovadora Nacional (Arena), nas eleições de novembro de 1970.\nAssumiu no dia 2 de fevereiro do ano seguinte uma cadeira na Assembleia\nLegislativa do Estado da Guanabara (ALEG) para a legislatura 1971-1975.\nDurante o mandato, foi eleito quarto secretário (1971-1973) da Mesa\nDiretora e vice-presidente da Comissão de Cultura, Desportos e Turismo\n(1973).\n\nNas eleições de novembro de 1974 foi reeleito deputado estadual no\nestado da Guanabara. Tomou posse em fevereiro de 1975 para o mandato\nordinário na Assembleia Legislativa do Estado do Rio de Janeiro (ALERJ)\ne passou a integrar, em março, a Assembleia Constituinte encarregada de\nelaborar a Constituição do novo estado do Rio de Janeiro – resultante da\nfusão do antigo estado do Rio com o da Guanabara, que ocorreria no dia\n15 de março.\n\nNa Assembleia Constituinte, instalada no mesmo dia 15 de março, integrou\na Subcomissão de Finanças e Sistema Tributário da Comissão\nConstitucional. Na ocasião, a maioria emedebista era ligada a Chagas\nFreitas e defendia que não se prolongassem no tempo os trabalhos\nconstituintes. Em apenas quatro meses a nova Carta foi finalizada.\n\nCom a promulgação da nova Constituição estadual em 23 de julho de 1975,\nÍtalo Bruno retornou ao exercício do mandato ordinário na ALERJ.\nIntegrou, ainda, a Comissão de Turismo e Desportos até 1978 e a Comissão\nEspecial para Assuntos do Município do Rio de Janeiro. Em 1976 foi\neleito líder da minoria. Em 1977, foi membro da Comissão Parlamentar de\nInquérito (CPI) sobre o fechamento do Hospital da Cruz Vermelha\nBrasileira. Em 1978 foi escolhido vice-líder do governo.\n\nEm novembro desse ano foi mais uma vez eleito deputado estadual no\nestado do Rio para a legislatura 1979-1983. Tomou posse em fevereiro de\n1979 e, durante o mandato, integrou a Comissão de Indicações\nLegislativas e Proposições Externas e presidiu a Comissão de Turismo até\n1980. Com o fim do bipartidarismo em novembro de 1979 e a posterior\nreformulação partidária, ingressou no Partido Democrático Social (PDS),\nherdeiro político da Arena. Em 1982 foi eleito presidente da Comissão de\nAgricultura e Política Rural.\n\nNo pleito de 1982 conquistou pela quarta vez consecutiva uma cadeira na\nALERJ, agora na legenda do PDS para a legislatura 1983-1987. Empossado\nem fevereiro de 1983, foi vice-líder da bancada do PDS na ALERJ e membro\nda Comissão Especial formada para promover estudos para a realização de\numa ampla revisão constitucional. Deixou a Assembleia Legislativa em 31\nde janeiro de 1987, ao término da legislatura.\n\nAnos depois, em 1998, voltou a se candidatar a deputado estadual no\nestado do Rio, desta vez filiado ao Partido Progressista Brasileiro\n(PPB), mas não conseguiu se eleger.\n\n*Sabrina Guerghe*\n\nFONTES: ASSEMB. LEGISL. RJ. *Anais* (1, 4/1971, v. I, 15-31/3/1975, v.\nI); ASSEMB. LEGISL. RJ. *Deputados estaduais fluminenses*. Terceira\nlegislatura (1983-1987); ASSEMB. LEGISL. RJ. *Documentos*; MOREIRA, L.\n*Mulheres*; TRIB. SUP. ELEIT. (Eleições 1998).\n","ref":"FONTES: ASSEMB. LEGISL. RJ. *Anais* (1, 4/1971, v. I, 15-31/3/1975, v.\nI); ASSEMB. LEGISL. RJ. *Deputados estaduais fluminenses*. Terceira\nlegislatura (1983-1987); ASSEMB. LEGISL. RJ. *Documentos*; MOREIRA, L.\n*Mulheres*; TRIB. SUP. ELEIT. (Eleições 1998).\n","dic":"DPRRJ"}
