{"title":"CABRAL, Ampliato","cargoss":["Deputado Estadual","Deputado Estadual"],"cargos_esp":[0,0],"datas_ini":[1983,1971],"datas_fim":[1987,1975],"estados":["RJ","RJ"],"autor":["Juliana Gagliardi"],"content":"**CABRAL, Ampliato**\n\n\\* dep. est. RJ 1971-1975 e 1983-1987.\n\n*Ampliato Sanches Cabral* nasceu em Paraíba do Sul (RJ) no dia 22 de\noutubro de 1931, filho de Vital Rodrigues Cabral e de Maria José Sanches\nCabral.\n\nFormou-se em direito em Valença (RJ) e trabalhou como professor de\nhistória.\n\nEm novembro de 1966 candidatou-se a deputado estadual na legenda da\nAliança Renovadora Nacional (Arena), mas os 2.335 votos que recebeu não\nforam suficientes para que se elegesse. Na gestão do governador Geremias\nFontes (1967-1971) participou do Movimento Popular de Alfabetização,\ntendo trabalhado na criação de cartilhas para auxiliar a alfabetização\nde adultos. No exercício dessa função, percorreu todo o estado do Rio.\n\nEleito deputado estadual em novembro de 1970, assumiu o mandato em\nfevereiro do ano seguinte**.** Na Assembleia Legislativa do Estado do\nRio de Janeiro (ALERJ), foi membro das comissões de Orçamento e\nFiscalização Financeira; de Constituição e Justiça; de Economia e\nFinanças, e de Redação. Tentou a reeleição no pleito de novembro de\n1974, mas não teve êxito. Deixou a ALERJ ao final da legislatura, em\njaneiro de 1975.\n\nAinda em 1975, foi nomeado chefe da Divisão de Relações Públicas do\nmunicípio de Duque de Caxias pelo coronel Renato Moreira da Fonseca,\nprefeito nomeado por Floriano Faria Lima (1975-1979), governador do novo\nestado resultante da fusão do estado da Guanabara e do antigo estado do\nRio de Janeiro. Depois de deixar a chefia da Divisão, candidatou-se mais\numa vez a deputado estadual, mas não se elegeu.\n\nFiliado ao Partido Democrático Social (PDS), elegeu-se deputado pela\nsegunda vez no pleito de novembro de 1982. No exercício do mandato,\napresentou alguns projetos que foram transformados em lei, como o que\nconsiderava de utilidade pública as associações ligadas aos evangélicos\ne o que determinava a inclusão de aulas de informática na rede oficial\nde ensino do estado.\n\nEm 1986, candidatou-se a deputado federal na coligação Pacto Democrático\nTrabalhista, formada pelo Partido Democrático Trabalhista (PDT), o\nPartido da Juventude (PJ), o Partido Municipalista Brasileiro (PMB) e o\nPartido Comunitário Nacional (PCN), mas não se elegeu. Em janeiro de\n1987, encerrou seu mandato na ALERJ.\n\nEm abril de 1993 assumiu a coordenação regional da Fundação Nacional de\nSaúde (Funasa), subordinada ao Ministério da Saúde. Foi exonerado do\ncargo em novembro do mesmo ano. Em fevereiro de 1998 foi nomeado\nsecretário de Desenvolvimento da Baixada Fluminense e Municípios\nAdjacentes pelo então governador Marcelo Alencar (1995-1998), tendo\npermanecido no cargo até dezembro do mesmo ano. Posteriormente dirigiu o\ncolégio Batista Memorial, em Duque de Caxias, entre 2008 e 2010.\n\nFoi casado e teve dois filhos.\n\n*Juliana Gagliardi*\n\nFONTES: ASSEMB. LEGISL. RJ. *Informações e produtos parlamentares*\n(2000); CANTALEJO, M. *Município*; CARDIANO, F. *Eleições*; *Diário\nOficial da União* (3/11/1993) Disponível em:\n\\<ww.jusbrasil.com.br/diarios/1341581/dou-secao-2-03-11-1993-pg-14\\>\nAcesso em: 2/5/2011. INF. PESS. (2/5/2011).\n","ref":"FONTES: ASSEMB. LEGISL. RJ. *Informações e produtos parlamentares*\n(2000); CANTALEJO, M. *Município*; CARDIANO, F. *Eleições*; *Diário\nOficial da União* (3/11/1993) Disponível em:\n\\<ww.jusbrasil.com.br/diarios/1341581/dou-secao-2-03-11-1993-pg-14\\>\nAcesso em: 2/5/2011. INF. PESS. (2/5/2011).\n","dic":"DPRRJ"}
