{"title":"CABRAL, Otávio","cargoss":["Deputado Estadual"],"cargos_esp":[0],"datas_ini":[1967],"datas_fim":[1969],"estados":["RJ"],"autor":[0],"content":"**CABRAL, Otávio**\n\n\\* dep. est. RJ 1967-1969.\n\n*Otávio Cabral* candidatou-se a deputado estadual no Rio de Janeiro pelo\nPartido Trabalhista Nacional (PTN) nas eleições de outubro de 1962, mas\nnão se elegeu. Filiado à Aliança Renovadora Nacional (Arena), partido de\napoio ao regime militar, candidatou-se novamente em novembro de 1966.\nDessa vez foi eleito, tendo como base eleitoral o município de Itaguaí,\ne assumiu sua cadeira na Assembleia Legislativa fluminense em 1^o^ de\nfevereiro de 1967. Foi escolhido vice-presidente da Comissão de Finanças\ne membro da Comissão dos Servidores Públicos. Não chegou, contudo, a\nconcluir o mandato, pois no dia 14 de março de 1969 foi cassado e teve\nseus direitos políticos suspensos por dez anos pelo Conselho de\nSegurança Nacional, com base no Ato Institucional n^o^ 5, promulgado em\n13 de dezembro de 1968.\n\n*Ioneide Piffano Brion de Souza*\n\nFONTES: ASSEMB. LEGISL. RJ**.** *Anais*; CARDIANO, F.\n*Eleições*(1945-986); OLIVEIRA, P. *Atos*.\n","ref":"FONTES: ASSEMB. LEGISL. RJ**.** *Anais*; CARDIANO, F.\n*Eleições*(1945-986); OLIVEIRA, P. *Atos*.\n","dic":"DPRRJ"}
