{"title":"CABRAL, Wilson","cargoss":["Deputado Estadual"],"cargos_esp":[0],"datas_ini":[2007],"datas_fim":[2011],"estados":["RJ"],"autor":["Ana Beatriz Paes"],"content":"**CABRAL, Wilson**\n\n\\* dep. est. RJ 2007-2011.\n\n*Wilson Rodrigues Cabral* *Filho* nasceu no dia 7 de maio de 1961 na\ncidade de Campos (RJ).\n\nGraduou-se em medicina e obteve o título de mestre em educação médica\npela Universidade Federal do Rio de Janeiro (UFRJ). Especializou-se\ntambém em pediatria e neonatalogia. Foi professor da Faculdade de\nMedicina de Campos e da rede pública do mesmo município. Aprovado em\nconcurso público, atuou como supervisor médico, diretor do departamento\nmédico e diretor do Centro de Controle de Zoonoses da Prefeitura\nMunicipal de Campos. Foi, ainda, subsecretário e secretário municipal de\nSaúde (2005-2006) nesse município.\n\nEntre as medidas que tomou durante sua gestão como secretário de Saúde,\ndefendeu a equiparação dos salários dos médicos e dentistas, conforme\nreivindicações das categorias, buscou regularizar o abastecimento de\nmedicamentos na Farmácia Municipal e nas unidades de saúde, implantou\nmódulos do Programa Saúde da Família e o Serviço de Emergências\nGinecológicas e inaugurou a Central de Regulação de Internações e o\nCentro de Atendimento Psicossocial (CAPS) Infantojuvenil Dr. João\nCastelo Branco.\n\nEm outubro de 2006 elegeu-se deputado estadual no estado do Rio de\nJaneiro, na legenda do Partido Socialista Brasileiro (PSB), tendo como\nbase eleitoral Campos e outros municípios do Norte e do Noroeste\nfluminense. Tomou posse de uma cadeira na Assembleia Legislativa do\nEstado do Rio de Janeiro em fevereiro do ano seguinte e, durante a\nlegislatura 2007-2011, foi líder do seu partido, membro das comissões de\nCiência e Tecnologia e de Agricultura e vice-presidente e relator da\nComissão de Saúde.\n\nEm 2007, foi autor do projeto que originou a Lei n^o^ 5.150, que\ndeterminou a instalação de redutores de velocidade nas rodovias\nestaduais em áreas próximas a estabelecimentos de ensino público ou\nprivado. No ano seguinte obteve a aprovação de outros dois projetos que\noriginaram a Lei n^o^ 5.326, que autorizou o Poder Executivo a firmar\nconvênios com as prefeituras municipais objetivando garantir o\ntransporte para tratamento de doentes, e a Lei n^o^ 5.309, que tornou\nobrigatório o uso de filtros para a contenção de fuligem nas usinas\nsucroalcooleiras. Ainda em 2008 encaminhou três indicações legislativas\nsobre a implantação de delegacias legais nos municípios de Cardoso\nMoreira e de Italva e de implantação de uma Unidade de\nPronto-Atendimento (UPA) em Campos. Em 2009 encaminhou outras indicações\nlegislativas, uma das quais sobre a implantação de uma nova UPA em\nGuarus, também no município de Campos.\n\nEm 2010 candidatou-se mais uma vez a deputado estadual no estado do Rio,\nna coligação Frente de Mobilização Socialista, do seu partido, o PSB,\ncom o Partido da Mobilização Nacional (PMN), e, nas eleições de outubro,\nobteve uma suplência.\n\nNo dia 7 de maio de 2012 foi nomeado secretário de Meio Ambiente de\nCampos pela prefeita Rosinha Garotinho (2009-).\n\nFoi casado e teve dois filhos.\n\n*Ana Beatriz Paes*\n\nFONTES: ASSEMB. LEGISL. RJ. Disponível em: \\<www.alerj.rj.gov.br\\>;\nPágina pessoal. Disponível em: \\<www.deputadowilsoncabral.com.br\\>.\n","ref":"FONTES: ASSEMB. LEGISL. RJ. Disponível em: \\<www.alerj.rj.gov.br\\>;\nPágina pessoal. Disponível em: \\<www.deputadowilsoncabral.com.br\\>.\n","dic":"DPRRJ"}
