{"title":"CALDARA, João","cargoss":["Deputado Estadual","Constituinte","Deputado Estadual"],"cargos_esp":[0,"est",0],"datas_ini":[1967,1989,1987],"datas_fim":[1971,1989,1991],"estados":["RJ","RJ","RJ"],"autor":["Sabrina Guerghe"],"content":"**CALDARA, João**\n\n\\* dep. est. RJ 1967-1971; const. est. RJ 1989; dep. est. RJ 1987-1991.\n\n*João Ésio Caldara* nasceu em Petrópolis, na região serrana do estado do\nRio de Janeiro, no dia 5 de fevereiro de 1929.\n\nEmpresário, iniciou sua vida pública elegendo-se vereador em Petrópolis\nnas eleições de 7 de outubro de 1962. Assumiu uma cadeira na Câmara\nMunicipal para a legislatura 1963-1966.\n\nEm outubro de 1965 o regime militar, iniciado no ano anterior, editou o\nAto Institucional n^o^ 2 que extinguiu os partidos políticos em vigor\naté então. Em novembro foi expedido o Ato Complementar n^o^ 4, que\ndispôs sobre a reorganização partidária, que resultou no bipartidarismo.\nDois partidos foram criados: a Aliança Renovadora Nacional (Arena), de\napoio ao regime iniciado em 1964, e o Movimento Democrático Brasileiro\n(MDB), de oposição. Nesse contexto, candidatou-se, em 1966, a deputado\nestadual no estado do Rio, na legenda do MDB. Eleito, assumiu no ano\nseguinte o mandato na Assembleia Legislativa do Estado do Rio de Janeiro\n(ALERJ) para a legislatura 1967-1971. Durante o mandato integrou a\nComissão de Orçamento, foi vice-líder da oposição e primeiro suplente da\nMesa Diretora da ALERJ.\n\nNas eleições de 15 de novembro de 1970 foi eleito prefeito em\nPetrópolis, pelo MDB, para um mandato de dois anos. Foi o sucessor de\nPaulo José Alves Rattes, prefeito em exercício e vice de Paulo Gratacós,\nque teve seus direitos políticos cassados pela ditadura militar. Tomou\nposse em 31 de janeiro de 1971 e, no ano seguinte, inaugurou o Relógio\ndas Flores, que se tornou um ponto turístico na cidade, construído no\ncontexto das comemorações dos 150 anos da Independência do Brasil. Ainda\nem 1972, último ano do mandato, oficializou o hino de Petrópolis, de\nautoria de Geraldo Ventura Dias.\n\nCandidatou-se a deputado federal pelo Rio de Janeiro nas eleições de\nnovembro de 1978 na legenda da Arena, mas não conseguiu se eleger.\n\nEm 1986 candidatou-se novamente a deputado estadual no estado do Rio,\nagora na legenda do Partido do Movimento Democrático Brasileiro (PMDB),\nherdeiro político do MDB criado após o fim do bipartidarismo em novembro\nde 1979. Eleito, assumiu o mandato em fevereiro de 1987. Integrou a\nAssembleia Estadual Constituinte de 1989, reunida para adequar a\nConstituição fluminense à nova Carta federal promulgada em 5 de outubro\nde 1988, que reorganizou a legislação nacional após a ditadura militar\n(1964-1985) e ficou conhecida como a “Constituição Cidadã”. A Assembleia\nEstadual Constituinte foi formada pelos deputados estaduais eleitos no\nRio de Janeiro em 1986 e promulgou a nova Constituição estadual no dia 5\nde outubro de 1989. A partir dessa data retornou ao exercício do mandato\nordinário na Assembleia Legislativa do Estado do Rio de Janeiro (ALERJ).\nDurante a legislatura, presidiu a Comissão de Fiscalização Financeira e\nTomada de Contas, integrou a Comissão de Orçamento e Finanças e foi\nsuplente nas comissões de Redação, Indicações Legislativas e Proposições\nExternas e de Obras Públicas. Entre 1987 e 1990 foi autor de 17\nresoluções de concessão de títulos a cidadãos do estado do Rio.\n\nFoi também membro benemérito da Academia Petropolitana de Poesia Raul de\nLeoni e da Casa do Hemofílico de Petrópolis.\n\n*Sabrina Guerghe*\n\nFONTES: ASSEMB. LEGISL. RJ. *Deputados estaduais fluminenses*. Quarta\nlegislatura (1987-1991); ASSEMB. LEGISL. RJ. *Documentos*; CÂM. MUN.\nPETRÓPOLIS. Disponível em: \\<www.cmp.rj.gov.br/docs/historia12.doc\\>;\nCARDIANO, F. *Eleições*; Diário de Petrópolis(6/1/2009); *Diário Oficial\ndo Estado de São Paulo* (13/4/1967). Disponível em:\n\\<www.jusbrasil.com.br/diarios/4451934/dosp-poder-executivo-13-04-1967-pg-33/pdfView\\>.\nAcesso em: 13/6/2012; IG Turismo. Disponível em:\n\\<http://turismo.ig.com.br/noticia/2008/06/18/o\\_que\\_fazer\\_em\\_petropolis\\_1370967.html\\>.\n","ref":"FONTES: ASSEMB. LEGISL. RJ. *Deputados estaduais fluminenses*. Quarta\nlegislatura (1987-1991); ASSEMB. LEGISL. RJ. *Documentos*; CÂM. MUN.\nPETRÓPOLIS. Disponível em: \\<www.cmp.rj.gov.br/docs/historia12.doc\\>;\nCARDIANO, F. *Eleições*; Diário de Petrópolis(6/1/2009); *Diário Oficial\ndo Estado de São Paulo* (13/4/1967). Disponível em:\n\\<www.jusbrasil.com.br/diarios/4451934/dosp-poder-executivo-13-04-1967-pg-33/pdfView\\>.\nAcesso em: 13/6/2012; IG Turismo. Disponível em:\n\\<http://turismo.ig.com.br/noticia/2008/06/18/o\\_que\\_fazer\\_em\\_petropolis\\_1370967.html\\>.\n","dic":"DPRRJ"}
