{"title":"CAMPOS JÚNIOR, Manuel Teixeira","cargoss":["Deputado Estadual"],"cargos_esp":[0],"datas_ini":[1959],"datas_fim":[1962],"estados":["RJ"],"autor":[0],"content":"**CAMPOS JÚNIOR, Manuel Teixeira**\n\n\\* dep. est. RJ 1959-1962.\n\n*Manuel Teixeira Campos Júnior* nasceu em Barra do Piraí (RJ) em maio de\n1893, filho de Manuel Teixeira Campos e de Otávia da Silva Campos. Era\nconhecido em sua cidade natal como Manequinho.\n\nEstudos no Colégio Diocesano São José no Rio de Janeiro, então Distrito\nFederal. Retornou para sua cidade natal, onde foi tesoureiro da\nprefeitura, coletor federal e iniciou sua trajetória pública como\nvereador.\n\nNo pleito de outubro de 1954 concorreu a uma vaga na Assembleia\nLegislativa do Estado do Rio de Janeiro (ALERJ), na legenda do Partido\nSocial Democrático (PSD), mas não obteve êxito. Candidatou-se novamente\na deputado estadual nas eleições de outubro de 1958, agora na legenda do\nPartido Trabalhista Brasileiro (PTB). Eleito, assumiu o mandato em\nfevereiro do ano seguinte.\n\nNa ALERJ, participou dos debates representando Barra do Piraí e região.\nIntegrou as comissões de Servidores Públicos, de Orçamento e de\nFiscalização Financeira.\n\nFaleceu em Barra do Piraí em dezembro de 1965.\n\nEra casado com Maria Aparecida de Lima Campos, com quem teve cinco\nfilhos. Um deles, Nilo Teixeira Campos, foi prefeito de Piraí\n(1959-1963), deputado estadual (1963-1969 e 1987-1991) e senador (2001)\npelo estado do Rio de Janeiro.\n\n*Vicente Saul Moreira dos Santos*\n\nFONTES: ASSEMB. LEGISL. RJ. *Anais* (1959); CARDIANO, F. *Eleição*.\n","ref":"FONTES: ASSEMB. LEGISL. RJ. *Anais* (1959); CARDIANO, F. *Eleição*.\n","dic":"DPRRJ"}
