{"title":"CAMPOS, Sena","cargoss":["Deputado Estadual"],"cargos_esp":[0],"datas_ini":[1901],"datas_fim":[1903],"estados":["RJ"],"autor":["Raimundo Helio Lopes"],"content":"**CAMPOS, Sena**\n\n\\* dep. est. RJ 1901-1903.\n\n*Bernardino de Almeida Sena Campos* elegeu-se deputado estadual no\nestado do Rio de Janeiro em 30 de dezembro de 1900, pelo terceiro\ndistrito eleitoral, com sede em Cantagalo, na legenda do Partido\nRepublicano do Rio de Janeiro (PRRJ). O PRRJ fora fundado em 23 de julho\nde 1899 pelos partidários do então presidente do estado do Rio de\nJaneiro Alberto Torres (1897-1900), que romperam com o Partido\nRepublicano Fluminense (PRF) diante das divergências envolvendo a\ninfluência do PRF sobre o governo estadual. Ao nascer como força\nsituacionista, o PRRJ garantiu um lugar de destaque no jogo político\nestadual e, no pleito de 1900, conseguiu eleger a maioria dos deputados\nestaduais, vencendo o PRF, agremiação que passou, então, a abrigar a\noposição estadual.\n\nNessa legislatura, iniciada em setembro de 1901, Sena Campos foi\nsucessivamente eleito membro da Comissão de Instrução Pública. Em 1902\nfoi um dos deputados que integrou o “Grupo de Petrópolis”, defensor da\nmanutenção da capital do estado nessa cidade. Esse grupo foi derrotado\npelo liderado por Nilo Peçanha, então principal nome do PRRJ e futuro\npresidente do estado (1903-1906), que conseguiu a aprovação, em agosto\nde 1902, na Assembleia Legislativa do Estado do Rio de Janeiro (ALERJ),\nda lei número 542, que determinou a volta da capital para Niterói, de\nonde saíra em 1894. Os trabalhos ordinários legislativos iniciados em\nsetembro de 1902 já foram realizados em Niterói.\n\nEm 1903, último ano do mandato, participou da reforma da Constituição\nestadual, articulada pelo recém-eleito presidente estadual Nilo Peçanha\n(1903-1906). Aprovada pela ALERJ em 18 de setembro desse ano, a reforma\ndeterminou, entre outras medidas, o fortalecimento do Executivo estadual\na partir da diminuição das atribuições do Legislativo e do Judiciário; o\naumento do mandato do presidente estadual de três para quatro anos; a\nredução do número de deputados estaduais de 60 para 45 e a nomeação pelo\npresidente estadual dos prefeitos dos municípios nos quais o governo\nestadual fosse responsável por parte dos financiamentos de obras\npúblicas – casos dos importantes municípios de Niterói, então capital do\nestado, Campos e Petrópolis.\n\n*Raimundo Helio Lopes*\n\nFONTES: ASSEMB. LEGISL. RJ. *Anais* (1901-1903); FERREIRA, M.\n*República*.\n","ref":"FONTES: ASSEMB. LEGISL. RJ. *Anais* (1901-1903); FERREIRA, M.\n*República*.\n","dic":"DPRRJ"}
