{"title":"CARNEIRO, Otávio","cargoss":["Prefeito"],"cargos_esp":["Niterói"],"datas_ini":[1914],"datas_fim":[1918],"estados":[0],"content":"**CARNEIRO, Otávio**\n\n\\* pref. Niterói 1914-1918.\n\n*Manuel Otávio de Sousa Carneiro* nasceu em Niterói no dia 24 de maio de\n1881, filho de Francisco Fernandes Carneiro e de Maria Josefa de Sousa\nCarneiro. Seu irmão, o jurista Levi Fernandes Carneiro, foi um dos\nfundadores e o primeiro presidente da Ordem dos Advogados do Brasil\n(OAB). Sua irmã, Célia Carneiro Guimarães, era casada com o almirante\nProtógenes Guimarães, governador do estado do Rio de Janeiro entre 1935\ne 1937.\n\nCursou o secundário no Liceu de Niterói e em 1900 formou-se engenheiro\npela Escola Politécnica do Rio de Janeiro. Em 1902 substituiu Everardo\nBackheuser como preparador da cadeira de mineralogia da Escola\nPolitécnica. Dois anos depois, em 1904, foi designado pelo prefeito de\nNiterói, Paulo Alves, para assumir o cargo de operador de nível da\nComissão de Construção da Rede de Esgotos, dirigida por Jorge Lóssio. No\nmesmo ano, já na gestão do prefeito Benedito Gonçalves Pereira Nunes,\nfoi nomeado diretor municipal de Obras de Niterói, cargo que exerceria\naté 1907, quando ingressou na empresa Guinle & Cia. Vinculado à empresa,\natuou na extensão da rede de iluminação elétrica na Bahia e em Goiás.\nPosteriormente retornou à Niterói, onde abriu um escritório de\nengenharia.\n\nEm 1914, foi indicado pelo presidente do estado do Rio de Janeiro, Nilo\nPeçanha (1914-1917), para o cargo de prefeito de Niterói, que assumiu no\ndia 31 de dezembro daquele ano. Sua administração transcorreu em meio a\nproblemas financeiros gerados pela Primeira Guerra Mundial, além da\ncrise política interna e da epidemia de gripe espanhola que atingiu o\npaís em 1918. Buscou reequilibrar a economia municipal através do\nfavorecimento das classes produtoras ao implementar medidas como a\nisenção e a anistia fiscal, a diminuição de impostos, sobretudo o\nimposto predial, e o perdão de multas. No entanto, a redução drástica da\nreceita municipal ocasionou o atraso do pagamento de funcionários e\nfornecedores, a paralisação das obras iniciadas nos governos anteriores\nde Feliciano Sodré (1910-1914) e Vilanova Machado (1914) e,\nconsequentemente, o sucateamento de materiais e equipamentos já\nadquiridos. Tudo isso fez com que obras importantes como a duplicação da\nsegunda adutora da Serra de Friburgo tivessem sua conclusão atrasada por\nmais de 20 anos. Outras obras, como a construção de redes de esgoto e a\nurbanização do Campo Sujo, também foram interrompidas, e foi extinto o\nLaboratório Municipal de Análises, considerado um dos melhores do país.\nConseguiu, por outro lado, promover o abastecimento de água do morro de\nSão Lourenço, o calçamento de ruas – como aquelas que ligavam o centro\nao terminal ferroviário do Barreto –, o aterro da avenida Estácio de Sá,\natual avenida Roberto Silveira, e a criação da primeira escola pública\nmunicipal no morro do Atalaia.\n\nEm 1918, ao deixar a prefeitura, passou a exercer suas atividades de\nengenheiro no Lóide Nacional e foi também diretor dos Estaleiros\nGuanabara, ligados ao Grupo Martineli.\n\nFaleceu no dia 1^o^ de março de 1920 em Niterói.\n\nFoi casado com Olga Paranhos de Sousa Carneiro, com quem teve quatro\nfilhos.\n\n*Paulo César Gomes Bezerra*\n\nfONTES: SOARES, E. *Prefeitura*; SOARES, E. *Ruas*; WEHRS,C. *Niterói*.\n","ref":"","dic":"DPRRJ"}
