{"title":"CARVALHO NETO, Raimundo Barbosa de","cargoss":["Deputado federal","Deputado Estadual"],"cargos_esp":[0,0],"datas_ini":[1958,1963],"datas_fim":[1959,1971],"estados":["PI","RJ"],"autor":[0],"content":"**CARVALHO NETO, Raimundo Barbosa de**\n\n\\* dep. fed. PI 1958-1959; dep. est. RJ 1963-1971.\n\n*Raimundo Barbosa de Carvalho Neto* nasceu em Amarante (PI) no dia 22 de\noutubro de 1903, filho de Orlando Barbosa de Carvalho e de Anatália de\nCarvalho.\n\nFez os primeiros estudos em sua cidade natal e o secundário no Liceu\nPiauiense, em Teresina. Em seguida, cursou a Escola Politécnica do Rio\nde Janeiro, então Distrito Federal, pela qual se formou engenheiro civil\ne geógrafo em 1925.\n\nDe 1926 a 1928 lecionou no Liceu de Teresina. Em seguida, como\nengenheiro, trabalhou em São Paulo na estrada de ferro Mayrink-Santos e\ndirigiu o departamento técnico da Comissão de Saneamento do Estado do\nRio de Janeiro.\n\nEm 1932 tornou-se engenheiro da prefeitura do Distrito Federal por\nconcurso, sendo promovido a engenheiro chefe da mesma em 1937. Elegeu-se\nem outubro de 1954 suplente de deputado federal pelo Piauí na legenda da\nUnião Democrática Nacional (UDN), exercendo o mandato de 12 de setembro\nde 1958 a 31 de janeiro de 1959.\n\nRadicado no Rio de Janeiro, foi secretário de Obras do estado da\nGuanabara durante quatro meses, no início do governo de Carlos Lacerda\n(1960-1965). Em outubro de 1962 elegeu-se deputado estadual pelo Rio de\nJaneiro na legenda da Aliança Renovadora Nacional (Arena), partido de\napoio ao regime militar instalado no país em abril de 1964. Reelegeu-se\ndeputado estadual pela legenda arenista no pleito de outubro de 1966 e\ndeixou a Assembleia Legislativa do Estado do Rio de Janeiro em janeiro\nde 1971, ao final da legislatura.\n\nFoi também engenheiro chefe da Construtora Meridional S.A. e professor\nda Faculdade Nacional de Arquitetura e da Escola Politécnica do Rio de\nJaneiro. Presidiu ainda o Sindicato Nacional de Engenheiros.\n\nEm sua homenagem, o teatro da Universidade Federal do Rio de Janeiro,\nconstruído no *campus* da Praia Vermelha, foi batizado com o nome de\nTeatro de Arena Carvalho Neto.\n\nCasou-se com Valmira de Carvalho Neto, com quem teve dois filhos.\n\nFONTES: CÂM. DEP. *Deputados*; HIRSCHOWICZ, E. *Contemporâneos*; INF.\nValmira de Carvalho Neto; *Quem é quem no Brasil*; TRIB. SUP. ELEIT.\n*Dados*.\n","ref":"FONTES: CÂM. DEP. *Deputados*; HIRSCHOWICZ, E. *Contemporâneos*; INF.\nValmira de Carvalho Neto; *Quem é quem no Brasil*; TRIB. SUP. ELEIT.\n*Dados*.\n","dic":"DPRRJ"}
