{"title":"CARVALHO, Alberto dos Santos","cargoss":["Deputado Estadual"],"cargos_esp":[0],"datas_ini":[1923],"datas_fim":[1926],"estados":["RJ"],"autor":["Raimundo Helio Lopes"],"content":"**CARVALHO, Alberto dos Santos**\n\n\\* dep. est. RJ 1923-1926.\n\n*Alberto dos Santos Carvalho* foi eleito deputado estadual no Rio de\nJaneiro pelo primeiro distrito eleitoral, com sede em Niterói, em 28 de\noutubro de 1923, na legenda do Partido Republicano Fluminense (PRF). Com\no início dos trabalhos legislativos, em 27 de novembro desse ano,\nparticipou do reconhecimento pela Assembleia Legislativa do Estado do\nRio de Janeiro (ALERJ) da eleição de Feliciano Sodré para presidente do\nRio de Janeiro (1923-1927), encerrando o período de intervenção federal\nno estado que fora motivado pela duplicidade de poderes no contexto de\nambos os candidatos à presidência do estado – Raul Fernandes e Feliciano\nSodré – terem se declarado vencedores nas eleições de julho de 1922.\n\nDurante o mandato integrou a Comissão de Viação e Obras Públicas da\nALERJ. Em 1926, ano final dessa legislatura, reaproximou-se da oposição\ne participou da convenção do Partido Republicano do Rio de Janeiro\n(PRRJ), representando o município de Vassouras (RJ).\n\n*Raimundo Helio Lopes*\n\nFONTES: ASSEMB. LEGISL. RJ. *Anais* (1923-1926); *Estado* (5/12/1926);\nFERREIRA, M. *República*.\n","ref":"FONTES: ASSEMB. LEGISL. RJ. *Anais* (1923-1926); *Estado* (5/12/1926);\nFERREIRA, M. *República*.\n","dic":"DPRRJ"}
