{"title":"CARVALHO, Antônio de","cargoss":["Deputado Estadual","Deputado Estadual"],"cargos_esp":[0,0],"datas_ini":[1996,1991],"datas_fim":[1997,1995],"estados":["RJ","RJ"],"autor":["Luzia Costa Becker"],"content":"**CARVALHO, Antônio de**\n\n\\* dep. est. RJ 1991-1995, 1996-1997.\n\n*Antônio Pereira Alves de Carvalho*nasceu em São João de Meriti (RJ), na\nBaixada Fluminense, no dia 13 de maio de 1947.\n\nFormou-se técnico em contabilidade no Colégio Pavunense em 1965.\nBacharelou-se em direito pela Faculdade Brasileira de Ciências Jurídicas\nem 1974, especializando-se nas áreas tributária e administrativa. Fez,\nainda, cursos de psicologia e relações públicas e humanas na Casa do\nPolicial. Foi diretor da Associação Comercial e Industrial de São João\nde Meriti de 1983 a 1985. Fundou a associação profissional do\ncontabilista nesse município e o Sindicato dos Contabilistas da Baixada\nFluminense, do qual foi diretor.\n\nIntegrante do antigo Partido Democrático Cristão (PDC), iniciou sua vida\npública em 1988 como vice-prefeito na chapa vitoriosa de José de Amorim\npara o período de 1989 a 1992. Em 1990 deixou o cargo para pleitear uma\nvaga na Assembleia Legislativa do Estado do Rio de Janeiro (ALERJ). Foi\neleito deputado estadual para a legislatura 1991-1995. Em 1992\ndesligou-se do PDC e passou a integrar a bancada do Partido da Frente\nLiberal (PFL). Nessa legislatura foi quarto vice-presidente da Mesa\nDiretora da ALERJ (1992). Afastou-se do mandato para assumir o cargo de\nsecretário de Habitação em julho de 1993, durante o governo Brizola\n(1991-1994). Exerceu o cargo até abril de 1994 e retornou à ALERJ em\nseguida. Em 18 de julho desse ano foi sancionada a Lei n^o^ 2.296, de\nsua autoria, que determinava que nos estabelecimentos de ensino,\nestaduais ou particulares, no âmbito do estado deveria haver pelo menos\numa biblioteca.\n\nEm 1994, agora filiado ao Partido Liberal (PL), candidatou-se mais uma\nvez a deputado estadual no Rio de Janeiro nas eleições de outubro.\nObteve uma suplência para a legislatura 1995-1999. Tendo assumido o\nmandato durante a legislatura, integrou a Comissão de Constituição e\nJustiça e foi vice-presidente da Comissão de Assuntos Municipais e\nDesenvolvimento Regional e da Comissão Parlamentar de Inquérito (CPI)\nsobre a contratação dos serviços de terceiros por órgãos da\nadministração estadual e integrou a Comissão Especial formada para\nelaborar anteprojeto de Lei Complementar do novo estatuto dos servidores\nmilitares do estado. Integrou a CPI formada para apurar denúncias de\nirregularidades cometidas em diversos setores da Companhia Estadual de\nÁguas e Esgotos (CEDAE), foi relator da CPI sobre supostas\nirregularidades na Rede Hospitalar Pública, credenciada e conveniada ao\nSistema Único de Saúde (SUS) e da Comissão Especial para elaborar\npropostas à regulamentação da legislação sobre segurança privada no\nestado. Em 1996, tendo retornado ao PFL, foi o segundo vice-líder do\npartido na ALERJ e integrou a Comissão de Orçamento, Finanças e de\nTributação, a Comissão Especial para acompanhar a implantação do\ntransporte alternativo no estado e a CPI para apurar denúncias de\nirregularidades na compra e distribuição de leite em pó por varias\nprefeituras no estado do Rio. Foi também vice-presidente da Comissão de\nDefesa do Consumidor e da CPI para apurar irregularidades nas licitações\ne concessões de serviços públicos por órgãos da administração direta e\nindireta do Governo do Estado do Rio de Janeiro.\n\nAinda em 1996 candidatou-se a prefeito de São João de Meriti pelo PFL.\nNessa eleição teve apoio ostensivo do então prefeito do Rio de Janeiro,\nCésar Maia, que era do mesmo partido. Eleito no segundo turno, assumiu a\nprefeitura em janeiro de 1997.\n\nEm 2000, último ano de sua gestão, candidatou-se novamente a prefeito,\ndesta vez filiado ao Partido do Movimento Democrático Brasileiro (PMDB),\nna coligação “Coragem de fazer”, que reuniu, além do seu partido, o\nPartido Trabalhista Brasileiro (PTB), o PFL, o Partido Trabalhista\nNacional (PTN), o Partido Progressista Brasileiro (PPB), o Partido\nRenovador Trabalhista Brasileiro (PRTB), o Partido Social Cristão (PSC),\no Partido Geral dos Trabalhadores (PGT) e o Partido de Reedificação da\nOrdem Nacional (Prona). Foi eleito no primeiro turno e assumiu o novo\nmandato em janeiro de 2001.\n\nFoi presidente da Associação de Prefeitos da Baixada Fluminense entre\njaneiro de 2000 e dezembro de 2002 e entre janeiro e dezembro de 2004.\nFundou e presidiu o Consórcio Intermunicipal da Baixada Fluminense\n(Cisbaf) entre junho de 2004 e dezembro de 2006. Foi também\nvice-presidente da Associação de Prefeitos do Estado do Rio de Janeiro\n(Apremerj). Após o fim do mandato de prefeito, em 2004, continuou\nparticipando de conselhos no estado, como o Conselho Estadual de\nRecursos Hídricos. Foi conselheiro da Agência Reguladora de Serviços\nPúblicos Concedidos de Transportes Aquaviários, Ferroviários e\nMetroviários e de Rodovias do Estado do Rio de Janeiro (Agetransp) entre\n2005 e 2009.\n\nEm 2010 candidatou-se novamente a deputado estadual no estado do Rio, na\nlegenda do PSC, e obteve uma suplência.\n\nFoi casado com Almerinda de Carvalho, que foi deputada federal pelo Rio\nde Janeiro (1999-2007). Tiveram três filhos.\n\n*Luzia Costa Becker*\n\n**FONTES:** ASSEMB. LEGISL. RJ. *Deputados estaduais fluminenses*. Sexta\nlegislatura (1995-1999); ASSEMB. LEGISL. RJ. Requerimento de informações\nn^o^ 198/2008 RJ. Disponível em:\n\\<http://alerjln1.alerj.rj.gov.br/scpro0711.nsf\\>;\n\\<hwww.alerj.rj.gov.br/common/noticia\\_corpo2.asp?num=507\\>; CÂM. DEP.\nDisponível em: \\<www2.camara.gov.br/busca/?wicket:interface=:0:1\\>;\nCENTRO FEMINISTA DE ESTUDOS E ASSESSORIA. Disponível em:\n\\<www.cfemea.org.br/.\\>; *Diário Oficial RJ* (18/2/1976, p. 10, Seção\nII); SUP. TRIB. JUSTIÇA. Disponível em:\n\\<www.stj.gov.br/webstj/Processo/Justica/detalhe.asp?numreg=200500197706&p=000000000000\\>;\nTRIB. SUP. ELEIT. Disponível em:\n\\<www.tse.gov.br/internet/eleicoes/2006/result\\_eleicao.htm\\>;\n\\<www.tse.gov.br/internet/eleicoes/estatistica2008/est\\_result/resultadoEleicao.htm\\>;\nVote Brasil. Disponível em:\n\\<www.votebrasil.com/eleicao/eleicoes-anteriores/1996/prefeito/rj/sao-joao-de-meriti\\>.\n","ref":"**FONTES:** ASSEMB. LEGISL. RJ. *Deputados estaduais fluminenses*. Sexta\nlegislatura (1995-1999); ASSEMB. LEGISL. RJ. Requerimento de informações\nn^o^ 198/2008 RJ. Disponível em:\n\\<http://alerjln1.alerj.rj.gov.br/scpro0711.nsf\\>;\n\\<hwww.alerj.rj.gov.br/common/noticia\\_corpo2.asp?num=507\\>; CÂM. DEP.\nDisponível em: \\<www2.camara.gov.br/busca/?wicket:interface=:0:1\\>;\nCENTRO FEMINISTA DE ESTUDOS E ASSESSORIA. Disponível em:\n\\<www.cfemea.org.br/.\\>; *Diário Oficial RJ* (18/2/1976, p. 10, Seção\nII); SUP. TRIB. JUSTIÇA. Disponível em:\n\\<www.stj.gov.br/webstj/Processo/Justica/detalhe.asp?numreg=200500197706&p=000000000000\\>;\nTRIB. SUP. ELEIT. Disponível em:\n\\<www.tse.gov.br/internet/eleicoes/2006/result\\_eleicao.htm\\>;\n\\<www.tse.gov.br/internet/eleicoes/estatistica2008/est\\_result/resultadoEleicao.htm\\>;\nVote Brasil. Disponível em:\n\\<www.votebrasil.com/eleicao/eleicoes-anteriores/1996/prefeito/rj/sao-joao-de-meriti\\>.\n","dic":"DPRRJ"}
