{"title":"CARVALHO, Elci de","cargoss":["Deputado Estadual","Deputado Estadual","Constituinte"],"cargos_esp":["GB",0,"est"],"datas_ini":[1971,1975,1975],"datas_fim":[1975,1979,1975],"estados":[0,"RJ","RJ"],"autor":["Sabrina Guerghe","Bruno Marques"],"content":"**CARVALHO, Elci de**\n\n\\* dep. est. GB 1971-1975; dep. est. RJ 1975-1979; const. est. RJ 1975.\n\n*Elci Coelho da Rocha Carvalho* nasceu no dia 8 de maio de 1929.\n\nNas eleições de novembro de 1970 elegeu-se deputado estadual na\nGuanabara, pelo Movimento Democrático Brasileiro (MDB), para a\nlegislatura 1971-1975, e no dia 1^o^ de fevereiro de 1971 tomou posse.\nDurante o exercício do mandato na Assembleia Legislativa do Estado da\nGuanabara (ALEG) foi membro efetivo da Comissão de Constituição e\nJustiça e integrou, como relator, em substituição a Nestor Nascimento,\nque renunciou à função, a comissão parlamentar de inquérito (CPI)\nencarregada de investigar o tráfico e o uso de tóxicos no estado.\n\nCandidatou-se com êxito à reeleição no pleito de 15 de novembro de 1974,\nabordando como compromissos de campanha a defesa dos funcionários do\nestado, dos guardadores de automóveis, das professoras primárias,\nmerendeiras e serventes da Secretaria de Educação. Tomou posse em\nfevereiro de 1975 e a partir de março passou a integrar a Assembleia\nConstituinte encarregada de elaborar a Constituição do novo estado do\nRio de Janeiro resultante da fusão entre o antigo estado do Rio e o\nestado da Guanabara. Foi vice-líder da maioria na Constituinte e, com a\npromulgação da nova Constituição estadual em 23 de julho de 1975,\nretornou ao exercício do mandato ordinário na Assembleia Legislativa do\nEstado do Rio de Janeiro (ALERJ).\n\nCandidatou-se mais uma vez no pleito de novembro de 1978, sempre pelo\nMDB, mas os 13.742 votos que recebeu não foram suficientes para que se\nelegesse. Deixou a ALERJ em 31 de janeiro de 1979, ao término da\nlegislatura.\n\nFaleceu no dia 8 de agosto de 2003.\n\nFoi casado com Sheila Varela Coelho da Rocha Carvalho, com quem teve um\nfilho.\n\n*Sabrina Guerghe/**Bruno Marques*\n\nFONTES: ANASPS. Disponível em:\n\\<www.anasps.org.br/index.asp?id=812&categoria=29&subcategoria=46\\>;\nASSEMB. LEGISL. RJ. *Anais* (1, 4/1971, 15-31/3/1975); ASSEMB. LEGISL.\nRJ. Disponível em:\n\\<www.alerj.rj.gov.br/center\\_arq\\_aleg\\_invent\\_link4\\_24.htm\\>,\n\\<www.alerj.rj.gov.br/center\\_arq\\_aleg\\_prod\\_link4.htm\\>; ASSEMB.\nLEGISL RJ. *Informações* (1960-1975); CARDIANO, F. *Eleições.* TRIB.\nREG. ELEIT. Disponível em:\n\\<www.tre-rj.gov.br/site/legislacao/resolucoes/1978/restre37.pdf*\\>.*\n","ref":"FONTES: ANASPS. Disponível em:\n\\<www.anasps.org.br/index.asp?id=812&categoria=29&subcategoria=46\\>;\nASSEMB. LEGISL. RJ. *Anais* (1, 4/1971, 15-31/3/1975); ASSEMB. LEGISL.\nRJ. Disponível em:\n\\<www.alerj.rj.gov.br/center\\_arq\\_aleg\\_invent\\_link4\\_24.htm\\>,\n\\<www.alerj.rj.gov.br/center\\_arq\\_aleg\\_prod\\_link4.htm\\>; ASSEMB.\nLEGISL RJ. *Informações* (1960-1975); CARDIANO, F. *Eleições.* TRIB.\nREG. ELEIT. Disponível em:\n\\<www.tre-rj.gov.br/site/legislacao/resolucoes/1978/restre37.pdf*\\>.*\n","dic":"DPRRJ"}
