{"title":"CARVALHO, Joaquim Gomes Leite de","cargoss":["Deputado Estadual"],"cargos_esp":[0],"datas_ini":[1895],"datas_fim":[1897],"estados":["RJ"],"autor":[0],"content":"**CARVALHO, Joaquim Gomes Leite de**\n\n\\* dep. est. RJ. 1895-1897.\n\n*Joaquim Gomes Leite de Carvalho* elegeu-se deputado estadual nas\neleições realizadas em 20 de maio de 1895. Candidatou-se pelo quarto\ndistrito eleitoral, com sede em Vassouras (RJ), na chapa oficial do\nPartido Republicano Fluminense (PRF), liderado por José Tomás da\nPorciúncula, ex-presidente do estado do Rio de Janeiro (1892-1894) e\nentão deputado federal (1895-1897). Sob a liderança de Porciúncula, o\nPRF, partido representante dos setores majoritários da oligarquia\nfluminense, era hegemônico no Executivo e no Legislativo estadual.\n\nEm 1897, ano final da legislatura, Joaquim Gomes Leite de Carvalho foi\neleito membro da Comissão de Instrução Pública da Assembleia Legislativa\ndo Estado do Rio de Janeiro (ALERJ).\n\n*Samuel Silva Rodrigues de Oliveira*\n\nFONTES: ASSEMB. LEGISL. RJ.*Anais* (1895, 1897); FERREIRA, M.\n*República*.\n","ref":"FONTES: ASSEMB. LEGISL. RJ.*Anais* (1895, 1897); FERREIRA, M.\n*República*.\n","dic":"DPRRJ"}
