{"title":"CASTRIOTO, Carlos Frederico","cargoss":["Deputado Geral","Ministro da Marinha","Constituinte","Deputado Estadual","Senador"],"cargos_esp":[0,0,"est",0,0],"datas_ini":[1886,1887,1892,1892,1894],"datas_fim":[1887,1888,1892,1894,1894],"estados":["RJ",0,"RJ","RJ","RJ"],"autor":[0],"content":"**CASTRIOTO, Carlos Frederico**\n\n\\* dep. geral RJ 1886-1887; min. Mar. 1887-1888; const. est. RJ 1892;\ndep. est. RJ 1892-1894; sen. RJ 1894.\n\n*Carlos Frederico Castrioto* nasceu em Niterói, na então província do\nRio de Janeiro, filho de João Nepomuceno Castrioto, político do Partido\nConservador e militar ligado ao duque de Caxias, fundador da Polícia\nMilitar de Niterói.\n\nEstudou no Colégio Pedro II e formou-se pela Faculdade de Direito de São\nPaulo. Exerceu a profissão de advogado e foi promotor. Em 1885 foi\neleito deputado provincial no Rio de Janeiro e depois foi deputado\ngeral, entre 1886 e 1887. Foi ministro da Marinha entre 10 de maio de\n1887 e 10 de março de 1888.\n\nQuando da proclamação da República em 1889, o marechal Deodoro da\nFonseca nomeou Francisco Portela presidente do estado do Rio de Janeiro.\nCom a renúncia de Deodoro e sua substituição por Floriano Peixoto em\nnovembro de 1891, Portela perdeu sua fonte de apoio e no mês seguinte\nfoi levado a renunciar, sendo substituído pelo por um dia pelo almirante\nJosé Marques Guimarães, até a posse do sucessor Carlos Baltasar da\nSilveira. Este último revogou a Constituição estadual de 1891 e convocou\numa nova Assembleia Constituinte. Na eleição realizada em janeiro de\n1892, Carlos Castrioto foi um dos eleitos. Juntamente com Alberto Torres\ne Tibúrcio Figueira, fez parte da comissão encarregada de elaborar o\nprojeto de regimento da Constituinte, e integrou também a comissão\nespecial para organização do projeto da Constituição e a Comissão de\nVerificação dos Poderes que fiscalizaria a eleição dos deputados.\n\nA Constituinte de 1892 consolidou a coalizão antiportelista que reuniu\nmonarquistas e republicanos. Carlos Castrioto e o conselheiro Paulino de\nSousa, por parte dos monarquistas, e José Tomas Porciúncula, Alberto\nTorres e José Barros Franco Júnior, pelos republicanos, foram as\nlideranças que viabilizaram e construíram essa aliança.\n\nA nova Constituição foi proclamada em 9 abril de 1892, e em 24 de abril\nforam realizadas novas eleições. Foram eleitos José Tomás Porciúncula,\npresidente do estado, e Manuel Martins Torres, Maurício de Abreu e\nLourenço Maria de Almeida Batista (o barão de Miracema),\nvice-presidentes. A maioria dos deputados constituintes se candidatou e\nfoi eleita para a Assembleia Legislativa do Estado do Rio de Janeiro\n(ALERJ). Entre eles estava Carlos Castrioto, que exerceu o mandato de\n1892 a 1894 e nesse período foi sucessivas vezes eleito presidente da\nmesa da ALERJ. Após a eclosão da Revolta da Armada em setembro de 1893 e\na decretação do estado de sítio no país, Castrioto convocou o retorno\ndos trabalhos legislativos em nome do “interesse público” e do\n“governo”, justificando a transferência da ALERJ para Petrópolis.\n\nEm 1894, foi eleito senador pelo estado do Rio de Janeiro. Faleceu em 18\nde agosto do mesmo ano.\n\n*Samuel Silva Rodrigues de Oliveira*\n\nFONTES: ASSEMB. LEGISL. RJ. *Anais* (14/11/1892-12/1/1893, 1/3-9/4/1892,\n8/1892, 13-26/1/1893, 1/8/1893); BRETAS, M. *Polícia*; FERREIRA, M.\n*República*; MAR. BRAS. Disponível em:\n\\<www.mar.mil.br/menu\\_v/cm/ministros\\_imperio\\_mb.html\\>. Acesso em:\n25/8/2010; PM. *200 anos*. Disponível em:\n\\<www.pmerj.org/historico-da-pmerj/\\>, Acesso em: 25/8/2010; SENADO.\nDisponível em:\n\\<www.senado.gov.br/senadores/senadores\\_biografia.asp?codparl=1549&li=23&lcab=1894-1896&lf=23\\>.\nAcesso em: 25/8/2010.\n","ref":"FONTES: ASSEMB. LEGISL. RJ. *Anais* (14/11/1892-12/1/1893, 1/3-9/4/1892,\n8/1892, 13-26/1/1893, 1/8/1893); BRETAS, M. *Polícia*; FERREIRA, M.\n*República*; MAR. BRAS. Disponível em:\n\\<www.mar.mil.br/menu\\_v/cm/ministros\\_imperio\\_mb.html\\>. Acesso em:\n25/8/2010; PM. *200 anos*. Disponível em:\n\\<www.pmerj.org/historico-da-pmerj/\\>, Acesso em: 25/8/2010; SENADO.\nDisponível em:\n\\<www.senado.gov.br/senadores/senadores\\_biografia.asp?codparl=1549&li=23&lcab=1894-1896&lf=23\\>.\nAcesso em: 25/8/2010.\n","dic":"DPRRJ"}
