{"title":"CASTRO, Agostinho Vidal Leite de","cargoss":["Constituinte","Deputado federal"],"cargos_esp":["est",0],"datas_ini":[1891,1894],"datas_fim":[1891,1899],"estados":["RJ","RJ"],"autor":["Luciana Pinheiro"],"content":"**CASTRO, Agostinho Vidal Leite de**\n\n\\* const. est. RJ 1891; dep. fed. RJ 1894-1899.\n\n*Agostinho Vidal Leite de Castro* nasceu em Minas Gerais no dia 25 de\noutubro de 1841, filho de Francisco de Sales de Oliveira e Castro e de\nAna Teresa Vidal Leite Ribeiro.\n\nAinda jovem transferiu-se para São Paulo, onde se bacharelou em direito\nem 1866. Recém-formado, retornou a Minas Gerais e fixou residência em\nMonte Verde, município no qual exercia as atividades de fazendeiro e\nadvogado. Reconhecido entusiasta da República, quando da instauração do\nnovo regime residia no Rio de Janeiro, onde foi delegado auxiliar e\nposteriormente chefe de polícia.\n\nEm 1891 foi eleito deputado estadual constituinte no estado do Rio de\nJaneiro, então presidido por Francisco Portela. Participou da elaboração\nda primeira Constituição fluminense, que foi no entanto anulada após a\nrenúncia de Portela, em dezembro do mesmo ano. Com isso a Constituinte\nestadual foi dissolvida, e Agostinho Vidal Leite de Castro perdeu o\nmandato.\n\nNas eleições de 1894 foi eleito deputado federal pelo estado do Rio de\nJaneiro e tomou posse na Câmara dos Deputados em maio do mesmo ano. Foi\nreeleito para a legislatura seguinte e ocupou uma cadeira na Câmara até\ndezembro de 1899.\n\nFaleceu no Rio de Janeiro em 4 de dezembro de 1901.\n\n*Luciana Pinheiro*\n\nFONTES: ABRANCHES. J.*Governos*; CÂM. DEP. *Deputados brasileiros*\n(1826-1976); FERREIRA, M. *República*; INST. HIST. PETRÓPOLIS.\nDisponível em: \\<www.ihp.org.br/ihp/site/\\>. Acesso em: 17/11/2010;\nMELLO, M. *Parlamento*; Referências genealógicas de Antonio Augusto\nLeite de Castro. Disponível em:\n\\<http://referenciasgenealogicasaalecastro.blogspot.com/2010/05/familia-leite.html\\>.\nAcesso em: 17/11/2010.\n","ref":"FONTES: ABRANCHES. J.*Governos*; CÂM. DEP. *Deputados brasileiros*\n(1826-1976); FERREIRA, M. *República*; INST. HIST. PETRÓPOLIS.\nDisponível em: \\<www.ihp.org.br/ihp/site/\\>. Acesso em: 17/11/2010;\nMELLO, M. *Parlamento*; Referências genealógicas de Antonio Augusto\nLeite de Castro. Disponível em:\n\\<http://referenciasgenealogicasaalecastro.blogspot.com/2010/05/familia-leite.html\\>.\nAcesso em: 17/11/2010.\n","dic":"DPRRJ"}
