{"title":"CASTRO, Sérgio Pita de","cargoss":["Deputado Estadual","Deputado Estadual","Deputado Estadual"],"cargos_esp":[0,0,0],"datas_ini":[1930,1923,1904],"datas_fim":[1930,1926,1915],"estados":["RJ","RJ","RJ"],"autor":["Raimundo Helio Lopes"],"content":"**CASTRO, Sérgio Pita de**\n\n\\* dep. est. RJ 1904-1915, 1923-1926, 1930.\n\n*Sérgio Pita de Castro* foi eleito deputado estadual na legenda do\nPartido Republicano do Rio de Janeiro (PRRJ), em 31 de janeiro de 1904,\npelo terceiro distrito eleitoral, com sede em Cantagalo. Ainda em 1904\nfoi signatário da mensagem que pediu que Quintino Bocaiúva aceitasse\nmandato de senador no ano de 1904. No ano seguinte e até o final desta\nlegislatura, compreendida até 1906, foi sucessivamente reeleito membro\nda Comissão de Redação de Leis.\n\nEm dezembro de 1906 reelegeu-se deputado estadual pelo PRRJ e por\nocasião da votação que visava, em setembro de 1907, regulamentar a\ncobrança da sobretaxa para o café, estipulada pelo Convênio de Taubaté\n(1906), e o destino da arrecadação desse imposto, votou contra a\nmanutenção da cobrança que havia sido o estopim do distanciamento entre\nNilo Peçanha e o então presidente do estado do Rio de Janeiro Alfredo\nBacker (1906-1910). Durante o mandato, foi membro das comissões de Obras\nPúblicas, Saúde Pública e Câmaras Municipais, de Comércio, Agricultura e\nIndústria e de Redação de Leis.\n\nNas eleições estaduais de dezembro de 1909 Sérgio Pita de Castro foi\nreeleito deputado estadual agora na chapa do Partido Republicano\nFluminense (PRF), partido que passou a abrigar o grupo ligado a Nilo\nPeçanha e que conseguiu eleger a maioria dos deputados estaduais. No\ninício dos trabalhos legislativos de 1910 participou do chamado “caso\nfluminense”. O acontecimento consistiu no lançamento de duas\ncandidaturas à sucessão estadual em julho de 1910, em que se\nencontraram, de um lado, Backer e seus partidários defendendo a\ncandidatura de Manuel Edwiges Queirós Viana e, de outro, Nilo Peçanha e\ncorreligionários apoiando o candidato Francisco Chaves de Oliveira\nBotelho. Em agosto, realizada a eleição, cada grupo reivindicou a\nvitória de seu candidato. O impasse levou à intervenção do então\npresidente da República Hermes da Fonseca (1910- 1914) que, em dezembro,\nempossou o candidato nilista Oliveira Botelho (1910-1914) na presidência\ndo estado do Rio de Janeiro. Nesse período foi sucessivamente reeleito\nmembro da Comissão de Estatística, Divisão Civil e Judiciária.\n\nEm 15 de dezembro de 1912 foi reeleito deputado estadual, agora como\ncandidato avulso pelo terceiro distrito eleitoral. Em 1913, Oliveira\nBotelho e Nilo Peçanha romperam politicamente devido à sucessão\nestadual, já que o presidente estadual lançou o nome de Feliciano Sodré,\nentão prefeito de Niterói, enquanto o próprio Nilo candidatou-se ao\ngoverno fluminense. Com esse rompimento, os nilistas voltaram a usar a\nsigla do PRF, enquanto Feliciano Sodré concorreu pelo Partido\nRepublicano Conservador Fluminense (PRCF). Esse partido passou a abrigar\na aposição ao nilismo e os deputados estaduais que apoiaram a\ncandidatura de Sodré, caso de Sérgio Pita de Castro.\n\nDurante a campanha eleitoral, a Assembleia Legislativa do Estado do Rio\nde Janeiro (ALERJ) foi dividida em duas: uma nilista e outra apoiadora\nde Feliciano Sodré, da qual fazia parte Sérgio Pita de Castro. Depois do\npleito de 12 de julho de 1914, Nilo e Sodré declararam-se vencedores e\nforam reconhecidos pelas respectivas assembleias. Entretanto, a contenda\nsó foi resolvida com um *habeas corpus* do Supremo Tribunal Federal\n(STF) garantindo a eleição de Nilo Peçanha e quando o recém-empossado\npresidente da República Venceslau Brás (1914-1918) assegurou a posse de\nNilo.\n\nCom o início do novo governo de Nilo Peçanha (1914-1917) e a reabertura\ndos trabalhos legislativos da ALERJ, em julho de 1915, Sérgio Pita de\nCastro passou à oposição ao governo, juntamente com os partidários do\nPRCF. Em dezembro, candidatou-se a mais uma reeleição, mas não foi\nvitorioso, pois os nilistas elegeram a maioria dos candidatos,\nderrotando a oposição. Ainda nesse ano foi membro da Comissão de Redação\nde Leis.\n\nVoltou à Assembleia Legislativa em 28 de outubro de 1923, quando foi\nnovamente eleito deputado estadual pelo segundo distrito eleitoral, com\nsede em Campos (RJ), no pleito realizado durante a intervenção federal\nno estado do Rio de Janeiro. Durante a intervenção federal, decretada em\n10 de janeiro de 1923 pelo então presidente da República Artur Bernardes\n(1922-1926), o estado foi governado pelo interventor Aureliano Leal, que\nfechou a ALERJ e anulou as eleições de 9 de julho de 1922 realizadas\npara a sucessão do então presidente estadual Raul Veiga (1918-1922),\nquando os candidatos Raul Fernandes e Feliciano Sodré declararam-se\neleitos, ocasionando a dualidade da ALERJ.\n\nFoi eleito na legenda do Partido Republicano Fluminense (PRF). Com o\ninício dos trabalhos legislativos, em 27 de novembro, participou do\nreconhecimento pela ALERJ da eleição de Feliciano Sodré para presidente\ndo Rio de Janeiro (1923-1927), encerrando o período de intervenção\nfederal do estado. Nesse ano integrou a Comissão de Redação de Leis e\nnos seguintes foi sucessivamente reeleito membro da Comissão de\nComércio, Agricultura e Indústria.\n\nAo final dessa legislatura, em 1926, não foi reeleito. Em agosto de 1930\nfoi mais uma vez reeleito deputado estadual na chapa oficial do PRF,\nnovamente pelo terceiro distrito eleitoral; contudo, em novembro de 1930\nteve seu mandato interrompido com a vitória da Revolução de 1930 que\nlevou Getúlio Vargas ao poder e fechou todos os órgãos legislativos do\npaís.\n\n*Raimundo Helio Lopes*\n\nFONTES: ASSEMB. LEGISL. RJ. *Anais* (1904-1915, 1923-1926); *Estado*\n(13/11/1923, 19/8/1930); FERREIRA, M. *República*.\n","ref":"FONTES: ASSEMB. LEGISL. RJ. *Anais* (1904-1915, 1923-1926); *Estado*\n(13/11/1923, 19/8/1930); FERREIRA, M. *República*.\n","dic":"DPRRJ"}
