{"title":"CINELLI, Floriano","cargoss":["Deputado Estadual"],"cargos_esp":[0],"datas_ini":[1987],"datas_fim":[1991],"estados":["RJ"],"autor":["Janeiro."],"content":"**CINELLI, Floriano**\n\n\\* dep. est. RJ 1987-1991\n\n*Floriano Cinelli* nasceu no Rio de Janeiro (RJ) no dia 9 de junho de\n1924.\n\nFormado em medicina, especializou-se nas áreas de pediatria,\nadministração hospitalar e medicina do trabalho. Na Escola Superior de\nGuerra realizou curso de extensão cultural.\n\nNo que diz respeito à sua vida política, candidatou-se ao cargo de\ndeputado estadual fluminense no pleito eleitoral realizado em novembro\nde 1986, sendo eleito na legenda do Partido da Mobilização Nacional\n(PMN). Em fevereiro seguinte tomou posse de sua cadeira na Assembleia\nLegislativa do Rio de Janeiro (ALERJ), para mandato decorrido até\njaneiro de 1991. Durante sua gestão como legislador estadual atuou como\nlíder da Bancada do PMN na ALERJ e integrou a Comissão Interpartidária\nPró-Constituinte.\n\nApós o término de seu mandato político Floriano Cinelli permaneceu\natuando como médico pediatra em seu consultório na cidade do Rio de\nJaneiro.\n\nFONTES: ASSEMB. LEGISL. *Deputados estaduais fluminenses*. Quarta\nlegislatura (1987-1991).\n","ref":"FONTES: ASSEMB. LEGISL. *Deputados estaduais fluminenses*. Quarta\nlegislatura (1987-1991).\n","dic":"DPRRJ"}
