{"title":"COELHO, Marcelino da Gama","cargoss":["Constituinte","Deputado Estadual"],"cargos_esp":["est",0],"datas_ini":[1892,1892],"datas_fim":[1892,1894],"estados":["RJ","RJ"],"autor":[0],"content":"**COELHO, Marcelino da Gama**\n\n\\* const. est. RJ 1892; dep. est. RJ 1892-1894.\n\n*Marcelino da Gama Coelho* foi filho do advogado Jacinto José Coelho.\nFormou-se em direito e exerceu a advocacia como procurador do Ministério\nPúblico por 30 anos, entre 1863 e 1893.\n\nIngressou na política ao concorrer nas primeiras eleições realizadas\napós a proclamação da República (15/11/1889) para a formação da\nAssembleia Constituinte fluminense, mas não foi eleito. Esse pleito,\nrealizado em 20 de março de 1891, foi vencido pelos partidários do\npresidente do estado do Rio de Janeiro, Francisco Portela (1889-1891),\nnomeado pelo presidente da República, marechal Deodoro da Fonseca\n(1889-1891). Os portelistas derrotaram os candidatos do Partido\nRepublicano, de oposição ao governo, liderados por José Tomás da\nPorciúncula.\n\nCandidatou-se novamente ao Legislativo estadual após a renúncia de\nFrancisco Portela, sendo eleito em 31 de janeiro de 1892 para a nova\nAssembleia Estadual Constituinte. Com a saída do então chefe do poder\nestadual, a Assembleia Legislativa do Estado do Rio de Janeiro (ALERJ)\nfoi dissolvida, assim como a primeira Constituição republicana\nfluminense que havia sido promulgada por Portela e seus partidários\nquando da formação da primeira Constituinte estadual em 1891. A nova\nAssembleia, composta por partidários do Partido Republicano, agora\nchamado Partido Republicano Fluminense (PRF), procurou reorganizar os\nestatutos jurídicos do estado que haviam sido constituídos para\nfavorecer Francisco Portela e representou o início do domínio do PRF na\npolítica estadual.\n\nApós a promulgação da nova Constituição, no dia 9 de abril de 1892,\nforam realizadas novas eleições para o Legislativo estadual no dia 24 do\nmesmo mês. Nesse pleito Marcelino da Gama Coelho foi eleito deputado\nestadual na legenda do PRF e, na ALERJ, em 1893, ingressou na Comissão\nde Redação das Leis, na qual permaneceu até o fim do seu mandato, em\ndezembro de 1894.\n\nPublicou o livro *Do habeas corpus* (1900) e foi contratado para\nescrever o código de posturas para a polícia do Distrito Federal.\n\n*Samuel Silva Rodrigues de Oliveira*\n\nFONTES: ASSEMB LEGISL. RJ. *Anais*(14/11/1892-12/1/1893, 1/3-9/4,\n8/1892, 13-26/1, 1/8/1893); ASSEMB. LEGISL. RJ. Disponível em:\n\\<www.alerj.rj.gov.br/center\\_arq\\_cons\\_munic\\_link7.htm\\>. Acesso em:\n17/8/2010; COELHO, M. *Habeas corpus*; FERREIRA, M. *República*; LEMOS,\nR. *Implantação*; MIN. PUB. RJ. Disponível em:\n\\<www.mp.rj.gov.br/portal/page/portal/Internet/Conheca\\_o\\_MP/Historia/Lista\\_todos\\_procuradores\\>.\nAcesso em: 17/8/2010.\n","ref":"FONTES: ASSEMB LEGISL. RJ. *Anais*(14/11/1892-12/1/1893, 1/3-9/4,\n8/1892, 13-26/1, 1/8/1893); ASSEMB. LEGISL. RJ. Disponível em:\n\\<www.alerj.rj.gov.br/center\\_arq\\_cons\\_munic\\_link7.htm\\>. Acesso em:\n17/8/2010; COELHO, M. *Habeas corpus*; FERREIRA, M. *República*; LEMOS,\nR. *Implantação*; MIN. PUB. RJ. Disponível em:\n\\<www.mp.rj.gov.br/portal/page/portal/Internet/Conheca\\_o\\_MP/Historia/Lista\\_todos\\_procuradores\\>.\nAcesso em: 17/8/2010.\n","dic":"DPRRJ"}
