{"title":"CONDE, Luís Paulo =================","cargoss":["Prefeito"],"cargos_esp":["Rio de Janeiro"],"datas_ini":[1997],"datas_fim":[2001],"estados":[0],"autor":[0],"content":"CONDE, Luís Paulo\n=================\n\n\\* pref. Rio de Janeiro 1997-2001.\n\n*Luís Paulo Fernandez Conde* nasceu no Rio de Janeiro no dia 6 de agosto\nde 1934.\n\nCursou a Faculdade Nacional de Arquitetura da Universidade do Brasil e\nainda estudante fez parte da equipe que desenvolveu o projeto do Museu\nde Arte Moderna do Rio de Janeiro. Formou-se em 1959.\n\nNo governo Carlos Lacerda (1960-1965), foi responsável por 50 projetos\nde escolas e centros poliesportivos, além do campus da Universidade do\nEstado da Guanabara, hoje Universidade do Estado do Rio de Janeiro\n(UERJ). Foi presidente do departamento carioca do Instituto dos\nArquitetos do Brasil (IAB) por duas vezes seguidas, de 1974 a 1979. Em\n1988 integrou o Conselho Municipal de Proteção ao Patrimônio Cultural do\nRio de Janeiro, e de 1990 a 1992 foi diretor da faculdade pela qual se\nformou, então chamada Faculdade de Arquitetura e Urbanismo da\nUniversidade Federal do Rio de Janeiro.\n\nDurante a primeira gestão de César Maia na prefeitura do Rio\n(1993-1997), chefiou a Secretaria Municipal de Urbanismo, onde\nempreendeu projetos como o Rio-Cidade, o Favela-Bairro e a construção da\nvia expressa Linha Amarela. Candidato de César Maia à sua sucessão em\n1996, disputou o pleito na legenda do Partido da Frente Liberal (PFL) e\nderrotou em segundo turno o candidato do Partido da Social Democracia\nBrasileira (PSDB), Sérgio Cabral Filho.\n\nTomou posse na prefeitura em janeiro de 1997 e em sua gestão buscou\ncontinuar os projetos iniciados por seu antecessor. Em 1999, contudo,\nrompeu sua aliança política com César Maia, que nas eleições para o\ngoverno do estado no ano anterior fora derrotado por Anthony Garotinho,\ndo Partido Democrático Trabalhista (PDT). Tentou a reeleição para\nprefeito em 2000, sempre na legenda do PFL, mas foi derrotado no segundo\nturno pelo próprio César Maia, que se havia filiado ao Partido\nTrabalhista Brasileiro (PTB), em 1999. Com a vitória de Maia, o PFL\narticulou sua vinda para o partido, o que levou Conde a deixar a\nlegenda. Filiou-se então ao Partido Socialista Brasileiro (PSB) e em\njaneiro de 2001 encerrou seu mandato na prefeitura.\n\nAinda em 2001, foi nomeado pelo governador Anthony Garotinho\n(1999-2003), secretário de Articulação Governamental. Nas eleições de\n2002 para o governo estadual, elegeu-se vice-governador na chapa\nencabeçada por Rosinha Garotinho, do PSB. Durante a gestão de Rosinha\n(2003-2007), foi também secretário Estadual de Meio Ambiente e\nDesenvolvimento Urbano. Em 2003, filiou-se ao Partido do Movimento\nDemocrático Brasileiro (PMDB) juntamente com Garotinho. Nessa legenda\ncandidatou-se novamente a prefeito em 2004, sem obter êxito; na ocasião\nCésar Maia foi eleito para seu terceiro mandato. Em 2007, no governo de\nSérgio Cabral Filho (2007-2011), foi nomeado secretário de Cultura. Em\nagosto do mesmo ano deixou a secretaria e, indicado pelo PMDB, foi\nnomeado presidente de Furnas Centrais Elétricas S. A.\n\nFoi também presidente da União das Cidades Capitais Ibero-Americanas\n(UCCI) e da Assembleia Geral da União de Cidades Capitais\nLuso-Afro-Américo-Asiáticas (UCCLA), vice-presidente da Sociedade\nMundial das Grandes Metrópoles, membro do Conselho Executivo da União\nInternacional das Autoridades Locais (IULA), presidente do Conselho\nExecutivo do Plano Estratégico da Cidade do Rio de Janeiro,\nrepresentante da prefeitura carioca no conselho para a eleição da cidade\ncomo sede das Olimpíadas de 2004, membro do Conselho Executivo da Liga\ndas Cidades Históricas e presidente do Centro Ibero-Americano de\nDesenvolvimento Estratégico Urbano (CIDEU).\n\nEscreveu livros e artigos sobre arquitetura. Foi tema do livro *Luís\nPaulo Conde, un arquitecto carioca*, lançado em 2004 pela Universidade\nde Los Andes, da Colômbia.\n\nCasado com Rizza Conde, teve três filhos.\n\n*Paulo Celso Corrêa Liberato*\n\nFONTES: ArcoWeb (26/10/2001). *Arquitetura e política no discurso do\nex-prefeito carioca*. Disponível em:\n\\<www.arcoweb.com.br/entrevista/luiz-paulo-conde-arquitetura-e-26-10-2001.html\\>.\nAcesso em: 13/11/2009; *Diário do Rio de Janeiro*. Os secretários de\nSérgio Cabral (1/1/2007). Disponível em:\n\\<http://diariodorio.com/os-secretarios-de-sergio-cabral\\>. Acesso em:\n13/11/2009; *Dia*. *Eleições 2008*. Disponível em: \\<http://odia.\nterra.com.br/politica/prefeitosdorio.asp\\>. Acesso em: 13/11/2009;\n*Folha de S.Paulo* (16/8/2007). Disponível em:\n\\<www1.folha.uol.com.br/fsp/brasil/fc 1608200719.htm\\>. Acesso em:\n13/11/2009; ViverCidades. *Perfil**Luiz Paulo Conde*. Disponível em:\n\\<www.vivercidades.org.br/site%20antigo/artigos/conde\\_bio.html\\>.\nAcesso em: 13/11/2009.\n","ref":"FONTES: ArcoWeb (26/10/2001). *Arquitetura e política no discurso do\nex-prefeito carioca*. Disponível em:\n\\<www.arcoweb.com.br/entrevista/luiz-paulo-conde-arquitetura-e-26-10-2001.html\\>.\nAcesso em: 13/11/2009; *Diário do Rio de Janeiro*. Os secretários de\nSérgio Cabral (1/1/2007). Disponível em:\n\\<http://diariodorio.com/os-secretarios-de-sergio-cabral\\>. Acesso em:\n13/11/2009; *Dia*. *Eleições 2008*. Disponível em: \\<http://odia.\nterra.com.br/politica/prefeitosdorio.asp\\>. Acesso em: 13/11/2009;\n*Folha de S.Paulo* (16/8/2007). Disponível em:\n\\<www1.folha.uol.com.br/fsp/brasil/fc 1608200719.htm\\>. Acesso em:\n13/11/2009; ViverCidades. *Perfil**Luiz Paulo Conde*. Disponível em:\n\\<www.vivercidades.org.br/site%20antigo/artigos/conde\\_bio.html\\>.\nAcesso em: 13/11/2009.\n","dic":"DPRRJ"}
