{"title":"CORONEL GARCIA ==============","cargoss":["Deputado federal"],"cargos_esp":[0],"datas_ini":[1999],"datas_fim":[2000],"estados":["RJ"],"autor":["Tiago Leite Costa"],"content":"CORONEL GARCIA\n==============\n\n\\* dep. fed. RJ 1999-2000.\n\n*José Maurício Rodrigues Garcia*, conhecido como coronel Garcia, nasceu\nno Rio de Janeiro no dia 27 de setembro de 1956, filho de Adelino de\nSousa Garcia e de Daise Rodrigues Garcia.\n\nCursou a Academia Militar das Agulhas Negras (AMAN) em Resende (RJ),\nentre 1974 e 1977, e seguiu a carreira militar, chegando a coronel do\nExército. Recebeu várias condecorações em sua carreira, como a Medalha\ndo Pacificador (Ministério do Exército), medalhas de mérito da polícia\nmilitar e da Justiça Criminal e Medalha Tiradentes, concedida pela\nAssembleia Legislativa do Estado do Rio de Janeiro.\n\nEntre 1995 e 1998 presidiu o Departamento de Trânsito do Rio de Janeiro\n(DETRAN-RJ), durante o governo de Marcelo Alencar. Sua gestão foi\nmarcada pelo combate às fraudes no órgão.\n\nNas eleições de outubro de 1998 foi eleito deputado federal pelo estado\ndo Rio de Janeiro na legenda do Partido da Social Democracia Brasileira\n(PSDB). Assumiu o mandato em fevereiro de 1999 e participou como membro\ntitular na Comissão de Relações Exteriores e de Defesa Nacional.\n\nFaleceu aos 44 anos, no dia 15 de novembro de 2000, em virtude de um\nderrame cerebral.\n\n*Tiago Leite Costa*\n\nFONTES: CÂM. DEP. *Deputados brasileiros*. Repertório (1999-2002);\n*Direito 2*. Disponível em: \\<www.direito2.com.br\\>. Acesso em:\n16/10/2000; *Veja*. Disponível em:\n\\<http://veja.abril.com.br/221100/datas.html\\>.\n","ref":"FONTES: CÂM. DEP. *Deputados brasileiros*. Repertório (1999-2002);\n*Direito 2*. Disponível em: \\<www.direito2.com.br\\>. Acesso em:\n16/10/2000; *Veja*. Disponível em:\n\\<http://veja.abril.com.br/221100/datas.html\\>.\n","dic":"DPRRJ"}
