{"title":"CORREIA, Carlos","cargoss":["Deputado Estadual","Deputado Estadual","Deputado Estadual"],"cargos_esp":[0,0,0],"datas_ini":[1999,1993,1987],"datas_fim":[2001,1995,1993],"estados":["RJ","RJ","RJ"],"autor":["Sabrina Guerghe"],"content":"**CORREIA, Carlos**\n\n\\* dep. est. RJ 1987-1993, 1993-1995, 1999-2001.\n\n*Carlos Correia* nasceu na cidade de São João de Meriti (RJ) no dia 20\nde abril de 1947, filho de Clóvis Correia de Oliveira e de Maria Augusta\nCorreia.\n\nBacharelou-se em direito na Universidade Gama Filho (UGF), na cidade do\nRio de Janeiro.\n\nPrestou concurso para a Prefeitura de São João de Meriti. Empossado em\n1969, foi secretário de Comissão de Inquérito na Câmara Municipal,\ndatilógrafo secretário dessa mesma comissão, membro da Comissão de\nInquérito Administrativo da Prefeitura e da Câmara Municipal. Aprovado\nem concurso para o cargo de escrivão de polícia do Estado do Rio de\nJaneiro, em 1973, exerceu suas funções em várias delegacias da Baixada\nFluminense, região que viria a ser sua principal base eleitoral. Também\ndesempenhou a função de chefe de seção de Expediente Cartorário de\nDelegacias Policiais.\n\nFiliou-se ao Partido Democrático Trabalhista (PDT), em 1985, e elegeu-se\ndeputado estadual do Rio de Janeiro no pleito de novembro de 1986.\nAssumiu o mandato ordinário em fevereiro seguinte e nessa legislatura\n(1987-1991) foi vice-líder de seu partido e vice-presidente da\nAssembleia Legislativa do Estado do Rio de Janeiro (ALERJ).\n\nCom a promulgação da Constituição pela Assembleia Nacional Constituinte\nem outubro de 1988, as assembleias legislativas iniciaram a adequação\ndas Cartas estaduais à nova realidade jurídica do país. Carlos Correia\nfoi o relator geral da Comissão Interpartidária Pró-Constituinte. Em\njaneiro de 1989 passou ao exercício dos trabalhos constituintes, tendo\nrelatado a Comissão da Ordem Econômica e do Meio Ambiente, além de ter\nintegrado a Comissão Constitucional.\n\nCom a promulgação da Constituinte estadual em outubro dede 1989, voltou\naos trabalhos ordinários e em 1989 presidiu a Comissão de Transportes,\nPolítica Urbana e Habitação. No ano seguinte integrou, como membro\nefetivo, as comissões de Fiscalização Financeira; de Economia, Comércio,\nIndústria e Turismo; de Emendas Constitucionais e Vetos.\n\nNo pleito de 1990 foi reeleito deputado estadual, mais uma vez na\nlegenda pedetista, com 13.674 votos. Tomou posse no novo mandato em\nfevereiro de 1991 e presidiu a Comissão de Constituição e Justiça; foi\nainda vice-presidente da Comissão de Redação e da Comissão de\nTransportes, Política Urbana e Habitação; e membro efetivo das comissões\nde Servidores Públicos, de Defesa dos Direitos Humanos, de Obras\nPúblicas, e de Legislação Constitucional Complementar e Códigos.\n\nEm 1993 foi nomeado secretário de Assuntos Fundiários e Assentamentos\nUrbanos no governo de Leonel Brizola (1991-1994). Nessa pasta\ndesenvolveu os programas de acesso e regularização de terras denominados\nMorar Feliz, Meu Pé no Chão e Terra Cidadã. De volta à ALERJ, presidiu a\nCPI para Apurar a Intervenção do Banco Central no Banco do Estado do Rio\nde Janeiro (Banerj) e foi vice-presidente da Comissão de Norma Internas\ne Proposições Externas; membro efetivo da CPI para Apurar\nIrregularidades e Irresponsabilidades na Loteria Estadual do Rio de\nJaneiro (Loterj) e, ainda, no Funcionamento das Casas de Bingo\nExistentes no Estado do Rio de Janeiro.\n\nEm outubro de 1994 disputou mais uma vez uma vaga na ALERJ e obteve uma\nsuplência. Deixou a assembleia em janeiro de 1995, ao final da\nlegislatura. No pleito seguinte, em outubro de 1998, novamente obteve\numa suplência. Em 1999, sempre em consonância com o governo pedetista,\nvoltou a ocupar a Secretaria de Assuntos Fundiários no início do governo\nde Anthony Garotinho (1999-2002). Deixou o cargo em outubro para assumir\numa cadeira na ALERJ, que vagara com o afastamento do titular,\npermanecendo no exercício do mandato até abril de 2001. Nessa\nlegislatura presidiu a Comissão Especial para Apurar Casos de Evasão\nFiscal do Imposto Sobre a Propriedade de Veículos Automotores (IPVA).\nIntegrou, também, as seguintes comissões permanentes: Assuntos\nMunicipais e Desenvolvimento Regional; Combate às Discriminações de\nRaça, Cor, Etnia, Religião e Procedência Nacional; Agricultura, Pecuária\ne Políticas Rural, Agrária e Pesqueira; Educação, Cultura e Desportos;\nTrabalho, Legislação Social e Seguridade Social; Servidores Públicos;\nSegurança Pública e Assuntos de Polícia; Política Urbana, Habitação e\nAssuntos Fundiários; Obras Públicas; e Normas Internas e Proposições\nExternas. No ano de 2001 presidiu a Comissão Especial para apurar as\ncausas dos blecautes ocorridos no estado.\n\nEm 2003, mais uma vez indicado pelo PDT, tornou-se superintendente do\nInstituto Nacional de Colonização e Reforma Agrária (INCRA) no Rio de\nJaneiro, cargo que deixou quando seu partido, em dezembro do mesmo ano,\nrompeu com o governo Lula.\n\nNo final do mês de novembro de 2007 foi empossado pelo ministro do\nTrabalho e Emprego, Carlos Lupi, também pedetista, delegado regional do\nTrabalho no Estado do Rio de Janeiro. No início do ano de 2009 foi\nnomeado secretário municipal de Educação da cidade de São João de\nMeriti.\n\nConcluiu uma pós-graduação em políticas públicas e governo pela Escola\nde Políticas Públicas e Governo da Universidade Federal do Rio de\nJaneiro (UFRJ). Foi secretário-geral do PDT e integrou a Comissão Fiscal\nda Executiva Nacional do seu partido. Elaborou o Estatuto Social da\nAssociação Comercial e Industrial de São João de Meriti e assessorou,\njuridicamente, a Federação das Associações de Moradores de sua cidade\nnatal.\n\nEm 2010, seu filho, Bruno Barbosa Correia, foi candidato a deputado\nestadual pela legenda pedetista.\n\n*Sabrina Guerghe*\n\nFONTES: ASSEMB. LEGISL. RJ. *Deputados estaduais fluminenses*. Sexta\nlegislatura (1995-1999), Sétima legislatura (1999-2003); *Diário Oficial\nRJ* (23/2/2001); *Congresso em Foco* (10/7/2006); *Extra* (27/6/2010);\n*Globo* (19/10/1990); MIN. TRAB. EMPR. (9/6/2010); PDT RJ. Disponível\nem: \\<www.pdt-rj.org.br/paginaindividual.asp?id=402\\>; PDT SP\n(18/3/2010); PDT São José dos Pinhais. Disponível em:\n\\<www.pdtsjp.com.br/index.php?pag=partido\\>; TRIB. SUP. ELEIT. *Eleições\n2010*.\n","ref":"FONTES: ASSEMB. LEGISL. RJ. *Deputados estaduais fluminenses*. Sexta\nlegislatura (1995-1999), Sétima legislatura (1999-2003); *Diário Oficial\nRJ* (23/2/2001); *Congresso em Foco* (10/7/2006); *Extra* (27/6/2010);\n*Globo* (19/10/1990); MIN. TRAB. EMPR. (9/6/2010); PDT RJ. Disponível\nem: \\<www.pdt-rj.org.br/paginaindividual.asp?id=402\\>; PDT SP\n(18/3/2010); PDT São José dos Pinhais. Disponível em:\n\\<www.pdtsjp.com.br/index.php?pag=partido\\>; TRIB. SUP. ELEIT. *Eleições\n2010*.\n","dic":"DPRRJ"}
