{"title":"ALMEIDA, Rui Guimarães de","cargoss":["Deputado Estadual"],"cargos_esp":[0],"datas_ini":[1935],"datas_fim":[1937],"estados":["RJ"],"autor":["Raimundo Helio Lopes"],"content":"**ALMEIDA, Rui Guimarães de**\n\n\\* dep. est. RJ 1935-1937.\n\n*Rui Guimarães de Almeida* nasceu em Santo Antônio de Pádua (RJ) no dia\n5 de junho de 1909.\n\nFormado em direito, dedicou grande parte de sua vida à atividade\nliterária.\n\nEm 14 de outubro de 1934, foi eleito deputado à Assembleia Constituinte\ndo estado do Rio de Janeiro na legenda da União Progressista Fluminense\n(UPF), partido político fundado em 18 de fevereiro de 1933. Os\nfundadores da UPF eram em sua quase totalidade integrantes da corrente\n“nilista”, que havia apoiado a candidatura de Nilo Peçanha à presidência\nda República em oposição a Artur Bernardes nas eleições de março de\n1922. Assumiu o mandato em 1935, participou da elaboração da nova Carta\nestadual e, após sua promulgação em 1^o^ de outubro, passou a exercer o\nmandato ordinário. Permaneceu na Assembleia Legislativa até 10 de\nnovembro de 1937, quando, com a implantação do Estado Novo, foram\nsuprimidos todos os órgãos legislativos do país.\n\nFoi também diretor de *O Semanário*, periódico da cidade de Santo\nAntônio de Pádua.\n\nFaleceu no Rio de Janeiro, então Distrito Federal, em 9 de setembro de\n1946.\n\nPublicou *Última elegia* (1945).\n\n*Raimundo Helio Lopes*\n\nFONTES: ASSEMB. LEGISL. RJ. *Anais* (1935); BELOCH, I.; ABREU, A.\n*Dicionário*; COUTINHO, Afrânio; SOUSA, J. *Enciclopédia.*\n","ref":"FONTES: ASSEMB. LEGISL. RJ. *Anais* (1935); BELOCH, I.; ABREU, A.\n*Dicionário*; COUTINHO, Afrânio; SOUSA, J. *Enciclopédia.*\n","dic":"DPRRJ"}
