{"title":"COSTA, André","cargoss":["Deputado federal"],"cargos_esp":[0],"datas_ini":[2004],"datas_fim":[2007],"estados":["RJ"],"autor":["Nina Paiva Almeida"],"content":"**COSTA, André**\n\n\\* diplomata; dep. fed. RJ 2004-2007.\n\n*André Luís Costa de Sousa* nasceu em Niterói (RJ) no dia 22 de maio de\n1968, filho de Romero Albuquerque de Sousa e de Danilza Costa de Sousa.\n\nBacharelou-se em direito pela Universidade Federal Fluminense (UFF) em\n1991. Em 1994 formou-se em relações internacionais na Pontifícia\nUniversidade Católica do Rio de Janeiro (PUC-Rio) e ingressou no curso\nde formação de diplomatas do Instituto Rio Branco do Ministério das\nRelações Exteriores (MRE). Concluiu o curso em 1995 e fez estágio na\nembaixada do Brasil na Colômbia. Foi coordenador da missão do MRE ao\nMali, em Bamaco, e subchefe da Divisão da África do MRE, em Brasília,\naté 1997, quando assumiu a chefia de gabinete do Escritório de\nRepresentação do MRE no Rio de Janeiro. De 1999 a 2002 foi vice-cônsul\ndo Brasil em Barcelona.\n\nNas eleições de outubro de 2002 concorreu a uma cadeira na Câmara dos\nDeputados pelo estado do Rio de Janeiro na legenda do Partido dos\nTrabalhadores (PT), ao qual se filiara em 1995, e obteve uma suplência.\nEm 2003 participou da missão da Coordenadoria do MRE a El Salvador, foi\ncoordenador da missão da Presidência da República a Roma e tornou-se\ncônsul do Brasil em Caiena. Em 2004 foi secretário da embaixada do\nBrasil em Kiev e vice-presidente da Associação de Diplomatas\nBrasileiros. Em 22 de dezembro desse mesmo ano licenciou-se da carreira\ndiplomática e foi empossado na Câmara na vaga aberta com o afastamento\nde Lindberg Farias, eleito prefeito de Nova Iguaçu (RJ).\n\nNa Câmara, foi primeiro vice-presidente da Comissão de Relações\nExteriores e Defesa Nacional, tendo defendido o cumprimento por parte do\ngoverno brasileiro de diversos acordos firmados com países estrangeiros,\ncomo a parceria com o governo ucraniano na área de tecnologia espacial.\nEm 2005 integrou a comissão externa para acompanhar as investigações\nsobre a chacina da Baixada Fluminense, em que, no dia 31 de março, 30\npessoas foram assassinadas por policiais militares nos municípios de\nNova Iguaçu e Queimados (RJ). Em agosto desse mesmo ano foi o primeiro\ndeputado federal do PT a desvincular-se do partido devido à denúncia do\nentão deputado Roberto Jefferson, do Partido Trabalhista Brasileiro\n(PTB), da existência do “mensalão”, esquema de compra de votos de\nparlamentares para se manifestarem a favor de projetos de interesse do\ngoverno federal liderado por José Dirceu, então ministro chefe da Casa\nCivil. Ainda em 2005, filiou-se ao Partido Democrático Trabalhista\n(PDT).\n\nNas eleições de outubro de 2006 disputou novamente uma vaga na Câmara\ndos Deputados pelo Rio de Janeiro na legenda do PDT, mas não foi eleito.\nEncerrou o mandato em 31 de janeiro de 2007 e ainda nesse ano foi\ncondenado pelo Tribunal Regional Eleitoral (TRE) por prática de\npropaganda eleitoral antecipada. Recorreu ao Tribunal Superior Eleitoral\n(TSE), que confirmou a decisão do tribunal regional.\n\nApós deixar a Câmara, retomou suas atividades na carreira diplomática,\nassumindo o Consulado do Brasil na Dinamarca. Em 2008 foi designado\nsegundo- secretário da embaixada do Brasil em Copenhague, na Dinamarca.\n\nPublicou *O fracasso da globalização* (2004).\n\n*Nina Paiva Almeida*\n\nFONTES: ASSOC. DIP. BRAS.; *Folha de S.Paulo* (29/8/2005); CÂM. DEP.\nDisponível em: \\<www.camara.gov.br/\\>; MIN. RELAC. EXT. Disponível em:\n\\<www.mre.gov.br/\\>; PDT. Disponível em: \\<www.pdb.org.br/\\>; TRIB. SUP.\nELEIT. Disponível em: \\<http://tse.gov.br\\>.\n","ref":"FONTES: ASSOC. DIP. BRAS.; *Folha de S.Paulo* (29/8/2005); CÂM. DEP.\nDisponível em: \\<www.camara.gov.br/\\>; MIN. RELAC. EXT. Disponível em:\n\\<www.mre.gov.br/\\>; PDT. Disponível em: \\<www.pdb.org.br/\\>; TRIB. SUP.\nELEIT. Disponível em: \\<http://tse.gov.br\\>.\n","dic":"DPRRJ"}
