{"title":"COSTA, Artur","cargoss":["Deputado Estadual"],"cargos_esp":[0],"datas_ini":[1916],"datas_fim":[1923],"estados":["RJ"],"autor":[0],"content":"**COSTA, Artur**\n\n\\* dep. est. RJ 1916-1923.\n\n*Artur Leandro de Araújo Costa* atuou politicamente em Campos (RJ).\n\nEm 15 de dezembro de 1915 foi eleito deputado estadual na legenda do\nPartido Republicano Fluminense (PRF).\n\nTomou posse como deputado estadual em 1916 e durante esse mandato apoiou\na eleição do candidato do PRF Raul Veiga à presidência do estado do Rio\nde Janeiro (1918-1922).\n\nFoi reeleito deputado estadual em janeiro de 1919 na chapa oficial do\nPRF. Durante todo esse mandato assumiu a presidência da Assembleia\nLegislativa do Estado do Rio de Janeiro (ALERJ).\n\nEm maio de 1920, depois da convenção oficial do PRF, o grupo\nsituacionista, liderado por Nilo Peçanha, passou a adotar a sigla do\nPartido Republicano do Rio de Janeiro (PRRJ), partido que abrigara os\nnilistas de 1899 a 1911.\n\nFoi reeleito deputado estadual na legenda do PRRJ em dezembro de 1921.\nPor ocasião da sucessão estadual de julho de 1922, apoiou a candidatura\ndo nilista Raul Fernandes contra Feliciano Sodré, candidato do PRF –\nreorganizado a partir da mudança da sigla do Partido Republicano\nConservador Fluminense (PRCF). Realizada a eleição, ambos os candidatos\nse declararam vencedores, o que ensejou uma cisão na Assembleia\nLegislativa do Estado do Rio de Janeiro (ALERJ), formando-se duas\nassembleias. Já que o reconhecimento do presidente do estado era da\ncompetência da Assembleia, a dualidade de assembleias levou à dualidade\nde governos. Seguindo a orientação política do ex-presidente da\nRepública Nilo Peçanha (1909-1910), Raul Fernandes temia que o novo\npresidente, Artur Bernardes (1922-1926), eleito em novembro de 1922 e\nadversário de Nilo, decretasse a intervenção federal no estado do Rio.\nAssim, apresentou ao Supremo Tribunal Federal (STF) um pedido de *habeas\ncorpus* que assegurasse sua posse. Atendido o pedido, Raul Fernandes foi\ninvestido na presidência do estado, recebendo o cargo de Raul Veiga no\npalácio do Ingá, em Niterói, no dia 31 de dezembro de 1922. Entretanto,\nFeliciano Sodré também foi empossado por sua assembleia no mesmo dia.\nAlegando a duplicidade de poderes no Rio de Janeiro, Artur Bernardes\ndecretou a intervenção federal no estado, em 1923, entregando o\nExecutivo fluminense a Aureliano Leal, que anulou tanto as eleições\nocorridas em 1922 para presidente estadual como as eleições legislativas\nde 1921. Encerrou-se, então, o mandato de**Artur Costa.** Durante sua\natividade parlamentar apresentou projetos de leis sobre construção de\nestradas de rodagem ligando o estado do Rio com outras unidades\nfederativas, além de posicionar-se sobre a situação do funcionalismo\npúblico estadual. Posicionou-se sobre as Câmaras Municipais e a reforma\npolítica. Participou da Comissão de Obras Públicas, Saúde Pública e\nCâmaras Municipais.\n\nNa eleição de fevereiro de 1927 foi candidato a deputado federal na\nchapa dos “nilistas vermelhos” do PRRJ. Os “nilistas vermelhos” eram\ncontrários à aliança do PRRJ com o PRF, atual partido situacionista, e\npor isso não ganharam apoio dos governos estadual e federal, não\nconseguindo eleger nenhum candidato nesse pleito.\n\nFoi vice-presidente da Sociedade Fluminense de Agricultura e Indústrias\nRurais (SFAIR).\n\n*Vicente Saul Moreira dos Santos*\n\nFONTES: ASSEMB. LEGISL RJ. *Anais* (1918, 1919, 1920, 1921); *Estado*\n(19/1, 18/4, 25/7, 3/11/1922, 24/10, 11/11/1923, 5/12/1926, 9/2,\n13/2/1927); FERREIRA, M. *República*; SOARES, E. *História*.\n","ref":"FONTES: ASSEMB. LEGISL RJ. *Anais* (1918, 1919, 1920, 1921); *Estado*\n(19/1, 18/4, 25/7, 3/11/1922, 24/10, 11/11/1923, 5/12/1926, 9/2,\n13/2/1927); FERREIRA, M. *República*; SOARES, E. *História*.\n","dic":"DPRRJ"}
