{"title":"COSTA, Ênio","cargoss":["Deputado Estadual"],"cargos_esp":[0],"datas_ini":[1967],"datas_fim":[1970],"estados":["RJ"],"autor":["Nayara Emerick Lamb"],"content":"**COSTA, Ênio**\n\n\\* dep. est. RJ 1967-1970.\n\n*Ênio Pereira da Costa* candidatou-se a deputado estadual no estado do\nRio de Janeiro em outubro de 1962 na legenda do Partido Republicano\n(PR), mas não conseguiu se eleger.\n\nEm outubro de 1965 o regime militar, iniciado no ano anterior, editou o\nAto Institucional n^o^ 2 que extinguiu os partidos políticos em vigor\naté então. Em novembro foi expedido o Ato Complementar n^o^ 4, que\ndispôs sobre a reorganização partidária, que resultou no bipartidarismo.\nDois partidos foram criados: a Aliança Renovadora Nacional (Arena), de\napoio ao regime iniciado em 1964, e o Movimento Democrático Brasileiro\n(MDB), de oposição. No pleito seguinte, realizado em 15 de novembro de\n1966, Ênio Costa candidatou-se novamente na legenda do MDB. Eleito,\nassumiu o mandato na Assembleia Legislativa do Estado do Rio de Janeiro\n(ALERJ) no ano seguinte. Nessa legislatura foi quarto secretário da Mesa\nDiretora entre 1967 e 1969.\n\nNas eleições de novembro de 1970 candidatou-se mais uma vez a deputado\nestadual na legenda do MDB, mas não se elegeu.\n\nEm 1996 foi eleito vereador no município de Paulistas (MG) pelo Partido\ndo Movimento Democrático Brasileiro (PMDB).\n\n*Nayara Emerick Lamb*\n\nFONTES: ACAD. BRAS. POESIA. Disponível em:\n\\<www.rauldeleoni.org/academicos\\_titulares/walter\\_pacheco.html\\#mais\\>.\nAcesso em: 10/4/2011; ASSEMB. LEGISL. MG. Disponível em:\n\\<www.almg.gov.br/eleicoes/votacao/m49670.htm\\>. Acesso em: 25/5/2011;\nCARDIANO, F. *Eleições*; FERREIRA, J. *Sociedade*; MARTINHO, F.\n*Democracia*; MELLO, M. *Parlamento*; ROLLEMBERG, D. *Ditadura*; TOLEDO,\nC. *Governo*; PALOMANES, F. *Democracia*.\n","ref":"FONTES: ACAD. BRAS. POESIA. Disponível em:\n\\<www.rauldeleoni.org/academicos\\_titulares/walter\\_pacheco.html\\#mais\\>.\nAcesso em: 10/4/2011; ASSEMB. LEGISL. MG. Disponível em:\n\\<www.almg.gov.br/eleicoes/votacao/m49670.htm\\>. Acesso em: 25/5/2011;\nCARDIANO, F. *Eleições*; FERREIRA, J. *Sociedade*; MARTINHO, F.\n*Democracia*; MELLO, M. *Parlamento*; ROLLEMBERG, D. *Ditadura*; TOLEDO,\nC. *Governo*; PALOMANES, F. *Democracia*.\n","dic":"DPRRJ"}
