{"title":"COSTA, Feliciano da","cargoss":["Deputado Estadual",0],"cargos_esp":[0,0],"datas_ini":[1963,1975],"datas_fim":[1967,1979],"estados":["RJ",0],"autor":["Sabrina Guerghe"],"content":"**COSTA, Feliciano da**\n\n\\* dep. est. RJ 1963-1967; 1975-1979.\n\n*Feliciano Benedito da Costa* nasceu na cidade do Rio de Janeiro, então\nDistrito Federal, dia 28 de outubro de 1908.\n\nIniciou carreira militar ao ingressar na Marinha de Guerra do Brasil\ncomo grumete. Realizou um curso de enfermagem e posteriormente cursou a\nFaculdade Fluminense de Medicina, onde se formou em 1936.\n\nMudou-se para Nova Friburgo, em 1940, como chefe de clínica do Hospital\nde Tuberculosos do Sanatório Naval, e chegou ao oficialato, sendo\npromovido a capitão-tenente e, posteriormente, a capitão de mar e\nguerra.\n\nIniciou sua careira política no Partido Trabalhista Brasileiro (PTB). No\npartido conheceu Badger da Silveira, um dos fundadores do PTB\nfluminense, aliado de João Goulart.\n\nEm 1954 Feliciano da Costa foi eleito prefeito de Nova Friburgo (RJ)\npara mandato compreendido entre 1955 e 1959, na legenda do Partido\nSocial Democrático (PSD), agremiação aliada do PTB, tendo Amâncio Mário\nde Azevedo como vice. Durante seu mandato no Executivo friburguense,\nFeliciano Costa deixou o PSD e ingressou no Partido Social Progressista\n(PSP).\n\nComo prefeito, tornou-se conhecido por criar dentro da estrutura do\nPoder Executivo o Departamento de Turismo e a Secretaria de Saúde.\nTambém realizou uma reforma do código tributário, além de ter construído\no posto de saúde Tunney Kassuga, no bairro de Olaria; o Mercado\nMunicipal da Vila Amélia; a Faculdade de Odontologia de Nova Friburgo;\nas escolas municipais Odette Penna Muniz, Helena Coutinho, Emílio\nMelhorance, Canadá e o Grupo Escolar Dr. Feliciano Costa, em Conselheiro\nPaulino.\n\nNas eleições de novembro de 1962 foi eleito deputado estadual\n(1963-1967), pela legenda do PSP, para exercício parlamentar na antiga\nAssembleia do Estado do Rio de Janeiro (ALERJ).\n\nAssumiu o mandato em primeiro de fevereiro de 1963 e, nesse mesmo ano,\nafastou-se da Assembleia Legislativa para assumir a Secretaria de\nTrabalho e Serviço Social no governo de Badger da Silveira, que perdeu o\nmandato logo após a instauração do regime militar de 1964, tendo seus\ndireitos políticos cassados pela ALERJ.\n\nCom a instauração do bipartidarismo em 1965, Feliciano Costa filiou-se à\nAliança Renovadora Nacional (Arena), partido de sustentação do regime\nmilitar.\n\nNas eleições diretas de 15 de novembro de 1970 foi reeleito prefeito de\nNova Friburgo, pela Arena, tendo José Rios como vice. Durante sua\ngestão, nomeou seu filho Zanon Zanoni Costa para ocupar a Secretaria\nGeral da prefeitura. Deixou o Executivo municipal em 1973.\n\nNo pleito de novembro de 1974 Feliciano da Costa elegeu-se deputado\nestadual pelo novo estado do Rio de Janeiro, resultante da fusão da\nGuanabara com o antigo estado do Rio. Como deputado constituinte,\nintegrou a Subcomissão Especial de Normas Internas.\n\nApós a aprovação pelo Congresso Nacional, em 29 de novembro de 1979, da\nreforma partidária que abriu caminho ao restabelecimento do\npluripartidarismo no país, filiou-se ao Partido Popular (PP).\n\nDurante mais de 20 anos atuou também na Santa Casa de Misericórdia de\nNova Friburgo, atual Hospital Municipal Raul Sertã.\n\nFaleceu em 6 de fevereiro de 1981, em Nova Friburgo.\n\nFoi casado com Emília Castro Costa, com quem teve um filho.\n\n*Sabrina Guerghe*\n\nFONTES: ASSEMB, LEGISL. RJ. Anais(7/1963, v. XXIV, 15-31/3/1975, v. I);\nASSOC. DOCENTES FAC. SANTA DOROTEIA. Disponível em:\n\\<www.docentesfsd.com.br/arquivo/O\\_poder\\_magico\\_em\\_Nova\\_Friburgo.pdf\\>;\nCENTR. DOC. D. JOÃO VI. Disponível em:\n\\<www.djoaovi.com.br/index.php?cmd=section:homenagens\\>; FAC. FILOS.\nSANTA DOROTEIA. Disponível em: \\<www.ffsd.br/files/governantes.pdf\\>;\nVoz da Serra. Disponível em:\n\\<www.avozdaserra.com.br/noticias.php?noticia=12422\\>;\n\\<www.avozdaserra.com.br/colunas3.php?id\\_coluna=3869&id\\_colunista=35\\>.\nAcesso em: 8/12/2010.\n","ref":"FONTES: ASSEMB, LEGISL. RJ. Anais(7/1963, v. XXIV, 15-31/3/1975, v. I);\nASSOC. DOCENTES FAC. SANTA DOROTEIA. Disponível em:\n\\<www.docentesfsd.com.br/arquivo/O\\_poder\\_magico\\_em\\_Nova\\_Friburgo.pdf\\>;\nCENTR. DOC. D. JOÃO VI. Disponível em:\n\\<www.djoaovi.com.br/index.php?cmd=section:homenagens\\>; FAC. FILOS.\nSANTA DOROTEIA. Disponível em: \\<www.ffsd.br/files/governantes.pdf\\>;\nVoz da Serra. Disponível em:\n\\<www.avozdaserra.com.br/noticias.php?noticia=12422\\>;\n\\<www.avozdaserra.com.br/colunas3.php?id\\_coluna=3869&id\\_colunista=35\\>.\nAcesso em: 8/12/2010.\n","dic":"DPRRJ"}
