{"title":"ABRAÃO, Ricardo","cargoss":["Deputado Estadual","Deputado Estadual"],"cargos_esp":[0,0],"datas_ini":[2011,2003],"datas_fim":[0,2007],"estados":["RJ","RJ"],"autor":["Ana Beatriz Paes"],"content":"**ABRAÃO, Ricardo**\n\n\\* dep. est. RJ 2003-2007 e 2011-\n\n*Ricardo Martins David*, conhecido como *Ricardo Abraão*, nasceu no em\nNilópolis (RJ) no dia 13 de setembro de 1972, filho de Farid Abraão\nDavid e de Jane Louise Martins David. Seu pai foi deputado estadual no\nRio de Janeiro de 1987 a 2000 e prefeito de Nilópolis de 2001 a 2009;\nseu tio, Miguel Abraão David, também foi prefeito de Nilópolis, de 1983\na 1989; outro tio, [Anísio Abraão\nDavid](http://pt.wikipedia.org/wiki/Aniz_Abra%C3%A3o_David \"Aniz Abraão David\"),\nfoi patrono do Grêmio Recreativo e Escola de Samba Beija-Flor de\nNilópolis e presidente da Liga Independente das Escolas de Samba do Rio\nde Janeiro (Liesa) de 1985 a 1987. Dois primos de seu pai também\nseguiram carreira política: Simão Sessim foi prefeito de Nilópolis de\n1973 a 1977, foi eleito deputado federal pela primeira vez em 1978 e em\n2010 conquistou seu nono mandato; e Jorge David foi prefeito de\nNilópolis de 1989 a 1993. Seu primo Abraão David Neto, o Abraãozinho,\nfoi eleito vereador em Nilópolis em 2004; outro primo, Sérgio Sessim,\nfoi eleito prefeito de Nilópolis em 2008.\n\nRicardo Abraão graduou-se em direito na Universidade Gama Filho em 1995.\nDe 2001 a 2002 foi chefe de gabinete da prefeitura de Nilópolis, na\nadministração de seu pai. Durante esse período idealizou e coordenou o\nprograma de distribuição de 15 mil kits escolares aos alunos da rede\nmunicipal.\n\nNas eleições de outubro de 2002 foi eleito pela primeira vez deputado\nestadual no Rio de Janeiro pelo Partido Progressista (PP). Tomou posse\nem fevereiro do ano seguinte, ao se iniciar a legislatura 2003-2007, e\nnesse período foi também vice-presidente da Escola de Samba Beija-Flor\nde Nilópolis. Na Assembleia Legislativa do Estado do Rio de Janeiro\n(ALERJ) apresentou um projeto de lei eferente à defesa do consumidor que\nfoi aprovado. Em 2007 foi denunciado pelo Ministério Público Eleitoral\npor ter supostamente distribuído, como material de campanha, 50 mil\nencartes de jornais que ligavam seu nome a obras realizadas na região de\nNilópolis. O Tribunal Regional Eleitoral do Rio considerou que houve\ncrime eleitoral e o condenou a três anos de inelegibilidade por uso\nindevido dos meios de comunicação.\n\nNo pleito de outubro de 2010 elegeu-se mais uma vez deputado estadual,\nagora pelo Partido Democrático Trabalhista (PDT). Os municípios que mais\ncontribuíram para sua votação foram Nilópolis, Rio de Janeiro, Paraíba\ndo Sul, Teresópolis, Nova Iguaçu, São João de Meriti, Sapucaia, Mesquita\ne Belford Roxo, responsáveis por 90,68% dos votos que recebeu. Tomou\nposse na ALERJ em 1^o^ de fevereiro de 2011 e passou a presidir a\nComissão de Trabalho, Legislação Social e Seguridade Social.\n\nCasou-se com Natália David, com quem teve três filhos.\n\n*Ana Beatriz Paes*\n\nFONTES: ASSEMB. LEGISL. RJ. *Notícias*. Disponível em:\n\\<www.alerj.rj.gov.br/common/noticia\\_hist.asp?mes=09&ano=2006\\>;\nASSEMB. LEGISL. RJ. Disponível em:\n\\<www.alerj.rj.gov.br/especiais\\_enc\\_2003\\_2006.htm\\>,\n\\<www.alerj.rj.gov.br/cpi\\_enc\\_2003\\_2006.htm\\>; *Folha*. Disponível\nem:\n\\<www1.folha.uol.com.br/folha/especial/2006/eleicoes/candidatos-deputado\\_estadual-rj.shtml\\>;\nINF. Zenóbio Fonseca (2/5/2011); *Jornal da ALERJ* (28/10-3/11/2004.);\nNilópolis Online. Disponível em:\n\\<http://nilopolisonline.sitedabaixada.com.br/noticias/geral/2010/10/04/nilopolis-elege-calazans-e-ricardo-abrao-para-a-alerj/\\>;\nTRIB. REG. ELEIT. Disponível em:\n\\<www.tre-se.gov.br/servicos\\_judiciarios/publicacoes/Boletim\\_Jurisprudencial/2008/Boletim\\_Jurisprudencial\\_33\\_2008.pdf\\>;\nTRIB. SUP. ELEIT. Disponível em:\n\\<www.tse.gov.br/partidos/desempenho/depDistEst/rj/de/rjde11198.htm\\>.\n","ref":"FONTES: ASSEMB. LEGISL. RJ. *Notícias*. Disponível em:\n\\<www.alerj.rj.gov.br/common/noticia\\_hist.asp?mes=09&ano=2006\\>;\nASSEMB. LEGISL. RJ. Disponível em:\n\\<www.alerj.rj.gov.br/especiais\\_enc\\_2003\\_2006.htm\\>,\n\\<www.alerj.rj.gov.br/cpi\\_enc\\_2003\\_2006.htm\\>; *Folha*. Disponível\nem:\n\\<www1.folha.uol.com.br/folha/especial/2006/eleicoes/candidatos-deputado\\_estadual-rj.shtml\\>;\nINF. Zenóbio Fonseca (2/5/2011); *Jornal da ALERJ* (28/10-3/11/2004.);\nNilópolis Online. Disponível em:\n\\<http://nilopolisonline.sitedabaixada.com.br/noticias/geral/2010/10/04/nilopolis-elege-calazans-e-ricardo-abrao-para-a-alerj/\\>;\nTRIB. REG. ELEIT. Disponível em:\n\\<www.tre-se.gov.br/servicos\\_judiciarios/publicacoes/Boletim\\_Jurisprudencial/2008/Boletim\\_Jurisprudencial\\_33\\_2008.pdf\\>;\nTRIB. SUP. ELEIT. Disponível em:\n\\<www.tse.gov.br/partidos/desempenho/depDistEst/rj/de/rjde11198.htm\\>.\n","dic":"DPRRJ"}
