{"title":"COZZOLINO, José","cargoss":["Deputado Estadual"],"cargos_esp":[0],"datas_ini":[1987],"datas_fim":[1995],"estados":["RJ"],"autor":["Luciana Pinheiro"],"content":"**COZZOLINO, José**\n\n\\* dep. est. RJ 1987-1995.\n\n*José Cozzolino* nasceu em Magé (RJ) no dia 20 de março de 1927. Seu\nirmão Renato Cozzolino foi prefeito de Magé entre 1982 e 1986.\n\nProfessor com longa experiência no magistério, José Cozzolino ingressou\nna política como secretário de Obras e de Planejamento da Prefeitura de\nMagé entre 1983 e 1986, durante a gestão do irmão Renato.\n\nNas eleições de novembro de 1986 candidatou-se a deputado estadual na\nlegenda do Partido da Frente Liberal (PFL), atual Democratas (DEM), e\nfoi eleito. Tomou posse na Assembleia Legislativa do Estado do Rio de\nJaneiro (ALERJ) em fevereiro de 1987 e tornou-se vice-líder do PFL. Em\nabril de 1988 filiou-se ao Partido do Movimento Democrático Brasileiro\n(PMDB), do qual também foi vice-líder. Foi suplente das comissões de\nTurismo e de Assuntos sobre a Mulher e o Menor, membro da comissão\nparlamentar de inquérito (CPI) criada para apurar denúncias sobre o\ndesmatamento no município de Magé e relator da CPI que investigou\nresponsabilidades na destruição do ecossistema da Lagoa de Araruama.\nAlém disso, foi vice-presidente da Comissão de Obras Públicas e da\ncomissão especial criada pela ALERJ para estudar as questões pertinentes\nao Polo Petroquímico do Estado do Rio de Janeiro.\n\nEm 1990 candidatou-se à reeleição na legenda do PFL e foi eleito. No\ndecorrer de seu segundo mandato, entre fevereiro de 1991 e janeiro de\n1995, foi vice-líder da bancada do PMDB, suplente da Comissão da Obras\nPúblicas, e presidiu a Comissão de Redação da ALERJ.\n\nFoi, ainda, professor titular da Faculdade de Educação, Ciências e\nLetras Grande Rio e docente efetivo do Departamento de Educação Média e\nSuperior do Estado do Rio de Janeiro, além de ter dirigido o Centro\nEducacional São José, localizado na Baixada Fluminense.\n\nCasou-se com Juraci Pereira Cozzolino. Seu filho Renato Cozzolino\nSobrinho foi prefeito de Magé (1989-1992), deputado estadual (1995-1999)\ne deputado federal (2003-2007) pelo Rio de Janeiro. Seus sobrinhos\ntambém exerceram mandatos eletivos: Charles Cozzolino também foi\nprefeito de Magé (1993-1996); Núbia Cozzolino foi deputada estadual no\nRio de Janeiro (1995-2005) e prefeita de Magé (2005-2009); Jane\nCozzolino foi deputada estadual no Rio de Janeiro (2007-2008), e\nAnderson Cozzolino foi vereador (2009-2010) e prefeito do mesmo\nmunicípio (2011-).\n\n*Luciana Pinheiro*\n\nFONTES: ASSEMB. LEGISL. *Deputados estaduais fluminenses.* Quinta\nlegislatura (1991-1994);CÂM. DEP. Disponível em: \\<www.camara.gov.br/\\>;\nAcesso em: 30/10/2010; *Dia*. Disponível em:\n\\<http://odia.terra.com.br/\\>. Acesso em: 30/10/2010.\n","ref":"FONTES: ASSEMB. LEGISL. *Deputados estaduais fluminenses.* Quinta\nlegislatura (1991-1994);CÂM. DEP. Disponível em: \\<www.camara.gov.br/\\>;\nAcesso em: 30/10/2010; *Dia*. Disponível em:\n\\<http://odia.terra.com.br/\\>. Acesso em: 30/10/2010.\n","dic":"DPRRJ"}
