{"title":"CRUZ, José da Silva","cargoss":["Deputado Estadual"],"cargos_esp":[0],"datas_ini":[1895],"datas_fim":[1897],"estados":["RJ"],"autor":[0],"content":"**CRUZ, José da Silva**\n\n\\* dep. est. RJ 1895-1897.\n\n*José da Silva Cruz* nasceu em Monte Verde (RJ).\n\nNas eleições realizadas em 20 de maio de 1895 candidatou-se a deputado\nestadual no Rio de Janeiro, na chapa oficial do Partido Republicano\nFluminense (PRF), liderado por José Tomás da Porciúncula, ex-presidente\ndo estado do Rio de Janeiro (1892-1894) e então deputado federal\n(1895-1897). Sob a liderança de Porciúncula, o PRF, partido\nrepresentante dos setores majoritários da oligarquia fluminense, exerceu\nhegemonia no Executivo e Legislativo estadual. Elegeu-se e assumiu o\nmandato.\n\nAinda em 1895 foi primeiro-secretário interino na terceira e quarta\nsessões da Assembleia, em setembro.\n\n*Ioneide Piffano Brion de Souza*\n\nFONTES: ASSEMB. LEGISL. RJ. *Anais*(1898); ASSEMB. LEGISL. RJ.\n*Legislaturas*. Disponível em: \\<www.alerj.rj.gov.br/arquivo.htm\\>.\nAcesso em: 10/10/2010.\n","ref":"FONTES: ASSEMB. LEGISL. RJ. *Anais*(1898); ASSEMB. LEGISL. RJ.\n*Legislaturas*. Disponível em: \\<www.alerj.rj.gov.br/arquivo.htm\\>.\nAcesso em: 10/10/2010.\n","dic":"DPRRJ"}
