{"title":"CRUZ, Luís Carlos","cargoss":["Deputado Estadual"],"cargos_esp":[0],"datas_ini":[1975],"datas_fim":[1979],"estados":["RJ"],"autor":[0],"content":"**CRUZ, Luís Carlos**\n\n**\\*** dep.est. RJ 1975-1979.\n\n*Luís Carlos da Cruz Carvalho* nasceu no dia 25 de junho de 1938.\n\nProfessor e ex-diretor de escola particular, atuou a favor do ensino,\nsobretudo em nome dos interesses das escolas particulares.\n\nFiliado ao Movimento Democrático Brasileiro (MDB), foi eleito deputado\nestadual nas eleições realizadas em novembro de 1974.\n\nNesse ano o presidente Ernesto Geisel enviou um projeto de lei ao\nCongresso Nacional que previa a fusão dos estados da Guanabara e do Rio\nde janeiro. Após rápida tramitação, o projeto foi transformado em lei em\njulho de 1974. Por essa razão, os deputados estaduais eleitos passaram a\nformar, em março de 1975, a Assembleia Constituinte, incumbida de\nelaborar a Constituição do novo estado do Rio de Janeiro, cujo\ngovernador nomeado foi o almirante Faria Lima. A fusão foi efetivada sem\nque houvesse consulta popular prévia.\n\nA Constituinte sofreu pressões do governador da Guanabara Chagas Freitas\n(1971-1975) para que concluísse rapidamente os trabalhos. Como a\ncorrente chaguista dentro dela era minoritária, em apenas quatro meses a\nnova Carta foi finalizada. Após a promulgação da nova Constituição, em\n23 de julho de 1975, Luís Carlos Cruz retornou ao exercício do mandato\nordinário na Assembleia Legislativa do Estado do Rio de Janeiro (ALERJ).\n\nDurante a 1^a^ legislatura (1975-1979) foi um dos vice-líderes do\npartido. Atuou principalmente a favor da Zona Norte da cidade do Rio de\nJaneiro (destaque para os bairros de Irajá, Bento Ribeiro, Madureira,\nRocha Miranda, Oswaldo cruz, Honório Gurgel, Marechal Hermes).\n\n*Jougi Guimarães Yamashita*\n\nFONTES: ASSEMB. CONST. RJ. *Anais*; ASSEMB. LEGISL. RJ. Disponível em:\n\\<www.alerj.rj.gov.br/\\>. Acesso em: 20/3/2011; ASSEMB. LEGISL. R J.\n*Fundos*.\n","ref":"FONTES: ASSEMB. CONST. RJ. *Anais*; ASSEMB. LEGISL. RJ. Disponível em:\n\\<www.alerj.rj.gov.br/\\>. Acesso em: 20/3/2011; ASSEMB. LEGISL. R J.\n*Fundos*.\n","dic":"DPRRJ"}
