{"title":"CUNHA NETO, Flores da","cargoss":["Constituinte","Deputado Estadual","Deputado Estadual"],"cargos_esp":["est",0,0],"datas_ini":[1975,1983,1975],"datas_fim":[1975,1987,1979],"estados":["RJ","RJ","RJ"],"autor":["Sabrina Guerghe"],"content":"**CUNHA NETO, Flores da**\n\n\\* const. est. RJ 1975; dep. est. RJ 1975-1979 e 1983-1987.\n\n*José Antônio Flores da Cunha Neto* nasceu em Porto Alegre no dia 27 de\nmarço de 1937. Seu avô, José Antônio Flores da Cunha, importante líder\npolítico gaúcho, foi deputado federal (1912-1914, 1918-1920, 1924-1926,\n1927-1929 e 1946-1959), interventor federal no Rio Grande do Sul\n(1930-1935) e governador do estado (1935-1937).\n\nFlores da Cunha Neto bacharelou-se em direito e em 1966 tornou-se\nprocurador do Instituto de Administração Financeira da Previdência e\nAssistência Social (IAPAS), autarquia extinta ao ser fundida ao\n*Instituto Nacional de Previdência Social* (INPS) na criação do\n*Instituto Nacional do Seguro Social* (INSS) através da Lei n^o^ 8.029,\nde 1990.\n\nNo pleito de novembro de 1974 elegeu-se deputado estadual no Rio de\nJaneiro na legenda do Movimento Democrático Brasileiro (MDB). Iniciou\nseu mandato em fevereiro de 1975, e de março a julho, durante trabalhos\nda Assembleia Constituinte estadual, foi membro titular da Comissão\nEspecial de Redação e da Subcomissão do Poder Judiciário e Direitos e\nGarantias Individuais. No ano seguinte, presidiu a Comissão Parlamentar\nde Inquérito (CPI) para apurar irregularidades na Fundação Estadual de\nEducação do Menor (FEEM) e integrou a CPI para investigar o problema das\nfavelas no Grande Rio. Ainda em 1976 foi membro efetivo das comissões de\nEducação e Cultura e de Siderurgia e Mineração, além de ter sido\nescolhido vice-líder do Bloco Parlamentar de Integração Partidária,\nfunção que exerceria até o fim do mandato. No pleito de 1978 tentou a\nreeleição mas não foi bem sucedido. Deixou assim a Assembleia\nLegislativa em janeiro de 1979.\n\nNas eleições de 15 de novembro de 1982 candidatou-se novamente ao\nLegislativo fluminense, dessa vez na legenda do Partido Democrático\nTrabalhista (PDT), e, com 17.396 votos, obteve a segunda suplência.\nAssumiu uma cadeira no dia 17 de março de 1983 e tornou-se vice-líder da\nbancada pedetista. Durante o mandato foi relator das comissões especiais\npara estudar as causas do alto índice de mendicância na Região\nMetropolitana do Rio de Janeiro e para apurar as causas da diminuição do\nfornecimento de leite do tipo especial ao comércio varejista. Também\nintegrou a Comissão de Constituição e Justiça. Encerrou o mandato em\njaneiro de 1987.\n\nFoi, ainda, delegado regional do Instituto dos Marítimos do Estado da\nGuanabara, e integrou a junta interventora do conselho administrativo\ndesse instituto. Também presidiu a extinta Fundação Estadual do\nBem-Estar do Menor (FEBEM-RJ) e foi assessor jurídico da Fundação\nNacional do Bem-Estar do Menor (Funabem).\n\n*Sabrina Guerghe*\n\nFONTES: ASSEMB. LEGISL. RJ. *Documentos*; ASSEMB. LEGISL. RJ. *Deputados\nestaduais fluminenses.* Quarta legislatura (1987-1991); ASSEMB. LEGISL.\nRS. Disponível em:\n\\<**www.al.rs.gov.br/diario/diarios\\_anteriores/981216/obra.htm\\>;**\nTRIB. REG. ELEIT. RJ. Disponível em:\n\\<www.tre-rj.gov.br/site/legislacao/resolucoes/1978/restre37.pdf\\>.\n","ref":"FONTES: ASSEMB. LEGISL. RJ. *Documentos*; ASSEMB. LEGISL. RJ. *Deputados\nestaduais fluminenses.* Quarta legislatura (1987-1991); ASSEMB. LEGISL.\nRS. Disponível em:\n\\<**www.al.rs.gov.br/diario/diarios\\_anteriores/981216/obra.htm\\>;**\nTRIB. REG. ELEIT. RJ. Disponível em:\n\\<www.tre-rj.gov.br/site/legislacao/resolucoes/1978/restre37.pdf\\>.\n","dic":"DPRRJ"}
