{"title":"CUNHA, Mário Leitão da","cargoss":["Deputado Estadual"],"cargos_esp":[0],"datas_ini":[1923],"datas_fim":[1926],"estados":["RJ"],"autor":["Raimundo Helio Lopes"],"content":"**CUNHA, Mário Leitão da**\n\n\\* dep. est. RJ 1923-1926.\n\n*Mário Leitão da Cunha* foi eleito deputado estadual pelo terceiro\ndistrito eleitoral, com sede em Cantagalo (RJ), em 28 de outubro de\n1923, no pleito realizado durante a intervenção federal no estado do Rio\nde Janeiro. Durante a intervenção federal, decretada em 10 de janeiro de\n1923 pelo então presidente da República Artur Bernardes (1922-1926), o\nestado foi governado pelo interventor Aureliano Leal, que fechou a\nAssembleia Legislativa do Estado do Rio de Janeiro (ALERJ) e anulou as\neleições de 9 de julho de 1922 realizadas para a sucessão do então\npresidente estadual Raul Veiga (1918-1922), quando os candidatos Raul\nFernandes e Feliciano Sodré declararam-se eleitos, ocasionando a\ndualidade da ALERJ.\n\nFoi eleito na legenda do Partido Republicano Fluminense (PRF). Com o\ninício dos trabalhos legislativos, em 27 de novembro, participou do\nreconhecimento pela ALERJ da eleição de Feliciano Sodré para presidente\ndo Rio de Janeiro (1923-1927), encerrando o período de intervenção\nfederal do estado. Foi eleito ainda nesse ano, e sucessivamente reeleito\naté o final da legislatura em 1926, membro da Comissão de Petições,\nRepresentações e Poderes. Durante seu mandato defendeu a construção de\nescolas e outras edificações em São Francisco de Paula (RJ), cidade onde\ntinha sua base eleitoral.\n\n*Raimundo Helio Lopes*\n\nFONTES: ASSEMB LEGISL. RJ (1923-1926); FERREIRA, M. República.\n","ref":"FONTES: ASSEMB LEGISL. RJ (1923-1926); FERREIRA, M. República.\n","dic":"DPRRJ"}
