{"title":"CUNHA, Ranulfo Bocaiúva","cargoss":["Deputado Estadual","Prefeito","Deputado federal","Ministro do Supremo Tribunal Militar"],"cargos_esp":[0,"Niterói",0,0],"datas_ini":[1915,1921,1924,1946],"datas_fim":[1921,1922,1930,1957],"estados":["RJ",0,"RJ",0],"autor":[0],"content":"**CUNHA,** **Ranulfo Bocaiúva**\n\n\\* dep. est. RJ 1915-1921; pref. Niterói 1921-1922; dep. fed. RJ\n1924-1930; min. STM 1946-1957.\n\n*Ranulfo Bocaiúva Cunha* nasceu em Campos (RJ) no dia 27 de maio de\n1888, filho de Godofredo Xavier da Cunha e de Emérita Bocaiúva Cunha.\nSeu pai foi o primeiro chefe de polícia do estado do Rio de Janeiro no\nregime republicano e, a seguir, ministro (1909-1931) e presidente\n(1927-1931) do Supremo Tribunal Federal (STF). Seu avô materno, o líder\nrepublicano Quintino Bocaiúva, exerceu, após a proclamação da República,\nos cargos de ministro da Agricultura (1889) e das Relações Exteriores\n(1889-1891), e foi também senador (1890-1891, 1892-1899 e 1901-1918).\nSeu ascendente pelo lado paterno, Rafael Pinto Bandeira, foi importante\nfigura nas lutas para a expulsão dos castelhanos da Colônia do\nSacramento.\n\nTendo aprendido as primeiras letras com sua mãe, ingressou no Externato\nJoaquim Serra, no Rio de Janeiro, então Distrito Federal, e, a seguir,\nno Colégio Militar dessa cidade, onde fez os estudos preparatórios entre\n1902 e 1905. Como pretendesse seguir a carreira militar e seus pais não\nconsentissem em sua matrícula na Escola Militar, transferida em 1906\npara Porto Alegre, ingressou nesse mesmo ano na Escola Naval, que\nabandonou a seguir por motivo de doença. Matriculou-se então na\nFaculdade de Ciências Jurídicas e Sociais do Rio de Janeiro e passou a\ndedicar-se ao jornalismo, colaborando, ainda como universitário, nos\njornais *O* *País* – fundado e dirigido por seu avô Quintino Bocaiúva –\n*A Notícia*, *O Dia* e na revista *A Época*, além de outras publicações.\nTrabalhou também no Ministério da Agricultura e, em 1912, concluiu o\ncurso universitário.\n\nEm 1914 foi nomeado auxiliar de auditor de guerra pelo ministro da\nGuerra, general Vespasiano de Albuquerque e Silva (1912-1914), e\ningressou na política pela mão do ex-presidente Nilo Peçanha\n(1909-1910), elegendo-se deputado à Assembleia Legislativa do estado do\nRio de Janeiro na legenda do Partido Republicano Fluminense (PRF).\nDurante a legislatura, que se iniciou em 1915 e terminou em 1917, ocupou\nos cargos de segundo e primeiro-secretário da Assembleia fluminense,\ntendo sido autor da lei que criou o ensino profissional no estado do Rio\ne a Escola Profissional Visconde de Morais, atual Henrique Laje.\nReeleito por duas vezes, exerceu seus novos mandatos de 1918 a 1920 e\ndurante os primeiros meses de 1921.\n\nNomeado prefeito de Niterói pelo presidente do estado do Rio de Janeiro,\nRaul de Morais Veiga (1918-1922), assumiu o cargo em maio de 1921. Nessa\nocasião apoiou em nível federal a campanha da Reação Republicana, que\npromoveu a candidatura de Nilo Peçanha à presidência da República em\noposição à de Artur Bernardes, afinal eleito em março de 1922. Durante\nsua administração realizou inúmeras obras públicas, criando ainda a\nDiretoria Municipal de Instrução Pública, atual Secretaria de Educação e\nCultura. Exonerou-se do cargo de prefeito em junho de 1922 para voltar a\npostulá-lo na legenda do PRF no pleito que se realizaria no mês\nseguinte. Entretanto, desistiu de sua candidatura em virtude de\nproblemas com a política federal relacionados com a eleição de Artur\nBernardes, e retornou à Justiça Militar e às atividades de advogado e\njornalista.\n\nEm 1923 assumiu as funções de secretário do ministro da Justiça, seu\nsogro João Luís Alves (1922-1925), e em março de 1924 elegeu-se deputado\nfederal na legenda do PRF, sendo empossado em maio do mesmo ano.\nReeleito em 1927, apresentou na Câmara um projeto sobre a criação do\nInstituto Nacional de Padrões, e durante a discussão do projeto de\nestabilização cambial manifestou-se a favor da adoção do cruzeiro. Após\nas eleições de março de 1930 – nas quais renovou mais uma vez seu\nmandato –, votou a favor do reconhecimento da bancada federal paraibana\ncomposta por políticos ligados ao governo do presidente Washington Luís.\nPrimeiro-secretário da Câmara dos Deputados, encontrava-se em Paris\nquando foi deflagrada em outubro a Revolução de 1930, que extinguiu seu\nmandato, assim como todos os órgãos legislativos do país. Em dezembro\nfoi denunciado pelo Tribunal Especial Revolucionário devido à sua\nposição favorável ao reconhecimento dos deputados paraibanos.\n\nAuditor de guerra da 3^a^ Auditoria da capital federal a partir de 1936,\nfoi nomeado em agosto de 1946 ministro do Superior Tribunal Militar\n(STM). Em 1948 participou do Congresso Jurídico realizado em Montevidéu,\nUruguai, permanecendo no STM até maio de 1957, quando se aposentou.\n\nFoi um dos fundadores e presidentes do Instituto de Pensões e\nAposentadoria dos Servidores do Estado (IPASE) e da Sociedade Fluminense\nde Agricultura e Indústrias, assim como do Montepio dos Servidores do\nEstado. Foi também membro do Instituto dos Advogados do Brasil, da\nSociedade Brasileira de Direito e da Academia Fluminense de Letras.\n\nFaleceu no Rio de Janeiro no dia 25 de abril de 1976.\n\nEra casado com Maria Vitória Alves, de quem teve três filhos. Seu sogro,\nJoão Luís Alves, além de ministro da Justiça, foi senador e ministro do\nSupremo Tribunal Federal (STF) entre 1924 e 1925. Seu filho, Luís\nFernando Bocaiúva Cunha, deputado federal do Partido Trabalhista\nBrasileiro (PTB) de 1959 a 1964 e líder do governo de João Goulart na\nCâmara em 1962, foi cassado em abril de 1964 pelo movimento\npolítico-militar que depôs Goulart. Posteriormente, voltou a ser\ndeputado federal pelo Rio de Janeiro entre 1983 e 1990 e constituinte em\n1987-1988.\n\nO arquivo de Ranulfo Bocaiúva Cunha encontra-se depositado no Centro de\nPesquisa e Documentação de História Contemporânea do Brasil (Cpdoc) da\nFundação Getulio Vargas.\n\nFONTES: BARBOSA, R. História;CÂM. DEP. Deputados; CORRESP. SUP. MILITAR;\nCORTÉS, C. Homens; Grande encic. Delta;Jornal do Brasil (26/4/1976);\nSOARES, E. Prefeitura.\n","ref":"FONTES: BARBOSA, R. História;CÂM. DEP. Deputados; CORRESP. SUP. MILITAR;\nCORTÉS, C. Homens; Grande encic. Delta;Jornal do Brasil (26/4/1976);\nSOARES, E. Prefeitura.\n","dic":"DPRRJ"}
