{"title":"DALMASSO, Artur","cargoss":["Deputado Estadual","Deputado Estadual"],"cargos_esp":[0,0],"datas_ini":[1967,1959],"datas_fim":[70,1962],"estados":["RJ","RJ"],"autor":["Daniela Yabeta"],"content":"**DALMASSO, Artur**\n\n\\* dep. est. RJ 1959-1962, 1967-70.\n\n*Artur Dalmasso* nasceu em La Tourvet, França, no dia 29 de agosto de\n1920, filho dos italianos José Dalmasso e Rosa Dalmasso. Veio para o\nBrasil com seus pais em 1922 e foram morar em Nova Friburgo.\n\nEm 1946, aos 24 anos, graduou-se pela Faculdade Fluminense de Medicina,\nhoje Universidade Federal Fluminense (UFF). No ano seguinte, em 1947,\nfoi morar na cidade de Teresópolis, naturalizou-se brasileiro e casou-se\ncom Leda Gilce Dalmasso, falecida em 1960. Em Teresópolis, fundou a\nSociedade de Ciências Médicas (1948), a Academia Cultural e Artística\n(1950) e a Casa de Saúde Nossa Senhora de Fátima (1955).\n\nNo pleito de 1958 elegeu-se deputado estadual no Rio de Janeiro pelo\nPartido Social Democrata (PSD), assumiu a cadeira no ano seguinte (1959)\ne cumpriu seu mandato até 1962.\n\nComo escritor e poeta, fundou a Academia Teresopolitana de Letras em\n1961 e no ano seguinte publicou, por iniciativa própria, seu primeiro\nromance, *Farrapos do sol poente*. Em 1964 casou-se com Gioconda Gouvêa\nDalmasso.\n\nNo pleito de 1966 elegeu-se novamente deputado estadual no Rio de\nJaneiro pela Aliança Renovadora Nacional (Arena) e assumiu o mandato na\nAssembleia Legislativa em janeiro de 1967. Nesse mesmo período\n(1966-1967) foi presidente da Associação Médica Fluminense (AMF) e\nfundou a Faculdade de Medicina da Serra dos Órgãos (1966), atual Unifeso\n– Centro Universitário Serra dos Órgãos. Em 1968 foi vice-líder da Arena\nna Assembleia e tornou-se secretário estadual da Indústria e Comércio do\ngoverno de Geremias Fontes (1968-1969). Em 1970 assumiu a liderança da\nArena na Assembleia até o final de seu mandato.\n\nApós deixar a política, continuou se dedicando à vida pública em\nTeresópolis, onde recebeu inúmeras homenagens e fundou importantes\nentidades, como a Sociedade dos Artistas de Teresópolis (1983). Sua\npreocupação com a preservação da memória do município de Teresópolis fez\ncom que doasse ao Patrimônio Histórico Municipal seu acervo com mais de\nsete mil fotografias de Mário Baldi (1897-1957), fotografóo austríaco\nque, assim como ele, mudou-se para o Brasil junto com sua família em\n1921, aos 24 anos de idade, e escolheu Teresópolis como sua cidade.\n\nEm 1986 lançou seu segundo livro *Antologia*, pela Academia\nTeresopolitana de Letras. Em 1989 publicou seu discursso na sessão de\ncomemoração ao centenário do nascimento de Olegário Mariano na *Revista\nda Academia Brasileira de Letras*.\n\nEm 1997, cinquenta anos depois de ter se naturalizado brasileiro, lançou\nseu terceiro livro pela Zen Gráfica Editora, *O livro de Ocaian: meio\nséculo de vida em Teresópolis*.\n\nArtur Dalmasso faleceu em Teresópolis, em 2006. Deixou sua mulher\nGioconda e quatro filhos: Gilce, Artur, Ronaldo e Télio.\n\nEm 2009 a cidade de Teresópolis inaugurou a Casa da Memória Artur\nDalmasso, que abriga o Serviço de Patrimônio Histórico, Artístico e\nCultural de Teresópolis, a sede da administração da Secretaria de\nCultura do município e uma biblioteca para pesquisa da história da\ncomunidade.\n\nEm 2010, a Casa da Memória Arthur Dalmasso recebeu a visita do diretor\ndo Museu de Etnologia de Viena, na Áustria, o antropólogo Christian\nFeest. O principal motivo de sua visita foi justamente o acervo do\nfotógrafo austríaco Mario Baldi, doado por Dalmasso.\n\nAo longo da vida recebeu a Medalha Sílvio Romero, conferida pela\nSecretaria de Educação do extinto estado da Guanabara; o título de\nCidadão Honorário de Teresópolis; o Troféu Mulher de Pedra, oferecido\npelo Comitê de Imprensa de Teresópolis por sua atuação no campo das\nartes; o Prêmio Serrana por suas atividades no setor de educação e\ncultura e a Medalha Euclides da Cunha, conferida pelo Clube dos Estados\n(SP), por seus méritos e dedicado culto ao Brasil.\n\n*Daniela Yabeta*\n\nFONTES: CASA DE MEM. ARTHUR DALMASSO; Entrevista com Gilce Dalmasso\n(11/2010); Netsaber Biografias. Disponível em:\n\\<www.netsaber.com.br/biografias/index.html\\>. Acesso em: 4/11/2010.\n","ref":"FONTES: CASA DE MEM. ARTHUR DALMASSO; Entrevista com Gilce Dalmasso\n(11/2010); Netsaber Biografias. Disponível em:\n\\<www.netsaber.com.br/biografias/index.html\\>. Acesso em: 4/11/2010.\n","dic":"DPRRJ"}
