{"title":"DAMASCENO, Hélio","cargoss":["Deputado Estadual"],"cargos_esp":["GB"],"datas_ini":[1967],"datas_fim":[1971],"estados":[0],"autor":["Adriana Clen"],"content":"**DAMASCENO, Hélio**\n\n\\* dep. est. GB 1967-1971.\n\n*Hélio Santos Damasceno* nasceu em 22 de março de 1926.\n\nEm 1958, quando era filiado ao Partido Trabalhista Nacional (PTN), foi\nsuplente do senador Napoleão Alencastro Guimarães (1901-1967), eleito na\n40^a^ legislatura (1955-1959).\n\nFoi eleito para a segunda legislatura da Assembleia do Estado da\nGuanabara (ALEG) através da Aliança Renovadora Nacional (Arena) e ocupou\no cargo entre 1^o^ de fevereiro de 1967 e 31 de janeiro de 1971. Durante\nseu mandato participou da Comissão de Emendas Constitucionais, foi\nvice-líder do bloco parlamentar da Arena, suplente da Comissão de\nOrçamentos e Finanças e 2^o^ vice-presidente da Mesa Diretora.\n\nNa 2^a^ sessão ordinária realizada em 17 de março de 1967 o deputado\nestadual realizou uma leitura do discurso de presidente marechal Arthur\nda Costa e Silva (1899-1969) e declarou apoio às ações políticas do\ngoverno militar.\n\n*Adriana Clen*\n\nFONTES: ASSEMB. LEGISL. RJ. *Anais* (v. LXI, v. LX, v. LXVIII); ASSEMB.\nLEGISL. RJ. Disponível em:\n\\<www.alerj.rj.gov.br/center\\_arq\\_aleg\\_prod\\_link4.htm\\>. Acesso em:\n14/1/2011.\n","ref":"FONTES: ASSEMB. LEGISL. RJ. *Anais* (v. LXI, v. LX, v. LXVIII); ASSEMB.\nLEGISL. RJ. Disponível em:\n\\<www.alerj.rj.gov.br/center\\_arq\\_aleg\\_prod\\_link4.htm\\>. Acesso em:\n14/1/2011.\n","dic":"DPRRJ"}
