{"title":"DAVID, Próspero","cargoss":["Deputado Estadual"],"cargos_esp":[0],"datas_ini":[1892],"datas_fim":[1894],"estados":["RJ"],"autor":[0],"content":"**DAVID, Próspero**\n\n\\* dep. est. RJ 1892-1894.\n\n*Vitor Próspero David* foi eleito, no dia 8 de janeiro de 1888, vereador\nem Niterói (RJ). No ano seguinte assumiu a vice-presidência da Câmara de\nNiterói em substituição a Antônio Joaquim da Silva Fontes.\n\nCandidatou-se às primeiras eleições realizadas após a proclamação da\nRepública (15/11/1889), para a formação da Assembleia Constituinte\nfluminense, mas não foi eleito. Esse pleito, realizado em 20 de março de\n1891, foi vencido pelos partidários do presidente do estado do Rio de\nJaneiro, Francisco Portela (1889-1891), nomeado pelo presidente da\nRepública, marechal Deodoro da Fonseca (1889-1891). Os portelistas\nderrotaram os candidatos do Partido Republicano liderados por José Tomás\nda Porciúncula, republicano histórico.\n\nA primeira Constituição fluminense havia sido elaborada em 1891 pelos\npartidários de Francisco Portela e anulada após a renúncia deste, em\ndezembro do mesmo ano. No dia 31 de janeiro de 1892 uma nova eleição foi\nrealizada para compor a nova Assembleia Constituinte, que foi formada\npor membros do PRF, presidida por José Tomás da Porciúncula e que\npromulgaria, no dia 9 de abril do mesmo ano, a segunda Constituição\nfluminense. No dia 24 de abril foram realizadas eleições para a\ncomposição da Assembleia Legislativa. Vitor Próspero David elegeu-se\ndeputado estadual na legenda do Partido Republicano Fluminense (PRF). No\nmesmo pleito José Tomás da Porciúncula elegeu-se presidente do estado do\nRio de Janeiro (1892-1894). Vitor Próspero David iniciou o mandato no\nLegislativo estadual em maio de 1892 e concluiu-o em dezembro de 1894.\n\nFoi também ourives e operário.\n\n*Ioneide Piffano Brion de Souza*\n\nFONTES: ASSEMB. LEGISL. RJ. *Anais*(1892); CAMPOS, M.*Governo*; LEMOS,\nR. *Implantação*.\n","ref":"FONTES: ASSEMB. LEGISL. RJ. *Anais*(1892); CAMPOS, M.*Governo*; LEMOS,\nR. *Implantação*.\n","dic":"DPRRJ"}
