{"title":"DIAS, Joaquim Bernardes","cargoss":["Deputado federal"],"cargos_esp":[0],"datas_ini":[1897],"datas_fim":[1899],"estados":["RJ"],"autor":["Raimundo Helio Lopes"],"content":"**DIAS, Joaquim Bernardes**\n\n\\* dep. fed. RJ 1897-1899.\n\n*Joaquim Bernardes Dias* nasceu na cidade de Paraíba do Sul (RJ).\n\nDedicou sua vida profissional à atividade comercial.\n\nIniciou-se na política ainda durante o Império, quando defendeu a causa\nrepublicana. Com a proclamação da República em 15 de novembro de 1889,\naderiu ao novo regime e em 1897 foi eleito deputado federal pelo estado\ndo Rio de Janeiro na legenda do Partido Republicano Fluminense (PRF). Ao\nfinal da legislatura, em 1899, recebeu novamente o apoio do PRF para a\nreeleição, mas todos os candidatos do partido foram derrotados pela\nchapa do Partido Republicano do Rio de Janeiro (PRRJ), originário de\ncisão do PRF e fundado em 23 de julho de 1899 por Alberto Torres, então\npresidente estadual (1897-1900).\n\n*Raimundo Helio Lopes*\n\nFONTES: ABRANCHES. J. *Governos*; CÂM. DEP. *Deputados brasileiros*\n(1826-1976); FERREIRA, M. *República*.\n","ref":"FONTES: ABRANCHES. J. *Governos*; CÂM. DEP. *Deputados brasileiros*\n(1826-1976); FERREIRA, M. *República*.\n","dic":"DPRRJ"}
