{"title":"DINIZ, Álvaro Augusto de Morais","cargoss":["Deputado Estadual"],"cargos_esp":[0],"datas_ini":[1907],"datas_fim":[1915],"estados":["RJ"],"autor":["Raimundo Helio Lopes"],"content":"**DINIZ, Álvaro Augusto de Morais**\n\n\\* dep. est. RJ 1907-1915.\n\n*Álvaro Augusto de Morais Diniz* foi chefe político em Itaperuna (RJ),\nonde foi vereador no ano de 1902.\n\nEm dezembro de 1906 foi eleito deputado estadual na legenda do Partido\nRepublicano do Rio de Janeiro (PRRJ), pelo segundo distrito eleitoral,\ncom sede em Campos (RJ). Por ocasião da votação que visava, em setembro\nde 1907, regulamentar a cobrança da sobretaxa para o café, estipulada\npelo Convênio de Taubaté (1906), e o destino da arrecadação desse\nimposto, votou contra a manutenção da cobrança que havia sido o estopim\ndo distanciamento entre Nilo Peçanha e o então presidente do estado do\nRio de Janeiro Alfredo Backer (1906-1910). Neste mesmo ano foi eleito\nsuplente de secretário da Assembleia Legislativa e nos anos de 1908 e\n1909 foi membro das Comissões de Estatística, Divisão Civil e Judiciária\ne Redação de Leis, respectivamente.\n\nNas eleições estaduais de dezembro de 1909 foi reeleito deputado\nestadual, agora na chapa do Partido Republicano Fluminense (PRF),\npartido que passou a abrigar o grupo ligado a Nilo Peçanha e que\nconseguiu eleger a maioria dos deputados estaduais. No início dos\ntrabalhos legislativos de 1910 participou do chamado “caso fluminense”.\nO acontecimento consistiu no lançamento de duas candidaturas à sucessão\nestadual em julho de 1910 em que se encontraram, de um lado, Backer e\nseus partidários defendendo a candidatura de Manuel Edwiges Queirós\nViana e, de outro, Nilo Peçanha e correligionários apoiando o candidato\nFrancisco Chaves de Oliveira Botelho. Em agosto, realizada a eleição,\ncada grupo reivindicou a vitória de seu candidato. O impasse levou à\nintervenção do então presidente da República Hermes da Fonseca\n(1910-1914) que, em dezembro, empossou o candidato nilista Oliveira\nBotelho (1910-1914) na presidência do estado do Rio de Janeiro.\n\nEm fevereiro de 1911 ingressou no Partido Republicano Conservador\nFluminense (PRCF), surgido da fusão do PRF com o Partido Republicano\nConservador (PRC). Durante esse mandato foi membro sucessivamente da\nComissão de Comércio, Agricultura, Indústria e Colonização.\n\nEm 15 de dezembro de 1912 foi reeleito deputado estadual na legenda do\nPRCF. Em 1913, Oliveira Botelho e Nilo Peçanha romperam politicamente\ndevido à sucessão estadual, já que o presidente estadual lançou o nome\nde Feliciano Sodré, então prefeito de Niterói, enquanto o próprio Nilo\ncandidatou-se ao governo fluminense. Com esse rompimento, os nilistas\nvoltaram a usar a sigla do PRF, enquanto Feliciano Sodré concorreu pelo\nPRCF. Esse partido passou a abrigar a oposição ao nilismo e os deputados\nestaduais que apoiaram a candidatura de Sodré, caso de Álvaro Augusto de\nMorais Diniz.\n\nDurante a campanha eleitoral, a Assembleia Legislativa do Estado do Rio\nde Janeiro (ALERJ) foi dividida em duas: uma nilista e outra apoiadora\nde Feliciano Sodré, da qual fazia parte Álvaro Augusto de Moraes Diniz.\nDepois do pleito de 12 de julho de 1914, Nilo e Sodré declararam-se\nvencedores e foram reconhecidos pelas respectivas assembleias.\nEntretanto, a contenda só foi resolvida com um *habeas corpus* do\nSupremo Tribunal Federal (STF) garantindo a eleição de Nilo Peçanha e\nquando o recém-empossado presidente da República Venceslau Brás\n(1914-1918) assegurou a posse de Nilo.\n\nCom o início do novo governo de Nilo Peçanha (1914-1917), e a reabertura\ndos trabalhos legislativos da ALERJ, em julho de 1915, passou à oposição\nao governo, juntamente com os partidários do PRCF. Em dezembro\ncandidatou-se a mais uma reeleição, mas não foi vitorioso, pois os\nnilistas elegeram a maioria dos candidatos, derrotando a oposição.\nDurante a legislatura, novamente foi membro da Comissão de Comércio,\nAgricultura, Indústria e Colonização.\n\n*Raimundo Helio Lopes*\n\nFONTES: ASSEMB. LEGISL. RJ. *Anais* (1907-1915); FERREIRA, M.\n*República*.\n","ref":"FONTES: ASSEMB. LEGISL. RJ. *Anais* (1907-1915); FERREIRA, M.\n*República*.\n","dic":"DPRRJ"}
