{"title":"DÓRIA, Fonseca","cargoss":["Constituinte","Deputado Estadual"],"cargos_esp":["est",0],"datas_ini":[1947,1947],"datas_fim":[1947,1951],"estados":["RJ","RJ"],"autor":[0],"content":"**DÓRIA, Fonseca**\n\n\\* const. est. RJ 1947; dep. est. RJ 1947-1951.\n\n*Raimundo da Fonseca Dória* atuou em Itaperuna (RJ).\n\nApós o fim do Estado Novo (1937-1945) e a promulgação da Constituição\nfederal de 1946, foi eleito em janeiro de 1947 deputado à Assembleia\nConstituinte do estado do Rio de Janeiro na legenda do Partido Social\nDemocrático (PSD). Tomou posse no mês seguinte, e a partir de julho,\ndepois de promulgada a Constituição estadual, passou a exercer o mandato\nordinário na Assembleia Legislativa do Estado do Rio de Janeiro (ALERJ).\nFoi eleito terceiro secretário da Mesa da ALERJ, posicionou-se nos\ndebates envolvendo Itaperuna e região, manifestou-se sobre os problemas\nde saúde no estado, sobre a produção de aço e a Companhia Siderúrgica\nNacional (CSN), ressaltou a urgência de ação pública em favor da\nagricultura e criticou a ação dos interventores varguistas no estado do\nRio de Janeiro. Participou também das comissões dos Servidores Públicos\ne de Segurança Pública. Deixou a ALERJ ao final da legislatura, em\njaneiro de 1951.\n\n*Vicente Saul Moreira dos Santos*\n\nFONTES: ASSEMB. CONST. RJ. *Anais*. (1947); ASSEMB. LEGISL. RJ. *Anais*.\n(1947, 1948).\n","ref":"FONTES: ASSEMB. CONST. RJ. *Anais*. (1947); ASSEMB. LEGISL. RJ. *Anais*.\n(1947, 1948).\n","dic":"DPRRJ"}
