{"title":"ALVARENGA, Dílson","cargoss":["Deputado Estadual"],"cargos_esp":[0],"datas_ini":[1975],"datas_fim":[1983],"estados":["RJ"],"autor":["Sabrina Guerghe"],"content":"**ALVARENGA, Dílson**\n\n\\* dep. est. RJ 1975-1983.\n\n*Dílson Francisco de Alvarenga Meneses* nasceu na cidade do Rio de\nJaneiro, então Distrito Federal, no dia 24 de outubro de 1929, filho de\nRaul Leonardo de Meneses e de Deolinda Caldeira de Alvarenga Meneses.\nSeu avô materno, Francisco Caldeira de Alvarenga, foi vereador no Rio de\nJaneiro, então Distrito Federal, por cinco mandatos. Seu tio, Manuel\nCaldeira de Alvarenga, foi deputado federal pelo Rio de Janeiro\n(1935-1937) e seu primo, Maurício Caldeira de Alvarenga, foi deputado\nestadual na Guanabara (1963-1975).\n\nIngressou na Faculdade de Medicina da Universidade do Brasil em 1948.\nQuando cursava o quinto ano foi aprovado em concurso público para\nauxiliar médico do Hospital de Pronto-Socorro. Passou também a trabalhar\nno Serviço de Assistência Médica Domiciliar de Urgência (SAMDU), do\nMinistério do Trabalho. Graduou-se em 1953. Entre 1962 e 1964, fez três\ncursos de especialização na Pontifícia Universidade Católica do Rio de\nJaneiro (PUC-Rio).\n\nTendo como base eleitoral a Zona Oeste da cidade do Rio de Janeiro, em\n15 de novembro de 1974 elegeu-se deputado estadual constituinte no\nestado do Rio, na legenda do Movimento Democrático Brasileiro (MDB),\npartido de oposição ao regime militar instaurado em abril de 1964. O\npresidente Ernesto Geisel havia enviado um projeto de lei ao Congresso\nNacional que previa a fusão dos estados da Guanabara e do Rio de Janeiro\ne que, depois de rápida tramitação, foi transformado em lei em julho de\n1974.\n\nTomou posse em fevereiro de 1975 para o mandato ordinário, e passou a\nintegrar, em 15 de março, a Assembleia Estadual Constituinte encarregada\nde elaborar a Constituição do novo estado do Rio de Janeiro. Na\nAssembleia Constituinte, integrou a Comissão Especial de Redação e a\nComissão Constitucional e foi relator da Subcomissão de Saúde Pública e\nSaneamento Básico. Na ocasião, a maioria emedebista era ligada a Chagas\nFreitas e defendia que não se prolongassem no tempo os trabalhos\nconstituintes. Em apenas quatro meses a nova Carta foi finalizada e com\nsua promulgação, em 23 de julho de 1975, Dílson Alvarenga retornou ao\nexercício do mandato ordinário na Assembleia Legislativa do Estado do\nRio de Janeiro (ALERJ). Durante o mandato foi vice-presidente da\nComissão de Saúde e Higiene e membro da Comissão de Obras Públicas.\n\nNas eleições de novembro de 1978, foi reeleito na legenda emedebista.\nIniciou o novo mandato em fevereiro de 1979, assumiu a vice-liderança do\nbloco da maioria e passou a integrar as comissões de Agricultura e\nPolítica Rural, e de Saúde e Higiene. Atuou também como relator da\nComissão Parlamentar de Inquérito (CPI) para Apurar as Causas da\nPoluição da Baía de Guanabara.\n\nCom o fim do bipartidarismo e a reorganização partidária em 1979,\nfiliou-se ao Partido Popular (PP). Tentou se reeleger para um terceiro\nmandato parlamentar em 1982, mas, sem obter êxito, deixou a Assembleia\nLegislativa em janeiro de 1983, ao final da legislatura.\n\nFoi, ainda, cirurgião geral da Secretaria Estadual de Saúde, do\nInstituto dos Bancários e do Hospital da Lagoa e ginecologista do\nInstituto Nacional de Assistência Médica da Previdência Social (INAMPS).\n\nCasou-se com Maria Ivonete Del Cima de Alvarenga Meneses, com quem teve\ndois filhos.\n\nEntre outras obras, publicou a *Coleção hexágono*, com 11 volumes; a\nsérie *Trabalhos parlamentares*, com oito volumes; *O ciclo dos governos\nmilitares* (2006) e *Poluição das baías de Guanabara e Sepetiba* (1999).\n\n*Sabrina Guerghe*\n\nFONTES: ALVARENGA, D. *Biografia*; ASSEMB. LEGISL. RJ. *Documentos\nparlamentares*; *Diário Oficial RJ* (4/1, 5/2, 18 e 20/4/1979); DINIZ,\nE. *Voto*; MENEZES, D. *Biografia*; TRIB. CONTAS RJ. Disponível em:\n\\<www.tcm.rj.gov.br/WEB/Site/Noticia\\_Detalhe.aspx?noticia=2851&detalhada=2&downloads=0\\>.\n","ref":"FONTES: ALVARENGA, D. *Biografia*; ASSEMB. LEGISL. RJ. *Documentos\nparlamentares*; *Diário Oficial RJ* (4/1, 5/2, 18 e 20/4/1979); DINIZ,\nE. *Voto*; MENEZES, D. *Biografia*; TRIB. CONTAS RJ. Disponível em:\n\\<www.tcm.rj.gov.br/WEB/Site/Noticia\\_Detalhe.aspx?noticia=2851&detalhada=2&downloads=0\\>.\n","dic":"DPRRJ"}
