{"title":"DUTRA, Ildefonso Carlos de Azevedo","cargoss":["Constituinte","Deputado Estadual"],"cargos_esp":["est",0],"datas_ini":[1891,1891],"datas_fim":[1891,1891],"estados":["RJ","RJ"],"autor":[0],"content":"**DUTRA, Ildefonso Carlos de Azevedo**\n\n\\* const. est. RJ 1891; dep. est. RJ 1891.\n\n*Ildefonso Carlos de Azevedo Dutra* nasceu no Rio Grande do Sul.\n\nFormou-se na Faculdade de Direito de São Paulo em 1888 e, logo depois,\npassou a advogar no estado do Rio de Janeiro. Em abril de 1889 foi\nnomeado procurador público do termo de Petrópolis (RJ), cargo ao qual se\ndedicou por muitos anos. Integrou o Conselho de Intendência de\nPetrópolis, no qual se destacou como chefe político, logo após a\nproclamação da República (15/11/1889).\n\nElegeu-se deputado estadual nas primeiras eleições realizadas após a\nproclamação da República (15/11/1889) para a formação da Assembleia\nConstituinte fluminense. Esse pleito, realizado em 20 de março de 1891,\nfoi vencido pelos partidários do presidente do estado do Rio de Janeiro,\nFrancisco Portela (1889-1891), nomeado pelo presidente da República,\nmarechal Deodoro da Fonseca (1889-1891). Os portelistas derrotaram os\ncandidatos do Partido Republicano, de oposição ao governo, liderados por\nJosé Tomás da Porciúncula.\n\nNa Constituinte estadual, reunida a partir de 10 de maio, Ildefonso\nCarlos de Azevedo Dutra e os demais deputados promulgaram a primeira\nConstituição republicana fluminense e elegeram Portela presidente\nconstitucional. As sessões ordinárias desse ano se encerraram em\nnovembro, mesmo mês em que Deodoro da Fonseca renunciou ao governo da\nRepública, transferindo-o ao vice-presidente Floriano Peixoto. Diante\ndesse conturbado contexto político, no dia 10 de dezembro, Portela\nrenunciou à presidência do estado do Rio de Janeiro por não ter mais o\napoio do poder federal. Seu sucessor, Carlos Baltasar da Silveira\n(1891-1892), revogou a Constituição republicana fluminense, fechou o\nCongresso estadual e convocou uma nova Assembleia Constituinte. Diante\ndisso, Ildefonso Carlos de Azevedo Dutra perdeu o mandato.\n\n*Samuel Silva Rodrigues de Oliveira*\n\nFONTES: CÂM. MUN. PETRÓPOLIS. Ata da 5^a^ sessão ordinária (12/4/1889).\nDisponível em: \\<www.cmp.rj.gov.br/atasimperio/1163-1303.htm\\>. Acesso\nem: 2/8/2010; *Diário Oficial da União* (10/7/1918). Disponível em:\n\\<www.jusbrasil.com.br/diarios/1870542/dou-secao-1-10-07-1918-pg-17\\>.\nAcesso em: 2/8/2010; FERREIRA, M. *República*; FRANCO, S. *Gaúchos*;\nINST. HIST. PETRÓPOLIS. *Não são de hoje os crimes ambientais em\nPetrópolis*. Disponível em:\n\\<www.ihp.org.br/colecoes/lib\\_ihp/docs/fjrv20010325t.htm\\>. Acesso em:\n2/8/2010.\n","ref":"FONTES: CÂM. MUN. PETRÓPOLIS. Ata da 5^a^ sessão ordinária (12/4/1889).\nDisponível em: \\<www.cmp.rj.gov.br/atasimperio/1163-1303.htm\\>. Acesso\nem: 2/8/2010; *Diário Oficial da União* (10/7/1918). Disponível em:\n\\<www.jusbrasil.com.br/diarios/1870542/dou-secao-1-10-07-1918-pg-17\\>.\nAcesso em: 2/8/2010; FERREIRA, M. *República*; FRANCO, S. *Gaúchos*;\nINST. HIST. PETRÓPOLIS. *Não são de hoje os crimes ambientais em\nPetrópolis*. Disponível em:\n\\<www.ihp.org.br/colecoes/lib\\_ihp/docs/fjrv20010325t.htm\\>. Acesso em:\n2/8/2010.\n","dic":"DPRRJ"}
