{"title":"EARP, Artur de Sá","cargoss":["Deputado Estadual"],"cargos_esp":[0],"datas_ini":[1895],"datas_fim":[1903],"estados":["RJ"],"autor":["Juliana Gagliardi","Adrianna Setemy"],"content":"**EARP, Artur de Sá**\n\n\\* dep. est. RJ 1895-1903.\n\n*Artur de Sá Earp* nasceu em Salvador, capital da então província da\nBahia, no dia 11 de julho de 1860.\n\nFormou-se pela Faculdade de Medicina do Rio de Janeiro em 1882. Viveu um\nperíodo em Minas Gerais, onde exerceu a profissão na cidade de\nLeopoldina, e depois se transferiu para o estado do Rio de Janeiro,\npassando a residir em Sapucaia, onde foi vereador. Nesse período foi um\ndefensor do abolicionismo.\n\nEm janeiro de 1895 participou da convenção do Partido Republicano\nFluminense (PRF) como delegado de Sapucaia, e nela propôs que José Tomás\nda Porciúncula, ex-presidente do estado do Rio (1892-1894), então\ndeputado federal e líder máximo do PRF, fosse substituído na liderança\ndo partido, durante sua permanência no exterior como ministro\nplenipotenciário na Argentina, por uma comissão eleita durante a\nconvenção integrada por 15 membros, três de cada um dos cinco distritos\neleitorais. A proposta foi aceita, o que garantiu certa estabilidade ao\nPRF, na medida em que o grande número de membros reduzia possíveis\ndesagregações dentro do partido.\n\nEm 20 de maio de 1895 elegeu-se deputado estadual na legenda do PRF e em\n26 de dezembro de 1897 foi reeleito. Durante a legislatura, o PRF sofreu\numa cisão devido às divergências entre Alberto Torres, novo presidente\nestadual (1897-1900), e José Tomás da Porciúncula, agora senador\n(1897-1901). Alberto Torres rebelou-se contra a liderança partidária de\nPorciúncula, que exigia que o Executivo estadual fortalecesse seu\npartido. Na Assembleia Legislativa do Estado do Rio de Janeiro (ALERJ),\nSá Earp foi um dos principais aliados de Alberto Torres. Nesse contexto\nde cisão, em maio de 1899, quatro membros da comissão executiva do PRF\nrenunciaram e em 23 de julho fundaram o Partido Republicano do Rio de\nJaneiro (PRRJ), liderados por Alberto Torres. Sá Earp foi um dos\nsecretários da convenção de fundação do PRRJ, realizada no Teatro\nFluminense, em Petrópolis (RJ). Nesse evento, discursou e apresentou as\nbases políticas do partido.\n\nEm 30 de julho de 1900 foi reeleito deputado estadual, agora pelo PRRJ,\nno primeiro pleito que o partido disputou. Logo que foi eleito,\ntornou-se líder na ALERJ do governo de Quintino Bocaiúva (1900-1903). Em\n1902 foi um dos deputados que integraram o “Grupo de Petrópolis”,\ndefensor da manutenção da capital do estado nessa cidade, para onde se\nhavia mudado no final do século XIX e onde se tornara um líder político.\nEsse grupo foi derrotado pelo grupo liderado por Nilo Peçanha, então\nprincipal nome do PRRJ, que conseguiu a aprovação na ALERJ, em agosto de\n1902, da Lei n^o^ 542, que determinou a volta da capital para Niterói,\nde onde saíra em 1894. Em consequência, Sá Earp perdeu o posto de líder\ndo governo na Assembleia.\n\nEm 1903, ano final da legislatura, participou da reforma da Constituição\nestadual, que determinou, entre outras medidas, o fortalecimento do\nExecutivo a partir da diminuição das atribuições do Legislativo e do\nJudiciário; o aumento do mandato do presidente estadual de três para\nquatro anos; e a redução do número de deputados estaduais de 60 para 45.\nDurante esses trabalhos, criticou diversos artigos apresentados pelo\ngoverno e propôs emendas. Esse posicionamento político se refletiu em\nseu afastamento da corrente liderada por Nilo Peçanha. Consequentemente,\nnão recebeu o apoio do PRRJ e não ingressou na chapa oficial do partido\npara as eleições de janeiro de 1904.\n\nEm 1904, elegeu-se vereador em Petrópolis e presidiu a Câmara Municipal\nnos dois anos seguintes. Foi ainda redator da *Gazeta de Petrópolis*,\ndirigiu *Cidade de Petrópolis*, *Diário da Manhã* e *Tribuna de\nPetrópolis*, fundou a Universidade Católica e a Faculdade de Medicina e\nclinicou no Hospital Santa Teresa, todos em Petrópolis.\n\nFaleceu em Petrópolis no dia 11 de julho de 1919.\n\nCasado com Ana Sá Earp, era pai de Artur de Sá Earp Filho, que também\nfoi vereador em Petrópolis e se casou com Arabela, filha de Hermogêneo\nSilva, também deputado estadual no Rio de Janeiro (1892, 1895-1897 e\n1901-1902).\n\n*Juliana Gagliardi/Adrianna Setemy*\n\nFONTES: ACAD. PETROPOLITANA LET. Disponível em:\n\\<www.apcl.com.br/noticias/coluna\\_arthur.htm\\>. Acesso em: 3/8/2010;\nASSEMB. LEGISL. RJ. Disponível em:\n\\<www.alerj.rj.gov.br/center\\_arq\\_inf\\_legislatura.htm\\>. Acesso em:\n3/8/2010. INF. FAM. Disponível em:\n\\<www.earp.arthur.nom.br/site/earpgkf.htm.\\>. Acesso em: 16/8/2011.\n\\<www.earp.arthur.nom.br/site/earpgkf.htm\\>.\n","ref":"FONTES: ACAD. PETROPOLITANA LET. Disponível em:\n\\<www.apcl.com.br/noticias/coluna\\_arthur.htm\\>. Acesso em: 3/8/2010;\nASSEMB. LEGISL. RJ. Disponível em:\n\\<www.alerj.rj.gov.br/center\\_arq\\_inf\\_legislatura.htm\\>. Acesso em:\n3/8/2010. INF. FAM. Disponível em:\n\\<www.earp.arthur.nom.br/site/earpgkf.htm.\\>. Acesso em: 16/8/2011.\n\\<www.earp.arthur.nom.br/site/earpgkf.htm\\>.\n","dic":"DPRRJ"}
