{"title":"ALVES, Ademar","cargoss":["Deputado Estadual","Constituinte"],"cargos_esp":[0,"est"],"datas_ini":[1987,1989],"datas_fim":[1991,1989],"estados":["RJ","RJ"],"autor":["Sabrina Guerghe"],"content":"**ALVES, Ademar**\n\n\\* dep. est. RJ 1987-1991; const. est. RJ 1989.\n\n*Ademar Alves* nasceu na cidade de Vitória no dia 18 de agosto de 1931 e\nmais tarde transferiu-se para a cidade do Rio de Janeiro.\n\nFiscal de rendas e relações públicas, foi assessor do governador da\nGuanabara Carlos Lacerda (1960-1965). No governo Negrão de Lima\n(1965-1971) foi assessor do diretor-geral do Departamento de Trânsito da\nSecretaria de Segurança Pública do Estado. Foi também assessor da\nDivisão de Emplacamento e, posteriormente, no governo de Floriano Faria\nLima (1975-1979) – o primeiro após a fusão dos antigos estados do Rio de\nJaneiro e da Guanabara –, diretor desse mesmo órgão. Durante o governo\nde Antônio de Pádua Chagas Freitas no estado do Rio de Janeiro\n(1979-1983), foi assessor especial da Secretaria de Estado de Fazenda,\nassessor e diretor da divisão de emplacamento do Detran, assessor do\nsecretário de Segurança Pública, e diretor da circunscrição regional de\ntrânsito de Nova Iguaçu (4^a^ Ciretran).\n\nNas eleições de outubro de 1986, elegeu-se deputado estadual no Rio de\nJaneiro, na legenda do Partido Trabalhista Brasileiro (PTB). Tomou posse\nna Assembleia Legislativa do Estado do Rio de Janeiro (ALERJ) em\nfevereiro de 1987 e passou a ocupar-se dos trabalhos legislativos\nordinários. Com a promulgação da Constituição pela Assembleia Nacional\nConstituinte em outubro de 1988, as assembleias legislativas iniciaram a\nadequação das Cartas estaduais à nova realidade jurídica do país. Em\njaneiro de 1989 passou assim ao exercício dos trabalhos constituintes,\ntendo sido escolhido segundo-secretário da Mesa Diretora. Com a\npromulgação da Constituinte estadual em outubro, voltou aos trabalhos\nordinários. Integrou a comissão parlamentar de inquérito (CPI) que\napurou irregularidades na Secretaria de Estado de Polícia Civil e fez\nviagens de missões culturais ao exterior. Ao longo da legislatura,\ntransferiu-se para o Partido do Movimento Democrático Brasileiro (PMDB).\n\nEm junho de 1990 teve seu nome aprovado pela ALERJ para o preenchimento\ndo cargo de membro do Conselho de Contas dos Municípios do Estado do Rio\nde Janeiro, que seria extinto em 1993 após a emenda da Constituição\nestadual que o criara ser declarada inconstitucional pelo Supremo\nTribunal Federal. Encerrou seu mandato em janeiro de 1991.\n\n*Sabrina Guerghe*\n\nFONTES: ASSEMB. CONST. RJ. (1989). Disponível em:\n\\<www.alerj.rj.gov.br/memoria/cd/assembleia/aconst89.html\\>. Acesso em:\n10/5/2011; ASSEMB. LEGIS. RJ. *Deputados estaduais fluminenses*. Quarta\nlegislatura (1987-1991); ASSEMB. LEGIS. RJ. Discurso Wolney Trindade\n(1/6/1999); ASSEMB. LEGIS. RJ. *Documentos*; Detran-RJ (12/12/2007);\n*Diário Oficial do Estado do Rio de Janeiro* (5/2/1987 e 10/10/1989);\n*Globo* (20/12/2009); Jusbrasil. Disponível em:\n\\<www.jusbrasil.com.br/legislacao/228759/resolucao-589-1990-rio-de-janeiro-rj\\>.\n","ref":"FONTES: ASSEMB. CONST. RJ. (1989). Disponível em:\n\\<www.alerj.rj.gov.br/memoria/cd/assembleia/aconst89.html\\>. Acesso em:\n10/5/2011; ASSEMB. LEGIS. RJ. *Deputados estaduais fluminenses*. Quarta\nlegislatura (1987-1991); ASSEMB. LEGIS. RJ. Discurso Wolney Trindade\n(1/6/1999); ASSEMB. LEGIS. RJ. *Documentos*; Detran-RJ (12/12/2007);\n*Diário Oficial do Estado do Rio de Janeiro* (5/2/1987 e 10/10/1989);\n*Globo* (20/12/2009); Jusbrasil. Disponível em:\n\\<www.jusbrasil.com.br/legislacao/228759/resolucao-589-1990-rio-de-janeiro-rj\\>.\n","dic":"DPRRJ"}
