{"title":"ESTEVES, Julião Freire","cargoss":["Interventor"],"cargos_esp":[0],"datas_ini":[1931],"datas_fim":[1931],"estados":["DF"],"autor":["Luciana P. Fagundes"],"content":"**ESTEVES, Julião Freire**\n\n**\\*** militar; interv. DF 1931.\n\n*Julião Freire Esteves* nasceu no estado do Mato Grosso em 1876.\n\nConcluiu o curso da Escola Militar em 22 de abril de 1899 e formou-se\ntambém bacharel em matemática e ciências físicas em 1903. Nesse mesmo\nano participou da construção do edifício para a direção de saúde do\nExército, e de 1905 a 1907 atuou na Comissão da Estrada Estratégica de\nPorto União de Vitória a Palmas, no estado do Paraná. Serviu no Estado\nMaior do Exército em 1907, e de 1918 a 1920, quando organizou um\nregulamento de organização dos serviços do Exército, em colaboração com\no coronel Lelong, da Missão Militar Francesa. Participou das manobras\nmilitares realizadas em 1920 no vale do Paraíba, e fez o curso de\nintendência em 1921. Chefiou o serviço de intendência em várias regiões\ndo Brasil: em 1923, na região de Pirassununga; em 1925, na região de Rio\nClaro; e, em 1926, em Juiz de Fora. Foi professor de administração e\ntática dos abastecimentos na Escola de Estado Maior, de 1914 a 1916.\n\nNo movimento de 1930, liderou um contingente de alunos da Escola de\nIntendência, na manhã de 24 de outubro. Com a vitória da revolução, foi\nindicado diretor de Obras da cidade do Rio de Janeiro, então capital\nfederal, que passou a ser governada pelo interventor Adolfo Bergamini.\nQuando este deixou o posto, em 24 de setembro de 1931, substituiu-o\ninterinamente. Em seu discurso de posse, procurou ressaltar que não era\npropriamente um interventor, e que sua permanência na prefeitura seria\ncurta, determinada pela duração dos trabalhos da comissão de sindicância\nque investigava a gestão do antecessor. Enquanto permaneceu no posto,\nrealizou algumas nomeações, pois teve que substituir funcionários que\nsaíram com o Adolfo Bergamini. Assim, nomeou novos auxiliares de\ngabinete, substituiu o diretor de Fazenda, Francisco d’Auria, por Manuel\nMirando, nomeou José Furtado Beleza diretor geral de Assistência\nMunicipal, e Artur Maggioli diretor geral de Instrução Pública. Assinou\ntambém um decreto modificando os vencimentos do funcionalismo municipal.\nPermaneceu na função até a nomeação de Pedro Ernesto, em 1^o^ de outubro\nde 1931.\n\nFaleceu em 1935, na cidade do Rio de Janeiro.\n\n*Luciana P. Fagundes*\n\nFONTES: *Correio da Manhã* (set./out. 1931); REIS, J. *Prefeitos*.\n","ref":"FONTES: *Correio da Manhã* (set./out. 1931); REIS, J. *Prefeitos*.\n","dic":"DPRRJ"}
