{"title":"FAÍSCA, Domingos Manhães","cargoss":["Deputado Estadual"],"cargos_esp":[0],"datas_ini":[1895],"datas_fim":[1897],"estados":["RJ"],"autor":[0],"content":"**FAÍSCA, Domingos Manhães**\n\n\\* militar; dep. est. RJ 1895-1897.\n\n*Domingos Manhães Faísca* foi major da Guarda Nacional e chefe político\ndo município de São João da Barra.\n\nDurante o Império, monarquistas conservadores formaram maioria e partido\nhegemônico no estado do Rio de Janeiro. Após a Abolição da escravatura e\na Proclamação tiveram essa hegemonia abalada, mas permaneceram fortes,\ncom a liderança de Conselheiro Paulino, fazendo alianças com o\nrepublicanismo em ascensão.\n\nDomingos Manhães Faísca candidatou-se a deputado estadual pelo segundo\ndistrito, com sede em Campos, nas eleições realizadas em 1894, filiado\nao Partido Republicano Fluminense (PRF). O partido congregava a\noligarquia fluminense, unindo lideranças monarquistas e republicanas; o\nPRF ascendeu ao poder com a queda do interventor Francisco Portella\n(1890-1891).\n\nO pleito de 1894 foi vencido pelo PRF. Para o governo foi eleito\nMaurício de Abreu e para o Legislativo estadual a chapa do partido foi\nvitoriosa, uma vez que a oposição não apresentou candidatos, optou por\npraticar a abstenção total. Domigos Manhães Faísca foi eleito e\ndiplomado para a legislatura estadual de 1895 a 1897.\n\nNo contexto político que se abria com a ascensão da oligarquia paulista\nao governo nacional, com a eleição de Prudente de Morais e a hegemonia\ndo Partido Republicano Federal, os republicanos fluminenses alinharam-se\nao governo federal, sem perder sua identidade e autonomia política.\n\nApós esta legislatura não mais se elegeu deputado estadual.\n\n*Samuel Silva Rodrigues de Oliveira*\n\nFONTES: ASSEMB. LEGISL. RJ. *Anais*(1895, 1897); FERREIRA, M.\n*República*.\n","ref":"FONTES: ASSEMB. LEGISL. RJ. *Anais*(1895, 1897); FERREIRA, M.\n*República*.\n","dic":"DPRRJ"}
