{"title":"FARIA, Gustavo de","cargoss":["Deputado federal","Constituinte"],"cargos_esp":[0,0],"datas_ini":[1983,1987],"datas_fim":[1990,1988],"estados":["RJ",0],"autor":["Lorenzo Aldé"],"content":"**FARIA, Gustavo de**\n\n\\* militar; dep. fed. RJ 1983-1990; const. 1987-1988.\n\n*Paulo Gustavo Coutinho de Faria* nasceu no Rio de Janeiro, então\nDistrito Federal, no dia 15 de fevereiro de 1937, filho de Gustavo de\nFaria e de Isabel Maria Dale de Faria. Seu pai foi general e seu tio\nmaterno, general Vicente de Paulo Dale Coutinho, foi ministro do\nExército no governo Ernesto Geisel (1974-1979).\n\nGustavo de Faria foi aluno da High School Joan Darc, em Nova Iorque, e\ndo Colégio Militar do Rio de Janeiro. Fez o curso de formação de\noficiais do Exército na Academia Militar das Agulhas Negras (AMAN), em\nResende (RJ), e de especialização na Escola de Educação Física do\nExército. Foi promovido a segundo-tenente em agosto de 1958, a\nprimeiro-tenente em agosto de 1961 e a capitão em dezembro de 1965.\n\nAliado político do general Afonso Augusto de Albuquerque Lima – ministro\ndo Interior no governo do general Artur da Costa e Silva (1967-1969),\nque se demitiu do cargo em janeiro de 1969 por desavenças com a equipe\neconômica –, foi compulsoriamente transferido para a reserva em julho do\nmesmo ano. A punição decorreu do Ato Institucional n^o^ 10, de\n16/5/1969, que atingiu cerca de quinhentas pessoas, entre políticos,\nprofessores, jornalistas, diplomatas, médicos, advogados e militares,\ncom a cassação de mandatos e suspensão de direitos políticos,\naposentadorias compulsórias e afastamento das forças armadas. Na vida\ncivil, fundou a Editora Guavira, tornando-se seu diretor-presidente.\nMais tarde, bacharelou-se em ciências jurídicas e sociais pela Faculdade\nde Direito da Universidade do Rio de Janeiro (UFRJ). Em agosto de 1979,\nbeneficiado pela Lei da Anistia, foi promovido a coronel, sem retornar à\nativa.\n\nVinculado à corrente política liderada pelo então governador do estado\ndo Rio de Janeiro, Antônio de Pádua Chagas Freitas (1979-1983), no\npleito de novembro de 1982 candidatou-se a uma cadeira na Câmara dos\nDeputados pelo Rio de Janeiro na legenda do Partido do Movimento\nDemocrático Brasileiro (PMDB) e foi eleito. Iniciou o mandato em\nfevereiro do ano seguinte e foi escolhido membro titular da Comissão de\nEconomia, Indústria e Comércio e suplente da Comissão de Relações\nExteriores da Câmara. Em 25 de abril de 1984, votou a favor da emenda\nDante de Oliveira, que previa a realização de eleições diretas para a\npresidência da República em novembro daquele ano, mas que, por\ninsuficiência de votos, não foi levada à apreciação do Senado. Em\nagosto, contrário ao projeto da Lei de Informática apresentado ao\nCongresso pelo governo e sujeito à aprovação por decurso de prazo,\nafirmou que a proposta, em vez de estabelecer uma reserva de mercado\nfavorável à indústria nacional, pretendia eternizar o poder do Serviço\nNacional de Informações (SNI), órgão criado pelo regime militar. O texto\ndo projeto previa a criação de uma comissão nacional de informática,\ndeixando todas as decisões a cargo da Secretaria Especial de Informática\n(SEI), controlada por militares egressos dos serviços de informações e\nsubordinada ao Conselho de Segurança Nacional. O projeto foi afinal\naprovado em outubro de 1984 graças a um acordo de lideranças que\nassegurou a incorporação de duas emendas do Partido dos Trabalhadores\n(PT), relativas à privacidade do cidadão e à garantia de emprego pela\nadoção de novas tecnologias de automação.\n\nNo Colégio Eleitoral reunido em 15 de janeiro de 1985, votou no\ncandidato oposicionista Tancredo Neves, da Aliança Democrática, união do\nPMDB com a dissidência do Partido Democrático Social (PDS) abrigada na\nFrente Liberal. Tancredo foi eleito, mas, doente, não chegou a ser\nempossado, vindo a falecer em 21 de abril de 1985. Seu substituto foi o\nvice José Sarney, que já vinha exercendo o cargo interinamente desde 15\nde março.\n\nNo pleito de novembro de 1986, aliado à corrente do PMDB liderada pelo\nsenador Nélson Carneiro, foi eleito deputado federal constituinte pelo\nRio de Janeiro. Empossado em fevereiro do ano seguinte, em maio de 1987\nassumiu a presidência do Instituto de Previdência dos Congressistas\n(IPC). Na Constituinte, foi membro titular da Subcomissão de Princípios\nGerais, Intervenção do Estado, Regime da Propriedade do Subsolo e da\nAtividade Econômica, da Comissão da Ordem Econômica, e suplente da\nSubcomissão do Poder Judiciário e do Ministério Público, da Comissão da\nOrganização dos Poderes e Sistema de Governo. Votou a favor do\nrompimento de relações diplomáticas com países que praticassem políticas\nde discriminação racial, da pena de morte, da manutenção do sistema\npresidencialista, da adoção do voto facultativo aos 16 anos, do aviso\nprévio proporcional, da unicidade sindical, da nacionalização do\nsubsolo, da anistia aos micro e pequenos empresários, da legalização do\njogo do bicho e do mandato de cinco anos para o então presidente Sarney.\nFoi contra a limitação do direito de propriedade, a descriminalização do\naborto, a proibição do comércio de sangue, a remuneração 50% superior\npara o trabalho extra, a jornada semanal de 40 horas, a manutenção da\nestabilidade de emprego, a limitação dos encargos da dívida externa e a\ncriação de um fundo de apoio à reforma agrária.\n\nEm março de 1989 foi substituído pelo deputado Rui Bacelar na\npresidência do IPC. Um mês depois a imprensa acusou-o de ter adquirido\nsem autorização do conselho deliberativo da entidade, em dezembro de\n1988, debêntures da empresa Rural e Colonização S.A. no valor aproximado\nde dez milhões de dólares. Auditoria instaurada pelo próprio IPC indicou\noutras operações suspeitas. Em agosto de 1988 o então presidente vendera\ntítulos da dívida agrária (TDAs) para comprar obrigações da Eletrobrás\npor um preço 475% acima da cotação de mercado. Posteriormente, e apenas\numa semana antes de deixar o cargo, voltara a comprar as TDAs com ágio\nsuperior a 40%. Chamado a depor, Faria argumentou que sua gestão fora\nlucrativa, mas mesmo assim o relatório final da auditoria o considerou\nculpado de fraude, e o caso passou à alçada da Polícia Federal.\n\nEm 28 de junho de 1989 Gustavo de Faria desligou-se do PMDB, cuja\nexecutiva nacional já se decidira por sua expulsão. No dia 3 de abril de\n1990, a Comissão de Constituição e Justiça (CCJ) da Câmara aprovou por\nunanimidade a cassação de seu mandato. A questão, contudo, não chegou a\nser votada em plenário, pois o deputado renunciou, sob a alegação de que\nnão tivera a oportunidade de se defender, nem de ter as contas do IPC\npericiadas por auditores isentos. Substituído pelo suplente Ernâni\nBoldrim, também do PMDB, publicou o livro intitulado *Eu acuso – ou a\nfarsa do IPC*, no qual contestava todas as acusações, além de apresentar\nresultados de auditorias que o inocentavam.\n\nEm agosto de 1990 o Tribunal Regional Eleitoral (TRE) do Rio de Janeiro\naceitou o registro de sua candidatura a deputado federal no pleito de\noutubro, na legenda do Partido Trabalhista Brasileiro (PTB). Obteve\nentão uma suplência. Afastado da carreira política, continuou a\ntrabalhar em sua editora. No intuito de provar sua inocência, contratou\nadvogado e moveu processos contra os que o haviam acusado, além de\ndefender-se dos que foram movidos contra ele. Contudo, em março de 1993\nfoi condenado a devolver 3,2 bilhões de cruzeiros aos cofres do IPC. Em\nagosto, por decisão unânime do Superior Tribunal Federal (STF),\ntornou-se réu de ação penal na qual era acusado de desvio de verbas e de\ncrime de apropriação indébita. A denúncia foi formulada pelo procurador\ngeral da República Aristides Junqueira.\n\nAlém do livro citado, Gustavo de Faria publicou, entre outros, *Filiação\npartidária*; *Soletre Mobral e leia Brasil*; *Amazônia é novo Brasil*;\n*Alagoas – o grande avanço*; *Maceió – modelo urbanístico do Nordeste*;\n*Mato Grosso – do garimpo ao computador*.\n\nFoi casado com Djane Bouças de Faria, com quem teve três filhos. O tio\nde sua ex-esposa, Valentim Bouças, foi um dos maiores empresários\nbrasileiros nas décadas de 1930, 1940 e 1950, fundador da revista *O\nObservador Econômico e Financeiro*, representante da IBM no Brasil,\ndiretor-consultivo da Coca-Cola e presidente da Panair, entre outras\nocupações.\n\nLorenzo Aldé\n\nFONTES: *Almanaque* *Exérc.* (1969); ASSEMB. NAC. CONST. *Repertório*\n(1987-1988); CÂM. DEP. *Deputados brasileiros*. Repertório (1983-1987);\nCOELHO, J.; OLIVEIRA, A. *Nova*; ENTREV. BIOG.; *Estado de S. Paulo*\n(31/8, 4/10/1984, 5/4/1990, 5/9/1991); *Folha de S.Paulo* (19/1/1987,\n28, 30/4, 5, 12/5, 11/7/1989); *Globo* (26/4, 31/8/1984, 16/1/1985,\n10/4/1987, 10/5, 9/6, 29/6/1989, 4/4, 16/8/1990, 20/8/1993); *Jornal do\nBrasil* (26/2/1988, 4/4, 9/8/1990, 30/3/1993); *Veja* (12/9/1984).\n","ref":"FONTES: *Almanaque* *Exérc.* (1969); ASSEMB. NAC. CONST. *Repertório*\n(1987-1988); CÂM. DEP. *Deputados brasileiros*. Repertório (1983-1987);\nCOELHO, J.; OLIVEIRA, A. *Nova*; ENTREV. BIOG.; *Estado de S. Paulo*\n(31/8, 4/10/1984, 5/4/1990, 5/9/1991); *Folha de S.Paulo* (19/1/1987,\n28, 30/4, 5, 12/5, 11/7/1989); *Globo* (26/4, 31/8/1984, 16/1/1985,\n10/4/1987, 10/5, 9/6, 29/6/1989, 4/4, 16/8/1990, 20/8/1993); *Jornal do\nBrasil* (26/2/1988, 4/4, 9/8/1990, 30/3/1993); *Veja* (12/9/1984).\n","dic":"DPRRJ"}
