{"title":"FAYAL, Carlos","cargoss":["Deputado Estadual"],"cargos_esp":[0],"datas_ini":[1983],"datas_fim":[1987],"estados":["RJ"],"autor":["Isadora Tavares Maleval"],"content":"**FAYAL, Carlos**\n\n\\* dep. est. RJ 1983-1987.\n\n*Carlos Eduardo Fayal de Lyra* nasceu no Rio de Janeiro no dia 10 de\njulho de 1948, filho de Charley Fayal de Lyra.\n\nIngressou na Faculdade Nacional de Odontologia em 1969, mas só concluiu\no curso de odontologia na Universidade do Estado do Rio de Janeiro\n(UERJ) em 1981, após o período do regime militar no Brasil, quando viveu\nexilado em vários países da América e da Europa. Trabalhou como\ncirugião-dentista.\n\nFoi membro-fundador do Partido Democrático Trabalhista (PDT), do qual\nfoi membro do diretório zonal (5^a^ Zona Eleitoral – Rio de Janeiro).\nFiliou-se, posteriormente, ao Partido Socialista Brasileiro (PSB).\n\nElegeu-se deputado estadual na legenda do PDT em 1982. Nesta\nlegislatura, que teve início em 1983, atuou como presidente da Comissão\nde Saúde e participou da elaboração do programa de saúde médico\nodontológica dos Centros Integrados de Educação Pública (CIEPs). Devido\nà sua área de atuação profissional, buscou diante da Assembleia\nLegislativa do Estado do Rio de Janeiro (ALERJ) o incentivo aos centros\nde pesquisas odontológicos e a luta por melhores condições salariais e\nde trabalho para os dentistas.\n\nFoi também membro efetivo das comissões de Obras Públicas, de Controle\ndo Meio Ambiente e de Turismo e Desportos. Foi suplente da Comissão de\nAssuntos Municipais. Atuou como membro da Comissão de Inquérito\nParlamentar (CPI), que visava esclarecer a distribuição de gás da bacia\nde Campos.\n\nFoi também relator da CPI para investigar o regime carcerário e\npenitenciário do estado do Rio de Janeiro, em 1983, além de membro da\nEmenda Constitucional (EC) que tinha como intuito apurar denúncias\nfeitas sobre a construção de uma estrada em Cachoeiras de Macacu, no\nmesmo ano.\n\nRetornou à vida política em 2010, quando disputou as eleições para\ndeputado estadual na legenda do PSB, sem obter êxito.\n\n*Isadora Tavares Maleval*\n\nFONTES: ASSEMB, LEGISL. RJ. *Deputados estaduais fluminenses*. Terceira\nlegislatura (1983-1987); *Globo*. Disponível em:\n\\<http://oglobo.globo.com/pais/eleicoes2010/mat/2010/09/28/conheca-os-perfis-dos-candidatos-chico-angelo-pt-carlos-fayal-psb-922651893.asp\\>.\nAcesso em: 4/10/2010; Notícias R7. Disponível em:\n\\<http://noticias.r7.com/eleicoes-2010/mapa-de-candidatos/candidatos/integra/candidato/190000000744.html\\>.\nAcesso em: 4/10/2010; Página pessoal. Disponível em:\n\\<http://carlosfayal40111.blogspot.com/\\>. Acesso em: 4/10/2010;\n\\<http://carlosfayal40111.blogspot.com/2010/07/carta-aos-dentistas-do-estado-do-rio-de.html\\>.\nAcesso em: 4/10/2010; Uol notícias. Disponível em:\n\\<http://noticias.uol.com.br/politica/politicos-brasil/2010/deputado-estadual/10071948-carlos-fayal.jhtm\\#resultado\\>.\nAcesso em: 4/10/2010.\n","ref":"FONTES: ASSEMB, LEGISL. RJ. *Deputados estaduais fluminenses*. Terceira\nlegislatura (1983-1987); *Globo*. Disponível em:\n\\<http://oglobo.globo.com/pais/eleicoes2010/mat/2010/09/28/conheca-os-perfis-dos-candidatos-chico-angelo-pt-carlos-fayal-psb-922651893.asp\\>.\nAcesso em: 4/10/2010; Notícias R7. Disponível em:\n\\<http://noticias.r7.com/eleicoes-2010/mapa-de-candidatos/candidatos/integra/candidato/190000000744.html\\>.\nAcesso em: 4/10/2010; Página pessoal. Disponível em:\n\\<http://carlosfayal40111.blogspot.com/\\>. Acesso em: 4/10/2010;\n\\<http://carlosfayal40111.blogspot.com/2010/07/carta-aos-dentistas-do-estado-do-rio-de.html\\>.\nAcesso em: 4/10/2010; Uol notícias. Disponível em:\n\\<http://noticias.uol.com.br/politica/politicos-brasil/2010/deputado-estadual/10071948-carlos-fayal.jhtm\\#resultado\\>.\nAcesso em: 4/10/2010.\n","dic":"DPRRJ"}
