{"title":"FERNANDES, Salvador","cargoss":["Deputado Estadual"],"cargos_esp":[0],"datas_ini":[1983],"datas_fim":[1987],"estados":["RJ"],"autor":["Luciana Pinheiro"],"content":"**FERNANDES, Salvador**\n\n\\* dep. est. RJ 1983-1987.\n\n*Salvador Fernandes de Oliveira* nasceu em Itanhomi (MG) no dia 18 de\njulho de 1932.\n\nAdvogado, economista e contador, fez mestrado em direito penal. Cursou\nextensão universitária em psicologia profunda e gemologia, além de\ntambém ter realizado cursos de relações humanas nas áreas de pedagogia e\nliderologia.\n\nNo que diz respeito à sua vida pública, no pleito eleitoral realizado em\nnovembro de 1982 candidatou-se ao cargo de deputado estadual fluminense\npela legenda do Partido Democrático Trabalhista (PDT) e obteve 24.135\nvotos, sendo eleito. Em fevereiro de 1983 tomou posse de sua cadeira na\nAssembleia Legislativa do Estado do Rio de Janeiro (ALERJ). Nesse mesmo\nano apresentou projeto de lei (PL), publicado no mês de setembro, que\nautorizava a prorrogação do pagamento dos créditos dos quais eram\ntitulares as empresas públicas do estado do Rio de Janeiro e decorrentes\ndo fornecimento de águas e gás.\n\nDurante seu mandato legislativo decorrido até janeiro de 1987 exerceu a\nfunção de vice-líder da bancada do PDT na ALERJ, foi presidente da\ncomissão de Trabalho e Legislação Social e da comissão de Emendas\nConstitucionais e Vetos e integrou a Comissão Parlamentar de Inquérito\n(CPI) criada na Assembleia fluminense para apurar as condições de\nfuncionamento das empresas mistas do estado do Rio de Janeiro.\n\n*Luciana Pinheiro*\n\nFONTES: ASSEMB. LEGISL. RJ. *Deputados estaduais fluminenses*. Terceira\nlegislatura (1983-1987); ASSEMB. LEGISL. RJ. Disponível em:\n\\<www.alerj.rj.gov.br/\\>. Acesso em: 2/1/2011.\n","ref":"FONTES: ASSEMB. LEGISL. RJ. *Deputados estaduais fluminenses*. Terceira\nlegislatura (1983-1987); ASSEMB. LEGISL. RJ. Disponível em:\n\\<www.alerj.rj.gov.br/\\>. Acesso em: 2/1/2011.\n","dic":"DPRRJ"}
