{"title":"FIGORELLE, José","cargoss":["Deputado Estadual"],"cargos_esp":[0],"datas_ini":[1987],"datas_fim":[1991],"estados":["RJ"],"autor":["Renata Moreira"],"content":"**FIGORELLE, José**\n\n\\* dep. est. RJ 1987-1991.\n\n*José Neri Figorelle* nasceu em 6 de fevereiro de 1965 na cidade de\nBarra do Piraí, no Rio de Janeiro.\n\nConcluiu seus estudos no Colégio Medianeira em sua cidade natal e cursou\nComunicação Social na Sociedade Barramense de Ensino Superior (SOBEU) em\nBarra Mansa. Destaca-se até os dias atuais como empresário. Seu pai foi\nprefeito da cidade de Barra do Piraí em 1982.\n\nNo pleito de 15 de novembro de 1986 elegeu-se deputado estadual no Rio\nde Janeiro pelo Partido do Movimento Democrático Brasileiro (PMDB) com\n19.456 votos. Tomou posse na Assembleia Legislativa do Estado do Rio de\nJaneiro (ALERJ) em 1^o^ de fevereiro de 1987.\n\nComo presidente da Comissão de Redação, Indicações Legislativas e\nProposições Externas, apreciou juntamente com os outros deputados a\ncriação do Departamento de Estradas e Rodagens (DETRO) e participou de\ndiversas indicações geralmente atreladas a sua cidade natal, entre as\nquais: solicitou a pavimentação asfaltica para a Rodovia Estadual\nRJ-141, do trecho iniciado na Rodovia Federal BR-393 até Vargem Alegre;\npediu ao secretário de Educação medidas urgentes para a criação de um\ncolégio em Mendes e requisitou ao secretário de Estado de Polícia\nMilitar (PM) o envio de uma viatura para patrulhar as cercanias.\n\nEm 17 de outubro de 1987 discursou congratulando os moradores de Barra\ndo Piraí pelo transcurso da sua data máxima. É autor da Lei n^o^\n1.542/1989, na qual mudou o nome do Centro Integrado de Educação Pública\n(CIEP) construído no Município de Mendes que passou a se chamar CIEP\nHenrique da Costa Nery; da Lei n^o^ 1.217/1989 pela qual a Escola\nEstadual Praça da Ponte passou a ser denominada Escola Estadual\nGovernador Miguel Couto e da Lei n^o^ 1.205/1987, que considerou de\nutilidade pública a Associação de Pais e Alunos Excepcionais (APAE) de\nBarra do Piraí. Por meio da Lei n^o^ 1.744, de 13 de novembro de 1990,\nconsiderou de utilidade pública o grupo de apoio à prevenção da AIDS-RJ\n(GAPA), com sede no foro na cidade do Rio de Janeiro. A Lei n^o^ 1.561\nde 9 de novembro de 1989, também de sua autoria, tornou obrigatório o\nuso de sacos ou recipientes coletores de lixo ao lado de barracas,\nestantes ou carroças, para recolhimento de materiais descartados,\nprovenientes de comercialização, visava a atender a preocupação com a\ninsalubridade nas ruas devido ao comércio não regulamentado de comidas.\nNo que tange também a saúde interferiu, com a Lei n^o^ 1.562/1989, no\nregime de plantão de farmácias e drogarias, criando normas sobre como\ndeveria ser feita a segurança e o direito das farmácias e seus usuários\npara os horários de plantão.\n\n            Participou da elaboração da Constituição do Estado do Rio de\nJaneiro e do ato das disposições constitucionais transitórias. Foi\nmembro efetivo da Comissão de Obras Públicas e suplente na Comissão de\nEducação, além de ter sido vice-presidente da Comissão Especial (CE)\n“Para Apurar as Causas da Poluição do Rio Paraibuna”.\n\n*Renata Moreira*\n\nFONTES: ASSEMB. LEGISL. RJ. *Deputados estaduais fluminenses*. Quarta\nlegislatura (1987-1991); ASSEMB. LEGISL. RJ. *Informações*; *Diário\nOficial RJ* (ano XIII, n. 21, 3/2/1987, parte III, ano XIII, n. 211,\n4/2/1987, parte II, ano XIII, n. 214, 9/11/1987).\n","ref":"FONTES: ASSEMB. LEGISL. RJ. *Deputados estaduais fluminenses*. Quarta\nlegislatura (1987-1991); ASSEMB. LEGISL. RJ. *Informações*; *Diário\nOficial RJ* (ano XIII, n. 21, 3/2/1987, parte III, ano XIII, n. 211,\n4/2/1987, parte II, ano XIII, n. 214, 9/11/1987).\n","dic":"DPRRJ"}
