{"title":"FIORAVANTE, Antônio","cargoss":["Deputado Estadual"],"cargos_esp":["GB"],"datas_ini":[1963],"datas_fim":[1971],"estados":[0],"autor":[0],"content":"**FIORAVANTE, Antônio**\n\n\\* dep. est. GB 1963-1971.\n\n*Antônio Fioravante Fraga* nasceu na Calábria, região do sul da Itália,\nno dia 17 de abril de 1914, filho de Ângelo Frega e Tereza Belizzi\nFrega. Ainda bebê, veio para o Brasil numa das sete viagens que a\nfamília fez ao país com o propósito de trabalhar, juntar dinheiro e\nretornar ao país natal em melhores condições financeiras. Teria sido\nregistrado no dia 9 de maio de 1914, data que consta como a de seu\naniversário em seus registros oficiais. O nome da família Frega foi\nadaptado para o português Fraga por iniciativa do pai, Ângelo, que\ntrabalhava como sapateiro e era anarquista. Fioravante Fraga começou a\ntrabalhar como aprendiz, na oficina do pai; na escola, concluiu o curso\nsecundário. Foi Inspetor de Alunos do Ministério da Justiça e Negócios\nInteriores até ser exonerado do cargo, em 1940. Entrou para a Polícia\nCivil do Distrito Federal em 1941 no cargo de investigador. Desde 1960\natuava também como jornalista policial no jornal *Última Hora*, do qual\nhavia sido um dos fundadores. Também trabalhou no jornal *Correio da\nManhã*. Foi presidente da Associação dos Detetives.\n\nConcorreu às eleições de outubro de 1962 para o Legislativo do estado da\nGuanabara pela legenda do Partido Rural Trabalhista (PRT) e conseguiu\n3.599 votos, o suficiente para ser o primeiro suplente do partido. Sua\ncandidatura havia sido articulada pelo Movimento Renovador da Classe\nPolicial, fundado em 1962. Em 26 de maio de 1964 foi convocado a assumir\na vaga do deputado Manoel Novela, falecido. Naquele ano integrou a\nComissão de Administração e Redação. Sua atuação parlamentar foi marcada\npela defesa de interesses corporativos como modificações na legislação\nsobre a atividade policial, concessões de pensões às viúvas de policiais\nmortos em serviço e pedidos por recursos e melhorias nas condições de\ntrabalho da corporação. Nessa época tiveram grande repercussão os\nassassinatos de dois famosos detetives do estado, Milton Le Cocq e\nPerpétuo de Freitas. Fioravante Fraga declarou-se “identificado\nideologicamente” com o governador Carlos Lacerda e um inimigo da\ncorrupção e do comunismo. Em junho de 1964 criou projeto de lei que,\naprovado, instituiu o dia 29 de setembro como Dia do Policial no estado\nda Guanabara.\n\nEm 1965 tornou-se vice-líder do Bloco Parlamentar de Resistência\nDemocrática, formado por deputados de vários partidos de governo e\noposição logo após o golpe militar de abril de 1964. Passou a criticar a\natuação do governo Lacerda quanto à segurança pública, ameaçando até\npassar para a oposição em virtude de um veto dado pelo governador ao\nprojeto de vantagens pecuniárias para a Polícia Civil, no final do ano\nanterior. Nessa legislatura também integrou a Comissão de Orçamento e\nFinanças e as Comissões Parlamentares de Inquérito sobre as condições de\nabrigo e tratamento de presos no estado e sobre a compra, instalação,\nfuncionamento e venda de energia elétrica dos geradores do estado. Em\nsetembro de 1965 anunciou apoio à candidatura de Negrão de Lima para o\ngoverno do estado após indignar-se com declarações dadas por Carlos\nLacerda, que disse que compraria votos e consciências de deputados para\nformar maioria absoluta na Assembleia, caso seu candidato a governador\nvencesse; para tomar tal decisão, Fioravante Fraga disse ter obedecido\n“ao impulso do sentimento getulista e trabalhista” que marcava sua\nformação política.\n\nEm decorrência da reorganização do sistema partidário nacional,\npromovida pelo Ato Institucional n^o^ 2 de outubro de 1965,\ntransferiu-se para o Movimento Democrático Brasileiro, o partido da\noposição ao governo. Mesmo assim, demonstrava apoio ao governo militar,\nem especial no que se referia ao combate à subversão. Na sessão\nlegislativa de 1966 tornou-se presidente da Comissão de Administração e\nRedação e participou, como suplente, da CPI sobre denúncias de\nexploração e contravenção do jogo do bicho. A respeito desse jogo, em\ncuja repressão se esforçava a polícia da Guanabara, disse ser favorável\nà sua regulamentação, como “tradição da família brasileira” que era. Em\nsua opinião, a situação de carência pela qual passava a segurança\npública do estado naquela época se devia à atenção demasiada dada pela\npolícia à ação repressiva contra os bicheiros, pois “se a polícia\ndedicar sua atividade ao combate do jogo do bicho, seriamente se\ndividirá no combate ao crime, que é a sua função primordial”.\n\nConseguiu eleger-se deputado estadual da Guanabara no pleito de 1966\npela legenda do Movimento Democrático Brasileiro (MDB). Recebeu 6.489\nvotos. No novo mandato, iniciado em janeiro de 1967, chegou a quinto\nsuplente da Mesa Diretora. Foi também membro da Comissão de Constituição\ne Justiça e da CPI que investigou denúncias feitas pelo ex-secretário de\nSegurança Pública, general Jaime Graça. Durante o processo de adaptação\nda Constituição estadual à Constituição federal outorgada em março\ndaquele ano, apresentou emendas visando à criação do Conselho Superior\nde Polícia, com um Tribunal de Ética a ele vinculado, cuja finalidade\nseria examinar as irregularidades cometidas por policiais; propôs também\na criação da Escola de Polícia, a ser cursada pelo policial antes de\ningressar na carreira.\n\nNa sessão legislativa de 1968 foi membro da Comissão de Economia, Viação\ne Obras Públicas e da CPI sobre irregularidades na reforma de oficiais e\npraças da Polícia Militar. Apesar de elogiar o governo Negrão de Lima\npelas mudanças efetuadas na Força Policial da Guanabara e pelo\nreestabelecimento das carreiras de detetive e da guarda civil, ainda\nreclamava da falta de recursos materiais e humanos para o exercício da\natividade policial. Diante das notícias a respeito da existência de um\n“esquadrão da morte” formado por policiais e que seria responsável pela\nmorte de vários criminosos no estado, negou a existência de tal grupo\nbem como o envolvimento da polícia ou da chamada Scuderie Le Cocq,\ndefinida por ele como uma “organização romântica” fundada para\nhomenagear a memória do detetive Milton Le Cocq e de outros policiais\nmortos em serviço.\n\nEm novembro de 1968 obteve licença para tratamento médico. Durante esse\nintervalo foi substituído pelo suplente Pascoal Citadino, que assumiu a\nvaga em janeiro de 1969. Fioravante Fraga retornou à Assembléia apenas\nem julho de 1970. Na sessão legislativa de 1970 tornou-se quinto\nsecretário da mesa diretora. Às vésperas das eleições estaduais de\nnovembro daquele ano declarou-se grato ao presidente general Médici,\npois ele “reconheceu o direito da oposição na Guanabara”; em sua\nopinião, o MDB não era um partido de oposição ao governo ou ao regime e\nsim “à tese da eleição, que nós achamos que deve ser direta e não\nindireta”. Fioravante Fraga também mostrou-se confiante na eleição do\nemedebista Chagas Freitas para o governo do estado e também na sua\nprópria reeleição para a Assembleia. Naquelas eleições Chagas Freitas\nfoi eleito governador, mas Fioravante Fraga conseguiu apenas a quarta\nsuplência da legenda do MDB ao receber 8.036 votos.\n\nEm 1972 foi aposentado pela Polícia Civil, no cargo de detetive\ninspetor. Concorreu às eleições estaduais de novembro de 1974, mas os\n10.002 votos que obteve fizeram dele apenas o segundo suplente da\nlegenda do MDB no Legislativo da Guanabara.\n\nFaleceu no dia 4 de junho de 1986.\n\nFoi casado com Tereza Sondermann Fraga, com quem teve os filhos Ângela\nTerezinha, Antônio Cláudio e Alberto Fioravante.\n\n*Paulo Celso Liberato Corrêa*\n\nFONTES: ASSEMB. LEGISL. GB. *Anais* (1964-1965, 12/1965, v. XLIX p.\n2505-2507); Memorial da atuação parlamentar do deputado Fioravante Fraga\n(1964-1965, 10/12/1965).\n","ref":"FONTES: ASSEMB. LEGISL. GB. *Anais* (1964-1965, 12/1965, v. XLIX p.\n2505-2507); Memorial da atuação parlamentar do deputado Fioravante Fraga\n(1964-1965, 10/12/1965).\n","dic":"DPRRJ"}
