{"title":"AMARAL NETO","cargoss":["Constituinte","Deputado Estadual","Deputado federal","Deputado federal","Deputado federal","Constituinte","Deputado federal"],"cargos_esp":["est GB","GB","GB",0,0,0,0],"datas_ini":[1960,1961,1963,1983,1975,1987,1988],"datas_fim":[1961,1963,1975,1987,1979,1988,1995],"estados":[0,0,0,"RJ","RJ",0,"RJ"],"autor":["Renato Lemos"],"content":"**AMARAL NETO**\n\n\\* jornalista; const. est. GB 1960-1961; dep. est. GB 1961-1963; dep.\nfed. GB 1963-1975; dep. fed. RJ 1975-1979 e 1983-1987; const. 1987-1988;\ndep. fed. RJ 1988-1995.\n\n*Fidélis dos Santos Amaral Neto* nasceu em Niterói, então capital do\nestado do Rio de Janeiro, em 28 de abril de 1921, filho do advogado\nLuciano Amaral e de Heroína Sobral Amaral.\n\nFez os primeiros estudos no Grupo Escolar Pedro II, em Petrópolis (RJ),\ne cursou em seguida a Escola Modelo e o Colégio Salesiano, ambos em\nNiterói, concluindo o secundário no internato do Colégio Pedro II, no\nRio de Janeiro, então Distrito Federal. Aluno fundador da Escola de\nMarinha Mercante, foi praticante de piloto no cargueiro *Alegrete* até\nnovembro de 1940, quando desembarcou no Rio. Começou a trabalhar no\nInstituto Vital Brasil como protocolista. Depois de casar, tornou-se\ncorrespondente na firma de exportação de tecidos de seu sogro e passou a\ntrabalhar também no escritório de advocacia de seu pai. Com o fim da\nSegunda Guerra Mundial em maio de 1945, e o fechamento da firma de seu\nsogro, ficou desempregado. Dedicou-se então ao jornalismo, iniciando a\ncarreira no *Correio da Noite*, dirigido por dom Hélder Câmara. Após\ntrês meses de trabalho, tornou-se colunista internacional.\n\nO Clube da Lanterna\n\nEm dezembro de 1949, ao lado de Carlos Lacerda, foi um dos fundadores da\n*Tribuna da Imprensa*. Em agosto de 1953, durante o segundo governo\nconstitucional de Getúlio Vargas (1951-1954), participou, com Lacerda,\nda criação do Clube da Lanterna, agremiação oposicionista de tendência\nconservadora que passou a congregar parlamentares de diversos partidos,\nsobretudo da União Democrática Nacional (UDN), o maior partido de\noposição. Coube-lhe a presidência da organização, enquanto Carlos\nLacerda foi escolhido presidente de honra e Alcides Carneiro se tornou o\norador oficial. A primeira reunião oficial do clube realizou-se na\nAssociação Brasileira de Imprensa (ABI) em 19 de maio de 1954. Foi\nproclamada como meta imediata a concentração de esforços nas eleições\nlegislativas e para 11 governos estaduais, marcadas para outubro daquele\nano, de modo a levar o povo a votar “nos bons candidatos que estão\ncombatendo a oligarquia de Getúlio”.\n\nEm 19 de agosto, em meio à grave crise político-institucional decorrente\nda revelação do envolvimento de membros da guarda pessoal de Vargas no\natentado cometido no dia 5 na rua Toneleros, cujo alvo era Lacerda, mas\nque resultou na morte do major-aviador Rubens Vaz, o Clube da Lanterna\nvoltou a se reunir e fez um apelo ao ministro da Guerra, general\nEuclides Zenóbio da Costa, para que as forças armadas forçassem a\nrenúncia de Vargas.\n\nApós o suicídio de Vargas (24/8/1954), a orientação seguida pelo novo\npresidente, João Café Filho, concedendo a políticos ligados à UDN pastas\nministeriais e cargos importantes em órgãos públicos, foi naturalmente\nbem recebida pelo Clube da Lanterna. A organização teve uma participação\nativa nas eleições de 3 de outubro de 1954, elegendo candidatos em\nalguns estados. Nesse pleito, Carlos Lacerda foi o deputado federal mais\nvotado no Distrito Federal.\n\nNa sucessão presidencial de 1955, o Clube da Lanterna alinhou-se com os\nudenistas e os militares do grupo do brigadeiro Eduardo Gomes e do\ngeneral Juarez Távora, opondo-se às candidaturas de Juscelino Kubitschek\ne de João Goulart, consideradas demasiadamente comprometidas com o\ngetulismo. Em 26 de abril, a comissão executiva e o conselho nacional do\nclube solidarizaram-se com a candidatura de Etelvino Lins, dissidente do\nPartido Social Democrático (PSD) que teve seu nome lançado no início do\nmês por líderes da UDN, do Partido Democrata Cristão (PDC) e do Partido\nLibertador (PL), com o apoio de outros dissidentes do PSD. O programa\ndesse candidato, cujo lema era “Pão de vergonha”, tinha bases\ncoincidentes com os princípios do clube. Em 28 de abril a candidatura de\nEtelvino foi homologada pela convenção nacional da UDN e em 10 de maio\nfoi lançada oficialmente pelo Clube da Lanterna, numa solenidade onde\ndiscursaram Amaral Neto, Carlos Lacerda, Alcides Carneiro, José Augusto\nSeabra e Etelvino Lins.\n\nEm 12 de maio, a direção da organização, em nota à imprensa, reafirmou\nseu apoio à candidatura de Etelvino Lins, desmentindo assim as\nespeculações sobre uma possível adesão a Juarez Távora, já então\ncandidato pelo PDC. Em 22 de junho, todavia, depois de Etelvino desistir\nde concorrer às eleições, o Clube da Lanterna passou a apoiar Juarez\nTávora, que já tivera sua candidatura homologada pela UDN. Em outubro,\nno entanto, Juscelino foi eleito presidente da República, derrotando\nJuarez.\n\nAinda em 1955, Amaral Neto fundou a revista quinzenal *Maquis*, que se\ntransformaria em porta-voz do Clube da Lanterna e seria publicada\ndurante seis anos pela Editora Reforma, da qual ele era o\ndiretor-presidente. A revista, sob sua direção, notabilizar-se-ia pelo\nestilo sensacionalista, contando com Araújo Neto na chefia de redação e\ncom um extenso corpo de colaboradores, entre os quais Alberto Deodato,\nAliomar Baleeiro, Henrique Pongetti, João Agripino, João Duarte Filho,\nPaulo Duarte, Pedro Dantas (Prudente de Morais Neto) e Rafael Correia de\nOliveira. Seu primeiro número lembrava o atentado da Toneleros e trazia\numa entrevista com a viúva do major Rubens Vaz. Além disso, acusava\nKubitschek de lesar o Brasil em milhões de dólares e classificava\nArmando Falcão, líder do governo na Câmara, como “megafone” do general\nHenrique Lott, ministro da Guerra.\n\nDurante o movimento militar de 11 de novembro de 1955, o Clube da\nLanterna teve sua sede invadida por agentes do Departamento de Polícia\nPolítica e Social (DPPS), que apreenderam, além do arquivo, documentos\nda organização. O movimento, liderado pelo general Lott, então\ndemissionário, depôs o presidente interino Carlos Luz e teve como\nobjetivo, segundo seus promotores, barrar uma conspiração em preparo no\ngoverno – sob a liderança da UDN e dos setores mais conservadores das\nforças armadas – e assegurar a posse do presidente eleito Juscelino\nKubitschek. Na ocasião, foi publicada uma edição clandestina de\n*Maquis*.\n\nAo prestar depoimento no Departamento de Ordem Política e Social (DOPS)\nem 9 de dezembro, Amaral Neto reafirmou sua posição contrária à posse\ndos eleitos. Fazendo pesadas críticas a Juscelino e a Goulart, acusou-os\nde não reunirem condições morais para assumir o governo. Denunciou ainda\no PSD e o Partido Trabalhista Brasileiro (PTB), por fazerem “uma aliança\nclandestina com o ilegal Partido Comunista Brasileiro (PCB), que se\nabrigou sob a legenda do Movimento Popular Trabalhista”, e considerou a\nCarta-Testamento de Getúlio Vargas como “uma carta falsificada para\nprovocar conflitos”.\n\nNo decorrer de 1956 – primeiro ano do governo Juscelino – o Clube da\nLanterna pautou sua atuação por ataques sistemáticos ao general Lott. Em\nsetembro, *Maquis* teve sua edição apreendida por ordem do general\nAugusto Magessi Pereira, chefe de polícia do Distrito Federal, que\nconsiderou a capa da revista ofensiva ao general Odílio Denis,\ncomandante do I Exército. Em seguida, porém, a revista foi liberada pelo\npresidente da República, preocupado em preservar a imagem democrática do\ngoverno, o que levou Magessi a pedir demissão.\n\nEm 24 de novembro, o Clube da Lanterna foi fechado por meio de um\ndecreto assinado por Juscelino, por ser identificado como um dos\nresponsáveis pela crise político-militar que o país atravessava, mas\nAmaral Neto prosseguiu em sua sistemática campanha de oposição ao\ngoverno.\n\nCarreira parlamentar\n\nCandidato pela UDN à Assembleia Constituinte do recém-criado estado da\nGuanabara, Amaral Neto foi eleito deputado em outubro de 1960 com 37 mil\nvotos. Foi signatário da primeira Constituição do estado, promulgada em\n27 de março de 1961, e durante dois anos foi líder do governo Carlos\nLacerda, na Constituinte e na Assembleia Legislativa do novo estado, não\ntendo perdido nenhum voto durante o período.\n\nEm outubro de 1962, foi eleito deputado federal com 123.380 votos. Foi o\nprimeiro de seu partido e o segundo mais votado do estado – o primeiro\nfoi Leonel Brizola, que obteve também a maior votação do país. Foi o\nexpoente eleitoral da corrente antijanguista, que se opunha às reformas\nde base propostas pelo governo, e a partir de fevereiro de 1963, quando\nassumiu o mandato, tornou-se vice-líder da oposição, destacando-se pela\nagressividade de seu combate à política oficial. Em dezembro, quando foi\ninstaurado um processo para investigação das atividades do Instituto\nBrasileiro de Ação Democrática (IBAD), acusado de utilizar verbas do\nexterior para financiar campanhas de políticos identificados com\nposições mais conservadoras e favoráveis a maiores concessões ao capital\nestrangeiro, foi citado como um dos beneficiários de tais verbas e\nassumiu de público a defesa da entidade.\n\nIntimamente identificado com o governador da Guanabara, Carlos Lacerda,\num dos principais conspiradores contra o governo Goulart, teve\nparticipação ativa no movimento político-militar de 31 de março de 1964,\nque instaurou um regime de exceção no país. Em 1965, depois de ter sido\npreterido por Lacerda na sucessão estadual – o governador optou pela\ncandidatura de Carlos Flexa Ribeiro –, lançou-se candidato com o apoio\ndo PL, mas na eleição de 3 de outubro foi derrotado. Os 40 mil votos que\nobteve o colocaram em terceiro lugar, muito atrás do eleito, o candidato\noposicionista Francisco Negrão de Lima, apoiado pelo PTB e pelo PSD, e\nde Flexa Ribeiro. Com a extinção dos partidos pelo Ato Institucional\nn^o^ 2 (AI-2) em 27 de outubro, e a posterior instauração do\nbipartidarismo, filiou-se ao Movimento Democrático Brasileiro (MDB),\npartido de oposição ao regime, e assumiu sua vice-liderança na Câmara em\nabril de 1966. Ainda nessa legenda foi reeleito no pleito de novembro\nseguinte, com 35.821 votos, mas no início de 1967 deixou o MDB e\ningressou no partido governista, a Aliança Renovadora Nacional (Arena).\nPouco tempo depois, declarou-se rompido com o presidente Artur da Costa\ne Silva, que em março de 1967 sucedera a Castelo Branco, e afirmou que\nabandonaria a política. Não renunciou, entretanto, ao mandato de\ndeputado, e apareceu algumas vezes na Câmara para evitar a cassação por\nfaltas.\n\nEm novembro de 1970 foi mais uma vez reeleito, obtendo a segunda votação\nna Guanabara. Em novembro de 1974 foi novamente reconduzido à Câmara,\nagora, porém, como o penúltimo dos seis deputados federais eleitos por\nseu partido no estado. Nesse ano, seu filho Fidélis do Amaral foi eleito\ndeputado estadual, também pela Arena. Em novembro de 1978 candidatou-se\nnovamente à Câmara e obteve uma suplência. Sua derrota deveu-se, segundo\na imprensa, à inexistência de um campo propício às suas pregações, de um\nassunto que comportasse, no estilo do ex-governador Carlos Lacerda, a\ncrítica intempestiva e contundente, capaz de se transformar em votos.\nSua extensa coleção de mandatos de deputado federal, iniciada em 1963,\nfoi assim interrompida em janeiro de 1979, no fim da legislatura.\n\nCom a extinção do bipartidarismo em 29 de novembro de 1979 e a\nconsequente reformulação partidária, filiou-se ao Partido Democrático\nSocial (PDS), que sucedeu à Arena. Nessa legenda voltou a se eleger\ndeputado federal pelo estado do Rio de Janeiro em novembro de 1982 e\niniciou mais um mandato em fevereiro de 1983. Aberto o processo de\nsucessão do presidente João Figueiredo, opôs-se decididamente à emenda\nconstitucional de autoria do deputado Dante de Oliveira, do Partido do\nMovimento Democrático Brasileiro (PMDB) de Mato Grosso, que previa o\nrestabelecimento das eleições diretas para presidente da República em\nnovembro de 1984. Embora uma parcela dos deputados do PDS apoiasse a\nemenda, defendeu a eleição no Colégio Eleitoral, formado pelos membros\ndo Congresso e representantes das assembleias legislativas. Votada na\nCâmara em 25 de abril de 1984, após a campanha popular que ficou\nconhecida como Diretas Já, a emenda Dante de Oliveira não obteve a\nvotação necessária para ser enviada ao Senado.\n\nEntre as alternativas que surgiram no PDS para disputar o pleito\nindireto, apoiou a candidatura do ex-governador de São Paulo e deputado\nfederal Paulo Maluf, cujo crescimento gerou grave crise no partido.\nDiante do apoio tácito dado pelo governo federal a outros nomes,\ndenunciou manobras de setores governistas para enfraquecer o PDS,\npartidas principalmente do chefe da Casa Civil, Leitão de Abreu, e do\nlíder do governo na Câmara, Nelson Marchezan, a quem acusou de comprar\nvotos. Em carta aberta a Paulo Maluf, sustentou, em maio de 1984, que,\npor ser filho de imigrantes libaneses e mascate, por chamar-se Salim e\npor, a despeito de tudo, ser empresário e político bem-sucedido, sua\ncandidatura despertara o ódio e o preconceito dos “quatrocentões”\n(paulistas tradicionais), dos grandes banqueiros e dos novos-ricos.\n\nEm junho de 1984, o PDS cindiu-se, e uma parte expressiva dos seus\ndirigentes reuniu-se na Frente Liberal, que formou com o PMDB a Aliança\nDemocrática. Em agosto seguinte, a aliança lançou a candidatura do\ngovernador de Minas Gerais, Tancredo Neves. No mesmo período, a\nconvenção nacional do PDS aprovou o nome de Maluf, que derrotou a\npré-candidatura do ministro do Interior, coronel Mário Andreazza.\nReunido o Colégio Eleitoral em 15 de janeiro de 1985, Paulo Maluf foi\nderrotado pelo candidato da Aliança Democrática que, no entanto, por\nmotivo de doença, não chegou a ser empossado na presidência, vindo a\nfalecer em 21 de abril de 1985. Tancredo Neves foi substituído pelo vice\nJosé Sarney, que já vinha exercendo interinamente o cargo desde 15 de\nmarço.\n\nEm maio, Amaral Neto foi processado por Marchezan, que o acusou de\ninjúria pela imprensa durante a votação do Colégio Eleitoral. Em agosto\nseguinte, foi alvo de mais um processo, dessa vez movido pelo governador\ndo Rio Grande do Sul, Jair Soares (1983-1987), por ele acusado\npublicamente de ter, quando ministro da Previdência, instalado no\nplenário da Câmara uma banca para distribuir credenciamentos\nhospitalares em troca de votos para a candidatura de Nelson Marchezan à\npresidência da Casa. Vice-líder do PDS na Câmara, reagiu energicamente a\nrumores que circulavam no Congresso dando conta de um suposto movimento\nde aproximação do partido com o governo de José Sarney. Em 27 de\nnovembro de 1985 pronunciou um contundente discurso em que se declarou\nem “estado de oposição desvairada” e exigiu do líder do seu partido,\ndeputado Prisco Viana (BA), uma atitude mais francamente oposicionista.\nO único aparte que recebeu foi feito pelo deputado Antônio Amaral\n(PSD-PA), que o acusou de cobiçar a liderança do partido. Rebateu a\nacusação com veemência, mas, menos de dois meses depois, assumiu o lugar\nde Prisco Viana, que se transferiu para o PMDB.\n\nTendo ascendido à liderança num momento em que o PDS perdia importantes\nquadros para outras legendas, adotou uma linha marcadamente\noposicionista: “Uma novidade a cada dia, sempre contra o governo”,\nameaçou. Para isso, passou a usar o expediente de ler atentamente o\n*Diário Oficial* e selecionar atitudes do governo para criticá-las. Essa\nestratégia não implicava, contudo, ausentar-se da discussão das\nprincipais questões da agenda política. Logo em 18 de janeiro de 1986,\npor exemplo, pronunciou-se favoravelmente à extinção da sublegenda para\nsenadores e prefeitos. A sublegenda – pela qual um partido podia lançar\naté três candidatos a uma mesma vaga em eleições majoritárias – estava\ngerando um impasse no Congresso, já que o Senado aprovara a sua\nextinção, mas a Câmara só admitia votar a medida caso se acabasse também\ncom a “candidatura nata”, que assegurava a todos os senadores eleitos em\n1982 vaga na chapa de seus partidos para as eleições, independentemente\ndas convenções partidárias. Outro tema escolhido como eixo de sua\nconduta à frente do PDS foi a política anti-inflacionária, que\nconsiderava o ponto mais vulnerável do governo José Sarney. Dispôs-se,\nmesmo, a afixar na porta do seu gabinete uma lista de 50 gêneros\nalimentícios vendidos pelos supermercados para provar que da posse de\nSarney até janeiro de 1986 a elevação dos preços fora de 340%. Em março,\nconcorreu à liderança do PDS na Câmara e venceu com 37 votos, contra 27\ndados ao candidato concorrente, Bonifácio de Andrada (MG), e um em\nbranco.\n\nEm novembro de 1986 disputou mais um mandato na Câmara. O novo Congresso\nteria atribuições de Assembleia Nacional Constituinte, devendo, durante\nos trabalhos de elaboração da nova Carta, dar conta das suas funções\nordinárias. Em sua plataforma, defendeu com destaque a implantação da\npena de morte para crimes de sequestro, roubo e estupro que resultassem\nem morte e a manutenção do prazo de quatro anos para o mandato de\nSarney, cuja ampliação fora aventada. Foi o sétimo parlamentar mais\nvotado no estado do Rio de Janeiro. Novamente escolhido, em janeiro de\n1987, líder do PDS na Câmara, tomou posse do mandato constituinte em\nfevereiro. Iniciados os trabalhos, integrou um dos blocos\nextrapartidários surgidos da inconsistência política e ideológica dos\npartidos, o chamado “Centrão”, que reuniu congressistas de direita e do\ncentro, chegando a formar quase a maioria absoluta da Assembleia. Com a\nparcela majoritária da bancada pedessista, assumiu posições contrárias\naos parlamentares que se opunham ao funcionamento paralelo do Congresso,\nclassificando-os de cínicos, já que não haviam sido eleitos apenas para\nparticipar da elaboração da Constituição.\n\nEm 26 de março de 1987, cumpriu sua “principal promessa da campanha”,\napresentando à Constituinte a proposta de instituição da pena de morte\npara os casos de crimes militares em tempo de guerra externa, assalto,\nroubo, sequestro e estupro de mulheres e crianças seguidos de morte.\nEncaminhada à Subcomissão dos Direitos e Garantias Individuais, a\nproposta não encontrou boa receptividade: dos 21 integrantes, 17 foram\ncontrários à sua inclusão no anteprojeto, por motivos que iam da\ndesconfiança quanto à competência da Justiça para aplicar a sentença de\nmorte à convicção de que a vida, mesmo de um criminoso, não pertencia ao\nEstado. Os membros da subcomissão favoráveis à proposta foram os\npedessistas Narciso Mendes (AC) e Ubiratan Spinelli (MT), e José\nMendonça Bezerra, do Partido da Frente Liberal (PFL) pernambucano.\n\nObstinado, em 9 de junho de 1987 apresentou nova proposta de emenda,\nagora à Comissão de Soberania, sugerindo que fosse realizado um\nplebiscito 120 dias após a promulgação da nova Constituição, quando o\npovo decidiria se aprovava ou não a instituição da pena de morte nos\ntermos por ele formulados. O ato de apresentação da emenda contou com a\npresença de representantes do Sindicato dos Condutores Autônomos de\nVeículos Rodoviários de Brasília, que levou à comissão um grupo de\nviúvas de motoristas assassinados. Em contrapartida, houve intensa\nreação por parte de parlamentares contrários à medida, especialmente dos\ndeputados Lisânias Maciel (RJ), do Partido Democrático Trabalhista\n(PDT), e José Genoíno (SP), do Partido dos Trabalhadores (PT), tendo\neste acusado os defensores da pena de morte de serem os mesmos que se\nopunham à reforma agrária. A proposta de adoção da pena de morte\nacabaria rejeitada definitivamente pelos constituintes.\n\nEm dezembro de 1987, Amaral Neto reagiu violentamente à notícia,\ndivulgada por um jornal de Brasília, de que a Conferência Nacional dos\nBispos do Brasil (CNBB) divulgaria os nomes dos constituintes que\nconsiderava contrários aos interesses populares, a maioria dos quais\nintegrantes do “Centrão”. Classificou a ideia de reedição da Santa\nInquisição e partiu para a denúncia pública dos bispos: dom Luciano\nMendes de Almeida (presidente da CNBB) seria um “canalha de batina”,\nintegrante do grupo de “vigaristas da CNBB”, assim como dom Pedro\nCasaldáliga (bispo de São Félix do Araguaia), dom Paulo Evaristo Arns\n(cardeal-arcebispo de São Paulo) e dom Ivo Lorscheiter (ex-presidente da\nCNBB). No seu modo de ver, a cúpula da CNBB estaria aliada à Central\nÚnica dos Trabalhadores (CUT) e a outras forças esquerdistas para\ndesmoralizar o “Centrão”. Sua reação intempestiva desagradou até mesmo\naos seus aliados na Constituinte, que a consideraram radical demais, e\nprovocou a defecção de um membro do “Centrão”, o deputado Victor\nFaccioni, vice-líder do PDS, que criticou a agressão à CNBB, com a qual\nentendia que se deveria dialogar.\n\nNa sucessão do prefeito do Rio de Janeiro, Saturnino Braga, Amaral Neto\ntentou, em 9 de agosto de 1988, invalidar a aliança firmada entre o PDS\ne o Partido Liberal (PL) em torno da candidatura do deputado federal\nÁlvaro Vale. Apontando irregularidades na convenção municipal do PDS\nreunida no dia anterior, encaminhou um pedido de intervenção da\nConvenção Nacional do partido no Diretório Regional carioca, com o\nobjetivo de anular a coligação com o PL. Embora dois meses antes tivesse\ndeclarado não pretender candidatar-se à prefeitura do Rio de Janeiro,\nalegou ter recebido expressivos apelos de deputados federais e\ncandidatos a vereador para que disputasse o pleito, resultando daí a sua\noposição ao acordo com o PL. Não chegou, contudo, a candidatar-se.\nRealizadas em novembro de 1988, as eleições foram vencidas por Marcelo\nAlencar, do PDT.\n\nCom a eleição de Fernando Collor, do Partido da Reconstrução Nacional\n(PRN), para a presidência da República em novembro/dezembro de 1989,\nAmaral Neto anunciou em janeiro seguinte o apoio do PDS ao novo governo.\nEm fevereiro, reelegeu-se líder na Câmara, posição em que desfrutou de\ngrande prestígio político no início da administração de Fernando Collor,\nempossado em março. Em outubro de 1990 conquistou mais um mandato\nfederal. No fim do ano, começou a fazer críticas ao governo federal.\nAtacou a política econômica e queixou-se da inexistência de diálogo\nentre o presidente e as lideranças dos partidos que o apoiavam no\nCongresso. Desde então, distanciou-se progressivamente do governo, cujos\nministros e secretários passou a criticar duramente. Durante a\nlegislatura iniciada em fevereiro de 1991, integrou a Comissão de Defesa\ndo Consumidor, Meio Ambiente e Minorias. Durante a crise política que\nresultaria no *impeachment* de Collor, alinhou-se com os que exigiram a\napuração de todas as denúncias contra o governo, tendo chamado o\npresidente de “assaltante”. Coerentemente com essa posição, na sessão de\n29 de setembro de 1992 votou a favor do afastamento de Collor, acusado\nde crime de responsabilidade pela comissão parlamentar de inquérito\n(CPI) que investigou denúncias de corrupção contra o tesoureiro de sua\ncampanha presidencial, Paulo César Farias. Afastado da chefia do\nExecutivo após a votação da Câmara, Collor renunciou ao mandato em 29 de\ndezembro seguinte, antes da conclusão do julgamento pelo Senado. Foi\nsubstituído pelo vice Itamar Franco, que vinha ocupando o cargo\ninterinamente desde 2 de outubro.\n\nCandidato em 1992 à prefeitura do Rio de Janeiro, Amaral Neto defendeu\nmais uma vez a adoção da pena de morte e a intervenção federal como\nmedidas de combate à onda de violência que assolava a cidade. No\nprimeiro turno das eleições, em outubro, ficou em quinto lugar. Anunciou\nentão seu apoio à candidata do Partido dos Trabalhadores (PT), Benedita\nda Silva, no segundo turno, que foi vencido por César Maia (PMDB). Os\nassassinatos de uma atriz de televisão por um colega de trabalho e de\numa menina de cinco anos por seu sequestrador em fins de dezembro de\n1992 o levaram, já nos primeiros dias de 1993, a nova ofensiva na\ncampanha pela adoção da pena de morte. Reaberta a discussão do tema,\nvoltou a entrar em violento conflito com a CNBB, sempre contrária à\nmedida.\n\nEm abril de 1993, Amaral Neto foi um dos fundadores do Partido\nProgressista Reformador (PPR), nascido da fusão do PDS com o Partido\nDemocrata Cristão (PDC). Atuou nesse ano como vice-líder do bloco\npartidário formado pelo PPR, o PFL, o Partido Trabalhista Brasileiro\n(PTB), o PRN, o PL e outras agremiações de menor expressão. Escolhido\nvice-líder do PPR na Câmara para o período 1993-1994, durante o processo\nde revisão constitucional que se desenrolou nessa legislatura voltou a\npropor, agora como emenda constitucional, a realização de um plebiscito\nsobre a adoção da pena de morte. Apresentada na sessão conjunta do\nCongresso realizada em 6 de outubro, a emenda, defendida por 189\nparlamentares, estabelecia que a consulta popular seria feita 18 meses\napós a sua aprovação. Amaral Neto propôs também outras três emendas que\nprovocaram polêmica: o fim do benefício da prisão especial para\ncondenados com diploma de curso superior, a extinção da primariedade\npara acusados de crimes dolosos e a invalidação do recurso à renúncia de\nmandato para parlamentares indiciados em CPIs. Além da pena de morte,\noutras questões mobilizaram sua atuação parlamentar. Defendeu as\nreformas administrativa e tributária, propondo o agravamento das penas\npara sonegadores e funcionários desonestos, e apoiou a realização de uma\nreforma agrária cooperativista, isenta de desapropriações.\n\nPrevista para essa legislatura, a revisão da Constituição de 1988 acabou\nnão acontecendo, e poucas alterações na Carta foram aprovadas. Amaral\nNeto foi contrário ao fim do voto obrigatório e votou favoravelmente à\nrevisão do conceito de empresa nacional e à instituição do Fundo Social\nde Emergência (FSE). Esteve ausente, no entanto, da sessão que aprovou a\ncriação do Imposto Provisório sobre Movimentação Financeira (IPMF), que,\nao lado do FSE, serviu como fonte de financiamento para o programa do\ngoverno de estabilização econômica batizado de Plano Real.\n\nNa eleição de 3 de outubro de 1994, candidatou-se mais uma vez à Câmara\ne foi eleito com votos obtidos sobretudo na capital do estado. Dezesseis\ndias depois, no entanto, o Tribunal Regional Eleitoral do Rio de Janeiro\n(TRE-RJ) decidiu anular o pleito por suspeitas de fraude. Marcada nova\neleição para novembro seguinte, Amaral foi reeleito. Em dezembro, um\nacidente automobilístico lhe deixou graves sequelas, obrigando-o a\ndiversas internações. Empossado na Câmara em fevereiro de 1995,\nlicenciou-se do novo mandato em abril seguinte, devido a complicações em\nseu estado de saúde. Substituído pelo suplente Agnaldo Timóteo, também\ndo PPR, ainda assim acompanhou Paulo Maluf na fundação do Partido\nProgressista Brasileiro (PPB), surgido da união do PPR com o Partido\nProgressista (PP), em agosto de 1995.\n\nDois meses depois, no entanto, seu estado de saúde agravou-se. Após duas\nsemanas internado num hospital no Rio de Janeiro, morreu em 17 de\noutubro de 1995.\n\nFoi casado três vezes, com Maria Estela da Cunha Amaral, Irene Waltrand\nOrwert e Ângela Maria Adnet Amaral. Teve oito filhos. Fidélis do Amaral,\nseu filho e de Maria Estela, foi deputado estadual de 1975 a 1979.\n\nAlém da participação na *Tribuna da Imprensa* e em *Maquis*, foi\ncolaborador do *Correio da Manhã*, de *O Jornal*, do *Diário da Noite* e\nda *Gazeta de São Paulo*. Criou e publicou *O Brasil em jornal*, com\nGustavo Barroso e Jaime Coelho, e *A história em notícia*, coleção sobre\na história do Brasil desde o descobrimento, de forma jornalística. Foi\nainda o fundador da Plantel – Editora e Publicidade, firma de produção e\nvenda de fascículos, *slides*, filmes e programas para a TV, dos quais o\nque mais se destacou foi *Amaral Neto, repórter*.\n\nPublicou *Os brasileiros* e *Pena de morte em defesa da vida*.\n\n*Renato Lemos*\n\nFONTES: ASSEMB. NAC. CONST. *Repertório* (1987); COELHO, J.; OLIVEIRA,\nA. *Nova*; CÂM. DEP. *Deputados*; CÂM. DEP. *Deputados brasileiros.*\nRepertório (1967-1971, 1971-1975, 1975-1979, 1983-1987, 1995-1999); CÂM.\nDEP. *Relação nominal dos senhores*; COSTA, M. *Cronologia*; *Estado de\nS. Paulo* (17/8/86, 5/3/87, 22/2 e 17/11/90); *Folha de S.Paulo*\n(20/11/1984, 3, 18/1, 26/2, 5/3, 28/12/1986, 9/8, 7/10/1988, 29/9/1992,\n12, 14/1/1993, 18/10/1995); *Globo* (12/11/1974, 4/11/1984, 22/8/1985,\n24/1, 13/11, 2, 4/12/1990, 13/1, 30/6, 22/9, 15/12/1993, 18/10/1995,\n20/3/1996); *Jornal do Brasil* (6/10/1966, 22/11/1974, 20/11/1984, 10/5,\n14/8, 27/11/1985, 20/1, 17/8/1986, 10/6, 16/12/1987, 24/3, 16/11/1990,\n4/10/1992, 18/10/1995); MIN. REL. EXT. *Relatório*; *Noite* (10/9/1962);\n*Olho no Congresso/Folha de S.Paulo* (31/1/1995); *Olho no voto/Folha de\nS.Paulo* (18/9/1994); *Perfil* (1972); *Perfil parlamentar/IstoÉ*\n(1991).\n","ref":"FONTES: ASSEMB. NAC. CONST. *Repertório* (1987); COELHO, J.; OLIVEIRA,\nA. *Nova*; CÂM. DEP. *Deputados*; CÂM. DEP. *Deputados brasileiros.*\nRepertório (1967-1971, 1971-1975, 1975-1979, 1983-1987, 1995-1999); CÂM.\nDEP. *Relação nominal dos senhores*; COSTA, M. *Cronologia*; *Estado de\nS. Paulo* (17/8/86, 5/3/87, 22/2 e 17/11/90); *Folha de S.Paulo*\n(20/11/1984, 3, 18/1, 26/2, 5/3, 28/12/1986, 9/8, 7/10/1988, 29/9/1992,\n12, 14/1/1993, 18/10/1995); *Globo* (12/11/1974, 4/11/1984, 22/8/1985,\n24/1, 13/11, 2, 4/12/1990, 13/1, 30/6, 22/9, 15/12/1993, 18/10/1995,\n20/3/1996); *Jornal do Brasil* (6/10/1966, 22/11/1974, 20/11/1984, 10/5,\n14/8, 27/11/1985, 20/1, 17/8/1986, 10/6, 16/12/1987, 24/3, 16/11/1990,\n4/10/1992, 18/10/1995); MIN. REL. EXT. *Relatório*; *Noite* (10/9/1962);\n*Olho no Congresso/Folha de S.Paulo* (31/1/1995); *Olho no voto/Folha de\nS.Paulo* (18/9/1994); *Perfil* (1972); *Perfil parlamentar/IstoÉ*\n(1991).\n","dic":"DPRRJ"}
