{"title":"FORTES, Alberto Rodrigues","cargoss":["Prefeito","Prefeito"],"cargos_esp":["Niterói","Niterói"],"datas_ini":[1954,1950],"datas_fim":[1959,1950],"estados":["RJ","RJ"],"content":"**FORTES, Alberto Rodrigues**\n\n\\* pref. Niterói RJ 1950 e 1954-1959.\n\n*Alberto Rodrigues Fortes* nasceu em Itaboraí (RJ) no dia 4 de dezembro\nde 1889, filho de Milton Rodrigues Fortes e de Maria Balbina de\nVasconcelos Fortes.\n\nApós concluir os estudos secundários no Colégio Alfredo Gomes, no Rio de\nJaneiro, então Distrito Federal, formou-se pela Faculdade Livre do Rio\nde Janeiro em 1922. Ainda estudante concorreu em 1919 ao cargo de juiz\nde paz no bairro do Barreto, em Niterói, mas não teve êxito. Depois de\nformado passou a advogar em diversos municípios do estado do Rio, como\nNiterói, São Gonçalo e Itaboraí.\n\nEm 1930 fundou a Cooperativa Banco Comercial e Hipotecário do Barreto,\nda qual foi presidente até morrer. Em 1932 foi um dos fundadores e\nprimeiro presidente da União dos Proprietários de Imóveis de Niterói.\nNesse mesmo ano ajudou na criação do Partido Economista do Brasil,\natravés do qual se candidatou em 1933, também sem êxito, à Assembleia\nNacional Constituinte. Em 1936 elegeu-se vereador em Niterói, mas teve o\nmandato interrompido no ano seguinte com o início da ditadura do Estado\nNovo (1937-1945).\n\nEm 28 de junho de 1950 foi nomeado prefeito de Niterói pelo governador\ndo estado, Edmundo de Macedo Soares (1947-1951), em substituição a José\nInácio da Rocha Werneck. Permaneceu no cargo apenas até 8 de dezembro,\nquando José Inácio Werneck voltou à prefeitura. Nesse período, suas\nprincipais realizações foram a reforma do Campo de São Bento, a\nelaboração do projeto da avenida do Contorno, importante via de ligação\nentre Niterói e São Gonçalo, e a inauguração da iluminação da avenida\nAmaral Peixoto.\n\nApós um período de grande rotatividade na administração de Niterói –\nentre 1945 e 1954 o município teve 11 prefeitos – voltou a assumir\nprefeitura entre 31 de janeiro de 1955 e 30 de janeiro de 1959, agora\neleito pela coligação entre a União Democrática Nacional (UDN) e o\nPartido Social Progressista (PSP), sucedendo a Lealdino de Alcântara. Em\nsua segunda gestão realizou diversas obras na cidade. Promoveu a\nurbanização do bairro Vital Brazil; fez a pavimentação dos bairros de\nIcaraí, Ingá, Santa Rosa, Fonseca, Barreto e Engenhoca, e, nesses mesmos\nlocais, instalou um novo sistema de iluminação; duplicou a avenida Ari\nParreiras; criou o Serviço Social dos Operários Municipais; terminou a\nconstrução do cais de Jurujuba; uniu a Ilha da Conceição ao continente e\nreformou a praça Enéias de Castro no bairro do Barreto, transformando-a\nem ponto de saída de diversas linhas de ônibus. Além disso, adotou o\nnovo Código Tributário, o que favoreceu a duplicação da receita do\nmunicípio no decorrer de seu mandato. Seu sucessor na prefeitura foi\nWilson Pereira de Oliveira.\n\nFoi também professor de português, francês, geografia, matemática,\nhistória, física, química, latim e grego no Ginásio Fluminense em\nNiterói. Pertenceu à Academia Fluminense de Letras, em cuja revista\npublicou diversos ensaios literários e biográficos.\n\nFaleceu em Niterói no dia 13 de outubro de 1967.\n\nCasado com Guiomar Rosa Fortes, teve quatro filhos.\n\n*Paulo César Gomes Bezerra*\n\nfontes: SOARES,E. *Prefeitura*;SOARES, E. *Ruas*: WEHRS, C. *Niterói*.\n","ref":"","dic":"DPRRJ"}
