{"title":"FRANCO, Bernardino","cargoss":["Deputado Estadual"],"cargos_esp":[0],"datas_ini":[1907],"datas_fim":[1909],"estados":["RJ"],"autor":["Raimundo Helio Lopes"],"content":"**FRANCO, Bernardino**\n\n\\* dep. est. RJ 1907-1909.\n\n*Bernardino Torres da Costa Franco* candidatou-se a deputado estadual no\nRio de Janeiro em 1906, na legenda do Partido Republicano do Rio de\nJaneiro (PRRJ). Elegeu-se em dezembro do mesmo ano pelo quarto distrito\neleitoral, sediado em Vassouras (RJ). Durante o mandato foi membro das\ncomissões de Agricultura, Indústria e Colonização e de Obras Públicas,\nSaúde Pública e Câmaras Municipais.\n\nAinda em 1906 Alfredo Backer (1906-1910) foi eleito presidente do estado\ndo Rio de Janeiro, apoiado por Nilo Peçanha. Contudo, ambos divergiram\nno curso do governo do presidente Afonso Pena (1906-1909), de quem Nilo\nPeçanha era vice-presidente. Afonso Pena decidiu constituir, para seu\ngoverno, uma base de apoio independente das lideranças políticas\ntradicionais, a fim de poder enfrentar a oposição que lhe era movida\npela corrente liderada por Pinheiro Machado, senador gaúcho (1890-1915)\ne um dos principais nomes da política nacional. Reagindo a esta\ninterferência em sua área de atuação política, Nilo Peçanha, que era\nligado a Pinheiro Machado, desentendeu-se ao mesmo tempo com Afonso Pena\ne com Alfredo Backer.\n\nCom o desenvolvimento da crise, Backer sofreu um importante revés na\nAssembleia Legislativa em setembro de 1907, quando a sobretaxa para o\ncafé estipulada pelo Convênio de Taubaté (1906), cuja adoção ele\ndefendeu, foi derrubada pela Assembleia. Nessa votação, Bernardino\nFranco votou a favor da sobretaxa, situando-se politicamente ao lado da\ncorrente backerista.\n\nA dissensão entre Backer e Nilo Peçanha aprofundou-se com o começo da\ncampanha para a sucessão federal. Backer apoiou inicialmente o\npresidente de Minas Gerais, João Pinheiro, enquanto Nilo era partidário\nda candidatura do ministro da Guerra, Hermes da Fonseca. Em março de\n1908, consumou-se o rompimento, ocorrendo manifestações em que\npartidários dos dois líderes entraram em conflito.\n\nNas eleições estaduais de dezembro de 1909, ao final do seu mandato,\nBernardino Franco se reaproximou dos nilistas, fortalecidos pela chegada\nde Nilo Peçanha à presidência da República (1909-1910). Nesse pleito não\nse reelegeu deputado estadual na chapa do Partido Republicano Fluminense\n(PRF), partido que passou a abrigar os nilistas ainda em 1909. Os\nnilistas conseguiram eleger a maioria dos deputados estaduais, em\noposição ao grupo backerista.\n\nBernardino Franco deu prosseguimento a sua trajetória política no\nmunicípio de Cantagalo (RJ). Em 1912 foi membro da Comissão Executiva do\nPRF e, em 1915, apoiou a candidatura do Miguel de Carvalho ao Senado\nFederal.\n\n*Raimundo Helio Lopes*\n\nFONTES: ASSEMB. LEGISL. RJ. *Anais* (1907-1909); *Correio de Cantagalo*\n(21/1/1912); FERREIRA, M. *República*.\n","ref":"FONTES: ASSEMB. LEGISL. RJ. *Anais* (1907-1909); *Correio de Cantagalo*\n(21/1/1912); FERREIRA, M. *República*.\n","dic":"DPRRJ"}
