{"title":"ABREU, Iltamir","cargoss":["Deputado Estadual"],"cargos_esp":[0],"datas_ini":[1967],"datas_fim":[1971],"estados":["RJ"],"autor":["Luciana Pinheiro"],"content":"**ABREU, Iltamir**\n\n\\* dep. est. RJ 1967-1971.\n\n***Iltamir Honório de Abreu*** nasceu em Macaé (RJ) no dia 27 de\nsetembro de 1935, filho de Antônio José de Abreu e de Delminda Honório\nde Abreu.\n\nNas eleições de 1958, elegeu-se vereador em Macaé na legenda do Partido\nSocial Progressista (PSP). No ano seguinte, assumiu o mandato. Em 1962,\nfundou a rádio Princesa do Atlântico, dando início a uma longa\ntrajetória como empresário do ramo das comunicações que o levaria a ser\nproprietário da Rádio Macaé, da Rádio Cabo Frio, da Rádio Angra dos Reis\ne da FM 103,5. Com o encerramento do mandato de vereador em janeiro de\n1963, no governo de Luís Miguel Pinaud (1963) dirigiu o Departamento de\nDifusão Cultural do Estado do Rio de Janeiro.\n\nCom a promulgação do Ato Institucional n^o^ 2 em 1965 e a posterior\ninstituição do bipartidarismo, filiou-se ao Movimento Democrático\nBrasileiro (MDB), partido de oposição ao regime militar instaurado no\npaís em abril de 1964, e nessa legenda **candidatou-se a deputado\nestadual no Rio de Janeiro** a**s eleições de novembro de 1966. Eleito,\nfoi empossado em fevereiro de 1967. Durante a legislatura foi terceiro**\nsuplente da mesa diretora, membro das comissões de Agricultura, Viação e\nObras Públicas e de Educação e Saúde da Assembleia Legislativa. Ao\ntérmino do mandato em janeiro de 1971, deixou a Assembleia.\n\nFoi subsecretário de Estado e Planejamento do Estado do Rio de Janeiro\nno governo de Wellington Moreira Franco (1987-1991). Foi ainda\nvice-prefeito de Macaé, membro da Associação dos Criadores de Cavalo\nPampa e da Associação Brasileira de Criadores de Cavalo Campolina, e\nprocurador do estado do Rio de Janeiro.\n\nFaleceu em 19 de julho de 2006.\n\nFoi casado com Elenita Quintela Abreu, com quem teve quatro filhos.\n\n*Luciana Pinheiro*\n\nFONTES: ASSEMB. LEG. RJ. Disponível em: \\<http://alerj.gov.br/\\>. Acesso\nem: 10/5/2011; ASS. BRAS. CRIAD. CAV. CAMPOLINA. Disponível em:\n\\<www.campolina.org.br/\\>. Acesso em: 10/5/2011; ASS. CRIAD. CAV. PAMPA.\nDisponível em: \\<www.abcpampa.org.br\\>. Acesso em: 10/5/2011; Diário\nCosta Sol. Disponível em:\n\\<www.diariodacostadosol.com/noticias.php?page=leitura&idNoticia=22255\\>.\nAcesso em: 10/5/2011; INF. João Kiffer Netto (3/5/2011); OLIVEIRA, P.\n*Atos*; PLANALTO. Disponível em: \\<www.planalto.gov.br\\>. Acesso em:\n10/5/2011; VALENTE, E. *Eduardo*.\n","ref":"FONTES: ASSEMB. LEG. RJ. Disponível em: \\<http://alerj.gov.br/\\>. Acesso\nem: 10/5/2011; ASS. BRAS. CRIAD. CAV. CAMPOLINA. Disponível em:\n\\<www.campolina.org.br/\\>. Acesso em: 10/5/2011; ASS. CRIAD. CAV. PAMPA.\nDisponível em: \\<www.abcpampa.org.br\\>. Acesso em: 10/5/2011; Diário\nCosta Sol. Disponível em:\n\\<www.diariodacostadosol.com/noticias.php?page=leitura&idNoticia=22255\\>.\nAcesso em: 10/5/2011; INF. João Kiffer Netto (3/5/2011); OLIVEIRA, P.\n*Atos*; PLANALTO. Disponível em: \\<www.planalto.gov.br\\>. Acesso em:\n10/5/2011; VALENTE, E. *Eduardo*.\n","dic":"DPRRJ"}
