{"title":"AMARAL, Blandino","cargoss":["Deputado Estadual"],"cargos_esp":[0],"datas_ini":[1995],"datas_fim":[2003],"estados":["RJ"],"autor":["Sabrina Guerghe"],"content":"**AMARAL, Blandino**\n\n\\* dep. est. RJ 1995-2003.\n\n*Blandino Pontes do Amaral* nasceu na cidade de São Fidélis (RJ), no dia\n10 de setembro de 1959, filho de Reni Gomes do Amaral e Maria Pontes do\nAmaral.\n\nConcluiu o ensino médio como técnico de enfermagem no Colégio Estadual\nde São Fidélis, em 1983. Em seguida, exerceu sua profissão no Hospital\nArmando Vidal, em sua cidade natal, onde também foi pipoqueiro.\nPresidente da Associação de Moradores e Amigos do Parque Bela Vista,\nbairro de São Fidélis, entre 1989 e 1994, nesse ano tornou-se presidente\nda seção municipal do Partido da Reedificação da Ordem Nacional (Prona).\n\nNas eleições de outubro de 1994, conquistou seu primeiro mandato\neletivo. Elegeu-se deputado estadual no Rio de Janeiro e tomou posse em\nfevereiro do ano seguinte. Na Assembleia Legislativa do Estado do Rio de\nJaneiro (ALERJ), exerceu a quarta suplência da mesa diretora\n(1995-1996), foi vice-líder de seu partido (1997) e integrou, como\nmembro efetivo, a comissão parlamentar de inquérito (CPI) instituída\npara apurar irregularidades na prestação de serviços na área de saúde\npública pela Fundação Cultural Ecológica Anjos do Asfalto, através do\nconvênio celebrado com o Sistema Único de Saúde (SUS).\n\nReeleito em outubro de 1998, durante o exercício de seu segundo mandato\natuou como vice-presidente da Comissão de Legislação Constitucional\nComplementar e Códigos. Foi também líder do Prona entre 1999 e 2002.\nCandidatou-se a mais um mandato, sempre pelo Prona, no pleito de outubro\nde 2002, mas obteve apenas uma suplência. Deixou a ALERJ em janeiro de\n2003. Quatro anos depois, tentou mais uma vez se eleger, novamente sem\nêxito.\n\nPublicou o livro *Vencer é possível* (1999).\n\nCasou-se e teve dois filhos.\n\n*Sabrina Guerghe*\n\nFONTES: ASSEMB. LEGISL. RJ. *Deputados estaduais fluminenses*. Sétima\nlegislatura (1999-2003); *Folha* (Eleições 2002, 12/8/2006); *Globo*\n(25/6/2004); G1 (Eleições 2006); TRIB. REG. ELEIT. RJ. Disponível em:\n\\<[www.tre-rj.gov.br/site/partido\\_politico/diretivos/prona.pdf](http://www.tre-rj.gov.br/site/partido_politico/diretivos/prona.pdf)\\>;\nTRIB. SUP. ELEIT. (Eleições 1994, 1998, 2002 e 2006).\n","ref":"FONTES: ASSEMB. LEGISL. RJ. *Deputados estaduais fluminenses*. Sétima\nlegislatura (1999-2003); *Folha* (Eleições 2002, 12/8/2006); *Globo*\n(25/6/2004); G1 (Eleições 2006); TRIB. REG. ELEIT. RJ. Disponível em:\n\\<[www.tre-rj.gov.br/site/partido\\_politico/diretivos/prona.pdf](http://www.tre-rj.gov.br/site/partido_politico/diretivos/prona.pdf)\\>;\nTRIB. SUP. ELEIT. (Eleições 1994, 1998, 2002 e 2006).\n","dic":"DPRRJ"}
