{"title":"FRANCO, Moreira","cargoss":["Deputado federal","Prefeito","Governador de estado ou do Distrito Federal","Deputado federal","Deputado federal","min Assuntos Estrat"],"cargos_esp":[0,"Niterói",0,0,0,0],"datas_ini":[1975,1977,1987,2003,1995,2011],"datas_fim":[1977,1982,1991,2007,1999,0],"estados":["RJ",0,"RJ","RJ","RJ",0],"autor":[0],"content":"**FRANCO, Moreira**\n\n\\* dep. fed. RJ 1975-1977; pref. Niterói 1977-1982; gov. RJ 1987-1991;\ndep. fed. RJ 1995-1999 e 2003-2007; min. Assuntos Estrat. 2011-\n\n*Wellington Moreira Franco* nasceu em Teresina no dia 19 de outubro de\n1944, filho do cirurgião dentista Francisco das Chagas Franco e de Kerma\nMoreira Franco.\n\nDepois de concluir os estudos primários no Liceu Piauiense, em sua\ncidade natal, transferiu-se em 1955 para o Rio de Janeiro, então\nDistrito Federal, e fez o curso secundário no Colégio Mallet Soares.\nDiplomou-se em seguida pela Faculdade de Ciências Econômicas da\nUniversidade do Brasil, atual Universidade Federal do Rio de Janeiro\n(UFRJ), em 1966, e pela Escola de Sociologia e Política da Pontifícia\nUniversidade Católica do Rio de Janeiro (PUC-Rio), em 1969. Na\nuniversidade, participou do movimento estudantil atuando nos grupos que\narticulavam as eleições para os diretórios acadêmicos e integrando os\nquadros dirigentes da Ação Popular, organização cristã de esquerda que,\napós a vitória do movimento político-militar de 31 de março de 1964,\nadotou uma orientação maoísta. Ainda em 1966 foi subchefe de seleção e\ntreinamento do Departamento de Cadastro do Instituto Brasileiro de\nReforma Agrária (IBRA) e foi bolsista da Escola Interamericana de\nAdministração Pública (EIAP) da Fundação Getulio Vargas (FGV), onde\ntrabalhou até 1968 como pesquisador. Em 1969 foi assistente de pesquisa\nda Escola Brasileira de Administração Pública (EBAP) da FGV, no estudo\nsobre “Administração pública brasileira e comportamento ideológico das\nelites políticas brasileiras frente à mudança e ao desenvolvimento”.\n\nTambém em 1969, casou-se com Celina Vargas Amaral Peixoto, neta de\nGetúlio Vargas, presidente da República de 1930 a 1945 e de 1951 a 1954,\ne filha de Alzira Vargas Amaral Peixoto e de Ernâni Amaral Peixoto,\ninterventor no estado do Rio de Janeiro de 1937 a 1945, governador desse\nestado de 1951 a 1955, presidente nacional do Partido Social Democrático\n(PSD) de 1952 a 1965, deputado federal de 1963 a 1971 e senador de 1971\na 1987. Celina se tornaria mais tarde fundadora e diretora do Centro de\nPesquisa e Documentação de História Contemporânea (Cpdoc) da FGV, e\ndiretora do Arquivo Nacional.\n\nEm 1970 participou dos trabalhos de levantamento das condições\nhabitacionais nos núcleos populacionais da Cidade de Deus e da Cidade\nAlta, no Rio de Janeiro, realizados pelo Centro Nacional de Pesquisas\nHabitacionais. No final desse ano seguiu para Paris, onde cursou a École\nPratique des Hautes Études.\n\nRetornando ao Brasil em 1973, elegeu-se em novembro do ano seguinte\ndeputado federal pelo estado do Rio de Janeiro na legenda do Movimento\nDemocrático Brasileiro (MDB), partido de oposição ao regime militar.\nBeneficiado pelo prestígio do senador Amaral Peixoto e pela expressiva\nvotação então obtida pelo MDB, assumiu seu mandato na Câmara em\nfevereiro de 1975, um mês antes da fusão dos estados do Rio e da\nGuanabara. Durante a legislatura, foi vice-presidente da Comissão\nParlamentar de Inquérito (CPI) das Multinacionais, membro da Comissão de\nEconomia, Indústria e Comércio e suplente da Comissão de Agricultura e\nPolítica Rural.\n\nNa prefeitura de Niterói\n\nEm novembro de 1976, sempre na legenda do MDB, elegeu-se prefeito de\nNiterói. Renunciando ao seu mandato na Câmara, assumiu o novo cargo em\njaneiro de 1977, em substituição ao engenheiro Ronaldo Fabrício. Em sua\ngestão, através da integração das atividades das secretarias municipais,\nda Fundação de Atividades Culturais, da Legião Brasileira de Assistência\n(LBA) e do Movimento Brasileiro de Alfabetização (Mobral), implantou os\nprogramas Pró-Bairro, Pró-Samba e Pró-Lazer, a partir dos quais foram\nformados conselhos comunitários e núcleos assistenciais com a finalidade\nde colher e atender diretamente as reivindicações da população. Ainda no\ncampo assistencial, lançou o programa de implantação de creches,\ninaugurando novas unidades em diversos bairros, e o programa de\nalimentação dirigido ao trabalhador municipal. Desburocratizou e\nreativou o Instituto de Benefícios e Assistência aos Servidores\nMunicipais (IBASM) e elaborou o Projeto Patamares Equipados para\nurbanizar e melhorar as condições de salubridade das favelas.\n\nNo setor de urbanização, remodelou o campo de São Bento, criou o novo\nhorto municipal e recuperou o antigo – transformando-o no parque\nmetropolitano do Barreto –, restaurou o parque da cidade do morro da\nViração e reurbanizou o mirante da Boa Viagem. Além disso, pavimentou o\nprimeiro trecho da rodovia litorânea ligando o bairro do Gragoatá à\npraia das Flechas e concluiu o túnel Raul Veiga. Em convênio com o\nMinistério dos Transportes abriu a estrada de Maceió e iniciou as obras\nda estrada do Engenho do Mato, em Itaipu. Para a execução dessas obras\ncriou a Companhia de Desenvolvimento de Niterói (Codesan), empresa de\neconomia mista com autonomia administrativa e financeira. Por último\nfirmou convênio com o Ministério do Interior para a construção da praça\ndo Trabalhador.\n\nNo setor do ensino e da cultura, ampliou o número de escolas da rede\nmunicipal, incrementou a Fundação de Atividades Culturais, implantou a\nhemeroteca do estado do Rio de Janeiro e a biblioteca Lacerda Nogueira\nna antiga Câmara Municipal. Através do Projeto Sítios Históricos,\nreformou o Teatro Municipal, desapropriou a antiga residência de Norival\nde Freitas para nela instalar a cinemateca municipal e realizou obras de\nrestauração das igrejas de São Francisco e de São Domingos.\n\nEm todo esse período, não deixou de estar atento aos acontecimentos\npolíticos que se desenrolaram no Congresso e no âmbito de seu partido.\nAssim, quando o presidente Ernesto Geisel (1974-1979) decretou em 1977 a\nsérie de medidas restritivas que se tornou conhecida como “pacote de\nabril”, gerando grande impacto na opinião pública e acentuado pessimismo\nnos meios políticos, mormente nas fileiras do MDB, insistiu na retomada\ndo diálogo com o governo, defendendo a necessidade da reorganização\npartidária, pois, conforme declarou ao *Jornal do Brasil* (2/5/1977),\n“já considerava esgotadas no país todas as expectativas do\nbipartidarismo”.\n\nEm meados de 1978, acirrou-se dentro do MDB a disputa entre as correntes\nlideradas, de um lado, pelo senador Ernâni Amaral Peixoto – que\ncontrolava o partido no interior do estado – e, de outro, pelo\nex-governador do extinto estado da Guanabara, Antônio de Pádua Chagas\nFreitas – principal líder da agremiação na capital. O conflito entre\n“amaralistas” e “chaguistas”, iniciado logo após a fusão dos dois\nestados, agravou-se quando a chapa composta pela comissão executiva do\npartido para as eleições de novembro de 1978 excluiu candidatos que, por\nacordo das duas lideranças, o senador Amaral Peixoto teria o direito de\nindicar. Moreira Franco, através da imprensa, criticou a atitude do\npartido, lamentando que uma agremiação “que propugnara pelos direitos\nhumanos, pelo estabelecimento do estado de direito e pela democracia,\npassasse a ter aquele comportamento”.\n\nNesse mesmo ano, quando a Frente Nacional de Redemocratização lançou a\ncandidatura do general Euler Bentes Monteiro à presidência da República,\ne a convenção nacional do MDB oficialmente o indicou em agosto, Moreira\nFranco chamou a atenção para o fato de que a transição do governo\nautoritário para um regime democrático estável não poderia ser\nassegurada pelos compromissos do presidente da República, e sim pelos\nmétodos adotados no processo de redemocratização, que seriam\nresponsáveis pelo estreitamento ou alargamento das conquistas\ndemocráticas. Em setembro, um colégio eleitoral de maioria chaguista\nelegeu indiretamente Chagas Freitas governador do Rio de Janeiro e\nAmaral Peixoto senador.\n\nEm fevereiro de 1979, divergindo da direção nacional do MDB, Moreira\nFranco voltou a afirmar a necessidade da reformulação partidária, que\npara ele deveria ser tratada antes mesmo da anistia aos presos políticos\ne da convocação de uma assembleia constituinte. Ao fazer um balanço\ncrítico dos quatro anos de fusão dos estados da Guanabara e do Rio de\nJaneiro, registrou, em entrevista ao *Jornal do Brasil* (9/9/1979), a\nperda do poder político de Niterói, a queda no movimento dos negócios e\na manutenção das diferenças de vencimentos entre os funcionários do\nantigo estado do Rio de Janeiro e os do antigo estado da Guanabara.\n\nCom a extinção do bipartidarismo em 29 de novembro de 1979 e a\nconsequente reformulação partidária, acompanhando o senador Amaral\nPeixoto, filiou-se no início de 1980 ao Partido Democrático Social\n(PDS), de apoio ao governo. Na ocasião, manifestando-se confiante no\nprojeto de abertura reiteradamente afirmado pelo presidente João Batista\nFigueiredo (1979-1985), declarou ao *Jornal do Brasil* (28/1/1980) seu\nempenho em lutar para que o novo partido “encaminhasse a transição\npacífica do autoritarismo para a legalidade democrática, incorporando\ntudo o que havia de novo na sociedade brasileira”.\n\nAinda em janeiro de 1980, no fórum de debates promovido pela Ordem dos\nAdvogados do Brasil (OAB), defendeu a emenda constitucional referente às\nprerrogativas do Legislativo, em discussão no Congresso Nacional,\nsugerindo que paralelamente se discutissem e promovessem reformas de\ncunho social para que se confirmasse de modo efetivo o estado de direito\ndemocrático no país.\n\nAs campanhas de 1982 e 1986\n\nCom a aprovação em setembro de 1980 da emenda constitucional do deputado\npedessista por Goiás Anísio de Sousa, prorrogando por dois anos o\nmandato dos prefeitos e vereadores, Moreira Franco teve sua gestão em\nNiterói estendida até janeiro de 1983. No entanto, em maio de 1982\ndesincompatibilizou-se do cargo de prefeito para candidatar-se pelo PDS\nao governo do estado do Rio nas eleições de novembro – as primeiras\neleições diretas para governador após 17 anos –, passando a prefeitura\nde Niterói ao vice-prefeito Armando Barcelos, do Partido Trabalhista\nBrasileiro (PTB).\n\nEm sua campanha, Moreira Franco apregoou seu passado oposicionista na\nluta pelo restabelecimento da democracia no país e criticou a política\neconômica do ministro do Planejamento, Antônio Delfim Neto, insistindo\nna confiança que depositava no projeto político de abertura do\npresidente Figueiredo. Em uma duríssima disputa, obteve 30% da\npreferência do eleitorado, perdendo para Leonel Brizola, do Partido\nDemocrático Trabalhista (PDT), que recebeu 34% dos votos. O candidato da\nmaior facção oposicionista do país, o Partido do Movimento Democrático\nBrasileiro (PMDB), deputado Miro Teixeira, ficou em terceiro lugar, com\n21%, a ex-deputada Sandra Cavalcanti, do PTB, em quarto, com 10%, e\nLisânias Maciel, do Partido dos Trabalhadores (PT), em último lugar, com\n3%.\n\nEntre 1983 e 1984, Moreira Franco ocupou a presidência da Editora Nova\nAguilar, ligada ao grupo da Editora Nova Fronteira, de propriedade da\nfamília de Carlos Lacerda. Em entrevista ao *Jornal do Brasil* em junho\nde 1984, defendeu a convocação de uma assembleia constituinte para\npromover as reformas de que o país necessitava.\n\nComo presidente regional do PDS, declarou-se favorável ao\nrestabelecimento das eleições diretas para presidente da República,\nvindo a integrar o “Núcleo pela Direta” do partido. Apresentada na\nCâmara pelo deputado Dante de Oliveira, do PMDB, a proposta não teve,\nporém, o número de votos necessários para ser enviada ao Senado Federal\ne foi rejeitada em 25 de abril de 1984. Assim, a sucessão de Figueiredo\nficou para ser decidida por um colégio eleitoral a ser reunido no início\ndo ano seguinte.\n\nDeflagrado processo sucessório, na escolha do candidato do PDS Moreira\nFranco declarou apoio ao vice-presidente Aureliano Chaves. Na época, a\nindicação era também pleiteada pelo ex-governador de São Paulo e\ndeputado federal Paulo Maluf, pelo ministro do Interior, Mário\nAndreazza, e pelo senador Marco Maciel. Numa tentativa de impedir o\navanço de Maluf, o presidente nacional do PDS, José Sarney, decidiu\nconvocar uma eleição antes da convenção partidária. O grupo liderado por\nAureliano Chaves pressionou então o presidente Figueiredo para que\naprovasse a convocação das prévias. Como Maluf conseguiu impedir a\nconsulta aos filiados, os partidários de Aureliano decidiram formar um\ngrupo dissidente que ficou conhecido como Frente Liberal. Quando da\nconvenção do partido em agosto de 1984, somente as candidaturas de\nAndreazza e de Maluf haviam sobrevivido à disputa. Com o apoio da\nmáquina partidária, o ex-governador paulista foi então indicado como o\ncandidato governista.\n\nNo mesmo período, Moreira Franco deixou a presidência do PDS fluminense\ne passou a integrar a direção nacional da Frente Liberal. Juntamente com\nTales Ramalho, tornou-se um interlocutor entre a dissidência pedessista\ne o ex-governador de Minas Gerais Tancredo Neves, lançado candidato pelo\nPMDB. A união da frente com os peemedebistas deu origem à Aliança\nDemocrática, ficando Moreira encarregado da campanha de Tancredo no Rio.\n\nTancredo Neves foi eleito pelo Colégio Eleitoral de 15 de janeiro de\n1985 com uma expressiva diferença sobre Maluf, mas não chegou a assumir\na presidência. Internado com uma grave doença horas antes de sua posse,\nmarcada para o dia 15 de março, foi substituído pelo vice José Sarney,\nque foi efetivado no cargo após seu falecimento em 21 de abril.\n\nEmbora desligado do PDS desde dezembro de 1984, Moreira não acompanhou\nos dissidentes na fundação do Partido da Frente Liberal (PFL). Ainda em\nmarço de 1985, apesar de a agremiação estar sob o comando dos\n“chaguistas”, optou por ingressar no PMDB de Niterói, com o apoio das\nbases remanescentes do tempo em que Amaral Peixoto comandava o MDB\nfluminense. No ano seguinte, já como primeiro-secretário da executiva\nregional do partido, apresentou-se como candidato natural ao governo do\nestado. Apesar das restrições a seu nome de parte da “esquerda\nindependente” do PMDB, liderada pelo jornalista Artur da Távola,\nderrotou, por uma diferença de 26 votos, a pré-candidatura do senador\nNélson Carneiro na convenção regional de agosto de 1986.\n\nPara enfrentar o candidato de Brizola, o vice-governador Darci Ribeiro,\nMoreira costurou uma frente política, a Aliança Popular e Democrática,\nagrupando, num amplo espectro ideológico 12 partidos, entre eles PMDB,\nPFL, PTB, PDS, Partido Comunista Brasileiro (PCB), Partido Comunista do\nBrasil (PCdoB), Partido Democrata Cristão (PDC) e Partido Trabalhista\nRenovador (PTR). Durante a campanha, utilizando o *slogan* “O nome dele\né trabalho”, prometeu que acabaria com a violência em apenas seis meses.\nApesar das dificuldades de relacionamento com Sarney, utilizou como\nbandeira eleitoral o sucesso do Plano Cruzado no combate à inflação. Em\n15 de novembro de 1986, Moreira foi eleito governador com 3.049.776\nvotos (44,5%), enquanto Darci Ribeiro recebeu 2.216.177 (32,3%). Nessas\neleições, o Plano Cruzado ajudou o PMDB a conquistar 22 governos\nestaduais e 53% das cadeiras do Congresso Constituinte.\n\nNo governo do Rio de Janeiro\n\nEm 15 de março de 1987 Moreira Franco tomou posse como governador do Rio\nde Janeiro, contando com um secretariado de distintas orientações\npolíticas, mas de reconhecida competência técnica em suas áreas de\natuação. O novo governador insistiu em estabelecer um contraste com o\nestilo administrativo de seu antecessor, nomeando a princípio quadros\ntécnicos e promovendo prestações de contas. Seus primeiros decretos\nanularam todas as contratações, transformações de cargos e nomeações de\nfuncionários feitas por Brizola desde junho de 1986. Destinou ao PFL a\nmaioria dos cargos econômicos e ao PMDB a maior parte das secretarias da\nárea social. Foram extintas cinco pastas e criadas duas, entre elas a\nSecretaria de Desenvolvimento Urbano, que concentrou a maioria dos\nrecursos.\n\nDurante sua gestão, Moreira enfrentou sérias dificuldades econômicas e\nfinanceiras, ocasionadas principalmente pela instabilidade da moeda e\npelas altas taxas de inflação. Em decorrência da crise, o estado sofreu\ncom a queda na arrecadação de impostos, o adiamento dos investimentos\nprivados e o aumento da dívida pública interna. Além disso, a quase\ntotalidade da arrecadação tributária esteve comprometida com os gastos\ncom o funcionalismo estadual.\n\nUm dos principais projetos apresentados pelo governo para a recuperação\neconômica do estado foi a criação de um polo petroquímico em Itaguaí,\ncom um potencial para gerar 30 mil empregos. Com esse objetivo, logo nos\nprimeiros dias do governo Moreira foi criada a Companhia do Polo\nPetroquímico do Rio de Janeiro. Incluído no Programa Nacional de\nPetroquímica, aprovado por Sarney em novembro de 1988, o estabelecimento\ndo polo petroquímico foi objeto de sérias controvérsias entre os\ngovernos estadual e federal. Em janeiro de 1989, o ministro da Indústria\ne Comércio, Roberto Cardoso Alves, aprovou a transferência de uma\nfábrica de polipropileno, inicialmente prevista para ser instalada no\nRio, para Capuava, em São Paulo. Moreira Franco recorreu da decisão ao\nSuperior Tribunal de Justiça (STJ). Enquanto aguardava a manifestação\njudicial, Sarney lançou em abril a pedra fundamental do polo de Itaguaí.\nApós uma série de desentendimentos entre Moreira e Cardoso Alves, o\nprojeto do governo fluminense seria definitivamente sepultado em\nfevereiro de 1990, com a autorização dada pelo governo federal para a\nampliação do polo de Triunfo, no Rio Grande do Sul.\n\nApesar das dificuldades, Moreira conseguiu reduzir em 75% a dívida\nexterna do estado. Os débitos internos foram renegociados com a União,\nmas a dívida cresceu em decorrência do programa de saneamento financeiro\ndo Banco do Estado do Rio de Janeiro (Banerj).\n\nNa área de abastecimento, Moreira colocou em funcionamento três projetos\nde complementação alimentar, os “sacolões”, com o objetivo de ofertar,\npara as populações de baixa renda, produtos hortigranjeiros a preços\nmais baixos que os do mercado. Foi também estabelecida uma nova política\nagrícola, com o fim da cobrança do Imposto sobre Circulação de\nMercadorias e Serviços (ICMS) dos produtos hortigranjeiros e com a\ncriação da “moeda produto”, permitindo aos produtores o pagamento de\nsuas dívidas com as próprias mercadorias.\n\nNo plano político-administrativo, a aliança eleitoral que elegera\nMoreira não se manteve, e a composição do secretariado foi sendo\nconstantemente modificada, segundo as necessidades políticas do governo.\nAlém disso, o governo enfrentou várias greves e movimentos\nreivindicatórios de servidores públicos, principalmente nos setores de\nsaúde e educação. O gatilho salarial, mecanismo de recomposição mensal\ndas perdas salariais causadas pela inflação, foi extinto em maio de\n1987, e elaboraram-se planos de reclassificação de cargos para médicos e\nprofessores, para as polícias civil e militar e também para os\nserventuários da Justiça, atingindo, segundo dados da Secretaria de\nFazenda, 70% do funcionalismo. Em junho de 1988 foi estabelecida uma\nnova política salarial para o setor, através da indexação da folha de\npagamento dos servidores à arrecadação líquida dos tributos.\n\nAs obras de saneamento na Baixada Fluminense foram, segundo Moreira, as\nprincipais realizações de seu governo. Ao longo de sua gestão, foram\ninaugurados milhares de quilômetros de rede de água e esgoto e foi\ndragada uma grande extensão de rios e canais.\n\nNo setor de habitação, o maior problema enfrentado foram as constantes\ninvasões de terrenos por famílias de baixa renda. Uma ocupação realizada\nna favela da Rocinha, Zona Sul da capital, em maio de 1988, teve na\népoca grande repercussão. Alegando que o estado não tinha como assentar\nas famílias invasoras por falta de recursos para desapropriações, o\ngoverno determinou a retirada das famílias pela polícia, o que provocou\num conflito de graves proporções. A solução para o problema veio através\nda Coordenadoria de Desenvolvimento Social, que criou um programa\nemergencial de assistência à Rocinha.\n\nNa educação, promoveu-se a descentralização do ensino e a realização de\neleições diretas para diretor em todas as escolas públicas do estado. No\nentanto, o suposto abandono dos Centros Integrados de Educação Pública\n(CIEPs), criados por Brizola, foi objeto de severas críticas por parte\ndos adversários de Moreira. Ao longo de sua gestão os professores\nestiveram constantemente em greve, com vários deles abandonando a\nprofissão por causa dos baixos salários.\n\nA expansão do metrô carioca para os bairros da Pavuna e Copacabana foi a\nprincipal promessa de Moreira Franco para o setor de transportes. O\nprojeto acabou adiado por razões econômicas, e somente em julho de 1988,\nquando foi inaugurada a estação de Triagem, foram iniciadas as obras na\nZona Sul da cidade. Em setembro de 1990, criticado por ter iniciado a\nconstrução sem a garantia de verbas, Moreira assinou a confissão da\ndívida de 150 milhões de dólares com sete empreiteiras responsáveis pela\nexpansão do metrô, ficando o débito para seu sucessor. Responsabilizando\no governo federal pela falta de financiamento para a conclusão das\nobras, Moreira também não conseguiu viabilizar o projeto de duplicação\nda avenida Brasil, principal via de acesso à cidade do Rio de Janeiro.\n\nNo curso de sua administração, foram constantes as denúncias de\nirregularidades em processos de licitação no Departamento Estadual de\nTrânsito (Detran), bem como de envolvimento de funcionários do órgão com\na venda de carteiras de motorista. Também no setor de transportes,\nMoreira determinou a devolução aos antigos donos de 16 empresas de\nônibus que haviam sido encampadas por Brizola. No final de sua gestão,\ndecidiu ainda extinguir a Companhia de Transportes Coletivos (CTC),\ncolocando em disponibilidade cerca de 3.800 funcionários e leiloando a\nfrota de 434 ônibus.\n\nEm relação à segurança pública, o desempenho de Moreira foi cercado de\numa grande expectativa, já que havia prometido solucionar o problema em\napenas seis meses. Os índices de violência no estado continuaram\nassustadores, com o ressurgimento do “esquadrão da morte” e notícias\ndiárias sobre chacinas, principalmente nas regiões de Niterói, São\nGonçalo e Baixada Fluminense. A guerra entre traficantes pelo controle\ndos pontos de venda de drogas e o aumento dos sequestros também foram\namplamente divulgados pela imprensa.\n\nAo completar dois anos de governo, Moreira anunciou a recuperação de\nseiscentas vagas em presídios, bem como a informatização e o\nreaparelhamento das polícias civil e militar. No início de abril de\n1989, contudo, a criminalidade registrou um crescimento, com um total de\n125 assassinatos em seis dias, alguns dos quais com marcas do “esquadrão\nda morte”. No ano seguinte, ocorreu um sensível aumento dos casos de\nsequestro, e o governo do estado decidiu instituir uma recompensa para\nquem fornecesse pistas sobre os criminosos. Na época, um integrante da\nequipe pessoal do governador chegou a ser acusado de integrar uma das\nquadrilhas de sequestradores. Ao justificar o não cumprimento de sua\nprincipal promessa de campanha, Moreira afirmou “que a cumplicidade com\no crime organizado no Rio era muito mais profunda do que se supunha”,\natribuindo a explosão de violência ao recrudescimento da crise social.\n\nConstituinte, PMDB e eleições\n\nNo período em que foi governador, Moreira Franco consolidou sua\nliderança nos níveis regional e nacional do PMDB. Durante os trabalhos\ndo Congresso Constituinte (1987-1988), definiu-se como um\nsocial-democrata e defendeu a manutenção do sistema presidencialista.\nAfirmou também ser favorável à possibilidade de reeleição para os\nocupantes de cargos executivos e à eleição em dois turnos.\n\nNa convenção nacional do PMDB de julho de 1987, os governadores do\npartido estabeleceram-se como força política. Três meses depois, Moreira\narticulou um novo encontro entre eles para debater assuntos como a\nreforma tributária, o sistema de governo e a conjuntura política\nnacional. Através da “Carta do Rio de Janeiro”, os governadores\nmanifestaram apoio explícito ao mandato de cinco anos para Sarney e\ndefenderam a manutenção do presidencialismo. Em novembro, no entanto,\njuntamente com os governadores de São Paulo, Rio Grande do Sul,\nPernambuco e Bahia, Moreira declarou que iria lutar por eleições diretas\nem 1988, considerando superado o documento de apoio ao presidente diante\nda gravidade da conjuntura nacional. Ainda que declarasse não acreditar\nque sofreria retaliações por ter apoiado um mandato de quatro anos para\nSarney, posteriormente afirmaria que, em consequência de seu\nposicionamento, o governo federal boicotou o estado do Rio no repasse de\nverbas federais.\n\nNo início de 1988, Moreira buscou reorganizar o PMDB do Rio promovendo\nfiliações em massa para acabar com os diretórios zonais, que eram, em\nsua grande maioria, cartoriais. Em meados desse ano, entretanto, ocorreu\numa reacomodação do quadro partidário, com a transferência de vários\ndeputados estaduais peemedebistas para o Partido da Social Democracia\nBrasileira (PSDB), uma dissidência do PMDB. Além disso, dos 13 deputados\nfederais eleitos pelo partido no estado em 1986 sete pediram\ndesligamento. Com isso, o PMDB do Rio chegou bastante enfraquecido à\nconvenção de agosto de 1988, na qual José Colagrossi foi indicado para\nrepresentar o partido na eleição para a prefeitura da capital. Embora\ntivesse recebido o apoio do PFL, Colagrossi não conseguiu unir os\npeemedebistas em torno de seu nome, e as principais lideranças do\npartido estiveram ausentes da campanha. Assim, em 15 de novembro de\n1988, o candidato do PMDB obteve apenas o quinto lugar na disputa,\ndecidida em favor de Marcelo Alencar, do PDT.\n\nDurante a campanha presidencial do ano seguinte, Moreira defendeu a\nunidade do PMDB em torno da chapa do partido, formada pelo deputado\nUlisses Guimarães e pelo governador da Bahia, Valdir Pires. Com a\nderrota de Ulisses, manifestou apoio no segundo turno à candidatura de\nLuís Inácio Lula da Silva, do PT. Este, no entanto, também não teria\nêxito, sendo derrotado pelo candidato do Partido da Reconstrução\nNacional (PRN), Fernando Collor de Melo, em dezembro de 1989. Collor\ntornou-se o primeiro presidente a ser eleito diretamente desde a eleição\nde Jânio Quadros em 1960.\n\nPara a sucessão de Moreira, a estratégia do PMDB fluminense foi a\nconstituição de uma composição anti-Brizola, tendo a convenção regional\ndo partido referendado a candidatura do senador Nélson Carneiro. Apoiado\npela coligação Aliança Progressista, também integrada por PFL, PTB e\nPDC, Carneiro não foi porém capaz de deter Brizola, que foi reeleito\ngovernador do Rio de Janeiro já no primeiro turno, em outubro de 1990.\n\nDurante seu governo, Moreira Franco manteve um bom relacionamento com a\nAssembleia Legislativa através de seu presidente Gilberto Rodrigues,\ntambém do PMDB, que administrou uma longa trégua com os deputados do\nPDT. Com o apoio da maioria, o governador conseguiu que quase todas as\nmensagens enviadas à Assembleia fossem aprovadas sem grandes\ndificuldades.\n\nControlando o PMDB fluminense\n\nDepois de transmitir o cargo para Brizola em março de 1991, Moreira\nFranco publicou o livro *Moreira – ele governou para todos*, com o que\nconsiderava as principais realizações de sua administração. A publicação\nseria mais tarde objeto de uma ação popular impetrada pelo secretário de\nAdministração de Brizola, Luís Henrique Lima, que acusou o ex-governador\nde autopromoção e de uso indevido de dinheiro público. Condenado em\ntodas as instâncias, Moreira acabaria sendo obrigado a devolver cerca de\nquatrocentos mil reais aos cofres do estado por determinação do Supremo\nTribunal Federal (STF).\n\nEntre 1991 e 1994 Moreira Franco dedicou-se à pesquisa acadêmica e morou\num tempo em Nova Iorque. Nas eleições municipais de 1992, quando César\nMaia foi eleito prefeito da cidade do Rio de Janeiro pelo PMDB, o\npartido elegeu 28 prefeitos no estado, dos quais 15 eram liderados por\nMoreira. Excluído da campanha, Moreira passou então a disputar o\ncontrole do partido com o novo prefeito. A desavença se arrastou até\nfevereiro de 1993, quando, nas eleições para a executiva regional,\nMoreira enfrentou os aliados de César Maia e inviabilizou a candidatura\nde Nélson Carneiro à presidência do partido. Articulando uma chapa única\naprovada por 49 dos 71 membros do diretório, garantiu assim o cargo de\npresidente para Renato Archer. Dois anos depois, César Maia deixaria o\npartido para ingressar no PFL.\n\nEm abril de 1993, durante o plebiscito sobre regime e forma de governo,\nMoreira Franco, que durante o processo constituinte se declarara\npresidencialista, manifestou-se favorável ao parlamentarismo, com\neleição direta do presidente da República e a introdução do voto\ndistrital misto.\n\nComo membro da executiva regional do PMDB desde o início de 1994,\ncomeçou a articular a candidatura presidencial do ex-governador de São\nPaulo Orestes Quércia contra a pré-candidatura do ex-presidente José\nSarney. Favorável à aliança estadual com o PFL, lançou sua própria\ncandidatura à Câmara dos Deputados. Durante a campanha sustentou, apesar\ndas defecções de vários peemedebistas, a manutenção do apoio a Quércia.\nO candidato do partido seria no entanto derrotado na eleição\npresidencial de outubro de 1994, vencida pelo candidato do PSDB,\nFernando Henrique Cardoso.\n\nNa sucessão estadual, a aliança com o PFL não se concretizou, e o\ncandidato peemedebista, o ator Mílton Gonçalves, também foi derrotado.\nNo segundo turno, realizado em novembro, Moreira manifestou apoio a\nMarcelo Alencar, do PSDB, eleito governador após disputa com o pedetista\nAnthony Garotinho.\n\nna relatoria da reforma administrativa\n\nEm outubro de 1994 Moreira foi o candidato a deputado federal mais\nvotado do PMDB fluminense, obtendo aproximadamente 85 mil votos. Devido\na suspeitas de fraudes na apuração dos resultados, a eleição\nproporcional foi anulada pelo Tribunal Regional Eleitoral (TRE).\nRealizado novo pleito em novembro, Moreira confirmou sua eleição e o\nprimeiro lugar entre os peemedebistas, com 76.315 votos, em sua maioria\noriundos de sua base eleitoral na capital do estado. Empossado em\nfevereiro de 1995, foi eleito presidente da Comissão de Viação e\nTransportes da Câmara dos Deputados.\n\nTrês meses depois, consolidou sua liderança no diretório regional do\nPMDB ao ser indicado para a presidência do partido. Sua chapa conquistou\ncerca de 80% dos votos dos convencionais.\n\nNas votações das emendas constitucionais propostas ao longo de 1995 pelo\ngoverno Fernando Henrique Cardoso (1995-1998), votou a favor da abertura\nda navegação de cabotagem às embarcações estrangeiras; da revisão do\nconceito de empresa nacional; da abolição do monopólio estatal nas\ntelecomunicações, na exploração do petróleo e na distribuição do gás\ncanalizado pelos governos estaduais; e da prorrogação do Fundo de\nEstabilização Fiscal (FEF), antigo Fundo Social de Emergência (FSE),\ncriado na legislatura anterior como fonte de financiamento para o plano\nde estabilização econômica do governo (Plano Real).\n\nEm junho de 1996, a Comissão de Constituição e Justiça da Câmara negou o\npedido de licença solicitada pelo STF para processar Moreira Franco em\ndecorrência da publicação do livro *Moreira* – *ele governou para\ntodos*. Continuando a exercer normalmente seu mandato, no mês seguinte\nMoreira votou favoravelmente à criação da Contribuição Provisória sobre\nMovimentação Financeira (CPMF), antigo Imposto Provisório sobre\nMovimentação Financeira (IPMF), com a qual o ministro da Saúde, Adib\nJatene, pretendia aumentar os recursos destinados ao setor. Ainda em\n1996, foi indicado membro da Comissão de Viação e Transportes, a qual\nintegraria até o fim do mandato.\n\nEm 17 de fevereiro de 1997, Moreira foi reempossado como deputado\nfederal, em virtude da decisão do Tribunal Superior Eleitoral (TSE) de\ndiplomar novamente a bancada do Rio de Janeiro de acordo com o resultado\nda eleição de outubro de 1994. Alegando falta de fundamentação nas\ndenúncias de fraude, o tribunal deu ganho de causa aos recursos\nimpetrados pelos candidatos derrotados na primeira eleição e decidiu\nanular o pleito de novembro. Ainda em fevereiro, Moreira votou\nfavoravelmente à emenda que instituiu a possibilidade de reeleição para\nprefeitos, governadores de estado e presidente da República. Uma das\nprincipais lideranças da bancada governista, o ex-governador teve uma\natuação destacada nas articulações para a aprovação do projeto.\n\nAo longo da legislatura 1995-1999, a principal atribuição de Moreira\nFranco foi a de relator da proposta de reforma administrativa enviada ao\nCongresso pelo governo federal. Elaborado pelo ministro da\nAdministração, Luís Carlos Bresser Pereira, o projeto estabelecia, entre\noutros pontos, o fim da estabilidade no serviço público por excesso de\nquadros ou por insuficiência de desempenho e a criação de um teto\nsalarial para o setor baseado nos vencimentos do presidente da República\n(o teto, porém, poderia ser ultrapassado em até 35%, com a incorporação\nde vantagens e gratificações recebidas pelos servidores).\n\nTendo assumindo a relatoria do projeto em novembro de 1995, Moreira fez\nalgumas modificações na proposta original. Embora fosse um dos\nprincipais aliados do governo na Câmara, rejeitou a demissão por excesso\nde quadros e atrelou o fim da estabilidade à execução do preceito\nconstitucional que limitava os gastos com a folha de pagamentos a 60% da\narrecadação do Estado. De acordo com seu parecer, apenas quando esse\nlimite fosse ultrapassado é que se poderia recorrer à demissão. Nesses\ncasos, as dispensas deveriam ser iniciadas com o corte de pelo menos 20%\ndos cargos comissionados e, em seguida, com as demissões dos\nfuncionários não estáveis. Se ainda assim a exigência não fosse\natendida, estaria autorizada a dispensa dos demais.\n\nApesar dessas restrições, Moreira manteve em seu relatório a\npossibilidade de demissão por insuficiência de desempenho e propôs a\navaliação permanente dos servidores. Além disso, o parecer proibia o\nrepasse de recursos da União para os estados e municípios que não se\nadequassem ao limite de 60% da receita para os gastos com pessoal e\nvedava a acumulação de cargos no funcionalismo público (exceto médicos e\nprofessores), bem como a incorporação de gratificações aos vencimentos\ndos aposentados. Como limite salarial para o setor, incluindo todas as\ngratificações recebidas pelos servidores, Moreira sugeriu o salário dos\nministros do STF.\n\nO substitutivo, apresentado em julho de 1996 à comissão especial da\nCâmara encarregada de analisar a reforma, foi objeto de várias críticas,\ntanto da oposição quanto das lideranças governistas. Segundo os\npartidários do governo, Moreira havia “engessado” a quebra da\nestabilidade com a não inclusão do critério de excesso de quadros e com\na adoção de limites excessivos para as demissões. Para a oposição, a\npossibilidade de dispensa por mau desempenho iria subordinar a\nadministração pública aos interesses dos mandatários do poder, abrindo\ncaminho para perseguições políticas aos servidores.\n\nApesar das resistências e após exaustivas negociações com o governo, no\ndia 16 de outubro o parecer foi aprovado pela comissão, com 18 votos\nfavoráveis e 11 contrários. A novidade foi a proposta de divisão do\nfuncionalismo público em duas categorias: uma, formada pelas funções\ntípicas de Estado (militares, promotores, magistrados, diplomatas e\nfiscais); a outra pelo restante dos servidores, ficando a estabilidade\ngarantida apenas para a primeira. Essa proposta, no entanto, seria mais\ntarde derrubada pela oposição juntamente com o artigo que proibia a\nincorporação de gratificações aos vencimentos dos aposentados.\n\nNo dia 9 de abril de 1997, o substitutivo de Moreira foi ratificado pelo\nplenário da Câmara em primeiro turno, com 309 votos a favor (um a mais\ndo que o necessário), 147 contra e 18 abstenções. Em novembro seguinte,\ndepois de mais de dois anos de tramitação, a reforma administrativa foi\nfinalmente aprovada pela maioria dos deputados, por 351 votos a 133. Na\népoca, a revista *Veja* revelou que a segunda esposa de Moreira, Ana\nClara Vasconcelos Torres, funcionária concursada do Senado, realizava as\ntarefas na própria residência do casal, no Rio de Janeiro e não no local\nde trabalho, em Brasília. Criticando o mau uso do dinheiro público, a\nrevista chamava a atenção para o fato de o privilégio ter sido garantido\njustamente por influência do relator da reforma administrativa. Após ter\nsido aprovado pela Câmara, o projeto do governo foi ratificado pelo\nSenado em março de 1998 e promulgado pelo presidente da República em\nmaio seguinte.\n\nAs eleições de 1998 e a Assessoria da Presidência\n\nTendo em vista as eleições de outubro de 1998, o PMDB negociou uma\naliança com o PSDB visando à sucessão de Marcelo Alencar no governo do\nRio de Janeiro. Pelo acordo, os peessedebistas ficaram com a candidatura\nao governo do estado e o PMDB com a candidatura ao Senado. Para o\nprimeiro cargo, o escolhido foi o ex-secretário estadual de Obras e\nvice-governador Luís Paulo Correia da Rocha, cabendo a Moreira Franco a\nindicação para o Senado.\n\nTendo como suplente o ex-deputado federal Cândido Mendes, Moreira\ndefendeu, ao longo da campanha, a continuidade das reformas\nconstitucionais, procurando ressaltar suas ligações políticas com\nFernando Henrique Cardoso, candidato à reeleição para a presidência da\nRepública. Apesar disso, disputou o apoio do presidente com o deputado\nfederal Roberto Campos, candidato ao Senado pela coligação do Partido\nProgressista Brasileiro (PPB) com o PFL, partidos que integravam a chapa\nde Fernando Henrique.\n\nMoreira Franco liderou as pesquisas de opinião desde o início do\nprocesso eleitoral. Em fins de agosto, no entanto, foi ultrapassado pelo\ncandidato do PSB, Saturnino Braga, também apoiado pelo PT e o PDT. Além\ndo crescimento da esquerda, o ex-governador teve de conciliar\ndivergências em sua própria base política. Em setembro, descontente com\na propaganda eleitoral de Moreira, o PSDB ameaçou romper a coligação,\nafirmando que o candidato não estava fazendo campanha para Luís Paulo\nCorreia da Rocha. Procurando superar o problema, Moreira apressou-se em\nnegar as acusações e declarou sua lealdade ao candidato peessedebista.\nEmbora o problema tivesse sido contornado, os resultados das pesquisas\neleitorais continuavam nada animadores, apontando, ainda em setembro, o\ncrescimento das candidaturas de Saturnino e Roberto Campos e a queda de\nMoreira para o terceiro lugar.\n\nEm outubro de 1998, Saturnino Braga confirmou o favoritismo e foi eleito\nsenador com 38,10% dos votos válidos. Roberto Campos veio em seguida,\ncom 33,07%, e Moreira Franco obteve a terceira colocação, com apenas\n14,78% dos votos. Na ocasião, Fernando Henrique Cardoso reelegeu-se\npresidente da República com 53,06% dos votos válidos. Quanto à sucessão\nestadual, Luís Paulo Correia da Rocha também não foi bem-sucedido,\nrecebendo 15,51% dos votos e ficando em terceiro lugar. Como nenhum dos\ncandidatos obteve a maioria absoluta dos votos, a eleição do novo\ngovernador fluminense ficou para ser decidida no segundo turno entre\nAnthony Garotinho, do PDT, e César Maia, do PFL. Realizada em novembro,\na eleição teve como vencedor o candidato pedetista.\n\nNo mesmo período, ainda como deputado federal, Moreira Franco votou\nfavoravelmente aos destaques da reforma da previdência que propunham o\nestabelecimento de um teto para as aposentadorias dos funcionários\npúblicos e a adoção dos critérios de idade mínima e de tempo de\ncontribuição para a concessão de aposentadorias no setor privado. Deixou\na Câmara em janeiro de 1999, ao fim de seu mandato.\n\nAinda em março de 1999, Fernando Henrique Cardoso nomeou-o assessor\nespecial da Presidência da República. Sem função específica no Planalto,\nMoreira fez parte da cota pessoal de FHC, que o considerava um excelente\nestrategista político. Em entrevista ao jornal *Folha de S.Paulo*\n(19/8/2001), o próprio Moreira assim definiu seu trabalho junto ao\npresidente: “Converso, cuido de projetos, discordo, polemizo, articulo e\nàs vezes sou bombeiro”.\n\nEm maio de 2001, com a saída de Fernando Bezerra do Ministério da\nIntegração Nacional, Moreira foi um dos políticos do PMDB cotados para\nassumir a pasta. No mês de julho, em meio às articulações com vistas às\neleições presidenciais do ano seguinte, defendeu a reedição da aliança\nentre o PSDB e o PFL, que elegera FHC para dois mandatos consecutivos,\nalém da entrada do PMDB no bloco, a despeito da decisão da seção Rio do\npartido, que presidia, de ter candidato próprio. Adversário da\ncandidatura de Itamar Franco (PMDB-MG), que ganhava terreno, opôs-se\ncontudo à tese segundo a qual o partido deveria entregar os cargos no\ngoverno se optasse por lançar o político mineiro na disputa\npresidencial. Classificou a postura como “fisiologismo escrachado” e\nafirmou que a sigla estava se transformando em um “bando”.\n\nEm setembro, após eleger-se presidente da Fundação Ulisses Guimarães,\nvinculada ao PMDB, demitiu-se do cargo de assessor especial da\npresidência da República. Segundo o jornal *Folha de S.Paulo*\n(19/9/2001), Moreira seria peça-chave na desarticulação da candidatura\nde Itamar, patrocinada pelo palácio do Planalto, até a convenção do\npartido marcada para o mês de janeiro de 2002, e teria preferido deixar\no governo, para não ser acusado de servir ao Planalto em detrimento do\npartido. “Minha saída significa romper com a prática do fisiologismo na\nrelação do PMDB com o governo federal”, afirmou Moreira ao mesmo jornal.\n\nDe volta à Câmara\n\nEm 2002, o PMDB desistiu da candidatura própria à presidência da\nRepública e aliou-se ao PSDB em torno da candidatura de José Serra\n(PSDB-SP). Derrotado Serra, que perdeu as eleições para Lula, do PT,\nMoreira Franco defendeu que seu partido ficasse na oposição e “passasse\npor essa experiência”. No mesmo pleito, elegeu-se pela terceira vez\ndeputado federal pelo estado do Rio de Janeiro na legenda peemedebista,\ncom 77.813 votos. Tomou posse em fevereiro de 2003 e foi eleito\nvice-líder do partido na Câmara. Defendeu a não participação no governo\ne, em agosto, votou contra a reforma da previdência.\n\nNas eleições de outubro de 2004, candidatou-se a prefeito de Niterói e\nficou em segundo lugar na disputa, com 22% dos votos, atrás do candidato\ndo PT, Godofredo Pinto, que chegou perto dos 48%, levando a eleição para\no segundo turno. Dias após a divulgação dos resultados, no entanto,\nsurpreendeu a todos anunciando sua desistência da disputa e afirmando\nreconhecer a vitória do adversário. “Não é por conta de uma filigrana\njurídica que obriga o candidato a ter 50% mais um voto que vou expor a\npopulação ao desgaste de mais um mês de campanha”, afirmou na ocasião.\nDiante do inusitado, o TRE do Rio manteve a obrigatoriedade de\nrealização do segundo turno das eleições entre Godofredo e o candidato\nmelhor colocado depois do candidato desistente, o pedetista João\nSampaio. Ainda em 2004, Moreira Franco deixou a presidência do PMDB no\nRio, que exercia desde 1995.\n\nNa Câmara, Moreira foi presidente da Comissão de Finanças e Tributação e\nda Comissão de Viação e Transportes. Foi ainda membro titular da\nComissão de Desenvolvimento Urbano e Interior, da Comissão de Economia,\nIndústria e Comércio, da Comissão de Minas e Energia, da Comissão de\nRelações Exteriores e de Defesa Nacional. Apresentou também propostas de\nemenda constitucional (PECs) proibindo o gasto do governo com\npublicidade e introduzindo o voto facultativo. Propôs ainda o projeto de\nlei que alterava o Estatuto da Criança e do Adolescente, garantindo aos\nirmãos o acesso à mesma escola, e o que estabelecia a obrigatoriedade de\ncomunicação ao Congresso da situação dos imigrantes no Brasil e dos\nemigrantes brasileiros no exterior.\n\nEm julho de 2006, segundo informou o jornal *Folha de S.Paulo*,\nexpoentes da oposição peemedebista, que não aderiram ao governo Lula\ndesde o primeiro instante – entre os quais Moreira se incluía –,\niniciaram um movimento de aproximação com o Planalto. Moreira foi\napontado como um dos que articulavam nos bastidores inclusive a ocupação\nde postos no governo. Em outubro, decidiu não concorrer à reeleição,\nalegando descrença na capacidade da Câmara de promover mudanças.\nComunicou a decisão em carta aos eleitores em que afirmava que\ncontinuaria contribuindo “sempre que chamado. Não preciso de mandato pra\nfazer política”. Em novembro, após três anos de fortes articulações, o\nPMDB entrou oficialmente no governo.\n\nMoreira Franco deixou a Câmara dos Deputados em janeiro de 2007, ao\nfinal da legislatura, e em junho assumiu a vice-presidência dos Fundos\nde Governo e Loterias da Caixa Econômica Federal (CEF), responsáveis,\nentre outras funções, por gerir os recursos do Fundo de Garantia por\nTempo de Serviço (FGTS). Deixou o cargo em julho de 2010, a fim de\nrepresentar o PMDB na coordenação de campanha da candidata do PT, Dilma\nRousseff, à presidência da República. Em troca do apoio político, o PMDB\nnegociou a posse de representantes do partido em ministérios. Com a\neleição de Dilma em outubro de 2010 e iniciado seu governo em janeiro de\n2012, Moreira Franco foi nomeado ministro-chefe da Secretaria de\nAssuntos Estratégicos da Presidência da República. De acordo com o\nPortal G1 (8/12/2010), a nomeação decorreu da proximidade de Moreira\nFranco com Michel Temer, presidente do PMDB e vice-presidente de Dilma.\n\nDivorciado de Celina Amaral Peixoto, com quem teve três filhos, Moreira\ncasou-se com Ana Clara Vasconcelos Torres, filha do político fluminense\nJoão Batista Vasconcelos Torres, deputado federal entre 1959 e 1963 e\nsenador entre 1963 e 1979.\n\nAlém do livro citado, publicou *Integração econômica, social e política\nda América Latina* (1958); *Relatório de pesquisa sobre as condições\nhabitacionais da Cidade de Deus e da Cidade Alta* (1970); *Rio: o nosso\ndesafio* (1982); “A Revolução de 1930” (texto em coautoria com Hélio\nSilva constante de *A century of armed politics in Brazil*); *Diretrizes\nde um governo popular e democrático* (1986); *Em defesa do Rio* (1991);\n*Antes que seja tarde: ainda é tempo de um Brasil menos desigual*\n(2002); e *Sem medo da realidade* (2004).\n\nO arquivo de Moreira Franco encontra-se depositado no Cpdoc da FGV.\n\nSarah Escorel/Luís Otávio de Sousa/André Dantas (atualização)\n\nFONTES: CÂM. DEP. *Deputados brasileiros.* Repertório (1975-1979,\n1995-1999); *Estado de S. Paulo* (11/4, 1/10/1989, 22/12/1995, 24/2,\n13/7, 2/12/1996, 4/4/1997); *Folha de S.Paulo* (19/3, 3, 14/9, 10/11,\n12, 29/12/1987, 15/3, 15/5, 15/6, 12/12/1988, 3/1, 20/3, 26/4,\n6/11/1989, 20/11/1992, 17/11, 8/12/1995, 27/3, 4/7/1996, 13/6,\n10/7/1997, 15/7, 10/10, 11/11/1998, 9/8/1999); *Folha de S.Paulo* (9,\n20, 30/5, 11, 22/7, 19/8, 19/9, 8/11/2001, 20/11, 12/12/2002, 6/8/2003,\n3, 5, 7/10/2004, 2/7, 22/11/2006, 11/6/2007, 13/1/2009); *Globo* (16/6,\n3/9, 20/10/1982, 17/3, 24/6, 5/7, 4, 19/10/1987, 13. 19/6, 1/7, 8/8,\n22/11/1988, 21/1, 11, 19/3, 22/4, 29/6, 14, 29/7, 2/8, 1/10, 2/11/1989,\n20, 25/2, 19/3, 24/6, 11/7/1990, 4/1, 10/3, 28/4/1991, 12, 13, 15/2,\n3/3, 8/6, 6, 10/10/1993, 12/1, 12, 15/7, 2/11/1994, 30/6/1995, 16, 29/2,\n20/3, 5/6, 10, 11/7, 17, 24/10/1996, 5/2, 3, 10, 15, 24/4, 8/6/1997,\n28/4, 17, 26, 27/6, 23/8, 1, 15/9/1998); *Jornal do Brasil* (2/5,\n16/9/1977, 25/6, 1/9/1978, 9/9/1979, 28/1/1980, 4/4, 16/5, 16/6, 4/7,\n4/8/1982, 25/11/1986, 16/3, 13, 23/8, 17/9, 25/11/1987, 7/1, 15, 28/3,\n5/5, 29/6, 9/7, 23/10, 30/12/1988, 8, 31/1, 20/2, 16/3, 3/4, 24/5, 5/9,\n20/10, 1/11/1989, 3/1, 20/2, 21/6, 27/7, 3, 14, 21/8, 20/9/1990,\n31/1/1991, 25/11/1992, 28/4, 11/5, 6/10/1994, 29/5, 12/11, 7/12/1995,\n27/3, 18/10/1996, 27/8, 2, 5, 12, 23/9/1998); Moreira Franco. Disponível\nem: \\<www.moreirafranco.com.br; www.tse.gov.br\\>. Acesso em: 24/8/2011;\nNÉRI, S. *16*; *Olho no Congresso* (31/1/1995, 14/1/1996, 30/1/1997,\n5/2/1998); *Olho no Voto* (29/9/1998); SOARES, E. *Prefeitura*;*Veja*\n(18/3, 7/5, 1/7, 30/9/1987, 26/2, 23/3, 1/6/1988, 11/1/1989, 24/7/1991,\n26/11/1997).\n","ref":"FONTES: CÂM. DEP. *Deputados brasileiros.* Repertório (1975-1979,\n1995-1999); *Estado de S. Paulo* (11/4, 1/10/1989, 22/12/1995, 24/2,\n13/7, 2/12/1996, 4/4/1997); *Folha de S.Paulo* (19/3, 3, 14/9, 10/11,\n12, 29/12/1987, 15/3, 15/5, 15/6, 12/12/1988, 3/1, 20/3, 26/4,\n6/11/1989, 20/11/1992, 17/11, 8/12/1995, 27/3, 4/7/1996, 13/6,\n10/7/1997, 15/7, 10/10, 11/11/1998, 9/8/1999); *Folha de S.Paulo* (9,\n20, 30/5, 11, 22/7, 19/8, 19/9, 8/11/2001, 20/11, 12/12/2002, 6/8/2003,\n3, 5, 7/10/2004, 2/7, 22/11/2006, 11/6/2007, 13/1/2009); *Globo* (16/6,\n3/9, 20/10/1982, 17/3, 24/6, 5/7, 4, 19/10/1987, 13. 19/6, 1/7, 8/8,\n22/11/1988, 21/1, 11, 19/3, 22/4, 29/6, 14, 29/7, 2/8, 1/10, 2/11/1989,\n20, 25/2, 19/3, 24/6, 11/7/1990, 4/1, 10/3, 28/4/1991, 12, 13, 15/2,\n3/3, 8/6, 6, 10/10/1993, 12/1, 12, 15/7, 2/11/1994, 30/6/1995, 16, 29/2,\n20/3, 5/6, 10, 11/7, 17, 24/10/1996, 5/2, 3, 10, 15, 24/4, 8/6/1997,\n28/4, 17, 26, 27/6, 23/8, 1, 15/9/1998); *Jornal do Brasil* (2/5,\n16/9/1977, 25/6, 1/9/1978, 9/9/1979, 28/1/1980, 4/4, 16/5, 16/6, 4/7,\n4/8/1982, 25/11/1986, 16/3, 13, 23/8, 17/9, 25/11/1987, 7/1, 15, 28/3,\n5/5, 29/6, 9/7, 23/10, 30/12/1988, 8, 31/1, 20/2, 16/3, 3/4, 24/5, 5/9,\n20/10, 1/11/1989, 3/1, 20/2, 21/6, 27/7, 3, 14, 21/8, 20/9/1990,\n31/1/1991, 25/11/1992, 28/4, 11/5, 6/10/1994, 29/5, 12/11, 7/12/1995,\n27/3, 18/10/1996, 27/8, 2, 5, 12, 23/9/1998); Moreira Franco. Disponível\nem: \\<www.moreirafranco.com.br; www.tse.gov.br\\>. Acesso em: 24/8/2011;\nNÉRI, S. *16*; *Olho no Congresso* (31/1/1995, 14/1/1996, 30/1/1997,\n5/2/1998); *Olho no Voto* (29/9/1998); SOARES, E. *Prefeitura*;*Veja*\n(18/3, 7/5, 1/7, 30/9/1987, 26/2, 23/3, 1/6/1988, 11/1/1989, 24/7/1991,\n26/11/1997).\n","dic":"DPRRJ"}
