{"title":"FRANKLIN, Virgílio de Almeida Lima","cargoss":["Deputado Estadual"],"cargos_esp":[0],"datas_ini":[1892],"datas_fim":[1897],"estados":["RJ"],"autor":[0],"content":"**FRANKLIN, Virgílio de Almeida Lima**\n\n\\* dep. est. RJ 1892-1897.\n\n*Virgílio de Almeida Lima Franklin* elegeu-se deputado estadual no Rio\nde Janeiro em abril de 1892, após a promulgação da segunda Constituição\ndo estado do Rio de Janeiro.\n\nA primeira Constituição fluminense havia sido elaborada em 1891 pelos\npartidários do então presidente estadual Francisco Portela (1891-1892).\nFoi anulada após a renúncia deste, em dezembro do mesmo ano. No dia 31\nde janeiro de 1892 uma nova eleição foi realizada para compor a nova\nAssembleia constituinte, que foi formada por membros do Partido\nRepublicano Fluminense (PRF), presidida por José Tomás da Porciúncula, e\nque promulgaria, no dia 9 de abril do mesmo ano, a segunda Constituição\nfluminense.\n\nNo dia 24 de abril foram realizadas eleições para a composição da\nAssembleia Legislativa e Virgílio de Almeida Lima Franklin elegeu-se\ndeputado estadual na legenda do PRF. No mesmo pleito José Tomás da\nPorciúncula elegeu-se presidente do estado do Rio de Janeiro\n(1892-1894). Foi sucessivamente eleito membro da Comissão de Instrução\nPública até o final da legislatura, em dezembro de 1894.\n\nEm 20 de maio 1895 foi reeleito deputado estadual na chapa do PRF pelo\nterceiro distrito eleitoral, com sede em Cantagalo (RJ). Até o final do\nseu segundo mandato, em dezembro de 1897, integrou a Comissão de\nInstrução Pública.\n\n*Samuel Silva Rodrigues de Oliveira*\n\nFONTES: ASSEMB. LEGISL. RJ. *Anais*(14/11/1892-12/1/1893, 1/3-9/4,\n8/1892, 13-26/1, 1/8/1893, 1895, 1897); FERREIRA, M. *República*.\n","ref":"FONTES: ASSEMB. LEGISL. RJ. *Anais*(14/11/1892-12/1/1893, 1/3-9/4,\n8/1892, 13-26/1, 1/8/1893, 1895, 1897); FERREIRA, M. *República*.\n","dic":"DPRRJ"}
