{"title":"FREITAS, Domingos","cargoss":["Deputado Estadual"],"cargos_esp":[0],"datas_ini":[1987],"datas_fim":[1991],"estados":["RJ"],"autor":["Sabrina Guerghe"],"content":"**FREITAS, Domingos**\n\n\\* dep. est. RJ 1987-1991.\n\n*Domingos Pascoal Pereira de Freitas* nasceu na cidade de São Paulo, no\ndia 9 de abril de 1944.\n\nFormou-se técnico em contabilidade, cursou Direito e atuou também como\nempresário na área de serviços médicos.\n\nEm 1986 foi eleito deputado estadual na legenda do Partido Liberal (PL).\nAssumiu em fevereiro de 1987 uma cadeira na Assembleia Legislativa do\nEstado do Rio de Janeiro (ALERJ). Durante o mandato foi quarto\nvice-presidente da Mesa Diretora da ALERJ e relator da Comissão\nParlamentar de Inquérito (CPI) para Apurar Abastecimento de Água na\nCidade do Rio de Janeiro pela Companhia Estadual de Águas e Esgotos\n(CEDAE). Deixou a ALERJ em janeiro de 1991, ao final da legislatura.\n\nEm 19 de setembro de 1991 foi aprovado o Projeto de Resolução n^o^ 833\nde 1990, de sua autoria, que instituiu o auxílio creche, pré-escolar e\nescolar, pago ao servidor que, comprovadamente, mantenha filhos ou\ndependentes, desde o nascimento até 14 anos de idade em creches,\npré-escolas e escolar.\n\nAfastado de mandatos eletivos por quase uma década, nas eleições de 2000\ncandidatou-se a prefeito de São João de Meriti, no estado do Rio, na\nlegenda do Partido Socialista Brasileiro (PSB) em uma coligação com o\nPartido Comunista Brasileiro (PCB). Não conseguiu se eleger.\n\nMudou novamente de agremiação, filiando-se ao Partido Trabalhista\nNacional (PTN). No pleito de 2006 candidatou-se a uma vaga na Câmara\nFederal, na coligação Crescendo com o Rio, composta pelo PTN, o Partido\nRepublicano Brasileiro (PRB) e o Partido Renovador Trabalhista\nBrasileiro (PRTB), mas não se elegeu. Em abril do ano seguinte assumiu a\npresidência do diretório do seu partido em São João de Meriti.\n\nFoi membro efetivo da Associação dos Diplomados da Escola Superior de\nGuerra (ADESG).\n\n*Sabrina Guerghe*\n\nFONTES: ASSEMB. LEGISL. RJ. *Documentos*; ASSEMB. LEGISL. RJ. *Deputados\nestaduais fluminenses*. Quarta legislatura (1987-1991); *Folha* Eleições\n(12/8/2006); *Primeira Hora* (11/8/2007); TRIB. REG. ELEIT. Disponível\nem: \\<www.tre-rj.gov.br/site/partido\\_politico/diretivos/ptn.pdf\\>;\nTRIB. SUP. ELEIT. (Eleições 2000, 2006).\n","ref":"FONTES: ASSEMB. LEGISL. RJ. *Documentos*; ASSEMB. LEGISL. RJ. *Deputados\nestaduais fluminenses*. Quarta legislatura (1987-1991); *Folha* Eleições\n(12/8/2006); *Primeira Hora* (11/8/2007); TRIB. REG. ELEIT. Disponível\nem: \\<www.tre-rj.gov.br/site/partido\\_politico/diretivos/ptn.pdf\\>;\nTRIB. SUP. ELEIT. (Eleições 2000, 2006).\n","dic":"DPRRJ"}
