{"title":"FREITAS, Luís Antônio de Miranda","cargoss":["Constituinte","Deputado Estadual"],"cargos_esp":["est",0],"datas_ini":[1891,1891],"datas_fim":[1891,1891],"estados":["RJ","RJ"],"content":"**FREITAS, Luís Antônio de Miranda**\n\n\\* const. est. RJ 1891; dep. est. RJ 1891.\n\n*Luís Antônio de Miranda Freitas* foi capitão do exército, tendo cursado\na Escola Militar na década de 1860.\n\nElegeu-se deputado estadual nas primeiras eleições realizadas após a\nproclamação da República (15/11/1889) para a formação da Assembleia\nConstituinte fluminense. Esse pleito, realizado em 20 de março de 1891,\nfoi vencido pelos partidários do presidente do estado do Rio de Janeiro,\nFrancisco Portela (1889-1891), nomeado pelo presidente da República,\nmarechal Deodoro da Fonseca (1889-1891). Os portelistas derrotaram os\ncandidatos do Partido Republicano, de oposição ao governo, liderados por\nJosé Tomás da Porciúncula.\n\nNa Constituinte estadual, reunida a partir de 10 de maio, Luís Antônio\nde Miranda Freitas e os demais deputados promulgaram a primeira\nConstituição republicana fluminense e elegeram Portela presidente\nconstitucional. As sessões ordinárias desse ano se encerraram em\nnovembro, mesmo mês em que Deodoro da Fonseca renunciou ao governo da\nRepública, transferindo-o ao vice-presidente Floriano Peixoto. Diante\ndesse conturbado contexto político, no dia 10 de dezembro, Portela\nrenunciou à presidência do estado do Rio de Janeiro por não ter mais o\napoio do poder federal. Seu sucessor, Carlos Baltasar da Silveira\n(1891-1892), revogou a Constituição republicana fluminense, fechou o\nCongresso estadual e convocou uma nova Assembleia Constituinte. Diante\ndisso, Luís Antônio de Miranda Freitas perdeu o mandato.\n\n*Samuel Silva Rodrigues de Oliveira*\n\nFONTE: *Diário Oficial da União* (1/10/1935); FERREIRA, M. *República*;\nPINHEIRO, X. *Marechal Floriano*.\n","ref":"","dic":"DPRRJ"}
