{"title":"FRÓIS, Luís José de Meneses","cargoss":["Constituinte","Deputado Estadual"],"cargos_esp":["est",0],"datas_ini":[1892,1892],"datas_fim":[1892,1897],"estados":["RJ","RJ"],"autor":[0],"content":"**FRÓIS, Luís José de Meneses**\n\n\\* const. est. RJ 1892; dep. est. RJ 1892-1897.\n\n*Luís José de Meneses Fróis* nasceu em Niterói, então capital da\nprovíncia do Rio de Janeiro, em 1825, filho de Raimundo José de Meneses\nFróis. Seu pai foi dono da Fazenda Saco e um dos chefes político de\nNiterói.\n\nHerdou metade da fazenda do pai e seu prestígio político. Foi major do\n1^o^ Batalhão da Guarda Nacional e vereador na Câmara Municipal de\nNiterói por vários mandatos consecutivos, entre 1854 e 1889, tendo sido\npor mais de uma vez presidente da Câmara. Foi eleito deputado\nprovincial. Em 1869 foi nomeado juiz de paz de Jurujuba (RJ).\n\nApós a proclamação da República (15/11/1889) foi nomeado presidente do\nConselho de Intendência de Niterói, em dezembro de 1891, mas ficou por\npouco tempo no cargo, pois elegeu-se deputado estadual à segunda\nAssembleia Constituinte fluminense em 1892.\n\nA primeira Constituição fluminense havia sido elaborada em 1891 pelos\npartidários do então presidente estadual, Francisco Portela (1889-1891),\ne foi anulada após a renúncia deste em dezembro do mesmo ano. No dia 31\nde janeiro de 1892 uma nova eleição foi realizada para compor a nova\nAssembleia Constituinte, que foi formada por membros do Partido\nRepublicano Fluminense (PRF), presidida por José Tomás da Porciúncula e\nque promulgaria, no dia 9 de abril do mesmo ano, a segunda Constituição\nfluminense. Nesse mandato, foi membro da Comissão de Verificação de\nPoderes.\n\nNo dia 24 de abril foram realizadas eleições para a composição da\nAssembleia Legislativa e Luís José de Meneses Fróisse elegeu deputado\nestadual na legenda do PRF. No mesmo pleito José Tomás da Porciúncula\nfoi eleito presidente do estado do Rio de Janeiro (1892-1894). No\nperíodo de 1892 a 1894 Luís José de Meneses Fróis exerceu juntamente com\no mandato de deputado estadual o de presidente da Câmara Municipal de\nNiterói.\n\nEm 20 de maio 1895 foi reeleito deputado estadual na legenda do PRF pelo\nprimeiro distrito eleitoral, com sede em Niterói. Ainda em 1895 foi\neleito membro da primeira e da segunda comissões de Verificação dos\nPoderes, encarregadas de contabilizar votos e diplomar deputados\nestaduais dos terceiro, quarto e quinto distritos eleitorais. Até o\nfinal da legislatura, em dezembro de 1897, não integrou nenhuma comissão\nparlamentar.\n\nAinda em 1897, concorreu a mais um mandato na Câmara Municipal de\nNiterói. Nesse pleito, o grupo liderado por ele e sua família\ndenominou-se Dissidência Republicana e concorreu com a chapa municipal\ndo PRF, sua antiga agremiação, mas da qual se distanciara durante seu\núltimo mandato no legislativo estadual. Ao final dessa eleição, o\nresultado foi favorável à chapa do PRF, mas Luís José de Meneses Fróis\nnão reconheceu a derrota e no dia da posse dos eleitos, duas câmaras\nmunicipais foram instaladas: uma do PRF e outra da Dissidência\nRepublicana. O fim dessa questão se deu em março de 1898, com a anulação\nda eleição de 1897, a realização de um novo pleito e a vitória\ndefinitiva do PRF, garantida pelo Tribunal da Relação.\n\nFaleceu em 1905.\n\n*Samuel Silva Rodrigues de Oliveira*\n\nFONTES: ASSEMB. LEGISL. RJ. *Anais*(14/11/1892-12/1/1893, 1/3-9/4,\n8/1892, 13- 26/1, 1/8/1893, 1895, 1897); CÂM. DEP. *Anais*(1867);\nCAMPOS, M. *Governo*; FERREIRA, M. *República*.\n","ref":"FONTES: ASSEMB. LEGISL. RJ. *Anais*(14/11/1892-12/1/1893, 1/3-9/4,\n8/1892, 13- 26/1, 1/8/1893, 1895, 1897); CÂM. DEP. *Anais*(1867);\nCAMPOS, M. *Governo*; FERREIRA, M. *República*.\n","dic":"DPRRJ"}
