{"title":"AMARAL, Francisco","cargoss":["Deputado Estadual"],"cargos_esp":[0],"datas_ini":[1975],"datas_fim":[1983],"estados":["RJ"],"autor":["Sabrina Guerghe"],"content":"**AMARAL, Francisco**\n\n\\* dep. est. RJ 1975-1983.\n\n*Francisco de Assis Martins Amaral*, também conhecido como *Chico\nAmaral*, nasceu na cidade de Pedreiras (MA) no dia 1^o^ de novembro de\n1933, filho de Antenor Magalhães Amaral e de Maria de Lourdes Martins\nAmaral. Seu pai foi deputado estadual no Maranhão entre 1934 e 1937.\n\nEm 1942 mudou-se com a família para Itaocara (RJ) e em 1945 passou a\nresidir em Nova Iguaçu (RJ). Em 1961 formou-se na Faculdade Nacional de\nDireito da Universidade do Brasil, no Rio de Janeiro, então Distrito\nFederal, e abriu escritório de advocacia em Nova Iguaçu. Paralelamente,\ntrabalhou como bancário no Banco do Brasil e manteve atividades no\nsindicato de sua categoria profissional. Em 1963 ingressou nos quadros\ndo Partido Comunista Brasileiro (PCB), que se encontrava na ilegalidade.\nApós o movimento político-militar de março de 1964, que instaurou o\nregime militar no país, passou a rearticular o PCB em Nova Iguaçu, tendo\nsido também secretário-geral do partido.\n\nEm 1969 filiou-se ao Movimento Democrático Brasileiro (MDB), partido de\noposição ao regime militar, e no ano seguinte participou da campanha de\nByron de Almeida para a prefeitura de Nova Iguaçu. Pouco depois,\ntornou-se secretário do MDB na mesma cidade.\n\nTendo Nova Iguaçu como principal reduto eleitoral, elegeu-se deputado\nestadual em novembro de 1974 e tomou posse na Assembleia Legislativa do\nEstado do Rio de Janeiro (ALERJ) em fevereiro de 1975. No dia 15 março,\npassou a integrar a Assembleia Constituinte encarregada de elaborar a\nConstituição do novo estado do Rio de Janeiro, resultante da fusão entre\no estado da Guanabara e o antigo estado do Rio. Na Assembleia\nConstituinte, integrou a comissão encarregada de redigir o Regimento\nInterno da ALERJ. Foi também presidente da Subcomissão de Saúde Pública\ne Saneamento Básico. Com a promulgação da nova Constituição estadual em\n23 de julho de 1975, retornou ao exercício do mandato ordinário na ALERJ\ne foi titular das comissões permanentes de Legislação Constitucional\nComplementar e Códigos, e de Educação e Cultura.\n\nNas eleições municipais de 1976, disputou a prefeitura de Nova Iguaçu\npela sublegenda do MDB. Houve, contudo, uma tentativa de impugnação da\nsua candidatura, que somente em 5 de novembro, às vésperas do pleito,\nfoi formalizada pelo Tribunal Superior Eleitoral (TSE). Realizado o\npleito, o eleito foi Rui Queiroz, da Aliança Renovadora Nacional\n(Arena), partido de sustentação do regime militar.\n\nEm novembro de 1978, Francisco Amaral foi reeleito deputado estadual na\nlegenda do MDB. Assumiu o novo mandato em fevereiro de 1979 e presidiu a\nComissão de Regiões Industriais do Médio Paraíba e Litoral Sul. Com o\nfim do bipartidarismo em novembro de 1979, e a consequente reorganização\npartidária, foi um dos fundadores do Partido do Movimento Democrático\nBrasileiro (PMDB), herdeiro do MDB. Atuou politicamente ao lado de\nHeloneida Studart, Raimundo de Oliveira e Alves de Brito, tendo\nparticipado da manifestação contra o fechamento do prédio da União\nNacional dos Estudantes (UNE), no bairro do Flamengo, no Rio de Janeiro,\nem junho de 1980. No pleito de novembro de 1982, concorreu sem sucesso a\numa vaga na Câmara dos Deputados pelo estado do Rio de Janeiro na\nlegenda do PMDB. Deixou a ALERJ em janeiro de 1983, ao final da\nlegislatura.\n\nEm 1986, na convenção do PMDB, apoiou o nome de Nélson Carneiro para\ncandidato a governador do estado, mas o escolhido foi Moreira Franco. Em\nbusca de uma unidade, abriu-se então a alternativa de o candidato a\nvice-governador ser indicado pelo grupo de Nélson Carneiro. Foi então\nescolhido candidato a vice na chapa de Moreira Franco, que em novembro\nsaiu vitoriosa, derrotando Darci Ribeiro, do Partido Democrático\nTrabalhista (PDT).\n\nCom a posse de Moreira Franco no governo do estado em 1987, além da\nvice-governadoria, Francisco Amaral foi nomeado secretário de Promoção\nSocial, cargo em que permaneceu por menos de um mês, e secretário de\nAssuntos Fundiários, função que deixou em agosto de 1988 quando foi\nnomeado interventor estadual em Nova Iguaçu devido ao afastamento do\nentão prefeito Paulo Leone. Permaneceu à frente da prefeitura de Nova\nIguaçu por cinco meses, tendo sido substituído por Aluísio Gama.\n\nNas eleições de outubro de 1990, disputou uma vaga no Senado pelo Rio de\nJaneiro na legenda peemedebista e foi derrotado por Darci Ribeiro. Em\n1^o^ de janeiro de 1991 deixou a vice-governadoria, ao término do\nmandato.\n\nEm 1992, foi aprovado em concurso para a magistratura estadual. Entre\n1994 e 2009 foi professor na Faculdade de Direito e Ciências Sociais da\nUniversidade Iguaçu.\n\nDurante sua trajetória foi também procurador geral do município de\nParacambi e secretário de Planejamento em São João de Meriti, na Baixada\nFluminense.\n\n*Sabrina Guerghe*\n\nFONTES: ASSEMB. LEGISL. RJ. *Documentos*; FERREIRA, M.; ROCHA, D.;\nFREIRE, A. *Vozes*; LAMOUNIER, B.; SADEK, M. *Depois da transição.*\n","ref":"FONTES: ASSEMB. LEGISL. RJ. *Documentos*; FERREIRA, M.; ROCHA, D.;\nFREIRE, A. *Vozes*; LAMOUNIER, B.; SADEK, M. *Depois da transição.*\n","dic":"DPRRJ"}
