{"title":"GAMA FILHO, Gonzaga da","cargoss":["Constituinte","Deputado Estadual","Deputado federal"],"cargos_esp":["est GB","GB","GB"],"datas_ini":[1960,1961,1967],"datas_fim":[1961,1967,1967],"estados":[0,0,0],"autor":[0],"content":"**GAMA FILHO, Gonzaga da**\n\n\\* const. est. GB 1960-1961; dep. est. GB 1961-1967; dep. fed. GB 1967.\n\n*Luís Gonzaga Prado Ferreira da Gama Filho* nasceu no Rio de Janeiro,\nentão Distrito Federal, em 10 de maio de 1930, filho de Luís Filipe\nMaigre de Oliveira Ferreira da Gama e de Altair Horacina Prado Ferreira\nda Gama. Seu pai, conhecido como Gama Filho, foi deputado federal pelo\nDistrito Federal de 1951 a 1953 e fundador da Universidade Gama Filho.\n\nProfessor e advogado, iniciou sua carreira política elegendo-se em 1954\nvereador no Distrito Federal na legenda do Partido Social Democrático\n(PSD). Durante a legislatura iniciada em 1955, foi presidente da\nComissão de Justiça, integrante da mesa da Câmara Municipal e líder da\nmaioria. Em 1958 tornou-se secretário de Educação e Cultura do Distrito\nFederal, na gestão do prefeito Francisco Negrão de Lima (1956-1958).\n\nNo pleito de outubro de 1960 elegeu-se deputado à Assembleia\nConstituinte do recém-criado estado da Guanabara na legenda do PSD.\nParticipou dos trabalhos constituintes e, após a promulgação da Carta\nestadual (27/3/1961), passou a exercer o mandato ordinário. Presidiu a\nComissão de Administração da Assembleia Legislativa e foi vice-líder da\noposição ao governo de Carlos Lacerda (1960-1965). Reeleito em outubro\nde 1962, foi autor dos projetos de criação da Companhia de Transportes\nColetivos (CTC) e do Departamento de Imprensa Estadual, e presidiu a\nComissão de Educação, Saúde e Trabalho. Com a extinção dos partidos\npolíticos pelo Ato Institucional n^o^ 2 (AI-2) em 27 de outubro de 1965\ne a posterior instauração do bipartidarismo, filiou-se ao Movimento\nDemocrático Brasileiro (MDB).\n\nEm novembro de 1966 elegeu-se deputado federal pelo estado da Guanabara\nna legenda do MDB. Deixando a Assembleia Legislativa em janeiro de 1967,\nassumiu seu mandato na Câmara dos Deputados em fevereiro seguinte e\ntornou-se vice-líder de seu partido. Em setembro do mesmo ano deixou a\nCâmara para assumir a Secretaria de Educação do estado da Guanabara no\ngoverno Negrão de Lima (1965-1971).\n\nFaleceu no Rio de Janeiro em 24 de junho de 1970.\n\nCasado com Maria Sílvia Moreira Ferreira da Gama, teve seis filhos.\n\nFONTES: CÂM. DEP. *Deputados*; CÂM. DEP. *Deputados brasileiros*.\nRepertório (6); CÂM. DEP. *Relação nominal dos senhores*; *Jornal do\nBrasil* (6/11/1966); NÉRI, S. 16; *Veja* (1/7/1970).\n","ref":"FONTES: CÂM. DEP. *Deputados*; CÂM. DEP. *Deputados brasileiros*.\nRepertório (6); CÂM. DEP. *Relação nominal dos senhores*; *Jornal do\nBrasil* (6/11/1966); NÉRI, S. 16; *Veja* (1/7/1970).\n","dic":"DPRRJ"}
