{"title":"GAMA FILHO","cargoss":["Deputado federal"],"cargos_esp":[0],"datas_ini":[1951],"datas_fim":[1953],"estados":["DF"],"autor":["Guanabara."],"content":"**GAMA FILHO**\n\n\\* dep. fed. DF 1951-1953.\n\n*Luís Filipe Maigre de Oliveira Ferreira da Gama* nasceu no Rio de\nJaneiro, então Distrito Federal, em 14 de março de 1906, filho do\njornalista Luís da Gama e de Paulina de Oliveira Gama. Tornou-se\nconhecido como *Gama Filho*.\n\nFez o curso primário no Colégio Gonçalves Dias e o secundário nos\ncolégios Pio Americano e Pedro II, todos no Rio de Janeiro. Oriundo de\nfamília de condição modesta, começou a trabalhar cedo, primeiro como\najudante e depois como motorista de caminhão do Departamento Nacional de\nEstradas de Rodagem (DNER), empregado na construção da antiga rodovia\nRio-São Paulo. Em seguida, foi auxiliar de almoxarife da companhia Light\nand Power e vendedor de querosene nos subúrbios do Rio. Era gerente da\ncadeia dos restaurantes automáticos em 1939, quando comprou o Colégio\nPiedade, situado no subúrbio carioca do mesmo nome, contando com 136\nalunos e dotado de cinco salas de aula. Esta seria a origem da\nUniversidade Gama Filho, estabelecida como tal na década de 1970.\n\nNo início da década de 1940 Gama Filho ingressou na Faculdade de\nCiências Políticas e Econômicas do Rio de Janeiro, e no final de 1944\nobteve seu diploma universitário. Sem interromper suas atividades à\nfrente do Colégio Piedade, que experimentava uma fase de expansão,\niniciou a carreira política em janeiro de 1947, elegendo-se vereador no\nDistrito Federal na legenda do Partido Republicano (PR). Foi primeiro\nvice-presidente da Câmara Municipal entre 1948 e 1950.\n\nEm 1950 candidatou-se a deputado federal na legenda do Partido Social\nDemocrático (PSD). Recebendo 21.361 sufrágios, foi eleito com a segunda\nmaior votação entre os candidatos do Distrito Federal. Tomou posse em\nfevereiro de 1951, e durante os dois primeiros anos do seu mandato foi\nmembro da Comissão de Finanças da Câmara dos Deputados. Em outubro de\n1953, nomeado pelo presidente Getúlio Vargas ministro do Tribunal de\nContas do Distrito Federal, renunciou ao mandato parlamentar. Depois de\nocupar a vice-presidência do tribunal entre agosto de 1955 e novembro de\n1956, foi eleito seu presidente, cargo ao qual seria reconduzido através\nde sucessivas reeleições. Em 1960, com a transferência da capital para\nBrasília e a criação do estado da Guanabara no lugar do antigo Distrito\nFederal, passou a presidir o Tribunal de Contas do estado.\n\nApós criar sua primeira faculdade, de ciências jurídicas, em 1951, ao\nlongo das décadas de 1950, 1960 e 1970 Gama Filho foi ampliando seu\nconjunto de faculdades, que passou a contar com escolas de economia e\nadministração, filosofia, ciências e letras, serviço social, medicina,\nengenharia, arquitetura, comunicação social, educação física e\nenfermagem. Essa expansão se baseou na cobrança de mensalidades\nconsideradas altas. Inicialmente, os alunos eram provenientes das\ncamadas de mais alta renda dos subúrbios cariocas. Depois da crise de\ncarência de vagas nas universidades públicas – que atingiu seu ponto\nmais explosivo em 1968 e facilitou a proliferação de escolas superiores\nprivadas –, as faculdades Gama Filho puderam reunir um corpo de\nestudantes mais numeroso e diversificado.\n\nEntre 1964 e 1970, Gama Filho foi também presidente das juntas de\ncontrole da Superintendência de Serviços Médicos (Suseme) e do Instituto\nde Previdência do Estado da Guanabara (IPEG), do Fundo Estadual de\nEducação e Cultura, da Superintendência do IV Centenário da Cidade do\nRio de Janeiro, além de presidente substituto de juntas de controle de\ndiversos outros órgãos do governo estadual.\n\nDeixou a presidência do Tribunal de Contas do estado da Guanabara para\nse candidatar a senador nas eleições de 15 de novembro de 1970 na\nlegenda da Aliança Renovadora Nacional (Arena). Embora tenha sido o mais\nvotado de seu partido, com 542.400 sufrágios, teve quase duzentos mil\nvotos a menos que o terceiro colocado, Danton Jobim, do Movimento\nDemocrático Brasileiro (MDB), não conseguindo assim o mandato. Não\ndesistiu, porém, de tentar novamente uma vaga no Senado. Em março de\n1972 foi eleito presidente do diretório regional da Arena carioca, e nas\neleições de 15 de novembro de 1974 voltou a se candidatar, sofrendo nova\nderrota. Teve 469.378 votos (29% do total), contra 1.150.983 dados a\nDanton Jobim.\n\nNos últimos anos de sua vida, dedicou-se à expansão da Universidade Gama\nFilho, reconhecida como tal pelo Conselho Federal de Educação em 1972.\n\nFaleceu no Rio de Janeiro em 28 de maio de 1978.\n\nEra casado com Altair Horacina Prado Ferreira da Gama, com quem teve\ncinco filhos. Um deles, Luís Gonzaga da Gama Filho, foi vereador no\nDistrito Federal (1955-1958), deputado estadual (1961-1967), deputado\nfederal (1967) e secretário de Educação e Cultura (1967-1970) da\nGuanabara.\n\nFONTES: CÂM. DEP. *Deputados*; CÂM. DEP. *Relação dos dep.*; CISNEIROS,\nA. *Parlamentares*; COUTINHO, A. *Brasil*; ENTREV. BIOG.; *Globo*\n(29/5/1978); *Grande encic. portuguesa*; HIRSCHOWICZ, I.\n*Contemporâneos*; *Jornal do Brasil* (29/5/1978); *Manchete* (9/7/1977);\nNÉRI, S. *16*; *Opinião* (8/11/1974); RIBEIRO FILHO, J. *Dicionário*.\n","ref":"FONTES: CÂM. DEP. *Deputados*; CÂM. DEP. *Relação dos dep.*; CISNEIROS,\nA. *Parlamentares*; COUTINHO, A. *Brasil*; ENTREV. BIOG.; *Globo*\n(29/5/1978); *Grande encic. portuguesa*; HIRSCHOWICZ, I.\n*Contemporâneos*; *Jornal do Brasil* (29/5/1978); *Manchete* (9/7/1977);\nNÉRI, S. *16*; *Opinião* (8/11/1974); RIBEIRO FILHO, J. *Dicionário*.\n","dic":"DPRRJ"}
