{"title":"GAMA, Aluísio","cargoss":["Constituinte","Deputado Estadual","Deputado Estadual"],"cargos_esp":["est",0,0],"datas_ini":[1975,1987,1975],"datas_fim":[1975,1989,1983],"estados":["RJ","RJ","RJ"],"autor":[0],"content":"**GAMA, Aluísio**\n\n\\* const. est. RJ 1975; dep. est. RJ 1975-1983 e 1987-1989.\n\n*Aluísio Gama de Sousa* nasceu no Rio de Janeiro, então Distrito\nFederal, no dia 1^o^ de março de\n1945[,](http://pt.wikipedia.org/wiki/1945 \"1945\") filho de Juvenil de\nSousa Lopes, dentista, e de Inah Gama de Sousa, professora. Sua mãe\nfundou em 1963 o Jardim-Escola Menino Jesus, localizado em Bonsucesso.\nSua irmã Aparecida Gama foi deputada estadual no Rio de Janeiro\n(1991-1995 e 1997-2011) e secretária estadual de Habitação e Assuntos\nFundiários (1995-1997).\n\nFez o curso primário no Instituto Rui Barbosa, o ginasial no Ginásio\nAliomar Pereira e no Instituto Francisco de Sales, e o científico no\nInstituto La Fayette. Em 1963 ingressou no curso de direito da\nUniversidade Cândido Mendes e no ano seguinte começou também a estudar\ngeografia. Em 1967 recebeu os títulos de bacharel em direito e de\nengenheiro-geógrafo. Em 1977 graduou-se em pedagogia pela Universidade\ndo Estado do Rio de Janeiro (UERJ).\n\nEm 1974 elegeu-se pela primeira vez deputado estadual no estado da\nGuanabara, na legenda do Movimento Democrático Brasileiro (MDB). Assumiu\no mandato em fevereiro de 1975 e, a partir de março, com a fusão dos\nestados da Guanabara e do Rio de Janeiro, passou a integrar a Assembleia\nConstituinte do novo estado do Rio. Promulgada a Constituição em 23 de\njulho de 1975, passou a exercer o mandato ordinário. Na Assembleia\nLegislativa foi vice-presidente da Comissão de Trabalho, Legislação\nSocial e Servidores Públicos (1975-1977) e membro efetivo das Comissões\nde Educação e Cultura (1977-1978) e da Região Metropolitana (a partir de\n1977). Foi também autor de leis que autorizaram a criação de três\nescolas de primeiro grau, atual ensino fundamental, nos bairros de Brás\nde Pina, Ramos e Manguinhos.\n\nReeleito em 1978, no segundo mandato foi escolhido vice-líder da bancada\ndo MDB e, após a reorganização partidária, ingressou no Partido do\nMovimento Democrático Brasileiro (PMDB). Permaneceu na Comissão da\nRegião Metropolitana, foi membro das Comissões de Obras Públicas\n(1979-1981) e de Redação (1980-1981) e presidiu a Comissão de Defesa dos\nDireitos Humanos (1980-1981). Foi mais uma vez eleito em 1982, mas\nlicenciou-se para ocupar cargos no governo Leonel Brizola (1983-1987):\nesteve à frente da Secretaria para o Desenvolvimento da Região\nMetropolitana (1983-1985) e da Secretaria de Agricultura e Abastecimento\n(1985-1986). Representou também o governo do estado junto ao Conselho\nConsultivo da Região Metropolitana do Rio de Janeiro (1984-1986).\n\nEm 20 de maio de 1986 desligou-se do PMDB e passou a integrar o Partido\nDemocrático Trabalhista (PDT). Nessa legenda foi mais uma vez eleito\ndeputado estadual em outubro seguinte. Presidiu então as Comissões de\nIndicação Legislativa e Proposições (de março a junho de 1987) e de\nCultura, e foi membro efetivo das Comissões de Agricultura e Política\nRural e de Assuntos Municipais. Foi o autor da Lei n^o^ 1.601/1989,\nconhecida como Lei do Banco de Livro, que determinou a criação, em todos\nos municípios fluminenses, de agências que promovessem a troca gratuita\nde livros didáticos e técnicos.\n\nEm 1988 foi eleito prefeito do município de Nova Iguaçu (RJ), o que o\nlevou a mais uma vez deixar a Assembleia Legislativa, em 1989. Durante\nsua gestão determinou a elaboração de Ortofotocartas na escala de\n1:5000, considerados importantes instrumentos para a execução de planos\ndiretores.\n\nEm 1993 foi empossado como conselheiro do Tribunal de Contas do Estado\ndo Rio de Janeiro (TCE), órgão que veio a presidir nos biênios 1997-1998\ne 1999-2000.\n\nNo mesmo espaço onde funcionava o Jardim-Escola Menino de Jesus, criado\npor sua mãe, fundou o curso Gama e Sousa, preparatório para as academias\nmilitares e institutos de educação. Posteriormente, o Ginásio Gama e\nSousa se somou a outras instituições de ensino de propriedade da\nfamília, passando a integrar um único grupo, detentor de uma faculdade e\nde escolas na cidade do Rio de Janeiro e no município de Mesquita.\n\nCasou-se com Sheila Gama. Presidente do PDT de Nova Iguaçu, Sheila era\nvice-prefeita do município e assumiu a titularidade do cargo em abril de\n2010, após o prefeito Lindbergh Farias ter-se desincompatibilizado para\ndisputar uma vaga no Senado.\n\n*Cláudia Calmon*\n\nFONTES: ASSEMB. LEGISL. RJ. *Deputados estaduais fluminenses*\n(1987-1991). ASSEMB. LEGISL. RJ. Disponível em:\n\\<www.alerj.rj.gov.br/processo2.htm\\>. Acesso em: 30/8/2010.\n\\<www.alerj.rj.gov.br/jornalalerj/jornalalerj84.pdf\\>. Acesso em:\n10/8/2010; CPDOC. Disponível em:\n\\<www.fgv.br/cpdoc/historiaoral/arq/Entrevista732.pdf\\>. Acesso em:\n10/8/2010; FACUL. GAMA E SOUZA. Disponível em:\n\\<www.gamaesouza.edu.br/instituicao.html\\>. Acesso em: 10/8/2010; MBI.\nDisponível em:\n\\<www.mbi.com.br/MBI/biblioteca/artigos/2010-01-cartografia-municipal\\>.\nAcesso em: 10/8/2010; PREF. NOVA IGUAÇU. Disponível em:\n\\<www.novaiguacu.rj.gov.br/noticias\\_res.php?id=174\\>. Acesso em:\n20/9/2010.\n","ref":"FONTES: ASSEMB. LEGISL. RJ. *Deputados estaduais fluminenses*\n(1987-1991). ASSEMB. LEGISL. RJ. Disponível em:\n\\<www.alerj.rj.gov.br/processo2.htm\\>. Acesso em: 30/8/2010.\n\\<www.alerj.rj.gov.br/jornalalerj/jornalalerj84.pdf\\>. Acesso em:\n10/8/2010; CPDOC. Disponível em:\n\\<www.fgv.br/cpdoc/historiaoral/arq/Entrevista732.pdf\\>. Acesso em:\n10/8/2010; FACUL. GAMA E SOUZA. Disponível em:\n\\<www.gamaesouza.edu.br/instituicao.html\\>. Acesso em: 10/8/2010; MBI.\nDisponível em:\n\\<www.mbi.com.br/MBI/biblioteca/artigos/2010-01-cartografia-municipal\\>.\nAcesso em: 10/8/2010; PREF. NOVA IGUAÇU. Disponível em:\n\\<www.novaiguacu.rj.gov.br/noticias\\_res.php?id=174\\>. Acesso em:\n20/9/2010.\n","dic":"DPRRJ"}
