{"title":"GAMA, Aparecida","cargoss":["Deputado Estadual","Deputado Estadual"],"cargos_esp":[0,0],"datas_ini":[1997,1991],"datas_fim":[2011,1995],"estados":["RJ","RJ"],"autor":["Luciana Pinheiro"],"content":"**GAMA, Aparecida**\n\n\\* dep. est. RJ 1991-1995 e 1997-2011.\n\n*Maria Aparecida Gama de Sousa Loureiro* nasceu no Rio de Janeiro, então\nDistrito Federal, em 9 de julho de 1950, filha de Juvenil de Sousa Lopes\ne de Inah Gama de Sousa. Seu irmão Aluísio Gama foi deputado estadual no\nRio de Janeiro (1975-1983 e 1987-1989), secretário estadual de\nDesenvolvimento da Região Metropolitana (1983-1985) e de Agricultura e\nAbastecimento (1985-1986), prefeito de Nova Iguaçu (RJ) (1989-1992), e\npresidente do Tribunal de Contas do Estado do Rio de Janeiro\n(1997-2000).\n\nEm 1972 Aparecida ingressou no curso de pedagogia da Faculdade Augusto\nMota, e em 1975 se formou. Especializou-se em orientação educacional e\nadministração escolar. Antes de ingressar na política exerceu diversos\ncargos em áreas administrativas e de educação. Em 1970 tornou-se\ndiretora de uma creche e orientadora educacional da Faculdade Gama e\nSousa, pertencente à sua família, e de 1975 a 1977 lecionou no ensino\nsupletivo na rede pública do estado do Rio. Em 1980 tornou-se\nadministradora da X Região Administrativa do Rio de Janeiro, e em 1982\nfoi nomeada técnica legislativa na Assembleia Legislativa do Estado do\nRio de Janeiro (ALERJ), função que exerceu até 1990.\n\nNas eleições de outubro de 1990 candidatou-se a deputada estadual no Rio\nde Janeiro na legenda do Partido Democrático Trabalhista (PDT). Eleita,\ntomou posse na ALERJ em fevereiro de 1991 e em dezembro do mesmo ano\nteve sancionadas duas leis de sua autoria: uma delas instituía o “Dia do\nFrentista”, e a outra assegurava ao educando portador de deficiência\nfísica, mental ou sensorial, a prioridade de vaga na escola mais próxima\nde sua residência. Em novembro de 1993 teve promulgado seu projeto de\nlei que visava a implantar o Programa de Fluoretação do Sal no estado do\nRio de Janeiro. Durante a legislatura presidiu a Comissão de Educação,\nCultura e Desportos, foi membro efetivo da Comissão de Assuntos da\nMulher, da Criança e do Adolescente, e suplente das comissões de Obras\nPúblicas, Emendas Constitucionais e Vetos, de Assuntos Municipais e\nDesenvolvimento Regional, e de Normas Internas e Proposições Externas.\n\nNo pleito realizado em novembro de 1994 concorreu à reeleição na legenda\ndo Partido da Social Democracia Brasileira (PSDB) e foi eleita. Iniciou\nnovo mandato em fevereiro de 1995, mas nesse mesmo ano licenciou-se para\ntomar posse como secretária estadual de Habitação e Assuntos Fundiários,\nnomeada pelo então governador Marcelo Alencar (1995-1998). Deixou a\nsecretaria no dia 9 de janeiro de 1997 e retornou à ALERJ. Ainda em\n1997, foi vice-presidente da Comissão de Legislação Constitucional\nComplementar e Códigos e integrou as comissões de Assuntos da Mulher, da\nCriança e do Adolescente, e de Agricultura, Pecuária e Política Rural,\nAgrária e Pesqueira. Em 1998 foi escolhida vice-presidente da comissão\nde Assuntos da Mulher. Em julho desse ano foi publicada uma lei de sua\nautoria que determinava que todos os produtos de origem rural *in\nnatura* ou simplesmente beneficiados, consumidos em estabelecimentos de\nensino público estadual, deveriam ser preferencialmente adquiridos de\ncooperativas ou de produtores rurais locais.\n\nEm outubro de 1998, candidatou-se mais uma vez a uma vaga na ALERJ na\nlegenda do PSDB e foi novamente eleita. Em fevereiro de 1999 iniciou o\nterceiro mandato e foi designada corregedora geral. Teve sancionada, em\nmarço, uma lei de sua autoria que estabeleceu novos limites territoriais\nentre os municípios de Cantagalo e Macuco. Ainda em 1999 participou de\nduas comissões parlamentares de inquérito (CPIs), referentes à evasão na\narrecadação do Imposto sobre Circulação de Mercadorias e Serviços (ICMS)\nno estado e ao suposto superfaturamento e compra de remédios\nfalsificados ou de validade vencida pela Secretaria Estadual de Saúde,\npara hospitais da rede estadual. Em 2000 integrou a CPI destinada a\ninvestigar os métodos de avaliação, perícia e cálculos dos bens imóveis\nem que havia interesses da administração direta e indireta do estado do\nRio de Janeiro. Em agosto de 2001 teve sancionada lei de sua autoria que\ntornava obrigatória a criação de espaço reservado ao deficiente físico,\nsem fila ou espera, em bares, lanchonetes, restaurantes e similares.\nNesse mesmo ano criou foi autora de um projeto de lei, posteriormente\nsancionado, que criou o dia estadual do doador de órgãos. Em 2002\nelaborou diversos projetos de lei, tornando obrigatório: para os\nfabricantes de cadernos escolares, imprimir no verso e no antiverso das\ncapas assuntos de relevância sobre o estado ou os hinos Nacional e da\nBandeira; para as instituições financeiras, ter um caixa eletrônico\nadaptado para deficientes físicos; entoar o Hino Nacional no início das\ncompetições esportivas oficiais; criar espaço reservado, marcado e\nindicado para deficientes físicos em casas de espetáculos, shows,\ncinemas, teatros e similares.\n\nNas eleições de outubro de 2002 concorreu novamente a uma vaga na ALERJ\nna legenda do Partido Socialista Brasileiro (PSB). Eleita, tomou posse\nem fevereiro de 2003. No ano seguinte presidiu a Comissão de Economia,\nIndústria e Comércio e foi membro das comissões de Segurança Alimentar e\nde Defesa da Pessoa Portadora de Deficiência. No mesmo ano teve aprovada\numa lei de sua autoria que determinava que o título de propriedade para\nmoradores carentes e de baixa renda deveria ser sempre outorgado em nome\nda esposa, mãe, filha e netas, nesta sequência, que teriam sempre\nprioridade sobre os varões. Em 2005 assumiu, por três anos, a\npresidência da Rede de Mulheres Parlamentares das Américas, órgão da\nConfederação Parlamentar das Américas (Copa).\n\nNas eleições gerais realizadas em 2006 foi candidatou-se novamente com\nêxito a deputada estadual no Rio de Janeiro, dessa vez na legenda do\nPartido do Movimento Democrático Brasileiro (PMDB). Foi escolhida\nvice-líder do PMDB na ALERJ, vice-presidente da Comissão de Política\nUrbana, Habitação e Assuntos Fundiários, e membro das comissões de\nLegislação Constitucional Complementar e Códigos, de Segurança\nAlimentar, e de Orçamento, Finanças, Fiscalização Financeira e Controle.\nParticipou também da CPI que investigou perdas na arrecadação\ntributária, principalmente do ICMS e da dívida ativa entre 2003 e 2006,\ne da CPI criada para apurar as causas e responsabilidades das enchentes\nno estado do Rio de Janeiro, identificando e propondo soluções para\nminimização dos efeitos para a população. Ainda em 2007 teve sancionada\nlei elaborada em parceria com a deputada Graça Matos, que autorizava o\nPoder Executivo a criar o Conselho Estadual de Prevenção e Enfrentamento\nao Tráfico de Mulheres e Crianças (Cepetemuc), vinculado à estrutura da\nAdministração Pública Estadual. Em 2009 foi vice-presidente das\ncomissões de Constituição e Justiça e de Educação, além de membro das\ncomissões de Segurança Alimentar, de Orçamento, Finanças, Fiscalização\nFinanceira e Controle, e de Defesa dos Direitos da Mulher. Não concorreu\nnas e eleições de outubro de 2010, e deixou a ALERJ em janeiro de 2011.\n\nFundadora do Instituto Gama Ação Social, entidade sem fins lucrativos\ndestinada a dar apoio social a comunidades carentes do estado do Rio de\nJaneiro, exerceu ainda a vice-presidência da União Nacional dos\nLegislativos Estaduais (Unale).\n\nCasou-se e teve três filhos.\n\n*Luciana Pinheiro*\n\nFONTES: ASSEMB. LEGISL. RJ. *Deputados estaduais fluminenses*. Quinta\nlegislatura (1991-1994); ASSEMB. LEGISL. RJ. *Deputados estaduais\nfluminenses*. Sexta legislatura (1995-1999); ASSEMB. LEGISL. RJ.\n*Deputados estaduais fluminenses*. Sétima legislatura; ASSEMB. LEGISL.\nRJ. Disponível em: \\<www.alerj.rj.gov.br/\\>. Acesso em: 19/2/2011; PREF.\nNOVA IGUAÇU. Disponível em: \\<www.novaiguacu.rj.gov.br/\\>. Acesso em:\n20/2/2011; REDE MULHERES PARL.AMÉR. Disponível em:\n\\<www.feminamericas.net/\\>. Acesso em: 20/11/2011; TRIB. SUP. ELEIT.\nDisponível em: \\<www.tse.gov.br/\\>. Acesso em: 19/2/2011; TRIB. CONTAS\nRJ. Disponível em: \\<www.tce.rj.gov.br/\\>. Acesso em: 20/2/2011.\n","ref":"FONTES: ASSEMB. LEGISL. RJ. *Deputados estaduais fluminenses*. Quinta\nlegislatura (1991-1994); ASSEMB. LEGISL. RJ. *Deputados estaduais\nfluminenses*. Sexta legislatura (1995-1999); ASSEMB. LEGISL. RJ.\n*Deputados estaduais fluminenses*. Sétima legislatura; ASSEMB. LEGISL.\nRJ. Disponível em: \\<www.alerj.rj.gov.br/\\>. Acesso em: 19/2/2011; PREF.\nNOVA IGUAÇU. Disponível em: \\<www.novaiguacu.rj.gov.br/\\>. Acesso em:\n20/2/2011; REDE MULHERES PARL.AMÉR. Disponível em:\n\\<www.feminamericas.net/\\>. Acesso em: 20/11/2011; TRIB. SUP. ELEIT.\nDisponível em: \\<www.tse.gov.br/\\>. Acesso em: 19/2/2011; TRIB. CONTAS\nRJ. Disponível em: \\<www.tce.rj.gov.br/\\>. Acesso em: 20/2/2011.\n","dic":"DPRRJ"}
