{"title":"GAMA, Odair","cargoss":["Deputado Estadual","Constituinte"],"cargos_esp":[0,"est"],"datas_ini":[1975,1975],"datas_fim":[1983,1975],"estados":["RJ","RJ"],"autor":["Juliana Gagliardi"],"content":"**GAMA,** **Odair**\n\n\\* dep. est. RJ 1975-1983; const. est. RJ 1975.\n\n*Odair Miguel da Gama* nasceu no dia 14 de novembro de 1929.\n\nFiliado à Arena, candidatou-se a deputado estadual no Rio de Janeiro em\nnovembro de 1970, mas não se elegeu.\n\nCandidatou-se novamente em novembro de 1974. Eleito, com base política\nem Três Rios (RJ), assumiu uma cadeira na Assembleia Legislativa do\nEstado do Rio de Janeiro (ALERJ) no ano seguinte. O presidente Ernesto\nGeisel havia enviado um projeto de lei ao Congresso Nacional que previa\na fusão dos estados da Guanabara e do Rio de Janeiro e que, depois de\nrápida tramitação, foi transformado em lei em julho de 1974. Os\ndeputados estaduais, que haviam sido eleitos em novembro de 1974 pelos\ndois antigos estados e tomado posse em fevereiro de 1975 para os\nmandatos ordinários, passaram a formar, em março, a Assembleia\nConstituinte encarregada de elaborar a Constituição do novo estado do\nRio de Janeiro – resultante da fusão que ocorreria no dia 15 de março.\nNesse mesmo dia tomou posse o governador nomeado, almirante Faria Lima.\n\nNa Assembleia Constituinte, instalada no dia 15 de março, Odair Gama\nintegrou a Comissão Constitucional. Na ocasião a maioria emedebista era\nligada a Chagas Freitas e defendia que não se prolongassem no tempo os\ntrabalhos constituintes. Em apenas quatro meses a nova Carta foi\nfinalizada.\n\nCom a promulgação da nova Constituição estadual em 23 de julho de 1975,\nOdair Gama retornou ao exercício do mandato ordinário na ALERJ.\n\nNas eleições de novembro de 1978 reelegeu-se deputado estadual no Rio de\nJaneiro. Nesse mandato foi quarto secretário da Mesa Diretora da ALERJ.\n\nDurante sua trajetória presidiu também o Instituto de Previdência da\nAssembleia Legislativa do Estado do Rio de Janeiro (IPALERJ).\n\nFaleceu em agosto de 2009.\n\nSeu filho, Odair Miguel da Gama Júnior, foi secretário de Controle\nInterno e coordenador da Agência de Desenvolvimento de Três Rios.\n\n*Juliana Gagliardi*\n\nFONTES: ASSEMB. LEGISL. RJ. *Informações e produtos parlamentares*; CÂM.\nMUN. RJ. Disponível em:\n\\<http://mail.camara.rj.gov.br/APL/Legislativos/contlei.nsf/874a3fe356a1d6970325774c006180d5/13f3489d42fe5cdd032576ee005f40c2?OpenDocument\\>.\nAcesso em: 12/7/2011.\n","ref":"FONTES: ASSEMB. LEGISL. RJ. *Informações e produtos parlamentares*; CÂM.\nMUN. RJ. Disponível em:\n\\<http://mail.camara.rj.gov.br/APL/Legislativos/contlei.nsf/874a3fe356a1d6970325774c006180d5/13f3489d42fe5cdd032576ee005f40c2?OpenDocument\\>.\nAcesso em: 12/7/2011.\n","dic":"DPRRJ"}
