{"title":"GONÇALVES, Nelson","cargoss":["Deputado Estadual"],"cargos_esp":[0],"datas_ini":[1995],"datas_fim":[2011],"estados":["RJ"],"autor":["Ana Beatriz Paes"],"content":"**GONÇALVES, Nelson**\n\n\\* dep. est. RJ 1995-2011.\n\n*Nelson dos Santos Gonçalves Filho* nasceu na cidade de Niterói (RJ) no\ndia 9 de abril de 1956, filho de Nelson dos Santos Gonçalves e de Gecy\nVieira Gonçalves. Seu pai era médico e foi prefeito de Volta Redonda por\ndois mandatos.\n\nAntes de se formar, investiu alguns anos em sua carreira, participando\nde cursos extracurriculares e atividades acadêmicas. Entre eles o Curso\nde Temas de Endocrinologia e o II Curso de Genética Médica, na Faculdade\nde Medicina de Vassouras, o curso de endoscopia urinária e de radiologia\ndo aparelho urinário, no XVII Congresso Brasileiro de Urologia, o curso\nbásico em eletrocardiografia na 4^a^ Enfermaria da Santa Casa de\nMisericórdia do Rio de Janeiro, e o curso de urgências urológicas, no\nCentro de Estudos do Hospital da Companhia Siderúrgica Nacional (CSN),\nem Volta Redonda, Rio de Janeiro. Participou também de seminários,\nconferências e congressos. Formou-se em medicina em 1980 pela Faculdade\nde Medicina de Vassouras, no estado do Rio de Janeiro e, em outubro do\nmesmo ano, publicou sua primeira obra na revista do Hospital da\nSiderúrgica Nacional (HSN), chamado “Cólica nefrética – abordagem do\npaciente em serviço de emergência”.\n\nFoi assistente do curso de nutrição hipercalórica e do curso de\nemergências cirúrgicas no I Simpósio de Saúde do Hospital da Companhia\nSiderúrgica Nacional (CSN), em Vassouras e em Volta Redonda, em 1981 e\npublicou sua segunda obra na revista do HSN, chamado “Fístula\nUreterocólica”.\n\nAtuou profissionalmente como interno do Hospital da CSN, Volta Redonda,\nentre os anos de 1979 e 1980, e, em 1980, foi médico plantonista no\nHospital São João Batista. No ano seguinte foi médico residente do\nHospital da CSN e da Secretaria de Saúde do Estado do Rio de Janeiro,\ncargo que ocupou até o ano de 1982. Neste ano também trabalhou como\nmédico urologista no Hospital da CSN e no Instituto de Urologia e\nNefrologia em Volta Redonda.\n\nAlém de sua atuação profissional, participou de atividades sindicais,\nrepresentativas de classe e associativas, entre as quais foi membro do\nConselho Fiscal do Aeroclube de Volta Redonda de 1983 e 1985; foi Grande\nBenemérito da Liga de Desportos de Volta Redonda; fundou o Lions Club da\nCidade do Aço e compôs o Conselho de Ética Médica do Hospital da CSN. Em\nseu rol de condecorações, podemos destacar o título de Cidadão\nVoltaredondense, concedido pela Câmara Municipal de Volta Redonda;\nTítulo de Cidadão Barramansense, concedido pela Câmara Municipal de\nBarra Mansa; Medalha Dom João VI da Escola Superior das Forças Armadas;\nMedalha Sérgio Braga da Associação Comercial de Volta Redonda. Entre os\nanos de 1991 e 1993 foi presidente do Diretório Municipal do Partido da\nSocial Democracia Brasileira (PSDB), de Volta Redonda. Em 1988, 1992 e\n1996 concorreu à Prefeitura de Volta Redonda, mas sem nunca ter obtido\nêxito.\n\nEm 1994 foi eleito deputado estadual no Rio de Janeiro, na legenda do\nPartido da Social Democracia Brasileira (PSDB). Assumiu o mandato no ano\nseguinte para a legislatura compreendida entre os anos de 1995 e 1999,\nna Assembleia Legislativa do Estado do Rio de Janeiro (ALERJ). Durante o\nmandato foi vice-líder do PSDB, vice-presidente da Comissão de Obras\nPúblicas, membro efetivo da Comissão de Saúde, Trabalho, Legislação\nSocial e Seguridade Social, da Comissão Parlamentar de Inquérito (CPI)\npara “apurar denúncias de irregularidades no Instituto de Assistência\ndos Servidores do Estado do Rio de Janeiro – IASERJ”, da Comissão\nEspecial para estudar as causas e soluções da poluição e degradação da\nbacia hidrográfica do rio Paraíba do Sul, da Comissão de Indicações\nLegislativas, da Comissão de Redação, da Comissão da Constituição e\nJustiça e segundo suplente da Mesa Diretora.\n\nEm 1998 foi reeleito deputado estadual, agora na legenda do Partido\nSocialista Brasileiro (PSB). Durante o segundo mandato foi presidente da\nComissão Especial para acompanhar denúncias sobre a explosão do Memorial\ndos Trabalhadores em Volta Redonda, sub-relator da comissão especial\npara estudar a aplicação da Legislação de Compensação Financeira\nreferente ao aproveitamento de recursos hídricos e dos recursos minerais\nno âmbito do estado do Rio de Janeiro em 1999, e em 2001 e 2002 atuou\ncomo segundo suplente da Mesa Diretora.\n\nEm 2002 foi novamente eleito pelo PSB. Os municípios que mais\ncontribuíram para sua votação, com um total de 97,95% dos votos do\ncandidato, foram oito: Volta Redonda, Barra Mansa, Valença, Vassouras,\nPinheiral, Barra do Piraí, Rio Claro, Rio de Janeiro.\n\nNas eleições de 2006 foi, pela quarta vez, eleito deputado estadual.\nAssumiu o mandato em 2007 para a legislatura 2007-2011 e nesse período\npresidiu a Comissão Permanente dos Servidores Públicos, foi\nvice-presidente da Comissão Permanente de Agricultura e membro das\nComissões de Saúde, Educação, Legislação e Trabalho e Desenvolvimento\nRegional, entre outras; e vice-liderou o governo na Assembleia\nLegislativa.\n\nDurante o período compreendido entre as quatro legislaturas que atuou,\nfoi autor de diversas leis, entre as quais se destacam as de:\nimplantação do programa “adote uma escola”; autorização das cooperativas\nde trabalho a participarem das licitações públicas; priorização do\natendimento nos serviços públicos de saúde aos portadores de\nnecessidades especiais; proibição da venda de produtos tóxicos a menores\nde 18 anos; autorização para a implantação da Universidade Pública\nEstadual do Sul e Centro Sul do Estado (Unisul); autorização para a\nimplantação do Pró-Turismo, programa integrado para o desenvolvimento do\nturismo no Médio Paraíba e Centro Sul do Estado; implantação do\nPro-Metal, programa de incentivo ao Polo Metal-Mecânico do estado Rio de\nJaneiro; a que Institui no âmbito das escolas o programa Escolas Sem\nDrogas; a que obriga as academias de ginástica e similares a alertarem\nsobre os riscos do uso inadequado de anabolizantes; criação do Dia\nEstadual em Defesa do Rio Paraíba do Sul; e a criação do Polosul,\nprograma de incentivo à Indústria Têxtil do Sul do estado do Rio de\nJaneiro.\n\nAtuou também junto ao Poder Executivo no sentido de que fosse construído\no novo prédio do Batalhão da Polícia Militar de Volta Redonda; na\nreforma e ampliação de 60 escolas estaduais; na pavimentação da rodovia\nRJ-153 de Volta Redonda a Santa Isabel do Rio Preto, construção do novo\nInstituto Médico Legal de Volta Redonda, recuperação da RJ-155 de Barra\nMansa a Angra dos Reis, liberação de recursos para o Centro de\nTratamento Intensivo do Hospital de Rio Claro, dotação orçamentária para\nos hospitais de Santa Isabel do Rio Preto e Conservatória, entre outros.\n\nEm 2010 tentou eleger-se para seu quinto mandato na ALERJ, mas com\n35.531 votos não obteve sucesso.\n\nSeu filho, Nelson Kruschewsky dos Santos Gonçalves, foi eleito\nvice-prefeito de Volta Redonda no ano de 2006.\n\n*Ana Beatriz Paes*\n\nFONTES: ASSEMB. LEGISL. RJ. *Deputados estaduais fluminenses*. Sexta\nlegislatura (1995-1999), Sétima legislatura (1999-2003); *Jornal da\nALERJ* (28/10-3/11/2004, 1-15/4/2010); ASSEMB. LEGISL. RJ. Disponível\nem: \\<www.alerj.rj.gov.br/common/deputado.asp?codigo=178\\>; TRIB. SUP.\nELEIT. Disponível em:\n\\<www.tse.gov.br/partidos/desempenho/depDistEst/rj/de/rjde40190.htm\\>.\n","ref":"FONTES: ASSEMB. LEGISL. RJ. *Deputados estaduais fluminenses*. Sexta\nlegislatura (1995-1999), Sétima legislatura (1999-2003); *Jornal da\nALERJ* (28/10-3/11/2004, 1-15/4/2010); ASSEMB. LEGISL. RJ. Disponível\nem: \\<www.alerj.rj.gov.br/common/deputado.asp?codigo=178\\>; TRIB. SUP.\nELEIT. Disponível em:\n\\<www.tse.gov.br/partidos/desempenho/depDistEst/rj/de/rjde40190.htm\\>.\n","dic":"DPRRJ"}
