{"title":"GOULART, João","cargoss":["Senador","Deputado Estadual"],"cargos_esp":["est",0],"datas_ini":[1891,1901],"datas_fim":[1891,1903],"estados":["RJ","RJ"],"autor":[0],"content":"**GOULART, João**\n\n\\* sen. est. RJ 1891; dep. est. RJ 1901-1903.\n\n*João Ferreira Goulart* nasceu na Fazenda de Nossa Senhora da Luz, na\nIlha de Itaoca, freguesia de São Gonçalo, então integrante da Imperial\nCidade de Niterói, capital da província do Rio de Janeiro, no dia 12 de\noutubro de 1844, filho de Manuel Ferreira Goulart e de Clara Maria\nGoulart.\n\nEm 1856 ingressou no Liceu Tintori, em Niterói, de onde saiu para o\nseminário. Foi ordenado presbítero no dia 20 de junho de 1869. Nessa\nmesma data foi nomeado capelão do corpo de polícia da Província do Rio\nde Janeiro, cargo exercido até 24 de junho de 1871, quando assumiu a\nparóquia de São Gonçalo de Amarante, na freguesia niteroiense de mesmo\nnome. Respondeu pela paróquia gonçalense até sua morte. Durante esse\nperíodo acumulou o pastoreio das freguesias de Nossa Senhora da\nConceição de Cordeiros, de São Sebastião de Itaipu, em Niterói, e de Bom\nJesus do Monte de Paquetá, então pertencente à Corte.\n\nEm primeiro de junho de 1873 foi agraciado, pelo imperador Pedro II, com\na comenda de Cavaleiro da Ordem de Cristo. Por provisão da princesa\nIsabel, foi nomeado cônego da Capela Imperial em 18 de agosto de 1877 e,\nem 1888, recebeu a Comenda da Rosa, por serviços prestados à educação.\n\nIniciou-se na política durante o Império exercendo dois mandatos de\ndeputado provincial de 1878 a 1883, pelo Partido Conservador. Ocupou o\ncargo de delegado educacional da província em São Gonçalo, em 1885,\nquando criou cerca de 20 escolas primárias.\n\nApós a instauração do regime republicano Francisco Portela foi nomeado,\npelo presidente da República, marechal Deodoro da Fonseca (1889-1891),\ninterventor estadual. Republicano histórico, Francisco Portela\nafastou-se dos antigos aliados buscando constituir um grupo político\nautônomo que lhe desse sustentação, alicerçado no apoio do presidente da\nRepública. Uma de suas estratégias foi a criação de novos municípios. Ao\nfindar a monarquia a província do Rio de Janeiro possuía 36\nmunicipalidades. O novo governador criou 20 novos municípios. O Cônego\nGoulart foi o principal articulador da emancipação de São Gonçalo,\ndecretada pelo governador em 22 de setembro de 1890. O novo município\nretirou da capital fluminense seu distrito rural, composto de três\nfreguesias, São Gonçalo, Nossa Senhora da Conceição de Cordeiros e São\nSebastião de Itaipu, e representava cerca dois terços de sua área\nterritorial.\n\nA Constituição provisória fluminense estabelecia que o Legislativo\norganizar-se-ia no sistema bicameral, possuindo um senado e uma câmara\nde deputados. Em 20 de março de 1891 foi eleito o congresso estadual\nconstituinte que promulgou a nova Carta em julho seguinte. O cônego\nGourlart foi eleito senador nesse pleito. Após a redação da\nConstituição, as casas legislativas tornaram-se regulares. A queda de\nDeodoro em 23 de novembro de 1891 precipitou a queda dos seus aliados\nnos estados. Em 10 de dezembro daquele ano, Francisco Portela renunciou\nao cargo. No dia seguinte o contra-almirante Baltasar da Silveira foi\nempossado como interventor federal e dissolveu o Legislativo estadual.\n\nO interventor realizou eleições para a nova constituinte estadual em 21\nde dezembro de 1891. A nova Assembleia elegeu José Tomás Porciúncula seu\npresidente e no dia 24 de abril de 1892 foram realizadas novas eleições\npara deputados estaduais e presidente do estado. Porciúncula foi eleito\npara chefia do Executivo fluminense e empossado em 3 de maio do mesmo\nano. Dois dias após a posse o novo governador extinguiu diversas\nmunicipalidades criadas por Portela, entre elas São Gonçalo. Com a\nsanção ao projeto do deputado Carlos de Sá Carvalho, o município foi\nrecriado por lei de 17 de dezembro daquele ano.\n\nEm 17 de janeiro de 1893 houve eleição dos vereadores e de um juiz de\npaz da Câmara Municipal de São Gonçalo. O cônego Goulart foi eleito,\ncomo o sexto mais votado, tendo obtido 373 votos. Empossado em fevereiro\nde 1893, foi preso no fim do ano sob a acusação de ser monarquista e de\nhaver fornecido água e víveres aos rebelados da Revolta da Armada\n(1893-1894). A Câmara Municipal cassou-lhe o mandato, pois seu regimento\ninterno estabelecia que a falta de um vereador em quatro sessões levaria\nà perda da representação popular.\n\nRetornou à política quando disputou uma vaga para a Assembleia\nLegislativa do Estado do Rio de Janeiro (ALERJ), no pleito de dezembro\nde 1900. Eleito para a legislatura de 1901 a 1904, não chegou a concluir\no mandato, pois faleceu antes do seu término. Durante sua atividade\nparlamentar posicionou-se sobre assuntos religiosos e econômicos.\nParticipou da Comissão de Estatística, Divisão Civil e Judiciária.\n\nFaleceu no dia 11 de março de 1903 e foi sepultado no cemitério de São\nGonçalo. Através de subscrição pública, foram arrecadados 15 contos de\nréis para a construção de um mausoléu inaugurado em 13 de novembro 1904.\n\nTornou-se patrono de cadeiras na Academia Gonçalense de Letras, Artes e\nCiências (AGLAC) e no Instituto Histórico e Geográfico (IHGSG), no\nmunicípio de São Gonçalo.\n\n*Jorge Cesar Pereira Nunes/Rui Aniceto Nascimento Fernandes/Vicente Saul\nMoreira dos Santos*\n\nFONTES: ASSEMB. LEGISL. RJ. *Anais* (1901, 1903). FERREIRA, M.\n*República*;NUNES, J. *Chefes*; SILVA, S. *Nasceram*.\n","ref":"FONTES: ASSEMB. LEGISL. RJ. *Anais* (1901, 1903). FERREIRA, M.\n*República*;NUNES, J. *Chefes*; SILVA, S. *Nasceram*.\n","dic":"DPRRJ"}
