{"title":"GOUVEIA, Soares","cargoss":["Constituinte","Deputado Estadual"],"cargos_esp":["est",0],"datas_ini":[1892,1892],"datas_fim":[1892,1903],"estados":["RJ","RJ"],"autor":[0],"content":"**GOUVEIA, Soares**\n\n\\* const. est. RJ 1892; dep. est. RJ 1892-1903.\n\n*Francisco Soares Gouveia* teve como base política a cidade de\nPetrópolis (RJ).\n\nA primeira Constituição fluminense havia sido elaborada em 1891 pelos\npartidários de Francisco Portela, então presidente do estado do Rio de\nJaneiro, e anulada após a renúncia deste, em dezembro do mesmo ano. No\ndia 31 de janeiro de 1892 uma nova eleição foi realizada para compor a\nnova Assembleia Constituinte, que foi formada por membros do Partido\nRepublicano Fluminense (PRF), presidida por José Tomás da Porciúncula e\nque promulgaria, no dia 9 de abril do mesmo ano, a segunda Constituição\nfluminense. Nessa ocasião Soares Gouveia se elegeu. A nova Assembleia,\ncomposta por partidários do PRF, procurou reorganizar os estatutos\njurídicos do estado que tinham sido constituídos para favorecer\nFrancisco Portela e representou o início do domínio do PRF na política\nestadual.\n\nNo dia 24 de abril foram realizadas eleições para a composição da\nAssembleia Legislativa do Estado do Rio de Janeiro (ALERJ). Soares\nGouveia elegeu-se deputado estadual na legenda do PRF. No mesmo pleito\nJosé Tomás da Porciúncula elegeu-se presidente do estado do Rio de\nJaneiro (1892-1894). Ainda em 1892 elegeu-se para a Comissão de Obras\nPúblicas. Em 1893, na Sessão Extraordinária da ALERJ que discutiu a\nmudança da capital do estado de Niterói para Petrópolis, foi eleito para\na “Comissão Especial para dar parecer sobre a mudança da Capital”. Com\nbase política em Petrópolis, tinha interesse na transferência da\ncapital. Em 1894 foi novamente eleito para a Comissão de Obras Públicas.\n\nNas eleições realizadas em 20 de maio de 1895 foi reeleito deputado pelo\nPRF. Em 1895 ingressou na Comissão de Obras Públicas. Em 1896 e 1897\nreelegeu-se para a mesma Comissão. Em 26 de dezembro de 1897 foi\nnovamente reeleito e em 1898 foi eleito para a Comissão da Força\nPública. Em 1898 e 1899 reelegeu-se para a mesma Comissão. Durante a\nlegislatura, o PRF sofreu uma cisão devido às divergências envolvendo o\nentão presidente estadual Alberto Torres (1897-1900) e José Tomás da\nPorciúncula, ex-presidente estadual (1892-1894) e agora senador\n(1897-1901). O novo presidente estadual rebelou-se contra a liderança\npartidária de Porciúncula, que exigia que o Executivo estadual\nfortalecesse seu partido. Diante dessa situação, em maio de 1899, quatro\nmembros da comissão executiva do PRF renunciaram aos seus cargos dentro\nda agremiação e em 23 de julho fundaram o Partido Republicano do Rio de\nJaneiro (PRRJ), liderados por Alberto Torres. Nesse contexto, Soares\nGouveia ingressou no PRRJ.\n\nEm 30 de dezembro de 1900 foi novamente reeleito deputado estadual,\nagora na legenda do PRRJ, no primeiro pleito que essa agremiação\ndisputou. Em 1901 elegeu-se para a Comissão de Verificação dos Poderes\ndo primeiro e segundo distrito. Compôs o grupo ligado a Hermogêneo Silva\ndentro do PRRJ, que rivalizaria com os nilistas o controle da política\nfluminense. Esse conflito agudizou-se no debate sobre o retorno da\ncapital para Niterói. Quando foi apresentado o projeto de mudança da\ncapital do estado para Niterói, Francisco Gouvêa fez parte do “Grupo de\nPetrópolis”, contrário à mudança. Seu grupo ocupou cargos estratégicos\nna Mesa Diretora da ALERJ em 1901, e impediu que o projeto de mudança\nfosse votado. Na oposição aos antimudancistas estava Nilo Peçanha, que\ntravou contatos com várias câmaras municipais do estado e usou da\nproximidade e da amizade com o presidente do estado Quintino Bocaiúva\n(1900-1903) para levar o projeto à ALERJ em 1902. Desta vez os\nantimudancistas não conseguiram ocupar os cargos estratégicos do\nLegislativo estadual, o que levou a aprovação da transferência da\ncapital do estado de Petrópolis para Niterói. Em 1903, ano final da\nlegislatura, participou da reforma da Constituição estadual, que\ndeterminou, entre outras medidas, o fortalecimento do Executivo estadual\na partir da diminuição das atribuições do Legislativo e do Judiciário; o\naumento do mandato do presidente estadual de três para quatro anos; e a\nredução do número de deputados estaduais de 60 para 45. Ainda nesse ano\nintegrou a Comissão especial responsável pela apuração e verificação de\npoderes do presidente e vice-presidente do estado.\n\nApós este mandato, não se reelegeu para deputado estadual no Rio de\nJaneiro.\n\nFoi também presidente da Câmara Municipal de Petrópolis.\n\n*Samuel Silva Rodrigues de Oliveira*\n\nFONTES: ASSEMB. LEGISL. RJ. *Anais*(14/11/1892-12/1/1893, 1/3-9/4/1892,\n8/1892, 13-26/1, 1/8/1893, 1895, 1897, 1899, 1900, 1901, 1902, 1903);\nFERREIRA, M. *República*.\n","ref":"FONTES: ASSEMB. LEGISL. RJ. *Anais*(14/11/1892-12/1/1893, 1/3-9/4/1892,\n8/1892, 13-26/1, 1/8/1893, 1895, 1897, 1899, 1900, 1901, 1902, 1903);\nFERREIRA, M. *República*.\n","dic":"DPRRJ"}
