{"title":"AMARAL, Ubaldino do","cargoss":["Constituinte","Senador","Senador","Ministro do Supremo Tribunal Federal","Prefeito"],"cargos_esp":[0,0,0,0,0],"datas_ini":[1891,1892,1891,1894,1897],"datas_fim":[1891,1894,1891,1896,1898],"estados":[0,"PR","PR",0,"DF"],"autor":["Luciana Pinheiro"],"content":"**AMARAL, Ubaldino do**\n\n\\* const. 1891; sen. PR 1891 e 1892-1894; min. STF 1894-1896; pref. DF\n1897-1898.\n\n*Ubaldino do Amaral Fontoura*nasceu na Lapa (PR) no dia 27 de agosto de\n1842, filho de Francisco das Chagas do Amaral e de Gertrudes Pilar do\nAmaral.\n\nFez os primeiros estudos no Colégio São João do Lageado, no município\npaulista de Sorocaba, e em 1867 diplomou-se em ciências jurídicas e\nsociais pela Faculdade de Direito de São Paulo. Recém-formado retornou a\nSorocaba, iniciando a carreira de advogado. No mesmo município, onde\npermaneceu por sete anos e fundou diversas entidades assistenciais e\nfilantrópicas, participou ativamente da fundação dos periódicos\n*Ipanema* e *Sorocabano* e trabalhou pela criação da Via Férrea\nSorocabana.\n\nEm 1874 transferiu-se para o Rio de Janeiro, então capital do Império,\ndando continuidade à carreira de advogado. Em janeiro de 1884 tornou-se\nmembro efetivo do Conselho Diretor da Instrução Primária e Secundária do\nmunicípio da Corte, por nomeação ministerial. Abolicionista ferrenho e\nrepublicano histórico, em novembro de 1889, logo após a proclamação da\nRepública, assumiu o cargo de inspetor da Alfândega do Rio de Janeiro.\nEm fevereiro seguinte foi nomeado presidente da Comissão Inspetora da\nCasa de Correção da capital federal. Em 1890 foi também presidente do\nConselho de Intendência Municipal.\n\nEleito senador pelo Paraná ao Congresso Nacional Constituinte reunido em\n15 de novembro de 1890, nele ocupou uma cadeira a partir de janeiro de\n1891 e destacou-se nos trabalhos da chamada “Comissão dos 21”, a qual\npresidiu, ficando à frente das discussões referentes ao projeto da\nConstituição Federal. Promulgada a Constituição em 24 de fevereiro de\n1891, passou em junho a exercer o mandato ordinário até dezembro, quando\nrenunciou. Em junho de 1892 foi novamente eleito senador, tomando posse\nno mês seguinte. Em maio de 1894 foi escolhido primeiro-secretário e\nvice-presidente do Senado, funções que desempenhou até dezembro do mesmo\nano. Renunciou então, mais uma vez, ao mandato ao ser nomeado ministro\ndo Supremo Tribunal Federal (STF), ao qual pertenceu até maio de 1896.\n\nEm 25 de novembro de 1897 foi nomeado pelo então presidente da República\nPrudente de Morais (1894-1898) prefeito do Distrito Federal, em\nsubstituição ao prefeito interino Joaquim José da Rosa. Exerceu curto\nmandato administrativo, tendo renunciado em 17 de novembro de 1898,\nalegando incompatibilidades políticas durante o processo de reforma\nadministrativa da prefeitura. Seu lugar foi ocupado por Luís van Erven.\n\nNo decorrer de 1903 assumiu a direção do Banco da República e tornou-se\nmembro do Conselho da Junta Administrativa da Caixa de Amortização. Em\n1909 exerceu a presidência do Banco do Brasil.\n\nAo longo de sua trajetória profissional exerceu também atividades\ndiplomáticas, atuando como árbitro brasileiro nos tribunais mistos\nbrasileiro-boliviano e brasileiro-peruano e como embaixador da Comissão\nPermanente de Arbitramento do Tribunal de Haia. Presidente da Sociedade\nde Legislação Comparada, defendeu o Paraná nas discussões referentes aos\nlimites geográficos com Santa Catarina. Foi professor de diversas\ninstituições de ensino, entre as quais a Faculdade Livre de Direito do\nRio de Janeiro.\n\nFaleceu no Distrito Federal em 22 de janeiro de 1920.\n\nFoi casado com Rosa Cândida de Oliveira Amaral.\n\nEntre suas publicações destacam-se a peça teatral *O soldado brasileiro*\n(1868), escrita em parceria com Cândido Barata Ribeiro, *Discurso no\nGrande Oriente do Brasil* (1876), *Segunda Conferência do Grande\nOriente* (1877) e *Saldanha Marinho, perfil biográfico*.\n\n*Luciana Pinheiro*\n\nFONTES: AZEVEDO, Elisabeth R. *Um palco*; COL. ESTADUAL DR. UBALDINO DO\nAMARAL. Disponível em: \\<www.snpubaldino.seed.pr.gov.br/\\>. Acesso em:\n8/10/2010; MUSEU MAÇÔNICO PARANAENSE. Disponível em:\n\\<www.museumaconicoparanaense.com\\>. Acesso em: 8/10/2010; Núcleo de\nMemória Política Carioca e Fluminense. Disponível em:\n\\<www.alerj.rj.gov.br/memoria/historia/prefdf/ubaldino\\_amaral.html\\>.\nAcesso em: 8/10/2010; PLANALTO. Disponível em: \\<www.planalto.gov.br/\\>.\nAcesso em: 8/10/2010; SENADO. Disponível em: \\<www.senado.gov.br/\\>.\nAcesso em: 8/10/2010; SUPR. TRIB. FED. Disponível em:\n\\<www.stf.jus.br\\>. Acesso em: 8/10/2010.\n","ref":"FONTES: AZEVEDO, Elisabeth R. *Um palco*; COL. ESTADUAL DR. UBALDINO DO\nAMARAL. Disponível em: \\<www.snpubaldino.seed.pr.gov.br/\\>. Acesso em:\n8/10/2010; MUSEU MAÇÔNICO PARANAENSE. Disponível em:\n\\<www.museumaconicoparanaense.com\\>. Acesso em: 8/10/2010; Núcleo de\nMemória Política Carioca e Fluminense. Disponível em:\n\\<www.alerj.rj.gov.br/memoria/historia/prefdf/ubaldino\\_amaral.html\\>.\nAcesso em: 8/10/2010; PLANALTO. Disponível em: \\<www.planalto.gov.br/\\>.\nAcesso em: 8/10/2010; SENADO. Disponível em: \\<www.senado.gov.br/\\>.\nAcesso em: 8/10/2010; SUPR. TRIB. FED. Disponível em:\n\\<www.stf.jus.br\\>. Acesso em: 8/10/2010.\n","dic":"DPRRJ"}
