{"title":"GRIPP, Reinaldo ===============","cargoss":["Deputado federal",0],"cargos_esp":[0,0],"datas_ini":[2001,2005],"datas_fim":[2002,2007],"estados":["RJ",0],"autor":[0],"content":"GRIPP, Reinaldo\n===============\n\n\\* dep. fed. RJ 2001-2002; 2005-2007.\n\n*Reinaldo Gripp Lopes* nasceu em Nilópolis (RJ) no dia 11 de fevereiro\nde 1952, filho de Newton Lopes e Hydee Gripp Lopes.\n\nFormado em medicina pela Universidade Gama Filho em 1977, começou sua\ncarreira como médico na Secretaria Municipal de Saúde de Nilópolis em\n1978. Em 1980 filiou-se ao Partido do Movimento Democrático Brasileiro\n(PMDB). No ano seguinte trabalhou como médico na Secretaria de Saúde do\nestado do Rio de Janeiro. Em 1983 desligou-se do PMDB. Sem partido\ndurante uma década, filiou-se ao Partido Democrático Trabalhista no ano\nde 1993, quando também foi presidente do Conselho Municipal de Saúde de\nNilópolis, cargo que exerceria até 2000.\n\nEm 1997 retornou ao Partido do Movimento Democrático Brasileiro (PMDB) e\ncandidatou-se no ano seguinte a deputado federal pelo Rio de Janeiro,\nobtendo uma suplência na legislatura 1999-2003. Em 2001 filiou-se\nrapidamente ao Partido da Social Democracia Brasileira (PSDB),\nligando-se em seguida ao Partido Liberal (PL). Neste mesmo ano exerceu o\nmandato como suplente de 5 de junho a 11 de outubro de 2001, de 6 de\nnovembro de 2001 a 3 de abril de 2002, reassumindo o mandato em 15 de\noutubro de 2002. Neste ano, candidatou-se novamente a uma vaga na\nCâmara, obtendo nova suplência para a legislatura 2003-2007.\n\nDe 2003 a 2004 Gripp foi vice-presidente regional do PL e, de 2004 a\n2005, secretário regional do partido, tendo sido nomeado tesoureiro\nregional da legenda em seguida. Assumiu o mandato de deputado em 15 de\nsetembro de 2005 em substituição ao deputado Carlos Rodrigues, que\nrenunciara em 12 de setembro. Na Câmara, atuou como titular na comissão\npermanente de Seguridade Social e Família.\n\nEm 2006 foi acusado de participar de um esquema clandestino que envolvia\ncorrupção ativa, formação de quadrilha e fraude em licitações para\ncompra de ambulâncias e equipamentos hospitalares com dinheiro da União.\nEste episódio ficou conhecido como o “escândalo dos sanguessugas”.\nSegundo o empresário Luiz Antônio Vedoin, acusado como um dos cabeças do\nesquema, Reinaldo Gripp dividia as comissões relativas às suas emendas\ncom Carlos Rodrigues, que comandava os deputados ligados à Igreja\nUniversal. Após a renúncia de Rodrigues, Gripp teria assumido as suas\nemendas. Na ocasião, Vedoin afirmou também que Gripp tentou aumentar\nsuas comissões de 10% para 30%, mas não conseguiu. Segundo Vedoin, o\nparlamentar pretendia usar o dinheiro arrecadado no esquema na campanha\neleitoral de 2006. Reinaldo Gripp, entretanto, negou conhecer Vedoin e\ndesconsiderou suas acusações, alegando que não tinham sentido, posto que\na autoria de emendas, como as que propõem licitação, não pode ser\ntransferida. O ex-deputado afirmou ainda que não exercia seu mandato em\n2003 no período em que foi acusado de ter apresentado as emendas. Gripp\nfoi absolvido junto com outros 25 envolvidos no escândalo, enquanto 48\noutras autoridades foram derrubadas.\n\nEm 2007 o Tribunal Regional Eleitoral (TRE) do Rio de Janeiro condenou\nReinaldo Gripp pela prática de compra de votos durante a campanha\neleitoral de 2006, tornando-o inelegível por três anos. Na ocasião,\nGripp foi acusado de trocar votos por cirurgias gratuitas de laqueadura\ne varizes na casa de Saúde Bom Pastor, em Queimados (RJ). Recorreu ao\nTribunal Superior Eleitoral (TSE), foi absolvido e pôde participar das\neleições. Porém, não conseguiu se eleger.\n\nFONTES: CÂM. DEP. *Deputados brasileiros*. Repertório\n(1999-2003/2003-2007); Direito2 (17/10/2006); *Folha de S.Paulo* (17/5,\n31/10/2007).\n","ref":"FONTES: CÂM. DEP. *Deputados brasileiros*. Repertório\n(1999-2003/2003-2007); Direito2 (17/10/2006); *Folha de S.Paulo* (17/5,\n31/10/2007).\n","dic":"DPRRJ"}
