{"title":"GUERRA, Newton","cargoss":["Deputado Estadual"],"cargos_esp":[0],"datas_ini":[1967],"datas_fim":[1970],"estados":["RJ"],"autor":[0],"content":"**GUERRA, Newton**\n\n\\* dep. est. RJ 1967-1970.\n\n*Newton Guerra* nasceu em Niterói (RJ).\n\nIngressou na política no ano de 1946 quando, eleito vereador, assumiu a\npresidência da Câmara Municipal de Niterói presidindo-a durante os anos\nde 1947 a 1951.\n\nSua aproximação com a política estadual se deu quando em 1947, pela\nUnião Democrática Nacional (UDN), pleiteou uma cadeira de deputado\nestadual na Assembleia Legislativa do Estado do Rio de Janeiro (ALERJ).\nPorém, os 1.242 votos que recebeu não foram suficientes para que se\nelegesse.\n\nNa eleição de 1954, já no Partido Socialista Brasileiro (PSB), novamente\nconcorreu a uma vaga no legislativo estadual e também não obteve sucesso\nno pleito. Ainda concorreria mais duas vezes, 1958 (pelo Partido Social\nProgressista – PSP) e 1962 (pelo Partido Trabalhista Brasileiro – PTB),\naté conseguir sua eleição para deputado estadual no pleito de 15 de\nnovembro de 1966. Nesse, filiado ao Movimento Democrático Brasileiro\n(MDB), recebeu 8.044 votos.\n\nAssumiu sua cadeira na Assembleia Legislativa em 1^o^ de fevereiro de\n1967. Durante esta legislatura foi líder da oposição. Permaneceu no\nLegislativo estadual até o ano de 1968 quando teve seu mandato cassado\npelo Ato Institucional n^o^ 5, de março de 1964. Ainda tentou voltar ao\nLegislativo estadual em 1982, mas com 12.088 votos não consegui se\neleger.\n\nFoi também médico.\n\n*Ioneide Piffano Brion de Souza*\n\nFONTES: ASSEMB. LEGISL. *Anais*; BIO. Newton Guerra. Disponível em:\n\\<http://camaraniteroi.rj.gov.br/2010/12/08/newton-guerra\\>. Acesso em:\n10/6/2011; CARDIANO, F. *Eleições*.\n","ref":"FONTES: ASSEMB. LEGISL. *Anais*; BIO. Newton Guerra. Disponível em:\n\\<http://camaraniteroi.rj.gov.br/2010/12/08/newton-guerra\\>. Acesso em:\n10/6/2011; CARDIANO, F. *Eleições*.\n","dic":"DPRRJ"}
