{"title":"GUIMARÃES JÚNIOR, Manuel Antunes de Castro","cargoss":["Prefeito",0],"cargos_esp":["Niterói",0],"datas_ini":[1929,1946],"datas_fim":[1930,1946],"estados":[0,0],"autor":[0],"content":"**GUIMARÃES JÚNIOR, Manuel Antunes de Castro**\n\n\\* militar; pref. Niterói 1929-1930; 1946.\n\n*Manuel Antunes de Castro Guimarães Júnior* nasceu em Barra do São João,\ndistrito do município de Casimiro de Abreu (RJ), no dia 5 de março de\n1881, filho de Manuel Antunes de Castro Guimarães e de Adalgisa\nGuimarães.\n\nIngressou no Exército, onde cursou infantaria, artilharia, intendência e\nengenharia civil e militar.\n\nIniciou sua vida profissional como professor de história, português,\nfrancês, latim, matemática e física na Escola Militar, na Escola de\nFormação de Oficiais de Intendência, na Escola de Cadetes de Barbacena e\nno Colégio Icaraí, em Niterói.\n\nEm 1914 começou a trabalhar como engenheiro da Comissão de Saneamento da\nprefeitura de Niterói, responsável pela construção da rede de esgotos do\nmunicípio. No ano seguinte foi demitido pelo prefeito eleito Manuel\nOtávio de Sousa Carneiro por ter feito campanha para a candidatura de\nFeliciano Sodré ao governo do estado do Rio de Janeiro. Naquele momento\nretomou a carreira militar.\n\nEntre 1927 e 1928, nomeado pelo prefeito Manuel Ribeiro de Almeida,\nvoltou a trabalhar na prefeitura como diretor de Obras. Em 1928 foi\nchamado pelo governador do estado, Feliciano Sodré, para trabalhar na\nDiretoria Geral de Obras e Viação do Estado. Ficou no cargo até o ano\nseguinte, quando foi eleito prefeito de Niterói. Tomou posse no dia 31\nde dezembro. Durante seu mandato procurou continuar as obras de seu\nantecessor, Manuel Ribeiro de Almeida, isto é, inaugurou a avenida\nFeliciano Sodré e a nova estação ferroviária da Leopoldina e deu\nandamento às obras de saneamento e urbanização do município, como as\nmelhorias no bairro de Santa Rosa e o alargamento da rua da Conceição,\nno Centro. Ele tinha o propósito de continuar as obras da segunda\nadutora da Serra de Friburgo, porém foi impedido pela Câmara de\nVereadores de contrair um novo empréstimo. De todo modo, conseguiu\ndiminuir consideravelmente a dívida interna municipal, de 11 mil para\ntrês mil contos de réis.\n\nFoi deposto do cargo por Júlio Limeira no dia 2 de outubro de 1930, na\nocasião da Revolução de 1930. Voltou para o Exército e foi designado\npara dirigir o seu Arquivo Geral e, em seguida, para ser presidente da\nCaixa Construtora de Casas do Ministério da Guerra. Também trabalhou em\num cargo civil, quando passou a ser conselheiro da Fundação\nBrasil-Central.\n\nNo dia 27 de setembro de 1946, a convite do interventor federal Hugo\nSilva, voltou à prefeitura de Niterói, entretanto ficou apenas até o dia\n6 de fevereiro do ano seguinte. Nesse segundo mandato concentrou-se nas\nobras de limpeza, saneamento e calçamento.\n\nFaleceu em Niterói no dia 2 de fevereiro de 1969.\n\nFoi casado com Julieta Barbosa Guimarães, com quem teve dois filhos, o\nmédico Almir Barbosa Guimarães e Alice Barbosa Guimarães Teixeira.\nCastro Guimarães foi sogro do general Rubens Rosado Teixeira, secretário\nde estado do governador do estado do Rio marechal Paulo Francisco\nTorres.\n\nFoi reformado como general de brigada.\n\n*Paulo César Gomes Bezerra*\n\nFONTES: Rio das Ostras Turismo. Disponível em:\n\\<www.riodasostrasturismo.com.br/?pagina=dinamico&item=6\\>. Acesso em:\n9/12/2010; SOARES, E. *Prefeitura*;SOARES, E. *Ruas*;WEHRS,C. *Niterói*.\n","ref":"FONTES: Rio das Ostras Turismo. Disponível em:\n\\<www.riodasostrasturismo.com.br/?pagina=dinamico&item=6\\>. Acesso em:\n9/12/2010; SOARES, E. *Prefeitura*;SOARES, E. *Ruas*;WEHRS,C. *Niterói*.\n","dic":"DPRRJ"}
