{"title":"GUIMARÃES, Edson Teixeira","cargoss":["Deputado Estadual","Deputado Estadual","Constituinte","Deputado Estadual"],"cargos_esp":["GB",0,"est",0],"datas_ini":[1963,1971,1975,1979],"datas_fim":[1967,1975,1975,1983],"estados":[0,"RJ","RJ","RJ"],"autor":["Bruno Marques"],"content":"**GUIMARÃES, Edson Teixeira**\n\n\\* dep. est. GB 1963-1967; dep. est. RJ 1971-1975; const. est. RJ 1975;\ndep. est. RJ 1979-1983.\n\n*Edson Teixeira Guimarães* nasceu no dia 18 de setembro de 1922.\n\nElegeu-se deputado estadual no estado da Guanabara pela União\nDemocrática Nacional (UDN) nas eleições de 7 de outubro de 1962 para a\nlegislatura 1963-1967.\n\nCom a instituição do sistema bipartidário a partir do Ato Institucional\nn^o^ 2 (1965), filiou-se à Aliança Renovadora Nacional (Arena), partido\nde apoio ao regime militar instituído no país em 1964. Nessa legenda foi\nreeleito deputado estadual pela Guanabara no pleito de 15 de novembro de\n1966. Tomou posse de uma cadeira na Assembleia Legislativa do Estado da\nGuanabara (ALEG) no dia 1^o^ de fevereiro do ano seguinte.\n\nEm novembro de 1970, foi mais uma vez reeleito deputado estadual e tomou\nposse de uma cadeira na ALEG em fevereiro do ano seguinte para a\nlegislatura 1971-1975. Nas eleições de novembro de 1974 foi novamente\neleito deputado para a legislatura 1975-1979. Tomou posse e fevereiro de\n1975 para o mandato ordinário na Assembleia Legislativa do Estado do Rio\nde Janeiro (ALERJ) e passou a integrar, em março, a Assembleia\nConstituinte encarregada de elaborar a Constituição do novo estado do\nRio de Janeiro – resultante da fusão do antigo estado do Rio com o da\nGuanabara, que ocorreria no dia 15 de março.\n\nNa Assembleia Constituinte, instalada no dia 15 de março, foi vice-líder\nda minoria Na ocasião a maioria emedebista era ligada a Chagas Freitas e\ndefendia que não se prolongassem no tempo os trabalhos constituintes. Em\napenas quatro meses a nova Carta foi finalizada. Com a promulgação da\nnova Constituição estadual em 23 de julho de 1975 retornou ao exercício\ndo mandato ordinário na ALERJ.\n\nFoi novamente eleito deputado estadual pela Arena nas eleições de\nnovembro de 1978. Assumiu uma cadeira na ALERJ em fevereiro do ano\nseguinte, para a legislatura 1979-1983. Com o fim do bipartidarismo em\nnovembro de 1979 e a posterior reformulação partidária, filiou-se ao\nPartido Democrático Social (PDS). Exerceu o mandato até janeiro de 1983.\n\n*Bruno Marques*\n\nFONTES: ASSEMB. LEGISL. RJ. Disponível em:\n\\<www.alerj.rj.gov.br/center\\_arq\\_aleg\\_prod\\_link4.htm\\>. Acesso em:\n26/9/2010; \\<www.alerj.rj.gov.br/memoria/historia/be7894.html\\>. Acesso\nem: 26/9/2010; \\<www.alerj.rj.gov.br/arquivo.htm\\>. Acesso em:\n26/9/2010; CPDOC. Disponível em:\n\\<http://cpdoc.fgv.br/producao/dossies/JK/glossario/uniao\\_democratica\\_nacional\\>.\nAcesso em: 26/9/2010; INST. EST. PATRIMÔNIO CULT. Disponível em:\n\\<www.inepac.rj.gov.br/arquivos/Historico\\_Estado.pdf\\>. Acesso em:\n26/9/2010; MOREIRA, L. *Mulheres*; UNIV. CANDIDO MENDES. Disponível em:\n\\<www.ucam.edu.br/leex/Brasil/Quocient/ASSEMLEG.html\\>. Acesso em:\n26/9/2010.\n","ref":"FONTES: ASSEMB. LEGISL. RJ. Disponível em:\n\\<www.alerj.rj.gov.br/center\\_arq\\_aleg\\_prod\\_link4.htm\\>. Acesso em:\n26/9/2010; \\<www.alerj.rj.gov.br/memoria/historia/be7894.html\\>. Acesso\nem: 26/9/2010; \\<www.alerj.rj.gov.br/arquivo.htm\\>. Acesso em:\n26/9/2010; CPDOC. Disponível em:\n\\<http://cpdoc.fgv.br/producao/dossies/JK/glossario/uniao\\_democratica\\_nacional\\>.\nAcesso em: 26/9/2010; INST. EST. PATRIMÔNIO CULT. Disponível em:\n\\<www.inepac.rj.gov.br/arquivos/Historico\\_Estado.pdf\\>. Acesso em:\n26/9/2010; MOREIRA, L. *Mulheres*; UNIV. CANDIDO MENDES. Disponível em:\n\\<www.ucam.edu.br/leex/Brasil/Quocient/ASSEMLEG.html\\>. Acesso em:\n26/9/2010.\n","dic":"DPRRJ"}
