{"title":"GUIMARÃES, José Augusto","cargoss":["Deputado Estadual","Deputado Estadual"],"cargos_esp":[0,0],"datas_ini":[1992,1983],"datas_fim":[1995,1987],"estados":["RJ","RJ"],"autor":["Luciana Pinheiro"],"content":"**GUIMARÃES, José Augusto**\n\n\\* dep. est. RJ 1983-1987 e 1992-1995.\n\n*José Augusto Guimarães* nasceu em Campos (RJ) no dia 7 de julho de\n1946.\n\nAdvogado e promotor público, nas eleições realizadas em novembro de 1982\ncandidatou-se ao cargo de deputado estadual fluminense e foi eleito pela\nlegenda do Partido do Movimento Democrático Brasileiro (PMDB). Tomou\nposse de sua cadeira na Assembleia Legislativa do Estado do Rio de\nJaneiro (ALERJ) em fevereiro de 1983, mantendo-se no cargo até janeiro\nde 1987. Durante seu mandato legislativo presidiu a Comissão de Defesa\nCivil e foi vice-presidente da Comissão de Assuntos Municipais. Integrou\nainda, na condição de membro efetivo, a comissão de Constituição e\nJustiça e a comissão da Região Metropolitana, além de ter sido suplente\nda comissão de Orçamento e Finanças.\n\nNas eleições gerais de 1990 candidatou-se à reeleição e obteve uma\nsuplência. Assumiu uma cadeira na ALERJ em dezembro de 1992, até o fim\nda legislatura, em janeiro de 1995.\n\nEntre as atividades realizadas por José Augusto Guimarães ao longo de\ntoda sua trajetória profissional, podem ser citadas a presidência da\nImprensa Oficial fluminense e a vice-presidência da Companhia de\nEletricidade do Estado do Rio de Janeiro (CERJ). Exerceu ainda a função\nde procurador da Prefeitura Municipal de Niterói, onde também atuou como\nassessor especial do prefeito e assessor de coordenação da prefeitura,\nfoi chefe de gabinete da Procuradoria Geral do município e membro do\nConselho de Administração da Empresa Niteroiense de Turismo (Enitur).\n\nCidadão honorário de diversos municípios do estado do Rio de Janeiro,\nGuimarães recebeu ainda o título de Benemérito do Rotary Club\nniteroiense.\n\n*Luciana Pinheiro*\n\nFONTES: ASSEMB. LEGISL. RJ. *Deputados estaduais fluminenses*\n(1991-1994); ASSEMB. LEGISL. RJ. Disponível em:\n\\<www.alerj.rj.gov.br/\\>. Acesso em: 7/10/2010.\n","ref":"FONTES: ASSEMB. LEGISL. RJ. *Deputados estaduais fluminenses*\n(1991-1994); ASSEMB. LEGISL. RJ. Disponível em:\n\\<www.alerj.rj.gov.br/\\>. Acesso em: 7/10/2010.\n","dic":"DPRRJ"}
