{"title":"GUIMARÃES, Modesto","cargoss":["Deputado Estadual"],"cargos_esp":[0],"datas_ini":[1916],"datas_fim":[1923],"estados":["RJ"],"autor":[0],"content":"**GUIMARÃES, Modesto**\n\n\\* dep. est. RJ 1916-1923.\n\n*Francisco de Borja Negreiros Modesto* *Guimarães* foi médico e residiu\nna cidade do Rio de Janeiro, então Distrito Federal.\n\nEstabeleceu bases políticas no município de Petrópolis (RJ) e em 15 de\ndezembro de 1915 foi eleito deputado estadual na legenda do Partido\nRepublicano Fluminense (PRF). Tomou posse em 1916 e durante o mandato\nocupou a segunda vice-presidência da Assembleia Legislativa do Estado do\nRio de Janeiro (ALERJ). Em outubro de 1917, manifestou-se sobre\nreeleição do presidente do estado Raul Veiga (1918-1922).\n\nFoi reeleito deputado estadual em janeiro de 1919 na chapa oficial do\nPRF. Em maio de 1920, depois da convenção oficial do PRF, o grupo\nsituacionista, liderado por Nilo Peçanha, passou a adotar a sigla do\nPartido Republicano do Rio de Janeiro (PRRJ), partido que abrigara os\nnilistas de 1899 a 1911. Em dezembro de 1921 foi mais uma vez reeleito\ndeputado estadual, agora na legenda do PRRJ.\n\nPor ocasião da sucessão estadual de julho de 1922, apoiou a candidatura\ndo nilista Raul Fernandes contra Feliciano Sodré, candidato do PRF,\nreorganizado a partir da mudança da sigla do Partido Republicano\nConservador Fluminense (PRCF). Realizada a eleição, ambos os candidatos\nse declararam vencedores, o que ensejou uma dualidade de Assembleias e\nde governos. Seguindo a orientação política de Nilo Peçanha, Raul\nFernandes temia que o novo presidente da República, Artur Bernardes\n(1922-1926), adversário de Nilo, decretasse a intervenção federal no\nestado do Rio. Assim, apresentou ao Supremo Tribunal Federal um pedido\nde *habeas corpus* para assegurar sua posse. Atendido o pedido, Raul\nFernandes foi investido na presidência do estado, recebendo o cargo de\nRaul Veiga no palácio do Ingá, em Niterói, no dia 31 de dezembro de\n1922. Entretanto, Feliciano Sodré também foi empossado no mesmo dia por\n“sua” assembleia. Alegando a duplicidade de poderes no Rio de Janeiro,\nArtur Bernardes decretou afinal a intervenção federal no estado em 1923,\nentregando o Executivo fluminense a Aurelino Leal, que anulou tanto as\neleições de 1922 para presidente estadual como as eleições legislativas\nde 1921. Encerrou-se, então, o mandato de **Modesto Guimarães**.\n\nDurante sua atividade parlamentar apresentou projeto que concedia\nisenção de impostos estaduais à Associação Protetora do Recolhimento de\nPetrópolis, discursou sobre o desenvolvimento da pecuária fluminense,\ndestacou a urgência de obras na ponte entre Vassouras e Valença, e\nopôs-se aos projetos que propunham que a Sociedade Sinfônica Fluminense\nfosse considerada de utilidade pública e que recebesse subvenção.\nParticipou ainda das comissões de Obras Públicas, Saúde Pública e\nCâmaras Municipais e de Estatística, Divisão Civil e Judiciária da\nALERJ.\n\nEra casado com Julieta de Moura Modesto Guimarães.\n\n*Vicente Saul Moreira dos Santos*\n\nFONTES: ASSEMB. LEGISL. RJ. *Anais*;*Estado* (17/12/1921, 19/1/1922,\n25/7/1922, 11/11/1923); FERREIRA, M. *República*; *Fluminense*\n(10/12/1915); NAVA, P. *Baú*, SOARES, E. *História*.\n","ref":"FONTES: ASSEMB. LEGISL. RJ. *Anais*;*Estado* (17/12/1921, 19/1/1922,\n25/7/1922, 11/11/1923); FERREIRA, M. *República*; *Fluminense*\n(10/12/1915); NAVA, P. *Baú*, SOARES, E. *História*.\n","dic":"DPRRJ"}
