{"title":"IELPO, Benjamin","cargoss":["Deputado Estadual","Deputado Estadual","Deputado Estadual"],"cargos_esp":[0,0,0],"datas_ini":[1967,1959,1951],"datas_fim":[1971,1963,1955],"estados":["RJ","RJ","RJ"],"autor":[0],"content":"**IELPO, Benjamin**\n\n\\* dep. est. RJ 1951-1955, 1959-1963, 1967-1971.\n\n*Benjamin Ielpo* nasceu na região de Scario, Itália, em agosto de 1898,\nfilho de Pedro Ielpo e de Ana Teresa Scaldaferri. Após o falecimento de\nseus pais transferiu-se para o Brasil com sua irmã Lúcia Vicenza Ielpo,\nchegando à cidade do Rio de Janeiro em 1907.\n\nIngressou na política ao ser eleito deputado estadual pelo estado do Rio\nde Janeiro em outubro de 1950 na legenda do Partido Trabalhista\nBrasileiro (PTB). Assumiu uma cadeira na Assembleia Legislativa do\nEstado do Rio de Janeiro (ALERJ) no início de 1951. Durante esse ano\nparticipou da Comissão de Finanças, foi primeiro secretário na sessão\nordinária de 15 de junho e segundo-secretário nas sessões ordinárias de\n16 e 29 de abril. Exerceu o mandato até o fim, em janeiro de 1955.\n\nNas eleições de 3 de outubro de 1958 elegeu-se novamente deputado\nestadual no Rio, mais uma vez pelo PTB, assumindo o mandato em fevereiro\ndo ano seguinte para a legislatura 1959-1963.\n\nNo pleito de novembro de 1966 foi mais uma vez eleito deputado estadual,\nagora na legenda do Movimento Democrático Brasileiro (MDB), partido de\noposição ao regime militar em vigor no país desde 1964. Assumiu uma\ncadeira na ALERJ em fevereiro de 1967 para a legislatura 1967-1971.\n\nFoi, ainda, vereador e prefeito de Valença, primeiro suplente de juiz de\ndireito, delegado de polícia, tesoureiro dos correios e fundador do\nBanco de Valença.\n\nFaleceu no município de Barra do Piraí (RJ).\n\nFoi casado com Luísa de Almeida Kirk.\n\n*Ioneide Piffano Brion de Souza*\n\nFONTES: ASSEMB. LEGISL. RJ. *Anais*(1952, v. 5, 6, 9); BIO. Benjamin\nIelpo. Disponível em: \\<www.cbg.org.br/cartamensal/CM72.pdf\\>. Acesso\nem: 19/1/2011; CARDIANO, F. *Eleições*.\n","ref":"FONTES: ASSEMB. LEGISL. RJ. *Anais*(1952, v. 5, 6, 9); BIO. Benjamin\nIelpo. Disponível em: \\<www.cbg.org.br/cartamensal/CM72.pdf\\>. Acesso\nem: 19/1/2011; CARDIANO, F. *Eleições*.\n","dic":"DPRRJ"}
