{"title":"JESUS, João Mendes de","cargoss":["Deputado federal"],"cargos_esp":[0],"datas_ini":[2003],"datas_fim":[2007],"estados":["RJ"],"autor":["Sabrina Guerghe"],"content":"**JESUS, João Mendes de**\n\n\\* dep. fed. RJ 2003-2007.\n\n*João Mendes de Jesus* nasceu em Aurelino Leal (BA) no dia 27 de janeiro\nde 1953, filho de Alexandre Mendes de Jesus e Mirtes Bispo de Jesus.\n\nAos 18 anos deixou sua cidade natal e fixou moradia no estado da\nGuanabara. Em 1974 trabalhou como auxiliar de fazenda da Secretaria de\nFinanças do estado e em seguida passou a trabalhar como auxiliar de\nadministração na Empresa Brasileira de Telecomunicações (Embratel),\nfunção que exerceria até 1987. Em 1980 bacharelou-se em economia na\nUniversidade Gama Filho, em 1981 fez o curso de Matemática Comercial e\nFinanceira na Unesa, e em 1982, o curso de gerência de vendas do\nManagement Center do Brasil. Cursaria ainda, em 1990, cadeira de\nradialismo no Sindicato Radialista da Bahia, em Ilhéus (BA).\n\nEm 1987 tornou-se pastor evangélico da Igreja Universal do Reino de\nDeus, função que exerceria até 1994, quando foi nomeado economista da\nEditora Gráfica Universal, em que permaneceria até 2000. Durante sua\nvida missionária dirigiu igrejas em alguns municípios da Baixada\nFluminense e em 1996 foi consagrado bispo.\n\nEm 2001 filiou-se ao Partido Democrático Trabalhista (PDT) e em outubro\ndo ano seguinte foi eleito deputado federal pelo estado do Rio de\nJaneiro. Assumiu o mandato em fevereiro de 2003 e ainda nesse ano\ningressou no Partido Social Liberal (PSL).\n\nNa Câmara dos Deputados participou da Comissão de Ciência e Tecnologia,\nComunicação e Informática, da Comissão de Legislação Participativa e da\nComissão de Turismo e Desporto, e votou a favor das propostas de reforma\nda Previdência e reforma tributária, encaminhadas pelo governo de Luís\nInácio Lula da Silva. Em 2005 filiou-se ao Partido Liberal (PL), voltou\nao PSL e ingressou no Partido Socialista Brasileiro (PSB). Em 2006 foi\ncitado pela Comissão Parlamentar Mista de Inquérito (CPMI) que\ninvestigou um esquema de compra de ambulâncias superfaturadas com\nrecursos públicos e ficou conhecida como a CPI dos Sanguessugas. Nesse\nmesmo ano deixou a legenda do PSB e ingressou no Partido Republicano\nBrasileiro (PRB). Não tentou a reeleição em 2006. Deixou a Câmara dos\nDeputados em janeiro de 2007, ao final da legislatura.\n\nEm 2008 foi eleito vereador do Rio de Janeiro na legenda do PRB.\n\nCasou-se com Cássia Regina Miranda de Jesus, com quem teve quatro\nfilhos.\n\n*Sabrina Guerghe*\n\nFONTES: CÂM. DEP. Disponível em*:\n\\<*www2.camara.gov.br/deputados/index.html/loadFrame.html\\>. Acesso em:\n5/10/2009; CÂM. MUN. RJ; Agência Câmara (19/10/2006); Direito2.\nDisponível em:\n\\<www.direito2.com.br/acam/2006/out/19/veja-a-acusacao-contra-joao-mendes-de-jesus-e-sua-defesa\\>.\nAcesso em: 5/10/2009; *Época* (4/9/2009); PSB (24/8/2006).\n","ref":"FONTES: CÂM. DEP. Disponível em*:\n\\<*www2.camara.gov.br/deputados/index.html/loadFrame.html\\>. Acesso em:\n5/10/2009; CÂM. MUN. RJ; Agência Câmara (19/10/2006); Direito2.\nDisponível em:\n\\<www.direito2.com.br/acam/2006/out/19/veja-a-acusacao-contra-joao-mendes-de-jesus-e-sua-defesa\\>.\nAcesso em: 5/10/2009; *Época* (4/9/2009); PSB (24/8/2006).\n","dic":"DPRRJ"}
