{"title":"JORGE ARMANDO","cargoss":["Deputado Estadual","Constituinte"],"cargos_esp":[0,"est"],"datas_ini":[1987,1989],"datas_fim":[1991,1989],"estados":["RJ","RJ"],"autor":["Luciana Pinheiro"],"content":"**JORGE ARMANDO**\n\n\\* dep. est. RJ 1987-1991; const. est. RJ 1989.\n\n*Jorge Armando de Macedo Pimentel* nasceu em Itaboraí (RJ) no dia 14 de\njulho de 1943.\n\nGraduou-se em direito pela Universidade Cândido Mendes.\n\nIngressou na política em 1970, quando se elegeu vereador em Itaboraí.\nNas eleições de novembro de 1986, candidatou-se a deputado estadual pelo\nPartido do Movimento Democrático Brasileiro (PMDB). Eleito, tomou posse\nna Assembleia Legislativa do Rio de Janeiro (ALERJ) em fevereiro de 1987\ne foi vice-líder da bancada do PMDB.\n\nNo dia 5 de outubro de 1988 foi promulgada a nova Constituição\nbrasileira, que reorganizou a legislação nacional após a ditadura\nmilitar e ficou conhecida como a “Constituição Cidadã”. Para adequar a\nConstituição fluminense à nova Carta federal, em 1989 reuniu-se a\nAssembleia Constituinte Estadual formada pelos deputados estaduais\neleitos em 1986. Após a promulgação da nova Constituição estadual no dia\n5 de outubro de 1989, Jorge Armando retornou ao exercício do mandato\nordinário na ALERJ, até o fim da legislatura, em janeiro de 1991. Foi\nainda vice-presidente da Comissão de Fiscalização Financeira e Tomada de\nContas, suplente das comissões de Constituição e Justiça, de Ciência,\nEnergia e Tecnologia e de Assuntos Municipais, e vice-presidente da\ncomissão parlamentar de inquérito (CPI) criada na ALERJ para apurar\nresponsabilidades na destruição do ecossistema da lagoa de Araruama.\n\nDiretor da Fundação Educacional Itaboraí (Feita) entre 1997 e 1999, no\ninício dos anos 2000 foi chefe de gabinete do prefeito do município,\nSérgio Alberto Soares. Em 2006 e 2007 dirigiu o Rotary Club de Itaboraí.\n\nPublicou o livro *Você Sabia*? (2007), em parceria com **Alair Vieira\nMelo e** **Antônio Gomes Lacerda.**\n\n*Luciana Pinheiro*\n\nFONTES: ASSEMB. LEGISL. RJ. *Deputados estaduais fluminenses*\n(1987-1991); ASSEMB. LEGISL. RJ. Disponível em:\n\\<www.alerj.rj.gov.br/memoria/cd/assembleia/aconst89.html\\>. Acesso em:\n10/5/2011; CÂM. MUN. ITABORAÍ. Disponível em:\n\\<www.camaraitaborai.rj.gov.br/\\>. Acesso em: 10/11/2010; Grupo\nEditorial Scortecci. Disponível em: \\<www.scortecci.com.br/\\>. Acesso\nem: 10/11/2010; RENIPAC. Disponível em:\n\\<www.renipac.org.br/rj.itaborai.html\\>; Rotary Club de Itaboraí.\nDisponível em: \\<www.rotaryitaborai.com.br/page8.aspx\\>. Acesso em:\n10/11/2010.\n","ref":"FONTES: ASSEMB. LEGISL. RJ. *Deputados estaduais fluminenses*\n(1987-1991); ASSEMB. LEGISL. RJ. Disponível em:\n\\<www.alerj.rj.gov.br/memoria/cd/assembleia/aconst89.html\\>. Acesso em:\n10/5/2011; CÂM. MUN. ITABORAÍ. Disponível em:\n\\<www.camaraitaborai.rj.gov.br/\\>. Acesso em: 10/11/2010; Grupo\nEditorial Scortecci. Disponível em: \\<www.scortecci.com.br/\\>. Acesso\nem: 10/11/2010; RENIPAC. Disponível em:\n\\<www.renipac.org.br/rj.itaborai.html\\>; Rotary Club de Itaboraí.\nDisponível em: \\<www.rotaryitaborai.com.br/page8.aspx\\>. Acesso em:\n10/11/2010.\n","dic":"DPRRJ"}
