{"title":"KAKI, José Borges","cargoss":["Deputado Estadual"],"cargos_esp":[0],"datas_ini":[1995],"datas_fim":[1999],"estados":["RJ"],"autor":["Tiago Alves Jaques"],"content":"**KAKI, José Borges**\n\n\\* dep. est. RJ 1995-1999.\n\n*José de Aguiar Borges* nasceu no Rio de Janeiro (RJ), então Distrito\nFederal, no dia 27 de setembro de 1945, filho de Walcyr Borges e de\nAlmerinda de Abreu Borges.\n\nGraduou-se em direito na Fundação Educacional Dom André Arcoverde, em\nValença (RJ). Participou de diversos cursos ligados à advocacia na mesma\nfaculdade e também pela Ordem dos Advogados do Brasil.\n\nEm 1966 elegeu-se vereador em Rio Bonito (RJ), na legenda da Aliança\nRenovadora Nacional (Arena). Nesse mandato fez parte das comissões de\nFinanças, Saúde e Justiça, além de ter sido primeiro e\nsegundo-secretário da Câmara Municipal de Rio Bonito. Na eleição\nmunicipal seguinte, em 1972, elegeu-se vice-prefeito naquele município.\n\nEntre 1972 e 1975 foi secretário executivo da Fundação Movimento\nBrasileiro de Alfabetização (Mobral), do Ministério de Educação e\nCultura.\n\nEm 1994 elegeu-se deputado estadual no estado do Rio de Janeiro, na\nlegenda do Partido da Mobilização Nacional (PMN). Na Assembleia\nLegislativa do Estado do Rio de Janeiro (ALERJ), foi líder do PMN em\n1995. No mesmo ano foi membro efetivo das comissões de Redação;\nOrçamento, Finanças e de Tributação; e de Educação, Cultura e Desportos.\nEm 1996 foi vice-presidente da Comissão de Orçamento, Finanças e de\nTributação; e presidente da Comissão de Normas Internas e Proposições\nExternas; e membro efetivo da Comissão de Indicações Legislativas. Em\n1997 foi membro efetivo da Comissão de Constituição e Justiça.\n\nEntre os anos de 1995 e 1997 participou também de comissões especiais\nrelativas a Políticas Públicas, Meio Ambiente, Transporte Público,\nReforma Administrativa Estadual e Política Internacional, e de comissões\nparlamentares de inquérito relativas a irregularidades na contratação de\nserviços de terceiros por órgãos públicos, bem como de licitações e\nconcessões de serviços públicos, de irregularidades no transporte de\npassageiros e de denúncias sobre sonegação de impostos. Em seu mandato\ncomo deputado estadual teve dez projetos de lei de sua autoria ou\ncoautoria transformados em leis ordinárias.\n\nDevido à anulação da segunda eleição, de 15 de novembro de 1994, e a\nvalidação da primeira eleição, de 3 de outubro de 1994, passou a ser\nsuplente do PMN a partir de fevereiro de 1997.\n\nCandidatou-se novamente ao cargo de deputado estadual em 1998, já\nfiliado ao Partido Social Cristão (PSC), mas não se elegeu. Em 2002,\ndessa vez filiado ao Partido da Reedificação da Ordem Nacional (Prona),\nextinto desde 2006, candidatou-se a deputado federal. Para o mesmo\ncargo, candidatou-se novamente nas eleições de 2006, mas agora pela\nlegenda do Partido Comunista do Brasil (PCdoB). Em 2008 candidatou-se a\nvereador em Rio Bonito, na legenda do PCdoB. Não foi eleito em nenhum\ndesses pleitos.\n\nFoi assessor jurídico da Prefeitura de Rio Bonito.\n\nFoi casado.\n\n*Tiago Alves Jaques*\n\nFONTES: ASSEMB. LEGISL. RJ. *Deputados estaduais fluminenses*\n(1995-1999); ASSEMB. LEGISL. RJ. *Legislação estadual*. Disponível em:\n\\<www.alerj.rj.gov.br/processo2.htm\\>. Acesso em: 18/1/2011; TRIB. SUP.\nELEIT. *Eleições* (1998, 2000, 2002, 2006, 2008).\n","ref":"FONTES: ASSEMB. LEGISL. RJ. *Deputados estaduais fluminenses*\n(1995-1999); ASSEMB. LEGISL. RJ. *Legislação estadual*. Disponível em:\n\\<www.alerj.rj.gov.br/processo2.htm\\>. Acesso em: 18/1/2011; TRIB. SUP.\nELEIT. *Eleições* (1998, 2000, 2002, 2006, 2008).\n","dic":"DPRRJ"}
