{"title":"KOPP, José","cargoss":["Deputado Estadual"],"cargos_esp":[0],"datas_ini":[1895],"datas_fim":[1909],"estados":["RJ"],"autor":[0],"content":"**KOPP, José**\n\n\\* dep. est. RJ 1895-1909.\n\n*José Hugo Kopp* nasceu em Macaé (RJ).\n\nIniciou sua atividade política em sua cidade natal.\n\nFoi eleito deputado estadual em 20 de maio de 1895 na legenda do Partido\nRepublicano Fluminense (PRF). Foi reeleito deputado estadual em 26 de\ndezembro de 1897, novamente pelo PRF. Durante a legislatura o PRF sofreu\numa cisão devido às divergências envolvendo o então presidente estadual\nAlberto Torres (1897-1900) e José Tomás da Porciúncula, ex-presidente\nestadual (1892-1894) e agora senador (1897-1901). O novo presidente\nestadual rebelou-se contra a liderança partidária de Porciúncula, que\nexigia que o Executivo estadual fortalecesse seu partido. Diante dessa\nsituação, em maio de 1899, quatro membros da comissão executiva do PRF\nrenunciaram aos seus cargos dentro da agremiação e em 23 de julho\nfundaram o Partido Republicano do Rio de Janeiro (PRRJ), liderados por\nAlberto Torres. Nesse contexto, José Hugo Kopp ingressou no PRRJ.\n\nEm 30 de julho de 1900 foi reeleito deputado estadual por esse partido.\nEm 1901 foi nomeado para a guarda nacional no posto de capitão\nassistente da 43^a^ Brigada de Infantaria da Comarca de Macaé. Em 1903,\nano final da legislatura, participou da reforma da Constituição\nestadual, que determinou, entre outras medidas, o fortalecimento do\nExecutivo estadual a partir da diminuição das atribuições do Legislativo\ne do Judiciário; o aumento do mandato do presidente estadual de três\npara quatro anos; e a redução do número de deputados estaduais de 60\npara 45.\n\nNo pleito de 31 de janeiro de 1904 se reelegeu mais uma vez. Em dezembro\nde 1906 reelegeu-se deputado estadual pelo PRRJ. Por ocasião da votação\nque visava regulamentar a cobrança da sobretaxa para o café, estipulada\npelo Convênio de Taubaté (1906), e o destino da arrecadação desse\nimposto, votou a favor da manutenção da cobrança que havia sido o\nestopim do distanciamento entre Nilo Peçanha e o então presidente do\nestado do Rio de Janeiro Alfredo Backer (1906-1910). Ainda nesse mandato\nocupou o cargo de segundo-secretário da Mesa e pronunciou discursos de\napoio a Backer (1906-1910) e de oposição ao presidente Nilo Peçanha\n(1909-1910). Ao final desse mandato, em 1909, não foi reeleito.\n\nDurante sua atividade parlamentar posicionou-se sobre o saneamento da\nBaixada Fluminense.\n\nParticipou da Comissão do Comércio, Agricultura, Indústria e\nColonização.\n\nApós se afastar da ALERJ, assumiu o cargo de oficial do Registro Público\ndo Comércio da Comarca de Niterói.\n\nPublicou *O Lynce* (1895).\n\n*Vicente Saul Moreira dos Santos*\n\nFONTES: ASSEMB. LEGISL. RJ. *Anais* (1907, 1908, 1909); *Diário Oficial\nda União* (28/11/1901, 24/11/1918); FERREIRA, M. *República*.\n","ref":"FONTES: ASSEMB. LEGISL. RJ. *Anais* (1907, 1908, 1909); *Diário Oficial\nda União* (28/11/1901, 24/11/1918); FERREIRA, M. *República*.\n","dic":"DPRRJ"}
