{"title":"LACERDA, Sebastião","cargoss":["Constituinte","Deputado federal","min Ind , Viação e Obras Públ","Deputado Estadual","Ministro do Supremo Tribunal Federal"],"cargos_esp":["est",0,0,0,0],"datas_ini":[1892,1894,1897,1910,1912],"datas_fim":[1892,1896,1898,1912,1925],"estados":["RJ","RJ",0,"RJ",0],"autor":["Eduardo Junqueira"],"content":"**LACERDA, Sebastião**\n\n**\\* const. est. RJ 1892; dep. fed.** **RJ 1894-1896; min. Ind., Viação\ne Obras Públ. 1897-1898; dep. est. RJ 1910-1912; min. STF 1912-1925.**\n\n*Sebastião Eurico Gonçalves de Lacerda* nasceu em Vassouras (RJ) no dia\n18 de maio de 1864, filho de João Augusto Pereira de Lacerda e de Maria\nEmília Gonçalves de Lacerda.\n\nFormou-se em ciências jurídicas e sociais na Faculdade de Direito de São\nPaulo em 1884 e, de volta a Vassouras, dedicou-se à advocacia. Ligado ao\nmovimento republicano e abolicionista, foi eleito para a Câmara\nMunicipal da cidade em 1888, passando a intendente em 1890, após a\nproclamação da República.\n\nEm 1892, foi deputado constituinte no estado do Rio de Janeiro. Após a\nelaboração da Constituição estadual, foi nomeado secretário de\nAgricultura do governo de José da Porciúncula. Permaneceu à frente da\nsecretaria até 1894, quando desavenças com o presidente do estado acerca\nda indicação de nomes para a composição da bancada fluminense na Câmara\ndos Deputados levaram à sua exoneração. No mesmo ano foi eleito deputado\nfederal pelo estado do Rio de Janeiro. Em abril de 1896, após deixar a\nCâmara, tornou-se secretário do Interior e Justiça do estado no governo\nde Joaquim Maurício de Abreu, cargo do qual se afastou para assumir o\nMinistério da Indústria, Viação e Obras Públicas no governo de Prudente\nde Morais (1894-1898). Esteve à frente da pasta de novembro de 1897 a\njunho de 1898, pouco antes da saída de Prudente de Morais da presidência\nda República, e em seguida voltou à atividade política e à advocacia em\nsua cidade natal.\n\nPor ocasião do pleito para escolha do presidente do estado do Rio em\n1900, chegou a apresentar sua candidatura, mas retirou-a para aderir à\ncampanha de Quintino Bocaiúva, nome de conciliação das forças políticas\nlocais que disputavam o controle do estado. Em 1910, foi mais uma vez\neleito vereador à Câmara Municipal de Vassouras. Em seguida foi deputado\nà Assembleia Legislativa do Estado do Rio de Janeiro, até 1911, quando\nassumiu a Secretaria Geral do estado, sob a presidência de Oliveira\nBotelho. Eleito deputado estadual para legislatura seguinte, tornou-se\npresidente da Assembleia fluminense por curto período. Enquanto esteve\nna presidência da casa enfrentou dura oposição, resultado de sua adesão\nà Campanha Civilista em 1910, embora todas as acusações fossem superadas\npela legalidade do Legislativo fluminense proclamada pelo Congresso\nNacional durante o governo Hermes da Fonseca (1910-1914).\n\nEm novembro de 1912 foi nomeado ministro do Supremo Tribunal Federal\n(STF), na vaga aberta em decorrência do falecimento de Oliveira\nFigueiredo. Faleceu, no exercício de suas funções no STF, em 5 de julho\nde 1925, na cidade do Rio de Janeiro.\n\nEra casado com Maria da Glória Paiva de Lacerda. Seu filho Maurício\nLacerda foi deputado federal pelo estado do Rio de Janeiro de 1912 a\n1920, revolucionário de 1922 e 1924, novamente deputado federal em 1930,\ne revolucionário de 1930 e de 1935. Seus filhos Fernando e Paulo de\nLacerda foram líderes do Partido Comunista (PCB). Seu neto Carlos\nLacerda, célebre jornalista, orador e político carioca, foi deputado\nfederal em 1955 e de 1956 a 1960, governador da Guanabara de 1960 a\n1965, e figura atuante no cenário nacional.\n\n*Eduardo Junqueira*\n\nFONTES: CPDOC. Disponível em:\n\\<www.cpdoc.fgv.br/nav\\_historia/htm/biografias/ev\\_bio\\_mauriciolacerda.htm\\>;\nMELLO FILHO, J. *Notas*; SUPR. TRIB. FED. Disponível em:\n\\<www.stf.jus.br/portal/ministros\\>. *Supremo Tribunal Federal – 150\nanos*.\n","ref":"FONTES: CPDOC. Disponível em:\n\\<www.cpdoc.fgv.br/nav\\_historia/htm/biografias/ev\\_bio\\_mauriciolacerda.htm\\>;\nMELLO FILHO, J. *Notas*; SUPR. TRIB. FED. Disponível em:\n\\<www.stf.jus.br/portal/ministros\\>. *Supremo Tribunal Federal – 150\nanos*.\n","dic":"DPRRJ"}
