{"title":"LEAL, Délio","cargoss":["Deputado Estadual","Deputado Estadual","Deputado Estadual","Deputado Estadual","Deputado Estadual"],"cargos_esp":[0,0,0,0,0],"datas_ini":[2008,2006,2004,1998,1991],"datas_fim":[2011,2007,2005,2003,1997],"estados":["RJ","RJ","RJ","RJ","RJ"],"autor":["Silvia Monnerat"],"content":"**LEAL, Délio**\n\n\\* dep. est. RJ 1991-1997, 1998-2003, 2004-2005, 2006-2007 e 2008-2011.\n\n*Délio Cesar Leal* nasceu em Paracambi (RJ) no dia 8 de fevereiro de\n1947, filho de Délio Basílio Leal e de Olga dos Reis Leal.\n\nApós bacharelar-se pela Faculdade Nacional de Direito, tornou-se\ndelegado de polícia, foi procurador da Prefeitura Municipal de Paracambi\n(1971-1973), prefeito de Paracambi (1983-1989) e presidente da Fundação\nSuperintendência Estadual de Rios e Lagoas (Serla) (1989-1990).\n\nFiliado ao Partido do Movimento Democrático Brasileiro (PMDB), foi\neleito deputado estadual em três eleições consecutivas, em 1990, 1994 e\n1998. Na legislatura 1991-1995 foi líder da bancada de seu partido na\nAssembleia Legislativa do Estado do Rio de Janeiro (ALERJ),\nvice-presidente da Comissão de Emendas Constitucionais e Vetos, membro\nefetivo da Comissão de Orçamento, Finanças e Tributação e da Comissão de\nAssuntos Municipais e Desenvolvimento Regional. Na legislatura seguinte,\n1995-1999, foi presidente da Comissão de Redação e da Comissão de\nTransportes, manteve-se por dois anos na vice-presidência da Comissão de\nEmendas Constitucionais e Vetos, foi vice-presidente da Comissão de\nSegurança Pública e Assuntos de Polícia, vice-líder do governo e membro\nde várias outras comissões. No período de 17 de fevereiro de 1997 a 5 de\nfevereiro de 1998 licenciou-se do mandato para exercer o cargo de\nsecretário de Meio Ambiente do Estado do Rio de Janeiro, no governo de\nMarcelo Alencar (1995-1999). Na legislatura 1999-2003 voltou a\nparticipar de diferentes comissões da ALERJ e foi vice-líder do PMDB em\n1999 e 2002.\n\nEm 2002 candidatou-se mais uma vez a deputado estadual e obteve a\nprimeira suplência da coligação Todos pelo Rio, formada pelo Partido da\nFrente Liberal (PFL), pelo Partido da Social Democracia Brasileira\n(PSDB) e pelo Partido do Movimento Democrático Brasileiro (PMDB).\nConcluindo o mandato em janeiro de 2003, deixou a ALERJ. Em 2 de julho\nde 2004 foi nomeado secretário estadual de Justiça e Direitos do\nCidadão, no governo de Rosinha Garotinho (2003-2007), e permaneceu no\ncargo até dezembro seguinte, quando ocupou na ALERJ a cadeira deixada\npor Albano Reis, que faleceu. Nomeado secretário de Desenvolvimento da\nBaixada, licenciou-se mais uma vez, em março de 2005, mas reassumiu o\nmandato em abril de 2006, após exonerar-se da secretaria para concorrer\nàs eleições legislativas. Nas eleições desse ano obteve novamente uma\nsuplência e em agosto de 2008 voltou à ALERJ, tendo sido efetivado no\nlugar de Álvaro Lins, que teve o mandato cassado. Nas eleições de\noutubro de 2010 disputou novamente uma vaga de deputado estadual, sempre\nno PMDB, e mais uma vez obteve uma suplência. Em janeiro de 2011, deixou\na ALERJ ao final da legislatura.\n\nEm 2012 foi nomeado pelo deputado Paulo Melo (PMDB), então presidente da\nALERJ, chefe de gabinete do diretor geral da Casa.\n\nFoi também despachante concursado da Prefeitura Municipal de Nova\nIguaçu, e membro do conselho de administração da Associação dos\nDelegados de Polícia do Estado do Rio de Janeiro (Adepol-RJ) e da\ncomissão executiva nacional da Frente Municipalista Nacional.\n\n*Silvia Monnerat*\n\nFONTES: ASSEMB. LEGISL. RJ. *Deputados estaduais fluminenses*. Quinta\nlegislatura (1991-1994); ASSEMB. LEGISL. RJ. *Deputados estaduais\nfluminenses*. Sexta legislatura (1995-1999); ASSEMB. LEGISL. *Deputados\nestaduais fluminenses*. Sétima legislatura (1999-2003); *Notícias\nALERJ*. Chiquinho da Mangueira e Délio Leal voltam à ALERJ (3/4/2006).\nDisponível em:\n\\<www.alerj.rj.gov.br/common/noticia\\_corpo.asp?num=15806\\>. Acesso em:\n27/10/2011; *Notícias ALERJ*. Délio Leal é eleito o novo corregedor da\nALERJ (3/10/2007). Acesso em: 27/10/2011.\n","ref":"FONTES: ASSEMB. LEGISL. RJ. *Deputados estaduais fluminenses*. Quinta\nlegislatura (1991-1994); ASSEMB. LEGISL. RJ. *Deputados estaduais\nfluminenses*. Sexta legislatura (1995-1999); ASSEMB. LEGISL. *Deputados\nestaduais fluminenses*. Sétima legislatura (1999-2003); *Notícias\nALERJ*. Chiquinho da Mangueira e Délio Leal voltam à ALERJ (3/4/2006).\nDisponível em:\n\\<www.alerj.rj.gov.br/common/noticia\\_corpo.asp?num=15806\\>. Acesso em:\n27/10/2011; *Notícias ALERJ*. Délio Leal é eleito o novo corregedor da\nALERJ (3/10/2007). Acesso em: 27/10/2011.\n","dic":"DPRRJ"}
