{"title":"LEANDRO, Fernando","cargoss":["Deputado Estadual","Constituinte","Deputado Estadual"],"cargos_esp":[0,"est",0],"datas_ini":[1971,1975,1979],"datas_fim":[1975,1975,1987],"estados":["RJ","RJ","RJ"],"autor":["Luciana Pinheiro"],"content":"**LEANDRO, Fernando**\n\n\\* dep. est. RJ 1971-1975; const. est. RJ 1975; dep. est. RJ 1979-1987.\n\n*Fernando Alberto Costa Leandro* nasceu em Vila de Nova Gaia, Portugal,\nno dia 27 de abril de 1927.\n\nAdvogado, iniciou sua carreira política em 1967 quando assumiu como\nvereador na Câmara do município fluminense de São João de Meriti,\npermanecendo no cargo por uma legislatura.\n\nNo pleito eleitoral realizado em novembro de 1970 candidatou-se ao cargo\nde deputado estadual, sendo eleito na legenda do Movimento Democrático\nBrasileiro (MDB). Em março de 1971 tomou posse de sua cadeira na\nAssembleia Legislativa do Rio de Janeiro (ALERJ), sendo escolhido\nvice-líder da oposição, função que desempenhou até o ano seguinte. No\ndecorrer de seu mandato de quatro anos atuou ainda como membro das\ncomissões de Educação e de Serviço Público e Legislação Social. Além\ndisso, foi vice-presidente da comissão de Redação e presidiu a comissão\nde Higiene e Segurança do Trabalho.\n\nCom a fusão dos estados da Guanabara e do Rio de Janeiro, executada em\nmarço de 1975, elegeu-se deputado estadual constituinte. Nesse mesmo\nano, durante o qual foi escolhido vice-líder da bancada do MDB por um\nbiênio, passou a presidir a Comissão de Transportes e Energia,\npermanecendo à frente da mesma até 1976. Em 1977 tornou-se terceiro\nsecretário da Assembleia Legislativa.\n\nNo pleito de 1978 candidatou-se a com vitória à reeleição, voltando à\nALERJ em março do ano seguinte. Nessa ocasião foi novamente eleito\nvice-líder da bancada do MDB e passou a integrar, na qualidade de membro\nefetivo, as comissões de Normas Internas, de Controle do Meio Ambiente e\nde Orçamento e Finanças. Em 1980 filiou-se ao Partido Trabalhista\nBrasileiro, do qual foi líder do Bloco Parlamentar e posteriormente\nvice-líder da Bancada. No decorrer de 1981 comandou os trabalhos\nrealizados pela comissão de Ciência, Energia e Tecnologia. Fora da\nesfera política, nesse mesmo ano assumiu a presidência da escola de\nsamba carioca Caprichosos de Pilares, a qual administrou por 12 anos,\ndestacando-se também como compositor de sambas polêmicos.\n\nNovamente eleito deputado estadual no pleito realizado em novembro de\n1982, tomou posse na ALERJ em março de 1983, nessa ocasião como membro\ndo Partido do Movimento Democrático Brasileiro (PMDB). Durante sua\núltima gestão como legislador fluminense atuou como vice-presidente da\ncomissão de Transportes e foi membro efetivo das comissões de Turismo e\nDesportos, de Defesa do Consumidor, de Saúde e de Redação.\n\nNo decorrer de 1984 foi chamado a prestar depoimento ao Serviço Nacional\nde Informação (SNI) em decorrência da composição do samba-enredo **A\nvisita da nobreza do riso** *a**Chico Rei num palco**nem sempre\n**iluminado****.*\n\nFaleceu no Rio de Janeiro, em 2 de julho de 2000.\n\n*Luciana Pinheiro*\n\nFONTES: ASSEMB. LEGISL. RJ. *Deputados estaduais fluminenses*. Terceira\nlegislatura (1983-1987); ASSEMB. LEGISL. RJ. Disponível em:\n\\<www.alerj.rj.gov.br/\\>. Acesso em: 21/9/2010;*IstoÉ Gente*. Disponível\nem: \\<www.terra.com.br/istoegente\\>. Acesso em: 21/9/2010; *Record Rio*.\nDisponível em: \\<www.recordrio.com.br/\\>. Acesso em: 21/9/2010; *Veja*.\nDisponível em: \\<http://veja.abril.com.br/\\>. Acesso em: 21/9/2010.\n","ref":"FONTES: ASSEMB. LEGISL. RJ. *Deputados estaduais fluminenses*. Terceira\nlegislatura (1983-1987); ASSEMB. LEGISL. RJ. Disponível em:\n\\<www.alerj.rj.gov.br/\\>. Acesso em: 21/9/2010;*IstoÉ Gente*. Disponível\nem: \\<www.terra.com.br/istoegente\\>. Acesso em: 21/9/2010; *Record Rio*.\nDisponível em: \\<www.recordrio.com.br/\\>. Acesso em: 21/9/2010; *Veja*.\nDisponível em: \\<http://veja.abril.com.br/\\>. Acesso em: 21/9/2010.\n","dic":"DPRRJ"}
