{"title":"ANTHONY GAROTINHO","cargoss":["Deputado Estadual","Prefeito","Prefeito","Governador de estado ou do Distrito Federal","Deputado federal"],"cargos_esp":[0,"Campos","Campos",0,0],"datas_ini":[1987,1997,1989,1999,2011],"datas_fim":[1988,1998,1992,2002,0],"estados":["RJ",0,0,"RJ","RJ"],"autor":[0],"content":"**ANTHONY GAROTINHO**\n\n\\* dep. est. RJ 1987-1988; pref. Campos 1989-1992 e 1997-1998; gov. RJ\n1999-2002; dep. fed. RJ 2011-.\n\n*Anthony William Mateus de Oliveira* nasceu em Campos (RJ) no dia 18 de\nabril de 1960, filho de Hélio Montezano de Oliveira e de Samira Mateus.\nCom o falecimento do pai, morou um período com o avô materno, Nahim\nMateus Jacob, comerciante de ascendência libanesa.\n\nEstudou no Liceu de Humanidades de Campos e aí iniciou, em 1975, suas\natividades políticas como líder estudantil influenciado pelo Partido\nComunista Brasileiro (PCB). Em 1980, participou da fundação do Partido\ndos Trabalhadores (PT) na sua cidade natal. Nessa época, iniciou também\nsuas atividades como radialista. Apresentou programas musicais e foi\nlocutor esportivo, passando a usar o apelido de *Garotinho*, com o qual\nse tornou conhecido e que incorporou ao nome em 1981. No mesmo ano,\ncasou-se com Rosângela Barros Assed, que adotou o sobrenome Mateus de\nOliveira e se tornaria conhecida posteriormente como Rosinha Garotinho.\n\nEm 1982 candidatou-se a vereador em Campos na legenda do PT. Foi o\ncandidato mais votado do município, com 1.405 votos, mas não foi eleito\nporque o PT não alcançou o quociente eleitoral necessário. Em 1984\nfiliou-se ao Partido Democrático Trabalhista (PDT) e em novembro de 1986\nfoi eleito deputado estadual nessa legenda, com mais de 20 mil votos. Em\nfevereiro de 1987 assumiu o mandato na Assembleia Legislativa do Estado\ndo Rio de Janeiro (ALERJ).\n\nNa eleição municipal de 1988 disputou o cargo de prefeito de Campos na\nlegenda do PDT, coligado ao Partido Socialista Brasileiro (PSB), ao PCB,\nao Partido Comunista do Brasil (PCdoB) e ao Partido Verde (PV), e foi\neleito com mais de 62 mil votos. Renunciou ao mandato de deputado\nestadual e foi empossado prefeito em 1989. Em sua administração,\nimplantou programas sociais, como o Bolsa Aprendizagem para reduzir a\nevasão escolar, e o Desafio, com o objetivo de erradicar o trabalho\ninfantil nos canaviais do município. Foi escolhido em 1990 pela\nAssociação Brasileira de Municípios (ABM) o melhor prefeito do Brasil.\nDeixou a prefeitura em 1992, ao final do mandato, e no ano seguinte\nesteve por sete meses à frente da Secretaria de Estado de Agricultura,\nAbastecimento e Pesca do governo de Leonel Brizola, o mais importante\nlíder do PDT.\n\nNas eleições de outubro de 1994 concorreu ao governo do estado do Rio de\nJaneiro na legenda do PDT. Foi o segundo colocado, com 1.874.435 votos,\natrás de Marcelo Alencar, do Partido da Social Democracia Brasileira\n(PSDB), vencedor do segundo turno. Durante a campanha eleitoral sofreu\num grave acidente automobilístico quando seguia para Volta Redonda (RJ),\no que o levou a se converter em 1995, junto com a esposa, à Igreja\nPresbiteriana. A partir de então apresentou diversos programas de rádio\ne de televisão com conteúdo religioso.\n\nNas eleições municipais de 1996, foi mais uma vez eleito prefeito de\nCampos, com 134.906 votos. Tomou posse em 1997, procurou sanear as\nfinanças do município e reformou o Teatro Trianon. Renunciou ao cargo em\nmarço de 1998, dois anos antes do previsto, após ter realizado uma\nconsulta popular que o incentivou a disputar novamente o governo do\nestado. Durante as prévias eleitorais, o PDT e a direção nacional do PT\nfizeram um acordo pelo qual Luís Inácio Lula da Silva, candidato à\npresidência da República na legenda petista, receberia o apoio nacional\ndo PDT e teria Leonel Brizola em sua chapa como candidato a\nvice-presidente, enquanto o PT apoiaria os candidatos do PDT aos\ngovernos estaduais, entre eles Garotinho. O acordo foi concretizado\ndepois da intervenção da direção nacional do PT em sua seção fluminense,\nque havia lançado Vladimir Palmeira como candidato a governador.\n\nGarotinho concorreu ao governo do estado do Rio de Janeiro tendo em sua\nchapa Benedita da Silva, do PT, como candidata a vice. Além do PDT e do\nPT, contou com o apoio do PSB, do PCdoB e do PCB. Em 3 de outubro de\n1998, recebeu 3.083.441 votos e obteve a primeira colocação, passando à\ndisputa do segundo turno com César Maia, do Partido da Frente Liberal\n(PFL). Elegeu-se com 4.259.344 votos.\n\nGovernador do Rio de Janeiro\n\nPouco antes de tomar posse em 1^o^ de janeiro de 1999, Garotinho\ndeclarou ao jornal *Folha de S.Paulo* que, apesar de integrar um partido\noposicionista, não faria “oposição por oposição” ao presidente da\nRepública Fernando Henrique Cardoso, do PSDB. Ao contrário, estaria\ndisposto a cooperar, pois era favorável à estabilidade econômica\ndefendida pelo governo federal.\n\nDurante seu governo, realizou investimentos na área social, coordenada\npor Rosinha Garotinho, que ocupou a Secretaria de Ação Social e\nCidadania. Criou os “restaurantes populares”, que forneciam refeições\npela quantia simbólica de um real, os “hotéis populares”, que também a\num real por noite ofereciam abrigo às pessoas que não podiam retornar às\nsuas casas após o trabalho e por isso dormiam nas ruas, e ainda o Leite\nSaúde, que distribuía leite em pó às crianças, e o Sopa da Cidadania,\nque doava refeições às instituições sociais. Instituiu o Cheque Cidadão,\noferecido a famílias com filhos matriculados na rede pública estadual de\nensino e com as carteiras de vacinação em dia, e criou também o Cheque\nCidadão do Trabalhador Rural, o Cheque Morar Feliz, para que mutuários\npobres da Caixa Econômica Federal (CEF) pudessem quitar suas dívidas, e\no Cheque Cidadão da Terceira Idade, oferecido a idosos pobres. Para os\njovens carentes criou os programas Vida Nova e Jovens Pela Paz. Com o\nobjetivo de oferecer alternativas de lazer à população carente, em\ndezembro de 2001 inaugurou o Piscinão de Ramos, às margens da baía de\nGuanabara.\n\nNo plano econômico, seu governo desenvolveu uma política de incentivos\nfiscais para empresas que se instalassem em municípios fluminenses. Foi\nnesse contexto que a fábrica de automóveis Peugeot se instalou em Porto\nReal e foram iniciadas as obras do Polo Gás-Químico em Duque de Caxias.\nForam feitos investimentos na revitalização da indústria naval e além\ndisso foi ampliado o financiamento para o setor agropecuário, por meio\ndo projeto Moeda Verde, que aumentou o crédito para pequenos produtores\nrurais, e do programa Frutificar, destinado à fruticultura irrigada. Com\nisso, o Rio de Janeiro retomou o posto de detentor do segundo maior\nProduto Interno Bruto (PIB) do país, superando Minas Gerais.\n\nNa área de segurança pública, foram iniciados projetos como o\nPoliciamento Comunitário em algumas comunidades carentes e o Programa\nDelegacia Legal, com a finalidade de desburocratizar o atendimento ao\ncidadão. Também nessa área ganhou destaque a demissão, em 21 de março de\n2000, através de programa de televisão, do coordenador de Segurança,\nJustiça e Cidadania do estado, o sociólogo Luís Eduardo Soares, que\nhavia entregado ao Ministério Público um dossiê no qual denunciava a\ncúpula da Polícia Civil de envolvimento em crimes como receptação de\ncarros roubados, homicídio e extorsão a criminosos envolvidos em\ndiversos delitos. Irritado com o auxiliar, por este ter feito as\ndenúncias sem lhe pedir autorização, Garotinho demitiu-o e tornou\npública uma conversa que haviam tido por telefone, com o intuito de\n“mostrar que ele tem duas caras. Para o governador fala uma coisa, à\nopinião pública diz outra”. Após a demissão de Soares, criou a comissão\nMãos Limpas para investigar suas denúncias. A comissão encerrou seus\ntrabalhos em setembro de 2000 sem encontrar provas de nenhuma das\nacusações de Soares, sugerindo denunciá-lo pelo delito de “falsa\ncomunicação de crime”. A crise desgastou o governo estadual na área de\nsegurança, que havia sido apontada como uma de suas prioridades durante\na campanha eleitoral de 1998. Ao final do governo, não houve consenso\nentre os especialistas acerca da diminuição das taxas estaduais de\ncriminalidade.\n\nNo que diz respeito à vida partidária, em novembro de 2000 Garotinho\ndesligou-se do PDT, antes que fosse expulso pela direção do partido. Os\ndesentendimentos entre ele e o presidente nacional do partido, Leonel\nBrizola, começaram no início de seu mandato e se aprofundaram quando\nBrizola decidiu se candidatar à prefeitura da cidade do Rio de Janeiro\nnas eleições de 2000 contra a vontade do governo estadual. Em sua saída\ndo partido, foi seguido por milhares de filiados e por diversos\ndeputados federais, estaduais, prefeitos e vereadores. Por seu turno, o\nPDT saiu da base de sustentação do governo estadual. Como havia perdido\ntambém o apoio do PT, o governo teve de refazer sua base com o ingresso\ndo PV e do Partido do Movimento Democrático Brasileiro (PMDB). Em\njaneiro de 2001, Garotinho filiou-se ao PSB com a intenção de\ncandidatar-se à presidência da República. Por exigência da lei\neleitoral, renunciou ao governo do estado do Rio de Janeiro em abril de\n2002, sendo substituído pela vice Benedita da Silva. De acordo com\npesquisas divulgadas pelo Ibope, tinha a aprovação de 88% da população\nfluminense. Pouco antes de encerrar sua administração, elevou o salário\nmínimo estadual para 240 reais, quando o salário mínimo nacional era de\n180 reais.\n\nCandidato à presidência da República\n\nA candidatura de Garotinho à presidência da República foi homologada em\n10 de junho de 2002, pela convenção nacional do PSB. Durante a campanha,\no candidato pleiteou uma reorientação do modelo econômico implementado\npelo governo de Fernando Henrique Cardoso, que em sua opinião\nprivilegiava o sistema financeiro. Defendeu políticas de redistribuição\nde renda, entre elas a nacionalização de alguns dos projetos sociais\nimplantados no estado do Rio de Janeiro e o aumento do salário mínimo.\nAlém disso, defendeu a inserção “soberana” do Brasil na globalização, e\na liderança do país entre as nações sul-americanas.\n\nEm outubro de 2002, Garotinho obteve 15.180.097 votos, ficando em\nterceiro lugar na disputa presidencial, atrás de Luís Inácio Lula da\nSilva, do PT, e José Serra, do PSDB. No segundo turno, apoiou a\ncandidatura de Lula, que foi eleito presidente da República. Nessas\nmesmas eleições, Rosinha Garotinho foi eleita, no primeiro turno,\ngovernadora do estado do Rio de Janeiro na legenda do PSB, sucedendo ao\nmarido.\n\nEm abril de 2003, Garotinho assumiu a Secretaria de Segurança Pública do\ngoverno Rosinha, com a tarefa de solucionar a grave crise na área da\nsegurança pública que dominava o estado. Em agosto, após tecer críticas\nao governo federal, especialmente à sua política econômica e às reformas\nda Previdência e tributária, foi expulso do PSB, que era um dos partidos\nde sustentação do governo. O episódio também encerrou a disputa que\ntravava pela liderança do PSB com o presidente nacional do partido,\nMiguel Arrais. No mesmo mês, filiou-se ao PMDB, que também integrava a\nbase de apoio do governo federal. Foi seguido por Rosinha, 12 deputados\nfederais e diversos deputados estaduais, prefeitos e vereadores.\n\nEm setembro de 2004, deixou a Secretaria de Segurança Pública, com a\njustificativa de que teria de coordenar a campanha do PMDB fluminense\nnas eleições municipais de outubro daquele ano. Dedicou-se especialmente\na apoiar a eleição para prefeito de Campos de Geraldo Roberto de Sousa,\nconhecido como Geraldo Pudim. A derrota de Geraldo Pudim para Carlos\nAlberto Campista, assim como de outros aliados, significou um golpe em\nsuas pretensões eleitorais. Além disso, o Ministério Público Eleitoral\nacusou o casal Garotinho de utilização do Cheque Cidadão e de cestas\nbásicas para a compra de votos. Em novembro, Garotinho voltou a ter um\ncargo no governo Rosinha, assumindo a Secretaria de Governo e de\nCoordenação.\n\nEm 2005, a eleição de Carlos Alberto Campista para a prefeitura de\nCampos foi anulada devido a denúncias de fraude. Também em função das\ndenúncias ligadas à eleição de 2004, o casal Garotinho foi julgado\ninelegível em primeira instância, mas a decisão seria anulada nas\ninstâncias superiores. Em outubro, Garotinho anunciou sua intenção de\nconcorrer às eleições internas que o PMDB realizaria para escolher seu\ncandidato à presidência da República. Em fevereiro de 2006, deixou a\nSecretaria de Governo e dedicou-se às prévias eleitorais. Na convenção\nnacional do PMDB, obteve a maioria dos votos. No entanto, os grupos\npeemedebistas que defendiam o apoio da legenda à reeleição do presidente\nLuís Inácio Lula da Silva obtiveram na Justiça que essa votação fosse\nconsiderada de caráter meramente consultivo. A despeito da insatisfação\ndos partidários de Garotinho, a direção nacional do PMDB decidiu que a\nlegenda não teria candidato próprio à eleição presidencial e apoiou a\nreeleição do presidente Lula.\n\nNesse ínterim, alguns órgãos da imprensa iniciaram uma série de\nreportagens, nas quais denunciavam a ligação entre empresas que fizeram\ndoações à pré-campanha de Garotinho e organizações não governamentais\n(ONGs) contratadas pela Fundação Escola de Serviço Público (Fesp) que\nprestavam serviços ao governo estadual. Em protesto contra a perseguição\nque estaria sofrendo por parte do sistema financeiro e da “grande mídia\nliderada pelas Organizações Globo e pela revista *Veja*” com o apoio do\ngoverno federal, no dia 30 de abril Garotinho iniciou uma greve de fome\nna sede estadual do PMDB. Em 10 de maio suspendeu a greve, segundo ele\npor ter obtido na Justiça o direito de resposta às acusações. Durante\nesse período, chegou a ser internado com desidratação.\n\nNas eleições de outubro de 2006, decidiu não se candidatar a nenhum\ncargo, mas apoiou as candidaturas de Geraldo Pudim, a deputado federal,\ne de Sérgio Cabral, a governador. Rosinha Garotinho não pôde concorrer à\nreeleição para o governo do estado, porque seu mandato foi interpretado\npela Justiça como continuação do mandato do marido. Sérgio Cabral foi\neleito, e Geraldo Pudim, apresentado como “o candidato do Garotinho”,\nobteve a segunda maior votação para deputado federal no estado.\n\nNas eleições municipais de 2008 Garotinho apoiou as candidaturas\nvitoriosas de Rosinha à prefeitura de Campos e da filha Clarissa\nGarotinho à Câmara de Vereadores do Rio de Janeiro, na legenda do PMDB.\nEm junho de 2009 deixou o partido, alegando divergências em relação à\nadministração de Sérgio Cabral. No mesmo mês aderiu ao Partido da\nRepública (PR), em cuja legenda candidatou-se a deputado federal pelo\nRio de Janeiro. Foi eleito com 694.862 votos, tendo sido o candidato a\ndeputado federal mais votado no estado e o segundo mais votado no país.\n\nTeve quatro filhos com Rosinha Garotinho e adotou outros cinco.\n\nPublicou *Violência e criminalidade no estado do Rio de Janeiro* (1998),\nem coautoria com Luís Eduardo Soares, e *Virou o carro, virou a minha\nvida* (2002). Coordenou também a Coleção Políticas Públicas, editada\npelo PMDB e dedicada a divulgar projetos desenvolvidos durante seu\ngoverno e o de Rosinha no estado do Rio de Janeiro.\n\nFabricio Pereira da Silva\n\nFONTES: *Folha de S.Paulo* (10/6, 28/10/1998, 1, 16/11/2000, 4/7/2001,\n19/8/2003, 1/5/2006, 23/6/2009);G1. Disponível em:\n\\<http://g1.globo.com/especiais/eleicoes-2010/noticia/2010/10/garotinho-e-candidato-deputado-federal-mais-votado-no-rio.html\\>.\nAcesso em: 2/9/2011; *Globo* (30/5/2008); *IstoÉ* (29/3/2000).\n","ref":"FONTES: *Folha de S.Paulo* (10/6, 28/10/1998, 1, 16/11/2000, 4/7/2001,\n19/8/2003, 1/5/2006, 23/6/2009);G1. Disponível em:\n\\<http://g1.globo.com/especiais/eleicoes-2010/noticia/2010/10/garotinho-e-candidato-deputado-federal-mais-votado-no-rio.html\\>.\nAcesso em: 2/9/2011; *Globo* (30/5/2008); *IstoÉ* (29/3/2000).\n","dic":"DPRRJ"}
