{"title":"LEON, Luís Carneiro de Campos Ponce de","cargoss":["Deputado Estadual","Deputado federal"],"cargos_esp":[0,0],"datas_ini":[1904,1915],"datas_fim":[1914,1917],"estados":["RJ","RJ"],"autor":["Luciana Pinheiro"],"content":"**LEON, Luís Carneiro de Campos Ponce de**\n\n\\* dep. est. RJ 1904-1914; dep. fed. RJ 1915-1917.\n\n*Luís Carneiro de Campos Ponce de Leon* nasceu em Barra Mansa (RJ) no\ndia 9 de fevereiro de 1881, filho de Adolfo Pereira Burgos Ponce de Leon\ne de Fabrízia Carneiro de Campos Ponce de Leon. Seu avô materno, Joaquim\nJosé Carneiro dos Santos, era o visconde de Caravelas. Seu pai foi\nvereador, deputado estadual e deputado federal pelo estado do Rio de\nJaneiro (1894-1898).\n\nFez os primeiros estudos no Colégio Anchieta, em Friburgo, e os\npreparatórios no Ginásio Nacional, no Rio de Janeiro, então Distrito\nFederal. Em 1902 bacharelou-se pela Faculdade Livre de Direito do Rio de\nJaneiro. Recém-formado, retornou ao município natal e dedicou-se ao\nexercício da advocacia. Foi também vereador em Barra Mansa e presidente\nda Câmara Municipal.\n\nEm 1904 elegeu-se deputado estadual. Foi reeleito para sucessivas\nlegislaturas até 1914, ano em que assumiu a presidência da Assembleia\nLegislativa. Em 1915 foi eleito deputado federal pelo estado do Rio de\nJaneiro e cumpriu seu mandato na Câmara dos Deputados de maio daquele\nano até dezembro de 1917.\n\nFaleceu em 16 de outubro de 1918.\n\n*Luciana Pinheiro*\n\nFONTES: ABRANCHES. J. *Governos* (v. 2); CÂM. DEP. *Deputados\nbrasileiros* (1826-1976); Genealogy.com. Disponível em:\n\\<www.genealogy.com/\\>. Acesso em: 21/1/2011.\n","ref":"FONTES: ABRANCHES. J. *Governos* (v. 2); CÂM. DEP. *Deputados\nbrasileiros* (1826-1976); Genealogy.com. Disponível em:\n\\<www.genealogy.com/\\>. Acesso em: 21/1/2011.\n","dic":"DPRRJ"}
