{"title":"LEON, Ponce de","cargoss":["Constituinte","Deputado Estadual"],"cargos_esp":["est",0],"datas_ini":[1947,1947],"datas_fim":[1947,1954],"estados":["RJ","RJ"],"autor":[0],"content":"**LEON, Ponce de**\n\n\\* const. est. RJ 1947; dep. est. RJ 1947-1954.\n\n*Jaime Ponce de Leon* construiu sua base política em Três Rios (RJ).\n\nCom o fim do Estado Novo e a reorganização partidária em 1945, foram\nconvocadas eleições para o Congresso Nacional e para as assembleias\nlegislativas estaduais. Em janeiro de 1947 foi eleito deputado à\nAssembleia Constituinte do estado do Rio de Janeiro pela legenda do\nPartido Trabalhista Brasileiro (PTB). Assumiu o mandato no mês seguinte.\nEm julho, depois de promulgada a Constituição, ocupou uma cadeira na\nAssembleia Legislativa do Estado do Rio de Janeiro (ALERJ). Durante esse\nmandato foi primeiro secretário da Mesa Diretora.\n\nReelegeu-se deputado estadual na eleição de outubro de 1950. Assumiu o\nmandato em fevereiro do ano seguinte.\n\nNo pleito de outubro de 1954 tentou a reeleição pela legenda do Partido\nSocial Progressista (PSP).\n\nNovamente disputou uma vaga para ALERJ na eleição de outubro de 1958,\ndessa vez pela legenda do Partido Social Democrático (PSD), mas não\nobteve êxito.\n\nEm outubro de 1962 concorreu sem sucesso a uma vaga de deputado estadual\npelo PTB.\n\nParticipou dos debates envolvendo Três Rios e região, especialmente\nsobre legislação, funcionalismo público e utilização de verba pública.\n\nIntegrou as comissões de Constituição, Interior e Justiça e Viação e\nObras Públicas.\n\n*Vicente Saul Moreira dos Santos*\n\nFONTES: ASSEMB. CONST. RJ. *Anais* (1947, 1948, 1951); CARDIANO, F.\n*Eleição*.\n","ref":"FONTES: ASSEMB. CONST. RJ. *Anais* (1947, 1948, 1951); CARDIANO, F.\n*Eleição*.\n","dic":"DPRRJ"}
