{"title":"LIMA, Afonso Peixoto de Abreu","cargoss":["Deputado Estadual","Prefeito"],"cargos_esp":[0,"Campos"],"datas_ini":[1898,1910],"datas_fim":[1903,1911],"estados":["RJ",0],"autor":["Raimundo Helio Lopes"],"content":"**LIMA, Afonso Peixoto de Abreu**\n\n\\* dep. est. RJ 1898-1903; pref. Campos 1910-1911.\n\n*Afonso Peixoto de Abreu Lima* ingressou na política fluminense ainda\ndurante o Império, quando foi eleito deputado provincial no Rio de\nJaneiro em duas legislaturas compreendidas entre os anos de 1878-1879 e\n1884-1885, respectivamente.\n\nApós a proclamação da República (15/11/1889) concorreu nas primeiras\neleições realizadas para a formação da Assembleia Constituinte\nfluminense, mas não foi eleito. Esse pleito, realizado em 20 de março de\n1891, foi vencido pelos partidários do presidente do estado do Rio de\nJaneiro, Francisco Portela (1889-1891), nomeado pelo presidente da\nRepública, marechal Deodoro da Fonseca (1889-1891). Os portelistas\nderrotaram os candidatos do Partido Republicano, de oposição ao governo,\nliderados por José Tomás da Porciúncula.\n\nMesmo após essa derrota, continuou apoiando o governo de Deodoro da\nFonseca. Em 3 de novembro de 1891 apoiou o golpe de estado desfechado\npelo presidente da República, que fechou o Congresso. Vinte dias depois,\numa revolta da Esquadra obrigou o então presidente a renunciar e\ntransferir o governo ao vice-presidente Floriano Peixoto.\n\nVoltou à cena política quando foi eleito deputado estadual em 26 de\ndezembro de 1897, na legenda do Partido Republicano Fluminense (PRF),\npelo segundo distrito eleitoral, com sede em Campos (RJ).\n\nDurante a legislatura, o PRF sofreu uma cisão devido às divergências\nenvolvendo o então presidente estadual Alberto Torres (1897-1900) e José\nTomás da Porciúncula, ex-presidente estadual (1892-1894) e agora senador\n(1897-1901). O novo presidente estadual rebelou-se contra a liderança\npartidária de Porciúncula, que exigia que o Executivo estadual\nfortalecesse seu partido. Diante dessa situação, em maio de 1899, quatro\nmembros da comissão executiva do PRF renunciaram aos seus cargos dentro\nda agremiação e em 23 de julho fundaram o Partido Republicano do Rio de\nJaneiro (PRRJ), liderados por Alberto Torres. Nesse contexto, Afonso\nPeixoto de Abreu Lima ingressou no PRRJ.\n\nFoi reeleito deputado estadual na legenda desse partido em 30 de\ndezembro de 1900. Em 1901 fez parte da Comissão de Apuração e\nVerificação de Poderes dos Deputados Eleitos pelo quinto distrito.\nDurante esse mandato fez parte da Comissão de Força Pública. Em 1903,\núltimo ano do mandato, participou da reforma da Constituição estadual,\nque determinou, entre outras medidas, o fortalecimento do Executivo\nestadual a partir da diminuição das atribuições do Legislativo e do\nJudiciário; o aumento do mandato do presidente estadual de três para\nquatro anos; e a redução do número de deputados estaduais de 60 para 45.\n\nEm 1910 foi eleito prefeito da cidade de Campos, mas não completou seu\nmandato, tendo permanecido na função até 1911.\n\nFoi também acionista do Banco do Brasil.\n\n*Raimundo Helio Lopes*\n\nFONTES: ASSEMB. LEGISL. RJ. *Anais* (1901-1903);CAM. CAMPOS. Disponível\nem: \\<www.camaracampos.rj.gov.br/historia\\_camara.php acesso\\>. Acesso\nem: 22/11/2010; FERREIRA, M. *República*.\n","ref":"FONTES: ASSEMB. LEGISL. RJ. *Anais* (1901-1903);CAM. CAMPOS. Disponível\nem: \\<www.camaracampos.rj.gov.br/historia\\_camara.php acesso\\>. Acesso\nem: 22/11/2010; FERREIRA, M. *República*.\n","dic":"DPRRJ"}
