{"title":"LIMA, Eugênio","cargoss":["Deputado Estadual"],"cargos_esp":[0],"datas_ini":[1955],"datas_fim":[1959],"estados":["RJ"],"autor":[0],"content":"**LIMA, Eugênio**\n\n\\* dep. est. RJ 1955-1959.\n\n*Eugênio Leite Lima* nasceu no Rio de Janeiro, então Distrito Federal.\n\nNas eleições de 3 de outubro de 1954 foi eleito, com 3.508 votos,\ndeputado estadual pela União Democrática Nacional (UDN). Assumiu seu\nmandato na Assembleia Legislativa do Estado do Rio de Janeiro (ALERJ) no\nano seguinte. Em 1957 foi primeiro vice-presidente da Mesa Diretora.\n\nNo pleito de 7 de outubro de 1962 candidatou-se novamente, mas os 2.308\nvotos que recebeu não foram suficientes para que se elegesse.\n\n*Ioneide Piffano Brion de Souza*\n\nFONTES: CARDIANO, F. *Eleições*;Jus Brasil. Seção 2/1957. Disponível em:\n\\<www.jusbrasil.com.br/diarios/dou-secao02-1957\\>. Acesso em: 19/2/2011.\n","ref":"FONTES: CARDIANO, F. *Eleições*;Jus Brasil. Seção 2/1957. Disponível em:\n\\<www.jusbrasil.com.br/diarios/dou-secao02-1957\\>. Acesso em: 19/2/2011.\n","dic":"DPRRJ"}
