{"title":"LIMA, Francisco","cargoss":["Constituinte","Deputado Estadual"],"cargos_esp":["est",0],"datas_ini":[1935,1935],"datas_fim":[1935,1937],"estados":[0,"RJ"],"autor":["Helio Lopes"],"content":"**LIMA, Francisco**\n\n\\* const. est. 1935; dep. est. RJ 1935-1937.\n\n*Francisco José da Costa Lima* nasceu em Saquarema (RJ), em quatro de\njunho de 1880, filho de Bento José da Costa Lima e de Maria Felizarda de\nGrimaldi Lima.\n\nFixou residência em São Gonçalo em 1899, no bairro do Gradim, onde era\ncomerciante e investidor imobiliário. Tradicional bairro de pescadores,\ntornou-se defensor desse grupo. Participou de campanhas filantrópicas do\nmunicípio, entre elas as da construção do Hospital de São Gonçalo, atual\nHospital Luiz Palmier, de apoio ao Patronato de Menores Abandonados do\nEstado do Rio de Janeiro e de criação da Caixa Auxiliadora dos Pobres,\nmantenedora da Instituição Cristã Amor ao Próximo, asilo para idosos.\n\nIngressou na política como partidário de Nilo Peçanha. Foi delegado de\npolícia, coronel da Guarda Nacional e juiz de paz. Em 18 de maio de 1924\nelegeu-se vereador à Câmara Municipal. Em 14 de outubro de 1934 foi\neleito deputado à Assembleia Constituinte fluminense, assumindo sua\ncadeira no ano seguinte. Participou da elaboração da nova Carta estadual\ne foi membro da Comissão de Agricultura, Viação e Obras Públicas. Após a\npromulgação da Carta magna estadual, em 1^o^ de outubro de 1935 passou a\nexercer o mandato ordinário. Permaneceu ALERJ até 10 de novembro de\n1937, quando, com a implantação do Estado Novo, foram suprimidos todos\nos órgãos legislativos do país.\n\nEm 1936 seu nome já era cogitado para ser candidato à prefeitura de São\nGonçalo, em reuniões realizadas na chácara do também deputado Luiz\nPalmier. Nomeado prefeito, pelo interventor federal Amaral Peixoto, em\n18 de novembro de 1937, tomou posse dois dias depois. Fustigado pelos\nadversários, pediu afastamento do cargo em 10 de maio de 1938, sendo\nsubstituído por Eugênio Borges. Seu sucessor apurou terem sido corretos\ntodos os seus atos, levando o interventor, por meio do secretário de\nInterior e Justiça, Horácio de Carvalho Júnior, a convidar-lhe a\nretornar à prefeitura. Recusou o oferecimento por problemas de saúde.\n\nFaleceu em sete de março de 1940 e foi sepultado no Cemitério da\nConfraria do Santíssimo Sacramento, no Barreto, Niterói.\n\nCasou-se, em 12 de abril de 1909, com a senhora Cristina Torres Lima.\nDessa união nasceram Cléa e Celso Torres Lima.\n\n*Jorge Cesar Pereira Nunes/Rui Aniceto Nascimento Fernandes/Raimundo\nHelio Lopes*\n\nFONTES: *Álbum da Constituinte Estadual* (1936); ASSEMB. LEGISL. RJ.\n*Anais* (1935); NUNES, J. *Dirigentes*; REZNIK, L *Intelectual*; SILVA,\nS. *Gonçalenses*.\n","ref":"FONTES: *Álbum da Constituinte Estadual* (1936); ASSEMB. LEGISL. RJ.\n*Anais* (1935); NUNES, J. *Dirigentes*; REZNIK, L *Intelectual*; SILVA,\nS. *Gonçalenses*.\n","dic":"DPRRJ"}
