{"title":"LIMA, Gama","cargoss":["Deputado Estadual","Constituinte","Deputado Estadual"],"cargos_esp":["GB","est",0],"datas_ini":[1963,1975,1975],"datas_fim":[1975,1975,1979],"estados":[0,"RJ","RJ"],"autor":[0],"content":"**LIMA, Gama**\n\n\\* dep. est. GB 1963-1975; const. est. RJ 1975; dep. est. RJ 1975-1979.\n\n*Francisco da Gama Lima Filho* nasceu em Palma (MG) no dia 21 de\nfevereiro de 1911, filho de Francisco da Gama Lima e de Nelsina Nogueira\nda Gama Lima.\n\nAinda menino, mudou-se para o Rio de Janeiro, então Distrito Federal,\nonde concluiu os cursos primário e secundário. De 1923 a 1926 cursou o\nSeminário Menor de Pirapora (SP). Começou sua carreira de professor\nainda em 1926, aos 15 anos, lecionando latim, álgebra e geografia no\nColégio Princesa Isabel, em Santa Cruz, no Rio de Janeiro. A partir de\nentão lecionaria em várias instituições de ensino da cidade, como o\nInstituto de Educação e o Colégio Vera Cruz. Em 1930 entrou para a\nFaculdade de Medicina e Odontologia da Universidade do Rio de Janeiro,\npela qual se formou em 1935. Foi cirurgião-dentista do Hospital Dom\nPedro II e do Convento da Ajuda entre os anos de 1933 e 1940. De 1934 a\n1939, foi vice-presidente da Ação Universitária Católica no Rio de\nJaneiro. Foi também diretor do jornal *O Debate*, em 1933, e redator de\n*A Gazeta Rural*, de 1934 a 1935, quando se tornou membro da Associação\nBrasileira de Imprensa.\n\nParticipou pela primeira vez de uma eleição em 1947, quando se\ncandidatou a vereador no Distrito Federal na legenda do Partido\nRepublicano Democrático (PRD), mas não foi eleito. De 1946 a 1956,\ndesempenhou diversas funções no Departamento Nacional do Serviço\nNacional de Aprendizagem Comercial (Senac), de cujas Divisão de Ensino e\nDivisão Técnica foi diretor. De 1951 a 1956, foi um dos membros nomeados\npelo governo federal para a Comissão de Aperfeiçoamento do Pessoal de\nNível Superior (Capes). Em 1960, com criação do estado da Guanabara,\ntornou-se diretor do Departamento de Educação Primária do governo de\nCarlos Lacerda. Foi autor do Plano de Educação Primária, que visava a\nresolver o problema dos excedentes nas escolas do estado. Em 1962 chegou\na ocupar a Secretaria de Educação por 30 dias, em substituição ao\ntitular Carlos Otávio Flexa Ribeiro, e foi diretor do Departamento de\nEducação Nacional.\n\nNas eleições de outubro de 1962 foi eleito deputado estadual na\nGuanabara na legenda do Partido Democrata Cristão (PDC). Tomou posse em\nfevereiro de 1963 e foi escolhido segundo vice-presidente da mesa\ndiretora da Assembleia Legislativa. Em 1964 foi escolhido líder do PDC,\nmas em abril, após o movimento político-militar que derrubou o\npresidente João Goulart, anunciou seu desligamento do partido por\ndiscordar das diretivas “esquerdizantes” aprovadas na última convenção\npartidária, e tornou-se um dos principais defensores do governo militar.\nPermaneceu como deputado independente até setembro, quando se filiou à\nUnião Democrática Nacional (UDN). Em 1965 foi escolhido presidente da\nComissão de Administração e Redação. Com a extinção dos partidos pelo\nAto Institucional n^o^ 2 em outubro do mesmo ano e a instauração do\nbipartidarismo, foi um dos primeiros deputados estaduais a filiar-se à\nAliança Renovadora Nacional (Arena), partido de apoio ao regime militar.\nEm 1966, foi designado vice-presidente da Comissão de Administração e\nRedação e vice-líder da Arena e, em novembro, foi reeleito deputado\nestadual.\n\nIniciando o segundo mandato em 1967, permaneceu como vice-líder da Arena\ne passou a defender a integração econômica entre os estados do Rio de\nJaneiro e da Guanabara, a partir da linha proposta pelo Clube dos\nDiretores Lojistas, pela Associação Comercial e outras entidades do\nsetor. No entanto, nesse momento ainda era contrário à fusão entre os\ndois estados, devido ao vulto das questões políticas e administrativas\nque tal decisão traria. Em 1968, integrou a Comissão Especial de Emendas\nConstitucionais e participou de uma comissão de estudos criada para\ndiscutir a fusão entre os estados do Rio de Janeiro e da Guanabara.\n\nReelegeu-se para mais um mandato em novembro de 1970. Na sessão\nlegislativa de 1971, foi vice-líder da Arena, integrou a Comissão de\nConstituição e Justiça e foi suplente das comissões de Cultura, Ciência\ne Tecnologia e de Finanças. Nesse mandato, enfatizou a necessidade da\nfusão entre a Guanabara e o estado do Rio como forma de neutralizar o\nesvaziamento econômico sofrido pela cidade do Rio de Janeiro com a\nmudança da capital na década anterior, agravado pelos fatores econômicos\ne fiscais que limitavam o desenvolvimento e a expansão dos setores\nindustrial e comercial locais. Em 1974, foi membro da Comissão de\nAdministração e Trabalho e suplente da Comissão de Saúde e Serviços\nSociais.\n\nPor meio da Lei Complementar n^o^ 20, de 1^o^ de julho de 1974,\nsancionada pelo presidente Ernesto Geisel, foi decretada a fusão entre\nos estados do Rio de Janeiro e da Guanabara, a ser concretizada em 15 de\nmarço de 1975. Nas eleições de novembro, Gama Filho foi mais uma vez\neleito deputado estadual. Durante os trabalhos da Assembleia\nConstituinte estadual em 1975, participou da Comissão Constitucional.\nDedicou-se a propor emendas que amparassem o magistério estadual,\natravés do aumento do vencimento básico e do escalonamento da carreira\npor meio de estatuto de modo a evitar a evasão dos professores; também\npropôs um plano integrado de turismo para a região fluminense, auxílios\nàs instituições de caridade e a criação de um Conselho Estadual de\nFamília. A Constituição do Estado do Rio de Janeiro foi promulgada em 23\nde julho de 1975, e no período seguinte foi presidente da Comissão de\nEducação, Cultura, Ciência e Tecnologia, segundo vice-presidente da\nComissão Especial de Normas Internas e suplente da Comissão de Controle\ndo Meio Ambiente. Em 1978, último ano de seu mandato, foi também\nvice-presidente da Comissão de Regiões Serranas e Baixadas Litorâneas e\nsuplente da Comissão de Indicações Legislativas e Proposições Externas.\nNos últimos dois meses de 1978, assumiu a liderança do governo na\nAssembleia.\n\nFoi também reitor da Faculdade Celso Lisboa, de 1972 a 1978, e professor\nda Faculdade Morais Júnior. Foi proprietário de colégios, como o Paula\nFreitas e o Vera Cruz, ambos na Tijuca. Presidiu a companhia estatal\nUrucum Mineração, fundada em 1976. Era comendador de Portugal e da\nEspanha, e recebeu do papa Paulo VI a comenda de Cavaleiro da Ordem do\nSanto Sepulcro.\n\nFaleceu no dia 4 de maio de 1985.\n\nCasado com Maria Luísa Ribas da Gama Lima, teve cinco filhos.\n\nEscreveu diversos livros didáticos, como *Curso básico de geografia do\nBrasil* (1961) e *Educação moral e cívica (súmulas) para estudantes do\nensino médio* (1971), e obras como *Elementos de economia: economia\npolítica* (1951), em parceria com Reinaldo Gonçalves, e *Noções gerais\nde comércio* (1960).\n\n*Paulo Celso Corrêa*\n\nFONTES: ASSEMB. LEGISL. GB. *Anais*; *Curriculum Vitae* de Francisco da\nGama Lima Filho; *Diário Oficial RJ*; *Jornal do Brasil* (6/5/1985).\n","ref":"FONTES: ASSEMB. LEGISL. GB. *Anais*; *Curriculum Vitae* de Francisco da\nGama Lima Filho; *Diário Oficial RJ*; *Jornal do Brasil* (6/5/1985).\n","dic":"DPRRJ"}
