{"title":"LIMA, Luís Henrique","cargoss":["Deputado Estadual"],"cargos_esp":[0],"datas_ini":[1987],"datas_fim":[1995],"estados":["RJ"],"autor":["Isadora Tavares Maleval"],"content":"**LIMA, Luís Henrique**\n\n\\* dep. est. RJ 1987-1995.\n\n*Luís Henrique Morais de Lima* nasceu em Concórdia (SC) no dia 19 de\njulho de 1960.\n\nGraduou-se em ciências contábeis na Universidade Federal do Rio de\nJaneiro (UFRJ) em 1981. Especializou-se em finanças corporativas na\nPontifícia Universidade Católica do Rio de Janeiro (PUC-Rio) em 1995 e\nobteve o título de mestre em planejamento ambiental no Instituto Luiz\nCoimbra de Pós-Graduação e Pesquisa de Engenharia da UFRJ (Coppe-UFRJ)\nno ano 2000. Doutorou-se em planejamento ambiental também no Coppe-UFRJ\nem 2009.\n\nTrabalhou como economista e analista de controle externo do Tribunal de\nContas da União (TCU), entre os anos de 1996 e 2009. Nesse último ano\nfoi empossado no Tribunal de Contas do Estado do Mato Grosso para o\ncargo de auditor substituto de conselheiro.\n\nFiliado ao Partido Democrático Trabalhista (PDT), iniciou sua trajetória\npolítica em 1983, quando foi eleito vereador na Câmara Municipal do Rio\nde Janeiro, em mandato que exerceria até 1986. Durante esse período\nchegou a exercer a liderança da bancada do PDT no ano de 1985.\n\nElegeu-se deputado estadual na legenda do PDT no pleito de 1986. Nessa\nlegislatura, entre 1987 e 1991, foi vice-líder da bancada do PDT, como\ntambém vice-líder da Comissão de Controle de Meio Ambiente e Defesa\nCivil. Foi membro efetivo das comissões de Constituição e Justiça, de\nCiência, Energia e Tecnologia, e de Orçamento, Finanças e Tributação.\nAtuou como suplente nas comissões de Defesa dos Direitos Humanos, de\nEmendas Constitucionais e Vetos, de Servidores Públicos, de Redação, de\nIndicações Legislativas, e de Normas Internas e Proposições Externas.\nFoi suplente em três comissões parlamentares de inquérito (CPIs),\ndestinadas a “Apurar irregularidades na Secretaria de Estado de Polícia\nCivil”; a “Apurar responsabilidades na destruição do ecossistema da\nlagoa de Araruama”; e a “Apurar as causas da poluição do Rio Paraibuna”.\nFoi também membro da Comissão Interpartidária Pró-Constituinte\n(subcomissão econômica). Ao final deste mandato tornou-se líder da\nbancada do PDT em 1991.\n\nFoi reeleito deputado estadual em 1990. Durante sua segunda legislatura\nna Assembleia Legislativa do Estado do Rio de Janeiro (ALERJ) foi\nsecretário de Estado de Administração no período de 1992 a 1994.\n\nApós o fim de seu mandato como deputado estadual tornou-se secretário de\nSaneamento e Recursos Hídricos do Estado do Rio de Janeiro entre os anos\n2000 e 2002.\n\nFoi também vice-presidente da Associação de Auditores da Região\nCentro-Oeste; instrutor do Instituto Serzedello Corrêa do TCU e da\nEscola de Contas e Gestão do Tribunal de Contas do Estado do Rio de\nJaneiro (TCE-RJ) e atuou como professor em disciplinas de pós-graduação\nem cursos da Fundação Getulio Vargas (FGV), da Universidade Gama Filho\n(UGF) e da PUC-Rio. Foi professor também em cursos preparatórios para\nconcursos públicos.\n\nPublicou três livros: *Controle do patrimônio ambiental brasileiro*\n(2000), *Controle externo – 310 questões comentadas* (2008) e *Controle\nexterno: teoria, jurisprudência e mais 500 questões* (2009), os dois\núltimos com muitas edições expandidas com exercícios voltados aos\ncandidatos a concursos públicos. Produziu também muitos artigos e\ntrabalhos técnicos, sobretudo nas áreas de controle externo e de gestão\nambiental.\n\n*Isadora Tavares Maleval*\n\nFONTES: ASSEMB. LEGISL. RJ. *Deputados estaduais fluminenses*. Quarta\nlegislatura (1987-1991); ASSEMB. LEGISL. RJ. *Deputados estaduais\nfluminenses*. Quinta legislatura (1991-1994); Elsevier. Disponível em:\n\\<www.elsevier.com.br/site/institucional/Minha-pagina-autor.aspx?seg=1&aid=42547\\>.\nAcesso em: 10/11/2010; TRIB. CONT. MG. Disponível em:\n\\<www.tce.mt.gov.br/conteudo/index/sid/286\\>. Acesso em: 10/11/2010.\n","ref":"FONTES: ASSEMB. LEGISL. RJ. *Deputados estaduais fluminenses*. Quarta\nlegislatura (1987-1991); ASSEMB. LEGISL. RJ. *Deputados estaduais\nfluminenses*. Quinta legislatura (1991-1994); Elsevier. Disponível em:\n\\<www.elsevier.com.br/site/institucional/Minha-pagina-autor.aspx?seg=1&aid=42547\\>.\nAcesso em: 10/11/2010; TRIB. CONT. MG. Disponível em:\n\\<www.tce.mt.gov.br/conteudo/index/sid/286\\>. Acesso em: 10/11/2010.\n","dic":"DPRRJ"}
