{"title":"LOBO, Moacir de Paula","cargoss":["Constituinte","Deputado Estadual","Deputado Estadual"],"cargos_esp":["est",0,0],"datas_ini":[1935,1935,1947],"datas_fim":[1936,1937,1951],"estados":["RJ","RJ","RJ"],"autor":[0],"content":"**LOBO, Moacir de Paula**\n\n\\* const. est. RJ 1935-1936; dep. est. RJ 1935-1937; const. est. RJ1947;\ndep. est. RJ 1947-1951.\n\n*Moacir de Paula Lobo* nasceu no Rio de Janeiro, então Distrito Federal,\nno dia 27 de junho de 1895, filho de Antônio Fonseca Lobo e de Judite\nTorres de Fonseca Lobo.\n\nFormou-se pela Faculdade de Medicina do Rio de Janeiro em 1926. Obteve o\nprêmio Francisco de Castro conferido ao melhor aluno pela tese de\nclínica propedêutica.\n\nEm 1932 iniciou sua atividade política como prefeito de Angra dos Reis.\nPermaneceu no cargo até 1934, quando se candidatou a deputado estadual\nno Rio de Janeiro pela legenda do Partido Radical (PR).\n\nElegeu-se deputado estadual em outubro de 1934. Tomou posse na\nAssembleia Legislativa do Estado do Rio de Janeiro (ALERJ) no ano\nseguinte e nessa legislatura fez parte da Assembleia Constituinte\nestadual preparou a nova Constituição do estado do Rio de Janeiro,\npromulgada em 22 de janeiro de 1936. Em novembro do ano seguinte seu\nmandato foi, contudo, interrompido devido ao golpe do Estado Novo, no\ngoverno do presidente Getúlio Vargas (1930-1945), quando o Congresso\nNacional e as assembleias legislativas foram fechados.\n\nAinda em 1937 retornou à prefeitura de Angra dos Reis, cargo que\npermaneceu até 1946.\n\nCom o fim do Estado Novo e a reorganização partidária em 1945, uma nova\nConstituição Federal entrou em vigor em 1946. Em janeiro de 1947 foi\neleito deputado à Assembleia Constituinte do Estado do Rio de Janeiro\npelo Partido Social Democrático (PSD). Assumiu o cargo no mês seguinte,\nquando foi instalada, no dia 24, a Constituinte estadual. Em 20 de junho\nfoi promulgada a Constituição do Estado do Rio de Janeiro. A partir de\nentão, retornou ao exercício do mandato ordinário ocupou uma cadeira na\nALERJ.\n\nEntre 1946 e 1947 foi membro do Conselho Administrativo do Estado.\n\nDurante sua atividade parlamentar posicionou-se nos debates sobre Angra\ndos Reis e região, e especialmente sobre problemas de saúde e saneamento\nbásico. Na tribuna da assembleia denunciou a “política de porta aberta”\nadotada pela presidência de Eurico Gaspar Dutra (1946-1951) em prol do\nimperialismo americano que prejudicava a indústria nacional.\n\nParticipou da Comissão de Saúde Pública, Organização Municipal, Educação\ne Saúde.\n\nEm 21 de julho de 1953 foi nomeado ministro do Tribunal de Contas do\nEstado do Rio de Janeiro, do qual foi vice-presidente entre 1954-1955 e\n1960. Em 1956 assumiu a presidência do Tribunal. Aposentou-se em 1962.\n\nAssumiu a secretaria estadual de Saúde durante os governos de Carvalho\nJanotti (1962-1963) e Luiz Pinaud (1963).\n\nFoi membro da Academia Nacional de Medicina.\n\nColaborou com os periódicos *O Estado* e *Tribuna Médica*.\n\nFaleceu em 19 de setembro de 1969.\n\n*Vicente Saul Moreira dos Santos*\n\nFONTES: ASSEMB. CONST. RJ. *Anais* (1947); ASSEMB. LEGISL. RJ. *Anais*\n(1947, 1948); DURÃO, D. *Memória*.\n","ref":"FONTES: ASSEMB. CONST. RJ. *Anais* (1947); ASSEMB. LEGISL. RJ. *Anais*\n(1947, 1948); DURÃO, D. *Memória*.\n","dic":"DPRRJ"}
