{"title":"LOMELINO, Francisco","cargoss":["Deputado Estadual","Deputado Estadual","Deputado Estadual"],"cargos_esp":[0,0,0],"datas_ini":[1983,1981,1975],"datas_fim":[1987,1983,1979],"estados":["RJ","RJ","RJ"],"autor":["Sabrina Guerghe"],"content":"**LOMELINO, Francisco**\n\n\\* dep. est. RJ 1975-1979, 1981-1983, 1983-1987.\n\n*Francisco Garcia de Freitas Lomelino* nasceu em Niterói, então capital\ndo estado do Rio de Janeiro, no dia 6 de julho de 1933.\n\nBacharelou-se em direito e ingressou na vida política, no pleito de\nnovembro de 1974, ao eleger-se deputado estadual, através da legenda do\nMovimento Democrático Brasileiro (MDB), pelo novo estado do Rio de\nJaneiro, resultante da fusão da Guanabara com o antigo estado do Rio.\nIniciou seu mandato em março do ano seguinte e passou a integrar a\nComissão Especial de Redação.\n\nEm 1976 assumiu a vice-presidência da Comissão de Agricultura e Política\nRural, permanecendo na função até 1977, quando foi escolhido para\nintegrar a Comissão de Estudos e Planejamento para o Desenvolvimento do\nEstado.\n\nDurante a Primeira Legislatura (1975-1979) foi, também, suplente das\ncomissões de Assuntos Municipais e de Economia, Indústria e Comércio.\n\nNas eleições de 1978 tentou reeleger-se ao Legislativo fluminense e\nobteve uma suplência. Tomou posse em 13 de janeiro de 1981, na vaga\naberta com o falecimento do parlamentar Frederico Trotta, e passou a\npresidir a Comissão de Indicações Legislativas e Proposições Externas.\n\nNo ano seguinte assumiu a liderança da bancada do Partido Democrático\nSocial (PDS), agremiação que, com o fim do bipartidarismo, deu\ncontinuidade à Arena. No pleito de novembro, com 26.698 votos,\nconquistou novamente uma cadeira na Assembleia Legislativa do Estado do\nRio de Janeiro (ALERJ). Ao tomar posse, em fevereiro de 1983, retomou a\nliderança do seu partido.\n\nEm 5 de novembro de 1986 foi aprovado o Projeto de Lei n^o^ 1.019, de\nsua autoria, que dispunha sobre a contagem de tempo de serviço\nanteriormente prestado sob o regime da Consolidação das Leis do Trabalho\n(CLT), para efeito de concessão de licença-prêmio.\n\nAfastado da vida política, nas eleições de 2002 tentou voltar ao\nLegislativo fluminense, desta vez pela legenda do Partido Progressista\nBrasileiro (PPB). Com 4.401 votos não conseguiu se eleger.\n\nEm 4 de abril de 2003 o PPB voltou a chamar-se apenas Partido\nProgressista (PP). Acompanhando as mudanças em sua agremiação, filiou-se\nà nova legenda. No ano seguinte tentou conquistar uma vaga na Câmara de\nVereadores de sua cidade natal, mas com 1.269 votos não foi\nbem-sucedido.\n\nDeixou a legenda do PP e filiou-se ao Partido Democrático Trabalhista\n(PDT). No pleito de 2006 foi candidato a uma cadeira na ALERJ,\nentretanto, com 3.786 votos, não obteve êxito.\n\n*Sabrina Guerghe*\n\nFONTES: ASSEMB. LEGISL. RJ. *Documentos*; ASSEMB. LEGISL. RJ. *Deputados\nestaduais fluminenses*. Terceira legislatura (1983-1987); *Diário\nOficial* (4/1/1979); TRIB. SUP. ELEIT. (Eleições 2002, 2004, 2006).\n","ref":"FONTES: ASSEMB. LEGISL. RJ. *Documentos*; ASSEMB. LEGISL. RJ. *Deputados\nestaduais fluminenses*. Terceira legislatura (1983-1987); *Diário\nOficial* (4/1/1979); TRIB. SUP. ELEIT. (Eleições 2002, 2004, 2006).\n","dic":"DPRRJ"}
