{"title":"LOPES, Fernando","cargoss":["Deputado Estadual","Deputado Estadual","Deputado Estadual","Deputado Estadual","Deputado Estadual","Deputado Estadual"],"cargos_esp":["1987-1991, dep fed","1987-1991, dep fed","1987-1991, dep fed","1987-1991, dep fed","1987-1991, dep fed","1987-1991, dep fed"],"datas_ini":[2007,2003,1999,1994,1993,1991],"datas_fim":[2011,0,0,1999,0,0],"estados":["RJ","RJ","RJ","RJ","RJ","RJ"],"autor":["Eneida Santos Lima"],"content":"**LOPES, Fernando**\n\n\\* dep. est. 1987-1991, dep. fed. RJ 1991, 1993, 1994-1999, 1999, 2003,\n2007-2011.\n\n*Fernando Lopes de Almeida*nasceu no Rio de Janeiro, então Distrito\nFederal, no dia 3 de dezembro de 1946, filho de Antônio de Almeida e de\nMaria Amélia Lopes de Almeida.\n\nCursou o ginasial e o colegial no Colégio Pedro II, em sua cidade natal.\nEm 1965 ingressou na Escola de Engenharia da antiga Universidade do\nBrasil, atual Universidade Federal do Rio de Janeiro. Em 1967 abandonou\no curso de engenharia e iniciou, simultaneamente, o curso de psicologia,\nna UFRJ – depois também interrompido – e o de economia, na Universidade\ndo Estado da Guanabara, atual Universidade do Estado do Rio de Janeiro\n(UERJ).\n\nVinculado a uma dissidência do clandestino Partido Comunista Brasileiro\n(PCB), posteriormente denominada Movimento Revolucionário 8 de Outubro\n(MR-8), iniciou sua atuação política, em 1967, no movimento estudantil e\nparticipou da luta contra o movimento político-militar de março de 1964.\nEm 1968 foi presidente do diretório acadêmico do Instituto de Psicologia\nda Ufrj. Com a decretação do Ato Institucional n^o^ 5 (AI-5), em\ndezembro de 1968, entrou para a clandestinidade, na qual permaneceu até\no início de 1970.\n\nFormou-se economista em 1970. Cursou o mestrado (1972-1973) e o\ndoutorado (1974-1975) de economia na Escola de Pós-Graduação em Economia\nda Fundação Getulio Vargas (FGV), obtendo o grau de doutor em 1979.\nEmbora tivesse atuado no Movimento Democrático Brasileiro (MDB), partido\nde oposição ao regime militar, sua primeira filiação partidária formal\nfoi em dezembro de 1981 ao Partido Democrático Trabalhista (PDT). Por\nesse partido foi candidato a deputado estadual em novembro de 1982, mas\nnão teve êxito.\n\nDurante o primeiro governo Leonel Brizola (1983-1987) foi secretário de\nPlanejamento e Controle do Estado do Rio de Janeiro de 1983 até 1986,\nquando se desincompatibilizou do cargo para se candidatar novamente pelo\nPDT a uma vaga na Assembleia Legislativa, em novembro desse mesmo ano.\n\nEleito com os votos da população de baixa renda da Região Metropolitana\ndo Rio de Janeiro, foi empossado em fevereiro de 1987. Como deputado\nestadual foi vice-presidente da Comissão de Transporte (1987-1988),\nmembro da Comissão de Orçamento e Finanças (1987-1990) e presidente da\nComissão de Economia, Indústria, Comércio e Turismo (1989-1990).\n\nEm outubro de 1990 foi eleito deputado federal pelo PDT fluminense.\nTomou posse em fevereiro de 1991, mas em março pediu licença para\nexercer, pela segunda vez, o cargo de secretário de Planejamento e\nControle do Estado do Rio de Janeiro, dessa vez no segundo governo\nLeonel Brizola (1991-1994), e foi substituído na Câmara pelo suplente\nLaerte Bastos, também do PDT. Simultaneamente, de 1991 a 1993, ocupou a\npasta de Urbanização, Habitação e Assentamentos Humanos. Em setembro\ndesse último ano retornou ao Legislativo federal por curto período, pois\nreassumiu o cargo de secretário em novembro de 1993. Dessa vez, seu\nsubstituto na Câmara foi o suplente Eduardo Mascarenhas (PDT). Lopes\nafastou-se em definitivo da Secretaria de Planejamento e Controle em\nmarço de 1994 e voltou a exercer o mandato parlamentar.\n\nEm 3 de outubro seguinte foi reeleito deputado federal pelo PDT, com a\nmaioria dos votos de sua base eleitoral na região dos Lagos. Dezesseis\ndias depois, no entanto, o Tribunal Regional Eleitoral do Rio de Janeiro\n(TRE-RJ) decidiu anular o pleito por suspeitas de fraude. Marcada nova\neleição para novembro seguinte, Fernando Lopes confirmou sua reeleição.\nEmpossado em fevereiro de 1995, passou a integrar as comissões de\nDireitos Humanos e de Comunicação, Ciência e Tecnologia da Câmara dos\nDeputados.\n\nNas votações das emendas constitucionais propostas pelo governo Fernando\nHenrique Cardoso em 1995 votou contra a quebra do monopólio dos estados\nna distribuição de gás canalizado, a quebra do monopólio das embarcações\nnacionais na navegação de cabotagem, a mudança no conceito de empresa\nnacional, a quebra do monopólio estatal das telecomunicações, a quebra\ndo monopólio da Petrobras na exploração do petróleo e a prorrogação do\nFundo Social de Emergência (FSE), rebatizado de Fundo de Estabilização\nFiscal (FEF), que permitia que o governo gastasse 20% da arrecadação de\nimpostos, sem que essas verbas ficassem obrigatoriamente vinculadas aos\nsetores de saúde e educação.\n\nEm maio de 1996 Fernando Lopes foi acusado pelo candidato do Partido da\nFrente Liberal (PFL) à prefeitura do Rio de Janeiro, Luís Paulo Conde,\nde ter incentivado invasões urbanas e loteamentos clandestinos durante\nsua gestão à frente da Secretaria de Planejamento.\n\nEm julho seguinte votou a favor da prorrogação da Contribuição\nProvisória sobre Movimentação Financeira (CPMF) – sucessora do Imposto\nProvisório sobre Movimentação Financeira (IPMF) –, taxação de 0,2% sobre\ntransações bancárias, criada como fonte complementar de recursos para a\nsaúde.\n\nAinda em 1996 assumiu a segunda vice-presidência da Comissão de Direitos\nHumanos e integrou como membro titular a Comissão de Finanças e\nTributação da Câmara. Nessa última foi relator do projeto de resolução\ndo deputado do Partido dos Trabalhadores (PT) Mílton Temer, que previa a\ninstalação imediata de Comissão Parlamentar de Inquérito (CPI) para\ninvestigar as atividades do Banco Central e o Programa de Estímulo à\nReestruturação e Fortalecimento do Sistema Financeiro (Proer) do governo\nfederal. Na ocasião deu parecer favorável ao projeto.\n\nEm novembro desse último ano o TSE decidiu revogar o pleito de novembro\nde 1994 e restabelecer o resultado de outubro. Ao considerar que as\ndenúncias de fraude não tinham sido devidamente comprovadas, o tribunal\ndeterminou nova diplomação da bancada do Rio de Janeiro, de acordo com o\nresultado da primeira eleição. Vitorioso nos dois pleitos de 1994,\nFernando Lopes foi reempossado na Câmara em fevereiro de 1997.\n\nAinda no mesmo mês votou contra a emenda da reeleição para presidente da\nRepública, prefeitos e governadores de estado. Em novembro seguinte\ntambém se manifestou contrário ao destaque para o projeto de reforma\nadministrativa do Executivo federal que aprovou o fim da estabilidade no\nserviço público, em caso de mau desempenho do servidor ou toda vez que\nos gastos com pessoal fossem superiores a 60% da arrecadação do Estado.\nTambém em 1997 integrou como membro titular a Comissão de Fiscalização\nFinanceira e Controle e assumiu a terceira vice-presidência da Comissão\nde Direitos Humanos da Câmara.\n\nNo pleito de outubro de 1998 – ano em que foi um dos vice-líderes do PDT\nna Câmara – candidatou-se à reeleição, obtendo a primeira suplência da\nlegenda pedetista. Em novembro seguinte votou contra o teto de 1.200\nreais para aposentadorias no setor público e o estabelecimento de idade\nmínima e tempo de contribuição para o setor privado, itens que definiram\na reforma da previdência.\n\nDeixou a Câmara em janeiro do ano seguinte, ainda na legislatura\n1995-1999, para assumir a Secretaria de Controle Geral do Quadro\nPermanente de Pessoal Civil do Poder Executivo do Rio de Janeiro, no\ngoverno de Anthony Garotinho (1999-2001), sendo substituído no\nLegislativo federal pelo suplente Luís Salomão (PDT). Em fevereiro de\n1999 assumiu cadeira de deputado na nova legislatura (1999-2003), na\nvaga de Míriam Reid, que fora indicada para a Secretaria da Criança e do\nAdolescente do governo estadual. Empossado apenas para não perder o\nmandato, solicitou em seguida nova licença da Câmara para continuar\natuando como secretário, sendo mais uma vez substituído por Luís\nSalomão.\n\nNo pleito eleitoral posterior, de 2002, voltou a candidatar-se ao cargo\nde deputado federal, pelo PSB, e, obteve sucesso. Licenciou-se em parte\ndo primeiro ano de mandato, em fevereiro de 2003, para exercer o cargo\nde Secretário de Planejamento, Controle e Gestão do Estado do Rio de\nJaneiro, mas retornou no mês de setembro daquele mesmo ano. Nesse\nmandato ainda atuou como titular na Comissão de Finanças e Tributação,\nFiscalização financeira e Controle, e de Relações Exteriores e de Defesa\nNacional.\n\nNo ano de 2003 filiou-se ao Partido do Movimento Democrático Brasileiro\n(PMDB), em cuja legenda se candidatou a mais um mandato na Câmara dos\nDeputados no pleito eleitoral seguinte, em 2006. Eleito, atuou como\ntitular na Comissão da Amazônia, Integração Nacional e de\nDesenvolvimento Regional, Desenvolvimento Econômico, Indústria e\nComércio e de Turismo e Desporto, além de assumir a vice-presidência da\nComissão de Direitos Humanos.\n\nEm 2010 tentou reeleger-se deputado federal na legenda do PMDB, mas não\nfoi eleito. Deixou a Câmara em janeiro de 2010 ao término do seu\nmandato.\n\nFoi diretor do Sindicato dos Economistas e da Associação de Funcionários\nda FGV do Rio de Janeiro, professor da Universidade Federal Fluminense\n(UFF) e da UFRJ e economista da FGV.\n\nCasou-se com Hilda Maria Ferreira de Almeida e teve duas filhas.\nDivorciado, uniu-se a Janaína Ferreira, com quem teve mais uma filha.\n\nFoi colaborador das obras *A indústria brasileira de bens de capital*\n(1979) e *Política salarial, emprego e sindicalismo – 1964-1981* (1982)\ne teve publicada sua tese de doutorado, intitulada *A expansão da\nindústria de bens de capital: fatores determinantes* (1983).\n\nEneida Santos Lima\n\nFONTES: CÂM. DEP. *Deputados brasileiros*. Repertório (1991-1995,\n1995-1999); CÂM. DEP. *Quadro de titulares e suplentes* (1991-1995 e\n1995-1999); *Folha de S.Paulo* (31/1/1995, 14/1, 1/8/1996, 30/1/1997,\n5/2, 29/9, 10/10, 11/11/1998); *Globo* (20/3, 5/6/1996, 5/2/1997,\n7/10/1998, 1/1/1999); INF. BIOG.; *Jornal do Brasil* (24/7/1996); Uol\nNotícias. Disponível em:\n\\<http://noticias.uol.com.br/politica/politicos-brasil/2010/deputado-federal/03121946-fernando-lopes.jhtm\\>.\nAcesso em: 17/10/2010; *Perfil parlamentar/IstoÉ* (1991).\n","ref":"FONTES: CÂM. DEP. *Deputados brasileiros*. Repertório (1991-1995,\n1995-1999); CÂM. DEP. *Quadro de titulares e suplentes* (1991-1995 e\n1995-1999); *Folha de S.Paulo* (31/1/1995, 14/1, 1/8/1996, 30/1/1997,\n5/2, 29/9, 10/10, 11/11/1998); *Globo* (20/3, 5/6/1996, 5/2/1997,\n7/10/1998, 1/1/1999); INF. BIOG.; *Jornal do Brasil* (24/7/1996); Uol\nNotícias. Disponível em:\n\\<http://noticias.uol.com.br/politica/politicos-brasil/2010/deputado-federal/03121946-fernando-lopes.jhtm\\>.\nAcesso em: 17/10/2010; *Perfil parlamentar/IstoÉ* (1991).\n","dic":"DPRRJ"}
