{"title":"LOPES, Tancredo","cargoss":["Deputado Estadual"],"cargos_esp":[0],"datas_ini":[1916],"datas_fim":[1918],"estados":["RJ"],"autor":[0],"content":"**LOPES, Tancredo**\n\n\\* dep. est. RJ 1916-1918.\n\n*Tancredo Lopes* atuou politicamente em Itaperuna (RJ).\n\nEra proprietário rural e jornalista. Formou-se em medicina.\n\nApós a morte de Pinheiro Machado em setembro de 1915, formou-se a\ndissidência do Partido Republicano Conservador Fluminense (PRCF)\nliderada pelo senador Erico Coelho para as eleições da Assembleia\nLegislativa do Estado do Rio de Janeiro (ALERJ) e das câmaras\nmunicipais. Em dezembro Tancredo Lopes disputou uma vaga de deputado\nestadual por essa chapa.\n\nDurante sua atividade parlamentar atuou como representante dos\nmadeireiros do norte fluminense. Na ALERJ, participou da Comissão de\nObras Publicas, Saúde Publica e Câmaras Municipais.\n\nEm 1921, integrou o grupo dos nilistas. Era membro da Sociedade\nFluminense de Agricultura e Indústrias Rurais (SFAIR).\n\nApós se afastar da vida política, destacou-se como médico e industrial\nem Natividade e Itaperuna.\n\n*Vicente Saul Moreira dos Santos*\n\nFONTES: ASSEMB. LEGISL. RJ. *Anais* (1917, 1918); *Estado* (11/2, 22/4,\n28/4/1921); FERREIRA, M. *República*; *Fluminense* (13, 21/12/1915);\nLAEMMERT, E. *Almanak* (1915,1918); SOARES, E. *História*.\n","ref":"FONTES: ASSEMB. LEGISL. RJ. *Anais* (1917, 1918); *Estado* (11/2, 22/4,\n28/4/1921); FERREIRA, M. *República*; *Fluminense* (13, 21/12/1915);\nLAEMMERT, E. *Almanak* (1915,1918); SOARES, E. *História*.\n","dic":"DPRRJ"}
