{"title":"LOUZADA, Júlio","cargoss":["Deputado Estadual"],"cargos_esp":[0],"datas_ini":[1975],"datas_fim":[1983],"estados":["RJ"],"autor":["Adriana Clen"],"content":"**LOUZADA, Júlio**\n\n\\* dep. est. RJ 1975-1983.\n\n*Júlio Pires Louzada* nasceu em 21 de fevereiro de 1914.\n\nRadialista e compositor, ficou conhecido por apresentar os programas\n*Hora da Ave Maria* na Rádio Tupi e *Consultório sentimental de Júlio\nLouzada* na Rádio Nacional.\n\nFoi eleito deputado estadual pela Arena durante a primeira legislatura\nda ALERJ, após a fusão dos estados do Rio de Janeiro e da Guanabara, e\nocupou o cargo entre 15 de março de 1975 e 31 de janeiro de 1979. Foi\nreeleito para um segundo mandato pelo Partido Democrático Social (PDS),\nfundado em 1980, após o fim do sistema bipartidário criado com o regime\nmilitar de 1964.\n\nEm 1975 foi vice-presidente da Subcomissão do Orçamento e da\nFiscalização Orçamentária e membro da Comissão Constitucional. Durante\numa sessão ordinária da ALERJ o deputado estadual realizou uma leitura\ndo discurso do então presidente Ernesto Geisel (1907-1996), em\ncomemoração aos 11 anos de instauração do regime militar.\n\nFoi autor de diversas leis estaduais, que, em sua maioria, concediam\ntítulos honoríficos a cidades do interior, consideravam de utilidade\npública várias instituições e nomeavam logradouros públicos e\nestabelecimentos. Entre elas, destacam-se as leis n^o^ 114, de 10 de\njaneiro de 1977, que “autoriza o poder executivo a dar o nome do\nradialista Manoel da Nóbrega a uma das praças fluminenses”, n^o^ 399, de\n26 de dezembro de 1980, que “considera de utilidade pública o Instituto\nEducacional Pedro II”, e n^o^ 653, de 13 de janeiro de 1983, que\n“concede a Três Rios o título honorífico de Cidade das Ninfas”.\n\n*Adriana Clen*\n\nFONTES: ASSEMB. CONST. RJ. *Anais* (1975, v. 1, 1975, v. 2); AUGUSTO, S.\n*Este mundo*; GOULART, J; LENHARO, A. *Cantores*; MURCE, R.\n*Bastidores*.\n","ref":"FONTES: ASSEMB. CONST. RJ. *Anais* (1975, v. 1, 1975, v. 2); AUGUSTO, S.\n*Este mundo*; GOULART, J; LENHARO, A. *Cantores*; MURCE, R.\n*Bastidores*.\n","dic":"DPRRJ"}
