{"title":"LUZ, Ferreira da","cargoss":["Constituinte","Deputado Estadual"],"cargos_esp":["est",0],"datas_ini":[1892,1892],"datas_fim":[1892,1894],"estados":["RJ","RJ"],"autor":["Raimundo Helio Lopes"],"content":"**LUZ, Ferreira da**\n\n\\* const. est. RJ 1892; dep. est. RJ 1892-1894.\n\n*Francisco Antunes Ferreira da Luz* foi eleito, em 31 de janeiro de\n1892, para a nova Assembleia Estadual Constituinte formada após a\nrenúncia do então presidente do estado do Rio de Janeiro Francisco\nPortela (1889-1891). Com a saída do então chefe do poder estadual, a\nAssembleia Legislativa do Estado do Rio de Janeiro (ALERJ) foi\ndissolvida, assim como foi anulada a primeira Constituição republicana\nfluminense que havia sido promulgada por Portela e seus partidários\nquando da formação da primeira Constituinte estadual em 1891.\n\nA nova Assembleia, composta por partidários do Partido Republicano\nFluminense (PRF) liderados por José Tomás da Porciúncula, procurou\nreorganizar os estatutos jurídicos do estado que tinham sido\nconstituídos para favorecer Francisco Portela e representou o início do\ndomínio do PRF na política estadual. Durante a Constituinte estadual foi\neleito membro da Comissão responsável pela elaboração do projeto\nconstitucional a ser debatido. Nela, combateu a eleição do Senado pelo\nvoto indireto e defendeu a magistratura vitalícia e que o tribunal\nsuperior tivesse a faculdade de anular leis inconstitucionais.\n\nApós a promulgação da nova Constituição, em 9 de abril de 1892, foram\nrealizadas novas eleições para o Legislativo estadual no dia 24 do mesmo\nmês. Nesse pleito Ferreira da Luz foi eleito deputado estadual na\nlegenda do PRF, como representante de Pádua (RJ), e, na ALERJ, tornou-se\nsegundo vice-presidente da Mesa Diretora da Casa.\n\nPermaneceu na ALERJ até o final dessa legislatura, em dezembro de 1894.\n\nFerreira da Luz também foi médico.\n\n*Raimundo Helio Lopes*\n\nFONTES: ASSEMB. LEGISL. RJ. *Anais* (1892-1894); FERREIRA, M.\n*República*.\n","ref":"FONTES: ASSEMB. LEGISL. RJ. *Anais* (1892-1894); FERREIRA, M.\n*República*.\n","dic":"DPRRJ"}
