{"title":"MACEDO, Raul","cargoss":["Deputado Estadual"],"cargos_esp":[0],"datas_ini":[1907],"datas_fim":[1909],"estados":["RJ"],"autor":["Raimundo Helio Lopes"],"content":"**MACEDO, Raul**\n\n\\* dep. est. RJ 1907-1909.\n\n*Raul Bastos de Macedo* foi líder político na cidade de Capivari (RJ).\nEm 1904 foi representante e signatário deste município em mensagem\nenviada a Quintino Bocaiúva que pedia que assumisse o mandato de senador\npara o qual havia sido eleito no mesmo ano, o que, contudo, não se\nconcretizou.\n\nEm dezembro de 1906 elegeu-se deputado estadual no estado do Rio de\nJaneiro pelo 1^o^ distrito eleitoral, sediado em Niterói (RJ), e no ano\nseguinte, após tomar posse, foi eleito suplente de secretário da\nAssembleia Legislativa do Estado do Rio de Janeiro (ALERJ). Em 1908 foi\neleito membro da Comissão de Estatística, Divisão Civil e Judiciária e\nsegundo secretário da assembleia. Durante todo o mandato defendeu o\ngoverno de Alfredo Backer (1906-1910), então presidente do estado do Rio\nde Janeiro.\n\nApós a morte de Pinheiro Machado em setembro de 1915, formou-se uma\ndissidência do Partido Republicano Conservador Fluminense (PRCF),\nliderada pelo senador Erico Coelho, para participar das eleições\nestaduais e municipais em dezembro desse ano. Raul Macedo candidatou-se\npor essa chapa para a Assembleia Legislativa, mas não chegou a ser\ndiplomado.\n\n*Raimundo Helio Lopes*\n\nFONTES: ASSEMB. LEGISL. RJ. *Anais* (1907-1909); *Fluminense* (13,\n21/12/1915); *Jornal do Comércio* (2/6/1904).\n","ref":"FONTES: ASSEMB. LEGISL. RJ. *Anais* (1907-1909); *Fluminense* (13,\n21/12/1915); *Jornal do Comércio* (2/6/1904).\n","dic":"DPRRJ"}
