{"title":"MACHADO JÚNIOR, Francisco Marcondes","cargoss":["Deputado Estadual","Deputado federal","Deputado federal"],"cargos_esp":[0,0,0],"datas_ini":[1903,1934,1918],"datas_fim":[1905,1935,1923],"estados":["RJ","RJ","RJ"],"autor":[0],"content":"**MACHADO JÚNIOR, Francisco Marcondes**\n\n\\* dep. est. RJ 1903-1905; dep. fed. RJ 1918-1923 e 1934-1935.\n\n*Francisco Marcondes Machado Júnior* nasceu em Pindamonhangaba (SP) no\ndia 25 de junho de 1877, filho de Francisco Marcondes Machado e de\nRafaelina Teixeira de Barros.\n\nEstudou no Colégio Abílio, no Rio de Janeiro, então Distrito Federal, e\nbacharelou-se em direito em 1902.\n\nAdvogado e proprietário rural, iniciou sua carreira política elegendo-se\nem 1903 deputado estadual no estado do Rio de Janeiro na legenda do\nPartido Republicano. Encerrado seu mandato em 1905, foi eleito mais\ntarde vereador e presidente da Câmara Municipal de Sapucaia (RJ), onde\npermaneceu durante nove anos. Participando da comissão diretora do\nPartido Republicano do Rio de Janeiro, liderado na época por Nilo\nPeçanha, elegeu-se deputado federal por duas vezes consecutivas, nas\nlegislaturas de 1918 a 1920 e de 1921 a 1923.\n\nDepois da Revolução de 1930, candidatou-se em maio de 1933 à Assembleia\nNacional Constituinte pelo estado do Rio de Janeiro, dessa vez na\nlegenda do Partido Popular Radical (PPR), e obteve a quarta suplência.\nPromulgada a nova Carta em julho de 1934, ocupou uma cadeira na Câmara\ndos Deputados desse mês até maio de 1935, quando terminou o prazo de\nprorrogação dos mandatos constituintes e os novos deputados eleitos em\n1934 foram empossados.\n\nFoi diretor da Brazilian Traction Light and Power – conhecida como\nLight, empresa canadense responsável pelo fornecimento de energia\nelétrica ao eixo Rio-São Paulo – até morrer. Faleceu no Rio de Janeiro\nno dia 14 de outubro de 1946.\n\nEra casado com Julieta de Carvalho Marcondes, com quem teve cinco\nfilhos.\n\nFONTES: ASSEMB. NAC. CONST. 1934. *Anais* (1); CÂM. DEP. *Deputados*;\n*Câm. Dep.* *seus componentes*; *Ilustração Brasileira*; INF. Chiquita\nMarcondes.\n","ref":"FONTES: ASSEMB. NAC. CONST. 1934. *Anais* (1); CÂM. DEP. *Deputados*;\n*Câm. Dep.* *seus componentes*; *Ilustração Brasileira*; INF. Chiquita\nMarcondes.\n","dic":"DPRRJ"}
