{"title":"MACHADO, Edgardo Nunes","cargoss":["Prefeito"],"cargos_esp":["Campos"],"datas_ini":[1962],"datas_fim":[1963],"estados":[0],"content":"**MACHADO, Edgardo Nunes**\n\n\\* pref. Campos 1962-1963.\n\n***Edgardo Nunes Machado*** **diplomou-se em medicina e em seguida\npassou a exercer a profissão.**\n\n**Em 19 de janeiro de 1947, quando ocorreram as primeiras eleições\nestaduais e municipais após o fim do Estado Novo, foi eleito vereador em\nCampos (RJ). Assumiu o mandato em outubro do mesmo ano, e nas eleições\nmunicipais seguintes, realizadas em 3 de outubro de 1950, candidatou-se\ncom sucesso à reeleição. Iniciou o segundo mandato como vereador em\nfevereiro de 1951 e no mesmo ano assumiu interinamente a presidência da\nCâmara Municipal. Exerceu o mandato até o fim da legislatura, em janeiro\nde 1955.**\n\nNas eleições de 3 de outubro de 1958, filiado à União Democrática\nNacional (UDN), foi candidato a vice-prefeito de Campos na chapa\nvitoriosa encabeçada por José Alves de Azevedo, do Partido Trabalhista\nBrasileiro (PTB). Tomou posse como vice-prefeito em 1959, e em 1962\nassumiu a prefeitura por alguns meses, até janeiro de 1963, quando se\niniciou a gestão do prefeito recém-eleito João Barcelos Martins. A\npartir de então, voltou a exercer a profissão de médico.\n\n*Luciana Pinheiro*\n\nFONTES**:** BELIDO, V. *Política*; CÂM. MUN. CAMPOS DOS GOYTACAZES.\nDisponível em: \\<www.camaracampos.rj.gov.br/\\>. Acesso em: 28/3/2011;\nInstituto Historiar. Disponível em:\n\\<http://institutohistoriar.blogspot.com/\\>. Acesso em: 25/3/2011.\n","ref":"","dic":"DPRRJ"}
