{"title":"MACHADO, Luís Carlos","cargoss":["Deputado Estadual"],"cargos_esp":[0],"datas_ini":[1991],"datas_fim":[1999],"estados":["RJ"],"autor":["Ana Beatriz Paes"],"content":"**MACHADO, Luís Carlos**\n\n\\* dep. est. RJ 1991-1999.\n\n*Luís Carlos de Jesus Machado* nasceu na cidade do Rio de Janeiro (RJ)\nno dia 31 de maio de 1955, filho de Narciso Sebastião Machado e Luzia de\nJesus Machado. Atuou profissionalmente como assistente social, foi\ndiretor da Federação Nacional dos Urbanitários, diretor social do\nSindicato dos Urbanitários entre os anos de 1982 e 1985, e logo em\nseguida assumiu a presidência, mantendo-se nesse cargo entre os anos de\n1985 e 1993.\n\nIniciou sua vida pública na Assembleia Legislativa do Estado do Rio de\nJaneiro (ALERJ) em 1991, quando foi eleito deputado estadual pelo\nPartido Socialista Brasileiro com cerca de 12.880 votos. Durante esse\nmandato assumiu cargos como membro efetivo das comissões de obras\npúblicas; de defesa dos direitos humanos e de emendas constitucionais e\nvetos, bem como a suplência da comissão de ciência, energia e\ntecnologia. Logo em 1991, em coautoria com o então deputado Eduardo\nChuahy, elaborou a Lei de n^o^ 1.823, que dispunha sobre a aquisição por\nparte do estado do Rio de Janeiro do controle acionário da Light\nServiços de Eletricidade S/A.\n\nEm 1992 concedeu o título de benemérito do estado do Rio de Janeiro ao\nexcelentíssimo senhor Luiz Paulo Corrêa da Rocha, então secretário\nmunicipal de obras e serviços públicos da prefeitura da cidade do Rio de\nJaneiro; em 1993, ao professor Carlos Alberto Provenciano Gallo, ao\nprofessor Benito Diaz Paret e ao doutor Jamil Haddad do Rio de Janeiro,\nentão ministro da Saúde. Nesse mesmo ano também elaborou a Lei n^o^\n1.978, que considera de utilidade pública a Associação de Pais e Amigos\ndos Excepcionais (APAE) de Bom Jesus de Itabapoana.\n\nNo ano seguinte foi o responsável pela autoria de mais leis, entre as\nquais: a de n^o^ 2.182, que autorizava o Poder Executivo a instituir a\ncomplementação integral para os aposentados da administração indireta e\nparticipantes de fundações de seguridade, e a de n^o^ 2.147, que\nconsiderava de utilidade pública a Sociedade Ortodoxa São Nicolau.\n\nDurante o ano de 1994 criou a Comissão Parlamentar de Inquérito (CPI)\npara apurar e apontar soluções para a elevação das mensalidades em\ninstituições particulares de nível superior, incluindo-se 1^o^ e\n2^o^graus, bem como concedeu o título de benemérito do estado do Rio de\nJaneiro ao professor Francisco Correa Barbosa.\n\nEm 1995 foi reeleito deputado estadual, dessa vez pelo Partido da Social\nDemocracia Brasileira (PSDB). Nessa sua segunda gestão ocupou cargos\ncomo vice-líder do PSDB; membro efetivo da Comissão de assuntos\nMunicipais e de Desenvolvimento Regional, da Comissão de Obras Públicas\ne da CPI para “apurar denúncias de falta de segurança e condições de\ntrabalho nas plataformas petrolíferas no Estado do Rio de Janeiro”; foi\npresidente da Comissão Especial para analisar a queda da qualidade dos\nserviços prestados pelas empresas distribuidoras de energia elétrica e\nrelator da CPI para “Apurar responsabilidades pelos prejuízos causados à\nCompanhia Estadual de Água e Esgoto – CEDAE, e outros no contrato e na\nimplementação da Linha Amarela” (via expressa inaugurada em 1997 que\nliga a Zona Norte da cidade à Zona Oeste).\n\nEm 1997 foi autor da Lei n^o^ 2.818, que dispunha sobre a adaptação do\nacesso de deficientes físicos às plataformas e locais de venda de\nbilhetes nas estações metroviárias. Em 1998 elaborou duas leis e três\nresoluções: a Lei n^o^ 2.955, que considerava de utilidade pública a Rio\nCamerata Orquestra e Coral, e a n^o^ 2.922, que declarava também como\nutilidade pública o grupo Renascer da Terceira Idade; e as resoluções\ntinham como teor três concessões de Medalha Tiradentes, ao\ntenente-coronel PM Lúcio Aracati Fournier de Lima, ao doutor Danilo\nAieta e ao engenheiro Álvaro José Martins Santos.\n\nExerceu o mandato até o fim da legislatura, em 1999.\n\n*Ana Beatriz Paes*\n\nFONTES: ASSEMB. LEGISL. RJ. *Deputados estaduais fluminenses*. Quinta\nlegislatura (1991-1995); ASSEMB. LEGISL. RJ. *Deputados estaduais\nfluminenses*. Sexta legislatura (1995-1999); ASSEMB. LEGISL. RJ.\n*Formulários*. Disponível em:\n\\<http://alerjln1.alerj.rj.gov.br/scpro.nsf/Formularios/PEmendaAutor?OpenDocument&Start=1&Count=15&Expand=13\\>;\nASSEMB. LEGISL. RJ. *Resoluções*. Disponível em:\n\\<http://alerjln1.alerj.rj.gov.br/CONTLEI.NSF/ResolucaoAutorInt?OpenForm&Start=286&Count=15&Expand=286\\>;\nASSEMB. LEGISL. RJ. *Leis ordinárias por autor*. Disponível em:\n\\<http://alerjln1.alerj.rj.gov.br/CONTLEI.NSF/LeiOrdAutorInt?OpenForm&Start=273&Count=15&Expand=274\\>;\n*Globo* (19/10/1990).\n","ref":"FONTES: ASSEMB. LEGISL. RJ. *Deputados estaduais fluminenses*. Quinta\nlegislatura (1991-1995); ASSEMB. LEGISL. RJ. *Deputados estaduais\nfluminenses*. Sexta legislatura (1995-1999); ASSEMB. LEGISL. RJ.\n*Formulários*. Disponível em:\n\\<http://alerjln1.alerj.rj.gov.br/scpro.nsf/Formularios/PEmendaAutor?OpenDocument&Start=1&Count=15&Expand=13\\>;\nASSEMB. LEGISL. RJ. *Resoluções*. Disponível em:\n\\<http://alerjln1.alerj.rj.gov.br/CONTLEI.NSF/ResolucaoAutorInt?OpenForm&Start=286&Count=15&Expand=286\\>;\nASSEMB. LEGISL. RJ. *Leis ordinárias por autor*. Disponível em:\n\\<http://alerjln1.alerj.rj.gov.br/CONTLEI.NSF/LeiOrdAutorInt?OpenForm&Start=273&Count=15&Expand=274\\>;\n*Globo* (19/10/1990).\n","dic":"DPRRJ"}
